authors,created,days_abandoned,days_alive,description,id,is_prerelease,last_updated,listed,missing_info,summary,tags,total_downloads,verified,versionBoris Letocha,2016-03-24T07:07:20.94Z,43209,757,"(Just depend on .NET 4.0，not .NET 4.5)
Fast Owin Web server in pure .Net without reliance on HttpListener or Win8, includes WebSockets and SSL support",Nowin40-itglobal,False,1899-12-31T16:00:00-08:00,False,False,"(Just depend on .NET 4.0，not .NET 4.5)
Owin Web server in pure .Net 4.0","webserver,owin,http,websockets",-1,False,0.22.0
"David Tomcik,Jonathan Allen",2016-03-24T09:05:07.443Z,401,757,Commons and data modeling library for the Toruga project.,Tortuga.Anchor,False,2017-03-15T00:47:02.703-07:00,True,False,,.net461,4315,False,0.3.5927.3723
vip32,2016-03-24T14:48:48.99Z,43209,757,A long description of the package. This shows up in the right pane of the Add Package Dialog as well as in the Package Manager Console when listing packages using the Get-Package command.,Xtricate.Dynamic,False,1900-01-01T00:00:00+00:00,False,False,"A short description of the package. If specified, this shows up in the middle pane of the Add Package Dialog. If not specified, a truncated version of the description is used instead.","dynamic,expando,objects,xtricate",18684,False,1.0.40
takenet,2016-03-24T14:10:32.577Z,172,757,Textc extensions for the Messaging Hub SDK,Takenet.MessagingHub.Client.Textc,False,2017-10-30T18:02:55.763+00:00,True,False,,"lime,messaginghub,textc",57160,False,0.2.133
Administrator,2016-03-24T12:05:43.353Z,43209,757,微信接口,WxClient,False,1899-12-31T16:00:00-08:00,False,False,,,-1,False,1.1.0
Gurux Ltd,2016-03-24T14:01:51.217Z,98,757,"Open Source GXSerial media component, made by Gurux Ltd, is a part of GXMedias set of media components, which programming interfaces help you implement communication by chosen connection type. GXSerial offers you an easy way to build multithreaded, serial communication applications. GXSerial is made easy to use. Our media components also support the following connection types: network, terminal.",Gurux.Serial,False,2018-01-12T08:08:24.227+00:00,True,False,,"Gurux,Device,Framework,serial,port,RS-232",5930,False,7.0.3.1
JACKY,2016-03-24T03:23:31.86Z,43209,757,金软科技基础开发框架实体模型运行时文件,GoldSoft.Basic.EntityLayer,False,1899-12-31T16:00:00-08:00,False,False,,,-1,False,4.0.2016.223
"Steffen Forkmann,Mauricio Scheffer,Colin Bull",2016-03-24T10:11:07.287Z,5,757,FAKE - F# Make - is a build automation tool for .NET. Tasks and dependencies are specified in a DSL which is integrated in F#. Experimental Extensions,FAKE.Experimental.x64,False,2018-04-15T16:39:49.73+00:00,True,False,FAKE - F# Make - Get rid of the noise in your build scripts.,"build,fake,f#",58805,False,4.22.7
Intersoft Solutions,2016-03-24T03:17:37.47Z,7,757,"Provides a comprehensive charting data visualization suite featuring 12+ series, smooth animations, intuitive pinch-to-zoom, and beautiful modern design. Supports iOS and Android platforms.",Intersoft.Crosslight.UI.DataVisualization,False,2018-04-13T08:35:53.54+00:00,True,False,,"Intersoft,Crosslight,UI,User,Interface,Data,Visualization,Reporting,Charting,Components,iOS,Android,Xamarin",46407,False,5.0.5000.574
Björn Wikström @ Welcom Web i Göteborg,2016-03-24T10:41:00.377Z,542,757,Falyze.Data Class Library,Falyze.Data,False,2016-10-25T04:29:41.34-07:00,True,False,,,2374,False,2.5.1
AtillaTanrikulu,2016-03-24T14:49:36.15Z,477,757,Utility package,RoboUtil,False,2016-12-29T05:27:15.73+00:00,True,False,,,3752,False,1.0.2
E-iceblue,2016-03-24T08:07:29.943Z,10,757,"Spire.Doc for .NET, specially designed for developers, enables to fast generate, open, write, edit and save Word document from Word Version 97-2003 to 2013. The featured function conversion enables developers to easily realize conversion between Word and other popular document formats such as Word to PDF/EPub/HTML/RTF/Image/XML etc.

Spire.Doc for .NET is a totally independent .NET Word class library which doesn't require Microsoft Office installed on system. Microsoft Office Automation is proved to be unstable, slow and not scalable to produce MS Word documents. Spire.Doc for .NET is many times faster than Microsoft Word Automation and with much better stability and scalability. 

By using Spire.Doc for .NET, users can save Word Doc/Docx to stream, save as web response and convert Word Doc/Docx to XML, RTF, EMF, TXT, XPS, EPUB, HTML and vice versa. Spire.Doc for .NET also supports to convert Word Doc/Docx to PDF and HTML to image. 

A common use of Spire.Doc for .NET is to create Word document dynamically from scratch. Almost all Word document elements are supported. Mainly includes page, sections, headers, footers, footnotes, paragraphs, lists, tables, text, fields, hyperlinks, bookmarks, comments, images, styles, background settings, printing features, document settings and protection. Furthermore, drawing objects including shapes, textboxes, images, OLE objects and controls are supported as well. 

Spire.Doc for .NET enables developers to process pre-existing Word documents. It supports search and replace function, alignment, page break, fill field, document concatenate, document copy, print, complex and deeply nested mail merge, etc.",Spire.Doc,False,2018-04-10T06:30:58.277+00:00,True,False,Spire.Doc for .NET is a professional and powerful .NET Word library to process a large range of Word tasks in C# and Visual Basic for .NET (2.0/3.5/4.0/4.0 ClientProfile/4.5),"words,Word,TEXT,RTF,doc,docx,PDF,XPS,HTML,Image,XTML,word,document,EPUB",89780,False,5.6.62
JACKY,2016-03-24T07:08:32.59Z,43209,757,金软科技基础开发框架数据持久类运行时文件(MySQL),Basic.MySqlAccess,False,1900-01-01T00:00:00+00:00,False,False,,,-1,False,4.0.2016.225
Turner Industries,2016-03-24T15:15:58.41Z,757,757,Turner.Infrastructure.OfficeAutomation.OpenXML is a minimalist library to make generating XLSX and DOCX files much easier.,Turner.Infrastructure.OfficeAutomation.OpenXML,False,2016-03-24T13:53:48.853-07:00,True,False,,,1053,False,2.2016.3.242
JACKY,2016-03-24T07:08:48.977Z,43209,757,金软科技基础开发框架Asp.Net Mvc运行时文件,GoldSoft.Basic.MvcLibrary,False,1899-12-31T16:00:00-08:00,False,False,,,-1,False,4.0.2016.225
Neodynamic,2016-03-24T13:42:00.52Z,291,757,"ThermalLabel Editor Add-on is a first-class barcode label designer component for .NET Windows desktop apps (WinForms & WPF) which empowers your own apps by providing an end-user visual label editor! It features visual aids for the creation of items like texts, barcodes, pictures and shapes; an undo/redo engine, Cut-Copy-Paste functionality, Grid-lines, snap to grid, Z-ordering, zooming, keyboard shortcuts for well-known common actions, In-place text edition for TextItem objects and many more features! It is also very customizable so you can skin it to match the app’s UI style on which it will be hosted in. With the ThermalLabel Editor component, you can allow your end-users to create, load, edit and save ThermalLabel objects in the form of XML template file definition or .NET object within your own .NET apps. You can also export the labels to PDF or raster image formats by leveraging the ThermalLabel SDK ThermalLabel Editor provides First-Class Internationl Barcode Standards compliance. Neodynamic is an expert in the barcode field and all the barcode algorithms were written from ground up based on the official specifications. ThermalLabel Editor leverages the ThermalLabel SDK and provides you and your end-users with barcode generation for most popular Linear (1D), Postal &amp; 2D Symbologies/Standards including Code 39, Code 128, GS1-128 (formerly EAN/UCC-128), GS1 DataBar (RSS-14),  EAN 13 &amp; UPC, Postal (USPS, British Royal Mail, Australia Post, DHL, etc.), Data Matrix (including GS1 version), QR Code, PDF 417, UPS MaxiCode, Micro QR Code, ALL EAN/UPC Composite Barcodes (CC-A, CC-B &amp; CC-C), Chinese Han Xin Code, IFA PPN, Postmatrix and many more!",Neodynamic.Windows.ThermalLabelEditor,False,2017-07-03T13:47:15.323-07:00,True,False,First-class barcode label designer component for .NET Windows desktop apps (WinForms & WPF) which empowers your own apps by providing an end-user visual label editor.,"Barcode,bar-code,.net,C#,VB,bar,code,Zebra,ZPL,EPL,Thermal,printer,printdocument,label,editor,designer,Code39,Code128,EAN13,EAN,UPC,GS1-128,PDF417,Data,Matrix,QR,Code,Aztec,USPS,PostNet,Maxicode,ISBN,HIBC,ISBT-128,128,GS1,DataBar,RSS14,IMpb,Zip+4,Chinese,Han,Xin,IFA,PPN,Postmatrix",7303,False,6.0.3516.324
Paket team,2016-03-24T08:14:17.82Z,357,757,A package dependency manager for .NET with support for NuGet packages and GitHub repositories.,Paket.PowerShell,False,2017-04-28T07:19:40.903+00:00,True,False,A package dependency manager for .NET with support for NuGet packages and GitHub repositories.,"nuget,bundler,F#",138115,False,2.55.4
"Suresh Balasubramanian,Matt Gray,Rami Abughazaleh,Mattias Kindborg,and contributors",2016-03-24T08:35:25.793Z,363,757,"CUITe (Coded UI Test enhanced) Framework is a thin layer developed on top of Microsoft Visual Studio Team Test's Coded UI Test engine which helps reduce code, increases readability and maintainability, while also providing a bunch of cool features for the automation engineer.",CUITe.Silverlight.VS2015,True,2017-04-22T03:06:18.877-07:00,True,False,,"cuit,cuite,coded,ui,test,enhanced,silverlight,visual,studio,2015,vs2015",2041,False,2.0.262-beta
Roman Koff,2016-03-10T11:18:59.86Z,43209,771,Code generator for Ans.Mvc5 projects,Ans.Mvc5.Codegen,False,1899-12-31T16:00:00-08:00,False,False,,,-1,False,1.4.4
Analyze Re,2016-03-24T01:13:50.483Z,74,757,A testing framework for the Analyze Re Client Library,AnalyzeRe.Client.Test,False,2018-02-05T19:39:30.553+00:00,True,False,,"AnalyzeRe,Analyze,Re,Client,Library,Test",26686,False,1.5.5926.39997
苏州联纺信息技术服务有限公司,2016-03-24T01:03:22.04Z,43209,757,通用方法,UTSoft.Utils,False,1899-12-31T16:00:00-08:00,False,False,,UTSoft,-1,False,1.0.0
gongdo,2016-03-24T10:09:03.583Z,312,757,CoolSms SMS API의 닷넷 클라이언트,CoolSms,False,2017-06-12T11:29:06.8+00:00,True,False,,"CoolSms,Bapul",2080,False,1.0.10
Esun Kim,2016-03-24T07:27:24.793Z,755,757,Simple StoredProcedure Binder in a type safe way. This generates class codes to call stored procedures.,SqlProcBinder.CodeGenerator,False,2016-03-26T05:47:26.693-07:00,True,False,,"sql,stored,procedure,binder,type,safe",878,False,0.3.1
JACKY,2016-03-24T07:38:33.683Z,43209,757,金软科技基础开发框架Asp.Net Mvc运行时文件,GoldSoft.Basic.MvcLibrary,False,1899-12-31T16:00:00-08:00,False,False,,,-1,False,4.0.2016.226
Intersoft Solutions,2016-03-24T07:59:53.497Z,7,757,"Provides extended capabilities to share and authenticate users with social network accounts, including Facebook and Twitter.",Intersoft.Crosslight.Services.Social,False,2018-04-13T08:34:02.38+00:00,True,False,,"Intersoft,Crosslight,Services,Social,Network,Facebook,Twitter,PCL,iOS,Android,Xamarin,Portable,Class,Library",47357,False,5.0.5000.575
Intersoft Solutions,2016-03-24T08:00:37.153Z,7,757,"Provides powerful data access components to WebAPI server featuring OData 4 extended implementation, view projection technology, two-way data synchronization and seamless integration with Entity Framework. For the client counterpart, please install Intersoft.AppFramework package.",Intersoft.Data.WebApi.v4,False,2018-04-13T08:36:09.34+00:00,True,False,,"Intersoft,Data,WebAPI,Server,Controller,Components,OData,Synchronization,EF,Entity,Framework",42549,False,5.0.5000.575
JACKY,2016-03-24T07:37:24.87Z,43209,757,金软科技基础开发框架实体验证模型运行时文件,GoldSoft.Basic.Validation,False,1899-12-31T16:00:00-08:00,False,False,,,-1,False,4.0.2016.226
CareerHub,2016-03-24T04:36:13.607Z,401,757,Adds HAL support to ASP.NET WebAPI,Halcyon.WebApi,True,2017-03-14T19:01:18.9-07:00,True,False,,"Hypermedia,ASP.NET,HAL,JSON,WebApi",6522,False,1.1.69-alpha
CareerHub,2016-03-24T03:29:51.107Z,401,757,HAL Models for producing HAL Json,Halcyon,True,2017-03-14T19:00:52.45-07:00,True,False,,"Hypermedia,ASP.NET,HAL,JSON,WebApi",16738,False,1.1.63-alpha
"Jonathan Goldman,Colin Anderson",2016-03-24T14:15:23.38Z,123,757,"MsgPack serializer for Chinchilla, the little library that makes RabbitMQ awesome",Chinchilla.Serializers.MsgPack,True,2017-12-18T17:10:10.36+00:00,True,False,"MsgPack serializer for Chinchilla, the little library that makes RabbitMQ awesome","rabbitmq,management,api,http,chinchilla",6211,False,0.3.11-dev-20160324101443
,,-1,-1,,Inovout.Core-beat,,,,True,,,,,1.0.1
苏州联纺信息技术服务有限公司,2016-03-23T09:25:10.88Z,43209,758,日志相关,UTSoft.Log,False,1899-12-31T16:00:00-08:00,False,False,,Log,-1,False,1.0.0
E-iceblue,2015-12-24T04:03:46.857Z,10,848,"Spire.Doc for .NET, specially designed for developers, enables to fast generate, open, write, edit and save Word document from Word Version 97-2003 to 2013. The featured function conversion enables developers to easily realize conversion between Word and other popular document formats such as Word to PDF/EPub/HTML/RTF/Image/XML etc.

Spire.Doc for .NET is a totally independent .NET Word class library which doesn't require Microsoft Office installed on system. Microsoft Office Automation is proved to be unstable, slow and not scalable to produce MS Word documents. Spire.Doc for .NET is many times faster than Microsoft Word Automation and with much better stability and scalability. 

By using Spire.Doc for .NET, users can save Word Doc/Docx to stream, save as web response and convert Word Doc/Docx to XML, RTF, EMF, TXT, XPS, EPUB, HTML and vice versa. Spire.Doc for .NET also supports to convert Word Doc/Docx to PDF and HTML to image. 

A common use of Spire.Doc for .NET is to create Word document dynamically from scratch. Almost all Word document elements are supported. Mainly includes page, sections, headers, footers, footnotes, paragraphs, lists, tables, text, fields, hyperlinks, bookmarks, comments, images, styles, background settings, printing features, document settings and protection. Furthermore, drawing objects including shapes, textboxes, images, OLE objects and controls are supported as well. 

Spire.Doc for .NET enables developers to process pre-existing Word documents. It supports search and replace function, alignment, page break, fill field, document concatenate, document copy, print, complex and deeply nested mail merge, etc.",Spire.Doc,False,2018-04-10T06:30:58.277+00:00,False,False,Spire.Doc for .NET is a professional and powerful .NET Word library to process a large range of Word tasks in C# and Visual Basic for .NET (2.0/3.5/4.0/4.0 ClientProfile/4.5),"words,Word,TEXT,RTF,doc,docx,PDF,XPS,HTML,Image,XTML,word,document,EPUB",89780,False,5.5.211
Exclr8 Business Automation,2016-03-24T06:45:13.42Z,10,757,The core modules required to build CloudCore-based system.,CloudCore.Core,False,2018-04-10T10:17:12.883+00:00,True,False,,,75371,False,2016.3.24.838
Michiel Lowijs,2016-03-24T09:42:02.343Z,416,757,Ever.y is a fluent API job scheduling engine for .NET.,Ever.y,False,2017-02-28T12:22:31.207-08:00,True,False,,"scheduler,jobs,tasks,timer",7308,False,2016.3.24.3
Streamcoders.com,2016-03-24T09:49:19.953Z,361,757,Is a comprehensive library for handling audio/video codecs and streaming technologies.,Streamcoders.MediaSuite.x64,False,2017-04-24T08:51:08.597+00:00,True,False,,"audio,video,streaming,html5,rtsp,rtp,h.264,vp8",101928,False,4.0.1024
Hibernating Rhinos,2016-03-24T05:10:38.523Z,43209,757,RavenDB 'Authorization' bundle client extend RavenDB and add document level permissions.,RavenDB.Client.Authorization,True,1900-01-01T00:00:00+00:00,False,False,,"nosql,ravendb,raven,document,database,client,bundles,authorization",168504,True,3.5.35073-Unstable
SelectPdf,2016-03-24T10:03:39.263Z,32,757,"Select.Pdf Html To Pdf Converter for .NET - Community Edition is the free version of the powerful html to pdf converter available in Select.Pdf Library for .NET.

The converter offers a lot of powerful options (convert any web page to pdf, convert any html string to pdf, html5/css3/javascript support, headers and footers support, etc) and the only limitation is that it can generate pdf documents up to 5 pages long.",Select.HtmlToPdf,False,2018-03-19T07:15:54.917+00:00,True,False,"Select.Pdf Free Html To Pdf for .NET - Community Edition is a powerful, free library that can convert from html to pdf in .NET.","html,pdf,converter,htmltopdf,html-to-pdf,html-to-pdf-converter,pdfconverter,pdf-converter,pdflibrary,pdf-sdk,pdf-library",203074,False,2.2.0
rzmoz,2016-03-24T07:38:36.117Z,43209,757,Syntactical sugar and commonly used functionality,DotNet.Basics,True,1900-01-01T00:00:00+00:00,False,False,,,20433,False,1.0.22-preview
Gennady Verdel,2016-03-24T10:04:00.617Z,126,757,This package provides implementation for fake abstractions using LightMock framework,Attest.Fake.LightMock,False,2017-12-15T19:21:49.793+00:00,True,False,This package provides implementation for fake abstractions using LightMock framework,,836,False,1.1.0
Paket team,2016-03-24T07:55:27.147Z,2,757,A package dependency manager for .NET with support for NuGet packages and GitHub repositories.,Paket.Core,False,2018-04-18T10:23:20.457+00:00,True,False,A package dependency manager for .NET with support for NuGet packages and GitHub repositories.,"nuget,bundler,F#",298246,False,2.55.3
Roman Kuzmin,2016-03-24T11:11:34.173Z,16,757,"FarNet provides the .NET API for Far Manager and the runtime infrastructure for
.NET modules. The package includes the framework and the module manager plugin.

---

To install FarNet packages, follow these steps:

https://raw.githubusercontent.com/nightroman/FarNet/master/Install-FarNet.en.txt

---",FarNet,False,2018-04-04T05:31:21.63+00:00,True,False,"FarNet provides the .NET API for Far Manager and the runtime infrastructure for
.NET modules. The package includes the framework and the module manager plugin.

---

To install FarNet packages, follow these steps:

https://raw.githubusercontent.com/nightroman/FarNet/master/Install-FarNet.en.txt

---","FarManager,FarNet,PowerShell,Module,Plugin",12455,False,5.0.64
zqb,2014-07-02T06:11:41.023Z,43209,1388,THOK.AF.Menus,THOK.AF.Menus,False,1899-12-31T16:00:00-08:00,False,False,,,-1,False,1.0.0
Hibernating Rhinos,2016-03-24T05:14:22.993Z,43209,757,"This package includes a utility class that helps test features of RavenDB. RavenDB is a document database for the .NET platform, offering a flexible data model design to fit the needs of real world systems.",RavenDB.Tests.Helpers,True,1900-01-01T00:00:00+00:00,False,False,This package includes a utility class that helps test features of RavenDB.,"nosql,ravendb,raven,document,database,test",244252,True,3.5.35073-Unstable
Kam Figy,2016-03-24T03:52:52.083Z,302,757,Implements the Sitecore database as a Rainbow data store,Rainbow.Storage.Sc,False,2017-06-22T12:56:06.153-07:00,True,False,,sitecore,168305,False,1.3.0
Charles Solar,2016-03-24T03:09:23.407Z,43209,757,"A framework to help developers integrate the excelent NServicebus and GetEventStore libraries together and provide basic DDD classes.
      This package contains objects for subscribing to events from the event store",Aggregates.NET.Consumer,False,1900-01-01T00:00:00+00:00,False,False,,"CQRS,NServicebus,GetEventStore,eventstore,event,store,aggregate,ddd,repository,unit,of,work,uow",-1,False,0.2.1.201
Ristona,2016-03-24T12:57:25.05Z,689,757,support NHibernate,Inovout.Data-KuaJing,False,2016-05-31T00:32:50.88-07:00,True,False,support NHibernate,"AutoFac,NHibernate",793,False,1.0.9
JACKY,2016-03-24T08:10:40.197Z,43209,757,金软科技基础开发框架数据持久类运行时文件,GoldSoft.Basic.Configuration,False,1899-12-31T16:00:00-08:00,False,False,,,-1,False,4.0.2016.227
Intersoft Solutions,2016-03-24T03:17:06.533Z,7,757,"Provides extended capabilities to share and authenticate users with social network accounts, including Facebook and Twitter.",Intersoft.Crosslight.Services.Social,False,2018-04-13T08:34:02.38+00:00,True,False,,"Intersoft,Crosslight,Services,Social,Network,Facebook,Twitter,PCL,iOS,Android,Xamarin,Portable,Class,Library",47357,False,5.0.5000.574
Ristona,2016-03-24T13:06:00.693Z,689,757,support OWIN,Inovout.Web.Mvc-KuaJing,False,2016-05-30T23:58:03.633-07:00,True,False,support OWIN,"Asp.Net.Mvc,OWIN",338,False,1.0.9
Michiel Lowijs,2016-03-24T10:11:56.71Z,416,757,Ever.y is a fluent API job scheduling engine for .NET.,Ever.y,False,2017-02-28T12:22:31.207-08:00,True,False,,"scheduler,jobs,tasks,timer",7308,False,2016.3.24.4
José Manuel Nieto (SuperJMN),2016-03-24T15:00:46.373Z,43209,757,Glass.LeadTools.ImagingExtensions,Glass.LeadTools.ImagingExtensions,False,1900-01-01T00:00:00+00:00,False,False,,,-1,False,1.6.0.50
Paket team,2016-03-24T14:46:18.007Z,2,757,A package dependency manager for .NET with support for NuGet packages and GitHub repositories.,Paket,True,2018-04-18T10:23:50.3+00:00,True,False,A package dependency manager for .NET with support for NuGet packages and GitHub repositories.,"nuget,bundler,F#",834968,False,3.0.0-alpha083
Jeremy Marcus,2016-03-24T14:29:33.703Z,206,757,Easily add icon fonts to your Xamarin applications!,Xam.Plugin.Iconize.WeatherIcons,True,2017-09-26T12:39:15.157+00:00,True,False,Iconize Plugin for Xamarin - Weather Icons,"xamarin,pcl,plugin,xamarin.forms,android,ios,windows",5643,False,1.0.5-alpha
Jeremy Marcus,2016-03-24T14:29:21.37Z,206,757,Easily add icon fonts to your Xamarin applications!,Xam.Plugin.Iconize.SimpleLineIcons,True,2017-09-26T12:38:49.14+00:00,True,False,Iconize Plugin for Xamarin - Simple Line Icons,"xamarin,pcl,plugin,xamarin.forms,android,ios,windows",5993,False,1.0.5-alpha
Veeplay,2016-03-24T13:32:38.843Z,757,757,"The Veeplay Media Player allows you to:

Create playlists of synchronized videos and overlays

Configure a playlist from an external JSON file, an equivalent Dictionary structure or directly via code attributes

Create custom, native overlays

Automatically configure ad linear inserts (pre, mid and post rolls) as well as nonlinear inserts (banner overlays), VAST 1.0, 2.0, 3.0 and VMAP 1.0 compliant

Create custom player skins, brand player with logo, insert overlay bugs, customize player controls

Track video and overlay lifecycle events in real-time, as rendered",Veeplay-SDK,False,2016-03-24T06:32:38.843-07:00,True,False,"Veeplay Media Player allows you to:
Play videos with linear ad inserts (pre, mid and post rolls) as well as nonlinear inserts (banner overlays), VAST 1.0, 2.0, 3.0 and VMAP 1.0 compliant",,9248,False,1.6.8
Brendon Greyling,2016-03-24T05:48:51.867Z,757,757,Some more utilities.,BGreyling.Utilities.Patterns,False,2016-03-23T22:48:51.867-07:00,True,False,,,199,False,1.0.0
"Steffen Forkmann,Mauricio Scheffer,Colin Bull",2016-03-24T10:12:54.927Z,5,757,FAKE - F# Make - is a build automation tool for .NET. Tasks and dependencies are specified in a DSL which is integrated in F#. This package bundles all extensions.,FAKE.x64,False,2018-04-15T16:43:32.79+00:00,True,False,FAKE - F# Make - Get rid of the noise in your build scripts.,"build,fake,f#",61987,False,4.22.7
Hibernating Rhinos,2016-03-24T05:10:59.4Z,43209,757,RavenDB Client MvcIntegration let you include a visual profiler in your ASP.NET MVC application which will show you all the opened sessions and the time took to complete each database request. This can help you when developing with RavenDB.,RavenDB.Client.MvcIntegration,True,1900-01-01T00:00:00+00:00,False,False,A visual profiler for RavenDB that you can use in your ASP.NET MVC application.,"nosql,ravendb,raven,document,database,client,mvc",243184,True,3.5.35073-Unstable
Elektro,2016-01-02T17:16:35.5Z,43209,839,"ElektroKit is a utility framework containing new APIs and extensions to the core .Net Framework to help complete your developer toolbox.

This nuget package only contains the Elektro.DateAndTime assembly.",Elektro.DateAndTime,False,1899-12-31T16:00:00-08:00,False,False,ElektroKit is a utility framework containing new APIs and extensions to the core .Net Framework to help complete your developer toolbox.,"Elektro,.net,c#,vbnet,vb,vb.net,visualstudio,framework,tool,toolkit,winforms,wpf,snippet,coding,util",-1,False,1.1.0
