authors,created,days_abandoned,days_alive,description,id,is_prerelease,last_updated,listed,missing_info,summary,tags,total_downloads,verified,versionJames Craig,2013-08-10T03:06:46.823Z,782,1714,This is the MVC Core package. However no functionality is included in this package.,Batman.MVC,False,2016-02-28T10:35:31.15-08:00,True,False,This is the MVC Core package. However no functionality is included in this package.,"batman,framework,mvc",24207,False,1.0.19
svespie,2013-08-09T15:17:40.55Z,346,1715,This library provides a variety of formulae to estimate a one rep maximum.,OneRepMax,False,2017-05-09T05:31:06.98-07:00,True,False,,,2367,False,1.0.0
eXpand,2013-08-09T14:42:00.4Z,877,1715,MemberLevelSecurity Module (Win) / eXpand Framework,eXpandMemberLevelSecurityWin,False,2015-11-25T10:21:12.1-08:00,True,False,MemberLevelSecurity Module (Win) / eXpand Framework,"DevExpress,eXpand",57688,False,13.1.5.25
Alexandre Mutel,2013-08-10T12:58:36.35Z,43209,1714,Graphics assembly for SharpDX.Toolkit assemblies.,SharpDX.Toolkit.Graphics,False,1899-12-31T16:00:00-08:00,False,False,,"SharpDX,DirectX,Direct3D,Multimedia,MDX,3D",-1,False,2.5.0
Jonathan Oliver,2013-08-09T11:46:25.25Z,689,1715,Additional wireup provider for NanoMessageBus using Autofac.,NanoMessageBus.Autofac,False,2016-05-31T09:43:45.44-07:00,True,False,Autofac wireup NanoMessageBus.,"messaging,service,bus,servicebus,nano,message,nanomessagebus,nmb,messages,ioc,inversion,of,control,dependecy,injection,Autofac",11993,False,2.0.40
James Craig,2013-08-10T02:58:16.827Z,782,1714,This adds SimpleInjector as the bootstrapper used by Batman.,Batman.Core.Bootstrapper.SimpleInjector,False,2016-02-28T10:34:41.38-08:00,True,False,This adds SimpleInjector as the bootstrapper used by Batman.,"batman,framework,simpleinjector",19610,False,1.0.18
Frozen Mountain Software,2013-08-10T19:48:33.08Z,84,1714,A client-side library for JavaScript that extends WebSync to provide location/user-based chat services.,FM.WebSync.Chat.JS,False,2018-01-26T02:27:25.57+00:00,True,False,,"WebSync,Client,Chat,Extension,HTTP,Streaming,Comet,Reverse,Ajax,JavaScript",16926,False,4.3.4
Auth0,2013-08-10T17:54:21.373Z,415,1714,"* Add authentication with [multiple authentication sources](https://docs.auth0.com/identityproviders), either social like **Google, Facebook, Microsoft Account, LinkedIn, GitHub, Twitter**, or enterprise identity systems like **Windows Azure AD, Google Apps, AD, ADFS or any SAML Identity Provider**. 
* Add authentication through more traditional **[username/password databases](https://docs.auth0.com/mysql-connection-tutorial)**.
* Add support for **[linking different user accounts](https://docs.auth0.com/link-accounts)** with the same user.
* Support for generating signed [Json Web Tokens](https://docs.auth0.com/jwt) to call your APIs and **flow the user identity** securely.
* Support for integrating with **Windows Azure Mobile Services backends**.
* Analytics of how, when and where users are logging in.
* Pull data from other sources and add it to the user profile, through [JavaScript rules](https://docs.auth0.com/rules).",Auth0.WinformsOrWPF,False,2017-02-28T20:08:06.507-08:00,True,False,,"auth0,wpf,winforms,social,login,google,facebook,twitter,linkedin,github,""windows,azure"",waad,adfs",12839,False,0.5.0
GeertvanHorrik,2013-08-10T15:01:51.09Z,507,1714,Catel.Mvc library which includes the MVC related features.,Catel.Mvc,True,2016-11-29T13:35:47.207+00:00,True,False,,"mvc,catel",90953,True,3.6.1308101652-beta
Media Browser Team,2013-08-09T15:38:01.34Z,43209,1715,Contains javascript api wrapper for working with the Media Browser Api.,MediaBrowser.ApiClient.Javascript,False,1899-12-31T16:00:00-08:00,False,False,,,41248,False,3.0.160
Paul Betts,2013-08-10T16:59:56.17Z,164,1714,A library to aid in writing unit tests for ReactiveUI projects,reactiveui-testing,False,2017-11-07T23:53:03.6+00:00,True,False,,,64289,False,5.1.1
Dirk Lemstra,2013-08-10T19:01:42.013Z,3,1714,ImageMagick is a powerful image manipulation library that supports over 100 major file formats (not including sub-formats). With Magick.NET you can use ImageMagick without having to install ImageMagick on your server or desktop.,Magick.NET-Q8-x86,False,2018-04-17T22:37:23.267+00:00,True,False,A .NET API to the ImageMagick image-processing library for Desktop and Web.,"ImageMagick,Magick.NET",26237,False,6.8.6.801
Paul Betts,2013-08-10T16:52:00.337Z,1075,1714,ReactiveUI library for Xamarin.Mobile and other mobile-related helpers,reactiveui-mobile,False,2015-05-10T20:13:01.59-07:00,True,False,,,20738,False,5.1.1
Johan Leino,2013-08-09T10:01:02.46Z,1715,1715,Web Deploy PowerShell (wdp) is a set of PowerShell modules for performing web deploy PowerShell commands. This is the backup module. Get more details at the project site.,WDP.Backup,False,2013-08-09T03:01:02.46-07:00,True,False,,"WebDeploy,MSDeploy,IIS,Automation,PowerShell",1029,False,2.0.4
CapableObjects,2013-08-09T16:28:38.8Z,1531,1715,Descr,EcoWeb,False,2014-02-09T03:25:38-08:00,True,False,,"ModelDrivenDevelopment,ECO,CapableObjects",26731,False,7.0.0.6637
Frozen Mountain Software,2013-08-10T19:48:17.183Z,48,1714,A client-side library for .NET that provides an aspect-oriented framework for developing RESTful APIs. (Community Edition),FM.TheRest,False,2018-03-03T21:26:00.877+00:00,True,False,,"TheRest,Client,REST,RESTful,.NET",14955,False,2.3.4
XemioNetwork,2013-08-10T16:38:08.903Z,1443,1714,Basic 2D game library for indie games.,Xemio-GameLibrary,False,2014-05-08T12:05:31.26-07:00,True,False,,"xemio,game,library,indie,2d,xna,gdi,render,rendering,sound,input",66019,False,0.5.18
Simon Cropp,2013-08-09T13:06:05.583Z,358,1715,Stamps an assembly with git information.,Stamp.Fody,False,2017-04-26T21:20:40.57-07:00,True,False,,"Git,Versioning,ILWeaving,Fody,Stamp,Cecil",22679,False,0.7.0
"Robert Moore,Matthew Davies",2013-08-10T16:14:19.843Z,1714,1714,This library extends the Windows Azure Storage library by Microsoft with a set of services and repositories as well as a factory that makes it easy to dependency inject any Azure Storage calls into your code. It removes a lot of the repetitive code that you would otherwise need to write again and again.,WindowsAzure.Storage.Services,True,2013-08-10T09:14:19.843-07:00,True,False,,"Azure,Storage,Table,Blob,Queue",321,False,0.1.6-alpha
Frozen Mountain Software,2013-08-10T19:48:18.997Z,84,1714,A client-side library for JavaScript that provides an aspect-oriented framework for developing RESTful APIs.,FM.TheRest.JS,False,2018-01-26T02:27:09.117+00:00,True,False,,"TheRest,Client,REST,RESTful,JavaScript",15448,False,2.3.4
Microsoft,2013-08-09T19:53:13.717Z,870,1715,This package includes samples illustrating the use of the Microsoft.Diagnostics.Tracing.EventSource library.  Works best if you create a console app called 'DemoEventSource' and reference this package.,Microsoft.Diagnostics.Tracing.EventSource.Samples,True,2015-12-02T10:54:44.953-08:00,True,False,Samples for the EventSource library.,"Samples,EventSource,Microsoft,ETW,EventLog,Channel",13326,True,1.0.3-beta
STracker Developers,2013-08-10T19:25:06.043Z,1690,1714,MongoDB repositories of STrackerServer.,STrackerServer.Repository.MongoDB,False,2013-09-03T15:37:34.557-07:00,True,False,,,6601,False,2.2.3
Paul Betts,2013-08-09T12:13:48.86Z,164,1715,Windows Forms specific extensions to ReactiveUI,reactiveui-winforms,False,2017-11-07T23:53:24.75+00:00,True,False,,,14323,False,5.1.0
GeertvanHorrik,2013-08-10T15:01:25.097Z,4,1714,"Catel.Core library which provides the core building blocks required when developing professional applications. This
	  package contains an IoC container, logging, argument checking, message mediators and much more!",Catel.Core,True,2018-04-16T10:11:44.76+00:00,True,False,,"mvvm,model,modelbase,logging,data,object,wpf,silverlight,sl,windows,phone,wp,wp7,wp8,winrt,c#,ioc,servicelocator,typefactory,messaging,messenger,message,mediator",244767,True,3.6.1308101652-beta
tangxuehua,2013-08-10T10:05:59.813Z,43209,1714,mongodb integration with enode framework,enode.mongo,False,1899-12-31T16:00:00-08:00,False,False,,"DDD,EDA,EventSourcing,CQRS,in-memory",-1,False,1.0.1
Alexandre Mutel,2013-08-10T12:38:06.023Z,69,1714,Assembly providing DirectX - Direct3D9 managed API.,SharpDX.Direct3D9,False,2018-02-10T09:03:57.187+00:00,True,False,,"SharpDX,DirectX,Direct3D,MDX,3D,Direct3D9,D3D9",93933,True,2.5.0
James Craig,2013-08-10T02:58:19.467Z,782,1714,This adds TinyIoC as the bootstrapper used by Batman.,Batman.Core.Bootstrapper.TinyIoC,False,2016-02-28T10:34:48.853-08:00,True,False,This adds TinyIoC as the bootstrapper used by Batman.,"batman,framework,tinyioc",24563,False,1.0.18
XemioNetwork,2013-08-10T16:29:25.74Z,1443,1714,Basic 2D game library for indie games.,Xemio-GameLibrary,False,2014-05-08T12:05:31.26-07:00,True,False,,"xemio,game,library,indie,2d,xna,gdi,render,rendering,sound,input",66019,False,0.5.16
GitHub,2013-08-09T13:19:56.607Z,229,1715,"A backend for Akavache based on SQLite3, particularly recommended on mobile platforms.",akavache.sqlite3,False,2017-09-03T10:39:58.1+00:00,True,False,"A backend for Akavache based on SQLite3, particularly recommended on mobile platforms.",,237413,False,3.0.2
GeertvanHorrik,2013-08-09T13:47:43.713Z,507,1715,Catel.Extensions.Prism library which contains helper classes for prism.,Catel.Extensions.Prism,True,2016-11-29T13:36:21.16+00:00,True,False,,"prism,catel,mvvm",129719,True,3.6.1308091537-beta
James Craig,2013-08-10T03:40:15.013Z,782,1714,This is the MVC Core package. However no functionality is included in this package.,Batman.MVC,False,2016-02-28T10:35:31.15-08:00,True,False,This is the MVC Core package. However no functionality is included in this package.,"batman,framework,mvc",24207,False,1.0.22
Matthias Gernand,2013-08-09T16:50:29.31Z,1358,1715,A portable api for filesystem io using a unified interface.,Portable.IO.Desktop,False,2014-08-01T01:28:39.453-07:00,True,False,,"io,portable,net45,file,directory",1230,False,1.0.1
eXpand,2013-08-09T14:42:13.893Z,1715,1715,ModelArtifact Module (Win) / eXpand Framework,eXpandModelArtifactWin,False,2013-08-09T07:42:13.893-07:00,True,False,ModelArtifact Module (Win) / eXpand Framework,"DevExpress,eXpand",31822,False,13.1.5.25
ReflectSoftware,2013-08-09T15:32:13.28Z,303,1715,"We've added support for the Enterprise Library Logging adapter. This allows you to leverage your current investment in EntLib, but leverage the power and flexibility of the ReflectInsight Viewer. A special benefit in this extension as it will parse and display XML message in proper syntax.

In order to use this extension you must have the ReflectInsight Viewer installed. Download and install the ReflectInsight Viewer from this location: 

http://www.ReflectSoftware.com/Public/Download.aspx

You can view your EntLib messages in realtime, in a rich viewer that allows you to filter out and search for what really matters to you.",ReflectSoftware.Insight.Extensions.EnterpriseLibrary,False,2017-06-20T21:06:29.56-07:00,True,False,ReflectInsight EnterpriseLibrary logging extention makes it easy to integrate ReflectInsight into your existing application logging infrastructure and leverage the power of the ReflectInsight log view,"EnterpriseLibrary,Logging,Extensions,ReflectInsight,Appender,EntLib,Log,Tracing,RabbitMQ",8468,False,5.1.4.5
Kristijan Horvat,2013-08-09T10:20:42.103Z,1515,1715,"MonoX is a Free ASP.NET CMS and Social Networking Platform

MonoX provides tools for quick and intuitive construction of dynamic and fully editable ASP.NET portals, social networks and similar Web applications. For more details, please download the user manual.",MonoX.CMS.Install,True,2014-02-25T09:19:15.467-08:00,True,False,MonoX CMS Install package will download only mandatory modules needed by MonoX to operate properly.,"MonoX,CMS,Social,Networking",7327,False,4.8.40.4696-prerelease
Frozen Mountain Software,2013-08-10T19:48:44.817Z,48,1714,A server-side library for .NET that provides real-time HTTP push (comet/reverse Ajax). (Community Edition),FM.WebSync.Server,False,2018-03-03T21:28:20.16+00:00,True,False,,"WebSync,Server,HTTP,Push,Comet,Reverse,Ajax,.NET",17419,False,4.3.4
Paul Betts,2013-08-09T12:12:04.433Z,234,1715,An MVVM library for .NET that is deeply integrated with the Reactive Extensions,reactiveui-core,False,2017-08-29T12:42:39.93+00:00,True,False,,,338518,False,5.1.0
Mauricio Scheffer,2013-08-10T21:26:37.07Z,814,1714,Functional test library,Fuchu,False,2016-01-26T16:59:28.513-08:00,True,False,,"test,testing",33817,False,0.3.0.1
Gianni,2013-08-09T10:44:52.957Z,1715,1715,Some useful utilities for common scenario.,common4gp,False,2013-08-09T04:07:24.033-07:00,True,False,Common utilities for .NET,,3261,False,1.0.5
Kristijan Horvat,2013-08-09T16:11:40.087Z,1515,1715,"MonoX is a Free ASP.NET CMS and Social Networking Platform

MonoX provides tools for quick and intuitive construction of dynamic and fully editable ASP.NET portals, social networks and similar Web applications. For more details, please download the user manual.",MonoX.CMS.Bootstrap,True,2014-02-25T09:18:51.997-08:00,True,False,MonoX Bootstrap is a toolkit for MonoX CMS designed to kickstart MonoX based custom web applications.,"MonoX,CMS,Social,Networking",6979,False,4.8.40.4703-prerelease
Leon Meijer,2013-08-09T15:01:01.58Z,43209,1715,Part of the Co-Console SDK. Use this package to connect to the Co-Console API.,Lucy.CoConsole.ApiClient.Actions.Portable,False,1899-12-31T16:00:00-08:00,False,False,,,-1,False,1.8.5.65
Paul Betts,2013-08-10T17:42:00.037Z,142,1714,An MVVM library for WPF and Silverlight that is deeply integrated with the Reactive Extensions,reactiveui,False,2017-11-29T13:25:31.297+00:00,True,False,,,275538,True,5.1.2
Kristijan Horvat,2013-08-09T10:22:03.007Z,1515,1715,"MonoX is a Free ASP.NET CMS and Social Networking Platform

MonoX provides tools for quick and intuitive construction of dynamic and fully editable ASP.NET portals, social networks and similar Web applications. For more details, please download the user manual.",MonoX.CMS.Theme.Mobile,True,2014-02-25T09:21:01.857-08:00,True,False,MonoX CMS Mobile Theme package contains the mobile MonoX theme.,"MonoX,CMS,Theme,Social,Networking",7216,False,4.8.40.4696-prerelease
ReflectSoftware,2013-08-09T14:54:30.307Z,81,1715,"We've added support for the Log4net appender. This allows you to leverage your current investment in log4net, but leverage the power and flexibility that comes with the ReflectInsight viewer.

In order to use this extension you must have the ReflectInsight Viewer installed. Download and install the ReflectInsight Viewer from this location: 

http://www.ReflectSoftware.com/Public/Download.aspx

You can view your log4net messages in realtime, in a rich viewer that allows you to filter out and search for what really matters to you.",ReflectSoftware.Insight.Extensions.Log4net,False,2018-01-29T01:30:55.583+00:00,True,False,ReflectInsight Log4net logging extention makes it easy to integrate ReflectInsight into your existing application logging infrastructure and leverage the power of the ReflectInsight log viewer.,"Log4net,Logging,Extensions,ReflectInsight,Appender,Log,Tracing,RabbitMQ",11397,False,5.1.8
Kristijan Horvat,2013-08-09T16:11:19.007Z,1515,1715,"MonoX is a Free ASP.NET CMS and Social Networking Platform

MonoX provides tools for quick and intuitive construction of dynamic and fully editable ASP.NET portals, social networks and similar Web applications. For more details, please download the user manual.",MonoX.CMS.Theme.Default,True,2014-02-25T09:20:26.797-08:00,True,False,MonoX CMS Default Theme package contains the default MonoX theme.,"MonoX,CMS,Theme,Social,Networking",7565,False,4.8.40.4703-prerelease
Antoine Aubry,2013-08-09T17:17:20.847Z,43209,1715,A .NET library for YAML. yamldotnet provides low level parsing and emitting of YAML as well as a high level object model similar to XmlDocument.,YamlDotNet.RepresentationModel,False,1899-12-31T16:00:00-08:00,False,False,This package contains the YAML document object model and serialization classes.,"yaml,serialization,development,library",-1,False,2.1.1
Alexandre Mutel,2013-08-10T12:51:46.753Z,69,1714,Core assembly for all SharpDX assemblies.,SharpDX,False,2018-02-10T09:02:13.433+00:00,True,False,,"SharpDX,DirectX,Direct3D,Multimedia,MDX,3D",458330,True,2.5.0
Brandon Stirnaman,2013-08-10T17:47:27.427Z,1426,1714,ScriptCs script pack for Fluent Automation,ScriptCs.FluentAutomation,False,2014-05-25T08:07:45.573-07:00,True,False,,"ScriptCs,F14N,PhantomJS,Phantom,WatiN,Selenium,Fluent,Automation,API",4039,False,1.0.3
Dao Hai Nam,2013-08-10T02:40:22.937Z,497,1714,ajax-data-table is a Javascript library allowing to create html table from JSON data,ajax-data-table,False,2016-12-09T04:45:14.58+00:00,True,False,,"ajax,data,table",7023,False,1.0.1
James Craig,2013-08-10T03:17:26.8Z,782,1714,This adds MiniProfiler to Batman.,Batman.Core.Profiling.MiniProfiler,False,2016-02-28T10:35:23.907-08:00,True,False,This adds MiniProfiler to Batman.,"batman,framework,miniprofiler",17980,False,1.0.21
Paul Betts,2013-08-10T17:33:27.033Z,234,1714,An MVVM library for .NET that is deeply integrated with the Reactive Extensions,reactiveui-core,False,2017-08-29T12:42:39.93+00:00,True,False,,,338518,False,5.1.1
David Ebbo,2013-08-09T17:22:54.28Z,25,1715,Runtime helpers used by code generated by T4MVC,T4MVCExtensions,False,2018-03-26T19:06:53.07+00:00,True,False,Runtime helpers used by code generated by T4MVC,"t4,mvc,t4mvc",660072,False,3.7.3
Paul Betts,2013-08-09T12:13:25.667Z,1075,1715,Platform specific extensions to ReactiveUI,reactiveui-platforms,False,2015-05-10T20:13:47.577-07:00,True,False,,,71654,False,5.1.0
Frozen Mountain Software,2013-08-10T19:48:06.943Z,84,1714,A library for JavaScript that extends IceLink to create WebRTC-compatible peer-to-peer audio/video data streams using IceLink.,FM.IceLink.WebRTC.JS,False,2018-01-26T02:26:25.553+00:00,True,False,,"IceLink,WebRTC,Extension,ICE,STUN,TURN,P2P,UDP,NAT,Firewall,Traversal,JavaScript",14680,False,2.3.4
XemioNetwork,2013-08-09T10:50:32.973Z,1443,1715,Basic 2D game library for indie games.,Xemio-GameLibrary,False,2014-05-08T12:05:31.26-07:00,True,False,,"xemio,game,library,indie,2d,xna,gdi,render,rendering,sound,input",66019,False,0.5.13
Microsoft,2013-08-10T18:21:02.833Z,1664,1714,"The Cloud Application Framework & Extensions (CloudFx) is a Swiss Army knife for Windows Azure developers which offers a set of production quality components and building blocks intended to jump-start the implementation of feature-rich, reliable and extensible Windows Azure-based solutions and services.",Microsoft.Experience.CloudFx,False,2013-09-28T19:18:33.167-07:00,True,False,"CloudFx is a Swiss Army knife for Windows Azure developers which offers a set of production quality components and building blocks intended to jump-start the implementation of feature-rich, reliable and extensible Windows Azure-based solutions","WindowsAzure,Azure,ServiceBus,Messaging,PubSub,Publish,Subscribe,Topic,Relay,Storage,Table,Blob,Queue,Rx,Reactive,Observable,Configuration,Diagnostics,Extensibility,Best,Practices,Web,Worker,Role",68175,False,2.0.0.1
Jonathan Oliver,2013-08-09T12:10:47.117Z,689,1715,Additional messaging provider for NanoMessageBus using RabbitMQ messaging infrastructure.,NanoMessageBus.RabbitMQ,False,2016-05-31T09:44:28.727-07:00,True,False,RabbitMQ messaging adapter for NanoMessageBus.,"messaging,service,bus,servicebus,nano,message,nanomessagebus,nmb,messages,amqp,rabbit,rabbitmq",12113,False,2.0.41
Alexandre Mutel,2013-08-10T12:56:29.377Z,69,1714,"Assembly providing DirectX - DXGI 1.0, 1.1 and 1.2 managed API.",SharpDX.DXGI,False,2018-02-10T09:04:53.64+00:00,True,False,,"SharpDX,DirectX,Direct3D,MDX,3D,DXGI",289051,True,2.5.0
GeertvanHorrik,2013-08-09T13:47:10.697Z,4,1715,"Catel.Core library which provides the core building blocks required when developing professional applications. This
	  package contains an IoC container, logging, argument checking, message mediators and much more!",Catel.Core,True,2018-04-16T10:11:44.76+00:00,True,False,,"mvvm,model,modelbase,logging,data,object,wpf,silverlight,sl,windows,phone,wp,wp7,wp8,winrt,c#,ioc,servicelocator,typefactory,messaging,messenger,message,mediator",244767,True,3.6.1308091537-beta
twistedstream,2013-08-09T15:47:26.52Z,1715,1715,Core library for FormsToTokenAccessAuthentication.,TS.FormsToTokenAccessAuthentication.Core,False,2013-08-09T08:47:26.52-07:00,True,False,,"asp.net,web-api,web,api,token,access,authentication,forms",1300,False,1.1.2
Kristijan Horvat,2013-08-09T12:24:58.97Z,1515,1715,"MonoX is a Free ASP.NET CMS and Social Networking Platform

MonoX provides tools for quick and intuitive construction of dynamic and fully editable ASP.NET portals, social networks and similar Web applications. For more details, please download the user manual.",MonoX.CMS.Install,True,2014-02-25T09:19:15.467-08:00,True,False,MonoX CMS Install package will download only mandatory modules needed by MonoX to operate properly.,"MonoX,CMS,Social,Networking",7327,False,4.8.40.4697-prerelease
Microsoft,2013-08-09T21:51:50.113Z,870,1715,"This package includes Microsoft.Diagnostics.Tracing.EventSource for firing ETW events from managed code. It enables defining a strongly typed specification of an ETW provider that can be called by managed code. The EventSource class is also included in the .NET Framework. This package provides a newer version that has more features. It is meant to be used as a stop gap until those features it contains are ported to (System.Diagnostics.Tracing.EventSource).

For more details, have a look at http://msdn.microsoft.com/en-us/library/system.diagnostics.tracing.eventsource.aspx.

New features:
- ETW channel support
- Support for static registration
      
Supported Platforms:
- .NET Framework 4",Microsoft.Diagnostics.Tracing.EventSource,True,2015-12-02T10:54:31.34-08:00,True,False,EventSource is a managed library for generating ETW events.,"EventSource,Microsoft,ETW,EventLog,Channel",510041,True,1.0.4-beta
James Craig,2013-08-10T03:16:55.18Z,782,1714,This adds the ability to email messages using SMTP in Batman.,Batman.Core.Communication.SMTP,False,2016-02-28T10:35:02.96-08:00,True,False,This adds the ability to email messages using SMTP in Batman.,"batman,framework,smtp",18546,False,1.0.21
Microsoft,2013-08-09T21:52:15.44Z,870,1715,This package includes samples illustrating the use of the Microsoft.Diagnostics.Tracing.EventSource library.  Works best if you create a console app called 'DemoEventSource' and reference this package.,Microsoft.Diagnostics.Tracing.EventSource.Samples,True,2015-12-02T10:54:44.953-08:00,True,False,Samples for the EventSource library.,"Samples,EventSource,Microsoft,ETW,EventLog,Channel",13326,True,1.0.4-beta
Nick Floyd,2013-08-09T15:13:21.197Z,1,1715,"The New Relic .NET Agent API supports custom error and metric reporting, and custom transaction parameters. If the agent is not installed or is disabled, method invocations of this API will have no effect. You can find more information about the NewRelic.Agent.Api at http://newrelic.com/docs/dotnet/AgentApi.",NewRelic.Agent.Api,False,2018-04-19T23:26:02.87+00:00,True,False,"The New Relic .NET Agent API supports custom error and metric reporting, and custom transaction parameters. This is the ANY CPU build of the API.","New,Relic",853793,False,2.9.122
Kristijan Horvat,2013-08-09T14:24:19.167Z,1515,1715,"MonoX is a Free ASP.NET CMS and Social Networking Platform

MonoX provides tools for quick and intuitive construction of dynamic and fully editable ASP.NET portals, social networks and similar Web applications. For more details, please download the user manual.",MonoX.CMS.Runtime,True,2014-02-25T09:19:56.78-08:00,True,False,MonoX CMS Runtime package is designed to easily download MonoX CMS Runtime prerequsites to run MonoX based web applications.,"MonoX,CMS,Runtime,Social,Networking",7598,False,4.8.40.4702-prerelease
"Sam Harwell,Terence Parr",2013-08-10T05:20:58.713Z,12,1714,The C# port of StringTemplate 4.,StringTemplate4,True,2018-04-08T13:39:07.7+00:00,True,False,The C# port of StringTemplate 4.,"stringtemplate,st4,stringtemplate4,template",29390,True,4.0.7.2-alpha002
John Batte,2013-08-09T21:16:24.253Z,1535,1715,The Autofac Implementation of Patterns.Testing,Patterns.Testing.Autofac,False,2014-02-04T21:08:57.867-08:00,True,False,,,4426,False,3.9.1
James Craig,2013-08-10T19:37:32.603Z,782,1714,"This adds the ServiceStack set of serializers (JSON, CSV, and XML) to Batman.",Batman.MVC.Serialization.ServiceStack,False,2016-02-28T10:36:06.977-08:00,True,False,"This adds the ServiceStack set of serializers (JSON, CSV, and XML) to Batman.","batman,framework,mvc,servicestack",18692,False,1.0.24
James Craig,2013-08-10T19:37:20.177Z,782,1714,This adds MiniProfiler to Batman.,Batman.Core.Profiling.MiniProfiler,False,2016-02-28T10:35:23.907-08:00,True,False,This adds MiniProfiler to Batman.,"batman,framework,miniprofiler",17980,False,1.0.24
Jonathan Oliver,2013-08-09T11:46:38.6Z,689,1715,Additional messaging provider for NanoMessageBus using RabbitMQ messaging infrastructure.,NanoMessageBus.RabbitMQ,False,2016-05-31T09:44:28.727-07:00,True,False,RabbitMQ messaging adapter for NanoMessageBus.,"messaging,service,bus,servicebus,nano,message,nanomessagebus,nmb,messages,amqp,rabbit,rabbitmq",12113,False,2.0.40
Paul Betts,2013-08-10T16:41:46.333Z,164,1714,ReactiveUI.Events adds Observable-based events to UI controls and other appropriate places.,reactiveui-events,False,2017-11-07T23:52:51.977+00:00,True,False,,,52348,False,5.1.1
