authors,created,days_abandoned,days_alive,description,id,is_prerelease,last_updated,listed,missing_info,summary,tags,total_downloads,verified,versionLloyd Franklin,2015-02-21T23:25:01.377Z,43209,1154,CarCake.PublishSubscribeClientAssistant simplifies adding publication and subscription implementations to your PublishSubscribeService connected applications.,CarCake.PublishSubscribeClientAssistant,False,1899-12-31T16:00:00-08:00,False,False,Simplifies adding publications and subscriptions to your projects.,carcake,-1,False,5.0.1
Paul Patarinski,2015-02-15T21:11:55.183Z,838,1160,"Custom Cells for your Xamarin.Forms project to allow you to create highly customizable, performant Listviews and TableViews. Ensure you call TwoColumnCellRenderer.Init() on each platform! VISIT THE PROJECT URL for more info.",Xam.Plugins.Forms.ExtendedCell,False,2016-01-03T07:42:56.853-08:00,True,False,Use a TwoColumnCell in your Xamarin.Forms projects! Ensure you call TwoColumnCellRenderer.Init() on each platform! VISIT THE PROJECT URL for more info.,"xamarin,pcl,xam.pcl,windows,phone,winphone,wp8,android,xamarin.forms",4781,False,1.0.0.1
XLabs Team,2015-02-22T00:12:37.797Z,524,1153,"XLabs is a open source project that aims to provide a powerfull and cross platform set of controls tailored to work with Xamarin Forms.

      This package implements the caching provider using SQLite.",XLabs.Caching.SQLite,False,2016-11-12T10:39:24.113-08:00,True,False,XLabs is a open source project that aims to provide a powerfull and cross platform set of controls tailored to work with Xamarin Forms.,"Xamarin,XLabs,caching,sqlite",14934,False,2.0.5530
Prajeesh Prathap,2015-02-22T07:30:35.803Z,1150,1153,A fluent interface based powershell unit testing framework.,FluentShellUnit,False,2015-02-25T10:50:40.503-08:00,True,False,,"PowerShell,Unit,test",1031,False,1.0.1
SEEK Ltd.,2015-01-31T11:38:57.81Z,995,1175,Custom DSC Resources for managing NServiceBus services,seek-dsc-nservicebus,True,2015-07-30T06:10:46.33-07:00,True,False,,"admin,DSC",15138,False,1.0.0.84-master
bryan.arendt,2015-02-21T15:29:09.61Z,43209,1154,The setup for the Identity service layer,OrangeOnion.Identity,False,1899-12-31T16:00:00-08:00,False,False,,,-1,False,1.0.0
Andrey Taritsyn,2015-02-22T10:32:29.863Z,29,1153,"BundleTransformer.SassAndScss contains translator-adapter `SassAndScssTranslator` (supports Sass (http://sass-lang.com) version 3.4.12). This adapter makes translation of Sass- and SCSS-code to CSS-code. Also contains debugging HTTP-handler `SassAndScssAssetHandler`, which is responsible for text output of translated Sass- or SCSS-asset.

BundleTransformer.SassAndScss does not support the string interpolation in file paths. 

For execution of Ruby-code is used a IronRuby (http://github.com/IronLanguages/main) version 1.1.4.0. Assemblies `IronRuby.dll`, `IronRuby.Libraries.dll`, `Microsoft.Dynamic.dll` and `Microsoft.Scripting.dll` were builded from source code of the IronLanguages project.",BundleTransformer.SassAndScss,False,2018-03-22T17:46:21.487+00:00,True,False,"BundleTransformer.SassAndScss contains translator-adapter `SassAndScssTranslator` (supports Sass version 3.4.12). This adapter makes translation of Sass- and SCSS-code to CSS-code. Also contains debugging HTTP-handler `SassAndScssAssetHandler`, which is responsible for text output of translated Sass- or SCSS-asset.","System.Web.Optimization,IBundleTransform,ASP.NET,CSS,Bundling,Sass,SCSS,Translation,Translator,Compilation,Compiler",130181,False,1.9.47
Stig Schmidt Nielsson,2015-02-22T10:39:11.947Z,1153,1153,"XmlRpcLight is based on XmlRpc by Cook Computing, but without the http web parts and without dependency on System.Web.",XmlRpcLight,False,2015-02-22T10:39:11.947+00:00,True,False,,XmlRpc,3032,False,1.0.0
Lloyd Franklin,2015-02-21T23:28:55.657Z,43209,1154,CarCake.UtilityServices provide a set of tools useful in the development of services including a configuration solution.,CarCake.UtilityServices,False,1899-12-31T16:00:00-08:00,False,False,Provides a set of tools useful in the development of services.,carcake,-1,False,5.0.1
Paket team,2015-02-21T11:23:32.08Z,2,1154,A package dependency manager for .NET with support for NuGet packages and GitHub repositories.,Paket,True,2018-04-18T10:23:50.3+00:00,True,False,A package dependency manager for .NET with support for NuGet packages and GitHub repositories.,"nuget,bundler,F#",834968,False,0.30.0-alpha022
SYSTEM,2015-02-21T12:48:58.337Z,43209,1154,Description,Blocks.Core.LogEngines.Serilog,False,1899-12-31T16:00:00-08:00,False,False,,,-1,False,0.5.0.100
SharpSvn Project,2014-06-04T17:47:16.79Z,213,1416,"SharpSvn is a binding of the Subversion Client API for .NET based on the Subversion 1.9-alpha. This is the x86/32-bit version, See SharpSvn.1.9-x64 for the 64 bit version.",SharpSvn.1.9-x86,False,2017-09-19T12:10:39.407+00:00,True,False,,"Subversion,Svn,SharpSvn",32613,False,1.8991.3289.80
SEEK Ltd.,2015-01-31T11:11:05.967Z,995,1175,Custom DSC Resources for managing TopShelf services,seek-dsc-topshelf,True,2015-07-30T06:11:57.597-07:00,True,False,,"admin,DSC",16620,False,1.0.83-issue-21
Mogens Heller Grabe,2015-02-21T22:45:54.15Z,309,1154,Azure Service Bus event dispatcher d60 event sourcing + cqrs kit,d60.Cirqus.AzureServiceBus,False,2017-06-14T22:32:00.207-07:00,True,False,,,28969,False,0.55.2
SEEK Ltd.,2015-01-31T11:49:19.577Z,995,1175,Custom DSC Resources for message queue administration,seek-dsc-messagequeue,True,2015-07-30T06:09:19.563-07:00,True,False,,"admin,DSC",15844,False,1.0.0.85-issue-21
rynn.wang,2015-02-22T11:00:40.75Z,864,1153,"Common library for .NET projects. Including REST Api handler, exception handler, AOP, Reflection, Extensions, Configurations, etc.

NOTE: version 2.x is not compatible for version 1.x in exception handler methods.",ifunction.Common,False,2015-12-07T22:29:02.52-08:00,True,False,"Common library for .NET projects. Including REST Api handler, exception handler, AOP, Reflection, Extensions, Configurations, etc.",,68668,False,2.8.5
CapableObjects,2015-02-22T06:41:49.233Z,2,1153,Descr,EcoOtherDatabasePersistenceMappers,False,2018-04-18T02:38:04.54+00:00,True,False,,"ModelDrivenDevelopment,ECO,CapableObjects",144087,False,7.0.0.7662
SEEK Ltd.,2015-01-31T11:08:59.507Z,995,1175,Custom DSC Resources for message queue administration,seek-dsc-messagequeue,True,2015-07-30T06:09:19.563-07:00,True,False,,"admin,DSC",15844,False,1.0.83-issue-21
Mogens Heller Grabe,2015-02-21T16:02:23.477Z,309,1154,MongoDB stuff for d60 event sourcing + cqrs kit,d60.Cirqus.MongoDb,False,2017-06-14T22:32:40.503-07:00,True,False,,,29271,False,0.54.0
mrbrain,2015-02-21T15:46:41.903Z,209,1154,T1 common library,T1.ClientProfile,False,2017-09-23T13:48:41.99+00:00,True,False,,,5044,False,1.0.12
Alessio Parma <alessio.parma@gmail.com>,2015-02-22T10:18:42.46Z,43209,1153,"A collection of utilities: classes, extension methods, parsers, converters, collections, etc etc.",PommaLabs.GRAMPA,False,1899-12-31T16:00:00-08:00,False,False,"A collection of utilities: classes, extension methods, parsers, converters, collections, etc etc.","utilities,pommalabs,concurrent,readonly,collections",-1,False,2.2.0
Sylvain PONTOREAU,2015-02-21T11:45:50.7Z,1154,1154,PowerBI Api client Active Directory Azure Library for iOS device,PowerBI.Api.Client.ADAL.PCL.iOS,True,2015-02-21T04:08:03.143-08:00,True,False,,PowerBI,564,False,1.0.0-alpha
Lloyd Franklin,2015-02-21T23:26:45.217Z,43209,1154,CarCake.Tools provide general purpose thread classes and utilities that help build multi-threaded processing applications and services.,CarCake.Tools,False,1899-12-31T16:00:00-08:00,False,False,Provides general purpose thread classes and utilities.,carcake,-1,False,5.0.1
CP,2015-02-21T15:34:34.24Z,1154,1154,Package description,CihanTest1Proj,False,2015-02-21T07:34:34.24-08:00,True,False,,"Tag1,Tag2",368,False,1.0.2
Mogens Heller Grabe,2015-02-21T16:00:37.493Z,309,1154,Event sourcing + cqrs kit,d60.Cirqus,False,2017-06-14T22:31:49.347-07:00,True,False,,,31448,False,0.54.0
Yves Reynhout,2015-02-21T18:04:54.927Z,136,1154,Projac provides lightweight infrastructure for producing SQL based projections.,Projac,False,2017-12-05T10:58:34.567+00:00,True,False,,"eventsourcing,DDDesign",14912,False,0.0.118
SEEK Ltd.,2015-02-22T10:59:05.53Z,995,1153,Custom DSC Resources for administration of an IIS web server,seek-dsc-webadministration,True,2015-07-30T06:12:32.33-07:00,True,False,,"admin,DSC",14781,False,1.0.0.86-master
Paul Patarinski,2015-02-18T00:28:45.127Z,838,1157,"Custom Cells for your Xamarin.Forms project to allow you to create highly customizable, performant Listviews and TableViews. Ensure you call TwoColumnCellRenderer.Init() on each platform! VISIT THE PROJECT URL for more info.",Xam.Plugins.Forms.ExtendedCell,False,2016-01-03T07:42:56.853-08:00,True,False,Use a TwoColumnCell in your Xamarin.Forms projects! Ensure you call TwoColumnCellRenderer.Init() on each platform! VISIT THE PROJECT URL for more info.,"xamarin,pcl,xam.pcl,windows,phone,winphone,wp8,android,xamarin.forms",4781,False,1.0.0.4
XLabs Team,2015-02-22T00:16:43.48Z,524,1153,"XLabs is a open source project that aims to provide a powerfull and cross platform set of controls tailored to work with Xamarin Forms.

			This package contains helpers to work with IoC and Autofac",XLabs.IoC.Autofac,False,2016-11-12T10:40:37.297-08:00,True,False,XLabs is a open source project that aims to provide a powerfull and cross platform set of controls tailored to work with Xamarin Forms.,"Xamarin,XLabs,IoC,Autofac",19164,False,2.0.5530
Variel,2015-02-21T15:11:25.57Z,1154,1154,Useful C# helper / extension methods,Variel.Helpers,False,2015-02-21T07:11:25.57-08:00,True,False,,,343,False,1.0.0
bryan.arendt,2015-02-21T15:01:45.733Z,43209,1154,This installs the Scaffold Configuration,OrangeOnion.Scaffold,False,1899-12-31T16:00:00-08:00,False,False,,,-1,False,1.0.23
www.homethic.com,2015-02-22T10:42:33.997Z,499,1153,These DLLs contain logically organized Concepts and constitute Fozzy Ontological Pyramid.,Fozzy.Ontology,False,2016-12-07T02:40:45.55-08:00,True,False,Fozzy Pyramid of Business Concepts,"Semantic,API",8867,False,1.2.3.14
Mogens Heller Grabe,2015-02-21T16:06:00.627Z,309,1154,xUnit integration for Cirqus testing tools,d60.Cirqus.xUnit,False,2017-06-14T22:33:52.63-07:00,True,False,,,12575,False,0.54.0
Paul Patarinski,2015-02-16T04:02:33.897Z,838,1159,"Custom Cells for your Xamarin.Forms project to allow you to create highly customizable, performant Listviews and TableViews. Ensure you call TwoColumnCellRenderer.Init() on each platform! VISIT THE PROJECT URL for more info.",Xam.Plugins.Forms.ExtendedCell,False,2016-01-03T07:42:56.853-08:00,True,False,Use a TwoColumnCell in your Xamarin.Forms projects! Ensure you call TwoColumnCellRenderer.Init() on each platform! VISIT THE PROJECT URL for more info.,"xamarin,pcl,xam.pcl,windows,phone,winphone,wp8,android,xamarin.forms",4781,False,1.0.0.3
SEEK Ltd.,2015-01-31T11:49:47.187Z,995,1175,Custom DSC Resources for networking administration,seek-dsc-networking,True,2015-07-30T06:10:03.163-07:00,True,False,,"admin,DSC",17675,False,1.0.0.85-issue-21
acraven,2015-02-22T01:44:15.96Z,1106,1153,A RabbitMQ implementation of a simple publish/subscribe service bus,Atlas.ServiceBus.RabbitMQ,False,2015-04-10T14:44:14.027-07:00,True,False,,"ServiceBus,Publish,Subscribe,RabbitMQ",5191,False,0.0.52
Matthew D. Groves,2015-02-21T21:57:51.91Z,1154,1154,"Sticking Place is yet another ""junk drawer"" C# library of useful extensions and helpers, including SqlExceptionHelper, ASP.NET MVC helpers, MD5 and SHA256 helpers.",StickingPlace,False,2015-02-21T13:57:51.91-08:00,True,False,,,426,False,0.1.0
Lloyd Franklin,2015-02-21T23:08:40.533Z,43209,1154,CarCake.Consoles provides console output in a WinForms application.,CarCake.Consoles,False,1899-12-31T16:00:00-08:00,False,False,Console output window control.,carcake,-1,False,5.0.1
SEEK Ltd.,2015-01-31T11:39:26.92Z,995,1175,Custom DSC Resources for installing and uninstalling software packages and updates,seek-dsc-software,True,2015-07-30T06:11:22.58-07:00,True,False,,"admin,DSC",14785,False,1.0.0.84-master
Matthew Erbs,2015-02-22T10:13:42.183Z,1153,1153,A file watcher to help determine when an Azure Web Job exits.,WebJobSentinel,False,2015-02-22T02:13:42.183-08:00,True,False,,"azure,webjob,job,websites",1039,False,0.1.33
XLabs Team,2015-02-22T00:21:36.823Z,524,1153,"XLabs is a open source project that aims to provide a powerfull and cross platform set of controls tailored to work with Xamarin Forms.

      This package contains serializer based on ServiceStack V3 - Copyright (c) 2007-2013, Demis Bellot, ServiceStack.",XLabs.Serialization.ServiceStackV3,False,2016-11-12T10:42:43.7-08:00,True,False,XLabs is a open source project that aims to provide a powerfull and cross platform set of controls tailored to work with Xamarin Forms.,"Xamarin,XLabs,Serialization,ServiceStackV3",14240,False,2.0.5530
Sylvain PONTOREAU,2015-02-21T11:45:50.7Z,1154,1154,PowerBI Api client Active Directory Azure Library for iOS device,PowerBI.Api.Client.ADAL.PCL.iOS,True,2015-02-21T04:08:03.143-08:00,True,False,,PowerBI,564,False,1.0.0-alpha
Paket team,2015-02-21T10:44:16.56Z,2,1154,A package dependency manager for .NET with support for NuGet packages and GitHub repositories.,Paket,True,2018-04-18T10:23:50.3+00:00,True,False,A package dependency manager for .NET with support for NuGet packages and GitHub repositories.,"nuget,bundler,F#",834968,False,0.30.0-alpha021
Paul Patarinski,2015-02-16T02:45:31.7Z,838,1159,"Custom Cells for your Xamarin.Forms project to allow you to create highly customizable, performant Listviews and TableViews. Ensure you call TwoColumnCellRenderer.Init() on each platform! VISIT THE PROJECT URL for more info.",Xam.Plugins.Forms.ExtendedCell,False,2016-01-03T07:42:56.853-08:00,True,False,Use a TwoColumnCell in your Xamarin.Forms projects! Ensure you call TwoColumnCellRenderer.Init() on each platform! VISIT THE PROJECT URL for more info.,"xamarin,pcl,xam.pcl,windows,phone,winphone,wp8,android,xamarin.forms",4781,False,1.0.0.2
bryan.arendt,2015-02-21T15:00:38.687Z,43209,1154,The setup for the View Model layer,OrangeOnion.ViewModel,False,1899-12-31T16:00:00-08:00,False,False,,,-1,False,1.0.0.7
Sayed Ibrahim Hashimi,2015-02-22T06:50:18.327Z,552,1153,"NuGet package which installs a PS module on init that can be used by other packages in init.ps1/install.ps1.
      It exposes some functionality to simplify manipulating MSBuild files.",psbuild,True,2016-10-15T12:33:18.32-07:00,True,False,,msbuild,22062,False,0.0.6-beta3
BenFradet,2015-02-21T19:53:57.47Z,161,1154,C# Wrapper for the Riot Games API,RiotSharp,False,2017-11-10T23:04:16.85+00:00,True,False,"C# wrapper for the Riot Games API.

This product is not endorsed, certified or otherwise approved in any way by Riot Games, Inc. or any of its affiliates.",,10854,False,2.2.0
Mogens Heller Grabe,2015-02-21T16:22:33.57Z,309,1154,Event sourcing + cqrs kit,d60.Cirqus,False,2017-06-14T22:31:49.347-07:00,True,False,,,31448,False,0.55.0
Mogens Heller Grabe,2015-02-21T16:26:31.677Z,309,1154,SQLite event store for d60 event sourcing + cqrs kit,d60.Cirqus.SQLite,False,2017-06-14T22:33:31.38-07:00,True,False,,,21821,False,0.55.0
Roman Perepelitsa,2015-02-21T15:52:04.507Z,839,1154,The middle level of the iFix library,iFix.Mantle,False,2016-01-02T06:38:27.57-08:00,True,False,,FIX,5509,False,0.1.5530.30344
Jason Jarrett,2015-02-22T02:03:10.353Z,759,1153,TypeScript Definitions (d.ts) for lazy.js. Generated based off the DefinitelyTyped repository [git commit: 8e85bba87a8c95c7f357e78e3d5d1269c337741d]. http://github.com/DefinitelyTyped,lazy.js.TypeScript.DefinitelyTyped,False,2016-03-22T12:01:36.98-07:00,True,False,,"TypeScript,JavaScript",3953,False,0.1.0
Josh Sim,2015-02-21T14:12:28.343Z,1154,1154,Web Api HAL Hypermedia Formatter,Hal.WebApi.Formatter,False,2015-02-21T06:12:28.343-08:00,True,False,HAL Hypermedia formatter for ASP.NET WebAPI,,844,False,0.1.0.2
acraven,2015-02-21T18:17:58.937Z,1106,1154,A simple publish/subscribe service bus contract,Atlas.ServiceBus,False,2015-04-10T14:43:09.957-07:00,True,False,,"ServiceBus,Publish,Subscribe",5445,False,0.0.51
bryan.arendt,2015-02-21T23:25:08.02Z,43209,1154,This installs the Scaffold Configuration,OrangeOnion.Scaffold,False,1899-12-31T16:00:00-08:00,False,False,,,-1,False,1.0.26
acraven,2015-02-22T02:07:10.487Z,1106,1153,An in-memory implementation of a simple publish/subscribe service bus,Atlas.ServiceBus.InMemory,False,2015-04-10T14:43:41.37-07:00,True,False,,"ServiceBus,Publish,Subscribe,InMemory",3764,False,0.0.54
"Robert Moore,Matthew Davies",2015-02-21T15:31:09.123Z,61,1154,"Provides an NHibernate driver that uses the Microsoft Transient Fault Handling library to allow for reliable SQL Azure connections.
      This package has the Microsoft Transient Fault Handling library IL-merged into it; for a version that doesn't see the NHibernate.SqlAzure.Standalone package.",NHibernate4.SqlAzure,False,2018-02-18T01:39:16.953+00:00,True,False,,"nhibernate,azure,sql,transient",19944,False,2.1.0
"ejsmith,bniemyjski",2015-02-21T22:43:23.35Z,43209,1154,Pluggable foundation blocks for building distributed apps.,Foundatio.Azure,False,1899-12-31T16:00:00-08:00,False,False,,"Queue,Messaging,Message,Bus,Locking,Lock,Distributed,File,Storage,Blob,Jobs,Metrics,Stats,Azure,Redis,StatsD",-1,False,1.0.0
"Robert Moore,Matthew Davies",2015-02-21T15:24:02.743Z,61,1154,"Provides an NHibernate driver that uses the Microsoft Transient Fault Handling library to allow for reliable SQL Azure connections.
      This package has the Microsoft Transient Fault Handling library IL-merged into it; for a version that doesn't see the NHibernate.SqlAzure.Standalone package.",NHibernate.SqlAzure,False,2018-02-18T01:38:59.407+00:00,True,False,,"nhibernate,azure,sql,transient",63011,False,2.1.0
Roman Perepelitsa,2015-02-22T11:24:12.91Z,839,1153,The lowest level of the iFix library,iFix.Core,False,2016-01-02T06:38:19.49-08:00,True,False,,FIX,5697,False,0.1.5531.22323
SEEK Ltd.,2015-02-22T11:25:26.08Z,995,1153,Custom DSC Resources for networking administration,seek-dsc-networking,False,2015-07-30T06:10:03.163-07:00,True,False,,"admin,DSC",17675,False,1.0.0.87
Lloyd Franklin,2015-02-21T23:11:01.383Z,43209,1154,A simple lightweight logging abstraction that allows output of logging and error information to be captured and routed to another abstraction or concrete logging implementation.,CarCake.LogErr,False,1899-12-31T16:00:00-08:00,False,False,A simple lightweight logging abstraction,carcake,-1,False,5.0.1
XLabs Team,2015-02-22T00:13:38.987Z,524,1153,"XLabs is a open source project that aims to provide a powerfull and cross platform set of controls tailored to work with Xamarin Forms.

			This package contains helpers to work with cryptography.",XLabs.Cryptography,False,2016-11-12T10:39:47.77-08:00,True,False,XLabs is a open source project that aims to provide a powerfull and cross platform set of controls tailored to work with Xamarin Forms.,"Xamarin,XLabs,Cryptography,md5",12339,False,2.0.5530
Christian Rondeau,2015-02-21T20:22:02.757Z,109,1154,A fast and simple Sikuli wrapper for .Net,SikuliSharp,False,2018-01-01T02:11:25.673+00:00,True,False,"Uses the Sikuli interactive console for faster results; you can run commands, or run a .sikuli project. Requires to have Java and Sikuli installed.","sikuli,automation,unit,test,functional,automated",5178,False,1.0.3
Production Ready LLC,2015-02-21T13:44:49.737Z,869,1154,"ELEFLEX is a platform for building modular, domain-driven, service-oriented web applications and services.",Eleflex,False,2015-12-03T10:28:59.697-08:00,True,False,"ELEFLEX is a platform for building modular, domain-driven, service-oriented web applications and services.","eleflex,mvc,soa,domain,modular,web,sql,entity,service,integration,modules,productionready",10900,False,2.0.28
Streamcoders.com,2015-02-22T08:36:28.287Z,361,1153,Is a comprehensive library for handling audio/video codecs and streaming technologies.,Streamcoders.MediaSuite.x86,False,2017-04-24T01:50:45.473-07:00,True,False,,"audio,video,streaming,html5,rtsp,rtp,h.264,vp8",102824,False,4.0.524
Mogens Heller Grabe,2015-02-21T22:50:05.52Z,309,1154,TypeScript command interface definition generator for  d60 event sourcing + cqrs kit,d60.Cirqus.TsClient,False,2017-06-14T22:33:41.74-07:00,True,False,,,22935,False,0.55.2
bryan.arendt,2015-02-21T15:35:35.217Z,43209,1154,This installs the Scaffold Configuration,OrangeOnion.Scaffold,False,1899-12-31T16:00:00-08:00,False,False,,,-1,False,1.0.24
Paket team,2015-02-21T17:18:56.613Z,2,1154,A package dependency manager for .NET with support for NuGet packages and GitHub repositories.,Paket,True,2018-04-18T10:23:50.3+00:00,True,False,A package dependency manager for .NET with support for NuGet packages and GitHub repositories.,"nuget,bundler,F#",834968,False,0.30.0-alpha023
Mogens Heller Grabe,2015-02-21T16:25:31.257Z,309,1154,PostgreSql stuff for d60 event sourcing + cqrs kit,d60.Cirqus.PostgreSql,False,2017-06-14T22:33:10.723-07:00,True,False,,,27536,False,0.55.0
"ejsmith,bniemyjski",2015-02-21T22:42:49.027Z,141,1154,Pluggable foundation blocks for building distributed apps.,Foundatio.Redis,False,2017-11-30T14:52:07.817+00:00,True,False,,"Queue,Messaging,Message,Bus,Locking,Lock,Distributed,File,Storage,Blob,Jobs,Metrics,Stats,Azure,Redis,StatsD",77724,True,1.0.0
Joe Harrison,2015-02-22T02:38:38.183Z,408,1153,"A grid for ASP.NET MVC and Bootstrap with ajax paging and sorting. Also has filtering support, export to csv, back button support, and graceful degradation. Easily configurable. All AJAX calls are handled for you... Simply tell it how to get your data!",MVCGrid.Net,False,2017-03-07T21:05:56.41-08:00,True,False,,"mvc,grid",30843,False,1.0.0.29
cabeln,2015-02-22T00:13:47.423Z,591,1153,This package adds the SDK library for Microsoft Dynamics Marketing 2015 to your project.,Microsoft.Dynamics.Marketing.SDK.library,False,2016-09-06T15:13:36.3-07:00,True,False,,"Dynamics,Marketing,2015,SDK",5147,True,17.0.3709
bryan.arendt,2015-02-21T15:35:35.217Z,43209,1154,This installs the Scaffold Configuration,OrangeOnion.Scaffold,False,1899-12-31T16:00:00-08:00,False,False,,,-1,False,1.0.24
Mogens Heller Grabe,2015-02-21T16:27:27.427Z,309,1154,xUnit integration for Cirqus testing tools,d60.Cirqus.xUnit,False,2017-06-14T22:33:52.63-07:00,True,False,,,12575,False,0.55.0
Roman Perepelitsa,2015-02-22T11:24:40.91Z,839,1153,The middle level of the iFix library,iFix.Mantle,False,2016-01-02T06:38:27.57-08:00,True,False,,FIX,5509,False,0.1.5531.22323
Jojatekok,2015-02-21T11:24:37.127Z,1102,1154,API for data transmission and retrieval from Monero applications through the Microsoft .NET Framework,MoneroApi.Net,False,2015-04-14T09:19:03.273-07:00,True,False,,"Monero,API",5452,False,6.1.0
Epworth Consulting Ltd.,2015-02-22T01:44:40.787Z,1106,1153,Description,Atlas.ServiceBus.Resolver.Windsor,False,2015-04-10T14:44:46.637-07:00,True,False,,,2448,False,0.0.52
ClouDeveloper,2015-02-21T15:29:14.11Z,350,1154,This component contains msvcrt P/Invoke declarations.,xpInterop.msvcrt,False,2017-05-05T05:54:32.873-07:00,True,False,,"pinvoke,msvcrt,xpinterop",1491,False,0.0.1.5
Shape,2015-02-22T00:14:28.717Z,1147,1153,"How many times have you compiled your C# code today? So many that you already forgot, right? Imagine if you could write code and you never had to compile a single change you do. You just ran the app and coded all along. Well, you can stop imagining, because that is a reality.

ShapeFX its just that! It's productivity, period. Write your objects a single time and never more you have to worry about compiling them, we'll take care of that for you. But we're much more than that. As we deploy as source we are the fastest way you'll ever know to correct a bug in production. Just pull the source via FTP, change, save and you´re done. We are also the only way to make critical changes into deployed components without restarts.

Works in a future-proof way. Connect your objects to a remote source code repo and sync them with the latest version of the code you want executed. If you´re not impressed until here, see for yourself, try the beta and we are sure that next time you´ll remember how many times you compiled your code.",Shape,True,2015-02-27T16:49:25.067-08:00,True,False,A high-productivity framework for the C# language,ShapeFX,2532,False,0.1.8-beta
"Brandon Cuff,alexinspire,Johan Nilsson",2015-02-22T00:59:55.43Z,483,1153,An async wrapper of the Google Geocode API for .NET,GeocodeSharp,False,2016-12-23T12:14:23.097-08:00,True,False,,"Geocode,Address,Maps,Geo",27349,False,1.0.5
bryan.arendt,2015-02-21T19:23:47.69Z,43209,1154,The setup for the MVC layer,OrangeOnion.MVC,False,1899-12-31T16:00:00-08:00,False,False,,,-1,False,1.0.0.6
SEEK Ltd.,2015-01-31T11:38:04.247Z,995,1175,Custom DSC Resources for message queue administration,seek-dsc-messagequeue,True,2015-07-30T06:09:19.563-07:00,True,False,,"admin,DSC",15844,False,1.0.0.84-master
SEEK Ltd.,2015-02-22T10:58:36.273Z,995,1153,Custom DSC Resources for managing TopShelf services,seek-dsc-topshelf,True,2015-07-30T06:11:57.597-07:00,True,False,,"admin,DSC",16620,False,1.0.0.86-master
Tareq Ateik,2015-02-20T20:38:30.847Z,1155,1155,"SlideshowView (Carousel) control for Universal Apps. Creates a thumbnail/Dots view, Auto play slider. Works on Windows & Windows Phone 8.1",SlideshowView,False,2015-02-20T12:38:30.847-08:00,True,False,,"SlideshowView,Carousel,control,winrt,wp8,universal",628,False,0.0.1
