authors,created,days_abandoned,days_alive,description,id,is_prerelease,last_updated,listed,missing_info,summary,tags,total_downloads,verified,version"Robert Moore,Matthew Davies",2015-02-21T09:47:10.477Z,61,1154,"Provides an NHibernate driver that uses the Microsoft Transient Fault Handling library to allow for reliable SQL Azure connections.
      This package has the Microsoft Transient Fault Handling library IL-merged into it; for a version that doesn't see the NHibernate.SqlAzure.Standalone package.",NHibernate.SqlAzure,False,2018-02-18T01:38:59.407+00:00,True,False,,"nhibernate,azure,sql,transient",63011,False,2.0.1
T-Alex Software,2015-02-21T20:47:58.853Z,25,1154,T-Alex MathCore.ComplexExpressions Library,TAlex.MathCore.ComplexExpressions,False,2018-03-26T02:29:58.253+00:00,True,False,,"Math,MathCore,Mathematica,Complex,Expression,Evaluate",503,False,1.1.1
Production Ready LLC,2015-02-21T14:39:13.527Z,869,1154,"ELEFLEX is a platform for building modular, domain-driven, service-oriented web applications and services.",Eleflex,False,2015-12-03T10:28:59.697-08:00,True,False,"ELEFLEX is a platform for building modular, domain-driven, service-oriented web applications and services.","eleflex,mvc,soa,domain,modular,web,sql,entity,service,integration,modules,productionready",10900,False,2.0.29
Alessio Parma <alessio.parma@gmail.com>,2015-02-21T17:46:45.13Z,15,1154,"A simple, timed and persistent key-value store based on SQLite. This package adds the references required to use the Web API output cache provider.",PommaLabs.KVLite.WebApi,False,2018-04-05T21:07:23.863+00:00,True,False,"A simple, timed and persistent key-value store based on SQLite. This package adds the references required to use the Web API output cache provider.","kvlite,webapi,web,api,response,output,cache,provider,controller",4189,True,1.4.2
cabeln,2015-02-22T00:13:47.423Z,591,1153,This package adds the SDK library for Microsoft Dynamics Marketing 2015 to your project.,Microsoft.Dynamics.Marketing.SDK.library,False,2016-09-06T15:13:36.3-07:00,True,False,,"Dynamics,Marketing,2015,SDK",5147,True,17.0.3709
XLabs Team,2015-02-22T00:13:08.227Z,524,1153,"XLabs is a open source project that aims to provide a powerfull and cross platform set of controls tailored to work with Xamarin Forms.

			This package contains the the core components of the XLabs Forms framework and controls.",XLabs.Core,False,2016-11-12T10:39:35.473-08:00,True,False,XLabs is a open source project that aims to provide a powerfull and cross platform set of controls tailored to work with Xamarin Forms.,"Xamarin.Forms,XLabs",211779,False,2.0.5530
"Henrik Feldt,Logibit AB",2015-02-21T22:31:10.983Z,211,1154,A F# implementation of the Hawk authentication protocol. Few dependencies. No cruft.,Hawk.Suave,False,2017-09-21T07:33:10.98+00:00,True,False,,"fsharp,hawk,authentication,authorization,security,hawknet",8437,False,0.8.2
CapableObjects,2015-02-22T06:43:15.58Z,2,1153,Descr,EcoWebASP,False,2018-04-18T02:38:50.37+00:00,True,False,,"ModelDrivenDevelopment,ECO,CapableObjects",118270,False,7.0.0.7662
Mogens Heller Grabe,2015-02-21T17:37:36.423Z,309,1154,Entity Framework-based view manager for d60 event sourcing + cqrs kit,d60.Cirqus.EntityFramework,False,2017-06-14T22:32:11.503-07:00,True,False,,,22298,False,0.55.1
"Chris Dostert,TonightWe",2015-02-21T23:04:44.35Z,43209,1154,A SQL Server implementation of the TW.CommentSubsystem.Core's storage dependencies.,TW.CommentSubsystem.Storage.SqlServer,False,1899-12-31T16:00:00-08:00,False,False,,"SQL,Server,Storage,CommentSubsystem,CommentSystem,Comments,Commenting",-1,False,0.0.33
CP,2015-02-21T14:45:08.877Z,43209,1154,Package description,CihanTest1id,False,1899-12-31T16:00:00-08:00,False,False,,"Tag1,Tag2",-1,False,1.0.0
Jason Jarrett,2015-02-22T02:02:13.677Z,492,1153,TypeScript Definitions (d.ts) for async. Generated based off the DefinitelyTyped repository [git commit: 8e85bba87a8c95c7f357e78e3d5d1269c337741d]. http://github.com/DefinitelyTyped,async.TypeScript.DefinitelyTyped,False,2016-12-13T22:20:21.19-08:00,True,False,,"TypeScript,JavaScript",25148,False,0.2.3
Younom,2015-02-21T23:27:16.477Z,294,1154,An Everybody Edits framework designed for performance and reliability.,BotBits,False,2017-06-30T08:12:58.64-07:00,True,False,An Everybody Edits framework designed for performance and reliability.,"BotBits,EverybodyEdits",33528,False,1.0.1
www.homethic.com,2015-02-21T17:46:42.56Z,1154,1154,Connector to Gedcom information,Fozzy.Gedcom,False,2015-02-21T09:46:42.56-08:00,True,False,Connector to Gedcom information,"Semantic,API",412,False,1.2.3.1
"Microsoft,Anton Nikolaev",2015-02-21T23:08:57.437Z,43209,1154,"PLEASE NOTE THIS PACKAGE IS NOT OFFICIAL. It contains MODIFIED version of System.IO.Pipes from .NETCore (https://github.com/dotnet/corefx) to allow using it in the apps targetting .NET4.

Provides a means for interprocess communication through anonymous and/or named pipes.

Commonly Used Types:
System.IO.Pipes.NamedPipeServerStream
System.IO.Pipes.PipeDirection
System.IO.Pipes.PipeOptions
System.IO.Pipes.PipeTransmissionMode
System.IO.Pipes.NamedPipeClientStream
System.IO.Pipes.PipeStream",CoreFx.System.IO.Pipes,False,1899-12-31T16:00:00-08:00,False,False,Provides a means for interprocess communication through anonymous and/or named pipes.,"pipes,system.io.pipes,corefx,ipc",-1,False,1.0.0
OrchestraDevs,2015-02-21T14:23:50.347Z,4,1154,This library allows the user to show desktop notifications.,Orc.Notifications,True,2018-04-16T14:52:33.497+00:00,True,False,,"orc,support,package",5202,True,0.2.0-unstable0014
Corrado Cavalli,2014-12-29T23:08:53.447Z,43209,1208,Porting of Blend behaviors core infrastructure to Xamarin Forms,Xamarin.Forms.Behaviors,False,1899-12-31T16:00:00-08:00,False,False,Behaviors for Xamarin Forms,"Xamarin,Behaviors",-1,False,1.3.1
SEEK Ltd.,2015-01-31T11:07:57.15Z,995,1175,Custom DSC Resources for SQL Database administration,seek-dsc-database,True,2015-07-30T06:08:08.473-07:00,True,False,,"admin,DSC",13298,False,1.0.83-issue-21
SEEK Ltd.,2015-01-31T11:39:53.31Z,995,1175,Custom DSC Resources for managing TopShelf services,seek-dsc-topshelf,True,2015-07-30T06:11:57.597-07:00,True,False,,"admin,DSC",16620,False,1.0.0.84-master
XLabs Team,2015-02-22T00:20:13.68Z,524,1153,"XLabs is a open source project that aims to provide a powerfull and cross platform set of controls tailored to work with Xamarin Forms.

			This package contains core framework for serialization",XLabs.Serialization,False,2016-11-12T10:41:47.25-08:00,True,False,XLabs is a open source project that aims to provide a powerfull and cross platform set of controls tailored to work with Xamarin Forms.,"Xamarin,XLabs,Serialization",200053,False,2.0.5530
SEEK Ltd.,2015-02-22T10:55:32.733Z,995,1153,Custom DSC Resources for hosting applications with AppFabric,seek-dsc-appfabric-hosting,True,2015-07-30T06:07:33.8-07:00,True,False,,"admin,DSC",11117,False,1.0.0.86-master
www.homethic.com,2015-02-21T17:16:55.687Z,648,1154,Set of connectors on different types of Data sources (both with In and Out directions),Fozzy.Server,False,2016-07-11T02:10:25.023-07:00,True,False,Fozzy Connectors,"Semantic,API",8058,False,1.2.3.3
"ejsmith,bniemyjski",2015-02-22T09:16:53.55Z,141,1153,Pluggable foundation blocks for building distributed apps.,Foundatio.AzureServiceBus,False,2017-11-30T15:05:26.42+00:00,True,False,,"Queue,Messaging,Message,Bus,Locking,Lock,Distributed,File,Storage,Blob,Jobs,Metrics,Stats,Azure,Redis,StatsD",55292,True,1.0.108
SEEK Ltd.,2015-02-22T11:41:36.81Z,995,1153,Custom DSC Resources for managing TopShelf services,seek-dsc-topshelf,False,2015-07-30T06:11:57.597-07:00,True,False,,"admin,DSC",16620,False,1.0.1
Fabio,2015-02-21T22:50:56.013Z,43209,1154,"MVC Upload plugin using dropzonejs, allowing dynamic validations",Fabiohvp.Upload.Web,False,1899-12-31T16:00:00-08:00,False,False,,"Upload,Web,ASP.NET,DropzoneJS",-1,False,1.0.9
Antonino Porcino,2015-02-21T16:11:29.77Z,1154,1154,This package contains the required metadata to use the Firebug Console with the Saltarelle C# to JavaScript compiler. Install this package on the C# saltarelle project.,Saltarelle.Firebug,False,2015-02-21T08:11:29.77-08:00,True,False,,"compiler,c#,javascript,web,console,firebug",530,False,0.0.2
bryan.arendt,2015-02-21T20:27:45.12Z,43209,1154,The setup for the View Model layer,OrangeOnion.ViewModel,False,1899-12-31T16:00:00-08:00,False,False,,,-1,False,1.0.0.8
Lloyd Franklin,2015-02-21T23:23:16.043Z,43209,1154,CarCake.PublishSubscribe provides a publication and subscription system service and toolset for implementing publish and subscribe  between multiple applications and services.,CarCake.PublishSubscribe,False,1899-12-31T16:00:00-08:00,False,False,CarCake PublishSubscribe Core Functionality.,carcake,-1,False,5.0.1
Mogens Heller Grabe,2015-02-21T22:46:50.49Z,309,1154,MongoDB stuff for d60 event sourcing + cqrs kit,d60.Cirqus.MongoDb,False,2017-06-14T22:32:40.503-07:00,True,False,,,29271,False,0.55.2
www.homethic.com,2015-02-22T07:17:35.557Z,664,1153,Fozzy Skin is an Interface with the Presentation Layer,Fozzy.Skin,False,2016-06-24T23:38:52.037-07:00,True,False,Fozzy Skin is an Interface with the Presentation Layer,"Semantic,API",16628,False,1.2.3.9
Masanori Onoue(@ugaya40),2015-02-21T13:07:07.103Z,1149,1154,"Simple Flow Control Library with Rx(Reactive Extensions).
MIT License.",RxFlow,False,2015-02-26T04:28:18.683-08:00,True,False,"Simple Flow Control Library with Rx(Reactive Extensions).
MIT License.","Reactive,Extensions",817,False,0.1.20150221
acraven,2015-02-22T02:17:21.79Z,1106,1153,A RabbitMQ implementation of a simple publish/subscribe service bus,Atlas.ServiceBus.RabbitMQ,False,2015-04-10T14:44:14.027-07:00,True,False,,"ServiceBus,Publish,Subscribe,RabbitMQ",5191,False,0.0.55
neuecc,2015-02-21T12:47:09.867Z,570,1154,LightNode(as Micro REST/RPC Framework) Formatter by MsgPack.,LightNode.Formatter.MsgPack,False,2016-09-27T02:13:54.273-07:00,True,False,,"Owin,Rest,RPC",3531,False,1.1.0
danielwertheim,2015-02-18T21:21:16.79Z,877,1157,"MyCouch is the simple asynchronous CouchDB and Cloudant client for .Net - building on top of the asynchronous HTTP client and uses JSON.Net to provide flexible serialization behaviour.

      This package contains support for Cloudant specific features. If you want pure CouchDB support go with the ""MyCouch"" package instead.

      It tries to keep the domain language of CouchDb and lets you work with requests and responses but also provides you with an alternative simplifying async API.
      MyCouch lets you work with raw JSON and/or entities/POCOS without requiring any implementation of interfaces or base-classes etc. MyCouch provides you with some model conventions like
      injection of $doctype to the document. It is pluggable. If you don't like some piece, then hook in your implementation instead.

      Supports .Net4.0, .Net4.5 and a PCL for Windows store 8.0 and 8.1 (WinRT) and WP8.1.",MyCouch.Cloudant,False,2015-11-25T12:45:47.4-08:00,True,False,Simple async CouchDB and Cloudant client.,"couchdb,cloudant,lucene,nosql",11062,False,3.1.0
bryan.arendt,2015-02-21T15:00:38.687Z,43209,1154,The setup for the View Model layer,OrangeOnion.ViewModel,False,1899-12-31T16:00:00-08:00,False,False,,,-1,False,1.0.0.7
Paul Jenkins; Jake Ginnivan; Brendan Forster (shiftkey); Alex Mitchell (Amrykid); Dennis Daume (flagbug); Jan Karger (punker76),2015-02-21T21:25:28.04Z,38,1154,"The goal of MahApps.Metro is to allow devs to quickly and easily cobble together a ""Metro"" or ""Modern"" UI for their WPF4+ apps, with minimal effort.",MahApps.Metro,True,2018-03-13T22:31:08.54+00:00,True,False,"The goal of MahApps.Metro is to allow devs to quickly and easily cobble together a ""Metro"" or ""Modern"" UI for their WPF4+ apps, with minimal effort.","WPF,UI,Metro",1280769,True,1.0.1-ALPHA069
Sylvain PONTOREAU,2015-02-21T12:08:03.143Z,1154,1154,PowerBI Api client Active Directory Azure Library for iOS device,PowerBI.Api.Client.ADAL.PCL.iOS,True,2015-02-21T04:08:03.143-08:00,True,False,,PowerBI,564,False,1.0.1-alpha
"GeertvanHorrik,OrchestraDevs",2015-02-21T13:19:19.563Z,4,1154,The MahApps shell for Orchestra based applications.,Orchestra.Shell.MahApps,True,2018-04-16T15:54:52.573+00:00,True,False,,"mvvm,orchestra,shell,prism,framework,wpf,mahapps",38721,True,2.1.0-unstable0088
Jason Jarrett,2015-02-22T02:01:43.837Z,492,1153,TypeScript Definitions (d.ts) for angular-hotkeys. Generated based off the DefinitelyTyped repository [git commit: 8e85bba87a8c95c7f357e78e3d5d1269c337741d]. http://github.com/DefinitelyTyped,angular-hotkeys.TypeScript.DefinitelyTyped,False,2016-12-13T22:09:00.86-08:00,True,False,,"TypeScript,JavaScript",12331,False,0.0.3
"ejsmith,bniemyjski",2015-02-22T09:02:43.01Z,141,1153,Pluggable foundation blocks for building distributed apps.,Foundatio.AzureServiceBus,False,2017-11-30T15:05:26.42+00:00,True,False,,"Queue,Messaging,Message,Bus,Locking,Lock,Distributed,File,Storage,Blob,Jobs,Metrics,Stats,Azure,Redis,StatsD",55292,True,1.0.103
Bret Copeland,2015-02-22T01:15:03.467Z,826,1153,A distributed settings library built on top of Redis.,NFig.Redis,True,2016-01-14T19:33:46.28-08:00,True,False,,"Settings,Config,Configuration,Distributed,Redis",6927,False,1.0.0-unstable
Younom,2015-02-22T01:34:17.513Z,294,1153,An Everybody Edits framework designed for performance and reliability.,BotBits,False,2017-06-30T08:12:58.64-07:00,True,False,An Everybody Edits framework designed for performance and reliability.,"BotBits,EverybodyEdits",33528,False,1.0.3
bryan.arendt,2015-02-21T15:29:09.61Z,43209,1154,The setup for the Identity service layer,OrangeOnion.Identity,False,1899-12-31T16:00:00-08:00,False,False,,,-1,False,1.0.0
XLabs Team,2015-02-22T00:16:16.447Z,524,1153,"XLabs is a open source project that aims to provide a powerfull and cross platform set of controls tailored to work with Xamarin Forms.

			This package contains core interfaces for IoC",XLabs.IoC,False,2016-11-12T10:40:25.843-08:00,True,False,XLabs is a open source project that aims to provide a powerfull and cross platform set of controls tailored to work with Xamarin Forms.,"Xamarin,XLabs,IoC",212459,False,2.0.5530
OrchestraDevs,2015-02-21T10:59:13.467Z,4,1154,This library allows the user to show desktop notifications.,Orc.Notifications,True,2018-04-16T14:52:33.497+00:00,True,False,,"orc,support,package",5202,True,0.2.0-unstable0013
ERS-DEV-1,2015-02-21T10:10:48.803Z,1147,1154,Description,AINUDB,False,2015-02-28T01:48:58.107-08:00,True,False,,,3478,False,1.0.12
cabeln,2015-02-21T23:55:49.503Z,43209,1154,This package adds the SDK library for Microsoft Dynamics Marketing 2015 to your project.,Microsoft.Dynamics.Marketing.SDK.dll,False,1899-12-31T16:00:00-08:00,False,False,,"Dynamics,Marketing,2015,SDK",-1,False,17.0.3709
www.homethic.com,2015-02-21T17:39:22.457Z,1054,1154,Connector to MSAccess information,Fozzy.MSAccess,False,2015-06-01T07:52:38.787-07:00,True,False,Connector to MSAccess information,"Semantic,API",2772,False,1.2.3.1
Stephen Cleary,2015-02-22T01:58:25.917Z,446,1153,A helper library for the Task-Based Asynchronous Pattern (TAP).,Nito.AsyncEx.StrongNamed,True,2017-01-29T12:39:59.83-08:00,True,False,A helper library for the Task-Based Asynchronous Pattern (TAP).,"async,await,async-await,task,asynchronous,net45,win8,net40,netcore45,sl5,wp8,wpa81,nito",10563,True,3.0.1-pre
www.homethic.com,2015-02-21T18:33:46.837Z,664,1154,Fozzy Skin is an Interface with the Presentation Layer,Fozzy.Skin,False,2016-06-24T23:38:52.037-07:00,True,False,Fozzy Skin is an Interface with the Presentation Layer,"Semantic,API",16628,False,1.2.3.8
"Microsoft,cabeln",2015-02-22T00:54:54.64Z,591,1153,This package adds the SDK library for Microsoft Dynamics Marketing 2015 to your project.,Microsoft.Dynamics.Marketing.SDK.library,False,2016-09-06T15:13:36.3-07:00,True,False,,"Dynamics,Marketing,2015,SDK",5147,True,17.0.3709.2
Dotstore,2015-02-21T19:56:34.407Z,43209,1154,SDK da API Dotstore,SDKDotstore,False,1900-01-01T00:00:00+00:00,False,False,,,27649,False,0.0.1.75
"Robert Moore,Matthew Davies",2015-02-21T15:24:55.15Z,62,1154,"Provides an NHibernate driver that uses the Microsoft Transient Fault Handling library to allow for reliable SQL Azure connections.
      Unlike NHibernate.SqlAzure, this library doesn't come with TransientFaultHandling IL-merged - instead it's a NuGet dependency.",NHibernate.SqlAzure.Standalone,False,2018-02-17T23:56:41.957+00:00,True,False,,"nhibernate,azure,sql,transient",7451,False,2.1.0
www.homethic.com,2015-02-22T10:22:04.053Z,499,1153,These DLLs contain logically organized Concepts and constitute Fozzy Ontological Pyramid.,Fozzy.Ontology,False,2016-12-07T02:40:45.55-08:00,True,False,Fozzy Pyramid of Business Concepts,"Semantic,API",8867,False,1.2.3.13
"Microsoft,Anton Nikolaev",2015-02-21T23:08:57.437Z,43209,1154,"PLEASE NOTE THIS PACKAGE IS NOT OFFICIAL. It contains MODIFIED version of System.IO.Pipes from .NETCore (https://github.com/dotnet/corefx) to allow using it in the apps targetting .NET4.

Provides a means for interprocess communication through anonymous and/or named pipes.

Commonly Used Types:
System.IO.Pipes.NamedPipeServerStream
System.IO.Pipes.PipeDirection
System.IO.Pipes.PipeOptions
System.IO.Pipes.PipeTransmissionMode
System.IO.Pipes.NamedPipeClientStream
System.IO.Pipes.PipeStream",CoreFx.System.IO.Pipes,False,1899-12-31T16:00:00-08:00,False,False,Provides a means for interprocess communication through anonymous and/or named pipes.,"pipes,system.io.pipes,corefx,ipc",-1,False,1.0.0
James Willock,2015-02-21T17:28:14.323Z,45,1154,Dragable and tearable tab control for WPF,Dragablz,False,2018-03-06T18:41:40.23+00:00,True,False,,"WPF,TabControl,Tab,Tearable",104987,False,0.0.0.100
Steven Luu,2014-06-01T02:13:47.327Z,43209,1419,Key value store backed by ADO.NET,Nkv,False,1899-12-31T16:00:00-08:00,False,False,,nkv,3856,False,1.1.79
Paul Jenkins; Jake Ginnivan; Brendan Forster (shiftkey); Alex Mitchell (Amrykid); Dennis Daume (flagbug); Jan Karger (punker76),2015-02-21T22:25:32.5Z,38,1154,"The goal of MahApps.Metro is to allow devs to quickly and easily cobble together a ""Metro"" or ""Modern"" UI for their WPF4+ apps, with minimal effort.",MahApps.Metro,True,2018-03-13T22:31:08.54+00:00,True,False,"The goal of MahApps.Metro is to allow devs to quickly and easily cobble together a ""Metro"" or ""Modern"" UI for their WPF4+ apps, with minimal effort.","WPF,UI,Metro",1280769,True,1.0.1-ALPHA070
Jaykumar K Daftary,2015-02-19T19:28:00.01Z,1150,1156,Incremental Loading with ObservableCollection and ObservableList for WINRT projects,JISoft.Collections,False,2015-02-25T10:03:05.307-08:00,True,False,Incremental Loading or Lazyloading with ListView and GridView in Windows 8.1 and Windows phone 8.1 (Runtime apps only),"ISupportIncrementalLoading,Collection,with,LazyLoading,support,for,Windows,Phone,8.1,ObservableCollection,ObservableList",2271,False,1.0.0.4
Sylvain PONTOREAU,2015-02-21T12:07:06.8Z,1154,1154,PowerBI Api client Active Directory Azure Library,PowerBI.Api.Client.ADAL.PCL,True,2015-02-21T04:07:06.8-08:00,True,False,,PowerBI,618,False,1.0.1-alpha
Mogens Heller Grabe,2015-02-21T22:46:23.907Z,309,1154,Entity Framework-based view manager for d60 event sourcing + cqrs kit,d60.Cirqus.EntityFramework,False,2017-06-14T22:32:11.503-07:00,True,False,,,22298,False,0.55.2
bryan.arendt,2015-02-21T23:13:52.66Z,43209,1154,The setup for the MVC layer,OrangeOnion.MVC,False,1899-12-31T16:00:00-08:00,False,False,,,-1,False,1.0.0.10
SharpSvn Project,2014-10-16T08:58:11.607Z,213,1282,"SharpSvn is a binding of the Subversion Client API for .NET based on the Subversion 1.9-alpha. This is the x86/32-bit version, See SharpSvn.1.9-x64 for the 64 bit version.",SharpSvn.1.9-x86,False,2017-09-19T12:10:39.407+00:00,True,False,,"Subversion,Svn,SharpSvn",32613,False,1.8991.3359.105
Corrado Cavalli,2014-09-03T17:03:14.513Z,43209,1325,Porting of Blend behaviors core infrastructure to Xamarin Forms,Xamarin.Forms.Behaviors,False,1899-12-31T16:00:00-08:00,False,False,Behaviors for Xamarin Forms,"Xamarin,Behaviors",-1,False,1.0.0
Jason Jarrett,2015-02-22T02:03:37.27Z,618,1153,TypeScript Definitions (d.ts) for page. Generated based off the DefinitelyTyped repository [git commit: 8e85bba87a8c95c7f357e78e3d5d1269c337741d]. http://github.com/DefinitelyTyped,page.TypeScript.DefinitelyTyped,False,2016-08-10T15:01:11.823-07:00,True,False,,"TypeScript,JavaScript",1347,False,0.0.3
Thomas Levesque,2015-02-21T18:43:58.807Z,395,1154,A set of helper and extension methods to complement the System.Linq namespace.,Linq.Extras,False,2017-03-21T02:33:31.72-07:00,True,False,,linq,13098,False,1.0.2
Anshoo Arora,2015-02-21T17:04:49.397Z,1096,1154,"NUnitOrange creates masonry style HTML reports for NUnit. Its a simple Console application that creates easy to use, attractive dashboard. It shows the XML output from NUnit in a presentable manner with charts, graphs and tables.",NUnitOrange,False,2015-04-20T10:55:45.5-07:00,True,False,,"NUnit,Report,HTML,Orange",5773,False,1.2.0
"ejsmith,bniemyjski",2015-02-21T22:42:19.283Z,141,1154,Pluggable foundation blocks for building distributed apps.,Foundatio,False,2017-11-30T14:31:02.107+00:00,True,False,,"Queue,Messaging,Message,Bus,Locking,Lock,Distributed,File,Storage,Blob,Jobs,Metrics,Stats,Azure,Redis,StatsD",99666,True,1.0.0
SEEK Ltd.,2015-02-22T10:57:18.413Z,995,1153,Custom DSC Resources for networking administration,seek-dsc-networking,True,2015-07-30T06:10:03.163-07:00,True,False,,"admin,DSC",17675,False,1.0.0.86-master
SEEK Ltd.,2015-01-31T10:44:50.38Z,995,1175,Custom DSC Resources for managing TopShelf services,seek-dsc-topshelf,True,2015-07-30T06:11:57.597-07:00,True,False,,"admin,DSC",16620,False,1.0.82-master
Ezaurum,2015-02-21T10:40:14.137Z,1055,1154,dapper auto generated repository extension,Ezaurum.Dapper,False,2015-05-31T15:51:50.97-07:00,True,False,,dapper,5902,False,0.0.1.5
bryan.arendt,2015-02-21T18:30:47.847Z,43209,1154,The setup for the MVC layer,OrangeOnion.MVC,False,1899-12-31T16:00:00-08:00,False,False,,,-1,False,1.0.0.4
"Microsoft,cabeln",2015-02-22T00:54:54.64Z,591,1153,This package adds the SDK library for Microsoft Dynamics Marketing 2015 to your project.,Microsoft.Dynamics.Marketing.SDK.library,False,2016-09-06T15:13:36.3-07:00,True,False,,"Dynamics,Marketing,2015,SDK",5147,True,17.0.3709.2
Ryan Milligan,2015-02-22T00:24:48.223Z,1139,1153,A .NET portable library for interacting with Run Keeper's HealthGraph web services.,RunKeeper.NET,False,2015-03-07T16:22:13.37-08:00,True,False,,"RunKeeper,HealthGraph",553,False,1.0.1
SEEK Ltd.,2015-01-31T10:43:04.933Z,995,1175,Custom DSC Resources for message queue administration,seek-dsc-messagequeue,True,2015-07-30T06:09:19.563-07:00,True,False,,"admin,DSC",15844,False,1.0.82-master
T-Alex Software,2015-02-21T20:55:25.457Z,25,1154,T-Alex MathCore.SpecialFunctions Library,TAlex.MathCore.SpecialFunctions,False,2018-03-26T02:29:25.657+00:00,True,False,,"Math,MathCore,Mathematica,Special,Functions,Error,Function,ERF",534,False,1.1.1
Mogens Heller Grabe,2015-02-21T22:49:33.63Z,309,1154,SQLite event store for d60 event sourcing + cqrs kit,d60.Cirqus.SQLite,False,2017-06-14T22:33:31.38-07:00,True,False,,,21821,False,0.55.2
acraven,2015-02-22T02:08:32.517Z,1106,1153,A Castle Windsor implementation of the IoC resolver used in Atlas.ServiceBus,Atlas.ServiceBus.Resolver.Windsor,False,2015-04-10T14:44:46.637-07:00,True,False,,"ServiceBus,Publish,Subscribe,Castle,Windsor,IoC",2448,False,0.0.54
www.homethic.com,2015-02-22T09:08:10.277Z,664,1153,Fozzy Skin is an Interface with the Presentation Layer,Fozzy.Skin,False,2016-06-24T23:38:52.037-07:00,True,False,Fozzy Skin is an Interface with the Presentation Layer,"Semantic,API",16628,False,1.2.3.12
bryan.arendt,2015-02-21T19:46:13.457Z,43209,1154,The setup for the MVC layer,OrangeOnion.MVC,False,1899-12-31T16:00:00-08:00,False,False,,,-1,False,1.0.0.7
Tim Abell,2015-02-21T22:45:18.887Z,976,1154,"Entity Framework 6.1 Enum Lookup-Table Generator

			Creates lookup tables and foreign key constraints based on the enums used in your model.

			This makes up for a feature that's missing in Entity Framework 6.1.

			See the project site on github at http://github.com/timabell/ef-enum-to-lookup for usage and more information.

			Please report any issues you encounter here: https://github.com/timabell/ef-enum-to-lookup/issues",ef-enum-to-lookup,True,2015-08-18T01:00:24.663-07:00,True,False,"Entity Framework 6.1 Enum Lookup-Table Generator

			Creates lookup tables and foreign key constraints based on the enums used in your model.",,36627,False,1.5.0-beta
Masanori Onoue(@ugaya40),2015-02-21T13:08:42.507Z,1149,1154,"Simple Flow Control Library with Rx(Reactive Extensions).
MIT License.",RxFlow,False,2015-02-26T04:28:18.683-08:00,True,False,"Simple Flow Control Library with Rx(Reactive Extensions).
MIT License.","Reactive,Extensions,Rx",817,False,0.1.20150222
SEEK Ltd.,2015-01-31T11:10:08.383Z,995,1175,Custom DSC Resources for managing NServiceBus services,seek-dsc-nservicebus,True,2015-07-30T06:10:46.33-07:00,True,False,,"admin,DSC",15138,False,1.0.83-issue-21
acraven,2015-02-22T02:16:06.9Z,1106,1153,A simple publish/subscribe service bus contract,Atlas.ServiceBus,False,2015-04-10T14:43:09.957-07:00,True,False,,"ServiceBus,Publish,Subscribe",5445,False,0.0.55
Mogens Heller Grabe,2015-02-21T22:47:16.683Z,309,1154,NLog integration for Cirqus,d60.Cirqus.NLog,False,2017-06-14T22:32:50.753-07:00,True,False,,,28364,False,0.55.2
CapableObjects,2015-02-22T06:43:44.287Z,2,1153,Descr,EcoWebProviders,False,2018-04-18T02:39:04.713+00:00,True,False,,"ModelDrivenDevelopment,ECO,CapableObjects",116695,False,7.0.0.7662
