authors,created,days_abandoned,days_alive,description,id,is_prerelease,last_updated,listed,missing_info,summary,tags,total_downloads,verified,version
Intersoft Solutions,2016-08-03T09:21:16.837Z,7,625,"Provides powerful data access components to WebAPI server featuring OData 4 extended implementation, view projection technology, two-way data synchronization and seamless integration with Entity Framework. For the client counterpart, please install Intersoft.AppFramework package.",Intersoft.Data.WebApi.v4,False,2018-04-13T08:36:09.34+00:00,True,False,,"Intersoft,Data,WebAPI,Server,Controller,Components,OData,Synchronization,EF,Entity,Framework",42549,False,5.0.5000.704
Intersoft Solutions,2016-08-03T09:21:07.687Z,7,625,"Provides a comprehensive charting data visualization suite featuring 12+ series, smooth animations, intuitive pinch-to-zoom, and beautiful modern design. Supports iOS and Android platforms.",Intersoft.Crosslight.UI.DataVisualization,False,2018-04-13T08:35:53.54+00:00,True,False,,"Intersoft,Crosslight,UI,User,Interface,Data,Visualization,Reporting,Charting,Components,iOS,Android,Xamarin",46407,False,5.0.5000.704
Intersoft Solutions,2016-08-03T09:20:56.99Z,7,625,Provides UI components tailored specifically for Material Design that works on Android API 21 and above.,Intersoft.Crosslight.UI.Android.v7,False,2018-04-13T08:35:37.98+00:00,True,False,,"Intersoft,Crosslight,UI,User,Interface,Components,Android,Material,Xamarin,v7",43124,False,5.0.5000.704
Intersoft Solutions,2016-08-03T09:20:47.4Z,7,625,"Provides a multitude of essential UI components for Crosslight development including Calendar, Map, Carousel, Signature Pad, and much more. Supports iOS and Android platforms.",Intersoft.Crosslight.UI,False,2018-04-13T08:35:22.697+00:00,True,False,,"Intersoft,Crosslight,UI,User,Interface,Components,Cross-Platform,iOS,Android,Xamarin",45017,False,5.0.5000.704
Intersoft Solutions,2016-08-03T09:20:37.2Z,7,625,"Provides extended capabilities to share and authenticate users with social network accounts, including Facebook and Twitter.",Intersoft.Crosslight.Services.Social,False,2018-04-13T08:34:02.38+00:00,True,False,,"Intersoft,Crosslight,Services,Social,Network,Facebook,Twitter,PCL,iOS,Android,Xamarin,Portable,Class,Library",47357,False,5.0.5000.704
Intersoft Solutions,2016-08-03T09:20:27.133Z,7,625,"Provides report viewer components for Crosslight development, featuring seamless integration with Intersoft ClientUI Reporting Server.",Intersoft.Crosslight.Services.Reporting,False,2018-04-13T08:33:46.397+00:00,True,False,,"Intersoft,Crosslight,Services,Reporting,Report,Viewer,PCL,Portable,Class,Library,Server,ClientUI",44944,False,5.0.5000.704
Intersoft Solutions,2016-08-03T09:20:16.97Z,7,625,"Provides end-to-end push messaging functionality to your Crosslight apps. Supports iOS, Android and Windows for the client platforms and .NET 4.5 for the server platforms.",Intersoft.Crosslight.Services.PushNotification,False,2018-04-13T08:33:30.723+00:00,True,False,,"Intersoft,Crosslight,Services,Push,Notification,PNS,PushNotification,Client,Server,PCL,Portable,Class,Library,iOS,Android,WinPhone,WindowsPhone,Phone,Xamarin",45998,False,5.0.5000.704
Intersoft Solutions,2016-08-03T09:20:07.623Z,7,625,Provides GPS location services for Crosslight development.,Intersoft.Crosslight.Services.Location,False,2018-04-13T08:33:15.52+00:00,True,False,,"Intersoft,Crosslight,Services,Location,PCL,Portable,Class,Library,GPS,iOS,Android,Xamarin,Cross-Platform",42745,False,5.0.5000.704
Intersoft Solutions,2016-08-03T09:19:58.903Z,7,625,"Provides high-performance, async image loading capabilities to your Crosslight apps, featuring smart queue, smooth animation, and various cache options.",Intersoft.Crosslight.Services.ImageLoader,False,2018-04-13T08:33:01.52+00:00,True,False,,"Intersoft,Crosslight,Services,ImageLoader,Image,Loader,Cross-Platform,PCL,Portable,Class,Library",45398,False,5.0.5000.704
Intersoft Solutions,2016-08-03T09:19:49.633Z,7,625,Provides barcode scanning capabilities to your Crosslight apps.,Intersoft.Crosslight.Services.Barcode,False,2018-04-13T08:32:46.767+00:00,True,False,,"Intersoft,Crosslight,Services,Barcode,Scanner,Reader,Cross-Platform,PCL,Portable,Class,Library,iOS,Android,Xamarin",44914,False,5.0.5000.704
Intersoft Solutions,2016-08-03T09:19:36.917Z,7,625,"Provides various authenticators for user authentication in Crosslight apps, including HttpBasic, NTLM, OAuth, OAuth2, and WebAPI authenticator.",Intersoft.Crosslight.Services.Auth,False,2018-04-13T08:32:30.877+00:00,True,False,,"Intersoft,Crosslight,Services,Auth,Authentication,User,HttpBasic,NTLM,OAuth,OAuth2,WebAPI,Authenticator",46074,False,5.0.5000.704
Intersoft Solutions,2016-08-03T09:19:27.157Z,7,625,Provides a powerful yet lightweight Rest client to access remote resources in Crosslight apps.,Intersoft.Crosslight.RestClient,False,2018-04-13T08:32:16.267+00:00,True,False,,"Intersoft,Crosslight,Data,Access,Rest,RestClient,Cross-Platform,PCL,Portable,Class,Library,Client,Server,Mobile",46216,False,5.0.5000.704
Intersoft Solutions,2016-08-03T09:19:18.11Z,7,625,Provides server logging functionality that use Entity Framework for the storage.,Intersoft.Crosslight.Logging.EntityFramework,False,2018-04-13T08:32:00.563+00:00,True,False,,"Intersoft,Crosslight,Logging,Entity,Framework,EF,PCL,Portable,Class,Library,Log",43620,False,5.0.5000.704
Intersoft Solutions,2016-08-03T09:19:08.3Z,7,625,"Provides seamless logging integration to Microsoft Azure Insights service, including page view and error logs. Supports all client and server platforms.",Intersoft.Crosslight.Logging.AzureInsights,False,2018-04-13T08:31:47.453+00:00,True,False,,"Intersoft,Crosslight,Logging,Azure,Insights,Microsoft,PCL,Server,Portable,Class,Library",44140,False,5.0.5000.704
Sensorberg GmbH,2016-08-03T09:18:56.863Z,583,625,The Sensorberg SDK allows you app to detect beacons and use the sensorberg API to enable proximity responses in your Windows10 application.,SensorbergSDK,True,2016-09-14T04:01:49.813-07:00,True,False,The Sensorberg SDK allows you app to detect beacons and use the sensorberg API to enable proximity responses in your Windows10 application.,"iBeacon,beacon,bluetooth,btle,offline,sensorberg,iot",2898,False,1.0.82-beta
Intersoft Solutions,2016-08-03T09:18:58.993Z,7,625,Provides powerful yet lightweight logging functionality to your Crosslight apps. Supports all client and server platforms.,Intersoft.Crosslight.Logging,False,2018-04-13T08:31:33.157+00:00,True,False,,"Intersoft,Crosslight,Logging,Log,Xamarin,iOS,Android,WinPhone,Windows,Phone,Client,Server,PCL,Portable,Class,Library",45017,False,5.0.5000.704
Intersoft Solutions,2016-08-03T09:18:48.377Z,7,625,Provides local database access components and offline changes functionality to your Crosslight apps.,Intersoft.Crosslight.Data.Sqlite,False,2018-04-13T08:31:18+00:00,True,False,,"Intersoft,Crosslight,Data,Sqlite,Cross-Platform,Access,Database,Sqllite",47647,False,5.0.5000.704
Intersoft Solutions,2016-08-03T09:18:04.267Z,7,625,Provides essential data components to your Crosslight apps.,Intersoft.Crosslight.Data,False,2018-04-13T08:30:59.497+00:00,True,False,,"Intersoft,Crosslight,Data,Access,Components,Cross-Platform,PCL,Portable,Class,Library",46791,False,5.0.5000.704
Intersoft Solutions,2016-08-03T09:17:43.54Z,7,625,"Crosslight is an advanced development toolset for building rich cross-platform mobile applications with 100% shared UI logic. Supported platforms include iOS, Android, and Windows.",Intersoft.Crosslight,False,2018-04-13T08:30:28.573+00:00,True,False,,"Intersoft,Crosslight,MVVM,iOS,Android,WindowsPhone,WinPhone,Windows,Xamarin,Cross-Platform,Mobile",54072,False,5.0.5000.704
Intersoft Solutions,2016-08-03T09:17:54.63Z,7,625,"Supercharge your Crosslight.Android apps with 50+ Material components including Collapsible ToolBar, RecycleView with built-in Shared Transition and Swipe gesture, Parallax Header and much more. Supports Android API 21 or higher.",Intersoft.Crosslight.Android.v7,False,2018-04-13T08:30:45.327+00:00,True,False,,"Intersoft,Crosslight,Android,Material,Components,Xamarin,v7",46455,False,5.0.5000.704
Intersoft Solutions,2016-08-03T09:17:23.857Z,7,625,"An advanced application framework designed to make enterprise apps development simple, featuring enterprise data access patterns such as generic repositories, query definitions, user management, authentication, security, push notifications, and more. For the server data access counterpart, please install Intersoft.Data.WebApi.v4 package.",Intersoft.AppFramework,False,2018-04-13T08:30:10.917+00:00,True,False,,"Intersoft,AppFramework,Application,Framework,Enterprise,Security,Query,Definitions,User,Management,Authentication,Push,Notification,PNS,Server,Client,WebAPI,Data,Portable,Class,Library,PCL,Mobile",45845,False,5.0.5000.704
"Imulus - Kevin Giszewski - Tom Fulton - Jeavon Leopold - Bjarne Fyrstenborg,Et. Al.",2016-08-03T09:17:03.25Z,542,625,UrlPicker for V7,UrlPicker,False,2016-10-25T02:23:25.493-07:00,True,False,,,17493,False,0.16.0
patagames.com,2016-08-03T09:12:16.983Z,4,625,"Pdfium.NET SDK it's a class library based on the PDFium project for viewing, text extracting, navigating and editing PDF files in your .NET projects.",Pdfium.Net.SDK,False,2018-04-16T05:15:24.21+00:00,True,False,"Pdfium.NET SDK it's a class library based on the PDFium project for viewing, text extracting, navigating and editing PDF files in your .NET projects.","WPF,PDF,Viewer,C#,Pdfium,Pdfium.Net,.Net,c#,VB,render,renderer,viewer",43717,False,2.18.2
patagames.com,2016-08-03T09:12:16.983Z,4,625,"Pdfium.NET SDK it's a class library based on the PDFium project for viewing, text extracting, navigating and editing PDF files in your .NET projects.",Pdfium.Net.SDK,False,2018-04-16T05:15:24.21+00:00,True,False,"Pdfium.NET SDK it's a class library based on the PDFium project for viewing, text extracting, navigating and editing PDF files in your .NET projects.","WPF,PDF,Viewer,C#,Pdfium,Pdfium.Net,.Net,c#,VB,render,renderer,viewer",43717,False,2.18.2
grabacr.net,2016-08-03T09:11:09.003Z,622,625,C# wrapper for IVirtualDesktopManager on Windows 10. You need to include the app manifest in your project so as to target Windows 10.,VirtualDesktop,True,2016-08-06T11:36:54.42-07:00,True,False,,"Windows,Windows10,Desktop,VirtualDesktop",2405,False,2.0.0-beta
grabacr.net,2016-08-03T09:11:16.277Z,622,625,C# wrapper for IVirtualDesktopManager on Windows 10.,VirtualDesktop.WPF,True,2016-08-06T11:37:00.397-07:00,True,False,,"Windows,Windows10,Desktop,VirtualDesktop,WPF",1325,False,2.0.0-beta
simon,2016-08-03T09:05:39.853Z,186,625,"Convertor数据类型转换类
DataVerify数据验证类
DataTimeHelper时间工具类
ReflectHelper对象反射数据类",AASV.DataConvert,False,2017-10-16T03:55:49.943+00:00,True,False,,,9435,False,1.0.18
Iamport.RestApi,2016-08-03T08:56:41.113Z,12,625,Iamport.RestApi .NET Client,Iamport.RestApi,False,2018-04-08T12:57:40.927+00:00,True,False,,"I'mport,아임포트,iamport",880,False,1.0.0
Dapplo,2016-08-03T09:02:58.287Z,43,625,Dapplo.Utils contains a lot of utilities which are used throughout Dapplo code.,Dapplo.Utils,False,2018-03-08T10:22:01.743+00:00,True,False,"LockAsync, string and type extensions and more",utils,15677,True,0.1.93
vitaly.vasilega@deleteagency.com,2016-08-03T08:59:22.823Z,206,625,"uTaxonomy – it's a property editor for Umbraco 7.x, allowing to select elements from pre-defined hierarchy (taxonomy).",Delete.uTaxonomy,False,2017-09-26T10:22:39.12+00:00,True,False,,"Umbraco,Backoffice,extensions,Taxonomy",1047,False,1.0.0
"Xamarin,Inc.",2016-08-03T08:54:14.38Z,15,625,Maps models and renderers for Xamarin.Forms,Xamarin.Forms.Maps,False,2018-04-05T23:07:44.773+00:00,True,False,,"xamarin,forms,maps,xamarinforms,xamarinformsmaps,xamarin.forms.maps",655044,True,2.3.1.114
Xamarin Inc.,2016-08-03T08:53:57.917Z,15,625,Add support for deep linking and indexing app content using Xamarin.Forms on the Android Platform,Xamarin.Forms.AppLinks,False,2018-04-05T23:07:28.553+00:00,True,False,,"xamarin,forms,applinks,xamarinforms,xamarin.forms",42013,True,2.3.1.114
Xamarin Inc.,2016-08-03T08:53:24.013Z,15,625,"Build native UIs for iOS, Android, and Windows Phone from a single, shared C# codebase",Xamarin.Forms,False,2018-04-05T23:07:12.977+00:00,True,False,,"xamarin,forms,xamarinforms,xamarin.forms",4930921,True,2.3.1.114
Iamport.RestApi,2016-08-03T08:56:41.113Z,12,625,Iamport.RestApi .NET Client,Iamport.RestApi,False,2018-04-08T12:57:40.927+00:00,True,False,,"I'mport,아임포트,iamport",880,False,1.0.0
"Xamarin,Inc.",2016-08-03T08:54:14.38Z,15,625,Maps models and renderers for Xamarin.Forms,Xamarin.Forms.Maps,False,2018-04-05T23:07:44.773+00:00,True,False,,"xamarin,forms,maps,xamarinforms,xamarinformsmaps,xamarin.forms.maps",655044,True,2.3.1.114
Xamarin Inc.,2016-08-03T08:53:24.013Z,15,625,"Build native UIs for iOS, Android, and Windows Phone from a single, shared C# codebase",Xamarin.Forms,False,2018-04-05T23:07:12.977+00:00,True,False,,"xamarin,forms,xamarinforms,xamarin.forms",4930921,True,2.3.1.114
Xamarin Inc.,2016-08-03T08:53:57.917Z,15,625,Add support for deep linking and indexing app content using Xamarin.Forms on the Android Platform,Xamarin.Forms.AppLinks,False,2018-04-05T23:07:28.553+00:00,True,False,,"xamarin,forms,applinks,xamarinforms,xamarin.forms",42013,True,2.3.1.114
elmah.io,2016-04-24T18:00:00.32Z,43209,726,elmah.io provider for Microsoft.Framework.Logging,Elmah.Io.Framework.Logging,True,1900-01-01T00:00:00+00:00,False,False,,"Error,Exception,Reporing,Management,Logging,ELMAH,Diagnostics,Tracing",-1,False,1.0.19-beta
elmah.io,2015-08-11T06:20:49.157Z,43209,983,elmah.io provider for Microsoft.Framework.Logging,Elmah.Io.Framework.Logging,True,1900-01-01T00:00:00+00:00,False,False,,,-1,False,1.0.18-beta
Mailcloud,2016-08-03T08:51:31.06Z,617,625,Sharding library for Azure Storage optimised for multithreading.,Mailcloud.Hydra.Core,False,2016-08-11T19:04:23.003+00:00,True,False,,"Azure,Table,Storage,Shard,Sharding",4702,False,1.0.0.105
,,-1,-1,,FactSet.Fundamentals.Utility,,,,True,,,,,1.0.0
TechCello,2016-08-03T08:51:23.79Z,508,625,SaaS Multi tenant Framework for SaaS Development and SaaS Migration. SaaS Application Development Platform addressing SaaS Challenges and  SaaS Non-Functional Requirements,CelloSaaS.Billing,True,2016-11-28T14:00:37.123+00:00,True,False,SaaS Multi tenant Framework for SaaS Development and SaaS Migration. SaaS Application Development Platform addressing SaaS Challenges and  SaaS Non-Functional Requirements,"SaaS,Multi,tenant,Framework,Development,Migration,Application,Platform,Challenges,Non-Functional,Requirements,Multi-Tenant,Enablement,Tenant,Architecture",50203,False,4.6.1-beta1
Steamcore,2016-08-03T08:51:15.897Z,404,625,Command line tool for detecting inconsistencies in Visual Studio project files.,VSLint,False,2017-03-12T08:47:04.77-07:00,True,False,,"visualstudio,csproj,fsproj,vbproj",806,False,1.0.2
TechCello,2016-08-03T08:50:52.283Z,508,625,SaaS Multi tenant Framework for SaaS Development and SaaS Migration. SaaS Application Development Platform addressing SaaS Challenges and  SaaS Non-Functional Requirements,CelloSaaS.Core,True,2016-11-28T14:01:40.453+00:00,True,False,SaaS Multi tenant Framework for SaaS Development and SaaS Migration. SaaS Application Development Platform addressing SaaS Challenges and  SaaS Non-Functional Requirements,"SaaS,Multi,tenant,Framework,Development,Migration,Application,Platform,Challenges,Non-Functional,Requirements,Multi-Tenant,Enablement,Tenant,Architecture",48733,False,4.6.1-beta1
TechCello,2016-08-03T08:50:09.29Z,625,625,SaaS Multi tenant Framework for SaaS Development and SaaS Migration. SaaS Application Development Platform addressing SaaS Challenges and  SaaS Non-Functional Requirements,CelloSaaS.Framework.Dependencies,True,2016-08-03T14:40:17.337+00:00,True,False,ysSaaS Multi tenant Framework for SaaS Development and SaaS Migration. SaaS Application Development Platform addressing SaaS Challenges and  SaaS Non-Functional Requirements,"SaaS,Multi,tenant,Framework,Development,Migration,Application,Platform,Challenges,Non-Functional,Requirements,Multi-Tenant,Enablement,Tenant,Architecture",46291,False,4.6.1-beta1
elmah.io,2015-08-11T06:20:49.157Z,43209,983,elmah.io provider for Microsoft.Framework.Logging,Elmah.Io.Framework.Logging,True,1900-01-01T00:00:00+00:00,False,False,,,-1,False,1.0.18-beta
elmah.io,2016-04-24T18:00:00.32Z,43209,726,elmah.io provider for Microsoft.Framework.Logging,Elmah.Io.Framework.Logging,True,1900-01-01T00:00:00+00:00,False,False,,"Error,Exception,Reporing,Management,Logging,ELMAH,Diagnostics,Tracing",-1,False,1.0.19-beta
TechCello,2016-08-03T08:49:46.46Z,508,625,SaaS Multi tenant Framework for SaaS Development and SaaS Migration. SaaS Application Development Platform addressing SaaS Challenges and  SaaS Non-Functional Requirements,CelloSaaS.License,True,2016-11-28T14:04:21.407+00:00,True,False,SaaS Multi tenant Framework for SaaS Development and SaaS Migration. SaaS Application Development Platform addressing SaaS Challenges and  SaaS Non-Functional Requirements,"SaaS,Multi,tenant,Framework,Development,Migration,Application,Platform,Challenges,Non-Functional,Requirements,Multi-Tenant,Enablement,Tenant,Architecture",50953,False,4.6.1-beta1
TechCello,2016-08-03T08:49:26.78Z,508,625,SaaS Multi tenant Framework for SaaS Development and SaaS Migration. SaaS Application Development Platform addressing SaaS Challenges and  SaaS Non-Functional Requirements,CelloSaaS.Plumbing,True,2016-11-28T14:04:44.173+00:00,True,False,SaaS Multi tenant Framework for SaaS Development and SaaS Migration. SaaS Application Development Platform addressing SaaS Challenges and  SaaS Non-Functional Requirements,"SaaS,Multi,tenant,Framework,Development,Migration,Application,Platform,Challenges,Non-Functional,Requirements,Multi-Tenant,Enablement,Tenant,Architecture",49656,False,4.6.1-beta1
TechCello,2016-08-03T08:48:47.42Z,508,625,SaaS Multi tenant Framework for SaaS Development and SaaS Migration. SaaS Application Development Platform addressing SaaS Challenges and  SaaS Non-Functional Requirements,CelloSaaS.Utils,True,2016-11-28T06:06:10.437-08:00,True,False,SaaS Multi tenant Framework for SaaS Development and SaaS Migration. SaaS Application Development Platform addressing SaaS Challenges and  SaaS Non-Functional Requirements,"SaaS,Multi,tenant,Framework,Development,Migration,Application,Platform,Challenges,Non-Functional,Requirements,Multi-Tenant,Enablement,Tenant,Architecture",51901,False,4.6.1-beta1
TechCello,2016-08-03T08:49:06.83Z,508,625,SaaS Multi tenant Framework for SaaS Development and SaaS Migration. SaaS Application Development Platform addressing SaaS Challenges and  SaaS Non-Functional Requirements,CelloSaaS.Reporting,True,2016-11-28T14:05:02.687+00:00,True,False,SaaS Multi tenant Framework for SaaS Development and SaaS Migration. SaaS Application Development Platform addressing SaaS Challenges and  SaaS Non-Functional Requirements,"SaaS,Multi,tenant,Framework,Development,Migration,Application,Platform,Challenges,Non-Functional,Requirements,Multi-Tenant,Enablement,Tenant,Architecture",51705,False,4.6.1-beta1
TechCello,2016-08-03T08:48:09.75Z,508,625,SaaS Multi tenant Framework for SaaS Development and SaaS Migration. SaaS Application Development Platform addressing SaaS Challenges and  SaaS Non-Functional Requirements,CelloSaaS.Web,True,2016-11-28T14:07:02.83+00:00,True,False,ysSaaS Multi tenant Framework for SaaS Development and SaaS Migration. SaaS Application Development Platform addressing SaaS Challenges and  SaaS Non-Functional Requirements,"SaaS,Multi,tenant,Framework,Development,Migration,Application,Platform,Challenges,Non-Functional,Requirements,Multi-Tenant,Enablement,Tenant,Architecture",56805,False,4.6.1-beta1
TechCello,2016-08-03T08:48:28.203Z,508,625,SaaS Multi tenant Framework for SaaS Development and SaaS Migration. SaaS Application Development Platform addressing SaaS Challenges and  SaaS Non-Functional Requirements,CelloSaaS.Workflow,True,2016-11-28T14:07:22.33+00:00,True,False,SaaS Multi tenant Framework for SaaS Development and SaaS Migration. SaaS Application Development Platform addressing SaaS Challenges and  SaaS Non-Functional Requirements,"SaaS,Multi,tenant,Framework,Development,Migration,Application,Platform,Challenges,Non-Functional,Requirements,Multi-Tenant,Enablement,Tenant,Architecture",60173,False,4.6.1-beta1
TechCello,2016-08-03T08:47:45.5Z,508,625,SaaS Multi tenant Framework for SaaS Development and SaaS Migration. SaaS Application Development Platform addressing SaaS Challenges and  SaaS Non-Functional Requirements,CelloSaaS.Engines,True,2016-11-28T14:02:58.517+00:00,True,False,SaaS Multi tenant Framework for SaaS Development and SaaS Migration. SaaS Application Development Platform addressing SaaS Challenges and  SaaS Non-Functional Requirements,"SaaS,Multi,tenant,Framework,Development,Migration,Application,Platform,Challenges,Non-Functional,Requirements,Multi-Tenant,Enablement,Tenant,Architecture",48088,False,4.6.1-beta1
TechCello,2016-08-03T08:47:02.81Z,508,625,SaaS Multi tenant Framework for SaaS Development and SaaS Migration. SaaS Application Development Platform addressing SaaS Challenges and  SaaS Non-Functional Requirements,CelloSaaS.BusinessService,True,2016-11-28T14:01:06.733+00:00,True,False,SaaS Multi tenant Framework for SaaS Development and SaaS Migration. SaaS Application Development Platform addressing SaaS Challenges and  SaaS Non-Functional Requirements,"SaaS,Multi,tenant,Framework,Development,Migration,Application,Platform,Challenges,Non-Functional,Requirements,Multi-Tenant,Enablement,Tenant,Architecture",57736,False,4.6.1-beta1
TechCello,2016-08-03T08:47:21.44Z,508,625,SaaS Multi tenant Framework for SaaS Development and SaaS Migration. SaaS Application Development Platform addressing SaaS Challenges and  SaaS Non-Functional Requirements,CelloSaaS.DAL,True,2016-11-28T14:02:16.86+00:00,True,False,SaaS Multi tenant Framework for SaaS Development and SaaS Migration. SaaS Application Development Platform addressing SaaS Challenges and  SaaS Non-Functional Requirements,"SaaS,Multi,tenant,Framework,Development,Migration,Application,Platform,Challenges,Non-Functional,Requirements,Multi-Tenant,Enablement,Tenant,Architecture",58174,False,4.6.1-beta1
TechCello,2016-08-03T08:46:40.883Z,508,625,SaaS Multi tenant Framework for SaaS Development and SaaS Migration. SaaS Application Development Platform addressing SaaS Challenges and  SaaS Non-Functional Requirements,CelloSaaS.ExternalDlls,True,2016-11-28T14:03:46.36+00:00,True,False,SaaS Multi tenant Framework for SaaS Development and SaaS Migration. SaaS Application Development Platform addressing SaaS Challenges and  SaaS Non-Functional Requirements,"SaaS,Multi,tenant,Framework,Development,Migration,Application,Platform,Challenges,Non-Functional,Requirements,Multi-Tenant,Enablement,Tenant,Architecture",57105,False,4.6.1-beta1
Christopher Loggins,2016-07-05T21:21:12.327Z,43209,654,"This extension turns AutoFixture into an Auto-Mocking Container. The mock instances are created by FakeItEasy 2.x. To use it, add the AutoFakeItEasyCustomization to your Fixture instance.",AutoFixture.AutoFakeItEasy2,False,1899-12-31T16:00:00-08:00,False,False,Turns AutoFixture into an Auto-Mocking Container based on FakeItEasy 2.x.,,-1,False,3.49.0
Christopher Loggins,2016-06-28T20:20:46.683Z,43209,661,"This extension turns AutoFixture into an Auto-Mocking Container. The mock instances are created by FakeItEasy 2.x. To use it, add the AutoFakeItEasyCustomization to your Fixture instance.",AutoFixture.AutoFakeItEasy2,False,1899-12-31T16:00:00-08:00,False,False,Turns AutoFixture into an Auto-Mocking Container based on FakeItEasy 2.x.,,-1,False,3.48.0
Christopher Loggins,2016-08-03T08:37:45.493Z,43209,625,"This extension turns AutoFixture into an Auto-Mocking Container. The mock instances are created by FakeItEasy 2.x. To use it, add the AutoFakeItEasyCustomization to your Fixture instance.",AutoFixture.AutoFakeItEasy2,False,1899-12-31T16:00:00-08:00,False,False,Turns AutoFixture into an Auto-Mocking Container based on FakeItEasy 2.x.,,-1,False,3.49.1
Accentiv' China,2016-08-01T08:23:53.04Z,43209,627,Spark Framewok for Quick Develope,Accentiv.Spark.Service,False,1899-12-31T16:00:00-08:00,False,False,,,-1,False,2.0.0
Mark Seemann,2016-08-03T08:40:06.38Z,184,625,"SemanticComparison makes it easier to compare instances of various objects to each other. Instead of performing a normal equality comparison, SemanticComparison compares objects that look semantically similar - even if they are of different types. Various fine-tuning options exist.",SemanticComparison,False,2017-10-18T11:46:37.147+00:00,True,False,,,149235,False,3.49.1
Mark Seemann,2016-08-03T08:39:42.01Z,4,625,"By leveraging the data theory feature of xUnit.net, this extension turns AutoFixture into a declarative framework for writing unit tests. In many ways it becomes a unit testing DSL (Domain Specific Language).
            For xUnit.net 2, please use the AutoFixture.Xunit2 NuGet Package.",AutoFixture.Xunit,False,2018-04-16T15:26:31.843+00:00,True,False,Extension to AutoFixture that integrates it with xUnit.net.,,255259,True,3.49.1
Mark Seemann,2016-08-03T08:39:54.85Z,4,625,"By leveraging the data theory feature of xUnit.net, this extension turns AutoFixture into a declarative framework for writing unit tests. In many ways it becomes a unit testing DSL (Domain Specific Language).",AutoFixture.Xunit2,False,2018-04-16T15:26:46.83+00:00,True,False,Extension to AutoFixture that integrates it with xUnit.net v2.,,478738,True,3.49.1
