authors,created,days_abandoned,days_alive,description,id,is_prerelease,last_updated,listed,missing_info,summary,tags,total_downloads,verified,versionDevBridge,2013-08-09T13:37:19.13Z,304,1715,Amazon S3 file storage module for BetterCMS. Better CMS is publishing focused and developer friendly .NET Open source CMS.,BetterCms.Module.AmazonS3Storage,False,2017-06-20T01:06:15.35-07:00,True,False,,,50575,False,1.2.1
Frozen Mountain Software,2013-08-10T19:48:31.173Z,48,1714,A client-side library for .NET that extends WebSync to provide location/user-based chat services. (Community Edition),FM.WebSync.Chat,False,2018-03-03T21:26:57.627+00:00,True,False,,"WebSync,Client,Chat,Extension,HTTP,Push,Comet,Reverse,Ajax,.NET",14887,False,4.3.4
Algimantas Krasauksas,2013-08-09T14:28:26.89Z,43209,1715,Simple AngularJS module structure for multiple Module include with RequireJs,Simplr.Angular.Module.Structure,False,1899-12-31T16:00:00-08:00,False,False,,Simplr,-1,False,0.0.2.2
James Craig,2013-08-10T03:14:43.31Z,782,1714,This adds SimpleInjector as the bootstrapper used by Batman.,Batman.Core.Bootstrapper.SimpleInjector,False,2016-02-28T10:34:41.38-08:00,True,False,This adds SimpleInjector as the bootstrapper used by Batman.,"batman,framework,simpleinjector",19610,False,1.0.20
Frozen Mountain Software,2013-08-10T19:48:15.21Z,48,1714,A server-side library for .NET that provides core utilities for other FM server-side libraries. (Community Edition),FM.Server,False,2018-03-03T21:25:47.003+00:00,True,False,,"FM,Server,Core,Frozen,Mountain,.NET",18230,False,2.3.4
Kristijan Horvat,2013-08-09T12:26:28.827Z,1515,1715,"MonoX is a Free ASP.NET CMS and Social Networking Platform

MonoX provides tools for quick and intuitive construction of dynamic and fully editable ASP.NET portals, social networks and similar Web applications. For more details, please download the user manual.",MonoX.CMS.Theme.Mobile,True,2014-02-25T09:21:01.857-08:00,True,False,MonoX CMS Mobile Theme package contains the mobile MonoX theme.,"MonoX,CMS,Theme,Social,Networking",7216,False,4.8.40.4697-prerelease
eXpand,2013-08-09T14:41:53.887Z,11,1715,MasterDetail Module (Win) / eXpand Framework,eXpandMasterDetailWin,False,2018-04-09T16:16:30.427+00:00,True,False,MasterDetail Module (Win) / eXpand Framework,"DevExpress,eXpand",70133,False,13.1.5.25
Frozen Mountain Software,2013-08-10T19:48:27.543Z,48,1714,A server-side library for .NET that extends WebSync to use Azure Caching as a backend message hub for horizontal scaling. (Community Edition),FM.WebSync.AzureCaching,False,2018-03-03T21:26:34.69+00:00,True,False,,"WebSync,Server,Azure,Caching,Extensions,HTTP,Push,Comet,Reverse,Ajax,.NET",14091,False,4.3.4
GeertvanHorrik,2013-08-09T13:47:40.433Z,507,1715,Catel.Extensions.Memento library which provides the memento pattern implementation as a service.,Catel.Extensions.Memento,True,2016-11-29T13:36:18.13+00:00,True,False,,"catel,memento",85548,True,3.6.1308091537-beta
eXpand,2013-08-09T14:42:20.24Z,11,1715,"Extends XAF by adding great new features for example;

◦the ability to generate runtime members for your objects, 
◦creating Application/Role/User models in the database, 
◦storing your web cookies in the database, 
◦handling of external application models, 
◦combine end user modifications with application model, 
◦support for multiple models at design time,
Blogs:
http://apobekiaris.blogspot.com/search/label/ModelDifference",eXpandModelDifferenceWeb,False,2018-04-09T16:17:21.897+00:00,True,False,Model managment,"DevExpress,eXpand",70189,False,13.1.5.25
"Sam Harwell,Terence Parr",2013-08-10T05:20:29.673Z,12,1714,"The runtime library for parsers generated by the C# target of ANTLR 3. This package supports projects targeting .NET 2.0 or newer, and built using Visual Studio 2008 or newer.",Antlr3.Runtime.Debug,True,2018-04-08T13:37:20.76+00:00,True,False,The runtime library for parsers generated by the C# target of ANTLR 3.,"antlr,antlr3,parsing",9956,True,3.5.0.3-alpha002
"Sam Harwell,Terence Parr",2013-08-10T05:21:14.197Z,12,1714,Provides the visualizer runtime for StringTemplate 4.,StringTemplate4.Visualizer,True,2018-04-08T13:39:19.043+00:00,True,False,Provides the visualizer runtime for StringTemplate 4.,"stringtemplate,st4,stringtemplate4,stviz,template",1450,True,4.0.7.2-alpha002
Willem Toerien,2013-08-09T11:16:04.707Z,43209,1715,Property Observer enables you to weave INotifyPropertyChanged interface members into your properties or types.,PropertyObserver,False,1899-12-31T16:00:00-08:00,False,False,,,-1,False,2.0.2
James Craig,2013-08-10T03:16:48.187Z,782,1714,This adds SimpleInjector as the bootstrapper used by Batman.,Batman.Core.Bootstrapper.SimpleInjector,False,2016-02-28T10:34:41.38-08:00,True,False,This adds SimpleInjector as the bootstrapper used by Batman.,"batman,framework,simpleinjector",19610,False,1.0.21
James Craig,2013-08-10T19:37:34.523Z,782,1714,This is a Glimpse addon that adds a tab containing information from the Batman framework.,Glimpse.Batman,False,2016-02-28T10:36:13.86-08:00,True,False,This is a Glimpse addon that adds a tab containing information from the Batman framework.,"batman,framework,mvc,servicestack",15116,False,1.0.24
Alexandre Mutel,2013-08-10T13:00:39.577Z,69,1714,"Assembly providing DirectX - XAudio2, X3DAudio and XAPO managed API.",SharpDX.XAudio2,False,2018-02-10T09:05:37.707+00:00,True,False,,"SharpDX,DirectX,Direct3D,MDX,XAudio2,XAPO",41758,True,2.5.0
Leon Meijer,2013-08-09T15:01:18.337Z,164,1715,Part of the Co-Console SDK. Use this package to connect to the Co-Console API.,Lucy.CoConsole.ApiClient.Actions.Win32,False,2017-11-07T08:58:35+00:00,True,False,,,8340,False,1.8.5.65
Alexandre Mutel,2013-08-10T12:39:25.057Z,69,1714,Assembly providing DirectX - DirectInput managed API.,SharpDX.DirectInput,False,2018-02-10T09:04:19.593+00:00,True,False,,"SharpDX,DirectX,Direct3D,MDX,3D,DirectInput,DInput",46453,True,2.5.0
Qsys Sverige AB,2013-08-09T14:51:27.353Z,11,1715,QuickPick Base module,QuickPick.One,False,2018-04-09T14:56:23.34+00:00,True,False,,"Apollo,Apollo13,Quickpick,Qsys",131366,False,1.0.2.38
ScottIsAFool,2013-08-10T14:00:32.59Z,1714,1714,"A PCL package for the Rotten Tomatoes API, runs on Silverlight, desktop, Windows 8, Windows Phone 7 and Windows Phone 8",RottenTomatoesPortable,False,2013-08-10T07:00:32.59-07:00,True,False,,,533,False,1.0.0
eXpand,2013-08-09T14:42:33.223Z,11,1715,NCarousel Module (Web) / eXpand Framework,eXpandNCarouselWeb,False,2018-04-09T16:18:13.867+00:00,True,False,NCarousel Module (Web) / eXpand Framework,"DevExpress,eXpand",69926,False,13.1.5.25
CapableObjects,2013-08-09T16:28:43.697Z,2,1715,Descr,EcoWindowsStore,False,2018-04-18T02:42:38.66+00:00,True,False,,"ModelDrivenDevelopment,ECO,CapableObjects",141694,False,7.0.0.6637
Jonathan Oliver,2013-08-09T12:10:36.217Z,689,1715,Additional serialization provider for NanoMessageBus based on the Newtonsoft Json.NET library.,NanoMessageBus.Json.NET,False,2016-05-31T09:43:56.373-07:00,True,False,Newtonsoft Json.NET Serializer for NanoMessageBus.,"messaging,service,bus,servicebus,nano,message,nanomessagebus,nmb,messages,newtonsoft,json,serialization,serializer",13330,False,2.0.41
Paul Betts,2013-08-10T17:01:43.747Z,1421,1714,An MVVM library for WPF and Silverlight that is deeply integrated with the Reactive Extensions,reactiveui-xaml,False,2014-05-30T11:58:31.91-07:00,True,False,,,69531,False,5.1.1
Jonathan Oliver,2013-08-09T11:46:18.95Z,689,1715,A fast and ultra-lightweight (sub-100K) general messaging library and service bus for .NET,NanoMessageBus,False,2016-05-31T09:43:32.42-07:00,True,False,,"messaging,service,bus,servicebus,nano,message,nanomessagebus,nmb,messages",13637,False,2.0.40
Frozen Mountain Software,2013-08-10T19:48:49.683Z,84,1714,A client-side library for JavaScript that extends WebSync to provide notifications when clients subscribe to or unsubscribe from a channel.,FM.WebSync.Subscribers.JS,False,2018-01-26T02:28:14.633+00:00,True,False,,"WebSync,Client,Subscribers,Extension,HTTP,Streaming,Comet,Reverse,Ajax,JavaScript",17009,False,4.3.4
GeertvanHorrik,2013-08-10T15:01:29.267Z,507,1714,"Catel.Extensions.Controls library which contains user controls, such as the StackGrid.",Catel.Extensions.Controls,True,2016-11-29T13:35:55.627+00:00,True,False,,"windows,controls,stackgrid,styles,stylehelper",170616,True,3.6.1308101652-beta
Kristijan Horvat,2013-08-09T12:26:12.53Z,1515,1715,"MonoX is a Free ASP.NET CMS and Social Networking Platform

MonoX provides tools for quick and intuitive construction of dynamic and fully editable ASP.NET portals, social networks and similar Web applications. For more details, please download the user manual.",MonoX.CMS.Theme.Default,True,2014-02-25T09:20:26.797-08:00,True,False,MonoX CMS Default Theme package contains the default MonoX theme.,"MonoX,CMS,Theme,Social,Networking",7565,False,4.8.40.4697-prerelease
Mauricio Scheffer,2013-08-10T21:26:44.533Z,814,1714,Integrates Fuchu with FsCheck,Fuchu.FsCheck,False,2016-01-26T16:59:35.18-08:00,True,False,,"test,testing",13767,False,0.3.0.1
Emoclick LLC,2013-08-10T13:52:18.313Z,43209,1714,Emoclick Community Mvc,Emoclick.Community.Mvc,False,1899-12-31T16:00:00-08:00,False,False,Emoclick Community Mvc,,-1,False,1.1.12
Brandon Stirnaman,2013-08-09T21:14:16.89Z,1426,1715,Fluent Automation is a simplified DSL for web application automation testing.,FluentAutomation.WatiN,False,2014-05-25T08:03:34.157-07:00,True,False,,"PhantomJS,Phantom,WatiN,Selenium,Fluent,Automation,API",17727,False,2.1.0
Steen F. Tøttrup,2013-08-09T17:42:50.333Z,1551,1715,The assemblies needed for running (and scaling out) MVC Forum on Azure with attachments and search indexes in blob storage.,MVCForum.Azure,False,2014-01-19T22:35:46.61-08:00,True,False,,,2713,False,1.0.0.30810
Pierre Chalamet,2013-08-09T17:31:31.32Z,289,1715,Core implementation of cassandra-sharp,cassandra-sharp-core,False,2017-07-05T13:09:59.07-07:00,True,False,Core implementation of cassandra-sharp,"apache,cassandra,driver,net40,net45,mono,database,nosql,tpl,rx,reactive,high,performance,streaming",6859,False,3.3.2
Frozen Mountain Software,2013-08-10T19:48:46.497Z,48,1714,A server-side library for .NET that extends WebSync to use SQL Server as a backend message hub for horizontal scaling. (Community Edition),FM.WebSync.SqlServer,False,2018-03-03T21:28:30.127+00:00,True,False,,"WebSync,Server,SQL,Extensions,HTTP,Push,Comet,Reverse,Ajax,.NET",14729,False,4.3.4
Remo Gloor,2013-08-10T00:22:07.297Z,538,1714,Ninject extension to add ioc for WCF services when IIS hosting.,Ninject.Extensions.Wcf.WebHost,True,2016-10-29T07:18:50.853-07:00,True,False,Extension for Ninject providing integration with ASP.NET MVC WebAPI WebHost,"Ninject,ioc,di,wcf",32793,False,3.0.2-unstable-9010
svespie,2013-08-09T15:43:15.05Z,346,1715,"This library provides a variety of formulae to estimate a one rep maximum.

This will not be updated any longer. Instead, OneRepMaxLib will be the active project going forward.",OneRepMax,False,2017-05-09T05:31:06.98-07:00,True,False,"This library provides a variety of formulae to estimate a one rep maximum.

Deprecated project. Replaced by OneRepMaxLib.",,2367,False,1.1.0
James Craig,2013-08-10T03:45:01.337Z,782,1714,This is a Glimpse addon that adds a tab containing information from the Batman framework.,Glimpse.Batman,False,2016-02-28T10:36:13.86-08:00,True,False,This is a Glimpse addon that adds a tab containing information from the Batman framework.,"batman,framework,mvc,servicestack",15116,False,1.0.23
James Craig,2013-08-10T02:58:41.723Z,782,1714,"The Batman framework is designed to simplify application development and tries to put the focus back on your application. This is the default setup package for the MVC platform. This package sets up the following items: smtp email, bootstrapper (SimpleInjector), auto bundling of JS and CSS (using YUI), LESS support, logging (NLog), profiling (MiniProfiler), default file systems, serialization (ServiceStack.Text), and Glimpse plugin.",Batman.MVC.Default,False,2016-02-28T10:35:59.94-08:00,True,False,The Batman framework is designed to simplify application development and tries to put the focus back on your application. This is the default setup package.,"batman,framework,mvc",18644,False,1.0.18
Leon Meijer,2013-08-09T15:01:34.63Z,164,1715,Part of the Co-Console SDK. Use this package to connect to the Co-Console API via Service Broker.,Lucy.CoConsole.ApiClient.ServiceBroker.Win32,False,2017-11-07T08:59:15.143+00:00,True,False,,,9885,False,1.8.5.65
Marc Plessis (Kopigi),2013-08-10T19:40:00.22Z,470,1714,"Navegar vous permet, de gérer une navigation inspirée des applications Windows 8, pour WPF mais également de gérer la navigation des applications Windows 8 (Modern UI/WinRT) en utilisant l'approche ViewModel First et non l'approche View First ,intégrée dans le Framework WinRT, le tout basé sur MVVMLight et SimpleIoc",Navegar,False,2017-01-05T08:37:03.09-08:00,True,False,Navegar vous permet de gérer la navigation d'une application WPF ou WinRT,"Navigation,C#,WPF,WinRT,MVVM,MVVMLight",9941,False,2.9.0
Abraham Echenique Carta,2013-08-10T21:04:47.847Z,149,1714,AecFramework - Data Objects,AecFramework.Data,False,2017-11-22T16:33:27.447+00:00,True,False,AecFramework - Data Objects,,13300,False,2.2.0
James Craig,2013-08-10T03:06:42.713Z,782,1714,This adds the ability for Batman to interact with local files as well as urls.,Batman.Core.Logging.NLog,False,2016-02-28T10:35:17.14-08:00,True,False,This adds the ability for Batman to interact with local files as well as urls.,"batman,framework,nlog",18410,False,1.0.19
Dean Hume,2013-08-09T15:25:45.88Z,1715,1715,The ASP.net MVC HTML5 Toolkit contains a rich set of controls that you can use to build ASP.net websites using HTML5. Harness the power of HTML5 and start using it in your applications. It's lightweight and can be a great step in getting your website up to speed with HTML5.,MVCHtml5Toolkit,False,2013-08-09T08:43:10.987-07:00,True,False,,,29910,False,1.7.0
Steen F. Tøttrup,2013-08-10T06:20:06.997Z,682,1714,A complete forum solution for ASP.NET MVC 3 applications.,MVCForum,False,2016-06-07T13:15:04.24-07:00,True,False,,,17710,False,1.0.1.30729
Brandon Stirnaman,2013-08-10T00:35:34.147Z,1426,1714,Fluent Automation is a simplified DSL for web application automation testing.,FluentAutomation.Core,False,2014-05-25T08:00:57.21-07:00,True,False,,"PhantomJS,Phantom,WatiN,Selenium,Fluent,Automation,API",76013,False,2.1.0.1
James Craig,2013-08-10T02:58:34.783Z,782,1714,This adds the ability to bundle less files within Batman.,Batman.MVC.Assets.Less,False,2016-02-28T10:35:38.03-08:00,True,False,This adds the ability to bundle less files within Batman.,"batman,framework,mvc,less",19609,False,1.0.18
Matthias Gernand,2013-08-09T16:50:13.74Z,1358,1715,A portable api for filesystem io using a unified interface.,Portable.IO,False,2014-08-01T01:27:13.797-07:00,True,False,,"io,portable,interface,file,directory",1470,False,1.0.1
eXpand,2013-08-09T14:44:14.867Z,11,1715,"Creates dynamic persistent assemblies. The XAF user interface allows us to create an assembly without writing a single line of code. Advanced users can even use c# scripting and create new code generation templates.  
Blogs:
http://apobekiaris.blogspot.com/search/label/WorldCreator",eXpandWorldCreatorWin,False,2018-04-09T16:26:37.873+00:00,True,False,Design runtime assemblies,"DevExpress,eXpand",68863,False,13.1.5.25
Kristijan Horvat,2013-08-09T12:26:35.557Z,1515,1715,"MonoX is a Free ASP.NET CMS and Social Networking Platform

MonoX provides tools for quick and intuitive construction of dynamic and fully editable ASP.NET portals, social networks and similar Web applications. For more details, please download the user manual.",MonoX.CMS.Bootstrap,True,2014-02-25T09:18:51.997-08:00,True,False,MonoX Bootstrap is a toolkit for MonoX CMS designed to kickstart MonoX based custom web applications.,"MonoX,CMS,Social,Networking",6979,False,4.8.40.4697-prerelease
ISV LEXXMT,2013-08-10T08:12:23.167Z,43209,1714,This is .NET library for multi-terminal  Expert Advisors / automated Forex trading.,Lexxmt.Forex.Interop.Mshpx,False,1899-12-31T16:00:00-08:00,False,False,.Net Forex MSHPX gateway.,,-1,False,1.5.55
Alexandre Mutel,2013-08-10T13:28:00.81Z,69,1714,"Assembly providing DirectX - Direct2D, DirectWrite and WIC managed API.",SharpDX.Direct2D1,False,2018-02-10T09:02:59.78+00:00,True,False,,"SharpDX,DirectX,Direct3D,MDX,3D,Direct2D,D2D,DirectWrite,DWrite,WIC",226825,True,2.5.0
Alexandre Mutel,2013-08-10T12:34:13.27Z,69,1714,Assembly providing DirectX - Direct3D10 and Direct3D10.1 managed API.,SharpDX.Direct3D10,False,2018-02-10T09:03:11.45+00:00,True,False,,"SharpDX,DirectX,Direct3D,MDX,3D,Direct3D10,D3D10",33363,True,2.5.1
Matthias Gernand,2013-08-09T16:50:42.387Z,1358,1715,A portable api for filesystem io using a unified interface.,Portable.IO.WindowsPhone,False,2014-08-01T01:30:12.917-07:00,True,False,,"io,portable,windowsphone,file,directory",1198,False,1.0.1
Frozen Mountain Software,2013-08-10T19:48:34.5Z,48,1714,A server-side library for .NET that extends WebSync to provide location/user-based chat services. (Community Edition),FM.WebSync.Chat.Server,False,2018-03-03T21:27:22.16+00:00,True,False,,"WebSync,Server,Chat,Extension,HTTP,Push,Comet,Reverse,Ajax,.NET",14350,False,4.3.4
GeertvanHorrik,2013-08-09T13:47:21.733Z,507,1715,"Catel.Extensions.Controls library which contains user controls, such as the StackGrid.",Catel.Extensions.Controls,True,2016-11-29T13:35:55.627+00:00,True,False,,"windows,controls,stackgrid,styles,stylehelper",170616,True,3.6.1308091537-beta
GeertvanHorrik,2013-08-09T13:47:55.11Z,1645,1715,Gyroscope service for Catel to use the gyroscope as a service in MVVM. Also contains a unit test version to simulate the gyroscope.,Catel.MVVM.Services.Gyroscope,True,2013-10-18T04:22:20.863-07:00,True,False,,"mvvm,catel,gyroscope,services,wp7,wp,windows,phone",25100,True,3.6.1308091537-beta
Cyotek,2013-08-10T19:20:50.33Z,146,1714,"The ImageBox is a custom control for displaying images. It supports zooming, scrolling, panning, region selection, virtual modes, and much more.",CyotekImageBox,False,2017-11-25T10:44:42.86+00:00,True,False,"The ImageBox is a custom control for displaying images with built in support for zooming, scrolling, panning, region selection, virtual modes, and much more.","image,picturebox,form,control,imagebox,cyotek",6877,False,1.1.4
eXpand,2013-08-09T14:41:01.553Z,1089,1715,ExceptionHandling Module (Win) / eXpand Framework,eXpandExceptionHandlingWin,False,2015-04-27T12:08:01.677-07:00,True,False,ExceptionHandling Module (Win) / eXpand Framework,"DevExpress,eXpand",57021,False,13.1.5.25
DevBridge,2013-08-09T13:37:12.887Z,304,1715,Pages module for BetterCMS. Better CMS is publishing focused and developer friendly .NET Open source CMS.,BetterCms.Module.Pages,False,2017-06-20T01:05:31.46-07:00,True,False,,,62282,False,1.2.1
James Craig,2013-08-10T03:44:46.047Z,782,1714,This adds MiniProfiler to Batman.,Batman.Core.Profiling.MiniProfiler,False,2016-02-28T10:35:23.907-08:00,True,False,This adds MiniProfiler to Batman.,"batman,framework,miniprofiler",17980,False,1.0.23
tangxuehua,2013-08-10T09:49:44.223Z,43209,1714,mongodb integration with enode framework,enode.mongo,False,1899-12-31T16:00:00-08:00,False,False,,"DDD,EDA,EventSourcing,CQRS,in-memory",-1,False,1.0.0
Kristijan Horvat,2013-08-09T10:21:52.997Z,1515,1715,"MonoX is a Free ASP.NET CMS and Social Networking Platform

MonoX provides tools for quick and intuitive construction of dynamic and fully editable ASP.NET portals, social networks and similar Web applications. For more details, please download the user manual.",MonoX.CMS.Theme.Default.Demo.Pages,True,2014-02-25T09:20:44.227-08:00,True,False,MonoX CMS Demo Pages package contains demo pages based on default theme that demonstrate how to build custom web parts and pages based on MonoX CMS.,"MonoX,CMS,Social,Networking",6925,False,4.8.40.4696-prerelease
Media Browser Team,2013-08-10T01:15:47.423Z,6,1714,Contains common model objects and interfaces used by all Media Browser solutions.,MediaBrowser.Common,False,2018-04-14T14:59:42.14+00:00,True,False,,,144350,False,3.0.176
Frozen Mountain Software,2013-08-10T19:48:38.82Z,48,1714,A client-side library for .NET that extends WebSync to provide optimizations for high network traffic scenarios. (Community Edition),FM.WebSync.ReturnData,False,2018-03-03T21:27:44.987+00:00,True,False,,"WebSync,Client,ReturnData,Extension,HTTP,Push,Comet,Reverse,Ajax,Return,Data,.NET",15064,False,4.3.4
James Craig,2013-08-10T03:44:43.83Z,782,1714,This adds the ability for Batman to interact with local files as well as urls.,Batman.Core.Logging.NLog,False,2016-02-28T10:35:17.14-08:00,True,False,This adds the ability for Batman to interact with local files as well as urls.,"batman,framework,nlog",18410,False,1.0.23
James Craig,2013-08-10T03:44:54.423Z,782,1714,This sets YUI as the CSS and JS minifier for Batman.,Batman.MVC.Assets.Yui,False,2016-02-28T10:35:52.44-08:00,True,False,This sets YUI as the CSS and JS minifier for Batman.,"batman,framework,mvc,webgrease",18147,False,1.0.23
eXpand,2013-08-09T14:40:31.907Z,11,1715,AdditionalViewControlsProvider Module (Web) / eXpand Framework,eXpandAdditionalViewControlsProviderWeb,False,2018-04-09T16:09:20.143+00:00,True,False,AdditionalViewControlsProvider Module (Web) / eXpand Framework,"DevExpress,eXpand",73120,False,13.1.5.25
Alexandre Mutel,2013-08-10T12:54:13.06Z,69,1714,Assembly providing DirectX - D3DCompiler managed API.,SharpDX.D3DCompiler,False,2018-02-10T09:02:36.95+00:00,True,False,,"SharpDX,DirectX,Direct3D,MDX,3D,D3DCompiler,HLSL,fx,Shaders",133563,True,2.5.0
Salar Khalilzadeh,2013-08-10T14:10:30.58Z,511,1714,MvcLanguageUrls adds language switch to every url in the MVC appplication. It also has the ability to redirect or change language switch in urls.,MvcLanguageUrls,False,2016-11-25T09:00:30.933-08:00,True,False,,"MVC,Url,Localization,Language,Globalization",1602,False,1.0.810.60
"Sam Harwell,Terence Parr",2013-08-10T05:20:53.517Z,12,1714,"The C# target of the ANTLR 3 parser generator. This package supports projects targeting .NET 2.0 or newer, and built using Visual Studio 2008 or newer.",Antlr3,True,2018-04-08T13:37:48.197+00:00,True,False,The C# target of the ANTLR 3 parser generator.,"antlr,antlr3,parsing",18751,True,3.5.0.3-alpha002
Paul Betts,2013-08-10T17:00:56.593Z,164,1714,Windows Forms specific extensions to ReactiveUI,reactiveui-winforms,False,2017-11-07T23:53:24.75+00:00,True,False,,,14323,False,5.1.1
GeertvanHorrik,2013-08-10T15:02:04.52Z,1645,1714,Gyroscope service for Catel to use the gyroscope as a service in MVVM. Also contains a unit test version to simulate the gyroscope.,Catel.MVVM.Services.Gyroscope,True,2013-10-18T04:22:20.863-07:00,True,False,,"mvvm,catel,gyroscope,services,wp7,wp,windows,phone",25100,True,3.6.1308101652-beta
Jayme Davis,2013-08-10T17:50:43.443Z,1,1714,"Stripe.net is a full service .net api for http://stripe.com. It includes support for Plans, Tokens, Customers, Charges, Subscriptions, Invoices, Events, and OAuth. For full documentation, visit https://github.com/jaymedavis/stripe.net.",Stripe.net,False,2018-04-19T12:26:39.697+00:00,True,False,,"stripe,payment,credit,cards,money",869210,False,1.6.0
Frozen Mountain Software,2013-08-10T19:48:51.26Z,48,1714,A server-side library for .NET that extends WebSync to provide notifications when clients subscribe to or unsubscribe from a channel. (Community Edition),FM.WebSync.Subscribers.Server,False,2018-03-03T21:29:05.27+00:00,True,False,,"WebSync,Server,Subscribers,Extension,HTTP,Push,Comet,Reverse,Ajax,.NET",14667,False,4.3.4
Frozen Mountain Software,2013-08-10T19:48:11.873Z,84,1714,A client-side library for JavaScript that provides core utilities for other libraries.,FM.JS,False,2018-01-26T02:26:51.37+00:00,True,False,,"FM,Core,Frozen,Mountain,JavaScript",18109,False,2.3.4
Paul Betts,2013-08-09T12:13:14.747Z,1472,1715,An adapter to initialize NLog as the logger for ReactiveUI.,reactiveui-nlog,False,2014-04-09T13:24:11.427-07:00,True,False,,,19733,False,5.1.0
Frozen Mountain Software,2013-08-10T19:48:13.5Z,48,1714,A library for .NET that provides logging via the log4net library. (Community Edition),FM.Log4Net,False,2018-03-03T21:25:25.003+00:00,True,False,,"FM,Log4Net,Logging,Frozen,Mountain,log4net,.NET",16591,False,2.3.4
James Craig,2013-08-10T19:37:18.33Z,782,1714,This adds the ability for Batman to interact with local files as well as urls.,Batman.Core.Logging.NLog,False,2016-02-28T10:35:17.14-08:00,True,False,This adds the ability for Batman to interact with local files as well as urls.,"batman,framework,nlog",18410,False,1.0.24
Jonathan Oliver,2013-08-09T11:46:28.347Z,689,1715,Additional serialization provider for NanoMessageBus based on the Newtonsoft Json.NET library.,NanoMessageBus.Json.NET,False,2016-05-31T09:43:56.373-07:00,True,False,Newtonsoft Json.NET Serializer for NanoMessageBus.,"messaging,service,bus,servicebus,nano,message,nanomessagebus,nmb,messages,newtonsoft,json,serialization,serializer",13330,False,2.0.40
dev@omnipasteapp.com,2013-08-09T13:37:17.327Z,1254,1715,BugFreak for Wpf. Easily track your applications errors. More info at https://bugfreak.co,BugFreak.WPF,False,2014-11-13T06:53:05.287-08:00,True,False,,"error,reporting,exception,handle",5331,False,1.0.0.5
XemioNetwork,2013-08-09T11:34:57.137Z,1443,1715,Basic 2D game library for indie games.,Xemio-GameLibrary,False,2014-05-08T12:05:31.26-07:00,True,False,,"xemio,game,library,indie,2d,xna,gdi,render,rendering,sound,input",66019,False,0.5.14
