authors,created,days_abandoned,days_alive,description,id,is_prerelease,last_updated,listed,missing_info,summary,tags,total_downloads,verified,version
MundiPagg,2015-06-25T01:34:00.237Z,1,1030,MundiPagg Gateway Client,MundiPagg.Gateway.Client,False,2018-04-19T18:25:32.76+00:00,True,False,,"MundiPagg,Credit,Card,Payment,Boleto,Gateway,Transaction",9255,False,1.0.0
LumiSoft,2015-06-25T08:55:45.3Z,982,1030,"Freeware open source SMTP,POP3,IMAP client/server components. MIME,Mail,DNS,FTP components.",LumiSoft.Net.dll,False,2015-08-12T05:46:57.797-07:00,True,False,,,8651,False,4.5.5654.19608
GroupDocs,2015-06-22T12:08:01.757Z,910,1033,"GroupDocs.Total for Cloud is a suite of RESTful APIs that allows developers to add comprehensive document collaboration functionality to their web/mobile applications or sites. The suite includes tools that enable end users to view, collaboratively annotate, e-sign, compare, convert, assemble and securely share over 50 document and image types, including PDF and Microsoft Office, all on the web and without having to install any office software. For more details, please visit: http://groupdocs.com/cloud/total-api

With this SDK, you can seamlessly configure, customize and integrate GroupDocs’ powerful document collaboration tools into your .NET/ASP.NET applications or sites.",groupdocs-dotnet,False,2015-10-23T05:22:32.927-07:00,True,False,GroupDocs Cloud SDK for .NET,"groupdocs,viewer,html-viewer,document-viewer,annotation,document-annotation,image-annotation,pdf-annotation,assembly,document-assembly,e-signature,electronic-signature,comparison,document,conversion,document-conversion,pdf,word,excel,powerpoint,html,cad,tiff",5479,False,2.29.1
Paul Betts,2015-06-24T19:15:24.593Z,1031,1031,The .NET 4.0 package of Splat with .NET 4.0 support fork. A library to make things cross-platform that should be,Splat.Net40,False,2015-06-24T12:15:24.593-07:00,True,False,A library to make things cross-platform that should be,,3585,False,1.6.2
tobiasschulz,2015-06-25T00:35:29.323Z,1027,1030,Common markdown classes for .NET applications,Core.Markdown,False,2015-06-28T12:11:24.89-07:00,True,False,,"Utilities,Common,Core,Markdown",20434,False,0.1.113
Administrator,2015-06-25T07:08:11.37Z,1030,1030,Description,LJ.Interfaces,False,2015-06-25T00:08:11.37-07:00,True,False,,,833,False,0.6.0.3
XLabs Team,2015-06-25T02:41:20.9Z,524,1030,"XLabs is a open source project that aims to provide a powerfull and cross platform set of controls tailored to work with Xamarin Forms.

			This package contains helpers to work with cryptography.",XLabs.Cryptography,True,2016-11-12T10:39:47.77-08:00,True,False,XLabs is a open source project that aims to provide a powerfull and cross platform set of controls tailored to work with Xamarin Forms.,"Xamarin,XLabs,Cryptography,md5",12339,False,2.0.5653-pre1
kgiszewski,2015-06-24T17:21:16.557Z,297,1031,"Collection of stuff not core worthy, but otherwise makes Umbraco 7 site building faster.",G42.UmbracoGrease,False,2017-06-27T06:34:56.81-07:00,True,False,,umbraco,4784,False,0.2.1
Christian Jensen,2015-06-25T00:32:13.197Z,43209,1030,Core library for sinch RestAPI,Sinch.Core,False,1899-12-31T16:00:00-08:00,False,False,Core library for sinch RestAPI,,-1,False,1.0.5
Lukiya,2015-06-15T19:37:52.867Z,140,1040,A CQRS framework for SyncSoft.,SyncSoft.CQRS,True,2017-12-01T01:11:46.18+00:00,True,False,,,21167,False,1.1.0.24-alpha
KellermanSoftware,2015-06-25T10:57:42.623Z,357,1030,"ORM and LINQ Provider.  Features: Auto Mapping, Generate Classes from Tables, Generate Tables from Classes, Synchronize Classes to Tables, Generic ADO.NET Wrapper, LINQ Provider support for SQL Server, Oracle, MySQL, VistaDB, Firebird, SQLite, and Microsoft Access.",KnightDataAccessLayer,False,2017-04-27T17:33:57.97-07:00,True,False,"ORM and LINQ Provider.  Features: Auto Mapping, Generate Classes from Tables, Generate Tables from Classes, Synchronize Classes to Tables, Generic ADO.NET Wrapper, LINQ Provider support for SQL Server, Oracle, MySQL, VistaDB, Firebird, SQLite, and Microsoft Access.","ORM,LINQ,Provider,generator,ADO.NET,SQL,Server,MySQL,Oracle,Firebird,Sqlite,Microsoft,Access,VistaDB",6123,False,1.36.0
Microsoft,2015-06-25T00:10:52.66Z,38,1030,Provides Api Management Service management capabilities for Microsoft Azure.,Microsoft.Azure.Management.ApiManagement,True,2018-03-13T21:30:07.123+00:00,True,False,Provides Api Management Service management capabilities for Microsoft Azure.,"Microsoft,Azure,Api,Management,Service,management,REST,HTTP,client,windowsazureofficial",31461,True,1.0.2-preview
Sören Deger,2015-06-25T02:41:27.48Z,43209,1030,"mail2cms is the email import solution for umbraco 7.1+. With this package you can import emails into cms umbraco. This emails can be saved as content nodes and the attachments as media nodes. You can import automatically all new emails in a mailbox with a scheduler or you can select single emails per right click context menu and save this mails under the chosen content or media node.
 
mail2cms is easy to configure, supports a dynamic mapping and most of the default umbraco datatypes. mail2cms use the best MIME parser on the market. It support IMAP, POP3, SSL and is fully compatible with Office 365, Gmail and others.

Here you can download the Official User Guide with a quick start manual: http://www.myheimarbeit.de/mail2cms-en

YOU USE THE PROGRAM AT YOUR OWN RISK.

IMPORTANT:
mail2cms needs permission to create own tables in the database!

EULA:
(End User License Agreement)

Licensee acknowledges that this is a nonexclusive license. myHeimarbeit.de is the owner of all titles, rights, and interests in the software. Licensee may not sell, distribute, or package for sale mail2cms. 
Licensee may not decompile, reverse engineer or disassemble mail2cms in whole or in part. mail2cms includes UI parts of the Umbraco core which is licensed separate under the MIT license.
mail2cms includes mail.dll from limilabs which is licensed separate and is royalty free. 
MAIL2CMS IS DISTRIBUTED ""AS IS"".NO WARRANTY OF ANY KIND IS EXPRESSED OR IMPLIED. YOU USE THE PROGRAM AT YOUR OWN RISK. MYHEIMARBEIT.DE DOES NOT WARRANT THAT THE SOFTWARE WILL MEET CUSTOMER'S NEEDS OR BE FREE FROM ERRORS, OR THAT THE OPERATION OF THE SOFTWARE WILL BE UNINTERRUPTED. MYHEIMARBEIT.DE WILL NOT BE LIABLE FOR DATA LOSS, DAMAGES, LOSS OF PROFITS OR ANY OTHER KIND OF LOSS WHILE USING OR MISUSING THIS SOFTWARE.",mail2cms_nugetTest,False,1899-12-31T16:00:00-08:00,False,False,The easiest and best way to import emails from your mailbox to cms umbraco  7.1+.,"umbraco,email,import,imap,pop3,mime,parser",-1,False,1.3.0.3
Eberhard Beilharz,2015-06-25T10:23:05.883Z,731,1030,A cross-platform msbuild/xbuild task for transforming T4 templates.,BuildTasks.TextTemplating,False,2016-04-19T09:40:19.923-07:00,True,False,,"msbuild,xbuild,cross-platform,T4",1409,False,1.0.5654.22084
Ephox Corp,2015-06-25T12:49:15.147Z,9,1030,The best WYSIWYG editor! TinyMCE is a platform independent web based Javascript HTML WYSIWYG editor control released as Open Source under LGPL by Ephox Corp. TinyMCE has the ability to convert HTML TEXTAREA fields or other HTML elements to editor instances. TinyMCE is very easy to integrate into other Content Management Systems.,TinyMCE.jQuery,False,2018-04-11T09:38:02.72+00:00,True,False,TinyMCE is a platform independent web based Javascript HTML WYSIWYG editor control released as Open Source under LGPL by Ephox Corp.,"Editor,TinyMCE,HTML,HTMLEditor",186963,False,4.2.0
XLabs Team,2015-06-25T02:44:44.913Z,524,1030,"XLabs is a open source project that aims to provide a powerfull and cross platform set of controls tailored to work with Xamarin Forms.

			This package contains helpers to work with IoC and Autofac",XLabs.IoC.Autofac,True,2016-11-12T10:40:37.297-08:00,True,False,XLabs is a open source project that aims to provide a powerfull and cross platform set of controls tailored to work with Xamarin Forms.,"Xamarin,XLabs,IoC,Autofac",19164,False,2.0.5653-pre1
eXpandFramework,2015-06-24T17:13:33.587Z,11,1031,Validation Module (Web) / eXpandFramework. To debug in VS enable Source Server support under Tools/Options/Debugging.,eXpandValidationWeb,False,2018-04-09T16:24:21.18+00:00,True,False,Validation Module (Web) / eXpandFramework,"DevExpress,eXpand,XAF,eXpressApp",38146,False,15.1.4.1
Mohammad Dayyan,2015-06-25T07:42:48.773Z,36,1030,"You can use PerdianDateTime like DateTime and easily parse varient persian datetime string and convert them to PersianDateTime.
For more information and samples see the project page.",MD.PersianDateTime,False,2018-03-15T03:47:56.777+00:00,True,False,PersianDateTime is a .Net library to work with PersianCalendar as easy as DateTime,"Persian,DateTime,Calendar,Date",12993,False,3.1.0
hclemente,2015-06-24T17:16:32.657Z,43209,1031,Description,Zabbix,False,1900-01-01T00:00:00+00:00,False,False,,,4932,False,1.0.1.27386
tobiasschulz,2015-06-25T00:33:44.707Z,1027,1030,A reusable Google Calendar synchronisation implementation for .NET applications,Core.Calendar.Google,False,2015-06-28T12:09:05.617-07:00,True,False,,"Utilities,Common,Core,Calendar,Google",29002,False,0.1.168
James Demeuse,2015-06-24T19:34:27.657Z,605,1031,This solution is a micro Object-Relational Mapper aimed at speed. ,OR-M_DataEntities,False,2016-08-23T18:13:36.313+00:00,True,False,Speedy Object-Relational Mapper for Microsoft Sql Server.  Based off of Microsoft's Entity Framework,"ORM,OR-M,Entity,Framework,EF,O/RM,Sql",4945,False,2.0.0
teunis.hakvoort,2015-06-25T07:34:13.49Z,43209,1030,SommiteFramework versie 15062502.45.140204,SommiteFramework,False,1900-01-01T00:00:00+00:00,False,False,v15.06.2502 - .Net 4.5 with DevExpress 14.2.4,,3939,False,15062502.45.140204
spencer.jones,2015-06-25T14:12:06.563Z,43209,1030,A group of useful MVC packages.,MvcCore.Sj,False,1899-12-31T16:00:00-08:00,False,False,,,-1,False,1.1.0
neuecc,2015-06-25T09:36:05.343Z,570,1030,LightNode(as Micro REST/RPC Framework) Client for PCL and HttpClient.,LightNode.Client.PCL.T4,False,2016-09-27T02:13:34.133-07:00,True,False,,"Owin,Rest,RPC",3745,False,1.5.0
Lukiya,2015-06-24T19:18:16.09Z,43209,1031,A service bus extension of CQRS framework for SyncSoft.,SyncSoft.CQRS.MassTransit.StateMachine,True,1899-12-31T16:00:00-08:00,False,False,,,-1,False,11.0.28-alpha
Umbraco HQ,2015-06-25T14:22:13.473Z,43209,1030,Contains the core assemblies needed to run Umbraco Cms. This package only contains assemblies and can be used for package development. Use the UmbracoCms-package to setup Umbraco in Visual Studio as an ASP.NET project.,UmbracoCmsVNB.Core,True,1899-12-31T16:00:00-08:00,False,False,Contains the core assemblies needed to run Umbraco Cms,umbraco,-1,False,7.3.0-build3
kgiszewski,2015-06-24T17:05:40.827Z,297,1031,"Collection of stuff not core worthy, but otherwise makes Umbraco 7 site building faster.",G42.UmbracoGrease,False,2017-06-27T06:34:56.81-07:00,True,False,,umbraco,4784,False,0.2.0
Execula,2015-06-25T09:56:52.357Z,1030,1030,This is only demo purpose,MyFirstAppDemo,False,2015-06-25T02:56:52.357-07:00,True,False,,"My,First,MVC,App",505,False,1.0.0
tobiasschulz,2015-06-25T03:00:01.753Z,1027,1030,Common ink classes for .NET applications,Core.Ink,False,2015-06-28T12:10:50.09-07:00,True,False,,"Utilities,Common,Core,Ink",16529,False,0.1.118
"Larry Aultman,Mark C. Huff II",2015-06-25T14:08:33.847Z,997,1030,This assembly is designed to assist in the coupling between legacy database and new .NET code.,PowerLine.SqlMesh,False,2015-07-28T10:44:17.287-07:00,True,False,,"PowerLine,SQL,Mapper",7958,False,1.1.0
Hyxtra Consulting,2015-06-25T13:00:19.53Z,1030,1030,Content specific diplay options for EPiServer.,Hyxtra.DisplayOptions,False,2015-06-25T06:00:19.53-07:00,True,False,,"EPiServerModulePackage,EPiServer,displayoptions",384,False,1.0.0
Lukiya,2015-06-19T18:30:29.953Z,43209,1036,A service bus extension of CQRS framework for SyncSoft.,SyncSoft.CQRS.MassTransit.StateMachine,True,1899-12-31T16:00:00-08:00,False,False,,,-1,False,1.1.0.26-alpha
earloc,2015-06-25T13:32:58.013Z,43209,1030,"Infrastructure for decoupling interaction logic between Views and ViewModels
      
      Send feedback, feature-request, unexpected breaking changes, etc. via the projects nuget-page, http://www.nuget.org/packages/Blue.MVVM.Interaction/ContactOwners, until there is a projet homepage...",Blue.MVVM.Interaction,True,1900-01-01T00:00:00+00:00,False,False,Infrastructure for decoupling interaction logic between Views and ViewModels,"MVVM,Interaction,XAML,IoC,Inversion,Control,Dialog,Notification",-1,False,0.4.0-beta1
Oystein Bjorke,2015-06-25T01:06:44.957Z,43209,1030,OxyPlot is a plotting library for .NET. This package targets Xamarin.iOS apps (both classic and unified APIs).,OxyPlot.Xamarin.iOS,True,1899-12-31T16:00:00-08:00,False,False,,"xamarin,iOS,plotting,plot,charting,chart",48161,False,2015.1.897-alpha
tobiasschulz,2015-06-25T00:36:02.983Z,1027,1030,A pure managed shell script interpreter for .NET applications,Core.Shell,False,2015-06-28T12:11:58.927-07:00,True,False,,"Utilities,Common,Core,Shell,Unix,Script",5405,False,0.1.17
Agile Harbor,2015-06-24T17:24:58.51Z,65,1031,Lightspeed webservices API wrapper.,LightspeedAccess,True,2018-02-14T11:57:23.487+00:00,True,False,Lightspeed webservices API wrapper.,Lightspeed,9076,False,1.0.26-rc1
Betclic,2015-06-25T08:34:54.537Z,857,1030,Portable and standalone node+npm+git for Front end dev and msbuild integration,Betclic.BuildTools.Node,False,2015-12-15T09:44:25.6+00:00,True,False,,"node,npm,git,frontend,build,msbuild",2609,False,1.0.3
2GIS,2015-06-25T06:21:32.92Z,891,1030,C# Framework for automated testing of Windows application based on WinFroms and WPF platforms.,Winium.Cruciatus,False,2015-11-10T20:08:04.98-08:00,True,False,,,6346,False,2.5.0
Michael Wasser,2015-06-25T06:29:50.273Z,1015,1030,"BloomApi.net is a client library for the Healthcare API, https://www.bloomapi.com/. For more information on the client visit https://github.com/untoldone/bloomapi.net",BloomApi.net,False,2015-07-09T18:16:41.23-07:00,True,False,,"bloomapi,healthcare,medical,medicine",877,False,0.2.0
"GeertvanHorrik,OrchestraDevs",2015-06-25T12:07:07.347Z,4,1030,The TaskRunner shell for Orchestra based applications.,Orchestra.Shell.TaskRunner,True,2018-04-16T15:54:09.353+00:00,True,False,,"mvvm,orchestra,shell,prism,framework,wpf,task,runner,taskrunner",38869,True,2.2.0-unstable0099
XLabs Team,2015-06-25T02:45:21.267Z,524,1030,"XLabs is a open source project that aims to provide a powerfull and cross platform set of controls tailored to work with Xamarin Forms.

			This package contains helpers to work with IoC and Ninject",XLabs.IoC.Ninject,True,2016-11-12T10:40:48.28-08:00,True,False,XLabs is a open source project that aims to provide a powerfull and cross platform set of controls tailored to work with Xamarin Forms.,"Xamarin,XLabs,IoC,Ninject",16268,False,2.0.5653-pre1
"JohnWintellect,JeffreyRichter,mozts2005",2015-03-26T03:38:02.7Z,781,1121,Wintellect Roslyn code analyzers and code fix providers for producing better code. See the GitHub project for the source. Have ideas for analyzers? Feel free to fork or let us know!,Wintellect.Analyzers,True,2016-02-29T02:20:35.24+00:00,True,False,Wintellect Roslyn code analyzers and code fix providers for producing better code.,"Roslyn,analyzers",5697,False,1.0.0-alpha7
QuantAlea AG.,2015-06-24T18:09:00.863Z,43209,1031,Alea GPU Platform CUDA compiler parallel algorithm extension.,Alea.CUDA.Unbound,False,1899-12-31T16:00:00-08:00,False,False,,"Alea,GPU,CUDA,C#,VB,F#,Parallel,Algorithm,QuantAlea",-1,False,2.1.1.3264
Sören Deger,2015-06-25T02:15:29.46Z,43209,1030,"mail2cms is the email import solution for umbraco 7.1+. With this package you can import emails into cms umbraco. This emails can be saved as content nodes and the attachments as media nodes. You can import automatically all new emails in a mailbox with a scheduler or you can select single emails per right click context menu and save this mails under the chosen content or media node.
 
mail2cms is easy to configure, supports a dynamic mapping and most of the default umbraco datatypes. mail2cms use the best MIME parser on the market. It support IMAP, POP3, SSL and is fully compatible with Office 365, Gmail and others.

Here you can download the Official User Guide with a quick start manual: http://www.myheimarbeit.de/mail2cms-en

YOU USE THE PROGRAM AT YOUR OWN RISK.

IMPORTANT:
mail2cms needs permission to create own tables in the database!

EULA:
(End User License Agreement)

Licensee acknowledges that this is a nonexclusive license. myHeimarbeit.de is the owner of all titles, rights, and interests in the software. Licensee may not sell, distribute, or package for sale mail2cms. 
Licensee may not decompile, reverse engineer or disassemble mail2cms in whole or in part. mail2cms includes UI parts of the Umbraco core which is licensed separate under the MIT license.
mail2cms includes mail.dll from limilabs which is licensed separate and is royalty free. 
MAIL2CMS IS DISTRIBUTED ""AS IS"".NO WARRANTY OF ANY KIND IS EXPRESSED OR IMPLIED. YOU USE THE PROGRAM AT YOUR OWN RISK. MYHEIMARBEIT.DE DOES NOT WARRANT THAT THE SOFTWARE WILL MEET CUSTOMER'S NEEDS OR BE FREE FROM ERRORS, OR THAT THE OPERATION OF THE SOFTWARE WILL BE UNINTERRUPTED. MYHEIMARBEIT.DE WILL NOT BE LIABLE FOR DATA LOSS, DAMAGES, LOSS OF PROFITS OR ANY OTHER KIND OF LOSS WHILE USING OR MISUSING THIS SOFTWARE.",mail2cms_nugetTest,False,1899-12-31T16:00:00-08:00,False,False,The easiest and best way to import emails from your mailbox to cms umbraco  7.1+.,"umbraco,email,import,imap,pop3,mime,parser",-1,False,1.3.0.1
hclemente,2015-06-24T20:45:59.803Z,43209,1031,Description,Zabbix,False,1900-01-01T00:00:00+00:00,False,False,,,4932,False,1.0.2.33697
LeanCloud,2015-06-25T03:07:23.53Z,187,1030,"## 支持以下运行时：
Windows Phone Silverlight （8.0 & 8.1）
Windows Desktop .NET Framework 4.5+
Xamarin iOS 8+
Xamarin Android 5+

## 文档地址
数据存储：https://cn.avoscloud.com/docs/dotnet_guide.html
实时消息：https://cn.avoscloud.com/docs/dotnet_realtime.html",LeanCloud,True,2017-10-15T07:14:44.413+00:00,True,False,LeanCloud SDK for .NET.,,5307,False,1.0.1.2-pre
Boris Scheiman,2015-06-25T07:51:37.357Z,1030,1030,".NET wrapper for Bitso, Mexico's #1 bitcoin exchange",Bitso,False,2015-06-25T00:51:37.357-07:00,True,False,http://www.bitso.com,"bscheiman,scheiman,boris,bitso,bitcoin,payment,mexico,pagos,pago,cobro",1033,False,1.0.3
Christian Jensen,2015-06-24T23:13:49.153Z,43209,1031,Core library for sinch RestAPI,Sinch.Core,False,1899-12-31T16:00:00-08:00,False,False,,,-1,False,1.0.4
Jerrie Pelser and contributors,2015-06-25T12:58:56.77Z,19,1030,Adds additional OAuth providers for OWIN to use with ASP.NET,Owin.Security.Providers,False,2018-04-01T06:38:29.297+00:00,True,False,"Additional OAuth providers for Katana (OWIN).  
      
      Includes providers for ArcGISOnline, Asana, Battle.net, Buffer, DeviantArt, Dropbox, EVEOnline, Flickr, Foursquare, GitHub, Gitter, Google+, HealthGraph, Instagram, LinkedIn, PayPal, Reddit, Salesforce, Slack, SoundCloud, Spotify, StackExchange, TripIt, Twitch.tv, Untappd, Visual Studio Online, Wordpress, Yahoo and Yammer.
      
      Also adds generic OpenID 2.0 providers as well implementations for Steam and Wargaming.","owin,katana,oauth,LinkedIn,Yahoo,Google+,GitHub,Reddit,Instagram,StackExchange,SalesForce,TripIt,Buffer,ArcGIS,Dropbox,Wordpress,Battle.NET,Yammer,OpenID,Steam,Twitch",248847,False,1.21.0
SocialMoneyDev,2015-06-24T20:21:53.053Z,332,1031,Visit http://docs.corepro.io for more information.,CorePro.SDK,False,2017-05-23T11:27:06.42-07:00,True,False,A .NET SDK for consuming the CorePro API.,"CorePro,.NET,API,SDK,'Social,Money'",10079,False,1.4.5653.25851
spencer.jones,2015-06-24T19:17:48.153Z,43209,1031,This is a fork of the GridMvc project that adds several features including defaulting column names to an object's DisplayName attribute (if available) and using a property's DisplayFormat attribute if available.,Grid.Mvc.Sj,False,1899-12-31T16:00:00-08:00,False,False,,,-1,False,1.0.5
"Robert Scaduto,Leo Hernandez",2015-06-25T13:33:52.973Z,975,1030,Common libraries for crux applications,Crux.NancyFx.Testing,False,2015-08-19T09:04:27.243-07:00,True,False,,,1884,False,0.2.7
spencer.jones,2015-06-24T20:34:41.157Z,43209,1031,A group of useful MVC packages.,MvcCore.Sj,False,1899-12-31T16:00:00-08:00,False,False,,,-1,False,1.0.0
eXpandFramework,2015-06-24T17:15:18.247Z,11,1031,Wizard Module (Win) / eXpandFramework. To debug in VS enable Source Server support under Tools/Options/Debugging.,eXpandWizardWin,False,2018-04-09T16:25:10.697+00:00,True,False,Wizard Module (Win) / eXpandFramework,"DevExpress,eXpand,XAF,eXpressApp",69382,False,15.1.4.1
Hibernating Rhinos,2015-06-25T06:42:20.587Z,43209,1030,"The Authorization Bundle extend RavenDB and add document level permissions. The Auth Bundle allows to define permissions for a specific user, a group or using arbitrary tagging. The system is design to be high performance, scalable and flexible.",RavenDB.Bundles.Authorization,True,1900-01-01T00:00:00+00:00,False,False,,"nosql,ravendb,raven,document,database,bundles,authorization",201812,True,3.0.3714-Unstable
Adeasygo,2015-06-09T07:59:24.22Z,43209,1046,Adeasygo.PaySDK For WP8.0SL,AdeasyGo.PaySDK,False,1899-12-31T16:00:00-08:00,False,False,,,5011,False,1.4.2
XLabs Team,2015-06-25T02:51:49.657Z,524,1030,"XLabs is a open source project that aims to provide a powerfull and cross platform set of controls tailored to work with Xamarin mobile platforms.

			This package contains Web related interfaces and services (e.g. REST client).",XLabs.Web,True,2016-11-12T10:43:17.847-08:00,True,False,XLabs is a open source project that aims to provide a powerfull and cross platform set of tools for Xamarin platform.,"Xamarin,XLabs",12345,False,2.0.5653-pre1
DebugRelease,2015-06-25T04:42:08.21Z,161,1030,"Clases de Acceso a datos mediante Entity Framework:
-Context Adapter
-Base Unit Of Work",Release.Helper.Data.Core,False,2017-11-10T15:28:59.073+00:00,True,False,,,1308,False,1.0.0
"Olivier GAUDEFROY,Arnaud DUFRANNE",2015-06-24T18:14:05.967Z,785,1031,Set of abstraction classes for AdomdClient,Microsoft.AnalysisServices.AdomdClient.Abstractions,False,2016-02-25T20:50:07.337+00:00,True,False,,"Analysis,Services,SSAS,ADOMD,Adomdclient,Microsoft",4478,False,1.0.4
Morten Fæster,2015-06-24T22:09:58.613Z,43209,1031,Aids in connecting to the Medielogin userservice,JpPolitikensHus.UserServiceProxy,False,1900-01-01T00:00:00+00:00,False,False,,Medielogin,-1,False,1.0.3.1
spencer.jones,2015-06-24T19:41:08.67Z,43209,1031,This is a fork of the GridMvc project that adds several features including defaulting column names to an object's DisplayName attribute (if available) and using a property's DisplayFormat attribute if available.,Grid.Mvc.Sj,False,1899-12-31T16:00:00-08:00,False,False,,,-1,False,1.1.1
Infragistics,2015-06-25T07:19:29.5Z,43209,1030,"Responsive Web Design on Any Browser, Any Platform, and Any Device",IgniteUI.Trial,False,1899-12-31T16:00:00-08:00,False,False,"The best HTML5 applications call for stellar Data Visualization and rocket-fast performance, and nobody else gives you the tools to deliver across every browser, platform and device better than Ignite UI (formerly NetAdvantage for jQuery). Prepare to launch modern UIs that deliver the flair for HTML5 without sacrificing resources, time, or money. With Ignite UI, your apps will boldly go where no app has gone before.","Infragistics,IgniteUI,Ignite,UI,asp.net,mvc,controls,components,html,5,javascript,jquery,web,applications,mobile,hybrid,NetAdvantage,jQuery,client-side,JavaScript,HTML5,grid,GroupBy,rich,HTML,editor,charts",-1,False,14.2.20142.2477
Marc Chouteau,2015-06-25T13:11:57.157Z,2,1030,Light plugin system for dotnet application,Sturon,False,2018-04-18T13:56:39.273+00:00,True,False,Light plugin system for dotnet application,Plugin,587,False,1.0.0
Hibernating Rhinos,2015-06-25T06:49:58.937Z,43209,1030,"Use this package if you want extend RavenDB. Don't use this package if you just want to work with existing RavenDB server, in order to so just use the client API which is in the RavenDB.Client package. RavenDB is a document database for the .NET platform, offering a flexible data model design to fit the needs of real world systems.

Note: If you encounter issue to install this package, please consult the following link: https://groups.google.com/forum/#!topic/ravendb/4TeMq7_7Esc",RavenDB.Database,True,1900-01-01T00:00:00+00:00,False,False,This package allows you to extend RavenDB database.,"nosql,ravendb,raven,document,database",663109,True,3.0.3714-Unstable
tobiasschulz,2015-06-25T02:14:12.647Z,1027,1030,Common ink classes for .NET applications,Core.Ink,False,2015-06-28T12:10:50.09-07:00,True,False,,"Utilities,Common,Core,Ink",16529,False,0.1.115
"Chris Patterson,Dru Sellers,Travis Smith",2015-06-25T03:30:13.343Z,1,1030,"Azure Service Bus support for MassTransit (a distributed application framework for .NET, including support for MSMQ and RabbitMQ).",MassTransit.AzureServiceBus,True,2018-04-19T17:05:48.51+00:00,True,False,,,116548,False,3.0.10-beta
tobiasschulz,2015-06-25T03:59:34.36Z,1027,1030,A reusable Google Calendar synchronisation implementation for .NET applications,Core.Calendar.Google,False,2015-06-28T12:09:05.617-07:00,True,False,,"Utilities,Common,Core,Calendar,Google",29002,False,0.1.174
NServiceBus Ltd,2015-06-25T09:32:44.84Z,63,1030,RavenDB integration for the NServicebus,NServiceBus.RavenDB,False,2018-02-16T08:30:28.587+00:00,True,False,,"nservicebus,servicebus,msmq,cqrs,publish,subscribe,ravendb",94898,False,2.2.1
