authors,created,days_abandoned,days_alive,description,id,is_prerelease,last_updated,listed,missing_info,summary,tags,total_downloads,verified,versionOneAutomata Ltd,2015-02-12T23:55:34.987Z,932,1163,"OneAutomata Messaging Client is the latest messaging queue library that works with centralized messaging. Send emails, iCal events, ftp files and web service calls to the messaging queue for immediate or delayed delivery.

Requires OneAutomata Web (FREE) to store and receive messages, view messaging queue, delay delivery of messages, pause, or stop delivery of messages, view email delivery replies and more.",OneAutomataMessagingClient,False,2015-10-01T00:52:24.867-07:00,True,False,OneAutomata Messaging Client is the latest messaging queue library that works with centralized messaging.,"OneAutomata,Messaging,client,queue",4895,False,3.3.0
Mogens Heller Grabe,2015-02-21T16:04:24.837Z,309,1154,Serilog integration for Cirqus,d60.Cirqus.Serilog,False,2017-06-14T22:33:21.007-07:00,True,False,,,27122,False,0.54.0
acraven,2015-02-21T18:18:27.15Z,1106,1154,An in-memory implementation of a simple publish/subscribe service bus,Atlas.ServiceBus.InMemory,False,2015-04-10T14:43:41.37-07:00,True,False,,"ServiceBus,Publish,Subscribe,InMemory",3764,False,0.0.51
acraven,2015-02-22T02:08:05.9Z,1106,1153,A RabbitMQ implementation of a simple publish/subscribe service bus,Atlas.ServiceBus.RabbitMQ,False,2015-04-10T14:44:14.027-07:00,True,False,,"ServiceBus,Publish,Subscribe,RabbitMQ",5191,False,0.0.54
Mogens Heller Grabe,2015-02-21T22:48:23.71Z,309,1154,PostgreSql stuff for d60 event sourcing + cqrs kit,d60.Cirqus.PostgreSql,False,2017-06-14T22:33:10.723-07:00,True,False,,,27536,False,0.55.2
Anshoo Arora,2015-02-21T17:04:49.397Z,1096,1154,"NUnitOrange creates masonry style HTML reports for NUnit. Its a simple Console application that creates easy to use, attractive dashboard. It shows the XML output from NUnit in a presentable manner with charts, graphs and tables.",NUnitOrange,False,2015-04-20T10:55:45.5-07:00,True,False,,"NUnit,Report,HTML,Orange",5773,False,1.2.0
Blocks,2015-02-21T12:50:04.36Z,43209,1154,Description,Blocks.TestHelpers,False,1899-12-31T16:00:00-08:00,False,False,,,-1,False,0.5.0.100
neuecc xin9le okazuki,2015-02-21T11:22:38.083Z,34,1154,"ReactiveProperty is MVVM and Asynchronous Extensions for Reactive Extensions(Rx-Main). Target is .NET 4, WP8, Windows store apps(Win8.1), Windows Phone 8.1.",ReactiveProperty,False,2018-03-17T04:45:03.51+00:00,True,False,,"rx,mvvm,async,rx-main",80569,False,1.2.1
ThyChief,2015-02-22T09:35:48.567Z,1127,1153,"Fluid is a flexible, all-in-one SDK for Everybody Edits made with the programmer in mind.",Fluid,False,2015-03-19T21:18:11.643-07:00,True,False,,"fluid,everybodyedits",5083,False,1.1.0
T-Alex Software,2015-02-21T20:53:58.543Z,25,1154,T-Alex MathCore.NumericalAnalysis Library,TAlex.MathCore.NumericalAnalysis,False,2018-03-26T02:29:47.05+00:00,True,False,,"Math,MathCore,Mathematica,Equation,Solving,Numerical,Integration,Interpolation,Optimization",511,False,1.1.1
Mogens Heller Grabe,2015-02-21T16:03:55.753Z,309,1154,PostgreSql stuff for d60 event sourcing + cqrs kit,d60.Cirqus.PostgreSql,False,2017-06-14T22:33:10.723-07:00,True,False,,,27536,False,0.54.0
"Anshoo Arora,Fabien Ruffin",2015-02-21T17:04:49.397Z,1096,1154,"NUnitOrange creates masonry style HTML reports for NUnit. Its a simple Console application that creates easy to use, attractive dashboard. It shows the XML output from NUnit in a presentable manner with charts, graphs and tables.",NUnitOrange,False,2015-04-20T10:55:45.5-07:00,True,False,,"NUnitOrange,NUnit,Report,HTML,Orange",5773,False,1.2.0
www.homethic.com,2015-02-21T14:30:18.567Z,499,1154,This NuGet represents Fozzy innermost level of DLLs,Fozzy.System,False,2016-12-07T09:12:04.177-08:00,True,False,Fozzy innermost NuGet,"Semantic,API",51739,False,1.2.3.24
Sylvain PONTOREAU,2015-02-21T09:49:51.503Z,1154,1154,PowerBI Api client Active Directory Azure Library,PowerBI.Api.Client.ADAL.PCL,True,2015-02-21T04:07:06.8-08:00,True,False,,PowerBI,618,False,1.0.0-alpha
Mogens Heller Grabe,2015-02-21T22:47:44.43Z,309,1154,NUnit integration for Cirqus testing tools,d60.Cirqus.NUnit,False,2017-06-14T22:33:00.41-07:00,True,False,,,12723,False,0.55.2
SEEK Ltd.,2015-02-22T10:58:10.233Z,995,1153,Custom DSC Resources for installing and uninstalling software packages and updates,seek-dsc-software,True,2015-07-30T06:11:22.58-07:00,True,False,,"admin,DSC",14785,False,1.0.0.86-master
XLabs Team,2015-02-22T00:11:40.743Z,524,1153,"XLabs is a open source project that aims to provide a powerfull and cross platform set of controls tailored to work with Xamarin Forms.

			This package implements the caching provider franework.",XLabs.Caching,False,2016-11-12T10:38:56.383-08:00,True,False,XLabs is a open source project that aims to provide a powerfull and cross platform set of controls tailored to work with Xamarin Forms.,"Xamarin,XLabs,caching",17555,False,2.0.5530
danielwertheim,2015-02-18T21:19:23.627Z,32,1157,"MyCouch is the simple asynchronous CouchDB and Cloudant client for .Net - building on top of the asynchronous HTTP client and uses JSON.Net to provide flexible serialization behaviour.

      If you want Cloudant specific features like Lucene Searches, go with the ""MyCouch.Cloudant"" package instead.

      It tries to keep the domain language of CouchDb and lets you work with requests and responses but also provides you with an alternative simplifying async API.
      MyCouch lets you work with raw JSON and/or entities/POCOS without requiring any implementation of interfaces or base-classes etc. MyCouch provides you with some model conventions like
      injection of $doctype to the document. It is pluggable. If you don't like some piece, then hook in your implementation instead.

      Supports .Net4.0, .Net4.5 and a PCL for Windows store 8.0 and 8.1 (WinRT) and WP8.1.",MyCouch,False,2018-03-19T17:29:46.93+00:00,True,False,Simple async CouchDB and Cloudant client.,"couchdb,cloudant,nosql",42811,False,3.1.0
neuecc xin9le okazuki,2015-02-22T07:13:20.89Z,34,1153,"ReactiveProperty is MVVM and Asynchronous Extensions for Reactive Extensions(Rx-Main). Target is .NET 4, WP8, Windows store apps(Win8.1), Windows Phone 8.1.",ReactiveProperty,True,2018-03-17T04:45:03.51+00:00,True,False,,"rx,mvvm,async,rx-main",80569,False,2.0.0-pre4
Angel Calvas,2015-02-21T22:53:10.41Z,43209,1154,A package that contains helpers for Xamarin Forms Codebehind views it simplifies the job will make Xaml and more friednly in the Future,Blacksun.XamForms,False,1899-12-31T16:00:00-08:00,False,False,,"Xamarin,Forms,Blacksun",-1,False,3.0.6
Yan Grenier,2015-02-21T13:50:06.837Z,1023,1154,A C# library for HTML DOM manipulations.,HDocument,False,2015-07-02T00:11:40.873-07:00,True,False,,HDocument,1147,False,1.0.1
Mogens Heller Grabe,2015-02-21T22:49:00.727Z,309,1154,Serilog integration for Cirqus,d60.Cirqus.Serilog,False,2017-06-14T22:33:21.007-07:00,True,False,,,27122,False,0.55.2
neuecc,2015-02-21T12:44:47.13Z,570,1154,LightNode(as Micro REST/RPC Framework) Common Core Interfaces.,LightNode.Core,False,2016-09-27T02:13:17.43-07:00,True,False,,"Owin,Rest,RPC",4855,False,1.1.0
SEEK Ltd.,2015-01-31T10:45:46.24Z,995,1175,Custom DSC Resources,seek-dsc,True,2015-07-30T06:13:07.9-07:00,True,False,,"admin,DSC",16048,False,1.0.82-master
Angel Calvas,2015-02-21T23:05:24.967Z,43209,1154,A package that contains helpers for Xamarin Forms Codebehind views it simplifies the job will make Xaml and more friednly in the Future,Blacksun.XamForms,False,1899-12-31T16:00:00-08:00,False,False,,"Xamarin,Forms,Blacksun",-1,False,3.0.7
bryan.arendt,2015-02-21T17:33:03.107Z,43209,1154,The setup for the MVC layer,OrangeOnion.MVC,False,1899-12-31T16:00:00-08:00,False,False,,,-1,False,1.0.0.2
Shape,2015-02-22T00:14:28.717Z,1147,1153,Shape Open Objects Framework,Shape,True,2015-02-27T16:49:25.067-08:00,True,False,,"Open,Objects",2532,False,0.1.8-beta
Jason Jarrett,2015-02-22T02:04:31.967Z,1153,1153,TypeScript Definitions (d.ts) for x-editable. Generated based off the DefinitelyTyped repository [git commit: 8e85bba87a8c95c7f357e78e3d5d1269c337741d]. http://github.com/DefinitelyTyped,x-editable.TypeScript.DefinitelyTyped,False,2015-02-21T18:04:31.967-08:00,True,False,,"TypeScript,JavaScript",2005,False,0.0.1
SEEK Ltd.,2015-01-31T10:43:55.437Z,995,1175,Custom DSC Resources for managing NServiceBus services,seek-dsc-nservicebus,True,2015-07-30T06:10:46.33-07:00,True,False,,"admin,DSC",15138,False,1.0.82-master
Corrado Cavalli,2014-12-29T23:08:53.447Z,43209,1208,Porting of Blend behaviors core infrastructure to Xamarin Forms,Xamarin.Forms.Behaviors,False,1899-12-31T16:00:00-08:00,False,False,Behaviors for Xamarin Forms,"Xamarin,Behaviors",-1,False,1.3.1
www.homethic.com,2015-02-21T18:06:08.52Z,782,1154,"Fozzy Senses are an implementatio of 5 Senses (4 out of 5 natural senses, Taste is not relevant) : Speak, See, Hear, Touch plus Speech, which is not a sense per se.",Fozzy.Sense,False,2016-02-28T05:48:34.433-08:00,True,False,Fozzy Senses,"Semantic,API",3397,False,1.2.3.3
Lloyd Franklin,2015-02-21T23:25:01.377Z,43209,1154,CarCake.PublishSubscribeClientAssistant simplifies adding publication and subscription implementations to your PublishSubscribeService connected applications.,CarCake.PublishSubscribeClientAssistant,False,1899-12-31T16:00:00-08:00,False,False,Simplifies adding publications and subscriptions to your projects.,carcake,-1,False,5.0.1
Joe Harrison,2015-02-22T02:25:44.13Z,408,1153,"A grid for ASP.NET MVC and Bootstrap with ajax paging and sorting. Also has filtering support, export to csv, back button support, and graceful degradation. Easily configurable. All AJAX calls are handled for you... Simply tell it how to get your data!",MVCGrid.Net,False,2017-03-07T21:05:56.41-08:00,True,False,,"mvc,grid",30843,False,1.0.0.28
Mogens Heller Grabe,2015-02-21T17:36:25.907Z,309,1154,Event sourcing + cqrs kit,d60.Cirqus,False,2017-06-14T22:31:49.347-07:00,True,False,,,31448,False,0.55.1
SEEK Ltd.,2015-02-22T11:39:27.287Z,995,1153,Custom DSC Resources for managing resources residing on the hard disk,seek-dsc-harddisk,False,2015-07-30T06:08:43.92-07:00,True,False,,"admin,DSC",15877,False,1.0.1
SEEK Ltd.,2015-02-22T10:55:32.733Z,995,1153,Custom DSC Resources for hosting applications with AppFabric,seek-dsc-appfabric-hosting,True,2015-07-30T06:07:33.8-07:00,True,False,,"admin,DSC",11117,False,1.0.0.86-master
Mogens Heller Grabe,2015-02-21T16:04:59.597Z,309,1154,SQLite event store for d60 event sourcing + cqrs kit,d60.Cirqus.SQLite,False,2017-06-14T22:33:31.38-07:00,True,False,,,21821,False,0.54.0
Kirill Ivanov,2015-02-21T11:10:53.88Z,560,1154,".NET API implementation https://developers.soundcloud.com/docs/api/reference

Check out full description here: https://github.com/kipwoker/SoundCloud.API.Client",SoundCloud.API.Client,False,2016-10-07T10:05:31.143-07:00,True,False,.NET API implementation https://developers.soundcloud.com/docs/api/reference,"SoundCloud,API",1961,False,1.0.0.1
SEEK Ltd.,2015-02-22T10:59:29.763Z,995,1153,Custom DSC Resources,seek-dsc,True,2015-07-30T06:13:07.9-07:00,True,False,,"admin,DSC",16048,False,1.0.0.86-master
SEEK Ltd.,2015-02-22T11:42:02.863Z,995,1153,Custom DSC Resources for administration of an IIS web server,seek-dsc-webadministration,False,2015-07-30T06:12:32.33-07:00,True,False,,"admin,DSC",14781,False,1.0.1
SEEK Ltd.,2015-02-22T11:25:52.767Z,995,1153,Custom DSC Resources for managing NServiceBus services,seek-dsc-nservicebus,False,2015-07-30T06:10:46.33-07:00,True,False,,"admin,DSC",15138,False,1.0.0.87
SharpSvn Project,2014-05-08T17:35:59.293Z,213,1443,"SharpSvn is a binding of the Subversion Client API for .NET based on the Subversion 1.9-alpha. This is the x86/32-bit version, See SharpSvn.1.9-x64 for the 64 bit version.",SharpSvn.1.9-x86,False,2017-09-19T12:10:39.407+00:00,True,False,,"Subversion,Svn,SharpSvn",32613,False,1.8991.3268.65
SEEK Ltd.,2015-02-22T10:59:29.763Z,995,1153,Custom DSC Resources,seek-dsc,True,2015-07-30T06:13:07.9-07:00,True,False,,"admin,DSC",16048,False,1.0.0.86-master
Mogens Heller Grabe,2015-02-21T16:03:22.363Z,309,1154,NUnit integration for Cirqus testing tools,d60.Cirqus.NUnit,False,2017-06-14T22:33:00.41-07:00,True,False,,,12723,False,0.54.0
T-Alex Software,2015-02-21T20:52:19.197Z,25,1154,T-Alex MathCore.LinearAlgebra Library,TAlex.MathCore.LinearAlgebra,False,2018-03-26T02:29:02.94+00:00,True,False,,"Math,MathCore,Mathematica,Linear,Algebra,System,Complex,Matrix,SVD,Eigenvalues",651,False,1.1.2
SEEK Ltd.,2015-02-22T10:57:43.427Z,995,1153,Custom DSC Resources for managing NServiceBus services,seek-dsc-nservicebus,True,2015-07-30T06:10:46.33-07:00,True,False,,"admin,DSC",15138,False,1.0.0.86-master
SEEK Ltd.,2015-01-31T11:07:22.477Z,995,1175,Custom DSC Resources for hosting applications with AppFabric,seek-dsc-appfabric-hosting,True,2015-07-30T06:07:33.8-07:00,True,False,,"admin,DSC",11117,False,1.0.83-issue-21
Eric Polerecky,2015-02-22T04:26:07.53Z,1029,1153,"Select or take photos, originally based on media picker from XLabs",detroitpro.Forms.Plugin.MediaPicker,False,2015-06-26T10:39:19.333-07:00,True,False,"Select or take photos, originally based on media picker from XLabs","xamarin,pcl,xam.pcl,plugin,for,xamarin.forms,windows,phone,winphone,wp8,android,ios,media,camera,photos",9106,False,0.0.9
bryan.arendt,2015-02-21T22:43:12.81Z,43209,1154,The setup for the MVC layer,OrangeOnion.MVC,False,1899-12-31T16:00:00-08:00,False,False,,,-1,False,1.0.0.9
acraven,2015-02-22T01:43:21.26Z,1106,1153,An in-memory implementation of a simple publish/subscribe service bus,Atlas.ServiceBus.InMemory,False,2015-04-10T14:43:41.37-07:00,True,False,,"ServiceBus,Publish,Subscribe,InMemory",3764,False,0.0.52
SEEK Ltd.,2015-02-22T10:56:55.33Z,995,1153,Custom DSC Resources for message queue administration,seek-dsc-messagequeue,True,2015-07-30T06:09:19.563-07:00,True,False,,"admin,DSC",15844,False,1.0.0.86-master
SEEK Ltd.,2015-01-31T11:50:12.927Z,995,1175,Custom DSC Resources for managing NServiceBus services,seek-dsc-nservicebus,True,2015-07-30T06:10:46.33-07:00,True,False,,"admin,DSC",15138,False,1.0.0.85-issue-21
acraven,2015-02-22T01:52:09.287Z,1106,1153,A RabbitMQ implementation of a simple publish/subscribe service bus,Atlas.ServiceBus.RabbitMQ,False,2015-04-10T14:44:14.027-07:00,True,False,,"ServiceBus,Publish,Subscribe,RabbitMQ",5191,False,0.0.53
Corrado Cavalli,2014-12-29T23:08:53.447Z,43209,1208,Porting of Blend behaviors core infrastructure to Xamarin Forms,Xamarin.Forms.Behaviors,False,1899-12-31T16:00:00-08:00,False,False,Behaviors for Xamarin Forms,"Xamarin,Behaviors",-1,False,1.3.1
Seek,2015-02-22T11:04:21.067Z,1172,1153,Remote Tools (Debuggers) for Visual Studio.,VS2013RemoteTools,False,2015-02-03T15:26:31.293-08:00,True,False,,"visual-studio-remote-tools,2013,installer,remote,debugging",1458,False,11.0.61030.6
SEEK Ltd.,2015-01-31T11:50:39.057Z,995,1175,Custom DSC Resources for installing and uninstalling software packages and updates,seek-dsc-software,True,2015-07-30T06:11:22.58-07:00,True,False,,"admin,DSC",14785,False,1.0.0.85-issue-21
bryan.arendt,2015-02-21T18:30:47.847Z,43209,1154,The setup for the MVC layer,OrangeOnion.MVC,False,1899-12-31T16:00:00-08:00,False,False,,,-1,False,1.0.0.4
www.homethic.com,2015-02-22T09:05:37.04Z,499,1153,This NuGet represents Fozzy innermost level of DLLs,Fozzy.System,False,2016-12-07T09:12:04.177-08:00,True,False,Fozzy innermost NuGet,"Semantic,API",51739,False,1.2.3.29
Oleg Volovikov,2015-01-06T13:01:42.383Z,1122,1200,"Sql commands wrapper, a mini ORM.",Wxen.DbHug,True,2015-03-25T04:08:08.82-07:00,True,False,"Primarily DbHug is select-based mini ORM, but it has basic functionality of update, delete, insert.","sql,data,common,orm,micro-orm",10599,False,0.10.0-beta
Andrew Simpson,2015-02-22T04:27:44.84Z,1074,1153,A framework that combines WebSharper and Angular to allow F# coding of all aspects of a SPA client and server,ellipsoid.org.Weatherwax.Core,True,2015-05-12T04:34:19.157-07:00,True,False,,"f#,fsharp,websharper,angular,angularjs,angular-mocks,angular-resource,angular-route,ui-router,spa,single,page,app",4620,False,0.2.8-alpha
Paul Jenkins; Jake Ginnivan; Brendan Forster (shiftkey); Alex Mitchell (Amrykid); Dennis Daume (flagbug); Jan Karger (punker76),2015-02-22T10:57:32.007Z,38,1153,"The goal of MahApps.Metro is to allow devs to quickly and easily cobble together a ""Metro"" or ""Modern"" UI for their WPF4+ apps, with minimal effort.",MahApps.Metro,True,2018-03-13T22:31:08.54+00:00,True,False,"The goal of MahApps.Metro is to allow devs to quickly and easily cobble together a ""Metro"" or ""Modern"" UI for their WPF4+ apps, with minimal effort.","WPF,UI,Metro",1280769,True,1.0.1-ALPHA073
Sylvain PONTOREAU,2015-02-21T09:49:51.503Z,1154,1154,PowerBI Api client Active Directory Azure Library,PowerBI.Api.Client.ADAL.PCL,True,2015-02-21T04:07:06.8-08:00,True,False,,PowerBI,618,False,1.0.0-alpha
SEEK Ltd.,2015-02-22T10:59:05.53Z,995,1153,Custom DSC Resources for administration of an IIS web server,seek-dsc-webadministration,True,2015-07-30T06:12:32.33-07:00,True,False,,"admin,DSC",14781,False,1.0.0.86-master
ERS-DEV-1,2015-02-22T06:12:08.577Z,1147,1153,Description,AINUDB,False,2015-02-28T01:48:58.107-08:00,True,False,,,3478,False,1.0.13
Surviveplus.net,2015-02-22T08:06:03.547Z,422,1153,"Unit test framework to use database (MDF, DACPAC, BACPAC) on Visual Studio, Visual Studio Online and Team Foundation Server.",Surviveplus.UnitTestPlus,False,2017-02-22T00:13:50.067-08:00,True,False,,,1160,False,1.0.5
Steven Luu,2014-05-28T02:18:23.587Z,43209,1423,A simpler version of Twitter's Snowflake ID generator which allows IDs to be generated locally instead of making a remote call.,NidGenerator,False,1899-12-31T16:00:00-08:00,False,False,,"NidGenerator,Nid",-1,False,1.0.1
Paket team,2015-02-21T17:19:27.353Z,2,1154,A package dependency manager for .NET with support for NuGet packages and GitHub repositories.,Paket.Core,True,2018-04-18T10:23:20.457+00:00,True,False,A package dependency manager for .NET with support for NuGet packages and GitHub repositories.,"nuget,bundler,F#",298246,False,0.30.0-alpha023
SEEK Ltd.,2015-01-31T11:51:35.6Z,995,1175,Custom DSC Resources for administration of an IIS web server,seek-dsc-webadministration,True,2015-07-30T06:12:32.33-07:00,True,False,,"admin,DSC",14781,False,1.0.0.85-issue-21
SEEK Ltd.,2015-01-31T11:12:02.413Z,995,1175,Custom DSC Resources,seek-dsc,True,2015-07-30T06:13:07.9-07:00,True,False,,"admin,DSC",16048,False,1.0.83-issue-21
Andrew Simpson,2015-02-21T23:42:09.22Z,1074,1154,A framework that combines WebSharper and Angular to allow F# coding of all aspects of a SPA client and server,ellipsoid.org.Weatherwax.Core,True,2015-05-12T04:34:19.157-07:00,True,False,,"f#,fsharp,websharper,angular,angularjs,angular-mocks,angular-resource,angular-route,ui-router,spa,single,page,app",4620,False,0.2.5-alpha
bryan.arendt,2015-02-21T17:13:17.77Z,43209,1154,The setup for the MVC layer,OrangeOnion.MVC,False,1899-12-31T16:00:00-08:00,False,False,,,-1,False,1.0.0.1
Mogens Heller Grabe,2015-02-21T17:40:37.61Z,309,1154,SQLite event store for d60 event sourcing + cqrs kit,d60.Cirqus.SQLite,False,2017-06-14T22:33:31.38-07:00,True,False,,,21821,False,0.55.1
Andrew Simpson,2015-02-22T01:38:02.9Z,1074,1153,A framework that combines WebSharper and Angular to allow F# coding of all aspects of a SPA client and server,ellipsoid.org.Weatherwax.Core,True,2015-05-12T04:34:19.157-07:00,True,False,,"f#,fsharp,websharper,angular,angularjs,angular-mocks,angular-resource,angular-route,ui-router,spa,single,page,app",4620,False,0.2.6-alpha
Mogens Heller Grabe,2015-02-21T17:39:06.393Z,309,1154,NUnit integration for Cirqus testing tools,d60.Cirqus.NUnit,False,2017-06-14T22:33:00.41-07:00,True,False,,,12723,False,0.55.1
SEEK Ltd.,2015-02-22T11:24:52.17Z,995,1153,Custom DSC Resources for message queue administration,seek-dsc-messagequeue,False,2015-07-30T06:09:19.563-07:00,True,False,,"admin,DSC",15844,False,1.0.0.87
Rynn Wang,2015-02-22T11:27:42.167Z,1133,1153,"Keen IO is an analytics API for modern developers. Track any event: signups, upgrades, impressions, purchases, powerups, errors, shares... Keen IO stores events in arbitrary JSON format, automatically ingesting any new events and rich custom properties you send. Our elegant query APIs make it straightforward to run counts, sums, segmentation, and more.

Github: https://github.com/rynnwang/KeenSDK",Keen.NET,False,2015-03-13T22:54:42.597-07:00,True,False,Keen IO is an analytics API that stores events in arbitrary JSON format. This library is based on official github and added 4 add-ons.,"keen.io,analytics,api,rest,client,statistics,geoip",23737,False,3.1.4
Tareq Ateik,2015-02-22T04:52:03.153Z,1114,1153,"Extended ListView for Universal Apps. Added Pull to refresh functionality and ""Load more data"" when the listview reaches the end. Works on Windows & Windows Phone 8.1",ExtendedListview,False,2015-04-02T14:49:51.747-07:00,True,False,,"extended,listview,pull,to,refresh,on,demand,winrt,wp8",5300,False,0.0.5.1
Mogens Heller Grabe,2015-02-21T16:01:50.383Z,309,1154,Entity Framework-based view manager for d60 event sourcing + cqrs kit,d60.Cirqus.EntityFramework,False,2017-06-14T22:32:11.503-07:00,True,False,,,22298,False,0.54.0
SEEK Ltd.,2015-01-31T10:43:28.673Z,995,1175,Custom DSC Resources for networking administration,seek-dsc-networking,True,2015-07-30T06:10:03.163-07:00,True,False,,"admin,DSC",17675,False,1.0.82-master
acraven,2015-02-22T01:51:42.887Z,1138,1153,A Log4Net implementation of the logger used in Atlas.ServiceBus,Atlas.ServiceBus.Log4Net,False,2015-03-09T06:18:37.04-07:00,True,False,,"ServiceBus,Publish,Subscribe,Log4Net",2821,False,0.0.53
Mogens Heller Grabe,2015-02-21T16:27:00.613Z,309,1154,TypeScript command interface definition generator for  d60 event sourcing + cqrs kit,d60.Cirqus.TsClient,False,2017-06-14T22:33:41.74-07:00,True,False,,,22935,False,0.55.0
Igor Kulman,2015-02-21T21:11:37.513Z,802,1154,Collection of utilities for Windows Phone 8.1 XAML apps,Kulman.WPA81,False,2016-02-08T13:55:40.977-08:00,True,False,Collection of utilities for Windows Phone 8.1 XAML apps,,4685,False,1.0.8
CapableObjects,2015-02-22T06:42:18.967Z,2,1153,Descr,EcoSqlServer,False,2018-04-18T02:38:20.023+00:00,True,False,,"ModelDrivenDevelopment,ECO,CapableObjects",145399,False,7.0.0.7662
Paket team,2015-02-21T11:24:01.897Z,2,1154,A package dependency manager for .NET with support for NuGet packages and GitHub repositories.,Paket.Core,True,2018-04-18T10:23:20.457+00:00,True,False,A package dependency manager for .NET with support for NuGet packages and GitHub repositories.,"nuget,bundler,F#",298246,False,0.30.0-alpha022
acraven,2015-02-22T02:17:46.637Z,1106,1153,A Castle Windsor implementation of the IoC resolver used in Atlas.ServiceBus,Atlas.ServiceBus.Resolver.Windsor,False,2015-04-10T14:44:46.637-07:00,True,False,,"ServiceBus,Publish,Subscribe,Castle,Windsor,IoC",2448,False,0.0.55
acraven,2015-02-22T01:51:17.013Z,1106,1153,An in-memory implementation of a simple publish/subscribe service bus,Atlas.ServiceBus.InMemory,False,2015-04-10T14:43:41.37-07:00,True,False,,"ServiceBus,Publish,Subscribe,InMemory",3764,False,0.0.53
Finsa S.p.A. <finsa@finsa.it>,2015-02-21T13:46:04.39Z,43209,1154,"Help Pages for services implemented with Web API, fully independent of the hosting model. An ""export"" function is also exposed, which allows you to export your APIs to PDF, Postman, RAML.

Since pages are completely embedded, even Bootstrap and JQuery, they work both on IIS and on self hosting (included OWIN).

Pages are built with Bootstrap and JQuery, which should guarantee an excellent browser compatibilty and a smooth browsing experience.",Finsa.WebApi.HelpPage.AnyHost,True,1899-12-31T16:00:00-08:00,False,False,"Help Pages for services implemented with Web API, fully independent of the hosting model. An ""export"" function is also exposed, which allows you to export your APIs to PDF, Postman, RAML.","web,api,help,page,self,iis,host,pdf,postman,raml",-1,False,0.1.6-alpha
Thomas Levesque,2015-02-21T21:57:19.313Z,297,1154,"A simple library to display animated GIF images in XAML applications. Currently supported platforms include WPF (.NET 4.5), Windows 8.1 and Windows Phone 8.1.",XamlAnimatedGif,True,2017-06-27T08:34:48.967+00:00,True,False,A simple library to display animated GIF images in XAML applications,"xaml,animated,gif,winrt,wpf,windows-phone",41483,False,1.0.0-beta1
Shape,2015-02-22T00:39:32.677Z,1148,1153,ShapeFX seamless integration with Autofac for new or existing projects.,ShapeFX.Integration.Autofac,True,2015-02-27T13:39:30.593-08:00,True,False,,"ShapeFX,Autofac",817,False,0.1.0-beta
Felix Berman,2015-02-21T16:31:28.99Z,605,1154,"Hapil is a dynamic MSIL generation library, which serves a back-end for the following design techniques: 
- CoI - Convention-over-Implementation
- Aspect-Oriented Programming, through decoration
- [planned] Subject-Oriented Programming, via mix-ins
- [planned] Duck Typing",FelixB.Hapil,False,2016-08-23T06:03:42.09-07:00,True,False,"A .NET dynamic type generator library, which serves a back-end for the Convention-over-Implementation approach","CoI,IL,MSIL,Dynamic,AOP,Aspect,Mix-in,Duck",10415,False,0.9.3
Microsoft,2015-02-22T11:05:48.567Z,1,1153,Extentions for Kendo UI.,WisdomCloud.KendoUI,False,2018-04-19T08:49:47.573+00:00,True,False,,"WisdomCloud,KendoUI",19055,False,1.4.0
Matthew D. Groves,2015-02-21T21:57:51.91Z,1154,1154,"Sticking Place is yet another ""junk drawer"" C# library of useful extensions and helpers, including SqlExceptionHelper, ASP.NET MVC helpers, MD5 and SHA256 helpers.",StickingPlace,False,2015-02-21T13:57:51.91-08:00,True,False,,,426,False,0.1.0
