authors,created,days_abandoned,days_alive,description,id,is_prerelease,last_updated,listed,missing_info,summary,tags,total_downloads,verified,versionXemioNetwork,2013-08-09T10:41:06.62Z,1443,1715,Basic 2D game library for indie games.,Xemio-GameLibrary,False,2014-05-08T12:05:31.26-07:00,True,False,,"xemio,game,library,indie,2d,xna,gdi,render,rendering,sound,input",66019,False,0.5.12
CapableObjects,2013-08-09T16:28:08.863Z,2,1715,Descr,EcoCore,False,2018-04-18T02:37:33.803+00:00,True,False,,"ModelDrivenDevelopment,ECO,CapableObjects",148109,False,7.0.0.6637
James Craig,2013-08-10T03:16:52.927Z,782,1714,This adds the ability to use razor when building templates for email in Batman.,Batman.Core.Communication.RazorFormatter,False,2016-02-28T10:34:55.707-08:00,True,False,This adds the ability to use razor when building templates for email in Batman.,"batman,framework,razor",18909,False,1.0.21
James Craig,2013-08-10T19:37:13.973Z,782,1714,This adds the ability to email messages using SMTP in Batman.,Batman.Core.Communication.SMTP,False,2016-02-28T10:35:02.96-08:00,True,False,This adds the ability to email messages using SMTP in Batman.,"batman,framework,smtp",18546,False,1.0.24
RecycleBin,2013-08-10T13:36:45.627Z,234,1714,Provides utility extensions for R.NET.,RDotNet.FSharp,False,2017-08-29T06:39:51.883+00:00,True,False,Provides utility extensions for R.NET.,"R,R.NET,F#,statistics",4377,False,0.1.0
"KCF Technologies,Inc.",2013-08-09T19:28:48.15Z,1437,1715,Description,Prometheus.Shared,False,2014-05-14T06:34:59.16-07:00,True,False,,,69117,False,1.0.4969.26044
ReflectSoftware,2013-08-09T14:45:48.007Z,81,1715,"We've added support for the Http Module.

In order to use this extension you must have the ReflectInsight Viewer installed. Download and install the ReflectInsight Viewer from this location: 

http://www.ReflectSoftware.com/Public/Download.aspx

You can view your Http messages in realtime, in a rich viewer that allows you to filter out and search for what really matters to you.",ReflectSoftware.Insight.Extensions.HttpModule,False,2018-01-29T17:02:58.303+00:00,True,False,ReflectInsight Http Module logging extention make it easy to integrate ReflectInsight into your existing application logging infrastructure and leverage the power of the ReflectInsight log viewer.,"HttpModule,Http,Debug,Trace,Logging,Extensions,ReflectInsight,Appender,Log,Tracing,RabbitMQ",5715,False,5.1.5
DevBridge,2013-08-09T13:37:30.597Z,304,1715,API Web module for BetterCMS. Better CMS is publishing focused and developer friendly .NET Open source CMS.,BetterCms.Module.Api.Web,False,2017-06-20T01:07:16.307-07:00,True,False,,,55831,False,1.2.1
James Craig,2013-08-10T03:16:59.363Z,782,1714,This adds the ability for Batman to interact with local files as well as urls.,Batman.Core.Logging.NLog,False,2016-02-28T10:35:17.14-08:00,True,False,This adds the ability for Batman to interact with local files as well as urls.,"batman,framework,nlog",18410,False,1.0.21
eXpand,2013-08-09T14:43:36.243Z,1715,1715,ViewVariants Module (Web) / eXpand Framework,eXpandViewVariantsWeb,False,2013-08-09T07:43:36.243-07:00,True,False,ViewVariants Module (Web) / eXpand Framework,"DevExpress,eXpand",31295,False,13.1.5.25
Kristijan Horvat,2013-08-09T12:25:45.993Z,1515,1715,"MonoX is a Free ASP.NET CMS and Social Networking Platform

MonoX provides tools for quick and intuitive construction of dynamic and fully editable ASP.NET portals, social networks and similar Web applications. For more details, please download the user manual.",MonoX.CMS.Runtime,True,2014-02-25T09:19:56.78-08:00,True,False,MonoX CMS Runtime package is designed to easily download MonoX CMS Runtime prerequsites to run MonoX based web applications.,"MonoX,CMS,Runtime,Social,Networking",7598,False,4.8.40.4697-prerelease
Willem Toerien,2013-08-09T11:16:10.377Z,43209,1715,Gives the ability to extend on the Property Observer weavers.,PropertyObserver.Weavers,False,1899-12-31T16:00:00-08:00,False,False,,,-1,False,2.0.2
Remo Gloor,2013-08-10T00:21:59.207Z,173,1714,Ninject extension to add ioc for WCF services when self hosting.,Ninject.Extensions.Wcf.Selfhost,True,2017-10-29T09:58:49.573+00:00,True,False,Ninject extension to add ioc for WCF services when self hosting.,"Ninject,ioc,di,wcf",34861,False,3.0.2-unstable-9010
eXpand,2013-08-09T14:41:40.283Z,1715,1715,JobSheduler Module (Web) / eXpand Framework,eXpandJobShedulerWeb,False,2013-08-09T07:41:40.283-07:00,True,False,JobSheduler Module (Web) / eXpand Framework,"DevExpress,eXpand",31781,False,13.1.5.25
Dmitry Tretyakov,2013-08-10T19:51:11.073Z,24,1714,"Windows Azure Storage Extensions is a .NET library aimed for managing and querying entities from Windows Azure Storage.
It's built on top of Windows Azure Storage Client Library 2.0, provides LINQ to Azure Tables queries and async interfaces.",WindowsAzure.StorageExtensions,False,2018-03-27T19:16:02.33+00:00,True,False,,"Azure,Storage,Blob,Table,Async,Extensions,LINQ,IQueryable",78672,False,0.7.7
DlhSoft,2013-08-09T10:02:18.663Z,463,1715,"Task hierarchy and resource scheduling components for WPF and .NET 4: Gantt Chart, Schedule Chart, Load Chart; Schedule editor, PERT Chart, Network Diagram. Main features: Interactive task hierarchy management, resource scheduling, resource load, and project flow charts; Task bars and dependency lines supporting drag and drop operations; Working time, scales, and zoom level customization; Project baseline visualization, critical path enumeration; Resource leveling algorithm; Data binding with high customizability; Rich user experience, customizable appearance, culture and theme awareness; Printing and image exporting; Microsoft Project® XML exporting support; Extended Model-View-ViewModel (MVVM) pattern support (Prism).",DlhSoft.ProjectManagementLibrary,False,2017-01-12T08:40:20.833-08:00,True,False,"Task hierarchy and resource scheduling components for WPF and .NET 4: Gantt Chart, Schedule Chart, Load Chart; Schedule editor, PERT Chart, Network Diagram.","Gantt,schedule,chart,project,task,management,WPF",4029,False,4.2.2.9
Casey Watson,2013-08-09T21:32:04.927Z,43209,1715,This library contains the base Mantle components used for interacting with Windows Service Bus.,mantle-wsb,True,1899-12-31T16:00:00-08:00,False,False,,"Cloud,Mantle,Microsoft,Windows,Service,Bus",-1,False,1.0.0-beta
Kristijan Horvat,2013-08-09T10:21:46.917Z,1515,1715,"MonoX is a Free ASP.NET CMS and Social Networking Platform

MonoX provides tools for quick and intuitive construction of dynamic and fully editable ASP.NET portals, social networks and similar Web applications. For more details, please download the user manual.",MonoX.CMS.Theme.Default,True,2014-02-25T09:20:26.797-08:00,True,False,MonoX CMS Default Theme package contains the default MonoX theme.,"MonoX,CMS,Theme,Social,Networking",7565,False,4.8.40.4696-prerelease
James Craig,2013-08-10T03:17:29.173Z,782,1714,This is the MVC Core package. However no functionality is included in this package.,Batman.MVC,False,2016-02-28T10:35:31.15-08:00,True,False,This is the MVC Core package. However no functionality is included in this package.,"batman,framework,mvc",24207,False,1.0.21
Brandon Stirnaman,2013-08-10T00:37:41.313Z,1426,1714,ScriptCs script pack for Fluent Automation,ScriptCs.FluentAutomation,False,2014-05-25T08:07:45.573-07:00,True,False,,"ScriptCs,F14N,PhantomJS,Phantom,WatiN,Selenium,Fluent,Automation,API",4039,False,1.0.2.1
Remo Gloor,2013-08-10T00:14:38.44Z,173,1714,Ninject extension to add ioc for WCF services when self hosting.,Ninject.Extensions.Wcf.Selfhost,True,2017-10-29T09:58:49.573+00:00,True,False,Ninject extension to add ioc for WCF services when self hosting.,"Ninject,ioc,di,wcf",34861,False,3.0.2-unstable-9009
James Craig,2013-08-10T03:06:44.6Z,782,1714,This adds MiniProfiler to Batman.,Batman.Core.Profiling.MiniProfiler,False,2016-02-28T10:35:23.907-08:00,True,False,This adds MiniProfiler to Batman.,"batman,framework,miniprofiler",17980,False,1.0.19
CapableObjects,2013-08-09T16:28:28.753Z,2,1715,Descr,EcoSqlServer,False,2018-04-18T02:38:20.023+00:00,True,False,,"ModelDrivenDevelopment,ECO,CapableObjects",145399,False,7.0.0.6637
asipe,2013-08-09T13:13:45.66Z,380,1715,Testing Utility Library,SupaCharge.Testing,False,2017-04-05T09:48:07.817-07:00,True,False,,utility,5888,False,1.0.0.6
STracker Developers,2013-08-10T19:32:27.663Z,1690,1714,MongoDB repositories of STrackerServer.,STrackerServer.Repository.MongoDB,False,2013-09-03T15:37:34.557-07:00,True,False,,,6601,False,2.2.4
Michael Bostock,2013-08-10T13:09:11.58Z,2,1714,"D3.js is a JavaScript library for manipulating documents based on data. D3 helps you bring data to life using HTML, SVG and CSS. D3’s emphasis on web standards gives you the full capabilities of modern browsers without tying yourself to a proprietary framework, combining powerful visualization components and a data-driven approach to DOM manipulation.",d3,False,2018-04-18T02:29:33.27+00:00,True,False,Powerful visualization components for JavaScript,"JavaScript,visualization",378049,False,3.2.8
Wies Hubbers,2013-08-10T15:00:40.443Z,1597,1714,CrossBase is a platform independent framework,CrossBase.CodeGeneration,False,2013-12-05T11:54:51.267-08:00,True,False,,,10402,False,0.0.37
Dirk Lemstra,2013-08-10T18:58:57.177Z,3,1714,ImageMagick is a powerful image manipulation library that supports over 100 major file formats (not including sub-formats). With Magick.NET you can use ImageMagick without having to install ImageMagick on your server or desktop.,Magick.NET-Q16-x86,False,2018-04-17T22:34:46.76+00:00,True,False,A .NET API to the ImageMagick image-processing library for Desktop and Web.,"ImageMagick,Magick.NET",59414,False,6.8.6.801
Media Browser Team,2013-08-10T02:58:52.77Z,6,1714,Contains core components required to build plugins for Media Browser Server.,MediaBrowser.Server.Core,False,2018-04-14T14:59:39.967+00:00,True,False,,,138326,False,3.0.177
Paul Betts,2013-08-10T17:02:04.827Z,142,1714,An MVVM library for WPF and Silverlight that is deeply integrated with the Reactive Extensions,reactiveui,False,2017-11-29T13:25:31.297+00:00,True,False,,,275538,True,5.1.1
Kristijan Horvat,2013-08-09T16:11:25.367Z,1515,1715,"MonoX is a Free ASP.NET CMS and Social Networking Platform

MonoX provides tools for quick and intuitive construction of dynamic and fully editable ASP.NET portals, social networks and similar Web applications. For more details, please download the user manual.",MonoX.CMS.Theme.Default.Demo.Pages,True,2014-02-25T09:20:44.227-08:00,True,False,MonoX CMS Demo Pages package contains demo pages based on default theme that demonstrate how to build custom web parts and pages based on MonoX CMS.,"MonoX,CMS,Social,Networking",6925,False,4.8.40.4703-prerelease
GeertvanHorrik,2013-08-10T15:01:38.707Z,507,1714,"Catel.Extensions.EntityFramework5 library which provides data classes such as repositories, unit of work, DbContextManager and more.",Catel.Extensions.EntityFramework5,True,2016-11-29T13:36:06.393+00:00,True,False,,"catel,entity,framework,entityframework,EF,EF5,UnitOfWork,unit,of,work,DbContextManager,repository,repositories,database",97012,True,3.6.1308101652-beta
Jim Cowart,2013-08-10T16:35:26.793Z,1234,1714,"Postal.js is an in-memory message bus - very loosely inspired by AMQP - written in JavaScript. Postal.js runs in the browser, or on the server-side using Node.js.",postal-js,False,2014-12-03T15:54:40.807-08:00,True,False,JavaScript in-memory message bus.,"message,messaging,bus,broker,mediator,pub,sub,publish,subscribe",9781,False,0.8.6
Alexandre Mutel,2013-08-10T12:37:42.68Z,69,1714,Assembly providing DirectX - Effects11 managed API for Direct3D11.,SharpDX.Direct3D11.Effects,False,2018-02-10T09:03:33.34+00:00,True,False,,"SharpDX,DirectX,Direct3D,MDX,3D,Direct3D11,D3D11,Effects11",39916,True,2.5.0
DevBridge,2013-08-09T13:37:20.69Z,304,1715,Windows Azure storage module for BetterCMS. Better CMS is publishing focused and developer friendly .NET Open source CMS.,BetterCms.Module.WindowsAzureStorage,False,2017-06-20T01:06:25.273-07:00,True,False,,,53961,False,1.2.1
Steve Greatrex,2013-08-09T20:47:15.257Z,101,1715,Helper extensions for KnockoutJs,ko.plus,False,2018-01-09T20:44:20.947+00:00,True,False,,"JavaScript,KnockoutJS",9228,False,0.0.4
James Craig,2013-08-10T03:40:07.267Z,782,1714,This adds the ability to email messages using SMTP in Batman.,Batman.Core.Communication.SMTP,False,2016-02-28T10:35:02.96-08:00,True,False,This adds the ability to email messages using SMTP in Batman.,"batman,framework,smtp",18546,False,1.0.22
James Craig,2013-08-10T02:58:28.187Z,782,1714,This adds the ability for Batman to interact with local files as well as urls.,Batman.Core.Logging.NLog,False,2016-02-28T10:35:17.14-08:00,True,False,This adds the ability for Batman to interact with local files as well as urls.,"batman,framework,nlog",18410,False,1.0.18
plexityHide,2013-08-09T18:24:46.353Z,592,1715,"GTP.NET.SL is a package of components to build interactive Gantt and Schedule charts on Silverlight,WPF,WindowsPhone,WindowsStore",GTP.NET.SL,False,2016-09-05T06:23:35.553-07:00,True,False,,"Gantt,Schedule,plexityHide,GTP.NET,GTP.NET.SL",19825,False,2.8.9.38
eXpand,2013-08-09T14:44:21.437Z,11,1715,Dashboard Module / eXpand Framework,eXpandDashboard,False,2018-04-09T16:10:29.52+00:00,True,False,Dashboard Module / eXpand Framework,"DevExpress,eXpand",49792,False,13.1.5.25
Nick Floyd,2013-08-09T15:29:45.137Z,43209,1715,This package has been replaced by : https://www.nuget.org/packages/NewRelic.Agent.Api,NewRelic.Agent.Api.x64,False,1899-12-31T16:00:00-08:00,False,False,"The New Relic .NET Agent API supports custom error and metric reporting, and custom transaction parameters. This is the 64-bit version of the package. For the 32-bit build, see  NewRelic.Agent.Api.x32","New,Relic",-1,False,2.9.122
James Craig,2013-08-10T02:58:23.84Z,782,1714,This adds the ability to email messages using SMTP in Batman.,Batman.Core.Communication.SMTP,False,2016-02-28T10:35:02.96-08:00,True,False,This adds the ability to email messages using SMTP in Batman.,"batman,framework,smtp",18546,False,1.0.18
GeertvanHorrik,2013-08-09T13:47:31.85Z,507,1715,"Catel.Extensions.DynamicObjects library which provides dynamic objects. This adds the IDynamicMetaObjectProvider and ICustomTypeProvider
	  to the ModelBase class.",Catel.Extensions.DynamicObjects,True,2016-11-29T05:36:02.283-08:00,True,False,,"catel,data,model,modelbase,dynamic,object,IDynamicMetaObjectProvider,ICustomTypeProvider",76524,True,3.6.1308091537-beta
GeertvanHorrik,2013-08-10T15:01:43.683Z,507,1714,Catel.Extensions.Interception library which provides interception capabilities.,Catel.Extensions.Interception,True,2016-11-29T13:36:15.02+00:00,True,False,,"catel,interception",80898,True,3.6.1308101652-beta
Jason Jarrett,2013-08-09T17:01:10.597Z,498,1715,TypeScript Definitions (d.ts) for angularjs. Generated based off the DefinitelyTyped repository [git commit: 7de095160ed0e94164a048ea7dd29ac77db6e694]. http://github.com/DefinitelyTyped,angularjs.TypeScript.DefinitelyTyped,False,2016-12-08T14:02:01.133-08:00,True,False,,"TypeScript,JavaScript",888874,False,0.2.8
Frozen Mountain Software,2013-08-10T19:48:00.107Z,84,1714,A library for JavaScript that provides resilient peer-to-peer data streams through firewalls for live media.,FM.IceLink.JS,False,2018-01-26T02:26:11.287+00:00,True,False,,"IceLink,ICE,STUN,TURN,P2P,UDP,NAT,Firewall,Traversal,JavaScript",14948,False,2.3.4
James Craig,2013-08-10T03:40:03.697Z,782,1714,This adds TinyIoC as the bootstrapper used by Batman.,Batman.Core.Bootstrapper.TinyIoC,False,2016-02-28T10:34:48.853-08:00,True,False,This adds TinyIoC as the bootstrapper used by Batman.,"batman,framework,tinyioc",24563,False,1.0.22
GitHub,2013-08-09T13:19:42.347Z,229,1715,"An asynchronous, persistent key-value store for desktop and mobile applications on .NET",akavache,False,2017-09-03T10:40:08.227+00:00,True,False,"An asynchronous, persistent key-value store for desktop and mobile applications on .NET",,215508,False,3.0.2
GitHub,2013-08-09T13:19:45.77Z,229,1715,An implementation of ISuspensionDriver that uses Akavache to save app state on tombstoning.,akavache.mobile,False,2017-09-03T10:39:47.21+00:00,True,False,An implementation of ISuspensionDriver that uses Akavache to save app state on tombstoning.,,16118,False,3.0.2
James Craig,2013-08-10T02:58:46.7Z,782,1714,This is a Glimpse addon that adds a tab containing information from the Batman framework.,Glimpse.Batman,False,2016-02-28T10:36:13.86-08:00,True,False,This is a Glimpse addon that adds a tab containing information from the Batman framework.,"batman,framework,mvc,servicestack",15116,False,1.0.18
Paul Betts,2013-08-09T12:12:42.01Z,164,1715,ReactiveUI.Events adds Observable-based events to UI controls and other appropriate places.,reactiveui-events,False,2017-11-07T23:52:51.977+00:00,True,False,,,52348,False,5.1.0
James Craig,2013-08-10T03:44:41.677Z,782,1714,This adds the ability for Batman to interact with local files as well as urls.,Batman.Core.FileSystem.Default,False,2016-02-28T10:35:09.503-08:00,True,False,This adds the ability for Batman to interact with local files as well as urls.,"batman,framework,files,io",24150,False,1.0.23
James Craig,2013-08-10T03:17:42.227Z,782,1714,This is a Glimpse addon that adds a tab containing information from the Batman framework.,Glimpse.Batman,False,2016-02-28T10:36:13.86-08:00,True,False,This is a Glimpse addon that adds a tab containing information from the Batman framework.,"batman,framework,mvc,servicestack",15116,False,1.0.21
Khalid Salomão,2013-08-10T15:43:22.597Z,1714,1714,"A simple lightweight object pool for fast and simple object reuse.

Fast lightweight thread-safe object pool for objects that are expensive to create or could efficiently be reused.

Note: this nuget package contains c# source code and depends on System.Collections.Concurrent introduced in .Net 4.0.",SimpleHelpers.ObjectPool,False,2013-08-10T08:45:02.83-07:00,True,False,A simple lightweight object pool for fast and simple object reuse.,"SimpleHelpers,Utils,Pool",1635,False,1.0.3
Omar Salem,2013-08-09T11:54:15.187Z,1711,1715,"Avoid runtime error ""The model item passed into the dictionary is of type ‘X’ but this dictionary requires a model item of type ‘Y‘"".

https://github.com/Omar-Salem/StronglyTypedViews

The template generates truly strongly typed views to use in your controllers with zero configuration.",StronglyTypedViews,False,2013-08-13T05:47:24.967-07:00,True,False,,mvc,2457,False,1.0.8
Simon Cropp,2013-08-09T12:46:18.853Z,12,1715,Extensible tool for weaving .net assemblies.,Fody,False,2018-04-08T11:29:32.863+00:00,True,False,,"ILWeaving,Fody,Cecil,AOP",1754058,False,1.14.0
XemioNetwork,2013-08-10T16:56:07.847Z,1443,1714,Basic 2D game library for indie games.,Xemio-GameLibrary,False,2014-05-08T12:05:31.26-07:00,True,False,,"xemio,game,library,indie,2d,xna,gdi,render,rendering,sound,input",66019,False,0.5.21
ReflectSoftware,2013-08-09T14:09:06.527Z,310,1715,"Traditional simple text base logging frameworks lack what your application can easily emit in providing you better insight into the health of your application. Wouldn’t it be great to easily instrument incredible rich details? Well, look no further. ReflectInsight was designed to easily let your application speak volumes!

One of ReflectInsight’s most powerful features is its impressive and elegant Viewer. The Viewer was design to hone in on particular issues and filter any unwanted noise by creating User Defined Views. User Defined Views allow you to filter a given request and visualize the execution path that actually caused the issue at hand. 

Everyone knows that debugging multithread applications is no simple task. Due to racing conditions, traditional IDE debuggers are not well suited for the job and don’t really provide an accurate picture behind the scenes. With ReflectInsight’s Live Viewer, debugging multithread applications is that much easier!

In order to use this library you must have the ReflectInsight Viewer installed. Download and install the ReflectInsight Viewer from this location: 

http://www.ReflectSoftware.com/Public/Download.aspx

You can view your messages in realtime, in a rich viewer that allows you to filter out and search for what really matters to you.",ReflectSoftware.Insight,True,2017-06-14T11:52:01.39-07:00,True,False,"ReflectInsight - The Next Generation in Application Logging.

ReflectInsight goes beyond where no text-based logging has gone before.",".NET,Diagnostic,Debug,Trace,Logging,Extensions,ReflectInsight,Appender,Log,Tracing,RabbitMQ",13462,False,5.1.5-rc1
James Craig,2013-08-10T03:17:39.64Z,782,1714,"This adds the ServiceStack set of serializers (JSON, CSV, and XML) to Batman.",Batman.MVC.Serialization.ServiceStack,False,2016-02-28T10:36:06.977-08:00,True,False,"This adds the ServiceStack set of serializers (JSON, CSV, and XML) to Batman.","batman,framework,mvc,servicestack",18692,False,1.0.21
GitHub,2013-08-09T13:19:51.877Z,1612,1715,"An asynchronous, persistent key-value store for desktop and mobile applications on .NET",akavache.portable,False,2013-11-20T15:38:23.52-08:00,True,False,"An asynchronous, persistent key-value store for desktop and mobile applications on .NET",,5081,False,3.0.2
John Batte,2013-08-09T21:16:25.973Z,1535,1715,Code Patterns: Extensions for Autofac,Patterns.Autofac,False,2014-02-04T21:08:28.457-08:00,True,False,,,8183,False,3.9.1
Jonathan Oliver,2013-08-09T12:10:41.93Z,689,1715,Additional logging provider for NanoMessageBus using Log4Net v1.2.10.,NanoMessageBus.Log4Net,False,2016-05-31T09:44:07.653-07:00,True,False,Log4Net logging plugin for NanoMessageBus.,"messaging,service,bus,servicebus,nano,message,nanomessagebus,nmb,messages,logging,log4net",12212,False,2.0.41
Leon Meijer,2013-08-09T15:00:40.93Z,43209,1715,"Main package of the Co-Console SDK for using the Co-Console API. This is a Portable Class Library that can be referenced from .NET 4 and higher, .NET for Windows Store apps and Windows Phone 8 and newer",Lucy.CoConsole.ApiClient,False,1899-12-31T16:00:00-08:00,False,False,,,-1,False,1.8.5.65
James Craig,2013-08-10T03:44:49.99Z,782,1714,This adds the ability to bundle less files within Batman.,Batman.MVC.Assets.Less,False,2016-02-28T10:35:38.03-08:00,True,False,This adds the ability to bundle less files within Batman.,"batman,framework,mvc,less",19609,False,1.0.23
ReflectSoftware,2013-08-09T14:51:13.747Z,81,1715,"We've added support for the NLog appender. This allows you to leverage your current investment in NLog, but leverage the power and flexibility that comes with the ReflectInsight viewer. 

In order to use this extension you must have the ReflectInsight Viewer installed. Download and install the ReflectInsight Viewer from this location: 

http://www.ReflectSoftware.com/Public/Download.aspx

You can view your NLog messages in realtime, in a rich viewer that allows you to filter out and search for what really matters to you.",ReflectSoftware.Insight.Extensions.NLog,False,2018-01-29T01:30:40.397+00:00,True,False,ReflectInsight NLog logging extention makes it easy to integrate ReflectInsight into your existing application logging infrastructure and leverage the power of the ReflectInsight log viewer.,"NLog,Logging,Extensions,ReflectInsight,Appender,Log,Tracing,RabbitMQ",8735,False,5.1.6
Remo Gloor,2013-08-10T00:14:45.31Z,538,1714,Ninject extension to add ioc for WCF services when IIS hosting.,Ninject.Extensions.Wcf.WebHost,True,2016-10-29T07:18:50.853-07:00,True,False,Extension for Ninject providing integration with ASP.NET MVC WebAPI WebHost,"Ninject,ioc,di,wcf",32793,False,3.0.2-unstable-9009
CapableObjects,2013-08-09T18:56:45.647Z,1531,1715,Descr,EcoWeb,False,2014-02-09T03:25:38-08:00,True,False,,"ModelDrivenDevelopment,ECO,CapableObjects",26731,False,7.0.0.6638
Alexandre Mutel,2013-08-10T12:40:32.74Z,69,1714,Assembly providing DirectX - RawInput managed API.,SharpDX.RawInput,False,2018-02-10T09:05:27.05+00:00,True,False,,"SharpDX,DirectX,Direct3D,MDX,RawInput",28766,True,2.5.0
Steve Greatrex,2013-08-09T20:24:55.217Z,101,1715,Helper extensions for KnockoutJs,ko.plus,False,2018-01-09T20:44:20.947+00:00,True,False,,"JavaScript,KnockoutJS",9228,False,0.0.3
eXpand,2013-08-09T14:40:54.643Z,1089,1715,ExceptionHandling Module (Web) / eXpand Framework,eXpandExceptionHandlingWeb,False,2015-04-27T12:07:21.237-07:00,True,False,ExceptionHandling Module (Web) / eXpand Framework,"DevExpress,eXpand",56866,False,13.1.5.25
eXpand,2013-08-09T14:41:46.73Z,1715,1715,JobSheduler Module (Win) / eXpand Framework,eXpandJobShedulerWin,False,2013-08-09T07:41:46.73-07:00,True,False,JobSheduler Module (Win) / eXpand Framework,"DevExpress,eXpand",32036,False,13.1.5.25
eXpand,2013-08-09T14:43:11.347Z,695,1715,Thumbnail Module (Web) / eXpand Framework,eXpandThumbnailWeb,False,2016-05-25T07:49:22.287-07:00,True,False,Thumbnail Module (Web) / eXpand Framework,"DevExpress,eXpand",59041,False,13.1.5.25
MefContrib,2013-08-09T16:06:43.037Z,43209,1715,Managed Extensibility Framework (MEF) and Unity integration.,MefContrib.Integration.Unity.Unofficial,False,1900-01-01T00:00:00+00:00,False,False,Managed Extensibility Framework (MEF) and Unity integration.,"mef,ioc,di,dependency,injection,mvc,composition,unity",-1,False,1.2.2.2
GeertvanHorrik,2013-08-09T13:47:53.16Z,1645,1715,Compass service for Catel to use the compass as a service in MVVM. Also contains a unit test version to simulate the compass.,Catel.MVVM.Services.Compass,True,2013-10-18T04:22:18.253-07:00,True,False,,"mvvm,catel,compass,services,wp,wp7,windows,phone",25382,True,3.6.1308091537-beta
