authors,created,days_abandoned,days_alive,description,id,is_prerelease,last_updated,listed,missing_info,summary,tags,total_downloads,verified,versionFlowWPF Project,2016-03-24T11:02:46.767Z,43209,757,Flow WPF - a library to build flow diagrams with MVVM,FlowWPF,False,1900-01-01T00:00:00+00:00,False,False,"Free of charge, royalty free.

Required: 
-License and copyright notice

Forbidden:
-Modification
-Patent use

Permitted:
-Commercial use
-Distribution",,-1,False,0.8.21
latticework,2016-03-24T08:00:58.66Z,1733,757,latticework.cs,latticework.cs,False,2013-07-22T14:32:56.307+00:00,True,False,,,312286,False,0.0.1550
Egor Bogatov,2016-03-24T13:18:26.657Z,757,757,"Don't be so NIH, use this package!",left-pad,False,2016-03-24T14:02:29.95-07:00,True,False,it does left-pad!,"left-pad,pad-left,Leftpad,padleft,pad,left",727,False,0.9.11
Paket team,2016-03-24T14:46:17.673Z,357,757,A package dependency manager for .NET with support for NuGet packages and GitHub repositories.,Paket.PowerShell,True,2017-04-28T07:19:40.903+00:00,True,False,A package dependency manager for .NET with support for NuGet packages and GitHub repositories.,"nuget,bundler,F#",138115,False,3.0.0-alpha083
,,-1,-1,,Inovout.Data.1.0.7,,,,True,,,,,1.0.7
E-iceblue,2014-05-09T09:53:04.137Z,10,1442,"Spire.Doc for .NET, specially designed for developers, enables to fast generate, open, write, edit and save Word document from Word Version 97-2003 to 2013. The featured function conversion enables developers to easily realize conversion between Word and other popular document formats such as Word to PDF/EPub/HTML/RTF/Image/XML etc.

Spire.Doc for .NET is a totally independent .NET Word class library which doesn't require Microsoft Office installed on system. Microsoft Office Automation is proved to be unstable, slow and not scalable to produce MS Word documents. Spire.Doc for .NET is many times faster than Microsoft Word Automation and with much better stability and scalability. 

By using Spire.Doc for .NET, users can save Word Doc/Docx to stream, save as web response and convert Word Doc/Docx to XML, RTF, EMF, TXT, XPS, EPUB, HTML and vice versa. Spire.Doc for .NET also supports to convert Word Doc/Docx to PDF and HTML to image. 

A common use of Spire.Doc for .NET is to create Word document dynamically from scratch. Almost all Word document elements are supported. Mainly includes page, sections, headers, footers, footnotes, paragraphs, lists, tables, text, fields, hyperlinks, bookmarks, comments, images, styles, background settings, printing features, document settings and protection. Furthermore, drawing objects including shapes, textboxes, images, OLE objects and controls are supported as well. 

Spire.Doc for .NET enables developers to process pre-existing Word documents. It supports search and replace function, alignment, page break, fill field, document concatenate, document copy, print, complex and deeply nested mail merge, etc.",Spire.Doc,False,2018-04-10T06:30:58.277+00:00,False,False,Spire.Doc for .NET is a professional and powerful .NET Word library to process a large range of Word tasks in C# and Visual Basic for .NET (2.0/3.5/4.0/4.0 ClientProfile/4.5),"words,Word,TEXT,RTF,doc,docx,PDF,XPS,HTML,Image,XTML,word,document,EPUB",89780,False,5.1.6
"Suresh Balasubramanian,Matt Gray,Rami Abughazaleh,Mattias Kindborg,and contributors",2016-03-24T08:35:19.683Z,363,757,"CUITe (Coded UI Test enhanced) Framework is a thin layer developed on top of Microsoft Visual Studio Team Test's Coded UI Test engine which helps reduce code, increases readability and maintainability, while also providing a bunch of cool features for the automation engineer.",CUITe.Silverlight.VS2013,True,2017-04-22T03:06:09.877-07:00,True,False,,"cuit,cuite,coded,ui,test,enhanced,silverlight,visual,studio,2013,vs2013",5400,False,2.0.262-beta
JACKY,2016-03-24T07:09:43.97Z,43209,757,金软科技基础开发框架Asp.Net WebForm运行时文件,GoldSoft.Basic.Web,False,1899-12-31T16:00:00-08:00,False,False,,,-1,False,4.0.2016.225
cy.a.scott,2016-03-24T04:17:45.733Z,752,757,Runs RabbitMQ as a portable process so that integration testing can be done.,RabbitMQ2Go,False,2016-03-29T10:48:47.713-07:00,True,False,,"Erlang,RabbitMQ",713,False,1.0.2
Intersoft Solutions,2016-03-24T03:14:39.7Z,7,757,"Crosslight is an advanced development toolset for building rich cross-platform mobile applications with 100% shared UI logic. Supported platforms include iOS, Android, and Windows.",Intersoft.Crosslight,False,2018-04-13T08:30:28.573+00:00,True,False,,"Intersoft,Crosslight,MVVM,iOS,Android,WindowsPhone,WinPhone,Windows,Xamarin,Cross-Platform,Mobile",54072,False,5.0.5000.574
Chillisoft,2016-03-24T04:02:42.807Z,365,757,Habanero.Binding,Habanero.Binding,True,2017-04-20T04:02:51.37+00:00,True,False,,,144869,False,1.2.2183-prerelease
Prolucid,2016-03-24T14:56:19.287Z,11,757,Apache Storm components and topologies authoring with F#,FsShelter,True,2018-04-09T21:05:09.193+00:00,True,False,,"Storm,F#,event-driven,real-time,distributed,analytics",4244,False,0.0.1-beta
Dinand Veldman,2016-03-24T10:00:59.87Z,739,757,This package contains a generic ScriptingHost for using c# scripts in a .net application. Tested for return types string and List<>,Sommite.Scripting,False,2016-04-11T09:45:04.05-07:00,True,False,,,955,False,1.160.3241
RIBA,2016-03-24T10:22:37.707Z,746,757,Riba payment systems,Riba.Payment.Web,False,2016-04-04T02:44:53.6-07:00,True,False,,RIBA,592,False,3.1.5
HiQPdf Software,2016-03-24T08:50:17.33Z,244,757,"The HiQPdf Library for .NET offers you a modern, simple, fast, flexible and powerful tool to create complex and stylish PDF documents in your applications with just a few lines of code.

This version of the HiQPdf library can run only in 64-bit applications. The normal version of the library can run both in 32-bit and 64-bit applications, but if you convert very large HTML documents you should consider using this package to avoid running out of process memory.

Using the high quality HTML to PDF conversion engine you can easily design a document in HTML with CSS3, JavaScript, SVG or Canvas and then convert it to PDF preserving the exact content and style.

The HiQPdf Library for .NET offers you the fastest and the most precise HTML to PDF conversion technology to use in your Web and Desktop applications. The HTML to PDF Converter can convert to PDF any HTML document or URL that a modern browser can display, preserving all the CSS styles and executing all the JavaScript scripts found in the HTML document.

Besides the common features a HTML to PDF Converter must have, the HiQPdf component has some unique features on the market like the full support for web fonts, the ability to convert only a selected region of the HTML document or the possibility to overlap multiple HTML documents in the same PDF while preserving the transparent backgrounds and images from the HTML document.

The HiQPdf Library is much more than just a HTML to PDF converter. The HTML to PDF conversion engine is the most important feature, but the HiQPdf software is a complete PDF library for .NET that you can use to create new PDF documents and add text and images at the desired positions in pages in a traditional manner, open and edit external PDF documents by adding new objects, create PDF documents with interactive forms, fill and submit interactive forms, merge and split PDF documents, extract text and images from PDF documents, search text in PDF documents, rasterize PDF pages to images.",hiqpdf_x64,False,2017-08-19T11:58:28.39+00:00,True,False,"The HiQPdf Library for .NET offers you a modern, simple, fast, flexible and powerful tool to create complex and stylish PDF documents in your applications with just a few lines of code.","HTML,PDF,Converter,Library,.NET,to,HTML-to-PDF,HTML-to-PDF-Converter,HTML-to-PDF-.NET,HTML-to-PDF-Converter-.NET,PDF-Library,PDF-Library-.NET",10620,False,9.12.0
dpiessens,2016-03-24T02:41:00.013Z,157,757,A SpecFlow plugin used to generate the correct test class attributes for SpecBind web drivers.,SpecBindGeneratorPlugin.SpecFlow,False,2017-11-14T21:23:42.287+00:00,True,False,A SpecFlow plugin used to generate the correct test class attributes for SpecBind web drivers.,"specflow,specbind",13998,False,1.7.0.268
CareerHub,2016-03-24T06:21:27.033Z,757,757,Provides Assertions for Budgerigar Budget Results,Budgerigar.XUnit,False,2016-03-23T23:21:27.033-07:00,True,False,,"Performance,PerformanceBudgetting,ASP.NET,XUnit",1453,False,1.0.15
"Steffen Forkmann,Mauricio Scheffer,Colin Bull",2016-03-24T11:43:52.167Z,5,757,FAKE - F# Make - is a build automation tool for .NET. Tasks and dependencies are specified in a DSL which is integrated in F#. Extensions for FluentMigrator,FAKE.FluentMigrator,False,2018-04-15T16:40:20.39+00:00,True,False,FAKE - F# Make - Get rid of the noise in your build scripts.,"build,fake,f#",33060,False,4.22.8
Kam Figy,2016-03-24T03:52:41.17Z,302,757,An advanced serialization library for Sitecore. Install the Rainbow package if you want the config file with the library,Rainbow.Core,False,2017-06-22T12:55:53.903-07:00,True,False,,"sitecore,serialization",171123,False,1.3.0
Intersoft Solutions,2016-03-24T03:16:37.863Z,7,757,Provides GPS location services for Crosslight development.,Intersoft.Crosslight.Services.Location,False,2018-04-13T08:33:15.52+00:00,True,False,,"Intersoft,Crosslight,Services,Location,PCL,Portable,Class,Library,GPS,iOS,Android,Xamarin,Cross-Platform",42745,False,5.0.5000.574
JACKY,2016-03-24T08:12:00.16Z,43209,757,金软科技基础开发框架WinForm运行时文件,GoldSoft.Basic.Forms,False,1899-12-31T16:00:00-08:00,False,False,,,-1,False,4.0.2016.227
Analyze Re,2016-03-24T01:27:52.113Z,74,757,A testing framework for the Analyze Re Client Library,AnalyzeRe.Client.Test,True,2018-02-05T19:39:30.553+00:00,True,False,,"AnalyzeRe,Analyze,Re,Client,Library,Test",26686,False,1.6.0-beta1
,,-1,-1,,Inovout.Web.Mvc-beat,,,,True,,,,,1.0.0
李晓静,2016-03-24T02:40:18.07Z,667,757,RPC调用类库，主要提供负载均衡、容错调用算法,Easy.Rpc,False,2016-06-22T06:16:27.867+00:00,True,False,,,2436,False,1.0.1.1
Spoon Software,2016-03-24T00:31:59.95Z,757,757,"One of the fastest & easiest ways to create, edit, convert & save bitmaps!",Fast-Bitmap,False,2016-03-24T00:31:59.95+00:00,True,False,,,1814,False,1.1.2
Luc,2015-12-20T19:30:37.99Z,50,852,"Afk.ZoneInfo is a .Net library 3.5 which use the Iana timezone database. By default the library is linked with database files, to override it set the environment variable TZDIR with the new directory of database files.",Afk.ZoneInfo,False,2018-03-01T14:41:58.43+00:00,True,False,An alternative to the framework 3.5 class System.TimeZoneInfo with IANA database,"timezone,datetime,zoneinfo,iana,c#,olson",2577,False,1.4.0
O.Ilnytskiy,2016-03-24T08:38:29.903Z,724,757,My package description.,WinnersChoiceDomains,False,2016-04-26T03:49:24.697-07:00,True,False,,,2469,False,1.0.0
Trackmatic Solutions (Pty) Ltd,2016-03-24T07:05:57.97Z,199,757,An object graph mapping library for .Net,Plot.Neo4j,False,2017-10-03T12:46:51.223+00:00,True,False,,"plot,n4g,ogm,neo4j",5738,False,0.1.17
FlowWPF Project,2016-03-24T11:02:46.767Z,43209,757,Flow WPF - a library to build flow diagrams with MVVM,FlowWPF,False,1900-01-01T00:00:00+00:00,False,False,"Free of charge, royalty free.

Required: 
-License and copyright notice

Forbidden:
-Modification
-Patent use

Permitted:
-Commercial use
-Distribution",,-1,False,0.8.21
Intersoft Solutions,2016-03-24T07:59:35.75Z,7,757,"Provides end-to-end push messaging functionality to your Crosslight apps. Supports iOS, Android and Windows for the client platforms and .NET 4.5 for the server platforms.",Intersoft.Crosslight.Services.PushNotification,False,2018-04-13T08:33:30.723+00:00,True,False,,"Intersoft,Crosslight,Services,Push,Notification,PNS,PushNotification,Client,Server,PCL,Portable,Class,Library,iOS,Android,WinPhone,WindowsPhone,Phone,Xamarin",45998,False,5.0.5000.575
Hibernating Rhinos,2016-03-24T05:12:29.34Z,43209,757,"Use this package if you want extend RavenDB. Don't use this package if you just want to work with existing RavenDB server, in order to so just use the client API which is in the RavenDB.Client package. RavenDB is a document database for the .NET platform, offering a flexible data model design to fit the needs of real world systems.

Note: If you encounter issue to install this package, please consult the following link: https://groups.google.com/forum/#!topic/ravendb/4TeMq7_7Esc",RavenDB.Database,True,1900-01-01T00:00:00+00:00,False,False,This package allows you to extend RavenDB database.,"nosql,ravendb,raven,document,database",663109,True,3.5.35073-Unstable
Charles Solar,2016-03-24T03:27:05.71Z,43209,757,"A framework to help developers integrate the excelent NServicebus and GetEventStore libraries together and provide basic DDD classes.
      This package contains entities for DDD such as aggregates, entities, repository, value object, etc",Aggregates.NET.Domain,False,1900-01-01T00:00:00+00:00,False,False,,"CQRS,NServicebus,GetEventStore,eventstore,event,store,aggregate,ddd,repository,unit,of,work,uow",-1,False,0.2.1.202
rzmoz,2016-03-24T09:09:16.32Z,43209,757,Syntactical sugar and commonly used functionality,DotNet.Basics,True,1900-01-01T00:00:00+00:00,False,False,,,20433,False,1.0.26-preview
苏州联纺信息技术服务有限公司,2016-03-24T01:03:22.04Z,43209,757,通用方法,UTSoft.Utils,False,1899-12-31T16:00:00-08:00,False,False,,UTSoft,-1,False,1.0.0
JACKY,2016-03-24T04:20:12.627Z,43209,757,金软科技基础开发框架实体验证模型运行时文件,GoldSoft.Basic.Validation,False,1899-12-31T16:00:00-08:00,False,False,,,-1,False,4.0.2016.224
ristona,2016-03-11T14:19:07.497Z,43209,770,This package contains the runtime assemblies for ASP.NET MVC.,Inovout.Web-beat,False,1899-12-31T16:00:00-08:00,False,False,This package contains the runtime assemblies for ASP.NET MVC.,"inovout,Web",-1,False,1.0.0
JACKY,2016-03-24T03:22:53.13Z,43209,757,金软科技基础开发框架数据持久类运行时文件,GoldSoft.Basic.Configuration,False,1899-12-31T16:00:00-08:00,False,False,,,-1,False,4.0.2016.223
Intersoft Solutions,2016-03-24T07:59:18.373Z,7,757,"Provides high-performance, async image loading capabilities to your Crosslight apps, featuring smart queue, smooth animation, and various cache options.",Intersoft.Crosslight.Services.ImageLoader,False,2018-04-13T08:33:01.52+00:00,True,False,,"Intersoft,Crosslight,Services,ImageLoader,Image,Loader,Cross-Platform,PCL,Portable,Class,Library",45398,False,5.0.5000.575
Semiodesk,2016-03-24T12:35:21.12Z,161,757,"Semiodesk Trinity is a high-level C# API for querying and manipulating RDF triplestores. Semiodesk Trinity offers a Object-Mapping mechanism which also supports all the features that makes RDF great, for example being schema-less and inferencing.",Semiodesk.Trinity.Core,True,2017-11-10T12:19:51.287+00:00,True,False,,"RDF,SPARQL,Database,Semantic,Object,Mapping,Linked,Data",4554,False,0.9.133-rc
"Omise Co.,Ltd.",2016-03-24T11:05:56.54Z,119,757,Omise payment gateway .Net API wrapper library.,Omise,False,2017-12-22T06:01:22.213+00:00,True,False,,"Omise,C#,payment,gateway,credit,card",7606,False,2.0.5.32544
"Suresh Balasubramanian,Matt Gray,Rami Abughazaleh,Mattias Kindborg,and contributors",2016-03-24T07:30:46.7Z,363,757,"CUITe (Coded UI Test enhanced) Framework is a thin layer developed on top of Microsoft Visual Studio Team Test's Coded UI Test engine which helps reduce code, increases readability and maintainability, while also providing a bunch of cool features for the automation engineer.",CUITe.Silverlight.VS2013,True,2017-04-22T03:06:09.877-07:00,True,False,,"cuit,cuite,coded,ui,test,enhanced,silverlight,visual,studio,2013,vs2013",5400,False,2.0.261-beta
zqb,2014-07-02T06:13:42.367Z,43209,1388,THOK.ParamUtil,THOK.ParamUtil,False,1899-12-31T16:00:00-08:00,False,False,,,-1,False,1.0.0
Paket team,2016-03-24T07:55:30.083Z,357,757,A package dependency manager for .NET with support for NuGet packages and GitHub repositories.,Paket.PowerShell,False,2017-04-28T07:19:40.903+00:00,True,False,A package dependency manager for .NET with support for NuGet packages and GitHub repositories.,"nuget,bundler,F#",138115,False,2.55.3
E-iceblue,2016-02-01T09:15:44.24Z,10,809,"Spire.Doc for .NET, specially designed for developers, enables to fast generate, open, write, edit and save Word document from Word Version 97-2003 to 2013. The featured function conversion enables developers to easily realize conversion between Word and other popular document formats such as Word to PDF/EPub/HTML/RTF/Image/XML etc.

Spire.Doc for .NET is a totally independent .NET Word class library which doesn't require Microsoft Office installed on system. Microsoft Office Automation is proved to be unstable, slow and not scalable to produce MS Word documents. Spire.Doc for .NET is many times faster than Microsoft Word Automation and with much better stability and scalability. 

By using Spire.Doc for .NET, users can save Word Doc/Docx to stream, save as web response and convert Word Doc/Docx to XML, RTF, EMF, TXT, XPS, EPUB, HTML and vice versa. Spire.Doc for .NET also supports to convert Word Doc/Docx to PDF and HTML to image. 

A common use of Spire.Doc for .NET is to create Word document dynamically from scratch. Almost all Word document elements are supported. Mainly includes page, sections, headers, footers, footnotes, paragraphs, lists, tables, text, fields, hyperlinks, bookmarks, comments, images, styles, background settings, printing features, document settings and protection. Furthermore, drawing objects including shapes, textboxes, images, OLE objects and controls are supported as well. 

Spire.Doc for .NET enables developers to process pre-existing Word documents. It supports search and replace function, alignment, page break, fill field, document concatenate, document copy, print, complex and deeply nested mail merge, etc.",Spire.Doc,False,2018-04-10T06:30:58.277+00:00,False,False,Spire.Doc for .NET is a professional and powerful .NET Word library to process a large range of Word tasks in C# and Visual Basic for .NET (2.0/3.5/4.0/4.0 ClientProfile/4.5),"words,Word,TEXT,RTF,doc,docx,PDF,XPS,HTML,Image,XTML,word,document,EPUB",89780,False,5.6.16
Intersoft Solutions,2016-03-24T07:57:59.41Z,7,757,Provides essential data components to your Crosslight apps.,Intersoft.Crosslight.Data,False,2018-04-13T08:30:59.497+00:00,True,False,,"Intersoft,Crosslight,Data,Access,Components,Cross-Platform,PCL,Portable,Class,Library",46791,False,5.0.5000.575
"Steffen Forkmann,Mauricio Scheffer,Colin Bull",2016-03-24T11:44:27.31Z,5,757,FAKE - F# Make - is a build automation tool for .NET. Tasks and dependencies are specified in a DSL which is integrated in F#. Extensions for IIS,FAKE.IIS,False,2018-04-15T16:41:34.643+00:00,True,False,FAKE - F# Make - Get rid of the noise in your build scripts.,"build,fake,f#",187365,False,4.22.8
HiQPdf Software,2016-03-24T08:46:15.117Z,244,757,"The HiQPdf Library for .NET offers you a modern, simple, fast, flexible and powerful tool to create complex and stylish PDF documents in your applications with just a few lines of code.

This version of the HiQPdf library can run both in 32-bit and 64-bit applications. When you convert very large HTML documents it is possible to run out of memory and in this case you should consider using the special package for x64-based systems.

Using the high quality HTML to PDF conversion engine you can easily design a document in HTML with CSS3, JavaScript, SVG or Canvas and then convert it to PDF preserving the exact content and style.

The HiQPdf Library for .NET offers you the fastest and the most precise HTML to PDF conversion technology to use in your Web and Desktop applications. The HTML to PDF Converter can convert to PDF any HTML document or URL that a modern browser can display, preserving all the CSS styles and executing all the JavaScript scripts found in the HTML document.

Besides the common features a HTML to PDF Converter must have, the HiQPdf component has some unique features on the market like the full support for web fonts, the ability to convert only a selected region of the HTML document or the possibility to overlap multiple HTML documents in the same PDF while preserving the transparent backgrounds and images from the HTML document.

The HiQPdf Library is much more than just a HTML to PDF converter. The HTML to PDF conversion engine is the most important feature, but the HiQPdf software is a complete PDF library for .NET that you can use to create new PDF documents and add text and images at the desired positions in pages in a traditional manner, open and edit external PDF documents by adding new objects, create PDF documents with interactive forms, fill and submit interactive forms, merge and split PDF documents, extract text and images from PDF documents, search text in PDF documents, rasterize PDF pages to images.",hiqpdf,False,2017-08-19T11:55:58.87+00:00,True,False,"The HiQPdf Library for .NET offers you a modern, simple, fast, flexible and powerful tool to create complex and stylish PDF documents in your applications with just a few lines of code.","HTML,PDF,Converter,Library,.NET,to,HTML-to-PDF,HTML-to-PDF-Converter,HTML-to-PDF-.NET,HTML-to-PDF-Converter-.NET,PDF-Library,PDF-Library-.NET",107460,False,9.12.0
Intersoft Solutions,2016-03-24T03:15:29.507Z,7,757,Provides powerful yet lightweight logging functionality to your Crosslight apps. Supports all client and server platforms.,Intersoft.Crosslight.Logging,False,2018-04-13T08:31:33.157+00:00,True,False,,"Intersoft,Crosslight,Logging,Log,Xamarin,iOS,Android,WinPhone,Windows,Phone,Client,Server,PCL,Portable,Class,Library",45017,False,5.0.5000.574
KB Lee,2016-03-24T11:54:11.793Z,43209,757,My package description.,KBNugetExample,False,1899-12-31T16:00:00-08:00,False,False,,,-1,False,1.0.0
ristona,2016-03-11T10:02:46.37Z,43209,770,This package contains the runtime assemblies for ASP.NET MVC.,Inovout.Data-beat,False,1899-12-31T16:00:00-08:00,False,False,This package contains the runtime assemblies for ASP.NET MVC.,"inovout,data",-1,False,1.0.0
Adrián Parisi,2016-03-24T04:58:16.823Z,458,757,Some common tools for .NET,SomeTools,False,2017-01-17T14:26:14.6-08:00,True,False,,,430,False,1.0.0
Dwivedi Vishal Sridhar Arya,2016-03-24T06:47:11.97Z,599,757,"Change Log--
1. SendMail logic changes
2. Reporting-UI Bug Fixes.",UnifiedFrameWork,False,2016-08-29T14:25:31.913+00:00,True,False,,,3247,False,1.1.1.6
Kam Figy,2016-03-24T03:52:59.6Z,302,757,Implements a YAML-based serialization format as a Rainbow data store,Rainbow.Storage.Yaml,False,2017-06-22T12:56:17.327-07:00,True,False,,sitecore,170329,False,1.3.0
ByteScout,2016-03-24T10:59:14.187Z,9,757,"Bytescout PDF To HTML SDK for .NET ASP.NET, ActiveX

(c) ByteScout 2008-2016

Bytescout PDF To HTML SDK converts PDF to HTML without any additional software required.

Benefits:

- converts PDF to HTML with layout preserved;
- text, fonts, images, tables are preserved;
- vector graphics is preserved (as a background images)
- precise positioning of text and images to reproduce the original PDF file
- doesn't require Adobe Reader or any other 3rd software to be installed;
- works with .NET 2.00, 3.5, 4.00 for desktop applications;
- works with ASP.NET 2.00, 3.5, 4.00 for web-applications;
- provides access via ActiveX interface for use by legacy programming languages (Visual Basic 6, old versions of Delphi) and scripting (VBscript and others);

http://bytescout.com/",Bytescout.PDF2HTML,False,2018-04-11T12:21:16.477+00:00,True,False,,"bytescout,pdf,html,to,htm,text",5272,False,6.30.0.2426
CareerHub,2016-03-24T03:30:04.68Z,401,757,Adds HAL support to ASP.NET WebAPI,Halcyon.WebApi,True,2017-03-14T19:01:18.9-07:00,True,False,,"Hypermedia,ASP.NET,HAL,JSON,WebApi",6522,False,1.1.63-alpha
Intersoft Solutions,2016-03-24T03:15:47.893Z,7,757,Provides server logging functionality that use Entity Framework for the storage.,Intersoft.Crosslight.Logging.EntityFramework,False,2018-04-13T08:32:00.563+00:00,True,False,,"Intersoft,Crosslight,Logging,Entity,Framework,EF,PCL,Portable,Class,Library,Log",43620,False,5.0.5000.574
"Steffen Forkmann,Mauricio Scheffer,Colin Bull",2016-03-24T11:44:49.913Z,5,757,FAKE - F# Make - is a build automation tool for .NET. Tasks and dependencies are specified in a DSL which is integrated in F#. FAKE helper functions as library,FAKE.Lib.x64,False,2018-04-15T16:42:22.427+00:00,True,False,FAKE - F# Make - Get rid of the noise in your build scripts.,"build,fake,f#",53366,False,4.22.8
Analyze Re,2016-03-24T01:13:29.85Z,74,757,A client library for Analyze Re high performance analytics services,AnalyzeRe.Client,False,2018-02-05T19:32:10.13+00:00,True,False,,"AnalyzeRe,Analyze,Re,Client,Library",26748,False,1.5.5926.39996
"Suresh Balasubramanian,Matt Gray,Rami Abughazaleh,Mattias Kindborg,and contributors",2016-03-24T07:31:07.09Z,363,757,"CUITe (Coded UI Test enhanced) Framework is a thin layer developed on top of Microsoft Visual Studio Team Test's Coded UI Test engine which helps reduce code, increases readability and maintainability, while also providing a bunch of cool features for the automation engineer.",CUITe.VS2012,True,2017-04-22T03:06:35.27-07:00,True,False,,"cuit,cuite,coded,ui,test,enhanced,visual,studio,2012,vs2012",4708,False,2.0.261-beta
camle,2016-03-24T14:52:39.18Z,43209,757,Business objects application framework.,Worm,False,1899-12-31T16:00:00-08:00,False,False,,,44856,False,1.0.483
