authors,created,days_abandoned,days_alive,description,id,is_prerelease,last_updated,listed,missing_info,summary,tags,total_downloads,verified,version
MvvmCross,2013-07-12T09:46:26.173Z,43209,1743,This package contains the 'All' plugin for MvvmCross v3 - Hot Tuna. This and other packages are currently under development...,MvvmCross.HotTuna.Plugin.All,True,1899-12-31T16:00:00-08:00,False,False,,"mvvm,mvvmcross,xamarin,monodroid,monotouch,wpf,windows8,winrt,netcore,wp,wpdev,windowsphone",-1,False,3.0.9-beta8
Akash Shrivastav,2013-07-12T09:52:37.737Z,1743,1743,My package description.,CodeFirst_FluentApi,False,2013-07-12T02:52:37.737-07:00,True,False,,,792,False,1.0.0
Contoso,2013-07-11T21:47:23.403Z,43209,1744,This package contains Microsoft SQL Server implementations of the Event-Sourceing storage for the abstract AggregateRoot.,BclContrib-Abstract.Sqll,False,1899-12-31T16:00:00-08:00,False,False,,"mssql,nosql,sql,aggregateroot,event,eventsourcing,bclex",-1,False,1.0.1
Steven Sanderson,2013-07-12T09:35:29.317Z,410,1743,"A JavaScript MVVM library to help you create rich, dynamic user interfaces with clean maintainable code",knockoutjs,False,2017-03-06T13:48:41.72-08:00,True,False,,"knockout,mvvm",10035291,False,2.3.0
Jason Jarrett,2013-07-12T01:00:57.01Z,577,1743,TypeScript Definitions (d.ts) for requirejs. Generated based off the DefinitelyTyped repository [git commit: 53dc0d5c2682ed71ac02268c89f28bc7b7e53005]. http://github.com/DefinitelyTyped,requirejs.TypeScript.DefinitelyTyped,False,2016-09-20T09:03:23.41-07:00,True,False,,"TypeScript,JavaScript",176877,False,0.0.5
Michel Perfetti,2013-07-12T19:53:12.363Z,92,1743,WiLinq is a workitem linq provider targeting TFS 2012 API,Wilinq,False,2018-01-18T16:19:05.367+00:00,True,False,,"Linq,WorkItem,TFS",3166,False,0.1.0
DevDigital,2013-07-12T16:13:47.517Z,1731,1743,Provides common data access for .NET applications.,Qi.Data.EntityFramework,False,2013-07-24T01:35:06.683-07:00,True,False,,,3277,False,1.0.12
eXpand,2013-07-11T22:47:10.183Z,11,1744,XtraDashboard Module (Win) / eXpand Framework,eXpandXtraDashboardWin,False,2018-04-09T16:27:13.61+00:00,True,False,XtraDashboard Module (Win) / eXpand Framework,"DevExpress,eXpand",47435,False,13.1.5.6
Autofac Contributors,2013-07-12T12:25:00.357Z,1743,1743,ASP.NET MVC4 Integration for Autofac,Autofac.Mvc4,False,2013-07-12T05:25:00.357-07:00,True,False,Provides an IControllerFactory implementation and other integration points for System.Web.Mvc.,,312444,False,3.1.0
Ben Dornis,2013-07-11T20:07:55.48Z,1725,1744,"Parrot a view engine that focuses on clean, familiar, css-like syntax.",Parrot,False,2013-07-29T17:16:24.727-07:00,True,False,,view-engine,3948,False,1.0.2
MvvmCross,2013-07-12T06:59:26.31Z,43209,1743,This package contains the 'SoundEffects' plugin for MvvmCross v3 - Hot Tuna. This and other packages are currently under development...,MvvmCross.HotTuna.Plugin.SoundEffects,True,1900-01-01T00:00:00+00:00,False,False,,"mvvm,mvvmcross,xamarin,monodroid,monotouch,wpf,windows8,winrt,netcore,wp,wpdev,windowsphone",-1,False,3.0.9-beta7
Contoso,2013-07-11T21:17:23.827Z,1744,1744,This package contains implementations of abstract Services for System.Web.,BclEx-Abstract.Web,False,2013-07-11T14:17:23.827-07:00,True,False,,"servicecache,web,bclex",578,False,1.0.0
DevDigital,2013-07-12T14:48:52.53Z,1731,1743,Provides common data access for .NET applications.,Qi.Data,False,2013-07-24T01:34:34.733-07:00,True,False,,,2231,False,1.0.8
Andrew Hutchinson,2013-07-12T09:51:33.71Z,1687,1743,A really simple example of how to authenticate using twitter oAuth and retrieve a timeline/search. No need for 3rd party and can be used in any .net project.,oAuthTwitterWrapper,False,2013-09-06T09:33:36.41-07:00,True,False,,"Twitter,TwitterFeed",4542,False,1.0.1
Contoso,2013-07-11T21:17:13.1Z,1744,1744,This package contains a Spring.Net implementation of the abstract ServiceLocator.,BclEx-Abstract.Spring,False,2013-07-11T14:17:13.1-07:00,True,False,,"spring.net,servicelocator,ioc,di,bclex",584,False,1.0.0
MvvmCross,2013-07-12T06:59:15.977Z,43209,1743,This package contains the 'PictureChooser' plugin for MvvmCross v3 - Hot Tuna. This and other packages are currently under development...,MvvmCross.HotTuna.Plugin.PictureChooser,True,1899-12-31T16:00:00-08:00,False,False,,"mvvm,mvvmcross,xamarin,monodroid,monotouch,wpf,windows8,winrt,netcore,wp,wpdev,windowsphone",-1,False,3.0.9-beta7
Contoso,2013-07-11T21:16:13.54Z,1744,1744,This package contains an Autofac implementation of the abstract ServiceLocator.,BclEx-Abstract.Autofac,False,2013-07-11T14:16:13.54-07:00,True,False,,"autofac,servicelocator,ioc,di,bclex",592,False,1.0.0
MvvmCross,2013-07-12T06:58:51.543Z,43209,1743,This package contains the 'FieldBinding' plugin for MvvmCross v3 - Hot Tuna. This and other packages are currently under development...,MvvmCross.HotTuna.Plugin.FieldBinding,True,1899-12-31T16:00:00-08:00,False,False,,"mvvm,mvvmcross,xamarin,monodroid,monotouch,wpf,windows8,winrt,netcore,wp,wpdev,windowsphone",-1,False,3.0.9-beta7
eXpand,2013-07-11T22:45:06.553Z,11,1744,"Extends XAF by adding great new features for example;

◦the ability to generate runtime members for your objects, 
◦creating Application/Role/User models in the database, 
◦storing your web cookies in the database, 
◦handling of external application models, 
◦combine end user modifications with application model, 
◦support for multiple models at design time,
Blogs:
http://apobekiaris.blogspot.com/search/label/ModelDifference",eXpandModelDifferenceWin,False,2018-04-09T16:17:41.383+00:00,True,False,Model managment,"DevExpress,eXpand",70277,False,13.1.5.6
DevDigital,2013-07-12T15:05:03.627Z,1731,1743,Provides common data access for .NET applications.,Qi.Data.EntityFramework,False,2013-07-24T01:35:06.683-07:00,True,False,,,3277,False,1.0.9
KellermanSoftware,2013-07-12T14:01:17.797Z,254,1743,"Commercial Encryption Library for .NET.  Features: Encrypt strings, files, & streams, Symmetric Encryption (AES, Twofish, Blowfish, DES, TripleDES, RC2), Asymmetric Encryption (RSA, X509 Certificate), hashing (SHA, MD, FCS, HAVAL, Ripemd, Whirlpool, Tiger, Gost), compression (gzip, deflate) and  encoding (uuEncode, quoted printable, Hex String).",NetEncryptionLibrary,False,2017-08-09T01:24:58.93+00:00,True,False,"Commercial Encryption Library for .NET.  Features: Encrypt strings, files, & streams, Symmetric Encryption (AES, Twofish, Blowfish, DES, TripleDES, RC2), Asymmetric Encryption (RSA, X509 Certificate), hashing (SHA, MD, FCS, HAVAL, Ripemd, Whirlpool, Tiger, Gost), compression (gzip, deflate) and  encoding (uuEncode, quoted printable, Hex String).","encryption,hashing,compression,gzip,deflate,AES,Twofish,Blowfish,RSA,X509",8061,False,2.3.0
Kevin Miller,2013-07-12T19:13:42.867Z,17,1743,TikaOnDotNet is a .NET wrapper around the Tika text extraction library implemented in Java.,TikaOnDotNet,False,2018-04-03T14:25:54.69+00:00,True,False,,"Text,IKVM.Net,Java,.NET",69028,False,1.4.0.51412
Tobias Klika,2013-07-13T12:05:55.457Z,867,1742,"PocketSharp is a .NET class library, that integrates the Pocket API v3",PocketSharp,False,2015-12-05T08:37:02.577-08:00,True,False,,"PocketAPI,Pocket,API,PocketSharp,Tobias,Klika,cee,RestSharp",8437,False,0.3.1
Jorge Martinez,2013-07-12T04:04:09.563Z,1743,1743,Simple yet powerful implementation of specification pattern in C#,SpecPattern,False,2013-07-11T21:04:09.563-07:00,True,False,,,544,False,1.0.0
Dmitry Kischenko,2013-07-12T08:35:50.727Z,43209,1743,xFunc.Logics is a simple and easy to use library that allows you to build logical expressions.,xFunc.Logics,False,1899-12-31T16:00:00-08:00,False,False,,"Logic,Expression,Expressions,Parser,LogicParser",-1,False,2.3.2
iD Commerce + Logistics,2013-07-12T19:40:49.313Z,1378,1743,"Readers and writers for CSV and fixed-length file formats. Supports both synchronous and asynchronous operation, data annotations, and wicked fast object serialization.",IdComLog.Data,False,2014-07-12T10:57:50.593-07:00,True,False,,"CSV,fixed,length,asynchronous",5888,False,1.3.4940.29749
Frozen Mountain Software,2013-07-12T22:11:14.9Z,84,1743,A client-side library for JavaScript that provides real-time HTTP streaming (comet/reverse Ajax).,FM.WebSync.JS,False,2018-01-26T02:27:41.227+00:00,True,False,,"WebSync,Client,HTTP,Streaming,Comet,Reverse,Ajax,JavaScript",17427,False,4.3.2
GeertvanHorrik,2013-07-11T21:58:46.497Z,4,1744,"Catel.Core library which provides the core building blocks required when developing professional applications. This
	  package contains an IoC container, logging, argument checking, message mediators and much more!",Catel.Core,True,2018-04-16T10:11:44.76+00:00,True,False,,"mvvm,model,modelbase,logging,data,object,wpf,silverlight,sl,windows,phone,wp,wp7,wp8,winrt,c#,ioc,servicelocator,typefactory,messaging,messenger,message,mediator",244767,True,3.6.1307112354-beta
MvvmCross,2013-07-12T06:58:46.967Z,43209,1743,This package contains the 'DownloadCache' plugin for MvvmCross v3 - Hot Tuna. This and other packages are currently under development...,MvvmCross.HotTuna.Plugin.DownloadCache,True,1899-12-31T16:00:00-08:00,False,False,,"mvvm,mvvmcross,xamarin,monodroid,monotouch,wpf,windows8,winrt,netcore,wp,wpdev,windowsphone",-1,False,3.0.9-beta7
eXpand,2013-07-11T19:52:08.393Z,1715,1744,ViewVariants Module (Win) / eXpand Framework,eXpandViewVariantsWin,False,2013-08-09T07:43:42.687-07:00,True,False,ViewVariants Module (Win) / eXpand Framework,"DevExpress,eXpand",30860,False,13.1.5.5
ACBr,2013-07-13T03:56:25.647Z,484,1742,Projeto ACBrFramework para .Net.,ACBrFramework,False,2016-12-22T10:03:17.13-08:00,True,False,,"ACBr,ACBrFramework,ACBr.Net",10856,False,0.9.4.2
Matthew Manela,2013-07-12T01:08:57.367Z,130,1743,Chutzpah is an open source JavaScript test runner which helps you integrate JavaScript unit testing into your website. It enables you to run JavaScript unit tests from the command line and from inside of Visual Studio. It also supports running in the TeamCity continuous integration server.,Chutzpah,False,2017-12-11T17:38:23.52+00:00,True,False,Chutzpah is an open source JavaScript test runner which enables you to run JavaScript unit tests from the command line and from inside of Visual Studio.,"testing,javascript,tdd,qunit,jasmine,coffeescript,typescript",1109353,False,2.4.3
Ben Dornis,2013-07-11T20:08:15.54Z,1725,1744,Default Parrot renderers for converting parrot source into html,Parrot.Renderers,False,2013-07-29T17:16:41.597-07:00,True,False,,,3224,False,1.0.2
Franz Kiermaier,2013-07-12T11:39:16.43Z,1286,1743,Active Directory Utility Library by GAB Enterprise IT Solutions GmbH,GAB.ActiveDirectory,False,2014-10-12T04:25:37.313-07:00,True,False,,activedirectory,3404,False,2.0.5
"Daniel Schroeder,iQmetrix",2013-07-12T22:53:48.727Z,225,1743,"Automatically creates a NuGet package from your project each time it builds. The NuGet package is placed in the project's output directory.
	If you want to use a .nuspec file, place it in the same directory as the project's project file (e.g. .csproj, .vbproj, .fsproj).
	This adds a PostBuildScripts folder to your project to house the PowerShell script that is called from the project's Post-Build event to create the NuGet package.
	If it does not seem to be working, check the Output window for any errors that may have occurred.",CreateNewNuGetPackageFromProjectAfterEachBuild,False,2017-09-07T20:02:19.643+00:00,True,False,Automatically creates a NuGet package from your project each time it builds.,"Auto,Automatic,Automatically,Build,Pack,Create,New,NuGet,Package,From,Project,After,Each,On,PowerShell,Power,Shell,.nupkg",128916,False,1.2.1
John Batte,2013-07-12T20:04:14.533Z,1535,1743,Code Patterns: Extensions for Autofac,Patterns.Autofac,False,2014-02-04T21:08:28.457-08:00,True,False,,,8183,False,3.7.2
MvvmCross,2013-07-12T09:46:54.843Z,43209,1743,This package contains the 'Messenger' plugin for MvvmCross v3 - Hot Tuna. This and other packages are currently under development...,MvvmCross.HotTuna.Plugin.Messenger,True,1899-12-31T16:00:00-08:00,False,False,,"mvvm,mvvmcross,xamarin,monodroid,monotouch,wpf,windows8,winrt,netcore,wp,wpdev,windowsphone",-1,False,3.0.9-beta8
eXpand,2013-07-11T19:52:21.603Z,1715,1744,WorkFlow Module (Win) / eXpand Framework,eXpandWorkFlowrWin,False,2013-08-09T07:43:55.84-07:00,True,False,WorkFlow Module (Win) / eXpand Framework,"DevExpress,eXpand",31116,False,13.1.5.5
MvvmCross,2013-07-12T06:59:35.667Z,43209,1743,This package contains the 'Visibility' plugin for MvvmCross v3 - Hot Tuna. This and other packages are currently under development...,MvvmCross.HotTuna.Plugin.Visibility,True,1899-12-31T16:00:00-08:00,False,False,,"mvvm,mvvmcross,xamarin,monodroid,monotouch,wpf,windows8,winrt,netcore,wp,wpdev,windowsphone",-1,False,3.0.9-beta7
GeertvanHorrik,2013-07-13T11:59:40.867Z,1645,1742,Gyroscope service for Catel to use the gyroscope as a service in MVVM. Also contains a unit test version to simulate the gyroscope.,Catel.MVVM.Services.Gyroscope,True,2013-10-18T04:22:20.863-07:00,True,False,,"mvvm,catel,gyroscope,services,wp7,wp,windows,phone",25100,True,3.6.1307131351-beta
aleatherwood,2013-07-11T23:51:45.867Z,123,1744,"DrivenDb is a better microORM.  Unique features, excellent performance, and cleaner code in as few trips to the database as possible.",DrivenDb,False,2017-12-18T15:31:44.183+00:00,True,False,"Features Include: 
* Self-Tracking entities that maintain their state through WCF serialization.
* Bulk reads / writes to the database reducing round trips.
* Parallel reads for decreasing load time of large result sets.
* Easily use your current Linq classes or the included entity generator.
* Support classes provide easy caching and filtered in-memroy views that are always up-to-date.
* Weak event model reduces memory leaks and eliminates the need for IDisposable implementations.","microorm,db,database,micro,orm,dal,sql,mysql,sqlite,mapping,cache,petapoco,dapper,self-tracking,entity,ddd,repository,nhibernate,napper,microlite,entityframework",25239,False,1.4.5.1
Framework One,2013-07-13T11:39:03.763Z,10,1742,The CloudCore API Client enables communication with CloudCore-based systems on Windows Azure using .NET applications.,CloudCore.Api.Client,False,2018-04-10T10:17:30.463+00:00,True,False,,,34834,False,1.1.79
Pierre Chalamet,2013-07-12T22:15:54.857Z,289,1743,Core implementation of cassandra-sharp,cassandra-sharp-core,False,2017-07-05T13:09:59.07-07:00,True,False,Core implementation of cassandra-sharp,"apache,cassandra,driver,net40,net45,mono,database,nosql,tpl,rx,reactive,high,performance,streaming",6859,False,3.3.1
MvvmCross,2013-07-12T06:59:01.043Z,43209,1743,This package contains the 'JsonLocalisation' plugin for MvvmCross v3 - Hot Tuna. This and other packages are currently under development...,MvvmCross.HotTuna.Plugin.JsonLocalisation,True,1899-12-31T16:00:00-08:00,False,False,,"mvvm,mvvmcross,xamarin,monodroid,monotouch,wpf,windows8,winrt,netcore,wp,wpdev,windowsphone",-1,False,3.0.9-beta7
Calabonga,2013-07-12T06:21:28.223Z,595,1743,This is a set of simplest javascript modules that can help to you organize your framework on ASP.NET (MVC). This is just for a begin your js-framework. For example: control DataSource - is loader that can data from web api with pager and it cat make selection.,JsSite,False,2016-09-01T20:29:17.23-07:00,True,False,"The library is using knockout.js, amplify.js, underscore.js, toastr.js and other helpful frameworks.","calabonga,mvc,asp.net,js,javascript,framework,site,clock,controls,ultilites,knockout,pager,dblookup,datasource",5278,False,0.6.1
eXpand,2013-07-11T22:46:43.88Z,1715,1744,WorkFlow Module (Web) / eXpand Framework,eXpandWorkFlowWeb,False,2013-08-09T07:44:02.05-07:00,True,False,WorkFlow Module (Web) / eXpand Framework,"DevExpress,eXpand",32731,False,13.1.5.6
GeertvanHorrik,2013-07-11T21:58:50.277Z,507,1744,"Catel.Extensions.Controls library which contains user controls, such as the StackGrid.",Catel.Extensions.Controls,True,2016-11-29T13:35:55.627+00:00,True,False,,"windows,controls,stackgrid,styles,stylehelper",170616,True,3.6.1307112354-beta
Frozen Mountain Software,2013-07-12T22:10:48.273Z,84,1743,A library for JavaScript that extends WebSync to support easy management of IceLink peer-to-peer conferences.,FM.IceLink.WebSync.JS,False,2018-01-26T02:26:39.227+00:00,True,False,,"IceLink,WebSync,Extension,ICE,STUN,TURN,P2P,UDP,NAT,Firewall,Traversal,JavaScript",14278,False,2.3.2
Media Browser Team,2013-07-12T15:10:32.823Z,43209,1743,Contains javascript api wrapper for working with the Media Browser Api.,MediaBrowser.ApiClient.Javascript,False,1899-12-31T16:00:00-08:00,False,False,,,41248,False,3.0.144
Paul Jenkins; Jake Ginnivan,2013-07-12T09:04:01.68Z,38,1743,"The goal of MahApps.Metro is to allow devs to quickly and easily cobble togther a ""Metro"" UI for their WPF4+ apps, with minimal effort.",MahApps.Metro,True,2018-03-13T22:31:08.54+00:00,True,False,"The goal of MahApps.Metro is to allow devs to quickly and easily cobble togther a ""Metro"" UI for their WPF4+ apps, with minimal effort.","WPF,UI,Metro",1280769,True,0.11.0.46-ALPHA
Contoso,2013-07-11T21:12:41.613Z,43209,1744,This package contains implementations of abstract Services for SPG2010.,BclContrib-Abstract.SPG2010,False,1899-12-31T16:00:00-08:00,False,False,,"sharepoint,2010,spg2010,servicelocator,ioc,di,bclex",-1,False,1.0.1
MvvmCross,2013-07-12T09:47:31.473Z,43209,1743,This package contains the 'Test Helpers'  for MvvmCross v3 - Hot Tuna. This and other packages are currently under development...,MvvmCross.HotTuna.Tests,True,1899-12-31T16:00:00-08:00,False,False,,"mvvm,mvvmcross,xamarin,monodroid,monotouch,wpf,windows8,winrt,netcore,wp,wpdev,windowsphone",-1,False,3.0.9-beta8
Frozen Mountain Software,2013-07-12T22:10:42.75Z,48,1743,A library for .NET that extends IceLink to create WebRTC-compatible peer-to-peer audio/video data streams using IceLink. (Community Edition),FM.IceLink.WebRTC,False,2018-03-03T21:24:25.753+00:00,True,False,,"IceLink,WebRTC,Extension,ICE,STUN,TURN,P2P,UDP,NAT,Firewall,Traversal,RTCWEB,Audio,Video,.NET",15954,False,2.3.2
"Quintsys,Inc.",2013-07-12T13:46:52.927Z,1743,1743,Administration123 API Client,QsAdministration123ApiClient,False,2013-07-12T06:46:52.927-07:00,True,False,,,5834,False,1.18.0
Cameron MacFarland,2013-07-13T12:11:41.447Z,797,1742,"Disposable, without the Using.",Usable.Fody,False,2016-02-13T03:40:39.163-08:00,True,False,,"Disposable,ILWeaving,Fody,Cecil",5075,False,0.2.1
Harry McIntyre,2013-07-12T18:29:17.94Z,39,1743,Advanced object to html form transformer. FormFactory.AspMvc should be used with ASP MVC. See http://formfactory.apphb.com/,FormFactory.AspMvc,False,2018-03-12T09:51:18.17+00:00,True,False,,"Html,EditorTemplates,Razor,AspMvc",20937,False,1.2.276
TBAPI-0KA,2013-07-13T03:16:28.073Z,1742,1742,Core C# high-level wrapper around libsass library,NSass.Core,False,2013-07-12T20:16:28.073-07:00,True,False,,"SASS,SCSS,CSS,libsass",22155,False,0.0.3
NServiceBus Ltd,2013-07-12T07:46:11.7Z,63,1743,The CastleWindsor Container for the nservicebus,NServiceBus.CastleWindsor,True,2018-02-16T08:25:50.44+00:00,True,False,,"nservicebus,servicebus,msmq,cqrs,publish,subscribe",198695,False,4.1.0-unstable3260
Frozen Mountain Software,2013-07-12T22:11:04.627Z,48,1743,A server-side library for .NET that extends WebSync to use Azure Caching as a backend message hub for horizontal scaling. (Community Edition),FM.WebSync.AzureCaching,False,2018-03-03T21:26:34.69+00:00,True,False,,"WebSync,Server,Azure,Caching,Extensions,HTTP,Push,Comet,Reverse,Ajax,.NET",14091,False,4.3.2
Signere.no,2013-07-12T10:13:50.047Z,43209,1743,"Client library to communication with Signere.no REST API.
		The library contains relevant model classes and a client class with methods to access all resources provided in the Signere.no API. 
		The client class itself is implemented from an interface to make it easily testable.
		
		All explicit communication with the API is handled internally and translated to POCO objects. 
		The client methods require certain fields from Signere.no user credentials in order to work properly. 
		To create a user account and obtain these credentials, please visit signere.no .  
		
		Also, check out the REST API documentation at Https://api.signere.no for further details about the resources that can be accessed through this library.",Unipluss.Sign.ClientNET35,False,1900-01-01T00:00:00+00:00,False,False,,"Signere,Sign,BankID,Digital,signatur,Uni,Pluss,Signere.no",205480,False,1.0.478
"Daniel Schroeder,iQmetrix",2013-07-12T21:13:58.837Z,225,1743,"Automatically creates a NuGet package from your project each time it builds. The NuGet package is placed in the project's output directory.
	If you want to use a .nuspec file, place it in the same directory as the project's project file (e.g. .csproj, .vbproj, .fsproj).
	This adds a PostBuildScripts folder to your project to house the PowerShell script that is called from the project's Post-Build event to create the NuGet package.
	If it does not seem to be working, check the Output window for any errors that may have occurred.",CreateNewNuGetPackageFromProjectAfterEachBuild,True,2017-09-07T20:02:19.643+00:00,True,False,Automatically creates a NuGet package from your project each time it builds.,"Auto,Automatic,Automatically,Build,Pack,Create,New,NuGet,Package,From,Project,After,Each,On,PowerShell,Power,Shell,.nupkg",128916,False,1.2.0-beta
Mark Seemann,2013-07-11T21:06:58.49Z,4,1744,"By leveraging the data theory feature of xUnit.net, this extension turns AutoFixture into a declarative framework for writing unit tests. In many ways it becomes a unit testing DSL (Domain Specific Language).",AutoFixture.Xunit,False,2018-04-16T15:26:31.843+00:00,True,False,Extension to AutoFixture that integrates it with xUnit.net.,,255259,True,3.6.1
eXpand,2013-07-11T22:45:27.197Z,11,1744,PivotChart Module (Win) / eXpand Framework,eXpandPivotChartWin,False,2018-04-09T16:19:05.76+00:00,True,False,PivotChart Module (Win) / eXpand Framework,"DevExpress,eXpand",69534,False,13.1.5.6
eXpand,2013-07-11T22:44:07.267Z,11,1744,IO Module (Web) / eXpand Framework,eXpandIOWeb,False,2018-04-09T16:13:57.577+00:00,True,False,IO Module (Web) / eXpand Framework,"DevExpress,eXpand",69946,False,13.1.5.6
"Microsoft Corporation,Ron Logan",2013-07-12T16:38:51.727Z,1178,1743,JavaScript and CSS minification Library for use in .NET applications that want to provide minification or parsing functionality.,AjaxMin,False,2015-01-28T14:45:45.577-08:00,True,False,,"JavaScript,CSS,minification,crunch,parser,ast,ajaxmin",1666689,False,4.96.4941.15389
TheHunter,2013-07-12T10:10:03.707Z,1200,1743,"This library is designed for transforming objects through an object Mapper / Merger, which contains a set of actions for mapping properties from source object into destination object.
This library can be useful when applications need to transform business data into DTO objects, or maybe in another complex context when (for example) applications need to set some properties, and this is possible by custom filters.",DynamicMapResolver,False,2015-01-06T09:51:04.053-08:00,True,False,DynamicMapResolver is a library used for transforming  input objects into custom output objects through  a set of actions which map properties from input  object type into output object type.,,3017,False,1.0.0.1
"Gregory Nickonov,Andrew Nefedkin",2013-07-12T13:07:03.22Z,1299,1743,Digillect Model-View-ViewModel Framework,Digillect.Mvvm,False,2014-09-29T04:52:38.903-07:00,True,False,,"digillect,mvvm,model,view,viewmodel",2441,False,2.2.1
MvvmCross,2013-07-12T06:59:23.973Z,43209,1743,This package contains the 'Share' plugin for MvvmCross v3 - Hot Tuna. This and other packages are currently under development...,MvvmCross.HotTuna.Plugin.Share,True,1899-12-31T16:00:00-08:00,False,False,,"mvvm,mvvmcross,xamarin,monodroid,monotouch,wpf,windows8,winrt,netcore,wp,wpdev,windowsphone",-1,False,3.0.9-beta7
NServiceBus Ltd,2013-07-12T21:00:56.463Z,63,1743,"The hosting template for the nservicebus, The most popular open-source service bus for .net",NServiceBus.Host32,True,2018-02-16T08:27:15.097+00:00,True,False,,"nservicebus,servicebus,msmq,cqrs,publish,subscribe",113399,False,4.1.0-unstable3262
eXpand,2013-07-11T22:44:39.823Z,877,1744,MemberLevelSecurity Module (Win) / eXpand Framework,eXpandMemberLevelSecurityWin,False,2015-11-25T10:21:12.1-08:00,True,False,MemberLevelSecurity Module (Win) / eXpand Framework,"DevExpress,eXpand",57688,False,13.1.5.6
aleatherwood,2013-07-11T23:46:23.463Z,123,1744,"DrivenDb is a better microORM.  Unique features, excellent performance, and cleaner code in as few trips to the database as possible.",DrivenDb,False,2017-12-18T15:31:44.183+00:00,True,False,"Features Include: 
* Self-Tracking entities that maintain their state through WCF serialization.
* Bulk reads / writes to the database reducing round trips.
* Parallel reads for decreasing load time of large result sets.
* Easily use your current Linq classes or the included entity generator.
* Support classes provide easy caching and filtered in-memroy views that are always up-to-date.
* Weak event model reduces memory leaks and eliminates the need for IDisposable implementations.","microorm,db,database,micro,orm,dal,sql,mysql,sqlite,mapping,cache,petapoco,dapper,self-tracking,entity,ddd,repository,nhibernate,napper,microlite,entityframework",25239,False,1.4.5
MvvmCross,2013-07-12T06:58:32.567Z,43209,1743,This package contains the 'Core' assemblies for MvvmCross v3 - Hot Tuna. This and other packages are currently under development...,MvvmCross.HotTuna.CrossCore,True,1899-12-31T16:00:00-08:00,False,False,,,-1,False,3.0.9-beta7
