authors,created,description,id,is_prerelease,last_updated,listed,missing_info,summary,tags,total_downloads,verified,versionJerome Haltom,2014-05-12T00:28:21.827Z,"NXKit forms the basis of an XML processing engine that can be used to implement other XML based models, such as XForms, or theoritically a full web browser user agent.

            Schema support is available in other NXKit packages.",NXKit.DOM,False,2015-04-28T22:27:12.403-07:00,True,False,,"xml,xforms",4482,False,0.4.0
"Microsoft Open Technologies,Inc.",2014-05-12T18:36:15.02Z,Tx (LINQ to Logs and Traces) components for generation of C# types representing Event Tracing for Windows (ETW) and Event Log events,Tx.Windows.TypeGeneration,False,2017-06-12T11:09:17.177-07:00,True,False,,"Tx,Traces,Logs,Playback,Replay,ETW",19390,False,1.0.40512
tuespetre,2014-05-12T18:21:58.777Z,"A fork of the original Pechkin, TuesPechkin allows you to convert HTML
      documents into PDF documents on the fly using the WebKit converter library. TuesPechkin
      is compatible with .NET 2.0 and up and will safely work in an IIS environment. Original
      work by gmanny on GitHub.",TuesPechkin,False,2015-01-21T07:15:09.9-08:00,True,False,,"Html,PDF,Wrapper,Converter,Webkit",148998,False,0.9.3.3
Signere.no,2014-05-12T08:58:12.347Z,"Client library POCOs for the REST API  
		
		Also, check out the REST API documentation at Https://api.signere.no for further details about the resources that can be accessed through this library.",Unipluss.Sign.Models,False,1900-01-01T00:00:00+00:00,False,False,,"Signere,Sign,BankID,Digital,signatur,Uni,Pluss,Signere.no",194433,False,1.0.1424
Jason Reimer,2014-05-12T00:28:12.52Z,"Foundational extensions, helpers and classes for .Net development.",Praetorium,False,2014-05-11T17:28:12.52-07:00,True,False,,"foundation,utilities,extensions,helpers,events,silverlight",3590,False,1.0.10
"Launchark,Prasanna V. Loganathar",2014-05-12T21:35:00.73Z,"A simple high-peformance portable logging framework for .NET, which follows simple convention over configuration, and works with PCL.",SharpLog,False,2014-06-07T11:11:24.723-07:00,True,False,A simple high-peformance portable logging framework for .NET,"log,logging,pcl,logger,framework",2559,False,1.1.2
Tim Jones,2014-05-12T15:00:24.97Z,"MonoGame module for Gemini, providing WPF integration for MonoGame content.",Gemini.Modules.MonoGame,False,2015-09-20T06:56:18.717-07:00,True,False,,".net40,WPF,MVVM,AvalonDock,Caliburn,Micro,Visual,Studio,IDE,Shell,XNA,MonoGame",774,False,0.5.0
Signere.no,2014-05-12T20:06:08.233Z,"Client library POCOs for the REST API  
		
		Also, check out the REST API documentation at Https://api.signere.no for further details about the resources that can be accessed through this library.",Unipluss.Sign.Models,False,1900-01-01T00:00:00+00:00,False,False,,"Signere,Sign,BankID,Digital,signatur,Uni,Pluss,Signere.no",194433,False,1.0.1426
Envoc,2014-05-12T12:06:17.04Z,Envoc.Directives,Envoc.Directives,False,2016-11-11T12:44:22.873-08:00,True,False,,,16846,False,1.0.0.42
"James Rosewell,Thomas Holmes",2014-05-12T10:58:04.517Z,"The fastest, most accurate tools. Deployed by millions.
      Request.Browser properties will be populated with data from 51Degrees Lite Device Data. Other features
      include automatic image optimisation, monitoring of network conditions and client side feature detection.",51Degrees.mobi,True,1899-12-31T16:00:00-08:00,False,False,Fast & Accurate Device Detection. Deployed by millions.,"mobile,phone,detection,device,data,handset,tablet,responsive,design,images,51degrees",-1,False,3.0.4-beta8
Joe Enos,2014-05-11T23:01:09.283Z,Basic cryptography functions,NoEdgeSoftware.Cryptography,False,1899-12-31T16:00:00-08:00,False,False,,cryptography,-1,False,0.8.1
James Craig,2014-05-12T15:07:47.533Z,"Craig's Utility Library is one of the largest collections of utility classes and extension methods for .Net. It includes code to help with tasks including encryption, compression, serialization, file management, email, image manipulation, SQL, various file formats (CSV, iCal, etc.), randomization, validation, math related classes, various data types, reflection, code gen, events, code profiling, etc.",CUL.NLog,True,2016-08-22T09:49:59.027-07:00,True,False,This adds support for NLog as the logger that the library uses,"utility,utilities",21460,False,4.0.134-beta
The OpenSSL Project,2014-05-11T15:28:19.26Z,"Redistributable components for package 'fix8.dependencies.openssl'. This package should only be installed as a dependency. 
(This is not the package you are looking for).",fix8.dependencies.openssl.redist,False,2014-05-11T08:28:19.26-07:00,True,False,Redistributable components for for package 'fix8.dependencies.openssl',"OpenSSL,native,CoApp,nativepackage",1398,False,1.0.20140509.1
amir.gholzam@live.com,2014-05-13T06:20:46.157Z,amir.gholzam@live.com CEO Hamava Project,Hamava.Core,False,1899-12-31T16:00:00-08:00,False,False,,Hamava,-1,False,1.0.0
Aranea IT,2014-05-11T17:37:45.617Z,Azure Storage provider for the NuGet.Server,Nuget.Server.AzureStorage,False,2014-11-28T15:11:29.827-08:00,True,False,,,3553,False,2.8.1.6
Bastian Eicher,2014-05-12T20:08:43.95Z,"Generic utility classes, interfaces, controls, etc. for WinForms projects.",NanoByte.Common.WinForms,False,2018-01-06T10:49:48.273+00:00,True,False,,,8049,False,1.0.4
Sander Struijk,2014-05-12T13:57:49.797Z,"Persistent Object Cache serializes objects and store them to disk as json.
When retrieving objects cache time is validated, if cache time has been exceeded null is returned otherwise the object.",PersistentObjectCache,False,2016-01-30T16:32:43.903-08:00,True,False,,"Persistent,Object,Cache",2038,False,1.2.0
Laurent Wouters,2014-05-12T19:41:16.053Z,Development kit for the generation of LR and RNGLR parsers programmatically or in command line. Full API for the manipulation of context-free grammars.,Hime.SDK,False,2018-02-18T09:13:25.677+00:00,True,False,,"parser,generator,lr,glr,rnglr",5022,False,1.0.0
objo,2014-05-12T19:27:40.07Z,"OxyPlot is an open source plotting library for .NET. This package contains the .pdf export extensions for Silverlight, .NET 4.0 and .NET 4.5.",OxyPlot.Pdf,False,1900-01-01T00:00:00+00:00,False,False,,"pdf,plotting,plot,charting,chart",119429,False,2014.1.301.1
Aditi Technologies Pvt. Ltd.,2014-05-12T10:23:06.347Z,Brewmaster Template SDK Contracts Ver-1.0.0-betaB355R269f5bc,Brewmaster.TemplateSDK.Contracts,True,2015-04-22T03:13:15.327-07:00,True,False,,"Aditi,Brewmaster,TemplateSDk",3251,False,1.0.0-betaB355R269f5bc
TeamCity.Service,2014-05-12T15:24:47.327Z,Description,Foundation.Configuration,False,2014-11-05T06:37:53.627-08:00,True,False,,,4253,False,0.28.0
Chillisoft,2014-05-13T04:02:45.413Z,Habanero.Smooth,Habanero.Smooth,True,2017-04-20T04:03:20.277+00:00,True,False,,,157786,False,3.9.203-prerelease
Mihai Mogosanu,2014-05-12T15:34:27.233Z,"Evolved toolkit for developing applications faster and with less code. Includes general purpose extension methods, guard clauses, predefined value objects (Email, Percentage etc) and specialized helper classes for specific tasks.",CavemanTools,False,2017-12-04T03:30:25.65+00:00,True,False,Power tools for developing applications faster and with less code and using best practices.,"toolkit,library,tools,utility,lcg,reflection,guard,contracts,helpers",29198,False,3.7.0
Applied Informatics,2014-05-11T15:29:10.12Z,Develop branch of Poco libraries,fix8.dependencies.poco,False,2015-12-01T01:50:30.967-08:00,True,False,Prebuilt Poco libraries for FIX8 build,"POCO,native,CoApp,nativepackage",3054,False,1.5.20140509.1
Envoc,2014-05-12T19:15:24.95Z,Envoc.Directives,Envoc.Directives,False,2016-11-11T12:44:22.873-08:00,True,False,,,16846,False,1.0.0.51
Tim Jones,2014-05-12T14:57:24.29Z,"CodeEditor module for Gemini, providing a syntax-highlighted code editor using AvalonEdit.",Gemini.Modules.CodeEditor,False,2015-09-20T06:54:02.603-07:00,True,False,,".net40,WPF,MVVM,AvalonDock,Caliburn,Micro,Visual,Studio,IDE,Shell,C#,syntax,highlighting,AvalonEdit",2304,False,0.5.0
Jerome Haltom,2014-05-12T00:31:57.413Z,"NXKit forms the basis of an XML processing engine that can be used to implement other XML based models, such as XForms, or theoritically a full web browser user agent.

            NXKit.XPath",NXKit.XPath,False,2015-04-28T22:37:54.647-07:00,True,False,,"xml,xforms",4147,False,0.4.0
George Heeres,2014-05-12T18:46:06.59Z,Extension methods for PDFSharp to support and simplify some common operations including image extraction.,PDFSharp.Extensions,False,2014-11-10T10:33:27.043-08:00,True,False,,"pdf,pdfsharp,image,extension",4280,False,0.1.1
Rex Morgan,2014-05-11T23:08:15.41Z,Blistering-fast Handlebars.js templates in your .NET application.,Handlebars.Net,True,2017-05-16T16:41:22.18-07:00,True,False,Blistering-fast Handlebars.js templates in your .NET application.,,391984,False,1.0.0-alpha3
Daniel Moore <polaris@northhorizon.net>,2014-05-12T04:15:13.767Z,A micro-library to provide support for easy view model creation and view/view model composition.,WpfIgniter,True,2014-12-01T07:54:01.897-08:00,True,False,,"wpf,inpc,INotifyPropertyChanged,binding,mvvm",4830,False,2.2.0-beta-1
andreb,2014-05-12T15:58:47.127Z,A set of controls and styles converting your WPF application into a great looking Modern UI app.,ModernUI.WPF.NoBackButton,True,2014-05-12T08:58:47.127-07:00,True,False,,,436,False,1.0.5.1-alpha
objo,2014-05-12T19:26:03.537Z,OxyPlot is an open source plotting library for .NET.,OxyPlot.GtkSharp,False,1899-12-31T16:00:00-08:00,False,False,,"gtk,gtk#,plotting,plot,charting,chart",78946,False,2014.1.301.1
Microsoft,2014-05-12T15:49:29.427Z,"Application Insights Telemetry SDK enables you to get insights into user behavior and monitor usage patterns for your Multi-Device Hybrid Apps. Application Insights service collects the data, analyzes it and presents the results in the forms of graphs and reports in your Visual Studio Online portal.",Microsoft.ApplicationInsights.Telemetry.JavaScript,True,1899-12-31T16:00:00-08:00,False,False,,"Analytics,Insights,Telemetry,JavaScript,MDD,Multi-Device,ApplicationInsights",-1,False,0.7.1-beta
"Robert Friberg,Patrik Svensson",2014-05-12T07:43:08.3Z,Enable OrigoDb serialization with ProtoBuf,OrigoDB.ProtoBuf,False,2014-05-12T00:43:08.3-07:00,True,False,Enable OrigoDb serialization with ProtoBuf,"in-memory,imdb,nosql,prevalence,odbms,database,imc",1156,False,0.4.0
Thorsten Hans,2014-05-11T17:32:17.837Z,ShareCoffee - The SharePoint App Helpers,ShareCoffee,False,2014-10-14T14:23:53.703-07:00,True,False,,"SharePoint,Apps,JavaSript,REST,CSOM,CrossDomain,CoffeeScript,TypeScript",4121,False,0.0.12
James Craig,2014-05-12T17:26:41.867Z,"Craig's Utility Library is one of the largest collections of utility classes and extension methods for .Net. It includes code to help with tasks including encryption, compression, serialization, file management, email, image manipulation, SQL, various file formats (CSV, iCal, etc.), randomization, validation, math related classes, various data types, reflection, code gen, events, code profiling, etc.",CraigsUtilityLibrary-IoC,True,2016-08-22T09:47:12.233-07:00,True,False,This is the IoC namespace from Craig's Utility Library,"utility,utilities",50347,False,4.0.136-beta
JASMIN,2014-05-12T11:41:47.877Z,Description,KatoAdhocExpress,False,1899-12-31T16:00:00-08:00,False,False,,,-1,False,1.0.0.4
CapableObjects,2014-05-12T12:38:46.1Z,Descr,EcoWindowsStore,False,2018-04-17T02:39:44.143+00:00,True,False,,"ModelDrivenDevelopment,ECO,CapableObjects",138567,False,7.0.0.7273
TeamCity.Service,2014-05-12T15:03:48.277Z,Description,Foundation.Configuration,False,2014-11-05T06:37:53.627-08:00,True,False,,,4253,False,0.24.0
cmisztur,2014-05-12T18:51:04.057Z,Query SCCM server with WQL and return data as JSON.,ScriptCs.SccmWqlQueryPack,False,2014-05-12T11:54:18.373-07:00,True,False,,,572,False,0.1.0
Apolineo | Design For Apps,2014-05-11T19:44:38.17Z,Conjunto de classes para acelerar o desenvolvimento de aplicativos Windows 8,Lean.Engine.Framework.Windows,False,2015-02-28T14:53:11.847-08:00,True,False,,,6893,False,1.1.65.15
Fakhrulhilal Maktum,2014-05-12T09:53:53.09Z,Various utility for C# programmer.,OpenLibrary,False,2014-08-18T16:46:43.143-07:00,True,False,,"openlibrary,excel-importer,csv-importer,excel-exporter,csv-exporter,authorize-attribute,helper,sql",6526,False,1.9.1
James Craig,2014-05-12T17:28:20.257Z,"Craig's Utility Library is one of the largest collections of utility classes and extension methods for .Net. It includes code to help with tasks including encryption, compression, serialization, file management, email, image manipulation, SQL, various file formats (CSV, iCal, etc.), randomization, validation, math related classes, various data types, reflection, code gen, events, code profiling, etc.",CraigsUtilityLibrary-Web,True,2016-08-22T09:48:09.66-07:00,True,False,This is the Web namespace from Craig's Utility Library,"utility,utilities",52182,False,4.0.136-beta
Dzmitry Lahoda,2014-05-12T12:04:24.907Z,"Minimalistic interface (no GC pressure, no stack walk, no custom enums,no formatting) log facade.",CommonLogFacade,False,1899-12-31T16:00:00-08:00,False,False,"Minimalistic interface (no GC pressure, no stack walk, no custom enums,no formatting) log facade.","logging,common,facade",-1,False,0.11.11
NIPO Software,2014-05-12T13:31:03.1Z,NIPO Software Nfield SDK for Windows,Nfield.SDK,False,2018-04-16T12:32:06.693+00:00,True,False,,"nfield,marketresearch,capi,cawi",11714,False,1.1.5245.26016
TeamCity.Service,2014-05-12T15:12:31.783Z,Description,Foundation.Web,False,2014-11-05T06:40:00.213-08:00,True,False,,,6888,False,0.26.0
NGS,2014-05-12T10:38:13.393Z,Minimal reporting library. Create reports from Word and Excel documents,Templater,False,2018-01-08T18:15:10.73+00:00,True,False,"Templater is a small reporting library with a minimal interface.
Use your favorite editor (Word, Excel) to create report templates and just fill them with data. It's really as simple as that.
Templater is not just a mail-merge library. It supports collections, nested collections and can create very complex reports.","Reporting,Word,Excel,docx,xlsx,csv",28915,False,1.9.2
TeamCity.Service,2014-05-12T15:04:34.003Z,Description,Foundation.Infrastructure,False,2014-11-05T06:38:48.987-08:00,True,False,,,7011,False,0.24.0
Intel Corporation,2014-05-11T15:31:00.9Z,"Redistributable components for package 'fix8.dependencies.tbb'. This package should only be installed as a dependency. 
(This is not the package you are looking for).",fix8.dependencies.tbb.redist,False,2014-05-11T08:31:00.9-07:00,True,False,Redistributable components for for package 'fix8.dependencies.tbb',"TBB,native,CoApp,nativepackage",1255,False,4.2.20140416.1
SeriousM,2014-05-12T15:19:37.557Z,"ChromeDriver.exe chromedriver.storage.googleapis.com. If you need an update, just drop me a line or create a pull request on github.com/SeriousM/WebDriver.ChromeDriver.win32-nuget.",WebDriver.ChromeDriver.win32,False,2018-03-19T14:43:31.11+00:00,True,False,ChromeDriver from chromedriver.storage.googleapis.com,"chrome,chromedriver,webdriver,selenium",221548,False,2.10.0
Denis Korkhov,2014-05-12T08:15:43.813Z,"Data Patterns for Cortoxa Framework. 
Cortoxa Framework is a Powerful Framework for faster and easier building .Net applications based on Dependency Injection patterns. Contains implementation of common ""Design Patterns"".",Cortoxa.Data,False,2014-07-30T10:25:39.23-07:00,True,False,Data Patterns for Cortoxa Framework,"logger,log,logging,nlog",3413,False,1.0.7
neuecc,2014-05-12T13:29:19.497Z,LightNode(as Micro REST/RPC Framework) Client for Unity.,LightNode.Client.Unity.T4,False,1899-12-31T16:00:00-08:00,False,False,,"Owin,Rest,RPC,Unity",-1,False,0.3.0
CapableObjects,2014-05-12T12:36:59.15Z,Descr,EcoSqlServer,False,2018-04-17T02:38:30.423+00:00,True,False,,"ModelDrivenDevelopment,ECO,CapableObjects",142314,False,7.0.0.7273
Kentor,2014-05-12T08:42:28.513Z,"A SAML2 Service Provider for ASP.NET. Built to mimic the WSFederationAuthenticationModule in .NET 4.5, but using SAML2 instead. The module works with the claims model of .NET 4.5 and uses the present infrastructure for claims translation, session authentication cookies etc.",Kentor.AuthServices,False,2018-01-17T15:03:39.173+00:00,True,False,,"SAML2,authentication,ASP.NET,SAML,SSO",150898,False,0.4.0
Jan Mattner,2014-05-12T13:58:44.21Z,Oracle Databases (<12.1) do not know identity columns. Therefore the auto increment with the generated *.edmx files does not work. This package offers a patch to change the specified columns in the project's *.edmx files to identity columns.,AIT.EF.Oracle.IdentityPatch,False,2014-05-14T01:31:18.583-07:00,True,False,Patch for *.edmx files generated with Oracle Database (<12.1) to include identity columns.,"AIT,EF,EDMX,Oracle,Database,Identity",2919,False,1.0.0
Microsoft,2014-05-12T12:09:06.35Z,".NET Client Library for Office 365 Mail, Calendar and Contacts API.

Learn more about how to use this library @ http://aka.ms/ClientLibraries.",Microsoft.Office365.Exchange,True,2014-08-04T10:28:08.397-07:00,True,False,".NET Client Library for Office 365 Mail, Calendar and Contacts API","Microsoft,Office,Office365,Service,REST",3522,False,0.1.0-alpha
Antoine Pultier - SINTEF,2014-05-12T14:34:08.723Z,ThingModel - Model - Meta model - WebSockets - Protocol Buffers - Rabbits,ThingModel,True,2015-04-07T02:17:44.253-07:00,True,False,,,5971,False,0.12.0-rc0
"Buddy Platform,Inc.",2014-05-12T22:24:28.493Z,"Buddy is designed to make it incredibly easy to write modern, interactive mobile applications by allowing you, the app developer, to focus on your mobile experience and not worry about building a backend service.
Buddy handles all the cost and hassle of a mobile backend for you by providing a scalable cloud-based backend for your app.",BuddyPlatformSdk,False,2015-12-19T20:05:16.993-08:00,True,False,Buddy Platform SDK for .NET,"iot,baas,paas,sdk,cloud,api",13316,False,2.0.0
Jerome Haltom,2014-05-12T00:28:56.317Z,"NXKit forms the basis of an XML processing engine that can be used to implement other XML based models, such as XForms, or theoritically a full web browser user agent.

            Schema support is available in other NXKit packages.",NXKit.Scripting,False,2015-04-28T22:29:51.267-07:00,True,False,,"xml,xforms",4138,False,0.4.0
CapableObjects,2014-05-12T12:36:37.65Z,Descr,EcoOtherDatabasePersistenceMappers,False,2018-04-17T02:38:14.233+00:00,True,False,,"ModelDrivenDevelopment,ECO,CapableObjects",141036,False,7.0.0.7273
Danny Varod,2014-05-12T23:40:34.687Z,"An abstraction above MongoDB Driver
(moved to PubComp.NoSql.MongoDbDriver)",PubExp.NoSqlRep.MongoDbDriver,False,2014-10-28T06:05:17.36-07:00,True,False,"An abstraction above MongoDB Driver
(moved to PubComp.NoSql.MongoDbDriver)","pubexp,nosql,mongodb,mongocsharpdriver",2434,False,1.5.0
Zach Bray,2014-05-11T22:28:28.367Z,An extension library for building dynamic websites with F# and FunScript that are capable of SEO.,TypeInferred.HashBang.Html,False,2014-05-31T17:47:06.053-07:00,True,False,,"F#,FSharp,JavaScript,TypeProvider,FunScript",7733,False,0.1.52
Vitalii Fedorchenko,2014-05-12T15:52:49.087Z,"Video converter component for C# (.NET) based on FFMpeg utility. Can be used for converting video, transcoding live streams, extracting video thumbnails.",NReco.VideoConverter,False,2017-01-14T10:00:19.1+00:00,True,False,,"Video,FFMpeg",85973,True,1.0.1
Tim Jones,2014-05-12T14:59:10.097Z,"Inspector.MonoGame module for Gemini, adding editors for MonoGame types to the Inspector module.",Gemini.Modules.Inspector.MonoGame,False,2015-09-20T06:56:53.69-07:00,True,False,,".net40,WPF,MVVM,AvalonDock,Caliburn,Micro,Visual,Studio,IDE,Shell,inspector,XNA,MonoGame",672,False,0.5.0
Rex Cardan,2014-05-12T20:17:35.99Z,A simple wrapper around the EPPlus library that enables quick access to Excel rows as a list of dynamic values.,Cardan.XCel,True,2016-08-08T12:44:31.47-07:00,True,False,A simple library to provide quick access to Excel data. Includes reading and writing.,Excel,3059,False,1.0.1-beta
Ivony,2014-05-12T15:08:55.13Z,Jumony for Web Development,Jumony.Web,True,2014-05-31T22:52:18.123-07:00,True,False,,,2282,False,3.1.9.1-alpha
Wes Cruver,2014-05-12T20:50:45.66Z,"Features:
-Define hotkeys on an entire route, automatically binding and unbinding them as you navigate
-Automatic listing of shortcuts when users hit the ? key
-Super duper unit tests",angular-hotkeys,False,2016-02-29T04:42:18.437-08:00,True,False,Configuration-centric keyboard shortcuts for your Angular apps,"hotkeys,angular,angularjs,keys,shortcuts",11548,False,1.2.2
Muchiachio,2014-05-12T18:07:28.577Z,"Datalist is autocomplete plus data tables like feature for retrieving, showing and selecting remote data in MVC projects.",Datalist,False,2018-01-31T18:36:00.22+00:00,True,False,,"datalist,autocomplete,mvc",14088,False,3.0.4
Media Browser Team,2014-05-11T23:04:22.22Z,Contains core components required to build plugins for Media Browser Server.,MediaBrowser.Server.Core,False,2018-04-14T14:59:39.967+00:00,True,False,,,136986,False,3.0.366
ZenProgramming.it,2014-05-12T11:26:20.88Z,Utilities to build ASP.NET MVC applications,Chakra.Mvc,False,2015-01-08T00:45:02.537-08:00,True,False,,,2888,False,1.0.6
Efrat Barak,2014-05-12T23:19:39.587Z,A C# API for working against BeatsMusic public developer API on a portable C# library.,BeatsMusicCSharpAPI,False,2014-08-18T15:00:31.987-07:00,True,False,,,4677,False,1.10.1
objo,2014-05-12T19:28:47.76Z,OxyPlot is an open source plotting library for .NET.,OxyPlot.WindowsForms,False,1900-01-01T00:00:00+00:00,False,False,,"winforms,plotting,plot,charting,chart",158422,False,2014.1.301.1
adriancs,2014-05-12T14:34:41.69Z,A tool to backup and restore MySQL database in C#/VB.NET/ASP.NET.,MySqlBackup.NET,False,2018-03-26T03:02:04.523+00:00,True,False,A tool to backup and restore MySQL database in C#/VB.NET/ASP.NET.,"MySql,Backup,Restore,Export,Import,C#,VB.NET,ASP.NET",29442,False,2.0.4
Arteny,2014-05-12T09:11:13.583Z,High level wrapper at Betfair API,ExchangeAPI,False,2018-04-03T14:00:11.48+00:00,True,False,,,97708,False,1.45.361
James Craig,2014-05-12T17:30:40.777Z,This adds LESS support to the Iron Man Framework.,Ironman.Core.Assets.Less,True,2016-08-22T09:51:02.54-07:00,True,False,This adds LESS support to the Iron Man Framework.,less,21489,False,1.0.136-beta
TTRider,2014-05-13T02:44:13.597Z,Fluid-style SQL statement generator,TTRider.FluidSql.dll,False,2017-08-09T02:23:12.623+00:00,True,False,,SQL,22623,False,0.0.7
"Bernhard Millauer,Uwe Mayer",2014-05-12T21:06:31.843Z,LocalizationExtension is a really easy way to localize any type of DependencyProperties or native Properties on DependencyObjects,WpfLocalizeExtension,False,2018-03-27T13:51:49.97+00:00,True,False,LocalizationExtension is a really easy way to localize any type of DependencyProperties or native Properties on DependencyObjects,"wpf,silverlight,phone,localization,extension,globalization,resx,csv,resource,language",85295,False,2.2.1
gregsdennis,2014-05-13T02:02:50.787Z,"A REST client provider implementation for Manatee.Trello, backed by RestSharp.",Manatee.Trello.RestSharp,False,1900-01-01T00:00:00+00:00,False,False,,"trello,rest,manatee",-1,False,1.0.1
Rex Morgan,2014-05-11T23:09:06.773Z,Blistering-fast Handlebars.js templates in your .NET application.,Handlebars.Net,True,2017-05-16T16:41:22.18-07:00,True,False,Blistering-fast Handlebars.js templates in your .NET application.,,391984,False,1.0.0-alpha4
"Microsoft Open Technologies,Inc.",2014-05-12T18:35:17.147Z,"Tx (LINQ to Logs and Traces) core components, not specific to the event format",Tx.Core,False,2017-06-12T11:08:35.427-07:00,True,False,,"Tx,Traces,Logs,Playback,Replay,XEvent,ETW",25453,False,1.0.40512
Patrik Svensson,2014-05-11T20:56:34.083Z,Use this package as a part of your build pipeline to build assets with Lunt.,Lunt.Make,False,2014-05-21T13:30:12.65-07:00,True,False,Lunt is an asset pipeline and build system for games.,"Lunt,Lake,Build",945,False,0.0.4
pocketberserker,2014-05-11T14:15:31.627Z,FsAttoparsec is A port of Bryan O'Sullivan's attoparsec from Haskell to F#.,FsAttoparsec,False,2014-10-13T15:16:41.5-07:00,True,False,,"f#,fsharp,parser",1318,False,0.2.0
Envoc,2014-05-12T12:56:04.15Z,Envoc.Directives,Envoc.Directives,False,2016-11-11T12:44:22.873-08:00,True,False,,,16846,False,1.0.0.43
Denis Korkhov,2014-05-12T12:55:00.12Z,Asp.Net Mvc factories for Cortoxa Framework,Cortoxa.Web.Mvc,False,2014-07-30T10:32:28.84-07:00,True,False,Data Patterns for Cortoxa Framework,"Cortoxa,IoC,MVC",2578,False,1.0.13
"Brady Holt,Renato Lima,Ivan Santos,Siarhei Khalipski,Mustafa SADEDÄ°L,Star Peng,TotalMace",2014-05-12T03:09:43.317Z,A library that converts cron expressions into human readable strings.,CronExpressionDescriptor,False,2018-03-11T03:19:09.207+00:00,True,False,,"cron,schedule,quartz,quartz.net,expression",160433,False,1.10.0
Denis Korkhov,2014-05-12T08:03:34.12Z,"Log4Net integration for Cortoxa Framework.
Cortoxa Framework is a Powerful Framework for faster and easier building .Net applications based on Dependency Injection patterns. Contains implementation of common ""Design Patterns"".",Cortoxa.Log4Net,False,2014-05-12T01:03:34.12-07:00,True,False,Log4Net integration for Cortoxa Framework,"logger,log,logging,log4net",719,False,1.0.6
Chillisoft,2014-05-12T04:02:40.693Z,Habanero.Smooth,Habanero.Smooth,True,2017-04-20T04:03:20.277+00:00,True,False,,,157786,False,3.9.202-prerelease
