authors,created,description,id,is_prerelease,last_updated,listed,missing_info,summary,tags,total_downloads,verified,versionPatrick Ineichen,2014-09-14T19:34:17.617Z,"A library which supports DDD, CQRS and event sourcing",SimpleDomain,True,2017-05-06T13:42:31.267-07:00,True,False,,,2389,False,0.6.0-beta0001
Zenasoft,2014-09-15T09:09:18.24Z,HyperStore is a Database Oriented Model integrating many concepts of DDD and CQRS.,Hyperstore,False,2015-03-16T14:17:23.16-07:00,True,False,,"Hyperstore,DSL,CQRS,DDD",18554,False,0.9.112
Bryan Apellanes,2014-09-14T22:06:53.787Z,EcmaScript.Net extensions for server side javascript execution,Brevitee.Javascript,False,2015-09-06T11:23:33.867-07:00,True,False,,,1538,False,3.0.7
Pascal Wyss,2014-09-14T11:43:20.17Z,.NET Library to use gladdress.com Web API,Gladdress,False,2015-10-17T14:58:14.097-07:00,True,False,"Gladdress.com API Client Library

Usage:

GladdressProfile gladdressProfile = new GladdressProfile(""046632BC-8B3A-485D-8213-9527132C97C9"");
List<string> fields = gladdressProfile->GetFields();
var firstName = gladdressProfile.Get(""FirstName"");","Gladdress,GladId",10157,False,1.5.0
Volkan Ceylan,2014-09-14T13:16:16.727Z,Contains reporting classes...,Serenity.Reporting,False,1899-12-31T16:00:00-08:00,False,False,,Serenity,-1,False,1.0.9
Blue Marble,2014-09-13T22:14:26.73Z,Shared Azure functions and classes for Blue Marble projects,BlueMarble.Shared.Azure,False,1899-12-31T16:00:00-08:00,False,False,,,6439,False,1.0.63
Blue Marble,2014-09-13T20:24:21.243Z,Shared Azure functions and classes for Blue Marble projects,BlueMarble.Shared.Azure,False,1899-12-31T16:00:00-08:00,False,False,,,6439,False,1.0.60
Adam Yeager,2014-09-14T02:42:57.383Z,A simple C# wrapper to PushBullet's HTTP API.,PushBulletSharp,False,2018-01-24T23:23:42.147+00:00,True,False,A simple C# wrapper to PushBullet's HTTP API.,"PushBullet,PushBulletSharp",14590,False,1.0.0
JustGiving,2014-09-13T18:43:57.94Z,"EventStore subscriber, using the JustGiving.EventStore.Http.Client library.",JustGiving.EventStore.Http.SubscriberHost,False,2017-08-11T10:23:16.803+00:00,True,False,JustGiving.EventStore.Http.SubscriberHost,"EventStore,event,store,soa,http",20649,False,1.0.90
Arteny,2014-09-15T13:02:53.557Z,Betfair API-NG low level library,BetfairAPI-NG,False,2014-10-07T09:31:26.457-07:00,True,False,,,3100,False,1.4.436
Dennis Bappert,2014-09-14T12:43:37.14Z,"You like EntityFramework and use it frequently but sometimes you need just a simple embedded database for an app or a small application, then MobileDB ist just right for you. It's a lightweight, fast and simple JSON database with an EntityFramework inspired API.",MobileDB,True,2014-09-30T01:51:55.857-07:00,True,False,,"database,json,entityframework,embedded",888,False,0.0.6-alpha
Patrick,2014-09-15T10:00:23.683Z,My package description.,Bootstrap.Admin.CleanZone,False,1899-12-31T16:00:00-08:00,False,False,,,-1,False,1.0.1
Ninny,2014-09-15T09:03:05.74Z,Common Library for all front-site and services-site using.,MMQ.CommonLibrary,False,2016-06-20T19:20:08.323-07:00,True,False,,,102571,False,0.0.318
Sam Thwaites,2014-09-15T00:46:07.983Z,"AFrame is a common automation framework built ontop of Selenium for Web Apps, Microsoft CodedUI for
          Desktop Apps and Appium for Mobile Apps. Utilizing the page object pattern and many others, AFrame
          gives your automation scripts the ability to be maintainable, flexible, and reliable without impacting on your design.
          With amazing documentation and samples galore, you will not be disappointed.

          NOTE: This is the desktop package of AFrame. For others please see AFrame.Mobile or AFrame.Web.",AFrame.Desktop,False,2015-08-13T03:31:08.69-07:00,True,False,,"automation,framework,uiautomation,selenium,codedui,appium,browser,mobile,web,ui,desktop,gui,phone,webdriver,unittest,test,testing,bdd,acceptance,tdd",6859,False,0.4.10
Oystein Bjorke,2014-09-15T05:59:52.71Z,OxyPlot is an open source plotting library for .NET. This package targets iOS apps.,OxyPlot.XamarinIOS,True,1899-12-31T16:00:00-08:00,False,False,,"xamarin,iOS,plotting,plot,charting,chart",-1,False,2014.1.465-alpha
Jef King,2014-09-14T17:57:16.967Z,Scalable image uploading and processing for Azure.,King.Azure.Imaging,False,2016-08-30T15:12:39.633-07:00,True,False,Simplified Azure Imaging Framework.,"King.Azure.Imaging,Azure,Image,Jpg,Png,CDN,image,resize,crop,rotate,jpeg,jpg,gif,png,server-safe-imaging,imaging,Cloud,Blob",8785,False,1.2.3
Bryan Apellanes,2014-09-14T22:08:15.03Z,"Network related tools.  Dfs, smb, ping, dns",Brevitee.Net,False,2015-09-06T11:25:28.66-07:00,True,False,,,2837,False,3.0.7
Stefan Seeland,2014-09-14T20:52:34.077Z,"You need to decode, encode or do some processing stuff on multimedia streams, files or whatever mencoder can read? You want to implement your solution in C# or some other .net language? Here you are! This is an assembly which wrappes calls to e.g. reencode some source with a other codec.",MencoderSharp,True,2016-12-05T14:34:07.28-08:00,True,False,"A mencoder wrapper
      Async- & Synccalls of mencoder are wrapped by this assembly. See http://code.google.com/p/mencoder-sharp/ for an example of encoding to mp4.
      Changelog: https://code.google.com/p/mencoder-sharp/source/list",".net,reencode,mencoder,multimedia,convert,ffmpeg,mp4,xvid",2873,False,1.1.0-Beta
fir3pho3nixx@gmail.com,2014-09-14T21:55:19.717Z,A library for make windsor really easy,FluentWindsor.Mvc,False,2017-09-14T20:10:07.937+00:00,True,False,,"Castle,Windsor,Fluent,Mvc",14961,False,1.0.0.6
SEEK Ltd.,2014-09-15T06:34:29.233Z,Custom DSC Resources for networking administration,seek-dsc-networking,False,2015-07-30T06:10:03.163-07:00,True,False,,"admin,DSC",17645,False,1.0.0.33
Volkan Ceylan,2014-09-15T13:47:06.767Z,Contains code generator classes for MVC applications...,Serenity.CodeGeneration.Mvc,False,1899-12-31T16:00:00-08:00,False,False,,Serenity,-1,False,1.1.0
fir3pho3nixx@gmail.com,2014-09-14T21:36:27.65Z,A library for make windsor really easy,FluentWindsor.Mvc,False,2017-09-14T20:10:07.937+00:00,True,False,,"Castle,Windsor,Fluent,Mvc",14961,False,1.0.0.4
Pavel,2014-09-13T22:00:01.967Z,Description,Odin.Extensions,False,1899-12-31T16:00:00-08:00,False,False,,,-1,False,1.0.0
Volkan Ceylan,2014-09-14T13:13:57.757Z,Contains HttpRuntimeCache that implements ICache interface,Serenity.Caching.Web,False,1899-12-31T16:00:00-08:00,False,False,,Serenity,-1,False,1.0.9
"Henrik Feldt,Intelliplan International AB",2014-09-14T14:58:48.61Z,"Logary is a high performance, multi-target logging, metric and health-check library for mono and .Net.",Intelliplan.Logary.CSharp,True,1899-12-31T16:00:00-08:00,False,False,,"logging,f#,nosql,log4net,nlog,serilog,log,logs,metrics,metrics.net,measure,performance,perf,semantic,structured",-1,False,2.0.0-alpha3
fir3pho3nixx@gmail.com,2014-09-14T21:38:21.293Z,A library for make windsor really easy,FluentWindsor,False,2017-09-14T20:09:56.56+00:00,True,False,,"Castle,Windsor,Fluent",15661,False,1.0.0.5
RArcher Software Ltd.,2014-09-14T11:58:30.217Z,The RArcher.WinRT.Toolkit package provides various classes that help when developing WinRT 8.1 (Windows and Windows Phone) apps based on a lightweight interpretation of the MVVM design pattern. This package provides console (debug) logging services.,RArcher.WinRT.Toolkit.Logging,True,2014-09-14T04:58:30.217-07:00,True,False,,,229,False,1.0.0-prerelease
JustGiving,2014-09-13T18:44:26.837Z,"Ninject bindings for the JG EventStore Http subscriber, used for instantiating event handlers for subscribed messages",JustGiving.EventStore.Http.SubscriberHost.Ninject,False,2017-08-11T10:24:43.367+00:00,True,False,JustGiving.EventStore.Http.SubscriberHost.Ninject,"EventStore,event,store,soa,http,ninject,subscribe",18586,False,1.0.90
Osman Buran,2014-09-14T21:35:18.613Z,LIBRARY,Buran.Library,False,1899-12-31T16:00:00-08:00,False,False,,,-1,False,1.2.0
Sam Thwaites,2014-09-15T06:39:32.297Z,"AFrame is a common automation framework built ontop of Selenium for Web Apps, Microsoft CodedUI for
          Desktop Apps and Appium for Mobile Apps. Utilizing the page object pattern and many others, AFrame
          gives your automation scripts the ability to be maintainable, flexible, and reliable without impacting on your design.
          With amazing documentation and samples galore, you will not be disappointed.

          NOTE: This is the web package of AFrame. For others please see AFrame.Desktop or AFrame.Mobile.",AFrame.Web,False,2015-08-13T03:30:03.463-07:00,True,False,,"automation,framework,uiautomation,selenium,codedui,appium,browser,mobile,web,ui,desktop,gui,phone,webdriver,unittest,test,testing,bdd,acceptance,tdd",7124,False,0.4.18
Alexander Krylkov,2014-09-14T07:55:31.533Z,Simplify.DI CastleWindsor provider,Simplify.DI.Provider.CastleWindsor,False,2018-03-13T17:10:44.23+00:00,True,False,Simplify.DI CastleWindsor provider,".NET,DI,IOC-container-provider",2083,False,1.0.2
Arteny,2014-09-15T13:06:03.767Z,Sport Exchanges Hi Level wrapper library,ExchangeAPI,False,2018-04-03T14:00:11.48+00:00,True,False,,"Betfair,API,API-NG,BetDAQ,Arteny",98025,False,1.92.437
Viktor Hofer,2014-09-15T13:32:06.407Z,TheTVDB API access library with huge support for all current plattforms: Win8+WP8+NET45+WP81,TheTVDBSharp,False,2017-03-10T07:32:01.023-08:00,True,False,,"TheTVDB,TVDB,SeriesManager",4101,False,1.0.5371.26158
Bryan Apellanes,2014-09-14T21:53:21.647Z,Command Line Tools,Brevitee.CommandLine,False,2015-09-06T11:17:10.257-07:00,True,False,,,3990,False,3.0.7
Ninny,2014-09-15T07:47:31.61Z,Common Library for all front-site and services-site using.,MMQ.CommonLibrary,False,2016-06-20T19:20:08.323-07:00,True,False,,,102571,False,0.0.315
Jef King,2014-09-15T04:05:46.99Z,Scalable image uploading and processing for Azure.,King.Azure.Imaging,False,2016-08-30T15:12:39.633-07:00,True,False,Simplified Azure Imaging Framework.,"King.Azure.Imaging,Azure,Image,Jpg,Png,CDN,image,resize,crop,rotate,jpeg,jpg,gif,png,server-safe-imaging,imaging,Cloud,Blob",8785,False,1.2.4
SQLite Development Team,2014-09-13T21:50:19.39Z,"This is a pre-release package and is not intended for production use.  This is a legacy package; if possible, please use either the ""System.Data.SQLite.Test"" or ""System.Data.SQLite.Core.Test"" package instead.  An ADO.NET provider for SQLite (managed-only).",System.Data.SQLite.MSIL.Test,False,1899-12-31T16:00:00-08:00,False,False,,"sqlite,database,ado.net,provider,interop",-1,False,1.0.94.2
ReflectSoftware Inc.,2014-09-15T05:12:16.667Z,"We've added support for the .NET Diagnostic Debug/Trace write. This allows you to leverage your current investment in Debug/Trace, but leverage the power and flexibility that comes with the ReflectInsight viewer. 

In order to use this extension you must have the ReflectInsight Viewer installed. Download and install the ReflectInsight Viewer from this location: 

http://www.ReflectSoftware.com/Public/Download.aspx

You can view your Debug/Trace messages in realtime, in a rich viewer that allows you to filter out and search for what really matters to you.",ReflectSoftware.Insight.Extensions.DebugTrace,False,2016-05-01T20:57:55.06-07:00,True,False,ReflectInsight Debug/Trace logging extention make it easy to integrate ReflectInsight into your existing application logging infrastructure and leverage the power of the ReflectInsight log viewer.,".NET,Diagnostic,Debug,Trace,Logging,Extensions,ReflectInsight,Appender,Log,Tracing,RabbitMQ",6324,False,5.3.2
Sam Thwaites,2014-09-15T00:45:30.237Z,"AFrame is a common automation framework built ontop of Selenium for Web Apps, Microsoft CodedUI for
          Desktop Apps and Appium for Mobile Apps. Utilizing the page object pattern and many others, AFrame
          gives your automation scripts the ability to be maintainable, flexible, and reliable without impacting on your design.
          With amazing documentation and samples galore, you will not be disappointed.

          NOTE: This is the web package of AFrame. For others please see AFrame.Desktop or AFrame.Mobile.",AFrame.Web,False,2015-08-13T03:30:03.463-07:00,True,False,,"automation,framework,uiautomation,selenium,codedui,appium,browser,mobile,web,ui,desktop,gui,phone,webdriver,unittest,test,testing,bdd,acceptance,tdd",7124,False,0.4.10
fir3pho3nixx@gmail.com,2014-09-14T21:35:49.243Z,A library for make windsor really easy,FluentWindsor.WebApi,False,2017-09-14T20:10:20.14+00:00,True,False,,"Castle,Windsor,Fluent,WebApi",14985,False,1.0.0.3
Ninny,2014-09-15T08:04:20.383Z,Common Library for all front-site and services-site using.,MMQ.CommonLibrary,False,2016-06-20T19:20:08.323-07:00,True,False,,,102571,False,0.0.317
Volkan Ceylan,2014-09-15T13:42:34.583Z,"Contains abstractions and implementations for some basic Serenity features like authorization, caching, localization, dependency resolution, reflection...",Serenity.Core,False,2018-03-31T16:38:28.347+00:00,True,False,,Serenity,122757,False,1.1.0
GeertvanHorrik,2014-09-15T10:01:08.61Z,Catel.Extensions.FluentValidation library which contains fluent validation extensions.,Catel.Extensions.FluentValidation,True,2016-11-29T05:36:11.987-08:00,True,False,,"validation,fluent,fluentvalidation,catel",125946,True,4.0.0-unstable0507
"Henrik Feldt,Intelliplan International AB",2014-09-14T10:19:05.6Z,"Logary is a high performance, multi-target logging, metric and health-check library for mono and .Net.",Intelliplan.Logary.Logentries,True,1899-12-31T16:00:00-08:00,False,False,,"logging,f#,nosql,log4net,nlog,serilog,log,logs,metrics,metrics.net,measure,performance,perf,semantic,structured",-1,False,2.0.0-alpha2
ReflectSoftware Inc.,2014-09-15T02:51:04.517Z,"Traditional simple text base logging frameworks lack what your application can easily emit in providing you better insight into the health of your application. Wouldn’t it be great to easily instrument incredible rich details? Well, look no further. ReflectInsight was designed to easily let your application speak volumes!

One of ReflectInsight’s most powerful features is its impressive and elegant Viewer. The Viewer was design to hone in on particular issues and filter any unwanted noise by creating User Defined Views. User Defined Views allow you to filter a given request and visualize the execution path that actually caused the issue at hand. 

Everyone knows that debugging multithread applications is no simple task. Due to racing conditions, traditional IDE debuggers are not well suited for the job and don’t really provide an accurate picture behind the scenes. With ReflectInsight’s Live Viewer, debugging multithread applications is that much easier!

In order to use this library you must have the ReflectInsight Viewer installed. Download and install the ReflectInsight Viewer from this location: 

http://www.ReflectSoftware.com/Public/Download.aspx

You can view your messages in realtime, in a rich viewer that allows you to filter out and search for what really matters to you.",ReflectSoftware.Insight,True,2017-06-14T11:52:01.39-07:00,True,False,"ReflectInsight - The Next Generation in Application Logging.

ReflectInsight goes beyond where no text-based logging has gone before.",".NET,Diagnostic,Debug,Trace,Logging,Extensions,ReflectInsight,Appender,Log,Tracing,RabbitMQ",13369,False,5.3.2-rc1
"Henrik Feldt,Intelliplan International AB",2014-09-14T15:04:06.1Z,"Logary is a high performance, multi-target logging, metric and health-check library for mono and .Net.",Intelliplan.Logary.TOML,True,1899-12-31T16:00:00-08:00,False,False,,"logging,f#,nosql,log4net,nlog,serilog,log,logs,metrics,metrics.net,measure,performance,perf,semantic,structured",-1,False,2.0.0-alpha3
Alexander Krylkov,2014-09-14T07:13:39.527Z,Windows services framework with DI.,Simplify.AutomatedWindowsServices,False,1899-12-31T16:00:00-08:00,False,False,Windows services framework with DI,".NET,windows-service,DI",-1,False,1.4.0
ReflectSoftware Inc.,2014-09-15T05:14:03.33Z,"We've added support for the Common Logging appender. This allows you to leverage your current investment in Common Logging, but leverage the power and flexibility that comes with the ReflectInsight viewer. 

In order to use this extension you must have the ReflectInsight Viewer installed. Download and install the ReflectInsight Viewer from this location: 

http://www.ReflectSoftware.com/Public/Download.aspx

You can view your Common Logging messages in realtime, in a rich viewer that allows you to filter out and search for what really matters to you.",ReflectSoftware.Insight.Extensions.CommonLogging,True,2018-01-29T01:31:11.147+00:00,True,False,ReflectInsight Common Logging extention makes it easy to integrate ReflectInsight into your existing application logging infrastructure and leverage the power of the ReflectInsight log viewer.,"Common,Logging,Extensions,ReflectInsight,Appender,Log,Tracing,RabbitMQ",3122,False,5.3.2-rc1
Henrik Feldt,2014-09-14T07:40:00.243Z,Log4net appender for RabbitMQ,log4net.RabbitMQAppender,False,1899-12-31T16:00:00-08:00,False,False,,"rabbitmq,log4net",-1,False,1.0.0
Shahedul Huq Khandkar,2014-09-14T06:39:01.463Z,A .NET Client Library for AzureSearch,azure-search-util,False,2014-10-02T14:08:09.28-07:00,True,False,,"AzureSearch,Azure",5003,False,0.2.4
Sergey Zwezdin,2014-09-14T09:16:49.21Z,Lightweight library to implement CQS principle with .NET applications.,CQS.NET.EntityFramework,False,1899-12-31T16:00:00-08:00,False,False,,,-1,False,1.0.0
SmartBooks,2014-09-15T03:25:43.69Z,网页在线客服插件.,OnlineService,False,2014-09-14T20:29:18.41-07:00,True,False,,,563,False,1.0.0
Kevin Dalman,2014-09-14T18:51:39.28Z,"This plug-in was inspired by the extJS border-layout, and recreates that functionality as a jQuery plug-in. The UI Layout plug-in can create any UI look you want - from simple headers or sidebars, to a complex application with toolbars, menus, help-panels, status bars, sub-forms, etc.",jQuery.Layout,False,2014-09-14T11:51:39.28-07:00,True,False,UI Layout – The Ultimate Page Layout Manager,"jQuery,page,layout",9017,False,1.40.3
Daniel Lo Nigro,2014-09-15T01:51:22.623Z,"ReactJS tools for ASP.NET MVC 4 and 5.
Please refer to project site (http://reactjs.net/) for more details, usage examples and sample code.",React.Web.Mvc4,False,2018-03-05T03:16:58.417+00:00,True,False,ReactJS tools for ASP.NET MVC 4 and 5,"asp.net,mvc,asp,jquery,javascript,js,react,facebook,reactjs",242525,False,1.1.2
GeertvanHorrik,2014-09-15T10:02:39.223Z,Catel.Extensions.Prism library which contains helper classes for prism.,Catel.Extensions.Prism,True,2016-11-29T13:36:21.16+00:00,True,False,,"prism,catel,mvvm",129402,True,4.0.0-unstable0507
Jin-Wook Chung,2014-09-15T04:46:12.367Z,Experiment is a base library to support parameterized tests with auto data.,Experiment.Xunit,True,2016-04-13T13:07:24.46-07:00,True,False,,"unit-testing,tdd,xunit",13799,False,1.6.0-a01
Jon Arild Torresdal,2014-09-14T19:11:34.907Z,"ConDep is a highly extendable Domain Specific Language for Continuous Deployment, Continuous Delivery and Infrastructure as Code on Windows.",ConDep,True,2015-03-08T13:43:49.03-07:00,True,False,,"Continuous,Deployment,Delivery,Infrastructure,WebDeploy,Deploy,msdeploy,IIS,automation,powershell,remote",42491,False,3.0.15-beta
Andreas Beham,2014-09-14T19:30:35.147Z,"Sim# aims to port the concepts used in SimPy (https://pypi.python.org/pypi/simpy) to the .NET world. It is implemented in C# and builds on the .NET Framework 4.0. Sim# uses an efficient event queue (adapted from https://bitbucket.org/BlueRaja/high-speed-priority-queue-for-c) that allows to compute models very fast. Simulating 10 years of the MachineShop sample (http://simpy.readthedocs.org/en/latest/examples/machine_shop.html) that uses preemptive resources requires only 2.5s on a Core i7 2.6Ghz. This model generates more than 5 million events.

SimPy allows to model processes easily and with little boiler plate code. A process is described as a method that yields events. When an event is yielded, the process waits on it. Processes are themselves events and so it is convenient to spawn sub-processes that can either be waited upon or that run next to each other. There is no need to inherit from classes or understand a complex object oriented design.",SimSharp,False,2017-09-27T09:09:43.4+00:00,True,False,"A .NET port of SimPy, process-based discrete event simulation framework","discrete-event,simulation",1238,False,3.0.5
"Henrik Feldt,Intelliplan International AB",2014-09-14T14:59:07.06Z,"Logary is a high performance, multi-target logging, metric and health-check library for mono and .Net.",Intelliplan.Logary.Dash,True,1899-12-31T16:00:00-08:00,False,False,,"logging,f#,nosql,log4net,nlog,serilog,log,logs,metrics,metrics.net,measure,performance,perf,semantic,structured",-1,False,2.0.0-alpha3
Rolosoft,2014-09-15T03:56:15.137Z,"This library includes extra Azure based trace listeners not found in core Microsoft.Practices.EnterpriseLibrary.Logging..
If you use Azure Worker or Web Roles, there is already a library (http://msdn.microsoft.com/en-us/library/vstudio/hh323704%28v=vs.100%29.aspx) in the Azure SDK to send ExceptionManger logs to Azure tables.
However, this method doesn't work in WebSites as it requires the Azure SDK to be installed on the server (which it is not for Azure websites).
This library enables ExceptionManager to write to Azure tables regardless of hosting platform or the presence (or absence) of the Azure SDK on the server.",Rolosoft.Practices.EnterpriseLibrary,False,2017-02-14T05:58:07.04-08:00,True,False,,"entlib,Enterprise,Library,exception,ehab,error,management,eab,logging,lab,handler,LOB,Azure,Table",5309,False,1.0.5
Appccelerate,2014-09-15T11:40:01.593Z,MSBuild task for automatic versioning of assemblies.,Appccelerate.VersionTask,False,2017-10-09T15:10:39.67+00:00,True,False,MSBuild task for automatic versioning of assemblies.,"Appccelerate,MSBuild",8191,False,1.5.0
Sitecore Corporation,2014-09-15T11:20:25.05Z,Common functionality for projects of IST team,Sitecore.Integration.Common,False,1899-12-31T16:00:00-08:00,False,False,,,5022,False,1.0.29
Patrick Ineichen,2014-09-14T19:34:41.213Z,"A library which supports DDD, CQRS and event sourcing. This is the Couchbase persistence module for the EventStore.",SimpleDomain.EventStore.CouchbasePersistence,True,1899-12-31T16:00:00-08:00,False,False,,,-1,False,0.6.0-beta0001
luguandao,2014-09-14T18:19:45.913Z,数据库轻量级访问件,SSystem.Data,False,2017-08-29T03:54:21.19+00:00,True,False,,轻量级数据访问，SSystem.Data,8696,False,4.1.0.4160
GeertvanHorrik,2014-09-15T10:03:54.55Z,Catel.MVC 5 library which includes the MVC 5 related features.,Catel.MVC5,True,2016-11-29T13:35:50.27+00:00,True,False,,"mvc,catel",52776,True,4.0.0-unstable0507
Jin-Wook Chung,2014-09-14T07:00:06.813Z,Experiment.AutoFixture supports auto data using AutoFixture library in parameterized tests.,Experiment.AutoFixture,False,2014-11-23T18:06:48.48-08:00,True,False,,"unit-testing,tdd,autofixture",25486,False,1.5.2
David Grupp,2014-09-13T22:13:33.507Z,Fuzzy Logic Sharp. A fuzzy logic library for .NET,FLS,False,2016-01-14T05:34:17.463+00:00,True,False,,,2525,False,1.1.3
Yan Cui,2014-09-13T19:56:48.047Z,"Agent-based F# library for collecting, aggregating and publishing metrics",Metricano,False,2015-06-12T04:59:05.117-07:00,True,False,"Agent-based F# library for collecting, aggregating and publishing metrics","F#,fsharp,aws,amazon,cloudwatch",1522,False,0.2.1
Bernhard Richter,2014-09-15T10:52:07.893Z,An ultra lightweight single file Inversion of Control container for the .Net framework.,LightInject.Source,False,2018-01-13T18:17:26.11+00:00,True,False,,"Ioc,Dependency-Injection,Inversion-of-Control,WinRT,Windows-Runtime",27261,False,3.0.1.8
GeertvanHorrik,2014-09-15T10:04:30.153Z,"Catel.MVVM library which contains the MVVM framework available in Catel. This MVVM framework solves actual
	  real-life development problems when using MVVM for professional applications written in any XAML language
	  such as WPF, Silverlight, Windows Phone and WinRT.",Catel.MVVM,True,2018-04-16T10:11:51.057+00:00,True,False,,"mvvm,data,object,wpf,windows,winrt,phone,wp8,wp,sl,silverlight,view,model,viewmodel",190827,True,4.0.0-unstable0507
ziyasal,2014-09-14T18:39:20.28Z,"Autofac Module that integrating Autofac and NLog, it supports both constructor and property injection.",Autofac.Extras.NLog,False,2015-05-24T07:10:07.317-07:00,True,False,"Autofac Module that integrating Autofac and NLog, it supports both constructor and property injection.","NLog,Autofac,Logger,ILogger,log,logging",49691,False,1.2.1
Alessio Parma <alessio.parma@gmail.com>,2014-09-14T12:22:52.367Z,A long description of the package. This shows up in the right pane of the Add Package Dialog as well as in the Package Manager Console when listing packages using the Get-Package command.,PommaLabs.GRAMPA,False,1899-12-31T16:00:00-08:00,False,False,"A short description of the package. If specified, this shows up in the middle pane of the Add Package Dialog. If not specified, a truncated version of the description is used instead.",utilities,-1,False,0.12.0
Harry McIntyre,2014-09-15T11:22:51.753Z,Strongly type html helpers for rendering jquery.datatables tables from IQueryables,Mvc.JQuery.Datatables,False,2018-02-13T13:32:31.3+00:00,True,False,,"jquery,datatables,iqueryable,razor",126112,False,1.2.147
Bryan Apellanes,2014-09-14T22:07:41.643Z,Brevitee management extensions for Asp.NET MVC,Brevitee.Management,False,1899-12-31T16:00:00-08:00,False,False,,,1888,False,3.0.7
