authors,created,days_abandoned,days_alive,description,id,is_prerelease,last_updated,listed,missing_info,summary,tags,total_downloads,verified,versionGeertvanHorrik,2011-10-02T17:25:18.283Z,4,2392,Catel.Core library which includes the DataObjectBase class.,Catel.Core,False,2018-04-16T10:11:44.76+00:00,True,False,,"mvvm,data,object,wpf,c#",244767,True,2.2.0
"Jake Ginnivan,Brendan Kowitz",2011-09-29T08:18:40.343Z,2395,2395,"Some essential controls, which are not available in other frameworks",WindowsPhoneEssentials.Controls.Settings,False,2011-09-29T01:19:57.48-07:00,True,False,,"windows,phone,7,wp7",1755,False,0.7.2.88
Peter Lillevold,2011-10-03T07:53:20.35Z,669,2391,MVVM implementation for WPF 4.0. NOTE: this is an initial release to the public meant for users already familiar with the DemiCode.Mvvm API. Online documentation is not yet available.,DemiCode.Mvvm,False,2016-06-20T02:14:55.08-07:00,True,False,,"mvvm,wpf,net40",11601,False,1.1.0.16
Erlend Oftedal,2011-09-29T18:20:51.67Z,2061,2395,"Support for Content Security Policy for ASP.NET applications.
      New in version 1.0.6 - Supporting the latest version that will also work properly in Chrome",ContentSecurityPolicy.Net,False,2012-08-28T12:34:08.363-07:00,True,False,,"security,csp,xss",3119,False,1.0.6
Roger Knapp,2011-09-30T16:55:22.213Z,1485,2394,"==CSharpTest.Net.RpcLibrary==
Simply one of the fastest and most robust inter-process communcations available
on the Windows platform.  WinRPC is the building block of DCOM and probably the 
most used remote proceedure call in Windows.  In plain words it is the fastest,
most stable, secure transport available.  Use it for authenticated or anonymous 
communications over LRPC, named-pipes, or tcp/ip.

This assembly provides all the interop nessessary to start a server or client; 
however, it is a transport only implementation.  In other words, it provides no
more than moving a byte[] back and forth with the remote endpoint.  A protocol
is usually layered on top of this to turn raw bytes into meaningful messages.",CSharpTest.Net.RpcLibrary,False,2014-03-27T16:33:41.553-07:00,True,False,CSharpTest.Net.RpcLibrary provides pure managed interop with the Win32 RPC API,"Rpc,Library,Win32,InterProcess,IPC,Remote,Remoting,named,pipes,LRPC,TCP,communications",5673,False,1.11.924.348
"Takayuki Usui,Joe Fitzgerald",2011-09-25T05:26:54.437Z,2399,2399,"Erlang.NET is an implementation of an Erlang node in C# which was manually translated and ported from the counterpart in Java, jinterface.",Erlang.NET,False,2011-09-24T22:26:55.07-07:00,True,False,"Erlang.NET is an implementation of an Erlang node in C# which was manually translated and ported from the counterpart in Java, jinterface.",,1807,False,0.9.6
Calabonga,2011-09-29T22:34:16.597Z,554,2395,Generator for exporting data to Office (Excel and Word),XmlExport,False,2016-10-12T23:18:14.947-07:00,True,False,,"xml,xmlexport,data,generator,exporting,export,office,ms,excel,calabonga,word",12242,False,0.1.6
Microsoft,2011-09-28T16:41:25.467Z,2389,2396,Description,NHibernate.Instantiation,False,2011-10-05T08:16:50.887-07:00,True,False,,,2705,False,1.0.0
Flagbug,2011-09-26T10:21:46.807Z,2098,2398,"A FTP library for .NET which supports various operations, such as retrieving file lists, write and read from/to files, retrieving file and directory infos, etc...",FlagFtp,False,2012-07-22T15:41:10.31-07:00,True,False,,,3665,False,0.1.2
Roger Knapp,2011-09-30T16:36:45.94Z,1545,2394,"==CSharpTest.Net.BPlusTree==
This library is a fairly full featured IDictionary<TKey, TValue> implementation
backed by a B+Tree on disk.  The instance is thread-safe and supports a form of
MVCC (Multi Version Concurancy Control) to support non-blocking reads.  Great
for storing a local cache or use it as a completly local stand-alone database.",CSharpTest.Net.BPlusTree,False,2014-01-26T14:01:33.01-08:00,True,False,"CSharpTest.Net.BPlusTree is a simple IDictionary<TKey, TValue> backed by a B+Tree.","B+,Tree,BPlus,BTree,BPlusTree,Dictionary,Binary,File,Storage",9254,False,1.11.924.348
Jesper Jensen,2011-09-25T19:36:20.933Z,43209,2399,Muccu is a JSON-RPC framework for c#,muccu,False,1899-12-31T16:00:00-08:00,False,False,,"Javascript,JSON-RPC",12820,False,1.1.0
"Andreas Håkansson,Steven Robbins and contributors",2011-10-03T20:03:00.42Z,43209,2391,Enables using the NDjango view engine with nancy,Nancy.Viewengines.NDjango,False,1899-12-31T16:00:00-08:00,False,False,"Nancy is a lightweight web framework for the .Net platform, inspired by Sinatra. Nancy aim at delivering a low ceremony approach to building light, fast web applications.","Nancy,Viewengine,NDjango",-1,False,0.8.0
Romain Flechner,2011-09-29T12:06:20.557Z,15,2395,"Scraping Framework containing :
- a web client able to simulate a web browser.
- an HtmlAgilityPack extension to select elements using css selector (like JQuery)",ScrapySharp,False,2018-04-05T21:03:28.133+00:00,True,False,Scraping framework written in C#.,Scraping,68429,False,1.0.0
"JeremiahRedekop,Ryan D Hatch",2011-09-28T18:12:30.093Z,2333,2396,"Blend of IOC, DI, and Factory Pattern",gcFactories,False,2011-11-30T09:29:49.357-08:00,True,False,"Blend of IOC, DI, and Factory Pattern","IOC,Factory,DI",6114,False,1.0.25
Oracle Corporation,2011-09-30T21:20:31.957Z,1,2394,Connector/Net is a fully-managed ADO.NET driver for MySQL.,MySql.Data,False,2018-04-19T10:17:33.787+00:00,True,False,,MySQL,3387486,True,6.4.4
Amir Rajan,2011-09-30T00:28:05.503Z,1591,2394,"Dynamic Hotness. Simply put...oak is a clone of ActiveModel (Ruby on Rails inspired) that can be used with ASP.NET MVC.  The nuget package 'oak' is the stable release, this one is the latest release fresh off the presses.",oak-edge,False,2013-12-11T09:38:17.657-08:00,True,False,,"dynamic,mvc,migrations,rails,aspnetmvc",50405,False,0.3.2
daruyanagi,2011-09-28T15:21:18.047Z,43209,2396,Grab the HTML code from Flickr's photo page url.,Flickr2Html,False,1899-12-31T16:00:00-08:00,False,False,,ASPNETWEBPAGES,3936,False,1.1.0
rasika.sherman,2011-09-28T03:20:12.127Z,2396,2396,This will add WIF configuration required for AppStore identity integration,LongscaleWIF2010,False,2011-09-27T20:20:13.107-07:00,True,False,,"wif,longscale,appstore",1958,False,1.2.0
Mark Rendle,2011-09-29T14:33:29.977Z,1266,2395,ADO Adapter for the Simple.Data data access library.,Simple.Data.Ado,False,2014-11-01T14:44:34.48-07:00,True,False,,"sqlserver,database,data,ado,.net40",235308,False,0.9.6.2
Arquitectura Binaria,2011-09-28T08:43:51.68Z,2394,2396,"Less Core services: Config, Log, Data...",Less,False,2011-09-30T03:31:02.487-07:00,True,False,A framework with less mass,,54989,False,2.9.5
Developpez.com,2011-10-02T18:42:35.89Z,1773,2392,"Librairie de classes diverses pour le développement d'applications Windows Forms, créée à partir des contributions des membres de Developpez.com.",dvp-net-winforms,False,2013-06-12T05:11:32.927-07:00,True,False,"Librairie de classes diverses pour le développement d'applications Windows Forms, créée à partir des contributions des membres de Developpez.com",,2168,False,0.4.0
Tatham Oddie,2011-09-26T04:10:58.987Z,9,2398,"A .NET client for the neo4j REST API. neo4j is an open sourced, Java based transactional graph database. It's pretty awesome.",Neo4jClient,False,2018-04-11T11:12:31.637+00:00,True,False,,"neo4j,REST,nosql",244832,False,0.0.1.167
Eric Meyer,2011-09-26T20:50:16.86Z,2398,2398,"The goal of a reset stylesheet is to reduce browser inconsistencies in things like default line heights, margins and font sizes of headings, and so on.",Reset.css,False,2011-09-26T13:50:17.907-07:00,True,False,,"Reset,Css",8614,False,2.0.0
Mauro Servienti,2011-10-01T18:41:28.847Z,430,2393,Radical Framework,Radical.Windows,False,2017-02-14T07:33:31.843-08:00,True,False,,"Radical,Radical.Windows",25826,False,1.2.2.3
Mauro Servienti,2011-09-27T09:52:23.467Z,455,2397,Radical Framework,Radical,False,2017-01-20T05:46:33.647-08:00,True,False,,Radical,37194,False,1.2.4
"Chad Myers,Jeremy D. Miller,Joshua Flanagan",2011-09-28T16:04:16.883Z,807,2396,A foundational library for .Net frameworks including model binding and localization,FubuCore,False,2016-02-03T14:49:48.593+00:00,True,False,,"utilities,fubu",109500,False,0.9.1.60
Simon Cropp,2011-09-27T11:45:51.897Z,43209,2397,Uses IL weaving to inject INotifyPropertyChanged code into properties.,NotifyPropertyWeaver,False,1899-12-31T16:00:00-08:00,False,False,,"WPF,Silverlight,MVVM,WP7,WindowsPhone,INotifyPropertyChanged,DataBinding,ILWeaving",-1,False,1.18.0
Luis Bocaletti,2011-09-28T02:42:18.02Z,1389,2396,"bootstrapper.codeplex.com uses a convention over configuration approach to initialize your IOC container, create automapper maps and run any other startup tasks that your application might need.",Bootstrapper,False,2014-06-30T19:38:11.73-07:00,True,False,"bootstrap your applications container, maps and  startup tasks",,100209,False,2.0.1.1
"Chad Myers,Jeremy D. Miller,Joshua Flanagan",2011-09-28T20:25:34.737Z,1718,2396,"Minimal assembly references needed for a FubuMVC application. FubuMVC is a compositional, convention-based framework for complex web applications",FubuMVC.References,False,2013-08-06T05:44:36.32-07:00,True,False,,"web,framework,mvc,fubumvc",58168,False,0.9.1.564
Wilson Mead III,2011-10-02T03:49:30.257Z,43209,2392,"Packs up and takes care of basic things that many of my websites will use. Unstable, but possibly useful. Main feature is packing up jQuery, and a few other 3rd party tools, and also having basic account stuff.",UnlimitedWebsiteWorks,False,1899-12-31T16:00:00-08:00,False,False,Libraries and basics for websites. Unstable.,,-1,False,0.1.0.8
"Chad Myers,Jeremy D. Miller,Joshua Flanagan",2011-10-03T01:10:39.443Z,1718,2391,"Minimal assembly references needed for a FubuMVC application. FubuMVC is a compositional, convention-based framework for complex web applications",FubuMVC.References,False,2013-08-06T05:44:36.32-07:00,True,False,,"web,framework,mvc,fubumvc",58168,False,0.9.1.567
"Jake Ginnivan,Brendan Kowitz",2011-09-29T08:08:26.307Z,2395,2395,a collection of utility classes which save you time and help you write testable wp7 applications,WindowsPhoneEssentials,False,2011-09-29T01:08:53.177-07:00,True,False,,"windows,phone,7,wp7",6588,False,0.7.2.88
GeertvanHorrik,2011-10-02T17:26:00.573Z,43209,2392,Windows Phone 7 version of Catel which includes the MVVM Framework and user controls.,Catel.WP7,False,1899-12-31T16:00:00-08:00,False,False,,"mvvm,data,object,wp7,wp,windows,phone,mango",-1,False,2.2.0
David Ebbo,2011-09-30T07:24:24.747Z,43209,2394,A NuGet package that allows other packages to execute some startup code in web apps,WebActivator,False,1900-01-01T00:00:00+00:00,False,False,,,-1,False,1.4.4
Martin H. Normark,2011-09-29T05:48:37.897Z,395,2395,"Use PreMailer.Net before sending HTML e-mails. E-mail clients are very primitive HTML renderers, and it is very difficult to achieve full support for rich HTML e-mail accross e-mail clients.

One thing that makes it easier, is to move all CSS from a style section in the HTML Head, to inline style attributes on each element.

Create your e-mails with embedded style sections, and have PreMailer.Net move that CSS to inline style attributes before sending.",PreMailer.Net,False,2017-03-21T15:49:38.263-07:00,True,False,"PreMailer.Net is a C# utility for moving CSS to inline style attributes, to gain maximum E-mail client compatibility.","email,css,newsletter,html",354814,False,1.1.0
Harry McIntyre,2011-09-25T22:06:42.763Z,678,2399,"Wraps your classes with a proxy which automatically carries out permission checks when you call methods.
e.g. If you have a method 
'public virtual void SendEmail()'
, you can create a method 
'public virtual bool' AllowSendEmail() { ... }
When SendEmail is called, AllowSendEmail is called first. If this returns false, a HardenException is thrown. To harden an object, call Hardener.Harden(someObject).",Harden,False,2016-06-11T04:47:21.823-07:00,True,False,,,14897,False,1.0.4285.39857
"Chad Myers,Jeremy D. Miller,Joshua Flanagan",2011-10-03T17:27:08.36Z,807,2391,A foundational library for .Net frameworks including model binding and localization,FubuCore,False,2016-02-03T14:49:48.593+00:00,True,False,,"utilities,fubu",109500,False,0.9.2.68
"Jeremy D. Miller,Dru Sellers,et al.",2011-09-28T16:21:04.39Z,836,2396,Shared libraries for runtime and deployment packaging of .Net applications,Bottles,False,2016-01-05T05:44:00.873-08:00,True,False,,"packaging,areas,slices",75899,False,0.9.1.119
"Jeremy D. Miller,Dru Sellers,et al.",2011-09-28T16:20:53.55Z,2223,2396,Tools for deploying applications built on top of the Bottles framework,Bottles.Deployment,False,2012-03-19T12:52:01.773-07:00,True,False,,"packaging,areas,slices",35894,False,0.9.1.119
Hadi Hariri,2011-09-28T07:01:55.767Z,2379,2396,Great Things,GreatLib,False,2011-10-15T04:10:08.827-07:00,True,False,,Wonderful,1199,False,1.0.0
"Tatham Oddie,Romiko Derbynew and Jamal Abreu",2011-09-27T00:19:35.307Z,9,2397,"A .NET client for the neo4j REST API. neo4j is an open sourced, Java based transactional graph database. It's pretty awesome.",Neo4jClient,False,2018-04-11T11:12:31.637+00:00,True,False,,"neo4j,REST,nosql",244832,False,0.0.1.172
"Joshua Arnold,Jeremy D. Miller,et al.",2011-09-28T16:16:41.743Z,1511,2396,"FubuValidation - have validation your way, whatever way that happens to be",FubuValidation,False,2014-03-01T07:58:02.463-08:00,True,False,,"fubu,validation,fubumvc,conventional",72685,False,0.4.0.58
"Chad Myers,Jeremy D. Miller,Joshua Flanagan",2011-10-03T01:10:13.433Z,1586,2391,"A compositional, convention-based framework for complex web applications.
		This package allows you to quickly create a new FubuMVC web application. If you just want to reference
		the FubuMVC libraries without the guidance, use the FubuMVC.Lib package instead.",FubuMVC,False,2013-12-16T12:00:59.923-08:00,True,False,,"web,framework,mvc",55979,False,0.9.1.567
Developpez.com,2011-10-02T18:40:29.943Z,1773,2392,"Librairie de classes diverses pour le développement d'applications .NET, créée à partir des contributions des membres de Developpez.com",dvp-net,False,2013-06-12T05:11:36.103-07:00,True,False,"Librairie de classes diverses pour le développement d'applications .NET, créée à partir des contributions des membres de Developpez.com",,5507,False,0.4.0
Tatham Oddie,2011-09-26T02:18:04.91Z,9,2398,"A .NET client for the neo4j REST API. neo4j is an open sourced, Java based transactional graph database. It's pretty awesome.",Neo4jClient,False,2018-04-11T11:12:31.637+00:00,True,False,,"neo4j,REST,nosql",244832,False,0.0.1.165
Dennis Apter,2011-09-25T12:49:10.093Z,2399,2399,WCF services utility.,Exader.ServiceModel,False,2011-09-25T05:49:31.09-07:00,True,False,,,1177,False,1.0.0
Jesper Jensen,2011-09-29T20:41:27.887Z,43209,2395,Muccu is a JSON-RPC framework for c#,muccu,False,1899-12-31T16:00:00-08:00,False,False,,,12820,False,1.1.0.38219
Harry McIntyre,2011-09-28T12:41:09.117Z,66,2396,Strongly type html helpers for rendering jquery.datatables tables from IQueryables,Mvc.JQuery.Datatables,False,2018-02-13T13:32:31.3+00:00,True,False,,"jquery,datatables,mvc,razor",126423,False,1.0.4288.22888
Harry McIntyre,2011-09-28T16:36:05.86Z,678,2396,"Wraps your classes with a proxy which automatically carries out permission checks when you call methods.
e.g. If you have a method 
'public virtual void SendEmail()'
, you can create a method 
'public virtual bool' AllowSendEmail() { ... }
When SendEmail is called, AllowSendEmail is called first. If this returns false, a HardenException is thrown. To harden an object, call Hardener.Harden(someObject).",Harden,False,2016-06-11T04:47:21.823-07:00,True,False,,,14897,False,1.0.4288.29787
Daniel Wertheim - @@danielwertheim - http://daniel.wertheim.se,2011-09-30T19:45:36.187Z,62,2394,Yet another guard clause project helping you with validation and uniformed exception throwing when validating args.,Ensure.That,False,2018-02-17T11:03:23.547+00:00,True,False,Yet another guard clause project.,"argument,validation,guard,clause",219229,False,0.3.0
"Andreas Håkansson,Steven Robbins and contributors",2011-10-03T20:09:45.01Z,484,2391,An Autofac bootstrapper for the Nancy web framework.,Nancy.Bootstrappers.Autofac,False,2016-12-22T02:26:07.007-08:00,True,False,"Nancy is a lightweight web framework for the .Net platform, inspired by Sinatra. Nancy aim at delivering a low ceremony approach to building light, fast web applications.","Nancy,Autofac",172147,False,0.8.0
Tatham Oddie,2011-09-26T13:49:58.67Z,1578,2398,A set of useful tools for building high reliability applications.,ReliabilityPatterns,False,2013-12-24T14:02:45.863-08:00,True,False,,,8668,False,1.0.0.7
Jesper Jensen,2011-09-27T15:02:05.397Z,43209,2397,MicroDal provider for SQLite,MicroDal.SQLiteProvider,False,1899-12-31T16:00:00-08:00,False,False,,,10233,False,1.0.4287.28306
"Joshua Arnold,et al.",2011-10-03T17:33:42.22Z,1511,2391,A FubuMVC implementation of FubuValidation,FubuMVC.Validation,False,2014-03-01T07:57:37.28-08:00,True,False,,"fubumvc,mvc,fubu,validation,conventional",71211,False,0.4.0.66
jasonbock.net,2011-09-28T21:12:03.393Z,44,2396,An assembly that contains utilities and extension methods to augment the .NET Framework.,Spackle,False,2018-03-07T20:43:13.317+00:00,True,False,,,25149,False,6.0.0
"Chad Myers,Jeremy D. Miller,Joshua Flanagan",2011-09-28T16:28:43.283Z,1718,2396,Support for using the ASP.NET WebForms view engine within a FubuMVC application.,FubuMVC.WebForms,False,2013-08-06T05:45:02.56-07:00,True,False,,"webforms,fubumvc",55402,False,0.9.1.563
"Andreas Håkansson,Steven Robbins and contributors",2011-10-03T20:01:54.457Z,484,2391,Enables hosting Nancy on ASP.NET,Nancy.Hosting.Aspnet,False,2016-12-22T02:23:57.88-08:00,True,False,"Nancy is a lightweight web framework for the .Net platform, inspired by Sinatra. Nancy aim at delivering a low ceremony approach to building light, fast web applications.","Nancy,ASP.NET",341823,False,0.8.0
Ben Aston,2011-10-02T17:00:31.263Z,2130,2392,Simple fluent assertions for .NET.,NSure,False,2012-06-20T12:08:39.31-07:00,True,False,,"fluent,assertion",12291,False,1.0.4292.30694
"Rick Strahl,West Wind Technologies",2011-09-25T01:35:46.04Z,43209,2399,"This library provides a simple business object framework for easily creating
    rich business objects that handle context management for L2S and EF and a common set of 
    CRUD operations within a small and very easy to use elf contained class structure.",Westwind.BusinessFramework,False,1899-12-31T16:00:00-08:00,False,False,A simple business object framework that wraps Linq to SQL and Entity Frameworks,,-1,False,1.18.0
Hadi Hariri and Contributors,2011-10-02T21:01:27.523Z,105,2392,A .NET Library to talk to JetBrains YouTrack,YouTrackSharp,False,2018-01-05T09:37:04.74+00:00,True,False,,,32380,False,1.0.43
"Chad Myers,Jeremy D. Miller,Joshua Flanagan",2011-09-29T18:42:22.393Z,1718,2395,Support for using the ASP.NET WebForms view engine within a FubuMVC application.,FubuMVC.WebForms,False,2013-08-06T05:45:02.56-07:00,True,False,,"webforms,fubumvc",55402,False,0.9.1.566
"Chad Myers,Jeremy D. Miller,Joshua Flanagan",2011-09-28T16:04:20.48Z,836,2396,Localization utilities,FubuLocalization,False,2016-01-05T05:44:31.873-08:00,True,False,,"utilities,fubu",59592,False,0.9.1.60
Sitecore A/S,2011-09-27T07:01:45.243Z,2397,2397,Sitecore NuGet Sample package.,Sitecore.NuGet.Sample,False,2011-09-27T00:04:48.067-07:00,True,False,,"Sitecore,Rocks",2488,False,1.0.0
Hibernating Rhinos,2011-09-26T15:41:41.513Z,43209,2398,"Raven is a document database for the .NET/Windows platform, offering a flexible data model design to fit the needs of real world systems.",RavenDB,False,1899-12-31T16:00:00-08:00,False,False,,"nosql,ravendb,raven,document,database",-1,False,1.0.0.482
"Rick Strahl,West Wind Technologies",2011-09-30T10:35:16.283Z,43209,2394,"Installs Westwind.Web and Westwind.Utilities components that provide the core toolkit functionality. Preconfigures configuration, error handling, logging and provides some basic admin and suppport forms. This NuGet works only for WebForms Web Applications.",WestWindWebToolkitProject,False,1899-12-31T16:00:00-08:00,False,False,West Wind Web & Ajax Toolkit Web Application Project Template,,-1,False,1.18.0
"Chad Myers,Jeremy D. Miller,Joshua Flanagan",2011-09-28T16:28:09.7Z,1586,2396,"A compositional, convention-based framework for complex web applications.
		This package allows you to quickly create a new FubuMVC web application. If you just want to reference
		the FubuMVC libraries without the guidance, use the FubuMVC.Lib package instead.",FubuMVC,False,2013-12-16T12:00:59.923-08:00,True,False,,"web,framework,mvc",55979,False,0.9.1.563
"Joshua Arnold,et al.",2011-10-03T01:10:04.977Z,836,2391,Advanced Diagnostics for FubuMVC.,FubuMVC.Diagnostics,False,2016-01-05T05:45:00.82-08:00,True,False,,fubumvc,62913,False,0.9.1.567
"Tatham Oddie,Romiko Derbynew and Jamal Abreu",2011-09-27T07:05:06.657Z,9,2397,"A .NET client for the neo4j REST API. neo4j is an open sourced, Java based transactional graph database. It's pretty awesome.",Neo4jClient,False,2018-04-11T11:12:31.637+00:00,True,False,,"neo4j,REST,nosql",244832,False,0.0.1.173
Derek Greer,2011-09-27T19:53:43.23Z,2039,2397,An extension for managing application level dependencies using NuGet.,nuget.install2.extension,False,2012-09-19T07:32:04.387-07:00,True,False,,dependency-management,1385,False,1.0.0.1
Developpez.com,2011-10-02T18:44:31.813Z,1773,2392,"Librairie de classes .NET pour l'utilisation de GDI+, créée à partir des contributions des membres de Developpez.com.",dvp-net-drawing,False,2013-06-12T05:11:29.32-07:00,True,False,"Librairie de classes .NET pour l'utilisation de GDI+, créée à partir des contributions des membres de Developpez.com.",,2148,False,0.4.0
Amir Rajan,2011-10-02T03:42:58.45Z,1591,2392,"Dynamic Hotness. Simply put...oak is a clone of ActiveModel (Ruby on Rails inspired) that can be used with ASP.NET MVC.  The nuget package 'oak' is the stable release, this one is the latest release fresh off the presses.",oak-edge,False,2013-12-11T09:38:17.657-08:00,True,False,,"dynamic,mvc,migrations,rails,aspnetmvc",50405,False,0.3.3
"Chad Myers,Jeremy D. Miller,Joshua Flanagan",2011-10-03T01:45:57.27Z,1718,2391,"Minimal assembly references needed for a FubuMVC application. FubuMVC is a compositional, convention-based framework for complex web applications",FubuMVC.References,False,2013-08-06T05:44:36.32-07:00,True,False,,"web,framework,mvc,fubumvc",58168,False,0.9.1.568
"Rob Gibbens,James Simmonds",2011-10-02T19:22:05.357Z,1388,2392,A MongoDb publishing plugin for the Wolfpack Distributed Monitoring System,Wolfpack.Contrib.Publishers.MongoDb,False,2014-07-02T16:21:24.52-07:00,True,False,A MongoDb publishing plugin for the Wolfpack Distributed Monitoring System,"Wolfpack,Monitoring",4004,False,2.3.0.5
Scott Anderson,2011-09-26T15:08:08.233Z,2083,2398,"ActionMailer.Net aims to be an easy, and relatively painless way to send email from your application. The concept is pretty simple. We can render HTML by utilizing some pretty snazzy view engines, so why can't we do the same thing for email?",ActionMailer.Standalone,False,2012-08-05T18:16:55.877-07:00,True,False,A simple library to allow you to render emails using the Razor view engine.,"email,mvc,asp.net,razor",29123,False,0.6.2
Codaxy,2011-09-26T13:34:32.7Z,262,2398,Codaxy.Common.SqlServer Library provides helpers for programatic database schema upgrade scenarios.,Codaxy.Common.SqlServer,False,2017-08-01T10:34:08.163+00:00,True,False,,,6179,False,0.5.3
"Marcus Cuda,Christoph Ruegg,Jurgen Van Gael",2011-10-03T14:01:58.677Z,43209,2391,"This package contains samples that demonstrate the use of the Math.NET Numerics library. Math.NET Numerics is the numerical foundation of the Math.NET project, aiming to provide methods and algorithms for numerical computations in science, engineering and every day use. Numerics is the result of merging dnAnalytics with Math.NET Iridium and is intended to replace both.",MathNet.Numerics.Sample,False,1899-12-31T16:00:00-08:00,False,False,This package contains samples that demonstrate the use of the Math.NET Numerics library.,"sample,code,math,numeric,statistics,probability,integration,interpolation,linear,algebra,matrix,fft",-1,False,2.1.0.19
S. van Deursen,2011-10-01T14:30:49.337Z,5,2393,The Simple Injector is an easy-to-use Inversion of Control library for .NET and Silverlight. It solely supports code-based configuration and is an ideal starting point for developers unfamiliar with larger IoC / DI libraries.,SimpleInjector,False,2018-04-15T09:23:47.283+00:00,True,False,The Simple Injector is an easy-to-use Inversion of Control library for .NET and Silverlight.,"architecture,CommonServiceLocator,dependency-injection,DI,easy,easy-to-use,Inversion-of-Control,IOC,Servicelocator",2462711,False,1.2.0.11273
dfang,2011-09-25T12:56:48.503Z,2399,2399,based on : http://code.google.com/p/google-api-for-dotnet/,Google.Translate.api,False,2011-09-25T05:56:49.303-07:00,True,False,,,4945,False,0.3.1
"Rick Strahl,West Wind Technologies",2011-09-24T23:58:02.013Z,8,2400,"This library provides a number of .NET utility classes that include: 
    StringUtils, ReflectionUtils, FileUtils, DataUtils, SerializationUtils, TimeUtils, SecurityUtils and XmlUtils.
    There are also classes for Configuration, Logging and a thin SQL Data Access layer. 
    These classes are useful in any kind of .NET project.",Westwind.Utilities,False,2018-04-12T09:24:38.173+00:00,True,False,A set of general purpose utility classes for .NET development,,132059,False,1.18.0
