authors,created,description,id,is_prerelease,last_updated,listed,missing_info,summary,tags,total_downloads,verified,versionJason Jarrett,2014-12-29T22:08:55.287Z,TypeScript Definitions (d.ts) for easeljs. Generated based off the DefinitelyTyped repository [git commit: ca32947b75a2b1203779dac7154ffbc232746e4d]. http://github.com/DefinitelyTyped,easeljs.TypeScript.DefinitelyTyped,False,2016-10-06T11:01:42.93-07:00,True,False,,"TypeScript,JavaScript",46924,False,0.5.3
Luke,2014-12-29T18:00:23.257Z,Contains common components shared by Media Browser Theater and Media Browser Server. Not intended for plugin developer consumption.,MediaBrowser.Common.Internal,False,1900-01-01T00:00:00+00:00,False,False,,,127900,False,3.0.538
Hibernating Rhinos,2014-12-29T14:29:40.403Z,"This package includes the client API of RavenDB. RavenDB is a document database for the .NET platform, offering a flexible data model design to fit the needs of real world systems.",RavenDB.Client,True,2018-03-30T12:13:14.39+00:00,True,False,This package includes the client API of RavenDB.,"nosql,ravendb,raven,document,database,client",1115852,True,3.0.3556-Unstable
Jason Jarrett,2014-12-29T02:09:09.577Z,TypeScript Definitions (d.ts) for fast-stats. Generated based off the DefinitelyTyped repository [git commit: a12472597c94a159811c61d41419d55400e6055a]. http://github.com/DefinitelyTyped,fast-stats.TypeScript.DefinitelyTyped,False,2016-03-22T11:12:16.363-07:00,True,False,,"TypeScript,JavaScript",29976,False,0.2.2
Media Browser Team,2014-12-29T17:54:55.363Z,"A dependency-free, configurable file naming engine.",MediaBrowser.Naming,False,2018-04-14T19:49:04.43+00:00,True,False,,,13230,False,1.0.0.24
Jason Jarrett,2014-12-29T06:02:51.927Z,TypeScript Definitions (d.ts) for backbone.radio. Generated based off the DefinitelyTyped repository [git commit: a12472597c94a159811c61d41419d55400e6055a]. http://github.com/DefinitelyTyped,backbone.radio.TypeScript.DefinitelyTyped,False,2016-12-13T22:27:04.47-08:00,True,False,,"TypeScript,JavaScript",41374,False,0.2.3
Jason Jarrett,2014-12-29T06:04:06.847Z,TypeScript Definitions (d.ts) for chai-as-promised. Generated based off the DefinitelyTyped repository [git commit: a12472597c94a159811c61d41419d55400e6055a]. http://github.com/DefinitelyTyped,chai-as-promised.TypeScript.DefinitelyTyped,False,2016-12-13T22:41:41.31-08:00,True,False,,"TypeScript,JavaScript",46330,False,0.5.8
"Aaron Jensen,Alexander Groß,Daniel Marbach,et al.",2014-12-29T20:20:26.21Z,Machine.Specifications.Runner.Resharper provides a Resharper runner for the Context/Specification framework Machine.Specifications,Machine.Specifications.Runner.Resharper9,True,2016-04-19T01:53:38.8-07:00,True,False,Machine.Specifications Runner Resharper,"test,unit,testing,context,specification,bdd,tdd,mspec,runner,resharper",9563,False,0.10.0-Unstable0014
Spursoft Solutions,2014-12-29T20:05:55.287Z,Update HTML Lightswtich projects with the javascript files needed for the Spursoft LightSwitch HTML Extension.,Spursoft.Html.Js,False,1899-12-31T16:00:00-08:00,False,False,,"SSRS,Web,Browser,Address,Viewer,Url,Image,Splitter",3004,False,1.0.0.6
Jason Jarrett,2014-12-29T02:15:46.953Z,TypeScript Definitions (d.ts) for mongoose-mock. Generated based off the DefinitelyTyped repository [git commit: a12472597c94a159811c61d41419d55400e6055a]. http://github.com/DefinitelyTyped,mongoose-mock.TypeScript.DefinitelyTyped,False,2016-03-22T12:14:14.04-07:00,True,False,,"TypeScript,JavaScript",10157,False,0.5.7
votrubac,2014-12-30T01:37:09.283Z,A component to send telemetry data from Windows 8.1 apps.,Clienttelemetry.WindowsRT,False,1899-12-31T16:00:00-08:00,False,False,,,-1,False,0.0.11
Jason Jarrett,2014-12-28T22:11:52.537Z,TypeScript Definitions (d.ts) for jquery.fancytree. Generated based off the DefinitelyTyped repository [git commit: a12472597c94a159811c61d41419d55400e6055a]. http://github.com/DefinitelyTyped,jquery.fancytree.TypeScript.DefinitelyTyped,False,2016-03-22T11:45:53.813-07:00,True,False,,"TypeScript,JavaScript",13261,False,0.1.4
Aidan McGinley,2014-12-29T15:40:46.827Z,Compares two NuGet packages to determine if the Major and Minor version are semantically correct based on the publicly exposed classes/methods.,SemanticVersionEnforcer,False,2015-01-01T05:41:39.97-08:00,True,False,,"NuGet,Package,'Semantic,Version',version,semantic,versioning",1811,False,2.1.1
Damir Dobric,2014-12-28T23:02:16.873Z,"Azure Service Bus JavaScript SDK
     Includes required JavaScript file only.",SbJsSdk,False,2014-12-28T15:02:16.873-08:00,True,False,"This SDK provides support for Queues, Topics and EventHubs.","azure,service,bus",965,False,1.2.0
Jason Jarrett,2014-12-29T02:14:18.007Z,TypeScript Definitions (d.ts) for minimist. Generated based off the DefinitelyTyped repository [git commit: a12472597c94a159811c61d41419d55400e6055a]. http://github.com/DefinitelyTyped,minimist.TypeScript.DefinitelyTyped,False,2016-03-22T12:12:06.557-07:00,True,False,,"TypeScript,JavaScript",24511,False,0.6.7
Corrado Cavalli,2014-12-29T23:06:19.497Z,Porting of Blend behaviors core infrastructure to Xamarin Forms,Xamarin.Forms.Behaviors,False,1899-12-31T16:00:00-08:00,False,False,Behaviors for Xamarin Forms,"Xamarin,Behaviors",-1,False,1.3.0
Oystein Bjorke,2014-12-29T21:52:30.18Z,OxyPlot is an open source plotting library for .NET. This package contains the custom controls for Windows 8.1 and Windows Phone 8.1 apps.,OxyPlot.WindowsUniversal,True,1899-12-31T16:00:00-08:00,False,False,,"winrt,win8,metro,plotting,plot,charting,chart",-1,False,2014.1.642-alpha
Jason Jarrett,2014-12-30T02:03:16.193Z,TypeScript Definitions (d.ts) for backbone.radio. Generated based off the DefinitelyTyped repository [git commit: ca32947b75a2b1203779dac7154ffbc232746e4d]. http://github.com/DefinitelyTyped,backbone.radio.TypeScript.DefinitelyTyped,False,2016-12-13T22:27:04.47-08:00,True,False,,"TypeScript,JavaScript",41374,False,0.2.8
Jason Jarrett,2014-12-29T22:11:33.167Z,TypeScript Definitions (d.ts) for hapi. Generated based off the DefinitelyTyped repository [git commit: ca32947b75a2b1203779dac7154ffbc232746e4d]. http://github.com/DefinitelyTyped,hapi.TypeScript.DefinitelyTyped,False,2016-10-19T09:03:05.227-07:00,True,False,,"TypeScript,JavaScript",25241,False,0.2.4
Jason Jarrett,2014-12-29T06:02:02.883Z,TypeScript Definitions (d.ts) for aspnet-identity-pw. Generated based off the DefinitelyTyped repository [git commit: a12472597c94a159811c61d41419d55400e6055a]. http://github.com/DefinitelyTyped,aspnet-identity-pw.TypeScript.DefinitelyTyped,False,2016-12-13T22:19:48.387-08:00,True,False,,"TypeScript,JavaScript",48013,False,0.5.5
"Aaron Jensen,Alexander Groß,Daniel Marbach,et al.",2014-12-29T20:17:57.65Z,Machine.Specifications is a Context/Specification framework geared towards removing language noise and simplifying tests.,Machine.Specifications-Signed,True,2014-12-29T13:15:20.253-08:00,True,False,Machine.Specifications Context/Specification framework,"test,unit,testing,context,specification,bdd,tdd,mspec",62112,False,0.10.0-unstable0033
Oleg Volovikov,2014-12-29T15:43:51.297Z,"Sql commands wrapper, a mini ORM.",Wxen.DbHug,True,2015-03-25T04:08:08.82-07:00,True,False,"Primarily DbHug is select-based mini ORM, but it has basic functionality of update, delete, insert.","sql,data,common,orm,micro-orm",10588,False,0.10.0-alpha
Jason Jarrett,2014-12-29T02:12:15.107Z,TypeScript Definitions (d.ts) for jquery.fancytree. Generated based off the DefinitelyTyped repository [git commit: a12472597c94a159811c61d41419d55400e6055a]. http://github.com/DefinitelyTyped,jquery.fancytree.TypeScript.DefinitelyTyped,False,2016-03-22T11:45:53.813-07:00,True,False,,"TypeScript,JavaScript",13261,False,0.1.5
Jason Jarrett,2014-12-29T06:08:28.387Z,TypeScript Definitions (d.ts) for fabricjs. Generated based off the DefinitelyTyped repository [git commit: a12472597c94a159811c61d41419d55400e6055a]. http://github.com/DefinitelyTyped,fabricjs.TypeScript.DefinitelyTyped,False,2016-09-08T11:01:59.67-07:00,True,False,,"TypeScript,JavaScript",66166,False,1.6.3
Joseph Antolick,2014-12-29T21:35:22.61Z,A simple Nuget Xamarin plugin for compressing image files.,EZCompress,False,1899-12-31T16:00:00-08:00,False,False,,,-1,False,1.0.0
Jason Jarrett,2014-12-29T10:10:56.363Z,TypeScript Definitions (d.ts) for fast-stats. Generated based off the DefinitelyTyped repository [git commit: a12472597c94a159811c61d41419d55400e6055a]. http://github.com/DefinitelyTyped,fast-stats.TypeScript.DefinitelyTyped,False,2016-03-22T11:12:16.363-07:00,True,False,,"TypeScript,JavaScript",29976,False,0.2.4
Jason Jarrett,2014-12-29T22:09:20.86Z,TypeScript Definitions (d.ts) for ejs-locals. Generated based off the DefinitelyTyped repository [git commit: ca32947b75a2b1203779dac7154ffbc232746e4d]. http://github.com/DefinitelyTyped,ejs-locals.TypeScript.DefinitelyTyped,False,2016-03-22T11:05:41.9-07:00,True,False,,"TypeScript,JavaScript",33764,False,0.2.7
Media Browser Team,2014-12-29T04:43:58.797Z,ApiClient allows .NET clients to easily access the Media Browser 3 web API,MediaBrowser.ApiClient,False,2017-09-20T19:19:53.913+00:00,True,False,,,117583,False,3.0.0.504
Jason Jarrett,2014-12-29T14:11:22.863Z,TypeScript Definitions (d.ts) for fabricjs. Generated based off the DefinitelyTyped repository [git commit: ca32947b75a2b1203779dac7154ffbc232746e4d]. http://github.com/DefinitelyTyped,fabricjs.TypeScript.DefinitelyTyped,False,2016-09-08T11:01:59.67-07:00,True,False,,"TypeScript,JavaScript",66166,False,1.6.5
Maksim Volkau,2014-12-29T15:44:21.81Z,"DryIoc is small, fast, capable IoC container for .NET",DryIoc,True,2018-03-17T16:01:26.937+00:00,True,False,,"IoC,Container,Inversion-of-Control,DI,Dependency-Injection,DRY,Service-Provider,Factory",128182,False,2.0.0-preview144
Iprel Progetti s.r.l.,2014-12-29T16:15:14.417Z,"The control library IToolS® (Industrial Component Tool Suite) is the answer to the interaction difficulties experienced by devices wishing to communicate via a common protocol.

IToolS® is a software library containing its own communication drivers for the most popular devices used in the field of industrial automation.

In addition to offering a number of controls for client/server communication management, it also contains several controls to use for one's communication client interface customisation.

The framework IToolS®, has been entirely developed with the Microsoft .NET Framework technology; it is based on object-oriented programming characteristics and uses the powerful constructions made available by Microsoft .NET, while assuring compatibility with Windows CE.

All IToolS® components rely on COM technology support: it is therefore possible to use IToolS® components in a variety of programming languages, from top level languages (.NET, C++, VB6, etc.) to scripting ones (JavaScript, VBScript, etc.)

For information contact info@iprel.it",IToolS.SignalR,False,2017-01-23T03:25:49.437-08:00,True,False,"contains implementations of the protocols signalr:

HubProxy;
HubServer;","driver,-,stack,protocol,signalr",1292,False,3.3.0.15
floydpink,2014-12-29T00:50:12.79Z,A WPF control that wraps the Image control with some filesystem caching,CachedImage,False,2016-03-10T04:47:48.477+00:00,True,False,,"WPF,Cache,Image,Control",4339,False,0.1.6
Hibernating Rhinos,2014-12-29T14:34:51.717Z,"Note: this package is deprecated. You should use RavenDB.Database package instead.

		This package let you include RavenDB embedded in-process with your application. RavenDB is a document database for the .NET platform, offering a flexible data model design to fit the needs of real world systems.",RavenDB.Embedded,True,1900-01-01T00:00:00+00:00,False,False,This package let you include RavenDB embedded in-process with your application.,"nosql,ravendb,raven,document,database,embedded",545197,True,3.0.3556-Unstable
Maksim Volkau,2014-12-29T15:45:28.247Z,"Implementation of CommonServiceLocator for DryIoc container, see rationale at https://commonservicelocator.codeplex.com/",DryIoc.CommonServiceLocator.dll,True,2016-10-20T05:59:26.74-07:00,True,False,,"Service-Locator,CommonServiceLocator,IoC,Container,Inversion-of-Control,DI,Dependency-Injection,DRY,Service-Provider,Factory",48095,False,2.0.0-preview144
Iprel Progetti s.r.l.,2014-12-29T22:02:21.833Z,"The control library IToolS® (Industrial Component Tool Suite) is the answer to the interaction difficulties experienced by devices wishing to communicate via a common protocol.

IToolS® is a software library containing its own communication drivers for the most popular devices used in the field of industrial automation.

In addition to offering a number of controls for client/server communication management, it also contains several controls to use for one's communication client interface customisation.

The framework IToolS®, has been entirely developed with the Microsoft .NET Framework technology; it is based on object-oriented programming characteristics and uses the powerful constructions made available by Microsoft .NET, while assuring compatibility with Windows CE.

All IToolS® components rely on COM technology support: it is therefore possible to use IToolS® components in a variety of programming languages, from top level languages (.NET, C++, VB6, etc.) to scripting ones (JavaScript, VBScript, etc.)

For information contact info@iprel.it",IToolS.SignalR,False,2017-01-23T03:25:49.437-08:00,True,False,"contains implementations of the protocols panasonic:

HubProxy;
HubServer;","driver,-,stack,protocol,signalr",1292,False,3.3.0.16
"Oystein Bjorke,Vsevolod Kukol",2014-12-29T10:48:23.937Z,OxyPlot is an open source plotting library for .NET. This package contains the widget for Xwt based applications.,OxyPlot.Xwt,True,1899-12-31T16:00:00-08:00,False,False,,"xwt,gtk,gtk#,wpf,mac,plotting,plot,charting,chart",31155,False,2014.1.638-alpha
"Microsoft Open Technologies,Rowan Miller,Scott Xu,Justin Yoo",2014-12-29T09:38:28.827Z,Testing helpers for using NSubstitute with EntityFramework.,EntityFrameworkTesting.NSubstitute,False,2017-09-04T13:43:31.073+00:00,True,False,,"EntityFramework,Entity,Framework,EF,EF6,Testing,NSubstitute",38406,False,1.0.7
danielwertheim,2014-12-29T18:57:40.233Z,"MyCouch is the simple asynchronous CouchDB and Cloudant client for .Net - building on top of the asynchronous HTTP client and uses JSON.Net to provide flexible serialization behaviour.

      This package contains support for Cloudant specific features. If you want pure CouchDB support go with the ""MyCouch"" package instead.

      It tries to keep the domain language of CouchDb and lets you work with requests and responses but also provides you with an alternative simplifying async API.
      MyCouch lets you work with raw JSON and/or entities/POCOS without requiring any implementation of interfaces or base-classes etc. MyCouch provides you with some model conventions like
      injection of $doctype to the document. It is pluggable. If you don't like some piece, then hook in your implementation instead.

      Supports .Net4.0, .Net4.5 and a PCL for Windows store 8.0 and 8.1 (WinRT) and WP8.1.",MyCouch.Cloudant,False,2015-11-25T12:45:47.4-08:00,True,False,Simple async CouchDB and Cloudant client.,"couchdb,cloudant,lucene,nosql",11013,False,3.0.0
Jason Jarrett,2014-12-29T14:05:34.363Z,TypeScript Definitions (d.ts) for chai-as-promised. Generated based off the DefinitelyTyped repository [git commit: ca32947b75a2b1203779dac7154ffbc232746e4d]. http://github.com/DefinitelyTyped,chai-as-promised.TypeScript.DefinitelyTyped,False,2016-12-13T22:41:41.31-08:00,True,False,,"TypeScript,JavaScript",46330,False,0.6.0
Jason Jarrett,2014-12-29T14:08:49.923Z,TypeScript Definitions (d.ts) for dojo. Generated based off the DefinitelyTyped repository [git commit: ca32947b75a2b1203779dac7154ffbc232746e4d]. http://github.com/DefinitelyTyped,dojo.TypeScript.DefinitelyTyped,False,2016-09-07T09:53:06.72-07:00,True,False,,"TypeScript,JavaScript",52412,False,0.6.6
Maksim Volkau,2014-12-29T15:47:13.68Z,DryIoc.MefAttributedModel is extension to support Microsoft Managed Extensibility Framework for DryIoc container,DryIoc.MefAttributedModel.dll,True,2018-02-05T19:55:25.38+00:00,True,False,,"MEF,Composition,IoC,Container,Inversion-of-Control,DI,Dependency-Injection,DRY,Service-Provider,Factory",54314,False,2.0.0-preview144
Hibernating Rhinos,2014-12-29T14:52:51.73Z,"This package includes the client API of RavenDB. RavenDB is a document database for the .NET platform, offering a flexible data model design to fit the needs of real world systems.",RavenDB.Client,True,2018-03-30T12:13:14.39+00:00,True,False,This package includes the client API of RavenDB.,"nosql,ravendb,raven,document,database,client",1115852,True,3.0.3557-Unstable
Jason Jarrett,2014-12-29T10:03:01.447Z,TypeScript Definitions (d.ts) for asyncblock. Generated based off the DefinitelyTyped repository [git commit: a12472597c94a159811c61d41419d55400e6055a]. http://github.com/DefinitelyTyped,asyncblock.TypeScript.DefinitelyTyped,False,2016-12-13T22:20:52.103-08:00,True,False,,"TypeScript,JavaScript",44850,False,0.2.4
Jason Jarrett,2014-12-29T18:01:06.397Z,TypeScript Definitions (d.ts) for amqp-rpc. Generated based off the DefinitelyTyped repository [git commit: ca32947b75a2b1203779dac7154ffbc232746e4d]. http://github.com/DefinitelyTyped,amqp-rpc.TypeScript.DefinitelyTyped,False,2016-12-13T22:05:47.253-08:00,True,False,,"TypeScript,JavaScript",53414,False,0.7.1
Jon Wagner,2014-12-29T15:47:29.523Z,An Insight.Database provider for the Glimpse profiling framework so the two can play together nicely.,Insight.Database.Providers.Glimpse,False,2018-03-08T19:29:01.503+00:00,True,False,,"Insight,orm,sql,micro-orm,profiler,glimpse",12573,False,5.2.0
Jason Jarrett,2014-12-29T18:11:55.233Z,TypeScript Definitions (d.ts) for fabricjs. Generated based off the DefinitelyTyped repository [git commit: ca32947b75a2b1203779dac7154ffbc232746e4d]. http://github.com/DefinitelyTyped,fabricjs.TypeScript.DefinitelyTyped,False,2016-09-08T11:01:59.67-07:00,True,False,,"TypeScript,JavaScript",66166,False,1.6.6
"Chris Sampson,James Goodenough",2014-12-29T21:28:19.96Z,Event sourcing for Windows SqlServer,SystemDotEventSourcing.Sql.Windows,False,2015-06-02T13:21:15.2-07:00,True,False,Event sourcing for Windows SqlServer,"Event,Sourcing,SqlServer",3265,False,3.0.2
Jason Jarrett,2014-12-29T18:05:54.743Z,TypeScript Definitions (d.ts) for chai-as-promised. Generated based off the DefinitelyTyped repository [git commit: ca32947b75a2b1203779dac7154ffbc232746e4d]. http://github.com/DefinitelyTyped,chai-as-promised.TypeScript.DefinitelyTyped,False,2016-12-13T22:41:41.31-08:00,True,False,,"TypeScript,JavaScript",46330,False,0.6.1
Jason Jarrett,2014-12-29T06:03:16.06Z,TypeScript Definitions (d.ts) for bingmaps. Generated based off the DefinitelyTyped repository [git commit: a12472597c94a159811c61d41419d55400e6055a]. http://github.com/DefinitelyTyped,bingmaps.TypeScript.DefinitelyTyped,False,2016-12-13T22:30:32.167-08:00,True,False,,"TypeScript,JavaScript",41723,False,0.1.9
"Andrew Browne,Picnic Software",2014-12-29T05:19:13.24Z,An EventSourcing library,Eventful,True,2015-10-07T21:56:58.313-07:00,True,False,,,56261,False,0.2.330-beta
"Szymon Pobiega,Sebastien Lambla,Toby Henderson",2014-12-29T14:39:34.64Z,OpenRasta codec for razor templates,openrasta-razor,False,2015-01-15T06:05:44.703-08:00,True,False,,"OpenRasta,Codec,Razor",2082,True,2.5.12
Hibernating Rhinos,2014-12-29T14:30:31.747Z,RavenDB 'Authorization' bundle client extend RavenDB and add document level permissions.,RavenDB.Client.Authorization,True,1900-01-01T00:00:00+00:00,False,False,,"nosql,ravendb,raven,document,database,client,bundles,authorization",166995,True,3.0.3556-Unstable
Matt Perdeck,2014-12-29T14:22:05.347Z,"Physics related type system that models the physical world, including distances, areas, etc. Includes strongly typed operators, so that multiplying two distances results in an aread, etc.",SemanticTypes.TypeSystem.Physics,False,2017-07-07T09:42:06.797-07:00,True,False,,"ddd,value,types,semantic,physics",1519,False,0.8.0
Jason Jarrett,2014-12-29T18:10:59.563Z,TypeScript Definitions (d.ts) for ejs-locals. Generated based off the DefinitelyTyped repository [git commit: ca32947b75a2b1203779dac7154ffbc232746e4d]. http://github.com/DefinitelyTyped,ejs-locals.TypeScript.DefinitelyTyped,False,2016-03-22T11:05:41.9-07:00,True,False,,"TypeScript,JavaScript",33764,False,0.2.6
Oren Novotny,2014-12-29T13:15:44.697Z,"Includes support for running xUnit.net v2 tests on iOS, Android and WP8 devices",xunit.runner.xamarin,True,1899-12-31T16:00:00-08:00,False,False,Xamarin xUnit.net runner components for iOS and Android,"xunit,xamarin,android,ios,monoandroid,monotouch,tdd,unit,test",-1,False,0.99.6-beta5
Jason Jarrett,2014-12-29T02:15:03.147Z,TypeScript Definitions (d.ts) for mockery. Generated based off the DefinitelyTyped repository [git commit: a12472597c94a159811c61d41419d55400e6055a]. http://github.com/DefinitelyTyped,mockery.TypeScript.DefinitelyTyped,False,2016-03-22T12:13:33.327-07:00,True,False,,"TypeScript,JavaScript",10671,False,0.5.7
Iprel Progetti s.r.l.,2014-12-29T12:22:59.46Z,"The control library IToolS® (Industrial Component Tool Suite) is the answer to the interaction difficulties experienced by devices wishing to communicate via a common protocol.

IToolS® is a software library containing its own communication drivers for the most popular devices used in the field of industrial automation.

In addition to offering a number of controls for client/server communication management, it also contains several controls to use for one's communication client interface customisation.

Contains components like alarms manager, variables archives, recipes manager, Variables, Tags, IOServers, Clients and more...

For information contact info@iprel.it",IToolS.Components,False,2017-01-23T03:07:46.1-08:00,True,False,The control library IToolS® (Industrial Component Tool Suite) is the answer to the interaction difficulties experienced by devices wishing to communicate via a common protocol.,,1872,False,3.3.0.15
Oystein Bjorke,2014-12-29T10:44:52.663Z,OxyPlot is an open source plotting library for .NET. This package contains the OpenXML (.docx) export extensions.,OxyPlot.OpenXml,True,1900-01-01T00:00:00+00:00,False,False,,"openxml,plotting,plot,charting,chart",117088,False,2014.1.638-alpha
Microsoft,2014-12-29T13:28:04.58Z,ExamViewModel,ExamViewModel,False,2015-02-10T22:58:32.993-08:00,True,False,,,6639,False,1.1.2.2
Jason Jarrett,2014-12-29T22:04:05.287Z,TypeScript Definitions (d.ts) for bingmaps. Generated based off the DefinitelyTyped repository [git commit: ca32947b75a2b1203779dac7154ffbc232746e4d]. http://github.com/DefinitelyTyped,bingmaps.TypeScript.DefinitelyTyped,False,2016-12-13T22:30:32.167-08:00,True,False,,"TypeScript,JavaScript",41723,False,0.2.3
Jason Jarrett,2014-12-30T02:05:18.203Z,TypeScript Definitions (d.ts) for cordova. Generated based off the DefinitelyTyped repository [git commit: ca32947b75a2b1203779dac7154ffbc232746e4d]. http://github.com/DefinitelyTyped,cordova.TypeScript.DefinitelyTyped,False,2016-12-13T22:54:11.853-08:00,True,False,,"TypeScript,JavaScript",74265,False,0.8.7
Jason Jarrett,2014-12-29T06:11:43.837Z,TypeScript Definitions (d.ts) for jquery.address. Generated based off the DefinitelyTyped repository [git commit: a12472597c94a159811c61d41419d55400e6055a]. http://github.com/DefinitelyTyped,jquery.address.TypeScript.DefinitelyTyped,False,2016-03-22T11:43:20.09-07:00,True,False,,"TypeScript,JavaScript",29577,False,1.1.5
Luke,2014-12-29T05:56:16.597Z,Contains common components shared by Media Browser Theater and Media Browser Server. Not intended for plugin developer consumption.,MediaBrowser.Common.Internal,False,1900-01-01T00:00:00+00:00,False,False,,,127900,False,3.0.537
Jason Jarrett,2014-12-29T18:09:24.187Z,TypeScript Definitions (d.ts) for dojo. Generated based off the DefinitelyTyped repository [git commit: ca32947b75a2b1203779dac7154ffbc232746e4d]. http://github.com/DefinitelyTyped,dojo.TypeScript.DefinitelyTyped,False,2016-09-07T09:53:06.72-07:00,True,False,,"TypeScript,JavaScript",52412,False,0.6.7
Jason Jarrett,2014-12-29T14:09:49.103Z,TypeScript Definitions (d.ts) for easeljs. Generated based off the DefinitelyTyped repository [git commit: ca32947b75a2b1203779dac7154ffbc232746e4d]. http://github.com/DefinitelyTyped,easeljs.TypeScript.DefinitelyTyped,False,2016-10-06T11:01:42.93-07:00,True,False,,"TypeScript,JavaScript",46924,False,0.5.1
Jason Jarrett,2014-12-29T02:10:43.123Z,TypeScript Definitions (d.ts) for jjv. Generated based off the DefinitelyTyped repository [git commit: a12472597c94a159811c61d41419d55400e6055a]. http://github.com/DefinitelyTyped,jjv.TypeScript.DefinitelyTyped,False,2016-03-22T11:40:52.117-07:00,True,False,,"TypeScript,JavaScript",22711,False,0.6.6
Matthieu Maitre,2014-12-29T07:59:19.7Z,Reads audio and video samples from cameras and microphones using MediaCapture. Renders video samples to XAML SwapChainPanel and SurfaceImageSource.,MMaitre.MediaCaptureReader,False,2015-05-23T13:06:30.383-07:00,True,False,Reads audio and video samples from cameras and microphones using MediaCapture.,"Native,WinRT,XAML,MediaCapture,SwapChainPanel,SurfaceImageSource",3248,False,1.0.2
"Aaron Jensen,Alexander Groß,Daniel Marbach,et al.",2014-12-29T20:20:30.303Z,Machine.Specifications.Runner.Resharper provides a Resharper runner for the Context/Specification framework Machine.Specifications,Machine.Specifications.Runner.Resharper9,False,2016-04-19T01:53:38.8-07:00,True,False,Machine.Specifications Runner Resharper,"test,unit,testing,context,specification,bdd,tdd,mspec,runner,resharper",9563,False,1.0.0
