authors,created,days_abandoned,days_alive,description,id,is_prerelease,last_updated,listed,missing_info,summary,tags,total_downloads,verified,versionDotNetWise,2013-07-12T21:18:41.15Z,1743,1743,"Enhanced VS2012 Javascript intellisense for variables, properties, methods even prototype's methods!",VS2012-Javascript-Intellisense,False,2013-07-12T14:47:27.837-07:00,True,False,"Enhanced VS2012 Javascript intellisense for variables, properties, methods even prototype's methods!","Javascript,VS2012,intellisense,enum,namespace,class,prototype,method,object,autocomplete,dotnetwise,dnw",12538,False,1.0.712.2118
Frozen Mountain Software,2013-07-12T22:10:51.777Z,48,1743,A library for .NET that provides logging via the log4net library. (Community Edition),FM.Log4Net,False,2018-03-03T21:25:25.003+00:00,True,False,,"FM,Log4Net,Logging,Frozen,Mountain,log4net,.NET",16591,False,2.3.2
Jorge Martinez,2013-07-11T20:06:05.85Z,1736,1744,Adds spring configuration to object constructors.,Spring.Fody,False,2013-07-19T18:19:29.21+00:00,True,False,,"Spring,ILWeaving,Fody,Cecil",1958,False,1.0.5
NServiceBus Ltd,2013-07-11T21:01:05.533Z,63,1744,"The hosting template for the nservicebus, The most popular open-source service bus for .net",NServiceBus.Host32,True,2018-02-16T08:27:15.097+00:00,True,False,,"nservicebus,servicebus,msmq,cqrs,publish,subscribe",113399,False,4.0.0-unstable3257
eXpand,2013-07-11T22:44:46.38Z,1715,1744,ModelArtifact Module (Web) / eXpand Framework,eXpandModelArtifactWeb,False,2013-08-09T07:42:06.993-07:00,True,False,ModelArtifact Module (Web) / eXpand Framework,"DevExpress,eXpand",31974,False,13.1.5.6
Frozen Mountain Software,2013-07-12T22:11:10.08Z,84,1743,A client-side library for JavaScript that extends WebSync to provide location/user-based chat services.,FM.WebSync.Chat.JS,False,2018-01-26T02:27:25.57+00:00,True,False,,"WebSync,Client,Chat,Extension,HTTP,Streaming,Comet,Reverse,Ajax,JavaScript",16926,False,4.3.2
"Haymo Kutschbach,ILNumerics",2013-07-12T07:46:16.823Z,1743,1743,"[Deprecated - use package 'ILNumerics' (AnyCPU) instead!] ILNumerics provides Matlab-like syntax, high performance execution and modern 2D/3D visualizations for programmers and scientists (C#).",ILNumerics.32Bit,False,2013-07-12T00:46:16.823-07:00,True,False,,"C#,HPC,Performance,Matlab,Matrix,3D,Complex,FFT,LAPACK,Scene,Graph,Math,Algorithm,Numeric,PSModule",3871,False,3.1.0.1
Daniel Mueller,2013-07-12T17:13:24.753Z,54,1743,"Contains classes to access the Personal Computer/Smart Card Resource Manager using
      the system's native PC/SC API. Implements partial ISO7816 support (APDU etc.).
      The library is written to run on both, Windows and Unix (Linux with Mono using PCSC Lite).",PCSC,False,2018-02-25T21:08:58.84+00:00,True,False,PC/SC wrapper classes for .NET to operate on smart cards,"PC/SC,smartcard,apdu,pcsc-sharp",27980,False,3.1.0
Paul Jenkins; Jake Ginnivan,2013-07-12T09:00:56.23Z,38,1743,"The goal of MahApps.Metro is to allow devs to quickly and easily cobble togther a ""Metro"" UI for their WPF4+ apps, with minimal effort.",MahApps.Metro,True,2018-03-13T22:31:08.54+00:00,True,False,"The goal of MahApps.Metro is to allow devs to quickly and easily cobble togther a ""Metro"" UI for their WPF4+ apps, with minimal effort.","WPF,UI,Metro",1280769,True,0.11.0.43-ALPHA
"David Fowler,Damian Edwards",2013-07-13T09:18:21.74Z,1742,1742,Ninject dependency resolver for SignalR,Microsoft.AspNet.SignalR.Ninject,False,2013-07-13T02:18:21.74-07:00,True,False,folked from https://github.com/davidfowl/SignalR.Ninject,"SignalR,Ninject,IoC,DI",23648,False,1.0.0
Harry McIntyre,2013-07-13T12:35:23.457Z,425,1742,"Object to html form transformer. FormFactory.RazorEngine can be embedded in WebApi, Nancy and Console apps. See http://formfactory.apphb.com/",FormFactory.RazorEngine,False,2017-02-19T04:31:00.453-08:00,True,False,,"Html,EditorTemplates,Razor,RazorEngine",16120,False,1.2.277
eXpand,2013-07-11T19:52:41.36Z,11,1744,"Creates dynamic persistent assemblies. The XAF user interface allows us to create an assembly without writing a single line of code. Advanced users can even use c# scripting and create new code generation templates.  
Blogs:
http://apobekiaris.blogspot.com/search/label/WorldCreator",eXpandWorldCreatorWin,False,2018-04-09T16:26:37.873+00:00,True,False,Design runtime assemblies,"DevExpress,eXpand",68863,False,13.1.5.5
"Buddy Platform,Inc.",2013-07-12T20:10:52.3Z,852,1743,"The Buddy Platform is an incredibly rich platform of APIs designed to support end-to-end scenarios. While many cloud products employ ""feature-based engineering"", Buddy is a ""scenario-engineered"" product. That means we offer APIs designed to solve for complete scenarios, rather than individual features like generic hosted databases or storage.",BuddyPlatformSdk,False,2015-12-19T20:05:16.993-08:00,True,False,Buddy Platform SDK for .NET,,13353,False,1.5.1.1
Autofac Contributors,2013-07-12T12:24:35.07Z,1129,1743,Autofac allows you to register metadata along with dependencies for additional resolution flexibility. This extension enables that metadata to be registered through attributes.,Autofac.Extras.Attributed,False,2015-03-18T04:59:16.58-07:00,True,False,Autofac extension for registering dependency metadata via attributes.,,98585,False,3.1.0
Polaris Community,2013-07-13T02:34:34.003Z,1742,1742,MS Build tasks for not so common needs.,Polaris.Build,False,2013-07-12T19:34:34.003-07:00,True,False,The Polaris Build holds files for inline csharp-based tasks for MSbuild process.,"polaris,csharp,msbuild,build",463,False,1.0.32872.5337
MvvmCross,2013-07-12T09:47:20.233Z,43209,1743,This package contains the 'ThreadUtils' plugin for MvvmCross v3 - Hot Tuna. This and other packages are currently under development...,MvvmCross.HotTuna.Plugin.ThreadUtils,True,1899-12-31T16:00:00-08:00,False,False,,"mvvm,mvvmcross,xamarin,monodroid,monotouch,wpf,windows8,winrt,netcore,wp,wpdev,windowsphone",-1,False,3.0.9-beta8
Joe Taylor,2013-07-12T11:58:31.837Z,14,1743,Provides Base Controllers that interact with Joe.Business to implement Default CRUD Actions.,Joe.Web.Mvc,False,2018-04-06T17:33:55.15+00:00,True,False,Provides Base Controllers(And API controllers) that interact with Joe.Business to implement Default CRUD Actions.,,29011,False,1.0.5.2
eXpand,2013-07-11T22:44:20.373Z,1715,1744,JobSheduler Module (Web) / eXpand Framework,eXpandJobShedulerWeb,False,2013-08-09T07:41:40.283-07:00,True,False,JobSheduler Module (Web) / eXpand Framework,"DevExpress,eXpand",31781,False,13.1.5.6
Damian Hickey,2013-07-12T20:06:57.887Z,43209,1743,An implementation of HttpMessageHandler that invokes requests against an OWIN application. Useful for testing and embedded scenarios. This packages contains source code that is added to your project instead of a dll.,Owin.HttpMessageHandler.Sources,False,1899-12-31T16:00:00-08:00,False,False,,,-1,False,0.1.0.43
Damian Mullins,2013-07-12T11:22:23.18Z,1736,1743,System.Utilities.Core is a collection of helpers and extension methods for quickly solving and aiding with common .NET programming tasks.,Utilities.Core,False,2013-07-19T04:55:26.463-07:00,True,False,,"extension,methods,utilities,helpers",1368,False,1.1.0
"Justin Adler,Phillip Haydon and contributors",2013-07-13T12:04:36.943Z,268,1742,This is a Glimpse plugin which helps developers see what magic happens 'under the hood' for SimpleAuthentication.,Glimpse.SimpleAuthentication,False,2017-07-26T02:27:22.05+00:00,True,False,A Glimpse plugin for SimpleAuthentication.,"glimpse,authentication,twitter,google,facebook,microsoftaccount,oauth,oauth1,oauth2,openid,unicorn,magicalunicorn,magical-unicorn,worlddomination,worldomination",5840,False,0.3.0
SYSTEM,2013-07-12T18:29:27.397Z,39,1743,"Install this project if you want to edit the FormFactory templates, or if you don't want to use the EmbeddedResourceVirutalPathProvider",FormFactory.Templates,False,2018-03-12T09:51:54.47+00:00,True,False,,,54045,False,1.2.276
Framework One,2013-07-13T11:39:07.813Z,10,1742,The core modules required to build CloudCore-based system.,CloudCore.Core,False,2018-04-10T10:17:12.883+00:00,True,False,,,75371,False,1.1.79
EVO PDF Software,2013-07-13T09:48:42.297Z,43209,1742,"EVO HTML to PDF Converter is a .NET library that can be easily integrated in any type of .NET applications to convert web pages, HTML strings and streams to PDF or to image. The converter has support for HTML5, CSS3, SVG, Canvas, Web Fonts and JavaScript. Does not require installation or any third party tools.",evohtmltopdf,False,1899-12-31T16:00:00-08:00,False,False,Convert HTML to PDF in your .NET application using the EVO HTML to PDF Converter.,"HTML,to,PDF,Converter,for,.NET,Library",-1,False,4.0.0
Contoso,2013-07-11T21:16:22.303Z,1744,1744,This package contains EventStore implementations of the Event-Sourcing storage for the abstract AggregateRoot.,BclEx-Abstract.EventStore,False,2013-07-11T14:16:22.303-07:00,True,False,,"mongodb,nosql,aggregateroot,event,eventsourcing,bclex",599,False,1.0.0
Sayed Ibrahim Hashimi,2013-07-12T21:05:36.173Z,1520,1743,This will extend web packages so that you can publish a package to different environments. Your packages will contain all of your web.config transforms.,PackageWeb,True,2014-02-20T09:23:49.497-08:00,True,False,,"PackageWeb,Package,Web,Package-Web,Deploy,ASP.NET,MSDeploy",15034,False,1.1.11-beta3
MvvmCross,2013-07-12T09:46:36.267Z,43209,1743,This package contains the 'Email' plugin for MvvmCross v3 - Hot Tuna. This and other packages are currently under development...,MvvmCross.HotTuna.Plugin.Email,True,1899-12-31T16:00:00-08:00,False,False,,"mvvm,mvvmcross,xamarin,monodroid,monotouch,wpf,windows8,winrt,netcore,wp,wpdev,windowsphone",-1,False,3.0.9-beta8
eXpand,2013-07-11T22:45:47.03Z,695,1744,Thumbnail Module (Web) / eXpand Framework,eXpandThumbnailWeb,False,2016-05-25T07:49:22.287-07:00,True,False,Thumbnail Module (Web) / eXpand Framework,"DevExpress,eXpand",59041,False,13.1.5.6
eXpand,2013-07-11T22:45:19.657Z,11,1744,PivotChart Module (Web) / eXpand Framework,eXpandPivotChartWeb,False,2018-04-09T16:18:47.917+00:00,True,False,PivotChart Module (Web) / eXpand Framework,"DevExpress,eXpand",69674,False,13.1.5.6
Mark Seemann,2013-07-11T21:06:54.06Z,4,1744,"This extension turns AutoFixture into an Auto-Mocking Container. The mock instances are created by Rhino Mocks. To use it, add the AutoRhinoMockCustomization to your Fixture instance. Read more at http://blog.ploeh.dk/2010/11/13/RhinoMocksbasedAutomockingWithAutoFixture.aspx",AutoFixture.AutoRhinoMocks,False,2018-04-16T15:24:52.387+00:00,True,False,Turns AutoFixture into an Auto-Mocking Container based on Rhino Mocks.,,143556,True,3.6.1
Contoso,2013-07-11T21:39:21.223Z,1744,1744,This package contains System.Web extentions.,BclEx-Web,False,2013-07-11T14:39:21.223-07:00,True,False,,"web,bclex",749,False,1.0.0
MvvmCross,2013-07-12T06:59:41.137Z,43209,1743,This package contains the 'MvvmCross Library' assemblies for MvvmCross v3 - Hot Tuna. This and other packages are currently under development...,MvvmCross.HotTuna.MvvmCrossLibraries,True,1899-12-31T16:00:00-08:00,False,False,,,-1,False,3.0.9-beta7
MvvmCross,2013-07-12T09:46:49.527Z,43209,1743,This package contains the 'JsonLocalisation' plugin for MvvmCross v3 - Hot Tuna. This and other packages are currently under development...,MvvmCross.HotTuna.Plugin.JsonLocalisation,True,1899-12-31T16:00:00-08:00,False,False,,"mvvm,mvvmcross,xamarin,monodroid,monotouch,wpf,windows8,winrt,netcore,wp,wpdev,windowsphone",-1,False,3.0.9-beta8
M. Sugakov,2013-07-11T23:34:48.823Z,1738,1744,"This library allows to define IEqualityComparer on arbitrary types to compare objects based on their members. Members are explicitly configured with strongly-typed fluent API. Members and are not limited to properties, fields and even methods can be used. The library allows to implement overrides of Equals and GetHashCode by using provided MemberEqualityComparer type thusminimizing boilerplate.",YetAnotherEqualityComparer,True,2013-07-17T09:40:16.107-07:00,True,False,C# configurable member based EqualityComparer,"Equals,GetHashCode,IEqualityComparer",1509,False,1.0.0-alpha2
Jason Jarrett,2013-07-12T05:00:52.98Z,567,1743,TypeScript Definitions (d.ts) for jquery. Generated based off the DefinitelyTyped repository [git commit: 17f058521f4d91652ebc69c9cd456038916fcc77]. http://github.com/DefinitelyTyped,jquery.TypeScript.DefinitelyTyped,False,2016-09-30T07:06:18.647-07:00,True,False,,"TypeScript,JavaScript",2054559,False,0.2.0
Joe Taylor,2013-07-12T15:09:23.3Z,1743,1743,My package description.,jquery.dataquickajax,False,2013-07-12T08:09:23.3-07:00,True,False,jQuery plugin for easily and unobtrusively loading ajax content.,,703,False,1.0.0.1
NServiceBus Ltd,2013-07-12T07:47:12.573Z,63,1743,"The testing for the nservicebus, The most popular open-source service bus for .net",NServiceBus.Testing,True,2018-02-16T08:24:31.56+00:00,True,False,,"nservicebus,servicebus,msmq,cqrs,publish,subscribe",326207,False,4.1.0-unstable3260
NServiceBus Ltd,2013-07-12T21:01:52.773Z,43209,1743,The Azure Host for the timeout manager on NServicebus,NServiceBus.Timeout.Hosting.Azure,True,1899-12-31T16:00:00-08:00,False,False,,"nservicebus,servicebus,msmq,cqrs,publish,subscribe",-1,False,4.1.0-unstable3262
Joe Taylor,2013-07-12T14:39:41.547Z,1743,1743,My package description.,jquery.dataquickajax,False,2013-07-12T08:09:23.3-07:00,True,False,jQuery plugin for easily and unobtrusively loading ajax content.,,703,False,1.0.0
Harry McIntyre,2013-07-12T18:29:22.74Z,425,1743,"Object to html form transformer. FormFactory.RazorEngine can be embedded in WebApi, Nancy and Console apps. See http://formfactory.apphb.com/",FormFactory.RazorEngine,False,2017-02-19T04:31:00.453-08:00,True,False,,"Html,EditorTemplates,Razor,RazorEngine",16120,False,1.2.276
Frozen Mountain Software,2013-07-12T22:11:08.317Z,48,1743,A client-side library for .NET that extends WebSync to provide location/user-based chat services. (Community Edition),FM.WebSync.Chat,False,2018-03-03T21:26:57.627+00:00,True,False,,"WebSync,Client,Chat,Extension,HTTP,Push,Comet,Reverse,Ajax,.NET",14887,False,4.3.2
NServiceBus Ltd,2013-07-12T07:47:17.17Z,43209,1743,The Azure Host for the timeout manager on NServicebus,NServiceBus.Timeout.Hosting.Azure,True,1899-12-31T16:00:00-08:00,False,False,,"nservicebus,servicebus,msmq,cqrs,publish,subscribe",-1,False,4.1.0-unstable3260
NServiceBus Ltd,2013-07-12T21:00:27.78Z,14,1743,The most popular open-source service bus for .net,NServiceBus,True,2018-04-06T19:48:02.973+00:00,True,False,,"nservicebus,servicebus,msmq,cqrs,publish,subscribe",1169248,False,4.1.0-unstable3262
MvvmCross,2013-07-12T06:59:47.94Z,6,1743,This package contains the 'Getting Started' assemblies for MvvmCross v3 - Hot Tuna. This and other packages are currently under development...,MvvmCross,True,2018-04-14T05:43:07.05+00:00,True,False,,,519640,True,3.0.9-beta7
Contoso,2013-07-11T21:17:20.623Z,1744,1744,This package contains a Unity implementation of the abstract ServiceLocator.,BclEx-Abstract.Unity,False,2013-07-11T14:17:20.623-07:00,True,False,,"unity,servicelocator,ioc,di,bclex",588,False,1.0.0
"Daniel Schroeder,iQmetrix",2013-07-12T23:29:19.03Z,225,1743,"Automatically creates a NuGet package from your project each time it builds. The NuGet package is placed in the project's output directory.
	If you want to use a .nuspec file, place it in the same directory as the project's project file (e.g. .csproj, .vbproj, .fsproj).
	This adds a PostBuildScripts folder to your project to house the PowerShell script that is called from the project's Post-Build event to create the NuGet package.
	If it does not seem to be working, check the Output window for any errors that may have occurred.",CreateNewNuGetPackageFromProjectAfterEachBuild,False,2017-09-07T20:02:19.643+00:00,True,False,Automatically creates a NuGet package from your project each time it builds.,"Auto,Automatic,Automatically,Build,Pack,Create,New,NuGet,Package,From,Project,After,Each,On,PowerShell,Power,Shell,.nupkg",128916,False,1.3.0
GeertvanHorrik,2013-07-13T11:59:23.083Z,507,1742,Catel.Extensions.Interception library which provides interception capabilities.,Catel.Extensions.Interception,True,2016-11-29T13:36:15.02+00:00,True,False,,"catel,interception",80898,True,3.6.1307131351-beta
"Justin Adler,Phillip Haydon",2013-07-13T12:04:24.167Z,268,1742,"Used with SimpleAuthentication, provides automated configuration for ASP.NET NancFX projects.",Nancy.SimpleAuthentication,False,2017-07-26T02:27:32.533+00:00,True,False,"A really simple way to Authenticate against Facebook, Twitter or Google - but integrated for the NancyFX framework.","authentication,twitter,google,facebook,oauth,oauth1,oauth2,openid,unicorn,magicalunicorn,magical-unicorn,worlddomination,worldomination,nancy,nancyfx",19945,False,0.3.0
GeertvanHorrik,2013-07-11T21:59:10.697Z,507,1744,Catel.Mvc library which includes the MVC related features.,Catel.Mvc,True,2016-11-29T13:35:47.207+00:00,True,False,,"mvc,catel",90953,True,3.6.1307112354-beta
Paul Jenkins; Jake Ginnivan,2013-07-12T09:01:59.227Z,38,1743,"The goal of MahApps.Metro is to allow devs to quickly and easily cobble togther a ""Metro"" UI for their WPF4+ apps, with minimal effort.",MahApps.Metro,True,2018-03-13T22:31:08.54+00:00,True,False,"The goal of MahApps.Metro is to allow devs to quickly and easily cobble togther a ""Metro"" UI for their WPF4+ apps, with minimal effort.","WPF,UI,Metro",1280769,True,0.11.0.44-ALPHA
span24,2013-07-12T09:14:03.477Z,1743,1743,CTP.Website.Extend,CTP.Website.Extend,False,2013-07-12T02:14:03.523-07:00,True,False,,,2638,False,10.0.0
John Batte,2013-07-12T20:04:20.857Z,1535,1743,The Autofac Implementation of Patterns.Testing,Patterns.Testing.Autofac,False,2014-02-04T21:08:57.867-08:00,True,False,,,4426,False,3.7.2
"Justin Adler,Phillip Haydon and contributors",2013-07-13T12:04:05.987Z,268,1742,"Used with SimpleAuthentication, this adds additional provider support:

1. GitHub
2. Amazon
3. 37 Signals
4. LinkedIn
5. OpenId.",SimpleAuthentication.ExtraProviders,False,2017-07-26T02:27:52.33+00:00,True,False,"A really simple way to Authenticate against a number of popular providers like GitHub, Amazon, 37 Signals, etc...","authentication,github,amazon,37signals,thirtysevensignals,basecamp,highrise,linkedin,openid,oauth,oauth1,oauth2,unicorn,magicalunicorn,magical-unicorn,worlddomination,worldomination",9698,False,0.3.0
DevDigital,2013-07-12T14:50:11.89Z,1731,1743,Provides common data access for .NET applications.,Qi.Data.EntityFramework,False,2013-07-24T01:35:06.683-07:00,True,False,,,3277,False,1.0.8
NServiceBus Ltd,2013-07-12T07:46:06.913Z,417,1743,Azure support for NServicebus,NServiceBus.Azure,True,2017-02-27T15:06:56.187-08:00,True,False,,"nservicebus,servicebus,msmq,cqrs,publish,subscribe",154035,False,4.1.0-unstable3260
NServiceBus Ltd,2013-07-11T21:00:42.387Z,63,1744,The Autofac Container for the nservicebus,NServiceBus.Autofac,True,2018-02-16T08:25:42.907+00:00,True,False,,"nservicebus,servicebus,msmq,cqrs,publish,subscribe",279857,False,4.0.0-unstable3257
"Daniel Schroeder,iQmetrix",2013-07-12T22:22:41.103Z,225,1743,"Automatically creates a NuGet package from your project each time it builds. The NuGet package is placed in the project's output directory.
	If you want to use a .nuspec file, place it in the same directory as the project's project file (e.g. .csproj, .vbproj, .fsproj).
	This adds a PostBuildScripts folder to your project to house the PowerShell script that is called from the project's Post-Build event to create the NuGet package.
	If it does not seem to be working, check the Output window for any errors that may have occurred.",CreateNewNuGetPackageFromProjectAfterEachBuild,False,2017-09-07T20:02:19.643+00:00,True,False,Automatically creates a NuGet package from your project each time it builds.,"Auto,Automatic,Automatically,Build,Pack,Create,New,NuGet,Package,From,Project,After,Each,On,PowerShell,Power,Shell,.nupkg",128916,False,1.2.0
Chris Jaehnen (CJ),2013-07-11T19:57:18.327Z,795,1744,OpenLib.Extensions is a C# library that provides extension methods for various object classes found in .NET,OpenLib.Extensions,False,2016-02-15T10:32:39.683-08:00,True,False,,,2357,False,1.2.0
kazuk,2013-07-12T04:18:30.277Z,1151,1743,publish nuget package to package source,OnBuild.PublishNugetPackage,False,2015-02-24T05:19:14.71-08:00,True,False,,,977,False,1.0.0
Dan Esparza,2013-07-11T21:00:43.873Z,86,1744,.NET MailChimp API wrapper,MailChimp.NET,False,2018-01-24T12:58:36.36+00:00,True,False,,"mailchimp,email",254600,False,1.0.0.2
Contoso,2013-07-11T21:17:34.28Z,1744,1744,This package contains implementations of abstract Services for use with ASP.NET MVC 4.,BclEx-Abstract.Web.Mvc4,False,2013-07-11T14:17:34.28-07:00,True,False,,"mvc,mvc4,servicelocator,web,bclex",593,False,1.0.0
GeertvanHorrik,2013-07-12T17:18:35.973Z,43209,1743,The main shell reference for Orchestra based applications.,Orchestra.Shell,True,1899-12-31T16:00:00-08:00,False,False,,"mvvm,orchestra,shell,prism,framework,wpf",-1,False,0.40.1307121913-beta
NServiceBus Ltd,2013-07-12T07:46:57.953Z,63,1743,The Spring Container for the nservicebus,NServiceBus.Spring,True,2018-02-16T08:26:14.66+00:00,True,False,,"nservicebus,servicebus,msmq,cqrs,publish,subscribe",125014,False,4.1.0-unstable3260
Frozen Mountain Software,2013-07-12T22:10:50.06Z,84,1743,A client-side library for JavaScript that provides core utilities for other libraries.,FM.JS,False,2018-01-26T02:26:51.37+00:00,True,False,,"FM,Core,Frozen,Mountain,JavaScript",18109,False,2.3.2
eXpand,2013-07-11T22:44:33.203Z,11,1744,MasterDetail Module (Win) / eXpand Framework,eXpandMasterDetailWin,False,2018-04-09T16:16:30.427+00:00,True,False,MasterDetail Module (Win) / eXpand Framework,"DevExpress,eXpand",70133,False,13.1.5.6
NServiceBus Ltd,2013-07-12T07:46:40.86Z,63,1743,The NHibernate for the NServicebus,NServiceBus.NHibernate,True,2018-02-16T08:32:13.247+00:00,True,False,,"nservicebus,servicebus,msmq,cqrs,publish,subscribe",329597,False,4.1.0-unstable3260
Paul Jenkins; Jake Ginnivan,2013-07-12T09:06:51.557Z,38,1743,"The goal of MahApps.Metro is to allow devs to quickly and easily cobble togther a ""Metro"" UI for their WPF4+ apps, with minimal effort.",MahApps.Metro,True,2018-03-13T22:31:08.54+00:00,True,False,"The goal of MahApps.Metro is to allow devs to quickly and easily cobble togther a ""Metro"" UI for their WPF4+ apps, with minimal effort.","WPF,UI,Metro",1280769,True,0.11.0.51-ALPHA
Paolo Possanzini,2013-07-12T08:30:21.55Z,1544,1743,Joshua 3.0 ContactForm plugin,Joshua.plugins.ContactForm,False,2014-01-27T01:24:06.897-08:00,True,False,,,1767,False,1.0.17
MvvmCross,2013-07-12T09:47:43.363Z,43209,1743,This package contains the 'AutoViews' PCL assemblies for MvvmCross v3 - Hot Tuna. This and other packages are currently under development...,MvvmCross.HotTuna.AutoViews,True,1899-12-31T16:00:00-08:00,False,False,,,-1,False,3.0.9-beta8
Giacomo Canonico,2013-07-12T13:13:49.907Z,1544,1743,Joshua 3.0 Twitter plugin,Joshua.plugins.twitter,False,2014-01-27T01:38:57.947-08:00,True,False,,,1125,False,1.0.1
Contoso,2013-07-11T21:12:52.537Z,43209,1744,This package contains a Unity implementation of the abstract ServiceLocator.,BclContrib-Abstract.Unity,False,1899-12-31T16:00:00-08:00,False,False,,"unity,servicelocator,ioc,di,bclex",-1,False,1.0.1
GeertvanHorrik,2013-07-13T11:59:12.927Z,507,1742,Catel.Extensions.CSLA library which provides CSLA.NET view models for Catel.,Catel.Extensions.CSLA,True,2016-11-29T13:35:56.627+00:00,True,False,,"catel,csla,clsa.net",105532,True,3.6.1307131351-beta
eXpand,2013-07-11T22:45:56.357Z,11,1744,TreelistView Module (Web) / eXpand Framework,eXpandTreelistViewWeb,False,2018-04-09T16:23:30.6+00:00,True,False,TreelistView Module (Web) / eXpand Framework,"DevExpress,eXpand",68988,False,13.1.5.6
Pavel Zaitsau; Alexander Belenkov,2013-07-12T11:15:43.597Z,1540,1743,My package description.,Zapos.Constructors.Razor,False,2014-01-31T00:10:36.103-08:00,True,False,,"Export,Razor",3611,False,1.13.1.41
Contoso,2013-07-11T21:16:17.047Z,1744,1744,This package contains a Castle Windsor implementation of the abstract ServiceLocator.,BclEx-Abstract.CastleWindsor,False,2013-07-11T14:16:17.047-07:00,True,False,,"castle,windsor,servicelocator,ioc,di,bclex",590,False,1.0.0
Frozen Mountain Software,2013-07-12T22:11:02.967Z,48,1743,A client-side library for .NET that provides real-time HTTP push (comet/reverse Ajax). (Community Edition),FM.WebSync,False,2018-03-03T21:26:24.69+00:00,True,False,,"WebSync,Client,HTTP,Push,Comet,Reverse,Ajax,.NET",19845,False,4.3.2
Joe Taylor,2013-07-12T17:02:55.397Z,427,1743,Mapping Lib similar to automapper that allows for simple and complex mappings via attributes.,Joe.Map,False,2017-02-17T10:57:14.003-08:00,True,False,Object Mapping Lib similar to automapper that allows for simple and complex mappings via attributes.,,15224,False,1.0.3.3
Kenji Wada,2013-07-12T08:54:41.403Z,1597,1743,Manages application files and settings for Windows Phone 7.1 and 8.0/Windows store apps projects.,Softbuild.Data,False,2013-12-04T16:54:56.887-08:00,True,False,,,1924,False,1.0.2
KCF Technologies,2013-07-11T20:44:36.94Z,1451,1744,Description,KCFTech.Console.Models,False,2014-04-30T12:40:08.767-07:00,True,False,,,3337,False,2.0.4940.28334
MvvmCross,2013-07-12T06:59:06.257Z,43209,1743,This package contains the 'Messenger' plugin for MvvmCross v3 - Hot Tuna. This and other packages are currently under development...,MvvmCross.HotTuna.Plugin.Messenger,True,1899-12-31T16:00:00-08:00,False,False,,"mvvm,mvvmcross,xamarin,monodroid,monotouch,wpf,windows8,winrt,netcore,wp,wpdev,windowsphone",-1,False,3.0.9-beta7
