authors,created,description,id,is_prerelease,last_updated,listed,missing_info,summary,tags,total_downloads,verified,versionneuecc,2014-05-12T13:28:30.27Z,LightNode(as Micro REST/RPC Framework) Common Core Interfaces.,LightNode.Core,False,2016-09-27T02:13:17.43-07:00,True,False,,"Owin,Rest,RPC",4803,False,0.3.0
Bastian Eicher,2014-05-12T20:07:26.357Z,"Generic utility classes, interfaces, controls, etc. that are applicable to a wide range of different applications.",NanoByte.Common,False,2018-01-06T10:49:15.193+00:00,True,False,,,8016,False,1.0.4
Signere.no,2014-05-12T08:57:37.663Z,"Client library to communication with Signere.no REST API.
		The library contains relevant model classes and a client class with methods to access all resources provided in the Signere.no API. 
		The client class itself is implemented from an interface to make it easily testable.
		
		All explicit communication with the API is handled internally and translated to POCO objects. 
		The client methods require certain fields from Signere.no user credentials in order to work properly. 
		To create a user account and obtain these credentials, please visit signere.no .  
		
		Also, check out the REST API documentation at Https://api.signere.no for further details about the resources that can be accessed through this library.",Unipluss.Sign.Client,False,1900-01-01T00:00:00+00:00,False,False,,"Signere,Sign,BankID,Digital,signatur,Uni,Pluss,Signere.no",242656,False,1.0.1424
TeamCity.Service,2014-05-12T15:11:24.32Z,Description,Foundation.Infrastructure,False,2014-11-05T06:38:48.987-08:00,True,False,,,7011,False,0.25.0
"Chris Sampson,James Goodenough",2014-05-11T17:54:16.257Z,"Inversion of control container and core libraries for cross platform development on Android, iOS and WinRT",SystemDotCore,False,2015-01-31T04:26:47.847-08:00,True,False,"Inversion of control container and core libraries for cross platform development on Android, iOS and WinRT","Ioc,Cross,Platform",14812,False,1.2.8
Wonka,2014-05-12T08:44:39.227Z,Description,Cortoxa.Data.Identity,False,2014-07-30T10:26:07.793-07:00,True,False,,,3654,False,1.0.8
Ali Kheyrollahi,2014-05-11T22:39:28.307Z,Server library for CacheCow project,CacheCow.Server,False,2017-02-02T08:34:23.05-08:00,True,False,,"aspnetwebapi,http,caching,webapi,cachecow,etag",87504,False,0.5.2
"Admir Tuzovic,Josip Dusper,Mirza Dervisevic,Fedja Omeragic",2014-05-12T12:33:40.437Z,"Vault.Core includes extensions methods and helper classes for:
- AntiXSS
- Cryptography
- CSV
- Exceptions
- Logging
- Primitive types",Vault.Core,False,2015-08-17T07:50:23.417+00:00,True,False,Vault.Core provides extension methods and helper classes for C#.,,31743,False,0.0.139
CapableObjects,2014-05-12T12:36:16.873Z,Descr,EcoWpf,False,2018-04-17T02:37:57.953+00:00,True,False,,"ModelDrivenDevelopment,ECO,CapableObjects",141682,False,7.0.0.7273
Jason Jarrett,2014-05-12T12:58:31.247Z,TypeScript Definitions (d.ts) for angularLocalStorage. Generated based off the DefinitelyTyped repository [git commit: f49ad5a9014309c23621166f59993a181e28ae9e]. http://github.com/DefinitelyTyped,angularLocalStorage.TypeScript.DefinitelyTyped,False,2016-12-13T22:15:25.037-08:00,True,False,,"TypeScript,JavaScript",17423,False,0.0.1
James Ottaway,2014-05-11T23:16:20.213Z,Interpolate your .NET strings,String.Interpolate,False,2014-05-11T16:16:20.213-07:00,True,False,Interpolate your .NET strings,,681,False,0.0.1
Outercurve RIA Services,2014-05-12T21:30:19.337Z,"OpenRiaServices.EntityFramework provides the LinqToEntitiesDomainService<T> class which can be used to create Domain Service classes for use with an ObjectContext using older versions of Entity Framework.

      This package supports versions of EntityFramework less than 6. If you are using ObjectContext with EF 6 use the OpenRiaServices.EntityFramework package instead.",OpenRiaServices.EntityFramework.EF4,True,2018-03-04T21:55:20.277+00:00,True,False,"OpenRiaServices.EntityFramework provides the LinqToEntitiesDomainService<T> class which can be used to create Domain Service classes for use with an ObjectContext using older versions of Entity Framework.

      This package supports versions of EntityFramework less than 6. If you are using ObjectContext with EF 6 use the OpenRiaServices.EntityFramework package instead.","WCF,RIA,Services,RIAServices,EntityFramework,CodeFirst,OpenRIAServices,ObjectContext",4259,True,4.4.0-Beta2
Fix8,2014-05-12T06:26:06.293Z,Develop branch of FIX8 libraries,fix8.dev,False,2016-09-16T14:11:17.47+00:00,True,False,Prebuilt FIX8 library (develoment branch),"FIX8,native,CoApp,nativepackage",7454,False,1.1.20140512.1
Jerome Haltom,2014-05-12T00:29:45.047Z,"NXKit forms the basis of an XML processing engine that can be used to implement other XML based models, such as XForms, or theoritically a full web browser user agent.

            NXKit.Web.UI provides the basic model for rendering a NXKit hosted document in ASP.Net. The View control forms the basis of the implementation which can be extended by including other NXKit.*.Web.UI packages.",NXKit.Web.UI,False,1899-12-31T16:00:00-08:00,False,False,,"xml,xforms",3725,False,0.4.0
Rex Cardan,2014-05-12T19:01:11.567Z,A simple wrapper around the EPPlus library that enables quick access to Excel rows as a list of dynamic values.,Cardan.XCel,True,2016-08-08T12:44:31.47-07:00,True,False,A simple library to provide quick access to Excel data. Includes reading and writing.,Excel,3059,False,1.0.0-beta
Apolineo | Design For Apps,2014-05-11T19:41:40.71Z,Conjunto de classes base portáveis para acelerar o desenvolvimento de aplicativos Windows 8 e Windows Phone 7.5+,Lean.Engine.Framework.Core,False,2014-05-11T12:41:40.71-07:00,True,False,,,2391,False,1.0.35.15
Tom PIT,2014-05-12T14:46:56.177Z,.Net connector for Tom PIT cloud solutions.,TomPITSdk,False,2014-05-13T13:50:00.13-07:00,True,False,,"cloud,project,management,customer,support,document,knowledge,base",748,False,1.0.1
Jakub Pachansky,2014-05-12T16:16:06.21Z,"A simple, easy to use plugin execution engine built on top of Quartz Enterprise Scheduler .NET",R.Scheduler,False,2018-03-29T13:48:33.3+00:00,True,False,,"Scheduler,R,R.Scheduler,Quartz,RScheduler,R.MessageBus,Scheduling",19433,False,0.0.0.4
Paul Jenkins; Jake Ginnivan; Brendan Forster (shiftkey); Alex Mitchell (Amrykid); Dennis Daume (flagbug); Jan Karger (punker76),2014-05-11T17:47:39.793Z,"The goal of MahApps.Metro is to allow devs to quickly and easily cobble togther a ""Metro"" UI for their WPF4+ apps, with minimal effort.",MahApps.Metro,True,2018-03-13T22:31:08.54+00:00,True,False,"The goal of MahApps.Metro is to allow devs to quickly and easily cobble togther a ""Metro"" UI for their WPF4+ apps, with minimal effort.","WPF,UI,Metro",1270766,True,0.14.0-ALPHA42
Maarten Balliauw,2014-05-12T16:08:21.75Z,Simple Oauth2 client.,WindowsAzure.Acs.Oauth2.Client.WinRT,False,2018-03-19T19:47:25.173+00:00,True,False,Simple Oauth2 client.,"oauth,oauth2,acs,windowsazure,azure,access,control,service,wif,api,rest,authorization,authorize",18696,False,1.1.23
Media Browser Team,2014-05-11T23:04:26.103Z,Contains common model objects and interfaces used by all Media Browser solutions.,MediaBrowser.Common,False,2018-04-14T14:59:42.14+00:00,True,False,,,142997,False,3.0.366
Aston Club,2014-05-12T06:06:02.977Z,Enables easy integration for POS and other systems with Aston Club services,AstonClub.PosApi.Client,False,1899-12-31T16:00:00-08:00,False,False,,"AstonClub,POS",-1,False,2.0.2
Jerome Haltom,2014-05-12T00:27:48.027Z,"NXKit forms the basis of an XML processing engine that can be used to implement other XML based models, such as XForms, or theoritically a full web browser user agent.

            Schema support is available in other NXKit packages.",NXKit,False,1899-12-31T16:00:00-08:00,False,False,,"xml,xforms",6915,False,0.4.0
James Liu,2014-05-12T21:06:39.643Z,Pulls in dependencies for C# client library unit and integration tests,ApruveTest,False,2014-05-12T14:06:39.643-07:00,True,False,,,1323,False,1.0.0
Stefan Prodan,2014-05-11T15:33:54.293Z,"WebApiThrottle message handler and action filter are designed for controlling the rate of requests that clients can make to an API based on IP address, client API key and request route. WebApiThrottle works with ASP.NET Web API hosted is IIS, Owin with IIS and Owin self-hosted.",WebApiThrottle,False,2017-07-31T21:41:45.493+00:00,True,False,,"ASP.NET,Web,API,Owin,throttling,rate,limits",241531,False,1.2.0
TeamCity.Service,2014-05-12T15:25:28.14Z,Description,Foundation.Infrastructure,False,2014-11-05T06:38:48.987-08:00,True,False,,,7011,False,0.28.0
Jason Jarrett,2014-05-12T17:01:17.323Z,TypeScript Definitions (d.ts) for handlebars. Generated based off the DefinitelyTyped repository [git commit: 68fd50f64b1384a38a047dbad592478aededae66]. http://github.com/DefinitelyTyped,handlebars.TypeScript.DefinitelyTyped,False,2016-08-10T09:01:44.773-07:00,True,False,,"TypeScript,JavaScript",56342,False,0.1.2
Zach Bray,2014-05-11T22:27:40.583Z,A library for building web servers. Compatible with FunScript. Exports human-readable documentation.,TypeInferred.HashBang,False,2014-10-16T03:11:44.643-07:00,True,False,,"F#,FSharp,JavaScript,TypeProvider,FunScript",10344,False,0.1.52
Dave Timmins,2014-05-12T20:28:00.807Z,"ServiceStack.Text V3 implementation of an ISerializer to use with ArcGIS.PCL.

      To use just call ServiceStackSerializer.Init().",ArcGIS.PCL.ServiceStackV3Serializer,False,2014-11-24T11:06:35.32-08:00,True,False,ServiceStack.Text V3 implementation of an ISerializer to use with ArcGIS.PCL.,"ArcGIS,PCL,Json,Serializer",1527,False,1.0.0
chandmk,2014-05-12T13:31:19.247Z,The OnTime app for Seq (http://getseq.net) formats events as text and creates an OnTime (http://www.axosoft.com/) ticket,Seq.App.OnTime,False,2015-12-04T08:59:13.593-08:00,True,False,,"seq-app,seq,serilog,events",5762,False,1.0.0.6
Joe Enos,2014-05-11T23:05:39.753Z,Basic cryptography functions,NoEdgeSoftware.Cryptography,False,1899-12-31T16:00:00-08:00,False,False,Basic cryptography functions,cryptography,-1,False,0.8.2
Jerome Haltom,2014-05-12T00:31:04.027Z,"NXKit forms the basis of an XML processing engine that can be used to implement other XML based models, such as XForms, or theoritically a full web browser user agent.

            NXKit.XForms.Layout contains the processing model for a basic page/section/category interface model that can be used along side XForms, without requiring XForms to be hosted inside of an HTML document.",NXKit.XForms.Layout,False,1899-12-31T16:00:00-08:00,False,False,,"xml,xforms",5480,False,0.4.0
"James Rosewell,Thomas Holmes",2014-05-12T11:44:53.92Z,"The fastest, most accurate tools. Deployed by millions.
      Request.Browser properties will be populated with data from 51Degrees Lite Device Data. Other features
      include automatic image optimisation, monitoring of network conditions and client side feature detection.",51Degrees.mobi-WebMatrix,True,2017-12-04T16:26:52.76+00:00,True,False,Fast & Accurate Device Detection. Deployed by millions.,"ASPNETWEBPAGES,mobile,phone,detection,device,data,handset,tablet,responsive,design,images,51degrees",37986,False,3.0.4-beta8
CapableObjects,2014-05-12T12:35:57.777Z,Descr,EcoCore,False,2018-04-17T02:37:42.297+00:00,True,False,,"ModelDrivenDevelopment,ECO,CapableObjects",144986,False,7.0.0.7273
Chillisoft,2014-05-13T04:02:40.22Z,Habanero.Testability,Habanero.Testability,True,2017-04-19T21:02:28.027-07:00,True,False,,,157368,False,3.9.203-prerelease
Aranea IT,2014-05-11T17:28:47.44Z,Azure Storage provider for the NuGet.Server,Nuget.Server.AzureStorage,False,2014-11-28T15:11:29.827-08:00,True,False,,,3553,False,2.8.1.5
Microsoft,2014-05-12T18:01:51.693Z,"This packages provides APIs for accessing CPU specific Single Instruction Multiple Data (SIMD) operations. SIMD allows parallelizing certain operations at the hardware level. This is especially useful in domains that perform computations over vectors, such as graphics, gaming, mathematics or finance.

The types in this package are implemented in IL which allows them to be used on non-SIMD enabled JIT compilers and hardware. However, in order to actually use SIMD instructions, you'll need to run on a JIT compiler that knows about these types in order to emit SIMD instructions. The current .NET 4.5.1 runtime doesn't. The .NET code generation team has published a CTP of the the new JIT, codenamed ""RyuJIT"". The CTP adds SIMD support when compiling for x64.

For more details around RyuJIT and how it's installed have a look at this post:

http://blogs.msdn.com/b/dotnet/archive/2013/09/30/ryujit-the-next-generation-jit-compiler.aspx

Supported Targets:
- .NET Framework 4.5
- Windows 8
- Portable Class Libraries",Microsoft.Bcl.Simd,True,1899-12-31T16:00:00-08:00,False,False,Provides managed APIs for leveraging Single Instruction Multiple Data (SIMD) CPU instructions.,"BCL,Microsoft,SIMD,Vector",-1,False,1.0.2-beta
chandmk,2014-05-12T13:46:21.467Z,The OnTime app for Seq (http://getseq.net) formats events as text and creates an OnTime (http://www.axosoft.com/) ticket,Seq.App.OnTime,False,2015-12-04T08:59:13.593-08:00,True,False,,"seq-app,seq,serilog,events",5762,False,1.0.0.7
JASMIN,2014-05-12T09:02:59.057Z,Description,KatoAdhocExpress,False,1899-12-31T16:00:00-08:00,False,False,,,-1,False,1.0.0.3
TeamCity.Service,2014-05-12T15:12:09.5Z,Description,Foundation.Persistence,False,2014-11-05T06:39:24.067-08:00,True,False,,,6452,False,0.26.0
Jason Jarrett,2014-05-12T17:02:05.29Z,TypeScript Definitions (d.ts) for siesta. Generated based off the DefinitelyTyped repository [git commit: 68fd50f64b1384a38a047dbad592478aededae66]. http://github.com/DefinitelyTyped,siesta.TypeScript.DefinitelyTyped,False,2016-03-22T12:54:06.833-07:00,True,False,,"TypeScript,JavaScript",4494,False,0.0.6
Lida Weng,2014-05-12T11:51:19.097Z,OElite Web API SDK for OElite Platform based application development,OElite.Web,False,2016-04-16T05:06:28.653-07:00,True,False,,oelite,101884,False,1.1.6
James Craig,2014-05-12T17:31:01.147Z,This makes YUI the minifier for the Iron Man Framework.,Ironman.Core.Assets.Yui,True,2016-08-22T09:51:10.177-07:00,True,False,This makes YUI the minifier for the Iron Man Framework.,less,21242,False,1.0.136-beta
Martin Willey,2014-05-11T17:48:43.963Z,"Any ADO provider can be read  (SqlServer, SqlServer CE 4, MySQL, SQLite, System.Data.OracleClient, ODP, Devart, PostgreSql, DB2...) into a single standard model.",DatabaseSchemaReader,False,2018-04-15T13:56:56.107+00:00,True,False,"A simple, cross-database facade over .Net 2.0 DbProviderFactories to read database metadata.","ADO,Entity,Framework,Code,First,SQL,Server,SQLite,Oracle",33978,False,1.3.3
"Carlos Ribas,Nathan Alden Sr.",2014-05-12T17:19:02.677Z,JuniorMap is a framework for mapping between two types and adapting one type to another.,Junior.Map,False,2014-09-16T11:20:29.08-07:00,True,False,,Junior,1196,False,5.0.0
Ali Kheyrollahi,2014-05-11T22:38:55.773Z,Common library for CacheCow project,CacheCow.Common,False,2018-04-09T11:02:41.703+00:00,True,False,,"aspnetwebapi,http,caching,webapi,cachecow",145360,False,0.5.2
Apolineo | Design For Apps,2014-05-12T22:12:47.37Z,Conjunto de classes para acelerar o desenvolvimento de aplicativos Windows 8,Lean.Engine.Framework.Windows,False,2015-02-28T14:53:11.847-08:00,True,False,,,6893,False,1.1.65.20
Arteny,2014-05-12T11:59:39.233Z,High level wrapper at Betfair API,ExchangeAPI,False,2018-04-03T14:00:11.48+00:00,True,False,,,97708,False,1.46.363
Ali Kheyrollahi,2014-05-12T21:56:39.987Z,BeeHive Actor Model mini-Library,BeeHive-common,False,2017-01-23T02:08:18.237-08:00,True,False,,"actor,model,cloud,azure,amazon,messaging,event-driven,event",16028,False,0.3.5
Jason Jarrett,2014-05-12T17:01:39.293Z,TypeScript Definitions (d.ts) for oclazyload. Generated based off the DefinitelyTyped repository [git commit: 68fd50f64b1384a38a047dbad592478aededae66]. http://github.com/DefinitelyTyped,oclazyload.TypeScript.DefinitelyTyped,False,2016-09-22T13:01:31.9-07:00,True,False,,"TypeScript,JavaScript",5363,False,0.0.1
James Craig,2014-05-12T17:29:46.383Z,"Craig's Utility Library is one of the largest collections of utility classes and extension methods for .Net. It includes code to help with tasks including encryption, compression, serialization, file management, email, image manipulation, SQL, various file formats (CSV, iCal, etc.), randomization, validation, math related classes, various data types, reflection, code gen, events, code profiling, etc.",CUL.ServiceStack,True,2016-08-22T09:50:17.023-07:00,True,False,"This adds support for ServiceStack.Text as the serializer for JSON, XML, and CSV that the library uses","utility,utilities",20946,False,4.0.136-beta
amir.gholzam@live.com,2014-05-13T06:11:34.2Z,amir.gholzam@live.com CEO Hamava Project,Hamava.Caching,False,1899-12-31T16:00:00-08:00,False,False,,Hamava,-1,False,1.0.0
Envoc,2014-05-11T21:36:26.463Z,Envoc.Directives,Envoc.Directives,False,2016-11-11T12:44:22.873-08:00,True,False,,,16846,False,1.0.0.39
Outercurve RIA Services,2014-05-12T21:25:17.48Z,Open RIA Services Toolkit - Silverlight ViewModel (MVVM) features,OpenRiaServices.ViewModel,True,2018-03-25T17:01:25.883+00:00,True,False,Open RIA Services Toolkit - Silverlight ViewModel (MVVM) features,"WCF,RIA,Services,RIAServices,Silverlight,ViewModel,MVVM,OpenRiaServices",7120,True,4.4.0-Beta2
vtortola,2014-05-12T21:10:35.383Z,"The WebSocketListener class provides simple methods that listen for and accept incoming WebSocket connection requests asynchronously. It is a lightweight listener that follows the official RFC 6455 WebSockets specification with an API very similar to the TcpListener class.

It supports secure connections and per message deflate compression.",vtortola.WebSocketListener,False,2017-12-20T22:50:35.137+00:00,True,False,,"websockets,HTML5,realtime,streaming,sockets,server,async,asynchronous",17907,False,2.0.1
TeamCity.Service,2014-05-12T15:25:48.033Z,Description,Foundation.Persistence,False,2014-11-05T06:39:24.067-08:00,True,False,,,6452,False,0.28.0
Tim Jones,2014-05-12T15:02:01.113Z,"Xna module for Gemini, providing two methods of integrating XNA content in WPF.",Gemini.Modules.Xna,False,2015-09-20T06:51:46.017-07:00,True,False,,".net40,WPF,MVVM,AvalonDock,Caliburn,Micro,Visual,Studio,IDE,Shell,XNA",1444,False,0.5.0
James Craig,2014-05-12T17:25:13.547Z,"Craig's Utility Library is one of the largest collections of utility classes and extension methods for .Net. It includes code to help with tasks including encryption, compression, serialization, file management, email, image manipulation, SQL, various file formats (CSV, iCal, etc.), randomization, validation, math related classes, various data types, reflection, code gen, events, code profiling, etc.",CraigsUtilityLibrary-Configuration,True,2016-08-22T09:46:26.787-07:00,True,False,This is the Configuration namespace from Craig's Utility Library,"utility,utilities",49782,False,4.0.136-beta
Denis Korkhov,2014-05-12T09:07:17.653Z,"Data Patterns for Cortoxa Framework. 
Cortoxa Framework is a Powerful Framework for faster and easier building .Net applications based on Dependency Injection patterns. Contains implementation of common ""Design Patterns"".",Cortoxa.Data,False,2014-07-30T10:25:39.23-07:00,True,False,Data Patterns for Cortoxa Framework,"logger,log,logging,nlog",3413,False,1.0.9
Envoc,2014-05-12T19:07:04.16Z,Envoc.Directives,Envoc.Directives,False,2016-11-11T12:44:22.873-08:00,True,False,,,16846,False,1.0.0.50
Microsoft,2014-05-12T12:05:50.203Z,".NET Client Library for Office 365 Users and Groups API.
    
Learn more about how to use this library @ http://aka.ms/ClientLibraries.",Microsoft.Office365.UsersGroups,True,2014-08-04T10:51:41.817-07:00,True,False,.NET Client Library for Office 365 Users and Groups API,"Microsoft,Office,Office365,Service,REST",3142,False,0.1.0-alpha
Vitalii,2014-05-12T14:32:22.98Z,A solution for saving/loading classes as easy as possible and as fast as possible in async manner on WP7.5+.,IsoStorageManager,False,2014-05-22T06:54:18.55-07:00,True,False,,,1541,False,1.1.0
gregsdennis,2014-05-13T02:02:18.423Z,"A JSON serializer implementation for Manatee.Trello, backed by Newtonsoft's Json.Net.",Manatee.Trello.NewtonsoftJson,False,1899-12-31T16:00:00-08:00,False,False,,"trello,json,manatee",-1,False,1.0.3
Denis Korkhov,2014-05-12T10:19:37.797Z,Microsoft Identity for Cortoxa Framework.,Cortoxa.Data.Identity,False,2014-07-30T10:26:07.793-07:00,True,False,Data Patterns for Cortoxa Framework,"logger,log,logging,nlog",3654,False,1.0.10
Lida Weng,2014-05-12T01:22:40.967Z,Common Library for OElite Platform based application development,OElite.Common,False,1899-12-31T16:00:00-08:00,False,False,,oelite,-1,False,1.1.3
TeamCity.Service,2014-05-12T15:05:15.863Z,Description,Foundation.Web,False,2014-11-05T06:40:00.213-08:00,True,False,,,6888,False,0.24.0
SageAnalytic,2014-05-12T20:00:52.297Z,"Revalee is a Windows Service used to schedule callbacks for web applications. It simplifies a web application's workflow when events are required *after* the normal handling of web requests. This library allows Revalee callback requests to be easily embedded in web application code.

This NuGet package requires installation of the Revalee Windows Service available for download at the Project Site or at the GitHub repository (SageAnalytic/Revalee).",Revalee.Client.Mvc,False,2014-12-19T08:49:01.35-08:00,True,False,Client library for scheduled web callbacks.,"revalee,web,callback,background,scheduled,tasks,scheduling,jobs,workers,aspnet,asp.net,mvc",2169,False,2.2.0
James Craig,2014-05-12T17:30:03.11Z,"Craig's Utility Library is one of the largest collections of utility classes and extension methods for .Net. It includes code to help with tasks including encryption, compression, serialization, file management, email, image manipulation, SQL, various file formats (CSV, iCal, etc.), randomization, validation, math related classes, various data types, reflection, code gen, events, code profiling, etc.",Glimpse.CUL,True,2016-08-22T09:50:37.35-07:00,True,False,This is a basic plugin for Glimpse that adds information from Craig's Utility Library.,"utility,utilities",22218,False,4.0.136-beta
Denis Korkhov,2014-05-12T08:44:30.077Z,"Data Patterns for Cortoxa Framework. 
Cortoxa Framework is a Powerful Framework for faster and easier building .Net applications based on Dependency Injection patterns. Contains implementation of common ""Design Patterns"".",Cortoxa.Data,False,2014-07-30T10:25:39.23-07:00,True,False,Data Patterns for Cortoxa Framework,"logger,log,logging,nlog",3413,False,1.0.8
Fix8,2014-05-12T06:55:10.597Z,Develop branch of FIX8 library tests,fix8.dev.tests,False,2016-09-16T07:11:52.91-07:00,True,False,Prebuilt FIX8 library tests (develoment branch),"FIX8,native,CoApp,nativepackage",7028,False,1.1.20140512.2
Bradley Sickles,2014-05-12T18:57:27.273Z,"Fayde is a cross platform, cross browser XAML engine.",Fayde,False,2014-08-16T08:59:32.667-07:00,True,False,,"fayde,xaml,silverlight",21876,False,0.9.8.34
TeamCity.Service,2014-05-12T15:25:58.627Z,Description,Foundation.Web,False,2014-11-05T06:40:00.213-08:00,True,False,,,6888,False,0.28.0
Aranea IT,2014-05-11T19:43:03.277Z,Azure Storage provider for the NuGet.Server,Nuget.Server.AzureStorage,False,2014-11-28T15:11:29.827-08:00,True,False,,,3553,False,2.8.1.9
Efrat Barak,2014-05-12T01:42:19.817Z,A C# API for working against BeatsMusic public developer API on a portable C# library.,BeatsMusicCSharpAPI,False,2014-08-18T15:00:31.987-07:00,True,False,,,4677,False,1.10.0
MMerayo,2014-05-11T17:24:53.877Z,Implementation of the subasta game,Subasta.Lib,False,2015-11-09T09:38:29.387-08:00,True,False,,,8863,False,0.5000.1000.1028
Danny Varod,2014-05-12T23:41:14.837Z,"An abstraction above ServiceStack.Redis
(moved to PubComp.NoSql.ServiceStackRedis)",PubExp.NoSqlRep.ServiceStackRedis,False,2014-10-28T06:06:21.507-07:00,True,False,"An abstraction above ServiceStack.Redis
(moved to PubComp.NoSql.ServiceStackRedis)","pubexp,nosql,redis,servicestack,servicestack.redis",2290,False,1.5.0
JustGiving,2014-05-12T09:57:46.373Z,Wrapper for simple integration with EventStore.,JustGiving.EventStore.Http.Client,False,2017-08-11T10:11:59.263+00:00,True,False,JustGiving.EventStore.Http.Client,"EventStore,event,store,soa,http",23500,False,1.0.39
Fix8,2014-05-12T06:26:42.763Z,"Redistributable components for package 'fix8.dev'. This package should only be installed as a dependency. 
(This is not the package you are looking for).",fix8.dev.redist,False,1900-01-01T00:00:00+00:00,False,False,Redistributable components for for package 'fix8.dev',"FIX8,native,CoApp,nativepackage",-1,False,1.1.20140512.1
Denis Korkhov,2014-05-12T10:19:52.747Z,"Data Patterns for Cortoxa Framework with NHibernate implementation. 
Cortoxa Framework is a Powerful Framework for faster and easier building .Net applications based on Dependency Injection patterns. 
Contains implementation of common ""Design Patterns"".",Cortoxa.Data.NHibernate,False,2014-07-30T10:31:01.607-07:00,True,False,Data Patterns for Cortoxa Framework,"logger,log,logging,nlog",4398,False,1.0.10
Envoc,2014-05-12T17:51:36.887Z,Envoc.Directives,Envoc.Directives,False,2016-11-11T12:44:22.873-08:00,True,False,,,16846,False,1.0.0.48
Jason Jarrett,2014-05-12T12:58:51.15Z,TypeScript Definitions (d.ts) for chrome. Generated based off the DefinitelyTyped repository [git commit: f49ad5a9014309c23621166f59993a181e28ae9e]. http://github.com/DefinitelyTyped,chrome.TypeScript.DefinitelyTyped,False,2016-12-14T06:45:07.833+00:00,True,False,,"TypeScript,JavaScript",75909,False,0.1.9
