authors,created,days_abandoned,days_alive,description,id,is_prerelease,last_updated,listed,missing_info,summary,tags,total_downloads,verified,versionContoso,2013-07-11T21:13:00.443Z,43209,1744,This package contains implementations of abstract Services for use with ASP.NET MVC 2.,BclContrib-Abstract.Web.Mvc,False,1899-12-31T16:00:00-08:00,False,False,,"mvc,mvc2,servicelocator,web,bclex",-1,False,1.0.1
Daniel Mueller,2013-07-12T17:17:15.47Z,54,1743,"Contains classes to access the Personal Computer/Smart Card Resource Manager using
      the system's native PC/SC API. Implements partial ISO7816 support (APDU etc.).
      The library is written to run on both, Windows and Unix (Linux with Mono using PCSC Lite).",PCSC,False,2018-02-25T21:08:58.84+00:00,True,False,PC/SC wrapper classes for .NET to operate on smart cards,"PC/SC,smartcard,apdu,pcsc-sharp",27980,False,3.1.0.1
Signere.no,2013-07-12T08:35:09.457Z,43209,1743,"Client library POCOs for the REST API  
		
		Also, check out the REST API documentation at Https://api.signere.no for further details about the resources that can be accessed through this library.",Unipluss.Sign.Models,False,1900-01-01T00:00:00+00:00,False,False,,"Signere,Sign,BankID,Digital,signatur,Uni,Pluss,Signere.no",197380,False,1.0.476
SYSTEM,2013-07-13T12:35:28.787Z,39,1742,"Install this project if you want to edit the FormFactory templates, or if you don't want to use the EmbeddedResourceVirutalPathProvider",FormFactory.Templates,False,2018-03-12T09:51:54.47+00:00,True,False,,,54045,False,1.2.277
eXpand,2013-07-11T22:43:19.527Z,11,1744,AdditionalViewControlsProvider Module (Win) / eXpand Framework,eXpandAdditionalViewControlsProviderWin,False,2018-04-09T16:09:37.91+00:00,True,False,AdditionalViewControlsProvider Module (Win) / eXpand Framework,"DevExpress,eXpand",73865,False,13.1.5.6
eXpand,2013-07-11T22:46:38.127Z,1715,1744,WorkFlow Module (Win) / eXpand Framework,eXpandWorkFlowrWin,False,2013-08-09T07:43:55.84-07:00,True,False,WorkFlow Module (Win) / eXpand Framework,"DevExpress,eXpand",31116,False,13.1.5.6
GeertvanHorrik,2013-07-11T21:58:58.853Z,507,1744,"Catel.Extensions.EntityFramework5 library which provides data classes such as repositories, unit of work, DbContextManager and more.",Catel.Extensions.EntityFramework5,True,2016-11-29T13:36:06.393+00:00,True,False,,"catel,entity,framework,entityframework,EF,EF5,UnitOfWork,unit,of,work,DbContextManager,repository,repositories,database",97012,True,3.6.1307112354-beta
MvvmCross,2013-07-12T06:58:39.64Z,43209,1743,This package contains the 'All' plugin for MvvmCross v3 - Hot Tuna. This and other packages are currently under development...,MvvmCross.HotTuna.Plugin.All,True,1899-12-31T16:00:00-08:00,False,False,,"mvvm,mvvmcross,xamarin,monodroid,monotouch,wpf,windows8,winrt,netcore,wp,wpdev,windowsphone",-1,False,3.0.9-beta7
aleatherwood,2013-07-11T23:52:32.75Z,123,1744,"DrivenDb is a better microORM.  Unique features, excellent performance, and cleaner code in as few trips to the database as possible.",DrivenDb,False,2017-12-18T15:31:44.183+00:00,True,False,"Features Include: 
* Self-Tracking entities that maintain their state through WCF serialization.
* Bulk reads / writes to the database reducing round trips.
* Parallel reads for decreasing load time of large result sets.
* Easily use your current Linq classes or the included entity generator.
* Support classes provide easy caching and filtered in-memroy views that are always up-to-date.
* Weak event model reduces memory leaks and eliminates the need for IDisposable implementations.","microorm,db,database,micro,orm,dal,sql,mysql,sqlite,mapping,cache,petapoco,dapper,self-tracking,entity,ddd,repository,nhibernate,napper,microlite,entityframework",25239,False,1.4.5.2
Giacomo Canonico,2013-07-12T13:07:29.17Z,1544,1743,Joshua 3.0 Facebook plugin,Joshua.plugins.facebook,False,2014-01-27T01:26:31.157-08:00,True,False,,,3300,False,1.0.1
Keiho Sakapon,2013-07-13T11:54:15.177Z,1739,1742,NuGet に公開されるライブラリのサンプルです。,Keiho.Tools.NuGetSample1,False,2013-07-15T22:24:44.707-07:00,True,False,,"SampleTag1,SampleTag2",814,False,1.0.0
Contoso,2013-07-11T21:12:55.9Z,43209,1744,This package contains implementations of abstract Services for System.Web.,BclContrib-Abstract.Web,False,1899-12-31T16:00:00-08:00,False,False,,"servicecache,web,bclex",-1,False,1.0.1
eXpand,2013-07-11T22:43:47.31Z,695,1744,FilterDatastore Module (Web) / eXpand Framework,eXpandFilterDatastoreWeb,False,2016-05-25T07:42:26.04-07:00,True,False,FilterDatastore Module (Web) / eXpand Framework,"DevExpress,eXpand",61751,False,13.1.5.6
GeertvanHorrik,2013-07-13T11:59:18.33Z,507,1742,"Catel.Extensions.EntityFramework5 library which provides data classes such as repositories, unit of work, DbContextManager and more.",Catel.Extensions.EntityFramework5,True,2016-11-29T13:36:06.393+00:00,True,False,,"catel,entity,framework,entityframework,EF,EF5,UnitOfWork,unit,of,work,DbContextManager,repository,repositories,database",97012,True,3.6.1307131351-beta
Jorge Martinez,2013-07-12T04:06:53.407Z,1743,1743,Domain Specific Language for C# code generation,CsBuilder,False,2013-07-11T21:06:53.407-07:00,True,False,,,700,False,1.0.0.1
Paul Jenkins; Jake Ginnivan,2013-07-12T08:58:18.92Z,38,1743,"The goal of MahApps.Metro is to allow devs to quickly and easily cobble togther a ""Metro"" UI for their WPF4+ apps, with minimal effort.",MahApps.Metro,True,2018-03-13T22:31:08.54+00:00,True,False,"The goal of MahApps.Metro is to allow devs to quickly and easily cobble togther a ""Metro"" UI for their WPF4+ apps, with minimal effort.","WPF,UI,Metro",1280769,True,0.11.0.40-ALPHA
Michel Perfetti,2013-07-13T11:23:03.963Z,92,1742,WiLinq is a workitem linq provider targeting TFS 2012 API,Wilinq,False,2018-01-18T16:19:05.367+00:00,True,False,,"Linq,WorkItem,TFS",3166,False,0.1.0.1
eXpand,2013-07-11T22:44:59.917Z,11,1744,"Extends XAF by adding great new features for example;

◦the ability to generate runtime members for your objects, 
◦creating Application/Role/User models in the database, 
◦storing your web cookies in the database, 
◦handling of external application models, 
◦combine end user modifications with application model, 
◦support for multiple models at design time,
Blogs:
http://apobekiaris.blogspot.com/search/label/ModelDifference",eXpandModelDifferenceWeb,False,2018-04-09T16:17:21.897+00:00,True,False,Model managment,"DevExpress,eXpand",70189,False,13.1.5.6
GeertvanHorrik,2013-07-13T11:59:10.427Z,507,1742,"Catel.Extensions.Controls library which contains user controls, such as the StackGrid.",Catel.Extensions.Controls,True,2016-11-29T13:35:55.627+00:00,True,False,,"windows,controls,stackgrid,styles,stylehelper",170616,True,3.6.1307131351-beta
MvvmCross,2013-07-12T09:47:45.337Z,43209,1743,This package contains the 'AutoViews' iOS assemblies for MvvmCross v3 - Hot Tuna. This and other packages are currently under development...,MvvmCross.HotTuna.Touch.AutoViews,True,1899-12-31T16:00:00-08:00,False,False,,,-1,False,3.0.9-beta8
GeertvanHorrik,2013-07-13T11:59:25.457Z,507,1742,Catel.Extensions.Memento library which provides the memento pattern implementation as a service.,Catel.Extensions.Memento,True,2016-11-29T13:36:18.13+00:00,True,False,,"catel,memento",85548,True,3.6.1307131351-beta
eXpand,2013-07-11T22:45:33.217Z,1715,1744,SqlDbMapper Module (Web) / eXpand Framework,eXpandSqlDbMapperWeb,False,2013-08-09T07:42:53.813-07:00,True,False,SqlDbMapper Module (Web) / eXpand Framework,"DevExpress,eXpand",31367,False,13.1.5.6
MvvmCross,2013-07-12T06:58:58.593Z,43209,1743,This package contains the 'Json' plugin for MvvmCross v3 - Hot Tuna. This and other packages are currently under development...,MvvmCross.HotTuna.Plugin.Json,True,1899-12-31T16:00:00-08:00,False,False,,"mvvm,mvvmcross,xamarin,monodroid,monotouch,wpf,windows8,winrt,netcore,wp,wpdev,windowsphone",-1,False,3.0.9-beta7
MvvmCross,2013-07-12T09:47:12.4Z,43209,1743,This package contains the 'Share' plugin for MvvmCross v3 - Hot Tuna. This and other packages are currently under development...,MvvmCross.HotTuna.Plugin.Share,True,1899-12-31T16:00:00-08:00,False,False,,"mvvm,mvvmcross,xamarin,monodroid,monotouch,wpf,windows8,winrt,netcore,wp,wpdev,windowsphone",-1,False,3.0.9-beta8
Scott Xu,2013-07-13T12:43:34.737Z,43209,1742,"Safely dispose WCF client when release Ninject kernel 
Abort when in faulted state and try close before the final dispose",Ninject.Extensions.WcfClientDisposableKernel,False,1899-12-31T16:00:00-08:00,False,False,,"wcf,client,clientbase,using,Ninject,dispose,abort,close",-1,False,1.0.0
Will Charczuk,2013-07-12T18:05:35.683Z,1446,1743,A high performance mini-orm enabling expressive queries and data models. Supports MSSQL.,Destrier,False,2014-05-05T14:01:42.717-07:00,True,False,A high performance mini-orm.,"orm,sql,mini-orm,micro-orm,mssql",2138,False,1.0.1
TBAPI-0KA,2013-07-13T03:16:33.423Z,1742,1742,HttpHandler for live SASS processing using libsass,NSass.Handler,False,2013-07-12T20:16:33.423-07:00,True,False,,"SASS,SCSS,CSS,libsass",4501,False,0.0.3
Frozen Mountain Software,2013-07-12T22:10:37.89Z,48,1743,A library for .NET that extends IceLink to create peer-to-peer data streams from Simple clients. (Community Edition),FM.IceLink.Simple,False,2018-03-03T21:24:14.457+00:00,True,False,,"IceLink,Simple,Extension,ICE,STUN,TURN,P2P,UDP,NAT,Firewall,Traversal,.NET",13854,False,2.3.2
MvvmCross,2013-07-12T09:46:59.087Z,43209,1743,This package contains the 'Network' plugin for MvvmCross v3 - Hot Tuna. This and other packages are currently under development...,MvvmCross.HotTuna.Plugin.Network,True,1899-12-31T16:00:00-08:00,False,False,,"mvvm,mvvmcross,xamarin,monodroid,monotouch,wpf,windows8,winrt,netcore,wp,wpdev,windowsphone",-1,False,3.0.9-beta8
S. van Deursen,2013-07-12T15:42:09.927Z,385,1743,"The Lifetime Scoping Extensions package adds an advanced new lifestyle called 'Lifetime Scope', which allows instances to live within an explicitly defined thread-specific scope and get disposed when this scope ends.",SimpleInjector.Extensions.LifetimeScoping,False,2017-03-30T23:15:14.513-07:00,True,False,Lifetime scoping extensions for the Simple Injector Inversion of Control library.,"simpleinjector,architecture,dependency-injection,DI,easy,easy-to-use,Inversion-of-Control,IOC,Servicelocator,lifestyle,lifetime,scope,scoping",209226,False,2.3.1
MvvmCross,2013-07-12T06:59:30.71Z,43209,1743,This package contains the 'Sqlite' plugin for MvvmCross v3 - Hot Tuna. This and other packages are currently under development...,MvvmCross.HotTuna.Plugin.Sqlite,True,1899-12-31T16:00:00-08:00,False,False,,"mvvm,mvvmcross,xamarin,monodroid,monotouch,wpf,windows8,winrt,netcore,wp,wpdev,windowsphone",-1,False,3.0.9-beta7
Stajs,2013-07-12T11:37:42.697Z,1732,1743,Proxy-friendly web caching.,WebCache,True,2013-07-23T04:22:36.863-07:00,True,False,,,1241,False,0.1.0-alpha3
huan,2013-07-13T03:26:53.727Z,1742,1742,Phan Thi Admin,PTAdmin,False,2013-07-12T21:33:11.327-07:00,True,False,,"Phan,thi",1515,False,1.0.4
John Batte,2013-07-12T20:03:15.413Z,1535,1743,"Code Patterns: Core Library -- for 0.x backward compatibility, see Patterns.Legacy.",Patterns,False,2014-02-04T21:08:21.5-08:00,True,False,,,10560,False,3.7.2
Casey Watson,2013-07-12T15:57:52.37Z,1649,1743,This library contains the components necessary for logging events to a Mantle publishing endpoint.,mantle-loggingadapter-messaging,True,2013-10-14T14:07:16.527-07:00,True,False,,"Cloud,Mantle,Logging",1315,False,1.0.0-beta
"Justin Adler,Phillip Haydon and contributors",2013-07-13T12:03:34.427Z,268,1742,SimpleAuthentication is a ASP.NET library that makes it really simple to for developers to add Social Authentication code to an ASP.NET application.,SimpleAuthentication.Core,False,2017-07-26T02:27:42.86+00:00,True,False,"A really simple way to Authenticate against Facebook, Twitter, Google or a Microsoft Account.","authentication,twitter,google,facebook,microsoftaccount,oauth,oauth1,oauth2,openid,unicorn,magicalunicorn,magical-unicorn,worlddomination,worldomination",34332,False,0.3.0
Casey Watson,2013-07-12T16:04:05.31Z,1649,1743,This library contains the components necessary for logging events to a Mantle publishing endpoint.,mantle-loggingadapter-messaging,True,2013-10-14T14:07:16.527-07:00,True,False,,"Cloud,Mantle,Logging",1315,False,1.0.1-beta
MvvmCross,2013-07-12T09:47:09.703Z,43209,1743,This package contains the 'ResourceLoader' plugin for MvvmCross v3 - Hot Tuna. This and other packages are currently under development...,MvvmCross.HotTuna.Plugin.ResourceLoader,True,1899-12-31T16:00:00-08:00,False,False,,"mvvm,mvvmcross,xamarin,monodroid,monotouch,wpf,windows8,winrt,netcore,wp,wpdev,windowsphone",-1,False,3.0.9-beta8
KCF Technologies,2013-07-11T20:49:02.753Z,1451,1744,Description,KCFTech.Console.Models,False,2014-04-30T12:40:08.767-07:00,True,False,,,3337,False,2.0.4940.28447
Yin-Chun Wang,2013-07-13T01:03:39.03Z,779,1742,A .net lib with common win32 values/types/routines for interop/pinvoke.,CommonWin32,False,2016-03-01T16:23:09.777-08:00,True,False,,"win32,pinvoke,interop",18740,False,1.1.3.3
Simon Cropp,2013-07-12T01:27:15.367Z,20,1743,Allows a more expressive use of the ObsoleteAttribute.,Obsolete.Fody,False,2018-03-31T22:28:54.687+00:00,True,False,,"Obsolete,ObsoleteAttribute,ILWeaving,Fody,Cecil",48659,False,2.3.0
Signere.no,2013-07-12T10:13:43.63Z,43209,1743,"Client library to communication with Signere.no REST API.
		The library contains relevant model classes and a client class with methods to access all resources provided in the Signere.no API. 
		The client class itself is implemented from an interface to make it easily testable.
		
		All explicit communication with the API is handled internally and translated to POCO objects. 
		The client methods require certain fields from Signere.no user credentials in order to work properly. 
		To create a user account and obtain these credentials, please visit signere.no .  
		
		Also, check out the REST API documentation at Https://api.signere.no for further details about the resources that can be accessed through this library.",Unipluss.Sign.Client,False,1900-01-01T00:00:00+00:00,False,False,,"Signere,Sign,BankID,Digital,signatur,Uni,Pluss,Signere.no",245837,False,1.0.478
MvvmCross,2013-07-12T09:47:17.99Z,43209,1743,This package contains the 'Sqlite' plugin for MvvmCross v3 - Hot Tuna. This and other packages are currently under development...,MvvmCross.HotTuna.Plugin.Sqlite,True,1899-12-31T16:00:00-08:00,False,False,,"mvvm,mvvmcross,xamarin,monodroid,monotouch,wpf,windows8,winrt,netcore,wp,wpdev,windowsphone",-1,False,3.0.9-beta8
Frozen Mountain Software,2013-07-12T22:10:34.777Z,84,1743,A library for JavaScript that provides resilient peer-to-peer data streams through firewalls for live media.,FM.IceLink.JS,False,2018-01-26T02:26:11.287+00:00,True,False,,"IceLink,ICE,STUN,TURN,P2P,UDP,NAT,Firewall,Traversal,JavaScript",14948,False,2.3.2
MvvmCross,2013-07-12T09:46:14.053Z,43209,1743,This package contains the 'PortableSupport' assemblies for PCL adaption for Xamarin.Android and Xamarin.iOS. This and other packages are currently under development...,MvvmCross.PortableSupport,True,1899-12-31T16:00:00-08:00,False,False,,,-1,False,3.0.9-beta8
NServiceBus Ltd,2013-07-12T21:01:48.68Z,63,1743,"The testing for the nservicebus, The most popular open-source service bus for .net",NServiceBus.Testing,True,2018-02-16T08:24:31.56+00:00,True,False,,"nservicebus,servicebus,msmq,cqrs,publish,subscribe",326207,False,4.1.0-unstable3262
span24,2013-07-12T05:28:16.103Z,1743,1743,CTP.Website.Brand,CTP.Website.Brand,False,2013-07-11T22:28:16.103-07:00,True,False,,,735,False,2.0.0
Giacomo Canonico,2013-07-12T13:08:37.7Z,1544,1743,Joshua 3.0 Facebook plugin,Joshua.plugins.facebook,False,2014-01-27T01:26:31.157-08:00,True,False,,,3300,False,1.0.2
MvvmCross,2013-07-12T09:46:43.69Z,43209,1743,This package contains the 'File' plugin for MvvmCross v3 - Hot Tuna. This and other packages are currently under development...,MvvmCross.HotTuna.Plugin.File,True,1900-01-01T00:00:00+00:00,False,False,,"mvvm,mvvmcross,xamarin,monodroid,monotouch,wpf,windows8,winrt,netcore,wp,wpdev,windowsphone",-1,False,3.0.9-beta8
Knoema,2013-07-12T12:20:24.027Z,225,1743,Entity Framework provider for Knoema.Localization,Knoema.Localization.EFProvider,False,2017-09-07T12:17:56.007+00:00,True,False,,"web,asp.net,mvc,localization,globalization,ef,entityframework",17008,False,0.1.42
"Jacob Mendoza,Iván Oliver",2013-07-12T08:51:09.047Z,1485,1743,Generic library for .NET with helpers,DomiLibrary.Utility,False,2014-03-27T05:21:48.94-07:00,True,False,,".NET,C#,Generic,Helper",15084,False,1.3.8.6
DotNetWise,2013-07-12T21:47:27.837Z,1743,1743,"Enhanced VS2012 Javascript intellisense for variables, properties, methods even prototype's methods!",VS2012-Javascript-Intellisense,False,2013-07-12T14:47:27.837-07:00,True,False,"Enhanced VS2012 Javascript intellisense for variables, properties, methods even prototype's methods!","Javascript,VS2012,intellisense,enum,namespace,class,prototype,method,object,autocomplete,dotnetwise,dnw",12538,False,1.0.712.2147
MvvmCross,2013-07-12T06:58:26.857Z,43209,1743,This package contains the 'PortableSupport' assemblies for PCL adaption for Xamarin.Android and Xamarin.iOS. This and other packages are currently under development...,MvvmCross.PortableSupport,True,1899-12-31T16:00:00-08:00,False,False,,,-1,False,3.0.9-beta7
eXpand,2013-07-11T22:44:14.403Z,11,1744,IO Module (Win) / eXpand Framework,eXpandIOWin,False,2018-04-09T16:14:14.513+00:00,True,False,IO Module (Win) / eXpand Framework,"DevExpress,eXpand",70000,False,13.1.5.6
NServiceBus Ltd,2013-07-11T21:01:26.063Z,63,1744,The NHibernate for the NServicebus,NServiceBus.NHibernate,True,2018-02-16T08:32:13.247+00:00,True,False,,"nservicebus,servicebus,msmq,cqrs,publish,subscribe",329597,False,4.0.0-unstable3257
Calabonga,2013-07-12T01:03:32.457Z,595,1743,This is a set of simplest javascript modules that can help to you organize your framework on ASP.NET (MVC). This is just for a begin your js-framework. For example: control DataSource - is loader that can data from web api with pager and it cat make selection.,JsSite,False,2016-09-01T20:29:17.23-07:00,True,False,"The library is using knockout.js, amplify.js, underscore.js, toastr.js and other helpful frameworks.","calabonga,mvc,asp.net,js,javascript,framework,site,clock,controls,ultilites,knockout,pager,dblookup,datasource",5278,False,0.6.0
NServiceBus Ltd,2013-07-11T21:01:48.01Z,43209,1744,SQL transport support for NServicebus,NServiceBus.SqlServer,True,1900-01-01T00:00:00+00:00,False,False,,"nservicebus,servicebus,msmq,cqrs,publish,subscribe",148648,False,1.0.0-unstable3257
GeertvanHorrik,2013-07-13T11:59:38.817Z,1645,1742,Compass service for Catel to use the compass as a service in MVVM. Also contains a unit test version to simulate the compass.,Catel.MVVM.Services.Compass,True,2013-10-18T04:22:18.253-07:00,True,False,,"mvvm,catel,compass,services,wp,wp7,windows,phone",25382,True,3.6.1307131351-beta
Paul Jenkins; Jake Ginnivan,2013-07-12T09:07:47.557Z,38,1743,"The goal of MahApps.Metro is to allow devs to quickly and easily cobble togther a ""Metro"" UI for their WPF4+ apps, with minimal effort.",MahApps.Metro,True,2018-03-13T22:31:08.54+00:00,True,False,"The goal of MahApps.Metro is to allow devs to quickly and easily cobble togther a ""Metro"" UI for their WPF4+ apps, with minimal effort.","WPF,UI,Metro",1280769,True,0.11.0.53-ALPHA
eXpand,2013-07-11T22:46:03.477Z,11,1744,TreelistView Module (Win) / eXpand Framework,eXpandTreelistViewWin,False,2018-04-09T16:23:47.913+00:00,True,False,TreelistView Module (Win) / eXpand Framework,"DevExpress,eXpand",69561,False,13.1.5.6
Contoso,2013-07-11T21:12:27.31Z,43209,1744,This package contains a MvcTurbine Abstractor to use a service locator.,BclContrib-Abstract.MvcTurbine,False,1899-12-31T16:00:00-08:00,False,False,,"mvcturbine,mvc,di,ioc,servicelocator,bclex",-1,False,1.0.1
NServiceBus Ltd,2013-07-11T21:01:53.28Z,63,1744,The StructureMap Container for the nservicebus,NServiceBus.StructureMap,True,2018-02-16T08:26:21.58+00:00,True,False,,"nservicebus,servicebus,msmq,cqrs,publish,subscribe",211946,False,4.0.0-unstable3257
MvvmCross,2013-07-12T09:46:17.557Z,43209,1743,This package contains the 'Core' assemblies for MvvmCross v3 - Hot Tuna. This and other packages are currently under development...,MvvmCross.HotTuna.CrossCore,True,1899-12-31T16:00:00-08:00,False,False,,,-1,False,3.0.9-beta8
Media Browser Team,2013-07-11T20:30:09.84Z,43209,1744,Contains javascript api wrapper for working with the Media Browser Api.,MediaBrowser.ApiClient.Javascript,False,1899-12-31T16:00:00-08:00,False,False,,,41248,False,3.0.143
eXpand,2013-07-11T22:44:53.697Z,1715,1744,ModelArtifact Module (Win) / eXpand Framework,eXpandModelArtifactWin,False,2013-08-09T07:42:13.893-07:00,True,False,ModelArtifact Module (Win) / eXpand Framework,"DevExpress,eXpand",31822,False,13.1.5.6
Autofac Contributors,2013-07-12T12:23:32.56Z,1,1743,Base assemblies for the Autofac Inversion of Control Container,Autofac,False,2018-04-19T15:02:08.59+00:00,True,False,Autofac is an IoC container for Microsoft .NET. It manages the dependencies between classes so that applications stay easy to change as they grow in size and complexity.,,10374364,False,3.1.0
Sayed Ibrahim Hashimi,2013-07-12T21:27:58.993Z,1520,1743,This will extend web packages so that you can publish a package to different environments. Your packages will contain all of your web.config transforms.,PackageWeb,True,2014-02-20T09:23:49.497-08:00,True,False,,"PackageWeb,Package,Web,Package-Web,Deploy,ASP.NET,MSDeploy",15034,False,1.1.11-beta4
eXpand,2013-07-11T22:46:14.07Z,1715,1744,ViewVariants Module (Web) / eXpand Framework,eXpandViewVariantsWeb,False,2013-08-09T07:43:36.243-07:00,True,False,ViewVariants Module (Web) / eXpand Framework,"DevExpress,eXpand",31295,False,13.1.5.6
Boris Letocha,2013-07-12T21:41:46.633Z,393,1743,Fast Owin Web server in pure .Net without reliance on HttpListener,Nowin,False,2017-03-23T13:15:18.08-07:00,True,False,Owin Web server in pure .Net,"webserver,owin,http",233710,False,0.3.0
huan,2013-07-13T04:33:11.327Z,1742,1742,Phan Thi Admin,PTAdmin,False,2013-07-12T21:33:11.327-07:00,True,False,,"Phan,thi",1515,False,1.0.5
Frozen Mountain Software,2013-07-12T22:11:29.86Z,48,1743,A server-side library for .NET that extends WebSync to provide notifications when clients subscribe to or unsubscribe from a channel. (Community Edition),FM.WebSync.Subscribers.Server,False,2018-03-03T21:29:05.27+00:00,True,False,,"WebSync,Server,Subscribers,Extension,HTTP,Push,Comet,Reverse,Ajax,.NET",14667,False,4.3.2
MvvmCross,2013-07-12T06:58:44.337Z,43209,1743,This package contains the 'Color' plugin for MvvmCross v3 - Hot Tuna. This and other packages are currently under development...,MvvmCross.HotTuna.Plugin.Color,True,1899-12-31T16:00:00-08:00,False,False,,"mvvm,mvvmcross,xamarin,monodroid,monotouch,wpf,windows8,winrt,netcore,wp,wpdev,windowsphone",-1,False,3.0.9-beta7
ByteScout,2013-07-12T09:12:31.283Z,9,1743,"Bytescout PDF Renderer SDK for .NET 2.00-4.50, ASP.NET, Visual Basic 6, ActiveX

(c) ByteScout 2011-2013 

Bytescout PDF Renderer SDK

System Requirements: .NET framework 2.00, 3.50, 4.00, 4.50
Works with: .NET, ASP.NET, ActiveX, Visual Basic 6, Classic ASP

Benefits:

- Renders PDF into hiqh quality PNG, TIFF, BMP images
- Renders PDF to EMF metafiles (vector based)
- NO OTHER SOFTWARE INSTALLED REQUIRED!

http://bytescout.com/",Bytescout.PDFRenderer,False,2018-04-11T15:29:03.803+00:00,True,False,,"bytescout,pdf,png,tiff,bmp,to,image,thumbnail",7915,False,3.20.0.1078
"David Fowler,Damian Edwards",2013-07-13T09:07:35.953Z,1742,1742,Ninject dependency resolver for SignalR,Microsoft.AspNet.SignalR.Ninject,True,2013-07-13T02:18:21.74-07:00,True,False,,"SignalR,Ninject,IoC,DI",23648,False,1.0.0-beta1
GeertvanHorrik,2013-07-11T21:59:21.037Z,1645,1744,Gyroscope service for Catel to use the gyroscope as a service in MVVM. Also contains a unit test version to simulate the gyroscope.,Catel.MVVM.Services.Gyroscope,True,2013-10-18T04:22:20.863-07:00,True,False,,"mvvm,catel,gyroscope,services,wp7,wp,windows,phone",25100,True,3.6.1307112354-beta
eXpand,2013-07-11T19:52:01.25Z,1715,1744,ViewVariants Module (Web) / eXpand Framework,eXpandViewVariantsWeb,False,2013-08-09T07:43:36.243-07:00,True,False,ViewVariants Module (Web) / eXpand Framework,"DevExpress,eXpand",31295,False,13.1.5.5
Kenji Wada,2013-07-12T08:30:51.373Z,1597,1743,Manages application files and settings for Windows Phone 7.1 and 8.0/Windows store apps projects.,Softbuild.Data,False,2013-12-04T16:54:56.887-08:00,True,False,,,1924,False,1.0.1
Nohros Inc,2013-07-12T11:47:18.95Z,76,1743,"This project contains several of Nohros' core .NET libraries that we use
      in our many .NET-based projects. The common package contains the common
      classes that are used by the others packages of the framework.",must.common,False,2018-02-03T19:46:31.53+00:00,True,False,The common package of the nohros must framework.,"csharp,framework,nohros,security",32861,False,1.7.7
Contoso,2013-07-11T21:39:34.377Z,43209,1744,This package contains System.Web extentions.,BclContrib-Web,False,1899-12-31T16:00:00-08:00,False,False,,"web,bclex",-1,False,1.0.1
NServiceBus Ltd,2013-07-11T21:01:30.313Z,63,1744,The Ninject Container for the nservicebus,NServiceBus.Ninject,True,2018-02-16T08:26:03.157+00:00,True,False,,"nservicebus,servicebus,msmq,cqrs,publish,subscribe",171718,False,4.0.0-unstable3257
