authors,created,days_abandoned,days_alive,description,id,is_prerelease,last_updated,listed,missing_info,summary,tags,total_downloads,verified,versionMicrosoft,2014-01-17T20:54:06.407Z,1554,1554,This package provides C# controller scaffolder templates for ASP.NET Web API 2 or newer that generate controllers decorated with attribute routes.,Microsoft.AspNet.WebApi.ScaffolderTemplates.AttributeRouting.CSharp,False,2014-01-17T12:54:06.407-08:00,True,False,,"Microsoft,AspNet,WebApi,AspNetWebApi,Attribute,Routing,AttributeRouting",7494,True,5.1.0
Vitalii Fedorchenko,2014-02-26T08:46:51.7Z,461,1514,"Video converter component for C# (.NET) based on FFMpeg utility. Can be used for converting video, transcoding live streams, extracting video thumbnails.",NReco.VideoConverter,False,2017-01-14T10:00:19.1+00:00,True,False,,"Video,FFMpeg",86544,True,1.0.0.18518
Microsoft,2013-10-31T17:06:15.497Z,1520,1632,このパッケージには、ASP.NET Web Optimization の 日本語 サテライト アセンブリが含まれています。,Microsoft.AspNet.Web.Optimization.ja,False,2014-02-20T14:09:39.303-08:00,True,False,Microsoft.AspNet.Web.Optimization パッケージの 日本語 リソース,"Microsoft,AspNet,optimization,bundling,minification",86665,True,1.1.2
Yimeng Wu,2014-03-04T14:54:18.027Z,1245,1508,"Windows Phone Toolkit customized by Kinnara. Includes fixes, improvements, and more controls.

This package also includes localized resources, XML documentation, and 76x76 ApplicationBar icons.

Highlights:

ApplicationBarSubmenu
Submenu for an application bar item.

FlipView
Lets people flip through items one at a time. Similar to the WinRT FlipView.

ImageButton + ToggleImageButton
Button/ToggleButton control which has an image as its content.

Label
Enhanced text control that supports MaxLines and TextLineBounds. A rich set of standard styles are provided.

ListView
Long list selector with incremental loading and more.

PhonePasswordBox
An extended password box which implements header, placeholder text, and a show password check box.

PhoneSlider
An extended Slider which implements tick marks and snap points.

PropertyUI
Interactive property presenter with copy context menu.

RadioButtonGroup
More easily implement a group of radio buttons.

StartView
Panoramic view similar to the start screen.

VariableSizedWrapGrid
Provides a grid-style layout panel where each tile/cell can be variable size based on content. Similar to the WinRT VariableSizedWrapGrid.

WaitCursor
The wait cursor is a blocking visual animation typically reserved for cases where the application cannot continue until an event is satisfied.",WPtoolkit.Kinnara,False,2014-11-21T21:23:33.76-08:00,True,False,"Customized by Kinnara. Includes fixes, improvements, and more controls.","wptoolkit,toolkit,windowsphone,wp7,wp7dev,phone,tk,wp7tk,controls,mango,wp8,apollo,kinnara,yimengwu,yimeng",13934,False,4.2014.3.4
Epsilon,2014-02-20T08:53:14.083Z,43209,1520,"This is my first NuGet package. It doesn't do anything. .Net 3.5, 4.0 support",EpsilonTestLibrary,False,1899-12-31T16:00:00-08:00,False,False,"This is my first NuGet package. It doesn't do anything. .Net 3.5, 4.0 support.","alma,korte",-1,False,1.5.0
Pure Krome and freeranger,2014-03-03T07:12:13.203Z,1299,1509,"This library can minify and/or combine any Javascript and/or Cascading Style Sheets. It includes an MSBuild task so you can automate this process, per build.
            
This is a direct .NET port of the original Yahoo! UI Library: YUI Compressor.",YUICompressor.NET.MSBuild,False,2014-09-28T19:33:11.867-07:00,True,False,Minify and/or Combine JavaScript and/or Cascading Style Sheets.,"compression,compressor,minification,obfuscation,minify,bundle,bundler,combine,javascript,js,CSS,cascading,style,sheets,msbuild",69275,False,2.4.0
Eric Butler,2014-02-21T15:06:05.607Z,1519,1519,A drop menu jQuery plugin.,DropMenu,False,2014-02-21T07:16:53.843-08:00,True,False,,"jquery,plugin,menu,dropdown",1646,False,1.0.2
Epsilon,2014-02-20T08:47:02.55Z,43209,1520,This is my first NuGet package. It doesn't do anything.,EpsilonTestLibrary,False,1899-12-31T16:00:00-08:00,False,False,This is my first NuGet package. It doesn't do anything.,"alma,korte",-1,False,1.4.0
Microsoft,2013-08-23T19:43:35.09Z,1701,1701,Il pacchetto contiene gli assembly satellite di Microsoft ASP.NET Friendly URLs per l'italiano.,Microsoft.AspNet.FriendlyUrls.Core.it,False,2013-08-23T12:43:35.09-07:00,True,False,,"Microsoft,AspNet",4874,True,1.0.2
clayco,2014-02-13T01:55:22.683Z,1527,1527,This is a new description.,EditPackageTest635278245211326461,False,2014-02-12T17:55:22.683-08:00,True,False,This is a summary.,"Tag1,Tag2",702,False,1.0.0
Chris Peterson,2014-03-02T23:50:41.707Z,39,1510,A .NET framework that supports writing low-ceremony BDD tests using Gherkin language,Kekiri,True,2018-03-12T16:04:25.13+00:00,True,False,A low-friction BDD framework,"bdd,tdd,nunit,scenario,test,gherkin,cucumber,specflow",12397,False,1.6.0-alpha
iciobanu,2014-02-25T16:05:28.243Z,75,1515,Lightweight and fast library written in C# for reading Microsoft Excel files ('97-2007).,ExcelDataReader,False,2018-02-04T09:51:27.92+00:00,True,False,Lightweight and fast library written in C# for reading Microsoft Excel files ('97-2007).,Excel,1190048,False,2.1.2.1
Kendar.org,2014-02-07T13:24:26.817Z,816,1533,"A fluent interface to create Lambda functions and expression. The documentation can be found on http://www.kendar.org/?p=/dotnet/expressionsbuilder. No knowledge of IL and System.Linq.Expression is needed. And even Lambda can be called.
			Available items are: Function parameters and Variables, Constants, String functions, Collections, Invocation of static and instance methods, If and While statements, Assignament, Conditions, Cast, New instance of arbitrary types. For debugging purposes it's possible to generate the source code for the function just created. Available on Github: https://github.com/endaroza/ExpressionBuilder
 For debugging purposes the new function can be converted in standard readable C# code with a simple toString()",ExpressionBuilder,False,2016-01-25T00:20:06.453-08:00,True,False,A fluent interface to create Lambda functions and expression.,"C#,System.Linq.Expression,Lambda,Dynamic,Runtime,Dom,Func,Action",17178,False,1.1.0
hrzafer,2014-02-22T20:41:18.277Z,652,1518,NLP lib for Turkic Languages,Nuve,False,2016-07-07T05:28:27.81-07:00,True,False,,"NLP,Turkish",4448,False,1.0.0
Epsilon,2014-02-20T08:42:18.49Z,43209,1520,This is my first NuGet package. It doesn't do anything.,EpsilonTestLibrary,False,1899-12-31T16:00:00-08:00,False,False,This is my first NuGet package. It doesn't do anything.,"alma,korte",-1,False,1.3.0
clayco,2014-02-22T01:03:14.85Z,1518,1518,This is a new description.,EditPackageTest635285989931444178,False,2014-02-21T17:03:14.85-08:00,True,False,This is a summary.,"Tag1,Tag2",673,False,1.0.0
BeyondTheDuck,2014-03-03T21:50:32.923Z,43209,1509,A helper library for generating random values for all properties of a specific type in a defined class.,BeyondTheDuck.Indescrimitron5000,False,1899-12-31T16:00:00-08:00,False,False,A helper library for generating random values for all properties of a specific type in a defined class.,"helpers,random,generator,test,data",-1,False,0.1.1
Robin Herbots,2014-02-13T13:21:56.17Z,150,1527,"jquery.inputmask is a jquery plugin which create an input mask.

An inputmask helps the user with the input by ensuring a predefined format. This can be useful for dates, numerics, phone numbers, ...

Highlights:
- easy to use
- optional parts anywere in the mask
- possibility to define aliases which hide complexity
- date / datetime masks
- numeric masks
- lots of callbacks
- non-greedy masks
- many features can be enabled/disabled/configured by options
- supports readonly/disabled/dir=""rtl"" attributes
- support data-inputmask attribute
- multi-mask support
- regex-mask support
- value formatting without input element",jQuery.InputMask,False,2017-11-21T11:47:23.837+00:00,True,False,jquery.inputmask is a jquery plugin which create an input mask.,"jQuery,plugins,input,form,inputmask,mask",238018,False,2.4.30
Q42,2013-11-01T08:50:18.867Z,252,1631,Please use the main Q42.HueApi package. This package only contains WinRT specific SSDP Bridge Locator. - Open source library for interaction with the Philips Hue Bridge. Allows you to control your lights from C#.,Q42.HueApi.WinRT,False,2017-08-11T12:09:51.383+00:00,True,False,Please use the main Q42.HueApi package. This package only contains WinRT specific SSDP Bridge Locator.,"philips,hue,lights",2260,False,1.4.1.42
"Copyright (c) 2009,CodePlex Foundation",2014-02-12T21:24:38.857Z,43209,1528,"The Ajax Control Toolkit contains a rich set of controls that you can use to build highly responsive and interactive Ajax-enabled Web applications. The Ajax Control Toolkit contains more than 40 controls, including the AutoComplete, CollapsiblePanel, ColorPicker, MaskedEdit, Calendar, Accordion, HTML Editor Extender, and Watermark controls. Using the Ajax Control Toolkit, you can build Ajax-enabled ASP.NET Web Forms applications by dragging-and-dropping Toolkit controls from the Visual Studio Toolbox onto an ASP.NET Web Forms page.",AJAXControlToolkit3.5.7.123,False,1899-12-31T16:00:00-08:00,False,False,,,-1,False,3.5.7.123
Pierre BELIN,2014-02-26T10:24:57.947Z,1514,1514,"A flexible library aiming to help Windows Phone developers to have neat and native looking tiles for their apps and/or in their apps.

Details at http://wptiletoolkit.codeplex.com/",Ree7.WPTileToolkit,False,2014-02-26T02:24:57.947-08:00,True,False,,"ree7,toolkit,wp7,wp8,wpdev,tile,windowsphone",2232,False,1.2.0
Niklas Rother,2014-03-03T14:13:21.31Z,1360,1509,"Wrapper for NLua, making access to Lua more idomatic from .NET. Heavily using the ""dynamic"" keyword.",DynamicLua,False,2014-07-30T03:17:49.587-07:00,True,False,DynamicLua is a wrapper for NLua heavily using the .NET 4 'dynamic' Feature.,"lua,dynamic",4971,False,1.1.0
BeyondTheDuck,2014-03-04T16:12:35.153Z,43209,1508,A helper library for WebApi 2.+ and Indiscrimitron 5000.,BeyondTheDuck.Indiscrimitron5000.WebApi,False,1899-12-31T16:00:00-08:00,False,False,A helper library for WebApi 2.+ and Indiscrimitron 5000.,"helpers,random,generator,test,data,webapi,indiscrimitron",-1,False,0.0.2
Microsoft,2013-10-31T17:06:26.43Z,1520,1632,此程序包包含适用于 ASP.NET Web Optimization 的简体中文附属程序集。,Microsoft.AspNet.Web.Optimization.zh-Hans,False,2014-02-20T14:10:46.857-08:00,True,False,适用于 Microsoft.AspNet.Web.Optimization 程序包的简体中文资源,"Microsoft,AspNet,optimization,bundling,minification",276973,True,1.1.2
Oracle,2014-03-03T17:57:02.037Z,43209,1509,ADO.Net driver for MySQL,MySql.ConnectorNET.Web,False,1899-12-31T16:00:00-08:00,False,False,,"MySql,MySql.Web",-1,False,6.8.3.2
Telerik AD,2014-02-26T10:05:18.357Z,568,1514,"The Telerik.DataAccess.Core NuGet package provides the Telerik Data Access runtime assemblies necessary to consume Telerik Data Access persistent objects, without defining any mapping.

      If this project contains persistent classes and defines mapping, the Telerik.DataAccess.Fluent NuGet package is required as well.

      Telerik Data Access helps defining mapping and executing create, retrieve, update and delete operations for your data access classes and database tables. It allows you to consume stored procedures and functions.",Telerik.DataAccess.Core,False,2016-09-29T07:13:35.11+00:00,True,False,The Telerik.DataAccess.Core NuGet package provides the Telerik Data Access runtime assemblies necessary to work with Telerik Data Access persistent objects.,"DataAccess,ORM,OpenAccess,Persistence,CRUD,Database,Data",185951,False,2014.1.225.2
testy,2014-02-16T21:52:55.99Z,1473,1524,"Create snapshots of any .Net object, compare them and create a structured diff",SIT.ObjectComparer,False,2014-04-08T16:31:44.41-07:00,True,False,"Compare .Net objects, Deep Copy","compare,objectcomparer,audit,adittrail,c#,snapshot,change,changeset,diff,structured",4577,False,1.3.3
Microsoft,2012-08-06T21:22:51.19Z,2083,2083,"Windows Identity Foundation enables .NET developers to externalize identity logic from their application, improving developer productivity, enhancing application security, and enabling interoperable federation. Enjoy greater productivity, applying the same tools and programming model to build on-premises software as well as cloud services. Create more secure applications by reducing custom implementations and using a single simplified identity model based on claims. Enjoy greater flexibility in application deployment through interoperability based on industry standard protocols, allowing applications and identity infrastructure services to communicate via claims.",Microsoft.IdentityModel,False,2012-08-06T14:22:53.38-07:00,True,False,"Windows Identity Foundation enables .NET developers to externalize identity logic from their application, improving developer productivity, enhancing application security, and enabling interoperable federation. Enjoy greater productivity, applying the same tools and programming model to build on-premises software as well as cloud services. Create more secure applications by reducing custom implementations and using a single simplified identity model based on claims. Enjoy greater flexibility in application deployment through interoperability based on industry standard protocols, allowing applications and identity infrastructure services to communicate via claims.","authentication,federation,claims",1794948,True,6.1.7600.16394
Meriworks,2014-02-26T13:14:29.093Z,95,1514,Client API library for ImageVault,ImageVault.Client,False,2018-01-15T08:35:08.37+00:00,True,False,,"ImageVault,Client,API,Meriworks",14743,False,4.4.2
SmartElk,2014-02-20T10:52:00.127Z,1127,1520,StructureMap adapter for Antler framework,Antler.StructureMap,False,2015-03-20T03:31:33.73-07:00,True,False,,"Antler,StructureMap,IoC",12014,False,1.22.0
Kalitte Professional Information Technologies Ltd. Co.,2014-03-04T15:37:21.887Z,43209,1508,Professional .Net Dashboard and Widget ToolKit for,JDash.WebForms.Demo,False,1899-12-31T16:00:00-08:00,False,False,,"Asp.Net,JDash,Dashlet,Drag-drop,Dashboard,Kalitte",-1,False,1.0.5
Epsilon,2014-02-18T15:03:59.717Z,43209,1522,This is my first NuGet package. It doesn't do anything.,EpsilonTestLibrary,False,1899-12-31T16:00:00-08:00,False,False,Summary of my first NuGet package: It doesn't do anything.,"alma,korte",-1,False,1.0.0
Steen F. Tøttrup,2014-03-02T11:22:21.25Z,682,1510,A complete forum solution for ASP.NET MVC 3+ applications.,MVCForum,False,2016-06-07T13:15:04.24-07:00,True,False,,,17710,False,1.3.8.40223
Onigiri-Soft,2014-02-21T02:57:59.53Z,139,1519,You will be able to manipulate WinForms Controls. This library is built on Friendly Layer.,Ong.Friendly.FormsStandardControls,False,2017-12-02T06:51:57.227+00:00,True,False,,"Friendly,Testing,Windows,WinForms,Automation,codeer,codeer.friendly",5629,False,2.1.0
Tobias Studer,2014-03-02T04:09:24.233Z,1510,1510,"This very loquacious data provider is the easiest way for your Sitecore solution to show the SQL Queries your fast queries translate to and measure them at the same time.

Documentation can be found here: https://github.com/studert/Loquacious",Loquacious.DataProvider,False,2014-03-01T20:09:24.233-08:00,True,False,A very loquacious data provider,"Sitecore,DataProvider,Logging,FastQuery,Sql",550,False,1.0.0
Jhonathan de Souza Soares,2014-02-12T15:56:27.417Z,1528,1528,Componente utilizado com classes úteis para utilização em projetos mvc.,libCrescabrasilMVC,False,2014-02-12T07:56:27.417-08:00,True,False,,,1739,False,1.1.2
Roman Kuzmin,2014-02-12T07:31:35.127Z,335,1528,"A simple and yet effective script debugger and related tools. They can be used
in the NuGet package manager console for debugging NuGet specific scripts. But
in some cases they are useful in other PowerShell hosts as well.",NuGetDebugTools,False,2017-05-20T01:54:08.47-07:00,True,False,"A simple and yet effective script debugger and related tools. They can be used
in the NuGet package manager console for debugging NuGet specific scripts. But
in some cases they are useful in other PowerShell hosts as well.","NuGet,PowerShell,Debugging,Tools",6053,False,0.2.0
bhuvak,2014-02-13T01:56:36.98Z,43209,1527,Package description,UploadPackageWithMinClientVersionFromUITest635278245953646219,False,1899-12-31T16:00:00-08:00,False,False,,windows8,-1,False,1.0.0
Hajivalie,2014-02-16T10:20:57.927Z,1524,1524,Right to left Bootstrap3.1.1 for MVC by Shidab.ir,ShidabBootstrap,False,2014-02-16T02:20:57.927-08:00,True,False,,"Bootstrap,farsi,persian,rtl,mvc",1196,False,1.0.0
Microsoft,2014-02-27T14:42:47.83Z,1513,1513,"CrmSvcUtil executable that comes as part of the
Microsoft CRM 2011 Application",CrmSvcUtil.2011,False,2014-02-27T06:42:47.83-08:00,True,False,,"Microsoft,CRM,2011,XRM,SDK,SVCUtil",168,False,5.0.18
Epsilon,2014-02-18T15:13:01.607Z,43209,1522,This is my first NuGet package. It doesn't do anything.,EpsilonTestLibrary,False,1899-12-31T16:00:00-08:00,False,False,This is my first NuGet package. It doesn't do anything.,"alma,korte",-1,False,1.1.0
Microsoft,2012-05-31T23:29:38.83Z,2150,2150,"Legacy package, System.Web.Providers.LocalDb is now included in the 'Microsoft.AspNet.Providers.LocalDB' package.",System.Web.Providers.LocalDb,False,2012-05-31T16:29:38.83-07:00,True,False,"Legacy package, System.Web.Providers.LocalDb is now included in the 'Microsoft.AspNet.Providers.LocalDB' package.",,41932,True,1.1.0
Microsoft,2014-02-17T00:23:12.547Z,9,1523,This package contains the main assembly for the Active Directory Authentication Library (ADAL). ADAL provides easy to use authentication functionality for your .NET client apps by taking advantage of Active Directory or Windows Azure Active Directory.,Microsoft.IdentityModel.Clients.ActiveDirectory,False,2018-04-11T21:26:30.58+00:00,True,False,This package contains the main assembly for the Active Directory Authentication Library (ADAL). ADAL provides easy to use authentication functionality for your .NET client apps by taking advantage of Active Directory or Windows Azure Active Directory.,"Active,Directory,Authentication,Library,ADAL,Windows,Azure,AD,AAD,Identity",9203247,True,1.0.3
Michael Meijer,2014-02-21T09:00:35.133Z,1508,1519,"TypeScript implementation of an AVL tree, a self-balancing binary search tree.",AvlTree.TypeScript,False,2014-03-04T02:00:31.83-08:00,True,False,Does not yet have install/uninstall scripts.,"AVL,binary,balanced,search,tree,algorithm,TypeScript,JavaScript",2271,False,1.0.2
Microsoft Corporation,2014-02-25T09:53:49.863Z,224,1515,"Classes to serialize, deserialize and validate OData payloads. Enables construction of OData producers and consumers. Targets .NET 4.0, Silverlight 4.0 or .NET Portable Lib with support for .NET 4.0, SL 4.0, Win Phone 7, and Win 8. Localized for CHS, CHT, DEU, ESN, FRA, ITA, JPN, KOR and RUS.",Microsoft.Data.OData,False,2017-09-08T00:54:23.46+00:00,True,False,,"wcf,data,services,odata,odatalib,edmlib,spatial,ado.net,ef,entity,framework,open,protocol,wcfds,wcfdataservices,dataservices",26524519,True,5.6.1
Epsilon,2014-02-20T09:15:08.017Z,43209,1520,This is my first NuGet package. It doesn't do anything. .Net 3.5 client.,EpsilonTestLibrary,False,1899-12-31T16:00:00-08:00,False,False,This is my first NuGet package. It doesn't do anything. .Net 3.5 client.,"alma,korte",-1,False,1.7.0
Juergen Gutsch,2014-02-19T21:29:07.773Z,1187,1521,A simple object store library to persist objects for demo and testing applications. The objects will be serialized to JSON and stored on the file system by default.,Gos.SimpleObjectStore,False,2015-01-18T23:30:11.637-08:00,True,False,A simple object store library to persist objects for demo and testing applications.,"object,storage,json,database",2312,False,1.0.5
Microsoft,2013-07-30T00:37:01.463Z,43209,1725,This package contains the main assembly for the Active Directory Authentication Library (ADAL). ADAL provides easy to use authentication functionality for your .NET client apps by taking advantage of Active Directory or Windows Azure Active Directory.,System.IdentityModel.Clients.ActiveDirectory,False,1899-12-31T16:00:00-08:00,False,False,This package contains the main assembly for the Active Directory Authentication Library (ADAL). ADAL provides easy to use authentication functionality for your .NET client apps by taking advantage of Active Directory or Windows Azure Active Directory.,"Active,Directory,Authentication,Library,ADAL,Windows,Azure,AD,AAD,Identity",-1,False,0.8.0
Microsoft,2013-05-31T00:04:37.903Z,1785,1785,Этот пакет содержит русские вспомогательные сборки для ASP.NET Web Pages 2 Administration.,Microsoft.AspNet.WebPages.Administration.ru,False,2013-05-30T17:04:37.903-07:00,True,False,Русские ресурсы для пакета Microsoft.AspNet.WebPages.Administration,"Microsoft,AspNet,WebPages,AspNetWebPages",2259,True,2.0.30506
zhaojianwei,2014-02-14T07:20:48.097Z,1526,1526,记录文本日志,Chiang,False,2014-02-13T23:20:48.097-08:00,True,False,,,629,False,1.0.0
Tigerspike,2014-02-21T04:23:51.207Z,1179,1519,Service Helper for consuming the Phoenix 5 Api's.,PhoenixServiceHelper,False,2015-01-26T19:27:25.543-08:00,True,False,Service Helper for consuming the Phoenix 5 Api's.,"Phoenix,Tigerspike,Service,Helper",4069,False,1.0.10
Venetasoft,2014-03-02T04:16:18.367Z,1508,1510,"Main Features:
•connects to Microsoft Live, Gmail or to a custom smtp mail server through a direct and secured ssl connection.
•does not use any web service.
•supports any kind of attachment, from resource or isolated storage.
•sends an email without calling EmailComposeTask and does not need user intervention.
•WP7 and WP8 compatible.
•multithreaded: will not freeze/block your UI.
•works on wifi and data connection.
•100% managed code, perfectly compliant to app certification (see the certificated App list below).
•comes with a complete VS2012 demo project, a functional demo App ready to be deployed to your phone for testing the library.
•lifetime upgrades and support via email/forum.
•supports international charset (Chinese).

//create a new MailMessage object
MailMessage mailMessage = new MailMessage();

//set a Live/Hotmail or Gmail, or a custom SMTP account
mailMessage.UserName= ""*****@hotmail.com;
mailMessage.Password = ""********"";
mailMessage.AccountType = accountType.MicrosoftAccount; 
mailMessage.From = ""myapp@mycompany.com"";

//set mail data
mailMessage.To = ""foo@foo.com"";
mailMessage.ReplyTo = ""foo5@foo.com"";
mailMessage.Subject = ""Hello from WP"";
mailMessage.Body = ""I can send any type of attachment from my app now !!"";   //text or HTML

//attach ANY KIND of file from a resource or IsolatedStorage path
mailMessage.AddAttachment(""\rex\file.wav"");
mailMessage.AddAttachment(""\myFolder\file.mp3""); 
mailMessage.AddAttachment(""\downloads\file.mp4""); 
//attach from in-memory data:
mailMessage.AddAttachment(Encoding.UTF8.GetBytes(""yesssss"".ToCharArray()), ""memoryfile.txt"");

//set message event handlers
mailMessage.Error +=  mailMessage_Error; 
mailMessage.MailSent += mailMessage_MailSent; 
mailMessage.Progress += mailMessage_Progress;  

//send email (async)
mailMessage.SendMail();

Support:  support@venetasoft.it",MailMessage,False,2014-03-03T20:49:55.19-08:00,True,False,"SMTP library to send unattended emails from your App without using EmailComposeTask.
Attach any type of file (pdf, mp3, wav, mp4, avi, bmp, txt, zip, jpg, etc).","Windows,Phone,SMTP,client,library",3058,False,1.3.1
WrapsToGo,2014-02-19T12:39:09.767Z,1501,1521,WrapsToGO SMTP is a complete library for building a SMTP server(mail server).,WTG_SMTP,False,2014-03-11T02:41:41.36-07:00,True,False,SMTP server library for building af SMTP Server(mailserver) in minutes.,"SMTP,C#,Mailserver,SMTPServer",1604,False,1.0.1
jmace,2014-02-14T18:33:36.44Z,43209,1526,Creates the default scaffolding for a Class Library.,MC_DataLibrary,False,1900-01-01T00:00:00+00:00,False,False,Default scaffolding for a Class Library,,-1,False,0.2.6
Microsoft,2013-10-31T17:06:08.26Z,1520,1632,Este paquete contiene los ensamblados satélites en español para ASP.NET Web Optimization.,Microsoft.AspNet.Web.Optimization.es,False,2014-02-20T14:09:23.72-08:00,True,False,Recursos en español para el paquete Microsoft.AspNet.Web.Optimization,"Microsoft,AspNet,optimization,bundling,minification",111227,True,1.1.2
Microsoft,2013-12-19T00:09:23.007Z,1330,1583,OWIN componenets for ASP.NET SignalR.,Microsoft.AspNet.SignalR.Owin,False,2014-08-29T14:41:42.6-07:00,True,False,OWIN componenets for ASP.NET SignalR.,"Microsoft,AspNet,SignalR,AspNetSignalR,Owin",908583,True,1.2.0
Huanlin Tsai,2014-02-17T06:14:17.987Z,43209,1523,"Just some common utilities for .NET development.
Note: if you have been used Yalib version 1.0.*, please remove it from your projects and    then add it again. This is because I changed version number from 1.0.* to 0.0.*. (Sorry!)",Yalib,False,1900-01-01T00:00:00+00:00,False,False,,,-1,False,0.0.10
Huanlin Tsai,2014-02-10T17:26:37.783Z,43209,1530,"Just some common utilities for .NET development.

Note: if you have been used Yalib version 1.0.*, please remove it from your projects and then add it again. This is because I changed version number from 1.0.* to 0.0.*. (Sorry!)",Yalib,False,1900-01-01T00:00:00+00:00,False,False,,,-1,False,1.0.8
Takenet,2014-02-17T13:05:42.41Z,1523,1523,Contains middleware to support takenet logging library.,Takenet.Library.Logging.Owin,False,2014-02-17T05:05:42.41-08:00,True,False,,"Logging,Takenet,Log,Owin",1403,False,1.0.0.3
