authors,created,description,id,is_prerelease,last_updated,listed,missing_info,summary,tags,total_downloads,verified,version"Abel Pereira,Scott Kirkland",2015-09-11T03:12:53.073Z,"Inflector is a simple lightweight .NET portable class library enabling you to pluralize, singularize, titleize (...) words in a specific culture.

More info available at: 
https://github.com/abelepereira/Inflector-Portable

This library is based on Scott Kirkland original work (https://github.com/srkirkland/Inflector).",Inflector.Portable,False,2015-09-10T20:12:53.073-07:00,True,False,,"pluralize,singularize,titleize,humanize,pascalize,camelize,capitalize,ordinalize,dasherize,inflector,portable",1485,False,1.2.0
Dumont Cedric,2015-09-11T10:26:04.333Z,Xml helpers and extensions,CExtensions.Xml,True,2016-01-15T03:49:41.19-08:00,True,False,Xml helpers and extensions,,2924,False,1.1.0-CI00023
Maksim Volkau,2015-09-11T10:13:40.653Z,DryIoc extension for ASP.NET providing Web Request Reuse,DryIoc.Web.dll,True,2017-04-04T01:57:04.497-07:00,True,False,,"Web,ASP,Extension,IoC,Container,Inversion-of-Control,DI,Dependency-Injection,DRY,DryIoc",23750,False,2.0.0-rc3build320
ScienceSoft,2015-09-11T09:32:19.183Z,"Xamarin.Forms gestures plugin for view controls (targeted at Android, iOS and Windows Phone)",ScnViewGestures.Forms,False,2016-10-24T14:26:15.72+00:00,True,False,,"xamarin,xamarin.forms,gestures,ios,android,windows,phone,winphone,wp8",16109,False,1.2.8
Takenet,2015-09-11T12:06:24.383Z,Data transfer objects for the Pay4Me HTTP API.,Takenet.Pay4Me.DataTransfer,False,2016-01-25T12:12:57.173-08:00,True,False,,,1675,False,1.0.9
.NET Foundation,2015-07-21T19:37:58.773Z,APIs for invoking NuGet services in Visual Studio.,NuGet.VisualStudio,False,2018-02-26T23:29:51.45+00:00,True,False,,nuget,353603,True,2.8.6
Qsys Sverige AB,2015-09-11T11:46:52.393Z,QuickPick One server component for Apollo 13,QuickPick.One,False,2018-04-09T14:56:23.34+00:00,True,False,,"Apollo,Apollo13,Quickpick,Qsys",130730,False,1.0.15222.25
Qsys Sverige AB,2015-09-11T07:16:53.86Z,QuickPick One server component for Apollo 13,QuickPick.One,False,2018-04-09T14:56:23.34+00:00,True,False,,"Apollo,Apollo13,Quickpick,Qsys",130730,False,1.0.15222.24
"HAKKO Development Co.,Ltd. az'Ciel division",2015-09-11T09:54:35.21Z,OAuth class library for Evernote Desktop Windows Applications.,EvernoteOAuth,False,2015-09-11T09:54:35.21+00:00,True,False,,,917,False,1.0.0.2
"Steffen Forkmann,Mauricio Scheffer,Colin Bull",2015-09-11T09:07:11.937Z,FAKE - F# Make - is a build automation tool for .NET. Tasks and dependencies are specified in a DSL which is integrated in F#. Extensions for FAKE Deploy,FAKE.Deploy.Lib,False,2018-04-15T16:38:30.65+00:00,True,False,FAKE - F# Make - Get rid of the noise in your build scripts.,"build,fake,f#",179902,False,4.4.1
objo,2015-09-11T11:55:46.203Z,Portable core assembly that is referenced by the other Helix Toolkit packages.,HelixToolkit,False,1900-01-01T00:00:00+00:00,False,False,,"3D,wpf",140029,False,2015.1.608
Hibernating Rhinos,2015-09-10T22:56:54.02Z,RavenDB embedded database,RavenDB.Bundles.IndexReplication,True,2018-02-22T21:29:30.903+00:00,True,False,,"nosql,ravendb,raven,document,database,bundles",115978,True,2.5.2967-Unstable
Maksim Volkau,2015-09-11T10:12:31.167Z,DryIoc extension for OWIN,DryIoc.Owin.dll,True,2017-04-13T03:28:36.8-07:00,True,False,,"Web,ASP,OWIN,Extension,IoC,Container,Inversion-of-Control,DI,Dependency-Injection,DRY,DryIoc",23436,False,2.0.0-rc3build320
Tim Long,2015-09-11T05:04:47.85Z,"A text-based display driver for SSD1306 I2C OLED displays, targeting .NET MicroFramework 4.3+ and Netduino Plus hardware platform.
      The driver works with I2C interface (only) and offers basic text rendering using bitmapped fonts. Two very minimal fonts are included
      but because fonts have a high memory footprint, these need to be specified by the application and should be optimized to contain the
      minimum required characters. Currently, the driver is text-only and no graphics primitives are included, although the display
      is bitmapped and this could be a future enhancement.",TA.NetMF.Devices.SSD1306,False,2015-10-19T18:26:23.707-07:00,True,False,"A text-based display driver for SSD1306 I2C OLED displays, targeting .NET MicroFramework 4.3+ and Netduino Plus hardware platform.","netduino,NetMF,MicroFramework,4.3,display,driver,oled,i2c,ssd1306,c#",1538,False,0.1.0
"Steffen Forkmann,Mauricio Scheffer,Colin Bull",2015-09-11T08:19:32.007Z,FAKE - F# Make - is a build automation tool for .NET. Tasks and dependencies are specified in a DSL which is integrated in F#. This package bundles all extensions.,FAKE,False,2018-04-15T16:37:14.193+00:00,True,False,FAKE - F# Make - Get rid of the noise in your build scripts.,"build,fake,f#",1443054,False,4.4.0
"Steffen Forkmann,Mauricio Scheffer,Colin Bull",2015-09-11T08:21:53.767Z,FAKE - F# Make - is a build automation tool for .NET. Tasks and dependencies are specified in a DSL which is integrated in F#. Extensions for FAKE Deploy,FAKE.Deploy.Lib.x64,False,2018-04-15T16:39:29.933+00:00,True,False,FAKE - F# Make - Get rid of the noise in your build scripts.,"build,fake,f#",57988,False,4.4.0
Paket team,2015-09-11T08:16:04.02Z,A package dependency manager for .NET with support for NuGet packages and GitHub repositories.,Paket.Core,False,2018-04-17T08:54:04.56+00:00,True,False,A package dependency manager for .NET with support for NuGet packages and GitHub repositories.,"nuget,bundler,F#",293543,False,1.39.2
thocun,2015-09-11T07:18:15.533Z,Store data object to many type of stores,MagicalStorage.Repository.SQL,False,2015-09-11T00:51:35.983-07:00,True,False,,"Entity,Framework,MS,SQL,MySQL,C#,.NET",883,False,1.0.2
DD4T Community,2015-09-11T08:21:38.42Z,DD4T RestService,DD4T.RestService.WebApi,True,2016-07-07T15:36:48.303-07:00,True,False,,"SDLTridion,Tridion,DD4T",4802,False,2.0.0-alpha14
Tim Jones,2015-09-11T07:06:56.797Z,Gemini is an application shell similar in concept to the Visual Studio Shell. It uses AvalonDock and has an MVVM architecture based on Caliburn Micro.,GeminiWpf,False,2015-09-20T06:50:03.537-07:00,False,False,,".net40,WPF,MVVM,AvalonDock,Caliburn,Micro,Visual,Studio,IDE,Shell",8806,False,0.6.0
Maksim Volkau,2015-09-11T10:16:37.973Z,Superset of MEF attributes. In addition to Export/Import contains attributes to support modern IOC (DryIoc) features.,DryIocAttributes,True,2018-02-05T19:16:31.683+00:00,True,False,,"MEF,Attributes,Attributed-Model,Composition,IoC,Container,Inversion-of-Control,DI,Dependency-Injection,DRY,Service-Provider,Factory",11998,False,2.0.0-rc3build320
Maksim Volkau,2015-09-11T10:55:05.3Z,DryIoc extension for ASP.NET WebAPI and OWIN,DryIoc.WebApi.Owin,True,2017-02-01T12:57:20.427-08:00,True,False,,"Web,ASP,WebApi,OWIN,Extension,IoC,Container,Inversion-of-Control,DI,Dependency-Injection,DRY,DryIoc",20453,False,2.0.0-rc3build321
Oren Novotny,2015-09-11T12:14:21.037Z,Tool to auto-generate BCL package nuspec dependencies for CoreCLR projects,NuSpec.ReferenceGenerator,False,2016-06-15T00:01:03.54+00:00,True,False,,"nuspec,coreclr,dnx,nuget,dependency,dotnet",123442,False,1.3.3
v.la@Live.cn,2015-09-11T07:50:06.797Z,C# Logging Factory,Es.Logging.Console,False,2018-01-16T06:57:35.76+00:00,True,False,,"logging,log,logger",2443,False,0.0.1
$���ӽ�$,2015-09-11T05:15:33.283Z,权限前台用户组管理,ITOO.AuthorityUserGroupManage.Contracts,False,2015-09-12T05:55:25.527-07:00,True,False,,,445,False,1.0.0
Oren Novotny,2015-09-11T00:11:28.6Z,Tool to auto-generate BCL package nuspec dependencies for CoreCLR projects,NuSpec.ReferenceGenerator,False,2016-06-15T00:01:03.54+00:00,True,False,,"nuspec,coreclr,dnx,nuget,dependency,dotnet",123442,False,1.3.2
Thomas Galliker,2015-07-29T20:34:02.227Z,CrossPlatformLibrary.Geolocation is a plug-in for geo information handling. It enables cross-platform GPS functionality.,CrossPlatformLibrary.Geolocation,True,2017-05-21T15:33:46.63-07:00,False,False,CrossPlatformLibrary.Geolocation is a plug-in for geo information handling.,,7769,False,1.0.4-alpha
Trey Gourley,2015-09-11T01:29:26.737Z,CommonServices collects and handles major tasks needed by most Microsoft .NET applications,CircularSoft.CommonServices,False,2015-11-17T12:47:39.78-08:00,True,False,,,869,False,0.1.0
Maksim Volkau,2015-09-11T10:51:36.717Z,DryIoc extension for OWIN,DryIoc.Owin,True,2017-04-13T03:28:23.5-07:00,True,False,,"Web,ASP,OWIN,Extension,IoC,Container,Inversion-of-Control,DI,Dependency-Injection,DRY,DryIoc",24522,False,2.0.0-rc3build321
Thomas Galliker,2015-07-29T19:49:29.303Z,CrossPlatformLibrary.Geolocation is a plug-in for geo information handling. It enables cross-platform GPS functionality.,CrossPlatformLibrary.Geolocation,True,2017-05-21T15:33:46.63-07:00,False,False,CrossPlatformLibrary.Geolocation is a plug-in for geo information handling.,,7769,False,1.0.3-alpha
Wintellect,2015-09-10T11:47:10.997Z,The Power Collections group of collection classes packed for the purpose of the Software University's courses.,SoftUni.Wintellect.PowerCollections,False,2015-09-12T09:34:20.463+00:00,True,False,,"Wintellect,PowerCollections,SoftUni",2278,False,1.0.5731.26533
"Steffen Forkmann,Mauricio Scheffer,Colin Bull",2015-09-11T08:25:57.207Z,FAKE - F# Make - is a build automation tool for .NET. Tasks and dependencies are specified in a DSL which is integrated in F#. Extensions for SQL Server,FAKE.SQL,False,2018-04-15T16:42:22.333+00:00,True,False,FAKE - F# Make - Get rid of the noise in your build scripts.,"build,fake,f#",195771,False,4.4.0
SPA Tools,2015-09-11T06:57:39.023Z,Knockout Utilities Extensions to simplify Knockout app development,KoMvvm,False,2015-09-11T00:21:05.83-07:00,True,False,,"Knockout,Mvvm,Commands,Operation,Messenger,Extension,AMD",2658,False,0.1.3
Keith Woods,2015-09-11T11:14:44.88Z,Source Only Package - Evented State Processor (ESP) adds specific processing workflow around changes to a model's state,esp-net-source,True,2016-06-09T02:16:18.243-07:00,True,False,,"evented,state,processor,reactive,router,event,loop",4901,False,0.4.1-alpha
"Steffen Forkmann,Mauricio Scheffer,Colin Bull",2015-09-11T08:20:58.293Z,FAKE - F# Make - is a build automation tool for .NET. Tasks and dependencies are specified in a DSL which is integrated in F#. Extensions for FAKE Deploy,FAKE.Deploy.Lib,False,2018-04-15T16:38:30.65+00:00,True,False,FAKE - F# Make - Get rid of the noise in your build scripts.,"build,fake,f#",179902,False,4.4.0
Maksim Volkau,2015-09-11T10:07:10.857Z,"DryIoc is small, fast, capable IoC container for .NET",DryIoc,True,2018-03-17T16:01:26.937+00:00,True,False,,"IoC,Container,Inversion-of-Control,DI,Dependency-Injection,DRY,Service-Provider,Factory",128182,False,2.0.0-rc3build320
Martin Gondermann,2015-09-11T11:12:33.017Z,Functional data types for C#,Pagansoft.Functional,False,2015-09-11T12:22:37.047+00:00,True,False,,"data,type,functional,option",1372,False,2.0.3
Paket team,2015-09-11T08:43:36.507Z,A package dependency manager for .NET with support for NuGet packages and GitHub repositories.,Paket.PowerShell,False,2017-04-28T07:19:40.903+00:00,True,False,A package dependency manager for .NET with support for NuGet packages and GitHub repositories.,"nuget,bundler,F#",135731,False,1.39.5
"Steffen Forkmann,Mauricio Scheffer,Colin Bull",2015-09-11T08:21:47.623Z,FAKE - F# Make - is a build automation tool for .NET. Tasks and dependencies are specified in a DSL which is integrated in F#. Experimental Extensions,FAKE.Experimental,False,2018-04-15T16:39:03.353+00:00,True,False,FAKE - F# Make - Get rid of the noise in your build scripts.,"build,fake,f#",177660,False,4.4.0
Hibernating Rhinos,2015-09-11T03:10:31.863Z,The cascade delete bundle allows for a specified set of documents and attachments to be deleted when the document that owns it is deleted. Typical usage scenarios include deleting an attachment that is referenced by a document or removing a set of child documents referenced by a parent document.,RavenDB.Bundles.CascadeDelete,True,1900-01-01T00:00:00+00:00,False,False,,"nosql,ravendb,raven,document,database,bundles",197914,True,3.0.3790-Unstable
"Steffen Forkmann,Mauricio Scheffer,Colin Bull",2015-09-11T08:26:39.713Z,FAKE - F# Make - is a build automation tool for .NET. Tasks and dependencies are specified in a DSL which is integrated in F#. Extensions for SQL Server,FAKE.SQL.x64,False,2018-04-15T16:42:47.723+00:00,True,False,FAKE - F# Make - Get rid of the noise in your build scripts.,"build,fake,f#",57791,False,4.4.0
Paket team,2015-09-11T08:21:28.027Z,A package dependency manager for .NET with support for NuGet packages and GitHub repositories.,Paket,False,2018-04-17T08:54:34.933+00:00,True,False,A package dependency manager for .NET with support for NuGet packages and GitHub repositories.,"nuget,bundler,F#",825043,False,1.39.3
Ash Pook,2015-09-11T09:22:04.33Z,Cross precision 3D maths library.,Abacus,False,2015-09-11T22:45:54.38+00:00,True,False,,"3D,Maths,Graphics",1190,False,0.9.1
Paket team,2015-09-11T09:50:47.237Z,A package dependency manager for .NET with support for NuGet packages and GitHub repositories.,Paket,False,2018-04-17T08:54:34.933+00:00,True,False,A package dependency manager for .NET with support for NuGet packages and GitHub repositories.,"nuget,bundler,F#",825043,False,1.39.6
Jerrie Pelser and contributors,2015-09-11T04:29:25.46Z,Adds additional OAuth providers for OWIN to use with ASP.NET,Owin.Security.Providers,False,2018-04-01T06:38:29.297+00:00,True,False,"Additional OAuth providers for Katana (OWIN).  
      
      Includes providers for ArcGISOnline, Asana, Backlog, Battle.net, Buffer, DeviantArt, Dropbox, EVEOnline, Fitbit, Flickr, Foursquare, GitHub, Gitter, Google+, HealthGraph, Imgur, Instagram, LinkedIn, PayPal, Reddit, Salesforce, Slack, SoundCloud, Spotify, StackExchange, TripIt, Twitch.tv, Untappd, Vimeo, Visual Studio Online, Wordpress, Yahoo and Yammer.
      
      Also adds generic OpenID 2.0 providers as well implementations for Steam and Wargaming.","owin,katana,oauth,LinkedIn,Yahoo,Google+,GitHub,Reddit,Instagram,StackExchange,SalesForce,TripIt,Buffer,ArcGIS,Dropbox,Wordpress,Battle.NET,Yammer,OpenID,Steam,Twitch",247936,False,1.24.1
RabbitSoftware,2015-09-11T08:13:55.9Z,Rabbit.Web.Mvc package from RabbitSoftware,RabbitWebMvc,False,2015-10-19T21:28:14.983-07:00,True,False,,,1587,False,1.0.1
akmittal,2015-09-11T09:34:05.277Z,"The barcode scan control can be used for scanning QR control using webcam of any device supporting Windows 10. Once the code is scanned successfully , the result would be available as text string.
The control has dependency of using ZXing.Net NuGet package as the control utilizes ZXing to actually scan the code and provide the result.",BarcodeScanControl,False,2015-09-11T09:34:05.277+00:00,True,False,Scan QR code with a Windows Tab device running Windows 10,,1424,False,1.1.0
Alen Pelin,2015-09-11T07:20:29.64Z,This is a tiny library that allows to override Sitecore configuration settings with values that come from Properties table of Core database. It is optimized for very high performance and miserable resources consumption.,Sitecore.AdvancedSettings,False,2015-09-17T21:22:47.433-07:00,True,False,,,1387,False,1.0.5
HristoKolev,2015-09-11T11:36:02.98Z,Contains repositories and unit of work bas class.,NetInfrastructure.Data.EF7,True,2015-09-29T00:31:13.377-07:00,True,False,,"NetInfrastructure,NetInfrastructure.Data.EF7",1147,False,0.0.1-alpha
Maksim Volkau,2015-09-11T11:39:37.427Z,DryIoc.MefAttributedModel is extension to support Microsoft Managed Extensibility Framework for DryIoc container,DryIoc.MefAttributedModel,True,2018-02-05T19:55:06.787+00:00,True,False,,"MEF,Composition,IoC,Container,Inversion-of-Control,DI,Dependency-Injection,DRY,Service-Provider,Factory",49684,False,2.0.0-rc3build322
sOUTHeR,2015-09-11T06:34:00.117Z,This is a SDK plugin in Windows Store App Universal .,Yodo1WSASDK,False,2015-12-24T19:35:41.403-08:00,True,False,Yodo1,Yodo1,4558,False,1.0.22
jeromerg,2015-09-11T12:40:47.957Z,"NCase !!Pre-Alpha, Under Construction!! Generates test cases from compact C# embedded language",NCase,False,2016-01-28T08:33:50.683-08:00,True,False,,"Compact,DSL,language,used,to,generate,test,cases,within,C#,application/,unit,tests",5188,False,0.2.0.55
$���Ǿ�$,2015-09-11T12:53:35.347Z,$ExamEvalStudent.ViewModel$,ITOO.ExamEvalStudent.ViewModel,False,2015-09-13T06:34:09.807-07:00,True,False,,,1331,False,4.0.0.1
Samuel Kamber,2015-09-10T22:31:22.267Z,A .Net  4.0 library for interacting with Stack Exchange chat. (Supports Mono.),ChatExchange.Net,True,1900-01-01T00:00:00+00:00,False,False,A .Net  4.0 library for interacting with Stack Exchange chat. (Supports Mono.),,-1,False,3.1.0-beta
Alen Pelin,2015-09-11T07:31:58.977Z,"The configurable engine to write custom data into History table, but can be switched to write data to CSV file",Sitecore.AdvancedHistory,False,2015-09-16T22:28:38.843-07:00,True,False,,,1043,False,1.0.3.1
Khalid,2015-09-11T04:21:31.257Z,"A helper class with console arguments parsing, log initialization, configuration file loading.
        Uses NLog for logging.",SimpleHelpers.ConsoleUtils,False,2016-04-27T10:02:46.71-07:00,True,False,"A helper class with console arguments parsing, log initialization, configuration file loading. 
        Uses NLog for logging.","SimpleHelpers,Template,Options,Arguments,CommandLine,Parser,Console",6343,False,1.2.1
Maksim Volkau,2015-09-11T13:34:10.75Z,DryIoc extension for OWIN,DryIoc.Owin.dll,True,2017-04-13T03:28:36.8-07:00,True,False,,"Web,ASP,OWIN,Extension,IoC,Container,Inversion-of-Control,DI,Dependency-Injection,DRY,DryIoc",23436,False,2.0.0-rc3build323
"Steffen Forkmann,Mauricio Scheffer,Colin Bull",2015-09-11T09:13:36.167Z,FAKE - F# Make - is a build automation tool for .NET. Tasks and dependencies are specified in a DSL which is integrated in F#. This package bundles all extensions.,FAKE.x64,False,2018-04-15T16:43:32.79+00:00,True,False,FAKE - F# Make - Get rid of the noise in your build scripts.,"build,fake,f#",60915,False,4.4.1
thocun,2015-09-11T03:03:50.847Z,Store data object to many type of stores,MagicalStorage,False,2015-09-11T00:48:08.503-07:00,False,False,,"Entity,Framework,MS,SQL,MySQL,C#,.NET,Persist,Storage",6153,False,1.3.7
XULU,2015-09-11T09:59:34.657Z,ITOO.BasicTeach.ViewModel,ITOO.BasicTeach.ViewModel,False,2015-09-15T20:00:47.103-07:00,True,False,,"Tag1,Tag2",4187,False,1.0.2.6
Mike Jewell,2015-09-11T04:30:19.91Z,Arragro Base library for MVC applications.,Arragro.Mvc,False,2017-12-29T21:50:21.297+00:00,True,False,,"Arragro,Arragro.Mvc",13533,False,1.0.0.50
Maksim Volkau,2015-09-11T10:48:05.823Z,"Implementation of CommonServiceLocator for DryIoc container, see rationale at https://commonservicelocator.codeplex.com/",DryIoc.CommonServiceLocator.dll,True,2016-10-20T05:59:26.74-07:00,True,False,,"Service-Locator,CommonServiceLocator,IoC,Container,Inversion-of-Control,DI,Dependency-Injection,DRY,Service-Provider,Factory",48095,False,2.0.0-rc3build321
objo,2015-09-11T11:56:58.017Z,Provides custom controls for WPF and a scene graph based on SharpDX.,HelixToolkit.Wpf.SharpDX,False,1900-01-01T00:00:00+00:00,False,False,,"wpf,SharpDX,3D",37254,False,2015.1.608
"Steffen Forkmann,Mauricio Scheffer,Colin Bull",2015-09-11T09:12:28.573Z,FAKE - F# Make - is a build automation tool for .NET. Tasks and dependencies are specified in a DSL which is integrated in F#. FAKE helper functions as library,FAKE.Lib.x64,False,2018-04-15T16:42:22.427+00:00,True,False,FAKE - F# Make - Get rid of the noise in your build scripts.,"build,fake,f#",52366,False,4.4.1
APPVYR-WIN20122\appveyor,2015-09-11T07:12:59.147Z,Created on 2015-09-11 07:12,Naos.Deployment.Core,False,2018-04-11T16:24:46.707+00:00,True,False,,,37190,False,1.0.116
SPA Tools,2015-09-11T02:17:23.017Z,Set of tools to help Single Page Application development,Appy,False,2016-02-24T19:52:48.54-08:00,True,False,,"Knockout,Spa,Tools,Utilities,Modules,Cache,AMD",3188,False,0.1.8
Maksim Volkau,2015-09-11T13:30:03.083Z,"Implementation of CommonServiceLocator for DryIoc container, see rationale at https://commonservicelocator.codeplex.com/",DryIoc.CommonServiceLocator.dll,True,2016-10-20T05:59:26.74-07:00,True,False,,"Service-Locator,CommonServiceLocator,IoC,Container,Inversion-of-Control,DI,Dependency-Injection,DRY,Service-Provider,Factory",48095,False,2.0.0-rc3build323
Ben Abelshausen,2015-09-11T10:35:23.32Z,OsmSharp is an open-source mapping project.,OsmSharp.Core,True,2016-09-29T14:20:19.907-07:00,True,False,OsmSharp is an open-source mapping project available on Android and iOS using Xamarin and other platforms using Mono/.NET,"osm,openstreetmap,routing,rendering,xamarin,mapping",19181,False,0.0.0.27-beta
"Xtensive LLC,Alexander Ovchinnikov",2015-09-10T22:41:11.53Z,Adds support for logging via NLog for DataObjects.Net,Xtensive.Orm.Logging.NLog,True,2015-01-30T11:17:03.067+00:00,True,False,,"DataObjects.Net,Extensions,Persistence,ORM,Logging",6091,False,5.0.7-RC
"Steffen Forkmann,Mauricio Scheffer,Colin Bull",2015-09-11T08:23:53.453Z,FAKE - F# Make - is a build automation tool for .NET. Tasks and dependencies are specified in a DSL which is integrated in F#. Extensions for FluentMigrator,FAKE.FluentMigrator.x64,False,2018-04-15T16:41:10.673+00:00,True,False,FAKE - F# Make - Get rid of the noise in your build scripts.,"build,fake,f#",31836,False,4.4.0
Essential Objects,2015-09-11T12:07:27.823Z,"EO.Pdf for .NET is a set of .NET components for you to easily create, read or modify PDF file in your Microsoft.NET application (both ASP.NET Web application and traditional Windows application). It also includes a powerful HTML to PDF converter that can handle almost everything a Web browser can handle.",EO.Pdf,False,2018-04-13T14:04:23.567+00:00,True,False,"EO.Pdf for .NET is a set of .NET components for you to easily create, read, modify PDF file and convert HTML to PDF in your Microsoft.NET application.","EO.Pdf,HTML,to,PDF,for,.NET,API",126657,False,15.2.53
"Steffen Forkmann,Mauricio Scheffer,Colin Bull",2015-09-11T09:10:22.98Z,FAKE - F# Make - is a build automation tool for .NET. Tasks and dependencies are specified in a DSL which is integrated in F#. Extensions for FluentMigrator,FAKE.FluentMigrator.x64,False,2018-04-15T16:41:10.673+00:00,True,False,FAKE - F# Make - Get rid of the noise in your build scripts.,"build,fake,f#",31836,False,4.4.1
PostSharp Technologies,2015-09-11T09:49:59.283Z,The #1 pattern-aware extension to C# and VB.,PostSharp,False,2018-03-29T18:36:32.507+00:00,False,False,The #1 pattern-aware extension to C# and VB. Allows developers to eradicate boilerplate by offloading repeating work from humans to machines. PostSharp contains ready-made implementations of the most common patterns and gives you the tools to build automation for your own patterns.,"postsharp,sharcrafters,post-compiler,postcompiler,aop,aspect,castle,spring,dynamic,interceptor,interception,unity,dependency,di,monitoring,instrumentation,logging,tracing,design,pattern,exception,handling",1199462,True,3.1.70
Ben Abelshausen,2015-09-11T10:28:18.517Z,OsmSharp is an open-source mapping project.,OsmSharp.Core,True,2016-09-29T14:20:19.907-07:00,True,False,OsmSharp is an open-source mapping project available on Android and iOS using Xamarin and other platforms using Mono/.NET,"osm,openstreetmap,routing,rendering,xamarin,mapping",19181,False,0.0.0.24-beta
Navdeep Kumar,2015-09-11T08:12:13.72Z,This is the Adatrix windows SDK,AdatrixWindowsSDK,False,1899-12-31T16:00:00-08:00,False,False,,,-1,False,1.0.0
Vladimír Mach,2015-09-11T12:19:13.95Z,Basic library with useful classes implementing MVVM pattern.,Mach.Wpf.Mvvm,False,2015-10-21T09:57:55.747+00:00,True,False,,"wpf,mvvm",1025,False,1.0.1
Paket team,2015-09-11T08:16:04.603Z,A package dependency manager for .NET with support for NuGet packages and GitHub repositories.,Paket,False,2018-04-17T08:54:34.933+00:00,True,False,A package dependency manager for .NET with support for NuGet packages and GitHub repositories.,"nuget,bundler,F#",825043,False,1.39.2
neuecc xin9le okazuki,2015-09-11T08:48:35.297Z,"ReactiveProperty is MVVM and Asynchronous Extensions for Reactive Extensions(Rx-Main). Target is .NET 4, WP8, Windows store apps(Win8.1), Windows Phone 8.1.",ReactiveProperty,False,2018-03-17T04:45:03.51+00:00,True,False,,"rx,mvvm,async,rx-main",79934,False,2.2.4
Outercurve Foundation,2015-07-21T19:31:36.807Z,MSBuild targets for nuget package restore and package build.,NuGet.Build,False,2016-07-29T21:17:53.24+00:00,True,False,,,3305637,True,2.8.6
Lukas Boersma,2015-09-11T08:54:07.17Z,A web framework for .NET,RailPhase,False,2017-06-21T14:37:00.33-07:00,True,False,,,679,False,1.0.0
Fredrik Rinsén,2015-09-11T10:00:25.033Z,Database installer and version handler for dnx projects,Rinsen.DatabaseInstaller,True,2018-01-03T23:30:22.21+00:00,True,False,,"dnx,database,installer",4283,False,0.1.81-beta
Maksim Volkau,2015-09-11T11:37:51.877Z,"Implementation of CommonServiceLocator for DryIoc container, see rationale at https://commonservicelocator.codeplex.com/",DryIoc.CommonServiceLocator,True,2016-10-20T05:59:17.24-07:00,True,False,,"Service-Locator,CommonServiceLocator,IoC,Container,Inversion-of-Control,DI,Dependency-Injection,DRY,Service-Provider,Factory",46383,False,2.0.0-rc3build322
Hibernating Rhinos,2015-09-11T03:13:26.377Z,RavenDB Client MvcIntegration let you include a visual profiler in your ASP.NET MVC application which will show you all the opened sessions and the time took to complete each database request. This can help you when developing with RavenDB.,RavenDB.Client.MvcIntegration,True,1900-01-01T00:00:00+00:00,False,False,A visual profiler for RavenDB that you can use in your ASP.NET MVC application.,"nosql,ravendb,raven,document,database,client,mvc",241564,True,3.0.3790-Unstable
