authors,created,description,id,is_prerelease,last_updated,listed,missing_info,summary,tags,total_downloads,verified,version"Chris Sampson,James Goodenough",2014-12-29T22:00:25.61Z,Event sourcing for Windows SqlServer,SystemDotEventSourcing.Sql.Windows,False,2015-06-02T13:21:15.2-07:00,True,False,Event sourcing for Windows SqlServer,"Event,Sourcing,SqlServer",3265,False,3.0.3
Michael Newton,2014-12-29T11:31:50.077Z,Command line Nuget wrapper.,NuGetPlus,True,2013-11-28T07:40:42.647-08:00,True,False,,BuildTools,8556,False,3.2.0-pull-3-53-ci
"Andrew Browne,Picnic Software",2014-12-28T23:46:11.513Z,An EventSourcing library,Eventful.RavenDb,True,2015-10-07T21:57:04.623-07:00,True,False,,,28404,False,0.2.328-beta
Jason Jarrett,2014-12-29T18:07:30.44Z,TypeScript Definitions (d.ts) for createjs-lib. Generated based off the DefinitelyTyped repository [git commit: ca32947b75a2b1203779dac7154ffbc232746e4d]. http://github.com/DefinitelyTyped,createjs-lib.TypeScript.DefinitelyTyped,False,2016-12-13T22:59:57.923-08:00,True,False,,"TypeScript,JavaScript",54590,False,1.0.6
Jason Jarrett,2014-12-29T14:03:13.193Z,TypeScript Definitions (d.ts) for asyncblock. Generated based off the DefinitelyTyped repository [git commit: ca32947b75a2b1203779dac7154ffbc232746e4d]. http://github.com/DefinitelyTyped,asyncblock.TypeScript.DefinitelyTyped,False,2016-12-13T22:20:52.103-08:00,True,False,,"TypeScript,JavaScript",44850,False,0.2.5
Jason Jarrett,2014-12-29T06:04:52.827Z,TypeScript Definitions (d.ts) for createjs-lib. Generated based off the DefinitelyTyped repository [git commit: a12472597c94a159811c61d41419d55400e6055a]. http://github.com/DefinitelyTyped,createjs-lib.TypeScript.DefinitelyTyped,False,2016-12-13T22:59:57.923-08:00,True,False,,"TypeScript,JavaScript",54590,False,1.0.3
Oystein Bjorke,2014-12-29T10:44:20.897Z,OxyPlot is an open source plotting library for .NET. This package contains the custom view for GTK# applications.,OxyPlot.GtkSharp,True,1899-12-31T16:00:00-08:00,False,False,,"gtk,gtk#,plotting,plot,charting,chart",80787,False,2014.1.638-alpha
Jason Jarrett,2014-12-29T18:01:39.387Z,TypeScript Definitions (d.ts) for angular-local-storage. Generated based off the DefinitelyTyped repository [git commit: ca32947b75a2b1203779dac7154ffbc232746e4d]. http://github.com/DefinitelyTyped,angular-local-storage.TypeScript.DefinitelyTyped,False,2016-12-13T22:09:59.513-08:00,True,False,,"TypeScript,JavaScript",72028,False,0.6.0
Jason Jarrett,2014-12-29T18:13:53.793Z,TypeScript Definitions (d.ts) for imap. Generated based off the DefinitelyTyped repository [git commit: ca32947b75a2b1203779dac7154ffbc232746e4d]. http://github.com/DefinitelyTyped,imap.TypeScript.DefinitelyTyped,False,2016-08-31T11:01:43.473-07:00,True,False,,"TypeScript,JavaScript",24252,False,0.7.0
Angel Calvas,2014-12-29T01:55:18.607Z,A package that contains helpers for Xamarin Forms Codebehind views it simplifies the job will make Xaml and more friednly in the Future,Blacksun.XamForms,False,1899-12-31T16:00:00-08:00,False,False,,"Xamarin,Forms,Blacksun",-1,False,3.0.1
"Andrew Browne,Picnic Software",2014-12-29T05:19:41.997Z,An EventSourcing library,Eventful.RavenDb,True,2015-10-07T21:57:04.623-07:00,True,False,,,28404,False,0.2.330-beta
Jason Jarrett,2014-12-28T22:13:27.113Z,TypeScript Definitions (d.ts) for log4js. Generated based off the DefinitelyTyped repository [git commit: a12472597c94a159811c61d41419d55400e6055a]. http://github.com/DefinitelyTyped,log4js.TypeScript.DefinitelyTyped,False,2016-06-07T23:03:44.153-07:00,True,False,,"TypeScript,JavaScript",11132,False,0.3.2
Jason Jarrett,2014-12-29T02:15:24.957Z,TypeScript Definitions (d.ts) for moment. Generated based off the DefinitelyTyped repository [git commit: a12472597c94a159811c61d41419d55400e6055a]. http://github.com/DefinitelyTyped,moment.TypeScript.DefinitelyTyped,False,2016-10-10T05:02:03.97-07:00,True,False,,"TypeScript,JavaScript",502232,False,0.9.6
Google Inc.,2014-12-29T16:57:54.53Z,"The Google APIs Client Library is a runtime client for working with Google services.
          The library supports service requests, media upload and download, etc.

          Supported Platforms:

          - .NET Framework 4

          - Windows Store apps

          - Windows Phone 8 and 8.1

          - Portable Class Libraries",Google.Apis,False,2018-02-08T11:06:13.173+00:00,True,False,,Google,3583543,True,1.9.1
Paket team,2014-12-29T19:10:07.527Z,A package dependency manager for .NET with support for NuGet packages and GitHub repositories.,Paket.Core,False,2018-04-17T08:54:04.56+00:00,True,False,A package dependency manager for .NET with support for NuGet packages and GitHub repositories.,"nuget,bundler,F#",293543,False,0.20.0
Marcin Deptuła,2014-12-29T15:56:13.007Z,F# wrapper for Stacks - reactive actor/network library,Stacks.FSharp,False,2016-07-16T09:37:47.467-07:00,True,False,Simple to use actor/network library,"F#,Socket,Network,Actor,Reactive",3241,False,1.3.3
Jason Jarrett,2014-12-29T14:14:12.4Z,TypeScript Definitions (d.ts) for jjve. Generated based off the DefinitelyTyped repository [git commit: ca32947b75a2b1203779dac7154ffbc232746e4d]. http://github.com/DefinitelyTyped,jjve.TypeScript.DefinitelyTyped,False,2016-03-22T11:40:58.567-07:00,True,False,,"TypeScript,JavaScript",21478,False,0.6.9
Luke,2014-12-29T05:06:32.73Z,Contains common components shared by Media Browser Theater and Media Browser Server. Not intended for plugin developer consumption.,MediaBrowser.Common.Internal,False,1900-01-01T00:00:00+00:00,False,False,,,127900,False,3.0.536
Jason Jarrett,2014-12-29T18:15:35.557Z,TypeScript Definitions (d.ts) for jquery. Generated based off the DefinitelyTyped repository [git commit: ca32947b75a2b1203779dac7154ffbc232746e4d]. http://github.com/DefinitelyTyped,jquery.TypeScript.DefinitelyTyped,False,2016-09-30T07:06:18.647-07:00,True,False,,"TypeScript,JavaScript",2044509,False,1.6.3
Jason Jarrett,2014-12-29T18:04:54.72Z,TypeScript Definitions (d.ts) for bingmaps. Generated based off the DefinitelyTyped repository [git commit: ca32947b75a2b1203779dac7154ffbc232746e4d]. http://github.com/DefinitelyTyped,bingmaps.TypeScript.DefinitelyTyped,False,2016-12-13T22:30:32.167-08:00,True,False,,"TypeScript,JavaScript",41723,False,0.2.2
"Aaron Jensen,Alexander Groß,Daniel Marbach,et al.",2014-12-29T21:06:23.727Z,Machine.Specifications is a Context/Specification framework geared towards removing language noise and simplifying tests.,Machine.Specifications-Signed,True,2014-12-29T13:15:20.253-08:00,True,False,Machine.Specifications Context/Specification framework,"test,unit,testing,context,specification,bdd,tdd,mspec",62112,False,0.10.0-unstable0037
"Oystein Bjorke,Vsevolod Kukol",2014-12-29T21:53:52.923Z,OxyPlot is an open source plotting library for .NET. This package contains the widget for Xwt based applications.,OxyPlot.Xwt,True,1899-12-31T16:00:00-08:00,False,False,,"xwt,gtk,gtk#,wpf,mac,plotting,plot,charting,chart",31155,False,2014.1.642-alpha
Maksim Volkau,2014-12-29T14:51:48.747Z,"DryIoc is small, fast, capable IoC container for .NET",DryIoc.dll,True,2018-03-17T16:00:47.92+00:00,True,False,,"IoC,Container,Inversion-of-Control,DI,Dependency-Injection,DRY,Service-Provider,Factory",221820,False,2.0.0-preview143
Socres,2014-12-29T13:17:41.817Z,"This package contains several helper for Asp.Net.
These include:
  - CultureBasedActionAttribute

For a full list of helpers, look at the project site.",Socres.Web.Mvc,False,2015-05-22T07:31:02.177-07:00,True,False,,,1768,False,1.0.34
Jason Jarrett,2014-12-29T10:10:30.27Z,TypeScript Definitions (d.ts) for fabricjs. Generated based off the DefinitelyTyped repository [git commit: a12472597c94a159811c61d41419d55400e6055a]. http://github.com/DefinitelyTyped,fabricjs.TypeScript.DefinitelyTyped,False,2016-09-08T11:01:59.67-07:00,True,False,,"TypeScript,JavaScript",66166,False,1.6.4
Maksim Volkau,2014-12-29T14:50:52.38Z,"Implementation of CommonServiceLocator for DryIoc container, see rationale at https://commonservicelocator.codeplex.com/",DryIoc.CommonServiceLocator,True,2016-10-20T05:59:17.24-07:00,True,False,,"Service-Locator,CommonServiceLocator,IoC,Container,Inversion-of-Control,DI,Dependency-Injection,DRY,Service-Provider,Factory",46383,False,2.0.0-preview143
"Andrew Browne,Picnic Software",2014-12-29T04:48:21.787Z,An EventSourcing library,Eventful.RavenDb,True,2015-10-07T21:57:04.623-07:00,True,False,,,28404,False,0.2.329-beta
Matt Hallmark,2014-12-29T18:09:01.75Z,A LINQ to MDX Psued-O-RM for Microsoft SQL Server Analysis Services,PercolatorAnalysisServices,False,2015-04-09T21:32:55.577+00:00,True,False,A LINQ to MDX Psued-O-RM for Microsoft SQL Server Analysis Services,"mdx,linq,linqtomdx,orm,percolator,PAS,mdxorm,mdxlinq,ssas",6371,False,0.1.4.443
Jason Jarrett,2014-12-29T22:12:56.957Z,TypeScript Definitions (d.ts) for jjve. Generated based off the DefinitelyTyped repository [git commit: ca32947b75a2b1203779dac7154ffbc232746e4d]. http://github.com/DefinitelyTyped,jjve.TypeScript.DefinitelyTyped,False,2016-03-22T11:40:58.567-07:00,True,False,,"TypeScript,JavaScript",21478,False,0.7.1
Jason Jarrett,2014-12-29T14:07:31.673Z,TypeScript Definitions (d.ts) for devextreme. Generated based off the DefinitelyTyped repository [git commit: ca32947b75a2b1203779dac7154ffbc232746e4d]. http://github.com/DefinitelyTyped,devextreme.TypeScript.DefinitelyTyped,False,2016-11-30T18:01:22.65-08:00,True,False,,"TypeScript,JavaScript",63610,False,0.7.2
47 Degrees,2014-12-29T16:18:12.5Z,A C# Android List View implementation with support for drawable cells and many other swipe related features.,FortySevenDeg.SwipeListView,False,2014-12-29T08:44:50.83-08:00,True,False,,"android,controls,swipelistview",8874,False,2.0.0
Jason Jarrett,2014-12-28T22:15:00.277Z,TypeScript Definitions (d.ts) for moment. Generated based off the DefinitelyTyped repository [git commit: a12472597c94a159811c61d41419d55400e6055a]. http://github.com/DefinitelyTyped,moment.TypeScript.DefinitelyTyped,False,2016-10-10T05:02:03.97-07:00,True,False,,"TypeScript,JavaScript",502232,False,0.9.5
Zoltu,2014-12-29T00:03:19.617Z,RouteConstraints for WebAPI v2.2,Zoltu.WebApi.RouteConstraints,False,2016-02-14T10:58:10.343-08:00,True,False,,,1162,False,1.0.5
Dusan Janosik,2014-12-29T00:50:00.25Z,"Moon.Web.Validation provides extensions for ASP.NET MVC validation framework. It supports convention-based localizeable messages, error images (with messages as tooltips) and more validators.",Moon.Web.Validation,False,1899-12-31T16:00:00-08:00,False,False,ASP.NET MVC validation extensions.,"mooncode,asp.net,mvc,validation",-1,False,3.1.2
Alisa Soft,2014-12-29T12:16:25.443Z,Sport Exchanges Hi Level wrapper library,ExchangeAPI,False,2018-04-03T14:00:11.48+00:00,True,False,,"Betfair,API,API-NG,BetDAQ",98025,False,1.226.83
"Aaron Jensen,Alexander Groß,Daniel Marbach,et al.",2014-12-29T20:19:23.927Z,Machine.Specifications.Runner.Resharper provides a dotCover runner for the Context/Specification framework Machine.Specifications,Machine.Specifications.Runner.dotCover,False,2014-12-29T12:19:23.927-08:00,True,False,Machine.Specifications Runner Resharper,"test,unit,testing,context,specification,bdd,tdd,mspec,runner,dotCover",3482,False,1.0.0
Jason Jarrett,2014-12-30T02:04:52.363Z,TypeScript Definitions (d.ts) for convict. Generated based off the DefinitelyTyped repository [git commit: ca32947b75a2b1203779dac7154ffbc232746e4d]. http://github.com/DefinitelyTyped,convict.TypeScript.DefinitelyTyped,False,2016-12-13T22:53:05.747-08:00,True,False,,"TypeScript,JavaScript",49532,False,0.7.2
Jason Jarrett,2014-12-29T22:15:15.227Z,TypeScript Definitions (d.ts) for kuromoji. Generated based off the DefinitelyTyped repository [git commit: ca32947b75a2b1203779dac7154ffbc232746e4d]. http://github.com/DefinitelyTyped,kuromoji.TypeScript.DefinitelyTyped,False,2016-03-22T12:01:17.57-07:00,True,False,,"TypeScript,JavaScript",6061,False,0.1.7
Jason Jarrett,2014-12-29T06:11:21.513Z,TypeScript Definitions (d.ts) for jquery. Generated based off the DefinitelyTyped repository [git commit: a12472597c94a159811c61d41419d55400e6055a]. http://github.com/DefinitelyTyped,jquery.TypeScript.DefinitelyTyped,False,2016-09-30T07:06:18.647-07:00,True,False,,"TypeScript,JavaScript",2044509,False,1.6.0
Jason Jarrett,2014-12-29T14:09:21.417Z,TypeScript Definitions (d.ts) for doublearray. Generated based off the DefinitelyTyped repository [git commit: ca32947b75a2b1203779dac7154ffbc232746e4d]. http://github.com/DefinitelyTyped,doublearray.TypeScript.DefinitelyTyped,False,2016-03-22T11:02:44.88-07:00,True,False,,"TypeScript,JavaScript",34460,False,0.1.8
Paket team,2014-12-29T10:43:43.267Z,A package dependency manager for .NET with support for NuGet packages and GitHub repositories.,Paket.Core,True,2018-04-17T08:54:04.56+00:00,True,False,A package dependency manager for .NET with support for NuGet packages and GitHub repositories.,"nuget,bundler,F#",293543,False,0.20.0-alpha013
Devlin Liles and Tim Rayburn,2014-12-29T14:30:48.423Z,The fastest and smoothest way to great architecture,Highway.Data,False,2017-12-21T15:02:25.16+00:00,True,False,,"Architecture,ORM,Repository,Specification,Productivity",34099,False,5.1.2
Paket team,2014-12-29T17:34:23.177Z,A package dependency manager for .NET with support for NuGet packages and GitHub repositories.,Paket.Core,True,2018-04-17T08:54:04.56+00:00,True,False,A package dependency manager for .NET with support for NuGet packages and GitHub repositories.,"nuget,bundler,F#",293543,False,0.20.0-alpha016
Michael Newton,2014-12-29T11:31:14.973Z,"DLL for adding, removing, restoring, updating and downgrading NuGet references at project and solution level.",NuGetPlus.Core,True,2013-11-28T07:40:30.84-08:00,True,False,,,4192,False,3.2.0-pull-3-53-ci
Oystein Bjorke,2014-12-29T10:47:26.557Z,OxyPlot is an open source plotting library for .NET. This package contains the custom control for Windows Phone Silverlight apps.,OxyPlot.WP8,True,1899-12-31T16:00:00-08:00,False,False,,"wp8,windows,phone,8,windowsphone,winphone,plotting,plot,charting,chart",61366,False,2014.1.638-alpha
"Aaron Jensen,Alexander Groß,Daniel Marbach,et al.",2014-12-29T20:19:52.487Z,Machine.Specifications.Runner.Resharper provides a Resharper runner for the Context/Specification framework Machine.Specifications,Machine.Specifications.Runner.Resharper,False,2014-12-29T12:19:52.487-08:00,True,False,Machine.Specifications Runner Resharper,"test,unit,testing,context,specification,bdd,tdd,mspec,runner,resharper",4024,False,1.0.0
Aidan McGinley,2014-12-29T16:40:47.867Z,Compares two NuGet packages to determine if the Major and Minor version are semantically correct based on the publicly exposed classes/methods.,SemanticVersionEnforcer,False,2015-01-01T05:41:39.97-08:00,True,False,,"NuGet,Package,'Semantic,Version',version,semantic,versioning",1811,False,2.2.0
Jon Wagner,2014-12-29T15:46:57.04Z,"An DB2 ODP.NET provider for Insight.Database so Insight.Database can do its magic on DB2.
Requires DB2's .NET provider.",Insight.Database.Providers.DB2,False,2018-03-08T19:28:35.017+00:00,True,False,,"Insight,orm,sql,DB2,micro-orm",11413,False,5.2.0
Jason Jarrett,2014-12-28T22:04:40.683Z,TypeScript Definitions (d.ts) for createjs-lib. Generated based off the DefinitelyTyped repository [git commit: a12472597c94a159811c61d41419d55400e6055a]. http://github.com/DefinitelyTyped,createjs-lib.TypeScript.DefinitelyTyped,False,2016-12-13T22:59:57.923-08:00,True,False,,"TypeScript,JavaScript",54590,False,1.0.1
Hibernating Rhinos,2014-12-29T14:53:40.723Z,RavenDB 'Authorization' bundle client extend RavenDB and add document level permissions.,RavenDB.Client.Authorization,True,1900-01-01T00:00:00+00:00,False,False,,"nosql,ravendb,raven,document,database,client,bundles,authorization",166995,True,3.0.3557-Unstable
"Andrew Browne,Picnic Software",2014-12-28T23:46:36.787Z,An EventSourcing library. Test helpers.,Eventful.Testing,True,2015-10-07T21:57:42.127-07:00,True,False,,,16304,False,0.2.328-beta
"Aaron Jensen,Alexander Groß,Daniel Marbach,et al.",2014-12-29T19:34:37.487Z,Machine.Specifications.Runner.Resharper provides a Resharper runner for the Context/Specification framework Machine.Specifications,Machine.Specifications.Runner.Resharper9,True,2016-04-19T01:53:38.8-07:00,True,False,Machine.Specifications Runner Resharper,"test,unit,testing,context,specification,bdd,tdd,mspec,runner,resharper",9563,False,0.10.0-Unstable0010
Jason Jarrett,2014-12-29T06:06:34.723Z,TypeScript Definitions (d.ts) for dojo. Generated based off the DefinitelyTyped repository [git commit: a12472597c94a159811c61d41419d55400e6055a]. http://github.com/DefinitelyTyped,dojo.TypeScript.DefinitelyTyped,False,2016-09-07T09:53:06.72-07:00,True,False,,"TypeScript,JavaScript",52412,False,0.6.4
Dreams Innovative Technologies LLC,2014-12-29T14:19:32.873Z,Models for MoySklad REST API,DreamsIT.MoySklad.RestClient.Models,False,2015-02-02T06:24:23.79-08:00,True,False,,,2435,False,1.0.4
"Andrew Browne,Picnic Software",2014-12-28T23:45:46.627Z,An EventSourcing library,Eventful,True,2015-10-07T21:56:58.313-07:00,True,False,,,56261,False,0.2.328-beta
Paket team,2014-12-29T17:35:21.717Z,A package dependency manager for .NET with support for NuGet packages and GitHub repositories.,Paket,True,2018-04-17T08:54:34.933+00:00,True,False,A package dependency manager for .NET with support for NuGet packages and GitHub repositories.,"nuget,bundler,F#",825043,False,0.20.0-alpha016
Media Browser Team,2014-12-29T05:06:39.103Z,Contains common model objects and interfaces used by all Media Browser solutions.,MediaBrowser.Model.Signed,False,1899-12-31T16:00:00-08:00,False,False,,,42151,False,3.0.536
Jon Wagner,2014-12-29T15:45:37.067Z,"A lightweight, fast, convenient micro-ORM that allows you to get objects in and out of your database with the most control and least overhead.
The Core package only includes the core engine. It does not include the default providers.
Install this package if you don't need the SQL Server, ODBC or OLEDB providers, for example, when building a mobile app.",Insight.Database.Core,False,2018-03-08T19:28:09.47+00:00,True,False,,"Insight,orm,sql,micro-orm,sqlserver,db2,glimpse,miniprofiler,mysql,oracle,postgres,sybase,sybasease,sqlite,sqllite",74362,False,5.2.0
Jason Jarrett,2014-12-29T06:15:24.633Z,TypeScript Definitions (d.ts) for moment. Generated based off the DefinitelyTyped repository [git commit: a12472597c94a159811c61d41419d55400e6055a]. http://github.com/DefinitelyTyped,moment.TypeScript.DefinitelyTyped,False,2016-10-10T05:02:03.97-07:00,True,False,,"TypeScript,JavaScript",502232,False,0.9.7
pjlammertyn,2014-12-29T18:14:57.237Z,A parser for the Medar format.,MedarParser,False,2017-01-04T02:01:11.03-08:00,True,False,,"Medar,Parser",1995,False,0.0.5
Jason Jarrett,2014-12-29T10:14:28.857Z,TypeScript Definitions (d.ts) for jquery.address. Generated based off the DefinitelyTyped repository [git commit: a12472597c94a159811c61d41419d55400e6055a]. http://github.com/DefinitelyTyped,jquery.address.TypeScript.DefinitelyTyped,False,2016-03-22T11:43:20.09-07:00,True,False,,"TypeScript,JavaScript",29577,False,1.1.6
Jason Jarrett,2014-12-29T10:09:30.917Z,TypeScript Definitions (d.ts) for ejs-locals. Generated based off the DefinitelyTyped repository [git commit: a12472597c94a159811c61d41419d55400e6055a]. http://github.com/DefinitelyTyped,ejs-locals.TypeScript.DefinitelyTyped,False,2016-03-22T11:05:41.9-07:00,True,False,,"TypeScript,JavaScript",33764,False,0.2.4
Jason Jarrett,2014-12-30T02:05:39.747Z,TypeScript Definitions (d.ts) for createjs-lib. Generated based off the DefinitelyTyped repository [git commit: ca32947b75a2b1203779dac7154ffbc232746e4d]. http://github.com/DefinitelyTyped,createjs-lib.TypeScript.DefinitelyTyped,False,2016-12-13T22:59:57.923-08:00,True,False,,"TypeScript,JavaScript",54590,False,1.0.8
Jason Jarrett,2014-12-29T06:08:52.257Z,TypeScript Definitions (d.ts) for fast-stats. Generated based off the DefinitelyTyped repository [git commit: a12472597c94a159811c61d41419d55400e6055a]. http://github.com/DefinitelyTyped,fast-stats.TypeScript.DefinitelyTyped,False,2016-03-22T11:12:16.363-07:00,True,False,,"TypeScript,JavaScript",29976,False,0.2.3
"Aaron Jensen,Alexander Groß,Daniel Marbach,et al.",2014-12-29T21:15:20.253Z,Machine.Specifications is a Context/Specification framework geared towards removing language noise and simplifying tests.,Machine.Specifications-Signed,True,2014-12-29T13:15:20.253-08:00,True,False,Machine.Specifications Context/Specification framework,"test,unit,testing,context,specification,bdd,tdd,mspec",62112,False,0.10.0-unstable0039
Jason Jarrett,2014-12-29T14:15:05.677Z,TypeScript Definitions (d.ts) for jquery.address. Generated based off the DefinitelyTyped repository [git commit: ca32947b75a2b1203779dac7154ffbc232746e4d]. http://github.com/DefinitelyTyped,jquery.address.TypeScript.DefinitelyTyped,False,2016-03-22T11:43:20.09-07:00,True,False,,"TypeScript,JavaScript",29577,False,1.1.7
Jason Jarrett,2014-12-29T22:09:51.51Z,TypeScript Definitions (d.ts) for express-partials. Generated based off the DefinitelyTyped repository [git commit: ca32947b75a2b1203779dac7154ffbc232746e4d]. http://github.com/DefinitelyTyped,express-partials.TypeScript.DefinitelyTyped,False,2016-03-22T11:10:32.06-07:00,True,False,,"TypeScript,JavaScript",30328,False,0.2.7
Oystein Bjorke,2014-12-29T21:51:39.743Z,OxyPlot is an open source plotting library for .NET. This package contains the custom control for Silverlight.,OxyPlot.Silverlight,True,1899-12-31T16:00:00-08:00,False,False,,"silverlight,plotting,plot,charting,chart",133853,False,2014.1.642-alpha
Nuvi,2014-12-29T20:51:44.737Z,i18n Platform built by Nuvi,Lingual,False,2015-01-20T09:30:50.433-08:00,True,False,,"i18n,Nuvi",2432,False,1.2.0
Jason Jarrett,2014-12-29T06:07:43Z,TypeScript Definitions (d.ts) for ejs-locals. Generated based off the DefinitelyTyped repository [git commit: a12472597c94a159811c61d41419d55400e6055a]. http://github.com/DefinitelyTyped,ejs-locals.TypeScript.DefinitelyTyped,False,2016-03-22T11:05:41.9-07:00,True,False,,"TypeScript,JavaScript",33764,False,0.2.3
"Aaron Jensen,Alexander Groß,Daniel Marbach,et al.",2014-12-29T08:23:49.99Z,Machine.Specifications is a Context/Specification framework geared towards removing language noise and simplifying tests.,Machine.Specifications,True,2017-10-11T10:18:09.38+00:00,True,False,Machine.Specifications Context/Specification framework,"test,unit,testing,context,specification,bdd,tdd,mspec",565482,False,0.10.0-unstable0032
"Aaron Jensen,Alexander Groß,Daniel Marbach,et al.",2014-12-29T20:00:21.86Z,Machine.Specifications.Runner.Resharper provides a Resharper runner for the Context/Specification framework Machine.Specifications,Machine.Specifications.Runner.Resharper9,True,2016-04-19T01:53:38.8-07:00,True,False,Machine.Specifications Runner Resharper,"test,unit,testing,context,specification,bdd,tdd,mspec,runner,resharper",9563,False,1.0.0-Beta0000-0001
Jason Jarrett,2014-12-29T02:02:51.177Z,TypeScript Definitions (d.ts) for asyncblock. Generated based off the DefinitelyTyped repository [git commit: a12472597c94a159811c61d41419d55400e6055a]. http://github.com/DefinitelyTyped,asyncblock.TypeScript.DefinitelyTyped,False,2016-12-13T22:20:52.103-08:00,True,False,,"TypeScript,JavaScript",44850,False,0.2.2
Rohit,2014-12-29T08:11:38.79Z,Microsoft.ReportViewer Runtime 2012,Microsoft.ReportViewer.Windows,False,2014-12-29T00:11:38.79-08:00,True,False,,"Microsoft,ReportViewer",38234,False,11.0.3452
Jason Jarrett,2014-12-29T18:08:01.427Z,TypeScript Definitions (d.ts) for devextreme. Generated based off the DefinitelyTyped repository [git commit: ca32947b75a2b1203779dac7154ffbc232746e4d]. http://github.com/DefinitelyTyped,devextreme.TypeScript.DefinitelyTyped,False,2016-11-30T18:01:22.65-08:00,True,False,,"TypeScript,JavaScript",63610,False,0.7.3
Jason Jarrett,2014-12-29T14:00:44.527Z,TypeScript Definitions (d.ts) for amqp-rpc. Generated based off the DefinitelyTyped repository [git commit: ca32947b75a2b1203779dac7154ffbc232746e4d]. http://github.com/DefinitelyTyped,amqp-rpc.TypeScript.DefinitelyTyped,False,2016-12-13T22:05:47.253-08:00,True,False,,"TypeScript,JavaScript",53414,False,0.7.0
"Aaron Jensen,Alexander Groß,Daniel Marbach,et al.",2014-12-29T21:14:05.913Z,Machine.Specifications is a Context/Specification framework geared towards removing language noise and simplifying tests.,Machine.Specifications,True,2017-10-11T10:18:09.38+00:00,True,False,Machine.Specifications Context/Specification framework,"test,unit,testing,context,specification,bdd,tdd,mspec",565482,False,0.10.0-unstable0039
Paket team,2014-12-29T19:11:00.403Z,A package dependency manager for .NET with support for NuGet packages and GitHub repositories.,Paket,False,2018-04-17T08:54:34.933+00:00,True,False,A package dependency manager for .NET with support for NuGet packages and GitHub repositories.,"nuget,bundler,F#",825043,False,0.20.0
Media Browser Team,2014-12-29T04:41:12.79Z,Contains core components required to build plugins for Media Browser Server.,MediaBrowser.Server.Core,False,2018-04-14T14:59:39.967+00:00,True,False,,,137580,False,3.0.535
Jason Jarrett,2014-12-29T14:13:39.887Z,TypeScript Definitions (d.ts) for jjv. Generated based off the DefinitelyTyped repository [git commit: ca32947b75a2b1203779dac7154ffbc232746e4d]. http://github.com/DefinitelyTyped,jjv.TypeScript.DefinitelyTyped,False,2016-03-22T11:40:52.117-07:00,True,False,,"TypeScript,JavaScript",22711,False,0.6.9
