authors,created,description,id,is_prerelease,last_updated,listed,missing_info,summary,tags,total_downloads,verified,version
"James Newkirk,Brad Wilson",2015-09-27T18:56:49.267Z,"Console and Visual Studio runner for xUnit.net.

Supported platforms:
- DNX 4.5.1
- DNX Core 5+",xunit.runner.dnx,True,1899-12-31T16:00:00-08:00,False,False,,,-1,False,2.1.0-beta5a-build185
Qsys Sverige AB,2015-09-28T11:38:58.39Z,QuickPick One Database assembly server component,QuickPickOneCLR,False,2018-02-19T10:36:42.787+00:00,True,False,,"Apollo,Apollo13,Quickpick,Qsys",87785,False,1.0.15222.60
Carlos G. Sarmiento,2015-09-28T06:15:26.517Z,The dynamic configuration manager for .NET,DynamiConf.HttpLocator,False,2015-09-28T20:27:17.853-07:00,True,False,,"Configuration,Dynamic,DynamiConf,Conf,AppSettings,EnvironmentVar",908,False,0.2.3
Konstantinos Papakonstantinou,2015-09-27T23:07:54.237Z,A simple wrapper for reading typed values from ConfigurationManager.AppSettings,SimpleAppSettings,False,2015-09-27T16:46:23.393-07:00,False,False,,,975,False,0.1.0.3
Roman Ivantsov,2015-09-28T07:53:06.2Z,VITA ORM driver for MySql.,Vita.Data.MySql,False,2017-07-24T23:38:51.463+00:00,True,False,,"VITA,ORM,MySql",5807,False,1.6.7
rasmus,2015-09-28T11:30:08.98Z,Hangfire job scheduling support for EventFlow,EventFlow.Hangfire,False,2018-02-25T21:51:05.65+00:00,True,False,,"CQRS,ES,event,sourceing,eventstore,hangfire,job,scheduling,tasks",13791,False,0.17.1134
Cady.IO,2015-09-28T00:34:17.39Z,A collection of .Net Utilities,Dewey.Net,False,2016-06-26T15:22:29.937-07:00,True,False,,,8835,False,2.7.5
Octopus Deploy,2015-09-28T02:35:14.77Z,"Octopus Deploy is a user-friendly automated deployment tool for .NET developers. 
    
This package contains the client library for the HTTP API in Octopus.",Octopus.Client,False,2018-04-09T23:30:11.58+00:00,True,False,Client library for the Octopus Deploy HTTP API.,,171574,False,3.1.2
"XAct Software Solutions,Inc.",2015-09-28T10:29:38.35Z,An XActLib assembly: base library for code to do with image manipulation or analysis.,XAct.Imaging,False,2017-02-08T17:57:21.133-08:00,True,False,,"XAct,XActLib",54045,False,0.0.5003
苏震巍,2015-09-28T07:15:29.967Z,"微信公众账号SDK：Senparc.Weixin.dll
（作为Senparc.Weixin.MP.dll及Senparc.Weixin.QY.dll的基类）
开源项目：
https://github.com/JeffreySu/WeiXinMPSDK",Senparc.Weixin,False,2018-02-28T10:25:28.963+00:00,True,False,,,107884,False,4.1.0
"PulseBridge,Inc.",2015-09-25T03:40:15.84Z,Tooling support for cross-platform build automation.,PulseBridge.Condo,True,2016-06-17T18:35:26.077+00:00,False,False,,"build,asp.net,dnx,xplat",5271,False,1.0.0-rc-00039
新生命开发团队,2015-09-28T02:07:32.983Z,包括并大于Orm的数据映射框架,NewLife.XCode,False,2018-04-14T10:24:58.587+00:00,True,False,,"新生命团队,X组件,NewLife",6905,False,8.20.5749.18133
Gibraltar Software,2015-09-28T00:06:32.55Z,"NLog is a powerful, flexible logging system available for all .NET platforms.  It's a great choice when you need very sophisticated log gathering capabilities such as sending log messages from clients to servers, multiple logging levels used simultaneously in the application, and a range of other sophisticated features. This package enables NLog message to route into Loupe - a black box recorder for your application that can gather data from wherever your application is run and get it back to you, anywhere in the world.",Gibraltar.Agent.NLog2,False,2018-03-22T05:22:45.26+00:00,True,False,"Connects NLog with Loupe - a black box recorder for your application that can gather data from wherever your application is run and get it back to you, anywhere in the world.","Loupe,Logging",20905,False,4.0.0.3015
AmamiyaYuuko,2015-09-28T03:38:47.183Z,ASP.Net vNext Extensions,CodeComb.vNext,True,1899-12-31T16:00:00-08:00,False,False,,"vNext,ASP.Net,MVC",-1,False,1.0.44-beta8-15870
"XAct Software Solutions,Inc.",2015-09-28T08:55:01.25Z,An XActLib assembly: core assembly for dealing with DirectoryServices of various kinds.,XAct.DirectoryServices,False,2017-02-08T17:57:12.977-08:00,True,False,,"XAct,XActLib",61421,False,0.0.5002
"XAct Software Solutions,Inc.",2015-09-22T11:33:29.067Z,An ActLib Assembly: OBSOLETE (now part of XAct.Core.PCL),XAct.Domain,False,2017-02-08T17:57:14.227-08:00,False,False,,"XAct,XActLib",75513,False,0.0.5001
Roman Ivantsov,2015-09-28T07:52:10.093Z,"VITA ORM standard modules - Login, Logging, EncryptedData, Party, others.",Vita.Modules,False,2017-07-24T23:38:38.273+00:00,True,False,,"VITA,ORM,LINQ",6003,False,1.6.7
S2 UG,2015-09-28T07:28:54.843Z,[S2] portable utility library,s2Libs.s2PortableUtils,False,2016-01-11T12:16:39.61+00:00,True,False,Contains base classes and utilities useful for all kinds of projects in a portable manner.,,2606,False,2.0.14
dantro,2015-09-28T10:53:16.253Z,A sample library that allows methods have attribute with specific properties.,Method.Attribute,False,2015-09-28T10:53:16.253+00:00,True,False,,"Method,Attribute,TestCase",967,False,2.0.1
"XAct Softwaer Solutions,Inc.",2015-09-28T10:26:29.357Z,An XActLib Assembly: a base library for accessing Graphs via Repositories.,XAct.Graphs.Persistence.Db,False,2015-11-02T03:25:55.57-08:00,True,False,,"XAct,XActLib",54531,False,0.0.5003
"XAct Software Solutions,Inc.",2015-09-28T10:24:41.477Z,An XActib Assembly: entities used by XAct.Graphs,XAct.Graphs.Entities,False,2017-02-08T17:57:17.18-08:00,True,False,,"XAct,XActLib",56046,False,0.0.5003
"XAct Software Solutions,Inc.",2015-09-28T11:17:07.483Z,An XActLib assembly: a base library for producing Workflow inproc/server side Events/Commands.,XAct.Workflows.Server,False,2017-02-09T01:58:16.603+00:00,True,False,,"XAct,XActLib",58240,False,0.0.5003
Bryan Apellanes,2015-09-28T00:50:45.023Z,Basic email composer for Bam,Bam.Net.Messaging,False,2018-01-25T03:46:54.84+00:00,True,False,,,10505,False,1.0.8
Microsoft,2015-09-28T05:34:10.713Z,"This client library adds file management capabilities to client applications built with the Azure Mobile Apps SDK. For more information, check out https://www.windowsazure.com/mobile.",WindowsAzure.MobileServices.Files,True,1899-12-31T16:00:00-08:00,False,False,Windows Azure Mobile Apps File Management SDK.,"microsoft,windows,azure,mobile,services,windowsazureofficial",-1,False,2.0.0-alpha
Alain Defrance,2015-09-28T07:13:30.923Z,Lightweight documentation tool,Projbook,False,2016-10-27T20:51:02.14-07:00,False,False,,,8257,False,0.1.2
Radar-Soft,2015-09-28T09:24:35.407Z,The package contains evaluation of RadarCube ASP.NET MVC R-OLAP controls. The controls are embedded in the ASP.NET MVC application to demonstrate Relational OLAP analysis using functionality that you so need.,RadarCube.MvcControls.ROLAP,True,2017-01-31T17:17:51.05+00:00,True,False,RadarCube controls for Relational OLAP analysis in ASP.NET MVC aplication,"radarcube,olap,controls,mvc,bi",708,False,1.0.0-beta
Alain Defrance,2015-09-28T06:58:04.833Z,Lightweight documentation tool,Projbook,False,2016-10-27T20:51:02.14-07:00,False,False,,,8257,False,0.1.1
Team XSockets Sweden AB,2015-09-28T07:57:13.727Z,Core dependencies,XSockets.Core,False,2017-11-20T17:57:15.247+00:00,True,False,Contains assemblies for developing realtime modules in XSockets.NET,xsockets,70114,False,5.0.0
Kazunori Sakamoto,2015-09-28T08:13:51.797Z,Code2Xml is a parser collection that inter-converts source code and XML-based concrete syntax trees (CSTs) supporting multiple programming languages.,Code2Xml,False,2016-12-18T22:09:25.04-08:00,True,False,,"Library,Parser,XML,Programming,Language",24122,False,3.3.6.102
rasmus,2015-09-28T11:30:14.797Z,MSSQL support for EventFlow,EventFlow.MsSql,False,2018-02-25T21:51:16.947+00:00,True,False,,"CQRS,ES,event,sourceing,mssql",22115,False,0.17.1134
Bart Read,2015-09-28T11:09:08.847Z,Dapper.SimpleLoad makes it easy to load complex object hierarchies from a relational database.,Dapper.SimpleLoad,False,2018-03-16T10:09:38.897+00:00,True,False,,"Dapper,SQL,micro-ORM",16114,False,1.0.31
Bryan Apellanes,2015-09-28T00:38:36.893Z,Tools for authoring web based applications,BamToolkit,False,2018-01-25T03:42:54.193+00:00,True,False,,,10778,False,1.0.8
nukedbit,2015-09-28T09:53:54.72Z,provide a facility to execute a container on a dev machine and get open ports,NukedBit.DockerTesting,False,2015-10-05T05:42:01.297-07:00,True,False,,"mongodb,docker",1874,False,0.1.13
Paket team,2015-09-28T08:58:34.913Z,A package dependency manager for .NET with support for NuGet packages and GitHub repositories.,Paket.PowerShell,False,2017-04-28T07:19:40.903+00:00,True,False,A package dependency manager for .NET with support for NuGet packages and GitHub repositories.,"nuget,bundler,F#",135731,False,2.4.0
Gibraltar Software,2015-09-28T00:53:30.56Z,HttpModule that handles logging of messages/exceptions from Loupe JavaScript agent.,Loupe.Agent.Web.Module,False,2018-03-18T02:22:19.127+00:00,True,False,,"Loupe,Logging,ASP.NET",1604,False,4.0.0.3015
Andy Dote,2015-09-27T22:54:25.203Z,A PostgreSql storage provider for Ledger,Ledger.Stores.Postgres,False,2016-07-30T07:27:02.457-07:00,True,False,,"eventsourcing,es,ledger",2360,False,1.0.1
Carlos G. Sarmiento,2015-09-28T06:16:47.93Z,The dynamic configuration manager for .NET,DynamiConf.JsonInterpreter,False,2015-09-28T20:28:23.917-07:00,True,False,,"Configuration,Dynamic,DynamiConf,Conf,Json",1041,False,0.2.3
Radar-Soft,2015-09-28T12:20:13.787Z,RadarCube ASP.NET OLAP controls for data visualization. Controls are embedded into an ASP.NET Web Forms aplication.,RadarSoft.RadarCube.Web,False,2017-11-02T07:52:18.853+00:00,True,False,ASP.NET OLAP Grid and Chart controls rendered using HTML or Silverlight.,"radarcube,asp.net,olap,controls,bi",1531,False,4.0.0
Streamcoders.com,2015-09-28T08:45:38.603Z,Is a comprehensive library for handling audio/video codecs and streaming technologies.,Streamcoders.MediaSuite.x86,False,2017-04-24T01:50:45.473-07:00,True,False,,"audio,video,streaming,html5,rtsp,rtp,h.264,vp8",101110,False,4.0.825
"XAct Software Solutions,Inc.",2015-09-28T10:16:01.527Z,An XActLib assembly: a library to develop Uml diagrams describing functionality of an application.,XAct.Diagnostics.Uml,False,2017-02-08T17:57:09.243-08:00,True,False,,"XAct,XActLib",6745,False,0.0.5003
Renato Golia,2015-09-28T06:56:30.717Z,Rx support for Nybus.,Nybus.Rx,False,2016-11-27T17:36:16.363-08:00,True,False,,,2859,False,0.4.0.65
Cady.IO,2015-09-28T03:13:47.95Z,A collection of .Net Utilities,Dewey.Net,False,2016-06-26T15:22:29.937-07:00,True,False,,,8835,False,2.7.6
"XAct Software Solutions,Inc.",2015-09-28T10:31:27Z,An XActLib assembly: Library to provide services that encapsulate Vision methods,XAct.Imaging.Vision,False,2017-02-09T01:57:22.82+00:00,True,False,,"XAct,XActLib",55104,False,0.0.5003
"XAct Software Solutions,Inc.",2015-09-28T08:26:58.35Z,An XActLib assembly:providing persistence (using EF) to XAct.Data.DataSources services.,XAct.Data.DataSources.Persistence.EF,False,2017-02-08T17:56:59.617-08:00,True,False,,"XAct,XActLib",12674,False,0.0.5002
"XAct Software Solutions,Inc.",2015-09-28T10:00:56.387Z,An XActLib assembly: services to manage an ArangoDB client.,XAct.Data.ArangoDB,False,2017-02-08T17:56:58.257-08:00,True,False,,"XAct,XActLib",8199,False,0.0.5003
Peter Groenewegen,2015-06-13T08:03:40.607Z,"WFC behavior to log soap messages and headers with log4net only by configuration. No need to change you code. The logging will be done at info level.
     
      The package will add the behavior extention to your canfig, to use it on endpoint add: behaviorConfiguration=""log4NetBehavior""",WcfBehaviorSoapLog4net,False,2015-09-24T11:50:41.74-07:00,False,False,This package enables you to log the incoming and outgoing soap of your wcf client or server connection with log4net.,"soap,wcf,message,headers,logging,log4net",3075,False,1.5.0
"XAct Software Solutions,Inc.",2015-09-28T08:23:31.74Z,"An XAct Library Assembly: An Assembly that contains interfaces common to datastore, while not limiting it to DBMS (see XAct.Data.Db, XAct.Data.EF, for such functionality).",XAct.Data,False,2017-02-08T17:56:56.587-08:00,True,False,,"XAct,XActLib",98101,False,0.0.5002
"XAct Software Solutions,Inc.",2015-09-28T11:04:35.933Z,"An XActLib assembly: the base assembly for Settings (app,host).",XAct.Settings,False,2017-02-09T01:57:56.947+00:00,True,False,,"XAct,XActLib",62078,False,0.0.5003
Bastian Eicher,2015-09-25T13:54:07.507Z,"This package provides implementations for Dehydrator's repository interfaces using Entity Framework.
Install this package in your controller if you use Entity Framework.",Dehydrator.EntityFramework,False,2016-10-17T03:54:58.043-07:00,True,False,Implements Dehydrator interfaces for Microsoft's Entity Framework,"Dehydrate,Entity,JSON,REST,WebAPI,ORM,EntityFramework",2002,False,0.1.0
"XAct Software Solutions,Inc.",2015-09-28T08:24:29.3Z,An XActLib assembly: services to manage an ArangoDB client.,XAct.Data.ArangoDB,False,2017-02-08T17:56:58.257-08:00,True,False,,"XAct,XActLib",8199,False,0.0.5002
Slav Ivanyuk,2015-09-28T08:16:47.57Z,BrandRetailers webservices API wrapper.,BrandRetailersAccess,False,2015-09-28T01:16:47.57-07:00,True,False,BrandRetailers webservices API wrapper.,BrandRetailers,813,False,1.0.5
"PulseBridge,Inc.",2015-09-25T18:50:42.18Z,Tooling support for cross-platform build automation.,PulseBridge.Condo,True,2016-06-17T18:35:26.077+00:00,False,False,,"build,asp.net,dnx,xplat",5271,False,1.0.0-rc-00049
Notificatio team,2015-04-13T16:24:29.927Z,Send Telegram notifications with one line of C#,Notificatio.TelegramClient,False,1899-12-31T16:00:00-08:00,False,False,,"C#,telegram,MTProto,notification,notificatio",-1,False,1.0.0
"XAct Software Solutions,Inc.",2015-09-28T10:33:15.107Z,An XActLib assembly: a library to work with the essentials of DotNetZip.,XAct.IO.Compression.DotNetZip,False,2017-02-09T01:57:22.29+00:00,True,False,,"XAct,XActLib",92247,False,0.0.5003
MBIT Solutions GmbH,2015-09-28T07:14:59.447Z,Sends razor mail templates,mbit.mail,False,1900-01-01T00:00:00+00:00,False,False,,"Mail,E-Mail,Razor,Template,Mbit",-1,False,1.1.5749.16522
"XAct Software Solutions,Inc.",2015-09-28T08:30:51.85Z,An XActLib assembly: a library for persisting and finding documents stored in Lucene.NET,XAct.Data.LuceneNet,False,2017-02-08T17:57:04.803-08:00,True,False,,"XAct,XActLib",8884,False,0.0.5002
"XAct Software Solutions,Inc.",2015-09-28T09:17:07.427Z,An XActLib assembly: a library to work with the essentials of DotNetZip.,XAct.IO.Compression.DotNetZip,False,2017-02-09T01:57:22.29+00:00,True,False,,"XAct,XActLib",92247,False,0.0.5002
Thomas Blitz,2015-09-28T00:26:18.527Z,Validate and encrypt passwords based on hashing and salting passwords. Use for basic authentication.,Krypt,False,2015-09-27T17:26:18.527-07:00,True,False,,"Encryption,Krypt,Password,Salt,SHA512,basic,authentication",446,False,1.0.1
Bastian Eicher,2015-09-25T13:56:50.093Z,"This package provides base classes and sample configuration for building WebAPI controllers that use a dehydrated data model.
Install this package in your controller if you use WebAPI.",Dehydrator.WebApi,False,2016-10-17T10:55:18.073+00:00,True,False,Base classes for creating WebAPI controllers using Dehydrator,"Dehydrate,Entity,JSON,REST,WebAPI,ORM,EntityFramework",2070,False,0.1.0
Dimension Data,2015-09-28T05:52:51.6Z,"Provides a client to fully manage the CaaS including deploying machines, managing backups etc.",DD.CBU.Compute.Api.Client,True,2018-04-05T01:25:32.323+00:00,True,False,Dimension Data Compute as a Service client API.,,22495,False,3.0.26-develop
"XAct Software Solutions,Inc.",2015-09-28T08:25:52.167Z,An XActLib assembly: a library of services to manage information regarding data sources.,XAct.Data.DataSources,False,2017-02-09T01:56:58.743+00:00,True,False,,"XAct,XActLib",12028,False,0.0.5002
"XAct Software Solutions,Inc.",2015-09-28T10:06:08.047Z,An XActLib assembly: a library for persisting and finding documents stored in Lucene.NET,XAct.Data.LuceneNet,False,2017-02-08T17:57:04.803-08:00,True,False,,"XAct,XActLib",8884,False,0.0.5003
"XAct Software Solutions,Inc.",2015-09-28T10:19:03.017Z,An XActLib assembly: Library of code to access ActiveDirectory resources.,XAct.DirectoryServices.ActiveDirectory,False,2017-02-08T17:57:13.227-08:00,True,False,,"XAct,XActLib",62236,False,0.0.5003
"XAct Software Solutions,Inc.",2015-09-28T08:57:15.21Z,An ActLib Assembly: OBSOLETE (now part of XAct.Core.PCL),XAct.Domain,False,2017-02-08T17:57:14.227-08:00,True,False,,"XAct,XActLib",75513,False,0.0.5002
"XAct Software Solutions,Inc.",2015-09-28T11:03:16.95Z,An XActLib assembly: a Library for working with Ninject,XAct.Services.IoC.Ninject,False,2017-02-09T01:57:54.807+00:00,True,False,,"XAct,XActLib",94442,False,0.0.5003
"XAct Software Solutions,Inc.",2015-09-28T08:18:34.863Z,An XActLib assembly: common code specific Collections,XAct.Collections,False,2017-02-08T17:56:52.837-08:00,True,False,,"XAct,XActLib",100518,False,0.0.5002
"XAct Software Solutions,Inc.",2015-09-28T11:01:18.797Z,An XActLib assembly: a library of code to work with Windows Services.,XAct.ServiceProcess,False,2017-02-09T01:57:57.557+00:00,True,False,,"XAct,XActLib",81753,False,0.0.5003
Furore and contributors,2015-09-28T12:45:43.097Z,FHIR Server Engine - handling REST calls and service layer,Spark.Engine,True,2017-01-18T14:36:59.103+00:00,True,False,FHIR Server Engine - handling REST calls and service layer,"HL7,FHIR,server,Furore,Spark,core,engine,library",3864,False,0.50.3-alpha7
Dave Senn,2015-09-28T07:21:12.47Z,Extend is a set of .Net extension methods build as portable class library. Extend enhance the .Net framework by adding a bunch of methods to increase developer’s productivity.,Extend,True,2017-11-04T17:20:53.59+00:00,True,False,,"C#,Extensions,Extend,Portable,Extension,Methods,.Net,Library,PCL",19966,False,1.1.4.1-alpha
m_sobati,2015-09-28T07:31:07.72Z,My package description.,MyShatelPackage,False,2015-09-28T00:31:07.72-07:00,True,False,,,261,False,1.0.0
"XAct Software Solutions,Inc.",2015-09-28T10:58:26.417Z,An XActLib assembly: library of services and helper classes for working with Certificates.,XAct.Security.Certificates,False,2017-02-08T17:57:51.9-08:00,True,False,,"XAct,XActLib",4875,False,0.0.5003
Logistical Labs,2015-09-28T12:00:19.683Z,Rex client library,RexClient,False,2018-03-21T11:12:37.46+00:00,True,False,,,46507,False,1.6.25.21228
"PulseBridge,Inc.",2015-09-25T02:08:38.597Z,Tooling support for cross-platform build automation.,PulseBridge.Condo,True,2016-06-17T18:35:26.077+00:00,False,False,,,5271,False,1.0.0-rc-00035
"XAct Software Solutions,Inc.",2015-09-28T10:20:03.813Z,An ActLib Assembly: OBSOLETE (now part of XAct.Core.PCL),XAct.Domain,False,2017-02-08T17:57:14.227-08:00,True,False,,"XAct,XActLib",75513,False,0.0.5003
"XAct Software Solutions,Inc.",2015-09-28T10:45:27.047Z,An XActLib assembly: wrapper around ClearScript Javascript engine.,XAct.Languages.JS.ClearScript,False,2017-02-08T17:57:41.307-08:00,True,False,,"XAct,XActLib",9293,False,0.0.5003
"XAct Software Solutions,Inc.",2015-09-28T10:30:33.837Z,An XActLib assembly: a Library for working with Tiff Images (ie processing incoming Faxes).,XAct.Imaging.TIFF,False,2017-02-08T17:57:22.337-08:00,True,False,,"XAct,XActLib",56855,False,0.0.5003
"XAct Software Solutions,Inc.",2015-09-28T10:50:21.37Z,"An XActLib assembly: an implementation of the services defined in XAct.ObjectMapping, using AutoMapper.",XAct.ObjectMapping.AutoMapper,False,2017-02-09T01:57:41.667+00:00,True,False,,"XAct,XActLib",57394,False,0.0.5003
"XAct Software Solutions,Inc.",2015-09-28T10:22:45.82Z,An XActLib assembly: a Library to work with QuickGraph Graphs.,XAct.Graphs,False,2017-02-09T01:57:14.243+00:00,True,False,,"XAct,XActLib",57276,False,0.0.5003
Microsoft,2015-09-28T05:34:10.713Z,"This client library adds file management capabilities to client applications built with the Azure Mobile Apps SDK. For more information, check out https://www.windowsazure.com/mobile.",WindowsAzure.MobileServices.Files,True,1899-12-31T16:00:00-08:00,False,False,Windows Azure Mobile Apps File Management SDK.,"microsoft,windows,azure,mobile,services,windowsazureofficial",-1,False,2.0.0-alpha
Andrey Poltavets,2015-09-28T07:34:27.003Z,Bitpool rest api client. This version compatible with .net framework >= 4.5.2,BitPool.Client,False,2017-12-12T05:21:03.997+00:00,True,False,,,2134,False,1.0.5
Microsoft,2015-09-28T06:02:27.853Z,"This library adds file management capabilities to applications built with the Azure Mobile Apps SDK. For more information, check out https://www.windowsazure.com/mobile.",WindowsAzure.MobileServices.Files.Server,True,1899-12-31T16:00:00-08:00,False,False,Windows Azure Mobile Apps File Management Server SDK.,"microsoft,azure,mobile,server,windowsazureofficial",-1,False,1.0.0-alpha
Carlos G. Sarmiento,2015-09-28T06:29:04.757Z,The dynamic configuration manager for .NET,DynamiConf.JsonInterpreter,False,2015-09-28T20:28:23.917-07:00,True,False,,"Configuration,Dynamic,DynamiConf,Conf,Json",1041,False,0.2.4
"XAct Software Solutions,Inc.",2015-09-28T10:51:40.45Z,An XActLib assembly: providing implementations of persistence contracts defined in XAct.Quality.,XAct.Quality.Persistence.EF,False,2017-02-09T01:57:43.4+00:00,True,False,,"XAct,XActLib",52766,False,0.0.5003
"XAct Software Solutions,Inc.",2015-09-28T11:11:23.653Z,An XActLib assembly: a Library for working with Transactions in the Application Layer,XAct.Transactions,False,2017-02-08T17:58:05.087-08:00,True,False,,"XAct,XActLib",58942,False,0.0.5003
Kevin Montrose,2015-09-28T03:09:41.477Z,A fast JSON serializer and deserializer.,Jil.StrongName,False,2017-08-23T20:49:46.963+00:00,True,False,,json,9916,False,2.12.1
MANA Cards,2015-09-28T09:09:33.343Z,Komponentë e cila e bën më të lehtë integrimin e API-t të Kartelës MANA në aplikacionet tuaja të shitjes.,Mana.Cards.Client,False,2016-02-08T14:27:36.053-08:00,True,False,,,4365,False,1.1.13
Konstantinos Papakonstantinou,2015-09-27T23:46:23.393Z,A simple wrapper for reading typed values from ConfigurationManager.AppSettings,SimpleAppSettings,False,2015-09-27T16:46:23.393-07:00,True,False,,,975,False,0.1.0.4
Paket team,2015-09-28T09:23:22.33Z,A package dependency manager for .NET with support for NuGet packages and GitHub repositories.,Paket.PowerShell,False,2017-04-28T07:19:40.903+00:00,True,False,A package dependency manager for .NET with support for NuGet packages and GitHub repositories.,"nuget,bundler,F#",135731,False,2.4.1
Bryan Apellanes,2015-09-28T00:46:08.56Z,Legacy Dust view engine for MVC.Net,Bam.Net.Dust,False,2017-09-28T03:23:29.96+00:00,True,False,,,10105,False,1.0.8
Bryan Apellanes,2015-09-28T00:42:29.65Z,Command Line Tools,Bam.Net.CommandLine,False,2018-01-25T03:44:36.633+00:00,True,False,,,10598,False,1.0.8
Innocent Bindura,2015-09-28T09:00:22.063Z,PayUMea,Bindsoft.PayuIntergration,False,2015-10-02T15:12:11.613-07:00,True,False,,,507,False,1.0.0
"XAct Software Solutions,Inc.",2015-09-28T10:56:25.323Z,"An XActLib assembly: an implementation of XAct.Scheduling, using the Quartz.NET library.",XAct.Scheduling.Quartz,False,2017-02-09T01:57:49.087+00:00,True,False,,"XAct,XActLib",53403,False,0.0.5003
"XAct Software Solutions,Inc.",2015-09-28T11:09:28.463Z,An XActLib assembly:common contracts and entities used to initiate and progress Tasks.,XAct.Tasks.PCL,False,2017-02-08T17:58:04.603-08:00,True,False,,"XAct,XActLib",8362,False,0.0.5003
"Chris Patterson,Dru Sellers,Travis Smith",2015-09-28T04:35:51.517Z,"MassTransit is a distributed application framework for .NET, including support for RabbitMQ and Azure Service Bus.",MassTransit.Log4Net,False,2018-04-17T18:22:21.46+00:00,True,False,MassTransit Log4Net Logging Support,MassTransit,147695,False,3.0.13
CityIndex Ltd,2015-09-28T08:08:12.427Z,LogSearchShipper client,LogSearchShipper,False,1899-12-31T16:00:00-08:00,False,False,,,4392,False,1.0.5749.27228
juchen,2015-09-28T03:10:12.737Z,Fix the constructor bug,Swashbuckle.Core.Extension,False,2015-10-07T20:48:26.743-07:00,True,False,The extension of Swashbuckle.Core,"Swashbuckle.Core,ApiExplorer,Swagger",31975,False,1.0.1
"PulseBridge,Inc.",2015-09-25T21:29:11.35Z,Tooling support for cross-platform build automation.,PulseBridge.Condo,True,2016-06-17T18:35:26.077+00:00,False,False,,"build,asp.net,dnx,xplat",5271,False,1.0.0-rc-00060
Gibraltar Software,2015-09-28T01:19:17.007Z,"Executable that packages Loupe data for transport via file, email and the Loupe Server",Gibraltar.Packager,False,2018-03-18T00:58:19.903+00:00,True,False,,"Loupe,Logging",7273,False,4.0.0.3015
"XAct Software Solutions,Inc.",2015-09-28T10:27:37.017Z,An XActLib assembly: assembly for persisting History entries related to specific domain entities (not the same as Tracing or Logging).,XAct.History,False,2017-02-08T17:57:18.227-08:00,True,False,,"XAct,XActLib",73308,False,0.0.5003
"XAct Software Solutions,Inc.",2015-09-28T10:28:31.38Z,An XActLib assembly: a service to persist History with a UI element. Not the same as Trace or Logging.,XAct.History.Persistence.EF,False,2017-02-09T01:57:20.993+00:00,True,False,,"XAct,XActLib",54690,False,0.0.5003
"XAct Software Solutions,Inc.",2015-09-28T08:49:57.187Z,An XActLib assembly: an Assembly that provides a Log4NetTraceListener (rerouting XAct.Diagnostics.Trace calls to Log4Net -- nice!) as well as Log4Net specific implementation of the core Tracing service.,XAct.Diagnostics.Log4Net,False,2017-02-08T17:57:07.633-08:00,False,False,,"XAct,XActLib",92086,False,0.0.5002
