authors,created,days_abandoned,days_alive,description,id,is_prerelease,last_updated,listed,missing_info,summary,tags,total_downloads,verified,versionHarry McIntyre,2011-09-28T13:48:38.063Z,66,2396,Strongly type html helpers for rendering jquery.datatables tables from IQueryables,Mvc.JQuery.Datatables,False,2018-02-13T13:32:31.3+00:00,True,False,,"jquery,datatables,iqueryable,razor",126423,False,1.0.4288.24925
Roman Kuzmin,2011-10-03T04:02:06.23Z,55,2391,"Helps.ps1 is a set of utility functions that allow to generate help script
templates and build PowerShell XML help files from PowerShell help scripts.
Help can be created for everything that supports XML help: cmdlets, providers,
standalone scripts, functions in script modules, functions in script libraries.",Helps,False,2018-02-24T14:46:17.31+00:00,True,False,Helps.ps1 - PowerShell Help Builder,"powershell,help,builder",3991,False,1.0.5
Developpez.com,2011-10-02T18:43:44.397Z,1773,2392,"Librairie de classes pour le développement d'applications WPF, créée à partir des contributions des membres de Developpez.com.",dvp-net-wpf,False,2013-06-12T05:11:39.707-07:00,True,False,"Librairie de classes pour le développement d'applications WPF, créée à partir des contributions des membres de Developpez.com.",,2270,False,0.4.0
"Karan Misra,Luis Bocaletti",2011-09-28T02:54:52.663Z,1389,2396,Autofac extension for Bootstrapper.,Bootstrapper.Autofac,False,2014-06-30T19:43:13.11-07:00,True,False,Autofac extension for Bootstrapper.,,15304,False,2.0.0
Ryan Riley,2011-09-30T08:12:13.613Z,43209,2394,"Focco is a quick-and-dirty, literate-programming-style documentation generator.",Focco,False,1899-12-31T16:00:00-08:00,False,False,"Focco is a quick-and-dirty, literate-programming-style documentation generator.","documentation,fsharp,csharp",1760,False,0.1.110930
chenxizhang,2011-09-26T02:05:40.55Z,2390,2398,这个设计针对在Silverlight中经常需要对多个远程服务进行调用，而且我们可能需要让这些任务之间有固定的顺序，同时还希望能够在任务之间传递任务状态。最新版本还支持进度汇报的功能,AsyncTaskFactory,False,2011-10-04T03:55:45.813-07:00,True,False,,"Silverlight,Thread,Task,Async",6126,False,1.5.0
drblame,2011-09-30T13:15:54.067Z,2394,2394,"A Microsoft.Net library with common utility classes for web, mail and others.",Goodstuff.Core,False,2011-09-30T06:16:38.737-07:00,True,False,,,1380,False,1.1.0
GeertvanHorrik,2011-10-02T17:25:48.637Z,43209,2392,"Silverlight version of Catel, including all controls and the MVVM framework.",Catel.Silverlight,False,1899-12-31T16:00:00-08:00,False,False,,"mvvm,data,object,silverlight,sl,sl4,sl5",-1,False,2.2.0
S. van Deursen,2011-10-01T15:02:46.68Z,43209,2393,The Extensions project adds many advanced capabilities to the Simple Injector.,SimpleInjector.Extensions.Silverlight,False,1899-12-31T16:00:00-08:00,False,False,The Simple Injector is an easy-to-use Inversion of Control library for .NET and Silverlight.,"architecture,CommonServiceLocator,dependency-injection,DI,easy,easy-to-use,Inversion-of-Control,IOC,Servicelocator",-1,False,1.2.0.11273
Sam Kroonenburg,2011-09-29T05:38:37.147Z,2152,2395,Minify your CSS/JS. Simple fluent configuration. Wildcard file matching. Works on Azure. Easy script debugging.,Rejuicer,False,2012-05-28T17:03:53.007-07:00,True,False,,"minify,minification,css,javascript,cache",30720,False,1.2.1
Tatham Oddie,2011-09-26T13:45:48.72Z,1578,2398,A set of useful tools for building high reliability applications.,ReliabilityPatterns,False,2013-12-24T14:02:45.863-08:00,True,False,,,8668,False,1.0.0.6
Michał Zalewski,2011-09-30T15:17:24.81Z,1823,2394,"A jQuery plugin to create google maps with advanced features (overlays, clusters, callbacks, events...).",GMAP3,False,2013-04-23T02:34:55.81-07:00,True,False,,"jQuery,google,maps,GMap",6429,False,4.0.0
Harry McIntyre,2011-09-29T17:14:45.03Z,2389,2395,A pluggable interceptor which allows interception of the NH entity creation program - warning may bust lazy loading at the moment!,NHibernate.Instantiation,False,2011-10-05T08:16:50.887-07:00,True,False,,,2705,False,1.0.4289.31022
"Jake Ginnivan,Brendan Kowitz",2011-09-29T08:20:18.727Z,2395,2395,a collection of wp7 helper classes which make it simpler to write tests for wp7,WindowsPhoneEssentials.Testing,False,2011-09-29T01:33:05.697-07:00,True,False,,"windows,phone,7,wp7,testing,unit",4994,False,0.7.2.88
"Chad Myers,Jeremy D. Miller,Joshua Flanagan",2011-09-29T16:13:15.617Z,807,2395,A foundational library for .Net frameworks including model binding and localization,FubuCore,False,2016-02-03T14:49:48.593+00:00,True,False,,"utilities,fubu",109500,False,0.9.2.65
"Joshua Arnold,Jeremy D. Miller,et al.",2011-09-28T22:08:05.937Z,1511,2396,"FubuValidation - have validation your way, whatever way that happens to be",FubuValidation,False,2014-03-01T07:58:02.463-08:00,True,False,,"fubu,validation,fubumvc,conventional",72685,False,0.4.0.61
Steven van Bodegraven,2011-09-26T09:19:03.947Z,2398,2398,Use RequestStrap Class- and Method-level Attributes when unit testing to initialize System.Web.HttpContext.Current prior to running tests. Release 0.1 contains a single Attribute [RequestStrap] which performs minimal initialization of System.Web.HttpContext.Current to allow the Cache object to be used. Requests for changes can be made at http://www.CodeShoutOut.com/RequestStrap,RequestStrap,False,2011-09-26T02:36:15.097-07:00,True,False,,"HttpContext,Unit,Testing",2790,False,0.2.0
"Andreas Håkansson,Steven Robbins and contributors",2011-10-03T20:10:56.927Z,484,2391,An Ninject bootstrapper for the Nancy web framework.,Nancy.Bootstrappers.Ninject,False,2016-12-22T02:26:21.6-08:00,True,False,"Nancy is a lightweight web framework for the .Net platform, inspired by Sinatra. Nancy aim at delivering a low ceremony approach to building light, fast web applications.","Nancy,Ninject",57018,False,0.8.0
Kappy,2011-09-27T15:06:40.347Z,585,2397,An open source library to consume the OpenSubtitles.org service written in C#,OSDBnet,False,2016-09-12T01:17:12.51-07:00,True,False,,"subs,subtitles,opensubtitles,osdb,movies",3968,False,0.1.0
"Marcus Cuda,Christoph Ruegg,Jurgen Van Gael",2011-10-03T19:43:25.277Z,43209,2391,"This package contains samples that demonstrate the use of the Math.NET Numerics library. Math.NET Numerics is the numerical foundation of the Math.NET project, aiming to provide methods and algorithms for numerical computations in science, engineering and every day use. Numerics is the result of merging dnAnalytics with Math.NET Iridium and is intended to replace both.",MathNet.Numerics.Sample,False,1899-12-31T16:00:00-08:00,False,False,This package contains samples that demonstrate the use of the Math.NET Numerics library.,"sample,code,math,numeric,statistics,probability,integration,interpolation,linear,algebra,matrix,fft",-1,False,2.1.1
James Smith,2011-10-03T14:46:47.767Z,2391,2391,A jQuery Tokenizing Autocomplete Text Entry,jquery-tokeninput,False,2011-10-03T07:47:24.2-07:00,True,False,,"jquery,input,token,tag,autocomplete",6375,False,1.6.0
Harry McIntyre,2011-09-28T13:07:43.83Z,66,2396,Strongly type html helpers for rendering jquery.datatables tables from IQueryables,Mvc.JQuery.Datatables,False,2018-02-13T13:32:31.3+00:00,True,False,,"jquery,datatables,mvc,razor",126423,False,1.0.4288.23699
Yor Mom,2011-09-28T21:51:35.557Z,1780,2396,Description,PostSharp.NotifyPropertyChanged,False,2013-06-05T11:00:01.38-07:00,True,False,,,4540,False,0.1.0
daruyanagi,2011-09-30T14:14:57.023Z,43209,2394,Quotes a tweet on Twitter.,BlackbirdPie,False,1899-12-31T16:00:00-08:00,False,False,,ASPNETWEBPAGES,4277,False,1.2.0
Mark Seemann,2011-10-01T13:49:01.557Z,4,2393,"This extension turns AutoFixture into an Auto-Mocking Container. The mock instances are created by Moq. To use it, add the AutoMoqCustomization to your Fixture instance. Read more at http://blog.ploeh.dk/2010/08/19/AutoFixtureAsAnAutomockingContainer.aspx",AutoFixture.AutoMoq,False,2018-04-16T15:24:18.43+00:00,True,False,Turns AutoFixture into an Auto-Mocking Container based on Moq.,,885226,True,2.4.1
Michael Jahn,2011-09-27T21:00:40.15Z,2387,2397,"Tools to formal check german account numbers, international credit card numbers and switch between national account numbers and IBAN",AccountNumberTools,False,2011-10-07T13:07:09.957-07:00,True,False,,"Account,Number,Check,Credit,Card,Luhn,German,Kontonummer,Kontonummern,Bankleitzahl,IBAN,BIC",12263,False,0.5.0
"Joost van Schaik,#wp7nl",2011-09-25T18:59:31.09Z,1654,2399,"This project is a collection of Windows Phone 7 utility classes that are created or brought together by the Dutch Windows Phone 7 developer community, a loose band of enthousiasts usually referred to as ""#wp7nl"" by their twitter hashtag.",wp7nl,False,2013-10-09T04:23:26.903-07:00,True,False,,,5030,False,2.0.1
RazorGenerator contributors,2011-09-26T22:14:48.967Z,617,2398,Helpers to allow unit testing precompiled Razor views,RazorGenerator.Testing,False,2016-08-11T11:37:24.4-07:00,True,False,,"mvc,razor,testing",62186,False,1.2.2
rabir Shrestha,2011-09-26T07:15:50.713Z,2384,2398,Package manager for nodejs.,nji,False,2011-10-10T01:35:54.23-07:00,True,False,,nodejs,5816,False,0.2.0
Ragnar Dahlén,2011-09-25T13:45:19.163Z,2399,2399,.NET client library for Graphite,Graphite.NET,False,2011-09-25T06:45:22.677-07:00,True,False,,"graphite,statsd,metrics",16052,False,1.1.0
Jakob Christensen,2011-09-27T07:05:11.317Z,43209,2397,"Sitecore Rocks plugin, that provides deep integration between Sitecore Rocks and JetBrains Resharper.

Convert Sitecore path to Sitecore ID.
Convert Sitecore ID to path.
Locate item with Guid in Sitecore Explorer.
Edit item wih ID.
Put GetItem in SecurityDisabler.",Sitecore.Rocks.Rocksharper,False,1899-12-31T16:00:00-08:00,False,False,,"Sitecore,Sitecore.Rocks,ReSharper",-1,False,1.0.0
"Chad Myers,Jeremy D. Miller,Joshua Flanagan",2011-10-03T17:27:15.257Z,1511,2391,Specification extensions and automocking utilities for interaction tests.,FubuTestingSupport,False,2014-03-01T07:57:52.687-08:00,True,False,,"utilities,testing,fubu",26955,False,0.9.2.68
"CityIndex Ltd,Sky Sanders,David Laing",2011-10-03T14:39:48.19Z,43209,2391,.NET client library for CityIndex Trading API,CIAPI.CS,False,1900-01-01T00:00:00+00:00,False,False,,,-1,False,1.0.207
Robert Westerlund,2011-10-02T22:44:14.223Z,2392,2392,"Allows getting the content written by script files which use the document.write() method. Originally created to support the SignalR chat sample application when adding content providers for reading entries from pastie or git. Sample usage: $('<div/>').captureDocumentWrite('https://gist.github.com/1158895.js?file=gistfile1.cs', function(content){/*callback after content is inserted into the div element*/}).appendTo(wrapper);",jquery.captureDocumentWrite,False,2011-10-02T15:44:15.893-07:00,True,False,Allows getting the content written by script files which use the document.write() method.,"jquery,document.write,javascript",314786,False,1.0.0
20363,2011-10-03T18:14:29.307Z,2041,2391,"A 100% managed code, free, open source, independent and mono compatible C#/.NET Library for interacting with Apple's Push Notification (APN / APNS) & Feedback Services for the iOS, iPhone, iPad, iPod.",apns-sharp,False,2012-09-17T06:09:35.913-07:00,True,False,,,4574,False,1.0.4.1
Jesper Jensen,2011-09-27T15:06:45.677Z,43209,2397,MicroDal provider for SQLite,MicroDal.SQLiteProvider,False,1899-12-31T16:00:00-08:00,False,False,,,10233,False,1.1.4287.29055
bcoover,2011-09-26T22:10:24.68Z,2327,2398,A quick way to theme an MVC Razor website,MvcRazorThemeableViewEngine,False,2011-12-06T11:43:42.1-08:00,True,False,,"MVC,MVC3,ASP.NET,Theming",5648,False,0.2.0
"Tatham Oddie,Romiko Derbynew and Jamal Abreu",2011-09-27T23:26:49.2Z,9,2397,"A .NET client for the neo4j REST API. neo4j is an open sourced, Java based transactional graph database. It's pretty awesome.",Neo4jClient,False,2018-04-11T11:12:31.637+00:00,True,False,,"neo4j,REST,nosql",244832,False,0.0.1.178
Matthias Friedrich,2011-09-25T12:27:45.647Z,2399,2399,"This project is an easy to use wrapper for native Windows device management and device setup functions. You can use the library for querying device configuration, registering for device change notifications or sending I/O control codes to device drivers. It´s an experimental project, which enables .NET-developers, who want to avoid the use of WMI, to add device management capabilities to Windows applications.",DeviceManagementPackage,False,2011-09-25T05:31:43.647-07:00,True,False,,"device,management,notification,USB,SetupDi",2211,False,0.1.0
Erik Zaadi,2011-09-29T12:25:10.797Z,2395,2395,C# integration with Githubs v2 apis - Core Module,GithubSharp.Core,False,2011-09-29T05:25:13.12-07:00,True,False,,Github,3126,False,0.0.5.1
Harry McIntyre,2011-09-25T22:03:28.743Z,678,2399,"Wraps your classes with a proxy which automatically carries out permission checks when you call methods.
e.g. If you have a method 
'public virtual void SendEmail()'
, you can create a method 
'public virtual bool' AllowSendEmail() { ... }
When SendEmail is called, AllowSendEmail is called first. If this returns false, a HardenException is thrown. To harden an object, call Hardener.Harden(someObject).",Harden,False,2016-06-11T04:47:21.823-07:00,True,False,,,14897,False,1.0.4285.39747
Daniel Wertheim - @@danielwertheim - http://daniel.wertheim.se,2011-09-30T19:46:19.39Z,43209,2394,"Yet another guard clause project helping you with validation and uniformed exception throwing when validating args.
		Distributed as SOURCE CONTENT. Use package Ensure.That for lib distribution.",Ensure.That.Source,False,1900-01-01T00:00:00+00:00,False,False,Yet another guard clause project.,"argument,validation,guard,clause",-1,False,0.3.0
ELC,2011-10-03T20:57:01.883Z,2367,2391,"A framework to facilitate cloud development.
**Note** - You will need an account at http://maasive.co before you can use this library",MaaSive,False,2011-10-27T10:00:28.357-07:00,True,False,"A framework to facilitate cloud development.
**Note** - You will need an account at http://maasive.co before you can use this library","cloud,wp7,C#",4335,False,0.1.7.1
Jesper Jensen,2011-09-26T20:45:18.967Z,43209,2398,ADO.NET wrapper for easy data access,MicroDal,False,1899-12-31T16:00:00-08:00,False,False,,"ADO.NET,ORM",15530,False,1.3.4286.38822
"Joshua Arnold,Jaime Febres,Alex Henning Johannessen,Jeremy D. Miller",2011-10-03T01:46:01.443Z,444,2391,Support for using the Spark view engine within a FubuMVC application.,FubuMVC.Spark,False,2017-01-31T12:51:04.08-08:00,True,False,,"fubumvc,spark",105937,False,0.9.1.568
"Rick Strahl,West Wind Technologies",2011-09-25T04:02:38.863Z,86,2399,This library provides a data driven ASP.NET resource provider using SQL Server as well as tools to dynamically add and edit language resources to the database via a Web interface.,Westwind.Globalization,False,2018-01-24T10:24:40.11+00:00,True,False,ASP.NET Database Driven Resource Provider and Tools,,72025,False,1.18.0
"Kazi Manzur Rashid,hazzik",2011-10-02T12:20:24.28Z,1645,2392,"ASP.NET MVC Extensions is framework developed on top of ASP.NET MVC extensibility point, which allows your IoC Container to rule everywhere.",MvcExtensions.Ninject,False,2013-10-17T22:29:01.173-07:00,True,False,,,16115,False,2.0.0.505
Tatham Oddie,2011-09-26T04:12:47.317Z,9,2398,"A .NET client for the neo4j REST API. neo4j is an open sourced, Java based transactional graph database. It's pretty awesome.",Neo4jClient,False,2018-04-11T11:12:31.637+00:00,True,False,,"neo4j,REST,nosql",244832,False,0.0.1.168
"Rick Strahl,West Wind Technologies",2011-09-30T10:06:29.373Z,165,2394,"West Wind Web and AJAX Utilities provide a host of AJAX and REST services for interaction with jQuery. Key features include support for easy to implement REST and AJAX services and a rich client side JavaScript library that can interact with these services easily. For WebForms there are a host of wrappers for the client side jQuery plug-in controls, or you can use them directly from script code to interact with MVC or other non-WebForm platforms. The toolkit also includes many general purpose helper classes and utility functions for low level ASP.NET operations including script loading, script compression, loading script variables into HTML output, request logging and error handling and more. Although there is some WebForms specific functionality, most of the library's generic features can be used both in WebForms and MVC as well as in handlers and modules. Note: this is the binary only distribution of the West Wind Web and Ajax Toolkit.",Westwind.Web,False,2017-11-06T09:52:13.927+00:00,True,False,"Provides a host of AJAX and REST services, a host of script serving services, and many general purpose ASP.NET utility classes",,89569,False,1.18.0
"Jeremy D. Miller,Dru Sellers,et al.",2011-10-03T17:31:05.47Z,2223,2391,Tools for deploying IIS web applications built on top of the Bottles framework,Bottles.Deployers.IIS,False,2012-03-19T12:51:46.65-07:00,True,False,,"packaging,areas,slices",34344,False,0.9.1.123
"Jeremy D. Miller,Dru Sellers,et al.",2011-09-28T16:21:22.937Z,2223,2396,Tool support for applications that use Bottles,Bottles.Tools,False,2012-03-19T12:52:25.837-07:00,True,False,,"packaging,areas,slices",35478,False,0.9.1.119
Daniel González García,2011-10-02T08:17:39.213Z,241,2392,Utility classes and extensions to facilitate common testing operations.,Testing.Commons,False,2017-08-22T13:01:03.143+00:00,True,False,Testing.Commons contains classes and extensions that help testing code in general and more specific areas such as configuration and web artifacts.,".net,C#,testing",6358,False,1.0.0
Jesper Jensen,2011-09-29T12:42:34.073Z,43209,2395,MicroDal provider for SQLite,MicroDal.SQLiteProvider,False,1899-12-31T16:00:00-08:00,False,False,,,10233,False,1.1.4289.24626
James Simmonds,2011-10-02T19:21:49.517Z,1388,2392,Provide a health check plugin for Wolfpack Distributed Monitoring System that will alert when a new version of a NuGet package is available,Wolfpack.Contrib.Checks.NuGet,False,2014-07-02T16:18:35.18-07:00,True,False,Provide a health check plugin for Wolfpack Distributed Monitoring System that will alert when a new version of a NuGet package is available,"Wolfpack,Monitoring,NuGet",2450,False,2.3.0.5
"Rob Gibbens,James Simmonds",2011-10-02T19:21:56.093Z,1388,2392,A MongoDb health check for the Wolfpack Distributed Monitoring System. Requires logging to a MongoDb instance using the log4Mongo package.,Wolfpack.Contrib.Checks.MongoDb,False,2014-07-02T16:19:37.23-07:00,True,False,A MongoDb health check for the Wolfpack Distributed Monitoring System.,"Wolfpack,Monitoring,MongoDb",3403,False,2.3.0.5
Magnus Thor and Uffe Björklund,2011-09-25T19:54:51.157Z,151,2399,A step towards the real time web,XSockets,False,2017-11-20T17:58:40.847+00:00,True,False,,"HTML5,WebSocket-API,Websocket,Websocketserver",74575,False,0.9.4.1
Don't Panic Labs,2011-09-26T15:08:39.52Z,2192,2398,Service Helpers simplifies using WCF in a service oriented software system. Service Helpers makes working with WCF as easy as using any dependency injection framework.,DPLServiceHelpers,False,2012-04-19T07:39:58.427-07:00,True,False,,"wcf,ioc",6193,False,7.0.0.2
Mauro Servienti,2011-10-03T07:13:31.26Z,455,2391,Radical Framework,Radical,False,2017-01-20T05:46:33.647-08:00,True,False,,Radical,37194,False,1.2.5.1
Tatham Oddie,2011-09-25T22:44:50.473Z,9,2399,"A .NET client for the neo4j REST API. neo4j is an open sourced, Java based transactional graph database. It's pretty awesome.",Neo4jClient,False,2018-04-11T11:12:31.637+00:00,True,False,,"neo4j,REST,nosql",244832,False,0.0.1.162
Harry McIntyre,2011-09-30T11:12:45.677Z,39,2394,Fluent builder for writing convention based forms,FormFactory,False,2018-03-12T09:51:06.5+00:00,True,False,,,92421,False,1.0.4290.19894
LibGit2Sharp contributors,2011-09-29T19:21:01.217Z,3,2395,"LibGit2Sharp brings all the might and speed of libgit2, a native Git implementation, to the managed world of .Net and Mono.",LibGit2Sharp,False,2018-04-17T11:25:31.36+00:00,True,False,,"libgit2,git,wrapper,bindings,API,dvcs,vcs",450055,False,0.5.0
"Joshua Arnold,Jeremy D. Miller,et al.",2011-09-28T18:08:11.907Z,1511,2396,"FubuValidation - have validation your way, whatever way that happens to be",FubuValidation,False,2014-03-01T07:58:02.463-08:00,True,False,,"fubu,validation,fubumvc,conventional",72685,False,0.4.0.59
"Chad Myers,Jeremy D. Miller,Joshua Flanagan",2011-09-28T21:16:22.677Z,2186,2396,Additional functionality useful for FubuMVC applications that use NHibernate and StructureMap,FubuMVC.FastPack,False,2012-04-25T12:05:13.46-07:00,True,False,,"fubumvc,mvc,nhibernate",47738,False,0.4.1.51
"Tim Jones,Alessandro Petrelli",2011-09-29T17:20:03.037Z,3,2395,DotLiquid is a templating system ported to the .NET framework from Ruby’s Liquid Markup.,DotLiquid,False,2018-04-17T11:59:29.3+00:00,True,False,DotLiquid is a templating system ported to the .NET framework from Ruby’s Liquid Markup.,"template,templating,language,Liquid,markup,.net35,.net40",402117,False,1.6.1
Jake Ginnivan,2011-09-29T08:52:00.327Z,2395,2395,"An MVC + MVVM implementation for windows phone 7, supporting type safe navigation, MVVM, wp7 lifecycle/tombstoning and much more!",WindowsPhoneMVC,False,2011-09-29T01:52:21.74-07:00,True,False,,"windows,phone,7,wp7,mvc",3587,False,0.7.2.133
bcoover,2011-09-26T22:26:57.02Z,2327,2398,A quick way to theme an MVC Razor website,MvcRazorThemeableViewEngine,False,2011-12-06T11:43:42.1-08:00,True,False,,"MVC,MVC3,ASP.NET,Theming",5648,False,0.3.0
Harry McIntyre,2011-09-28T12:31:00.907Z,66,2396,Strongly type html helpers for rendering jquery.datatables tables from IQueryables,Mvc.JQuery.Datatables,False,2018-02-13T13:32:31.3+00:00,True,False,,"jquery,datatables,mvc,razor",126423,False,1.0.4288.22587
Scott Anderson,2011-09-26T15:06:18.867Z,2083,2398,"ActionMailer.Net aims to be an easy, and relatively painless way to send email from your ASP.NET MVC application. The concept is pretty simple. We render HTML by utilizing some pretty snazzy view engines, so why can't we do the same thing for email?",ActionMailer,False,2012-08-05T18:16:27.14-07:00,True,False,An MVC 3-based port of the Rails ActionMailer library to ASP.NET MVC. The goal is to make it easy and relatively painless to send email from your application.,"email,mvc,asp.net,razor",101713,False,0.6.2
Amir Rajan,2011-09-30T00:37:14.9Z,1591,2394,"Dynamic Hotness. Simply put...oak is a clone of ActiveModel (Ruby on Rails inspired) that can be used with ASP.NET MVC.  The nuget package 'oak-edge' is the latest release fresh off the presses, this is the stable release.",oak,False,2013-12-11T09:38:56.707-08:00,True,False,,"dynamic,mvc,migrations,rails,aspnetmvc",31318,False,1.3.1
"Marcus Cuda,Christoph Ruegg,Jurgen Van Gael",2011-10-03T19:43:13.69Z,43209,2391,"This package contains samples that demonstrate the use of the F# Modules for the Math.NET Numerics library. Math.NET Numerics is the numerical foundation of the Math.NET project, aiming to provide methods and algorithms for numerical computations in science, engineering and every day use. Numerics is the result of merging dnAnalytics with Math.NET Iridium and is intended to replace both.",MathNet.Numerics.FSharp.Sample,False,1899-12-31T16:00:00-08:00,False,False,This package contains samples that demonstrate the use of the F# Modules for the Math.NET Numerics library.,"math,numeric,statistics,probability,integration,interpolation,linear,algebra,matrix,fft",-1,False,2.1.1
Xavier Decoster,2011-09-30T08:04:41.787Z,43209,2394,"Adds the nuspec.xsd to your project, enabling intellisense in your .nuspec manifest files.",NuGet.Manifest.Schema,False,1899-12-31T16:00:00-08:00,False,False,"Adds the nuspec.xsd to your project, enables intellisense in .nuspec files","nuget,nuspec,xsd",-1,False,1.6.0
Wilson Mead III,2011-10-02T01:48:10.183Z,43209,2392,"Packs up and takes care of basic things that many of my websites will use. Unstable, but possibly useful. Main feature is packing up jQuery, and a few other 3rd party tools, and also having basic account stuff.",UnlimitedWebsiteWorks,False,1899-12-31T16:00:00-08:00,False,False,Libraries and basics for websites. Unstable.,,-1,False,0.1.0
"Chad Myers,Jeremy D. Miller,Joshua Flanagan",2011-09-29T12:58:54.387Z,1511,2395,Specification extensions and automocking utilities for interaction tests.,FubuTestingSupport,False,2014-03-01T07:57:52.687-08:00,True,False,,"utilities,testing,fubu",26955,False,0.9.1.63
Matt Wrock,2011-09-28T20:41:21.297Z,2090,2396,RequestReduce allows any IIS based website to automaticaly sprite background images into a single optimized PNG as well as combine and minify all CSS in the page's head tag with absolutely no coding beyond a few config tweaks. RequestReduce excercises common best practices when serving its css and sprited images ensuring that the appropriate caching headers are sent to the browser so that browsers will not need to pull down a new http response until absolutely necessary. Chances are you will see an immediate rise in your yslow and google page speed tests.,RequestReduce,False,2012-07-30T07:02:27.333-07:00,True,False,RequestReduce is a .Net Library and HttpModule providing automatic CSS background image optimization and spriting as well as CSS merging and minification.,"CSS,Minification,Sprites,Website,Performance,Optimization",42760,False,0.9.237
Ben Aston,2011-10-02T19:38:28.873Z,2130,2392,Simple fluent assertions for .NET.,NSure,False,2012-06-20T12:08:39.31-07:00,True,False,,"fluent,assertion",12291,False,1.0.4292.35410
