authors,created,description,id,is_prerelease,last_updated,listed,missing_info,summary,tags,total_downloads,verified,version
Morten Houston Ludvigsen,2014-09-15T10:05:50.523Z,A CommonMark parser for .Net,CommonMarkSharp,False,2014-09-17T04:08:23.007-07:00,True,False,,"CommonMark,Markdown",2596,False,0.2.1
Volkan Ceylan,2014-09-15T13:48:33.79Z,Contains imports for common javascript libraries. Use only with Saltarelle projects that produce Javascript code.,Serenity.Script.Imports,False,1899-12-31T16:00:00-08:00,False,False,,Serenity,-1,False,1.1.0
PromoMe,2014-09-14T08:18:57.49Z,Cross-promotion system for Windows Phone,PromoMeSDK,False,1899-12-31T16:00:00-08:00,False,False,,"Cross-promotion,system,for,Windows,Phone,PromoMe,Promo,Me,cross,promotion,advertising,WP7,WP8,WP8.1,WP9,WP,C#,Visual,Studio,mobile",-1,False,2.3.2
Dave Senn,2014-09-15T12:15:00.757Z,"PortableExtensions is a set of .Net extension methods build as portable class library.
PortableExtensions enhance the .Net framework by adding a bunch of methods to increase developer’s productivity.",PortableExtensions,False,1900-01-01T00:00:00+00:00,False,False,The MIT License,"C#,Extensions,Portable,Extension,Methods,.Net,Library",16906,False,1.0.16
Andreas Kuntner (mobilemotion.eu),2014-09-14T20:28:52.147Z,Addition to the MvvmBasics library that adds functionality specifically used in WPF .NET 4.5 (and higher) projects.,MVVMbasicsDesktopExtensions,False,1899-12-31T16:00:00-08:00,False,False,,,-1,False,2.0.1
objo,2014-09-15T14:21:21.863Z,"Custom controls for WPF: PropertyGrid, DataGrid, multi-select TreeView, ColorPicker and more",PropertyTools.Wpf,False,1900-01-01T00:00:00+00:00,False,False,,"wpf,controls,propertygrid,dataform,datagrid",78661,False,2014.2.11
Patrick,2014-09-15T09:45:42.487Z,"Clean Zone is a responsive admin template based on Bootstrap 3.1.1, it has a clean design and beautiful features ready to use.",CleanZone.BootstrapAdmin,False,1899-12-31T16:00:00-08:00,False,False,,,-1,False,1.0.1
Volkan Ceylan,2014-09-14T13:17:55.37Z,Contains core functions for script side. Use only with Saltarelle projects that produce Javascript code.,Serenity.Script.Core,False,1899-12-31T16:00:00-08:00,False,False,,Serenity,-1,False,1.0.9
SQLite Development Team,2014-09-13T21:49:56.423Z,This is a pre-release package and is not intended for production use.  Support for LINQ using System.Data.SQLite.,System.Data.SQLite.Linq.Test,False,1899-12-31T16:00:00-08:00,False,False,,"sqlite,database,ado.net,provider,interop",-1,False,1.0.94.2
ReflectSoftware Inc.,2014-09-15T05:11:14.067Z,"We've added support for the Http Module.

In order to use this extension you must have the ReflectInsight Viewer installed. Download and install the ReflectInsight Viewer from this location: 

http://www.ReflectSoftware.com/Public/Download.aspx

You can view your Http messages in realtime, in a rich viewer that allows you to filter out and search for what really matters to you.",ReflectSoftware.Insight.Extensions.HttpModule,True,2018-01-29T17:02:58.303+00:00,True,False,ReflectInsight Http Module logging extention make it easy to integrate ReflectInsight into your existing application logging infrastructure and leverage the power of the ReflectInsight log viewer.,"HttpModule,Http,Debug,Trace,Logging,Extensions,ReflectInsight,Appender,Log,Tracing,RabbitMQ",5693,False,5.3.2-rc1
Osman Buran,2014-09-14T21:50:14.547Z,"Facebook, Linkedin, Google,Windows Live, PayPal, Spotify, Deezer OAuth2 Client",Buran.OAuth,False,1899-12-31T16:00:00-08:00,False,False,,,-1,False,1.7.0
Colin David Scott,2014-09-15T14:16:07.41Z,LightBlue is a lightweight Azure development platform designed to replace a subset of the Azure emulator functionality,LightBlue,True,2018-01-16T03:04:48.22+00:00,True,False,,azure,11131,False,1.1.12-beta
Christian Hermann,2014-09-15T06:49:50.13Z,"StreamCryptor uses FileStream to encrypt and decrypt files in chunks. Every file contains a EncryptedFileHeader some EncryptedFileChunks and an EncryptedFileFooter. The file serialization is realised with Google`s protobuf, it has a small overhead and offers an automatic length prefix for all file parts.

All cryptographic operations are performed via libsodium.",StreamCryptor,False,2017-01-07T10:14:50.143-08:00,True,False,Stream encryption & decryption with libsodium and protbuf-net,"stream,encryption,protobuf,libsodium",4048,False,0.1.14
Accord.NET Extensions,2014-09-13T22:51:07.687Z,"The core of the Accord.NET Extensions Framework. The framework is an extension framework for Accord.NET and AForge.NET.
      Contains classes needed for other libraries such as: collections, structures, structures for parallel processing and extensions shared across libraries.",Accord.Extensions.Core,True,2015-10-08T17:27:48.783-07:00,True,False,Accord.NET Extensions Framework core library.,"accord.net,framework,extensions",19123,False,1.0.0-rc
mgholam,2014-09-15T09:27:11.53Z,"smallest, fastest polymorphic JSON serializer",fastJSON,False,2018-01-16T10:32:04.363+00:00,True,False,,,122170,False,2.1.3
"Henrik Feldt,Intelliplan International AB",2014-09-14T10:19:42.377Z,"Logary is a high performance, multi-target logging, metric and health-check library for mono and .Net.",Intelliplan.Logary.NLog,True,1899-12-31T16:00:00-08:00,False,False,,"logging,f#,nosql,log4net,nlog,serilog,log,logs,metrics,metrics.net,measure,performance,perf,semantic,structured",-1,False,2.0.0-alpha2
Harry Pfleger - Infoware,2014-09-14T11:09:40.413Z,Basic semantic cascading styles (css).,IwStyle,True,1899-12-31T16:00:00-08:00,False,False,,,1396,False,0.1.1-beta
Bobby Cannon,2014-09-13T19:41:36.673Z,Markdown parser written in C#. (BETA... maybe even alpha),MarkR,False,2016-04-11T17:27:02.487-07:00,True,False,,,3065,False,0.1.5369.35431
Ali Kheyrollahi,2014-09-15T13:50:21.993Z,Random Generation tool,RandomGen,False,2018-04-10T21:06:06.99+00:00,True,False,,"random,randomise,normal,distribution,female,male,name,surname,word",7920,False,0.1.1
"Diederik Krols,Filip Skakun",2014-09-14T06:23:37.867Z,Gauge control for Windows Phone 8.1.,WinRTXamlToolkit.Controls.Gauge.WindowsPhone,False,2015-01-15T23:23:29.16-08:00,True,False,,"winrt,xaml,toolkit,winrtxamltoolkit,xyzzer,gauge",3877,False,1.7.2
Daniel Lo Nigro,2014-09-15T01:49:10.903Z,Allows you to compile JSX to JavaScript using Cassette,Cassette.React,False,2018-03-05T03:14:58.897+00:00,True,False,,"asp.net,mvc,asp,jquery,javascript,js,react,facebook,reactjs,cassette",18278,False,1.1.2
Jon Arild Torresdal,2014-09-14T19:01:19.267Z,"Note: This package is for extending the ConDep DSL. If you're looking for ConDep to do deployment or infrastructure as code, please use the ConDep package. ConDep is a highly extendable Domain Specific Language for Continuous Deployment, Continuous Delivery and Infrastructure as Code on Windows.",ConDep.Dsl,True,2016-12-06T04:12:57.487-08:00,True,False,,"Continuous,Deployment,Delivery,Infrastructure,WebDeploy,Deploy,msdeploy,IIS,automation,powershell,remote",65757,False,3.0.46-beta
ThoughtWorks,2014-09-15T06:49:57.193Z,Harness RestClient lib,Harness.RestClient,False,2015-05-21T23:27:12.13-07:00,True,False,,,10924,False,1.1.0.18
Patrick Ineichen,2014-09-14T19:35:07.06Z,"A library which supports DDD, CQRS and event sourcing. This is the MongoDB persistence module for the EventStore.",SimpleDomain.EventStore.MongoPersistence,True,1899-12-31T16:00:00-08:00,False,False,,,-1,False,0.6.0-beta0001
Coevery,2014-09-15T06:08:13.47Z,"Coevery is an open source and free web framework for efficient developing data-centric business applications, which makes users possible to build model and interact with data quickly without writing any code. By now this preview version has been released, with later regular updates, and functions improving will be followed. Check out what’s new, we're working on it. We are looking forward to your feedback. Thank you for your patience.",Coevery.Framework,False,2014-09-15T02:00:44.367-07:00,True,False,A light weight asp.net mvc based framework that provides implementations of commonly used design patterns for applications using a Domain Driven Design approach.,,3678,False,0.2.2
Stiven,2014-09-15T11:42:49.737Z,Nibiru is a library to help application development.,Nibiru,False,2016-10-20T06:16:19.8-07:00,True,False,Nibiru is a library to help application development.,"log,web.config,abstract,builder",6200,False,0.0.1
Bryan Apellanes,2014-09-14T21:56:29.427Z,"System for simply and easily exposing pocos as RESTful webservices
	with automatic generation of both .Net and Javascript clients",Brevitee.ServiceProxy,False,2015-09-06T11:28:08.677-07:00,True,False,,,4016,False,3.0.7
Nebula Web Technologies,2014-09-14T15:57:01.417Z,Dynamically generate data centric pages from your model objects.,DynamicMVC,False,2016-05-30T16:05:24.1+00:00,True,False,Dynamically generate data centric pages from your model objects.,"Dynamic,MVC,DynamicMVC,Paging,Filtering,Sorting,Grid",3848,False,1.1.0
"Henrik Feldt,Intelliplan International AB",2014-09-14T10:18:29.54Z,"Logary is a high performance, multi-target logging, metric and health-check library for mono and .Net.",Intelliplan.Logary.DB.Migrations,True,1899-12-31T16:00:00-08:00,False,False,,"logging,f#,nosql,log4net,nlog,serilog,log,logs,metrics,metrics.net,measure,performance,perf,semantic,structured",-1,False,2.0.0-alpha2
Enferno AB,2014-09-14T22:11:41.107Z,Enferno ShoppingBasket component.,Enferno.Public.Web.ShoppingBasket,True,2016-10-10T03:25:16.95-07:00,True,False,,"Enferno,Public,Web,Component,ShoppingBasket",7702,False,1.1.0-beta3
Lida Weng,2014-09-15T12:11:36.37Z,OElite Web API SDK for OElite Platform based application development,OElite.Web,False,2016-04-16T05:06:28.653-07:00,True,False,,oelite,102426,False,2.5.2
Jon Arild Torresdal,2014-09-15T08:00:09.003Z,"Note: This package is for extending the ConDep DSL. If you're looking for ConDep to do deployment or infrastructure as code, please use the ConDep package. ConDep is a highly extendable Domain Specific Language for Continuous Deployment, Continuous Delivery and Infrastructure as Code on Windows.",ConDep.Dsl,True,2016-12-06T04:12:57.487-08:00,True,False,,"Continuous,Deployment,Delivery,Infrastructure,WebDeploy,Deploy,msdeploy,IIS,automation,powershell,remote",65757,False,3.0.48-beta
GeertvanHorrik,2014-09-15T09:58:45.21Z,"Catel.Extensions.Controls library which contains user controls, such as the StackGrid.",Catel.Extensions.Controls,True,2016-11-29T13:35:55.627+00:00,True,False,,"windows,controls,stackgrid,styles,stylehelper",170050,True,4.0.0-unstable0507
Volkan Ceylan,2014-09-14T13:13:38.257Z,Contains a modified version of MUNQ IoC container by Matthew Dennis. https://munq.codeplex.com/ which is released under the Microsoft Public License (Ms-PL) http://www.opensource.org/licenses/ms-pl.html,Serenity.Munq,False,1899-12-31T16:00:00-08:00,False,False,,Serenity,-1,False,1.0.9
ReflectSoftware Inc.,2014-09-15T02:52:06.277Z,"We've added a new destination listener extension for ReflectInsight for sending emails. This new destination listener extension is called ReflectSoftware.Insight.Listeners.Email and allows you to send logging messages via email. This is typically done for Exceptions, Errors and Fatal messages types where you might want to be notified via email if something went wrong in your application.

Traditional simple text base logging frameworks lack what your application can easily emit in providing you better insight into the health of your application. Wouldn’t it be great to easily instrument incredible rich details? Well, look no further. ReflectInsight was designed to easily let your application speak volumes!

One of ReflectInsight’s most powerful features is its impressive and elegant Viewer. The Viewer was design to hone in on particular issues and filter any unwanted noise by creating User Defined Views. User Defined Views allow you to filter a given request and visualize the execution path that actually caused the issue at hand. 

Everyone knows that debugging multithread applications is no simple task. Due to racing conditions, traditional IDE debuggers are not well suited for the job and don’t really provide an accurate picture behind the scenes. With ReflectInsight’s Live Viewer, debugging multithread applications is that much easier!

In order to use this library you must have the ReflectInsight Viewer installed. Download and install the ReflectInsight Viewer from this location: 

http://www.ReflectSoftware.com/Public/Download.aspx

You can view your messages in realtime, in a rich viewer that allows you to filter out and search for what really matters to you.",ReflectSoftware.Insight.Listeners.Email,True,2018-01-29T17:03:09.757+00:00,True,False,"ReflectInsight - The Next Generation in Application Logging.

ReflectInsight goes beyond where no text-based logging has gone before.","Email,.NET,Diagnostic,Debug,Trace,Logging,Extensions,ReflectInsight,Appender,Log,Tracing,RabbitMQ",4138,False,5.3.2-rc1
CodeConverters,2014-09-15T07:25:47.91Z,An opinionated set of coding conventions for ASP.Net development,CodeConverters.Mvc,False,2016-05-18T03:53:18.08-07:00,True,False,,"ASP.Net,MVC",5585,False,0.0.27
Graeme Christie,2014-09-14T13:28:31.517Z,Xamarin iOS Bindings for the Active Directory Authenication Library.,AdalXamarinIos,True,2014-09-14T07:26:09.03-07:00,True,False,,"Active,Directory,Authentication,Library,ADAL,Windows,Azure,AD,AAD,Identity,iOS,Xamarin",2040,False,1.1.0-alpha-1
"Henrik Feldt,Intelliplan International AB",2014-09-14T10:19:24.353Z,"Logary is a high performance, multi-target logging, metric and health-check library for mono and .Net.",Intelliplan.Logary.Loggr,True,1899-12-31T16:00:00-08:00,False,False,,"logging,f#,nosql,log4net,nlog,serilog,log,logs,metrics,metrics.net,measure,performance,perf,semantic,structured",-1,False,2.0.0-alpha2
Jack Moore,2014-09-14T18:10:40.937Z,A plugin to enable automatic height for textarea elements.,jQuery.Autosize,False,2014-09-14T11:10:40.937-07:00,True,False,,"jQuery,autosize,textarea",19447,False,1.18.12
"Filip Skakun,Silverlight Toolkit Team",2014-09-14T06:21:23.71Z,"Calendar control for Windows 8.1 WinRT/XAML, ported from the Silverlight Toolkit.",WinRTXamlToolkit.Controls.Calendar.Windows,False,2015-01-15T23:19:56.15-08:00,True,False,,"winrt,xaml,toolkit,winrtxamltoolkit,xyzzer,calendar",8012,False,1.7.2
Colin David Scott,2014-09-15T14:19:08.197Z,Provides Windsor support for the LightBlue Azure development platform,LightBlue.Windsor,True,2018-01-16T03:05:35.393+00:00,True,False,,azure,2818,False,1.1.12-beta
"Henrik Feldt,Intelliplan International AB",2014-09-14T14:59:25.483Z,"Logary is a high performance, multi-target logging, metric and health-check library for mono and .Net.",Intelliplan.Logary.DB,True,1899-12-31T16:00:00-08:00,False,False,,"logging,f#,nosql,log4net,nlog,serilog,log,logs,metrics,metrics.net,measure,performance,perf,semantic,structured",-1,False,2.0.0-alpha3
GroupDocs,2014-09-14T07:00:11.247Z,"GroupDocs.Viewer for .NET is a flexible library that enables you to display documents and images of more than 45 file formats from within your web & mobile applications. The library is 100% independent and doesn't require any 3rd-party software installation. This allows end users to, for example, view PDF documents from within your .NET applications without having to install Adobe Reader.

With GroupDocs' document viewer for .NET, your app's users can view documents and images of the following file formats:

- Portable Document Format: PDF
- Microsoft Word: DOC, DOCX, DOCM, DOT, DOTX, DOTM
- Microsoft Excel: XLS, XLSX, XLSM, XLSB, XML
- Microsoft PowerPoint: PPT, PPTX
- Microsoft Visio: VSD, VDX, VSS, VSX, VST, VTX, VSDX, VDW
- Microsoft Project: MPP, MPT
- Microsoft Outlook: MSG, EML
- OpenDocument Formats: ODT, OTT, ODS, ODP
- Rich Text Format: RTF
- Plain Text File: TXT
- Comma-Separated Values: CSV
- HyperText Markup Language: HTM, HTML, MHT, MHTML
- XML Paper Specification: XPS
- AutoCAD Drawing File Format: DXF
- Image files: BMP, GIF, JPG, PNG, TIFF
- Electronic publication: EPUB

Documents can be both rasterized and converted to SVG+HTML+CSS, delivering high-fidelity native text rendering.

GroupDocs.Viewer for .NET comes with a convenient UI, which allows users to easily navigate documents when viewing them. For instance, users can scroll multi-page documents, turn pages with the Go Forward/Backward buttons, jump straight to a specified page, search for text within the document using keywords, preview pages with thumbnails, zoom, print and download documents right from a web-browser.

For more details on the GroupDocs.Viewer for .NET Library, please visit our website: 
http://groupdocs.com/dot-net/document-viewer-library

Note: this download contains a fully working version of the product, however without a license set it will run in evaluation mode with some limitations. To test GroupDocs' document viewer for .NET library without evaluation limitations, request a free 30-day temporary license.",groupdocs-viewer-dotnet,False,2017-08-30T10:18:46.433+00:00,True,False,GroupDocs.Viewer for .NET is a flexible library that enables you to display documents and images of more than 45 file formats from within your web & mobile applications. The library is 100% independent and doesn't require any 3rd-party software installation.,"Document-Viewer,Image-Viewer,PDF,Word,Excel,PowerPoint,Visio,AutoCad,DOC,DOCX,XLS,XLSX,PPT,PPTX,VSD,DXF,TIFF",51239,False,2.3.0
objo,2014-09-15T13:37:25.153Z,WPF exporter for Lynx.Documents.,LynxToolkit.Documents.Wpf,False,1899-12-31T16:00:00-08:00,False,False,,"wpf,document,model",-1,False,2014.2.417
Volkan Ceylan,2014-09-14T13:18:59.057Z,Generates server and script side code for Serenity platform applications,Serenity.CodeGenerator,False,2018-03-31T16:41:53.587+00:00,True,False,,Serenity,115580,False,1.0.9
Accord.NET Extensions,2014-09-13T22:51:46.803Z,"Implements image-processing and computer-vision algorithms.
      Provides extensions for image-processing algorithms implemented in Accord.NET framework and for some image-processing algorithms implemented in AForge.NET framework.",Accord.Extensions.Imaging.Algorithms,True,2015-10-08T17:28:21.94-07:00,True,False,Image-processing and computer-vision algorithms,"accord.net,framework,extensions,imaging,algorithms",6821,False,1.0.0-rc
Eirik Tsarpalis,2014-09-15T10:16:22.65Z,A simple F# utility for testing performance,PerfUtil,False,2014-09-15T03:16:22.65-07:00,True,False,A simple F# utility for testing performance,"F#,performance,tests,unit",14238,False,0.1.8
Jin-Wook Chung,2014-09-15T07:17:19.953Z,Experiment.AutoFixture supports auto data using AutoFixture library in parameterized tests.,Experiment.AutoFixture,True,2014-11-23T18:06:48.48-08:00,True,False,,"unit-testing,tdd,autofixture",25486,False,2.0.0-pre01
Francisco Lopez,2014-09-15T05:10:17.207Z,MSBuild task to restore Nuget content files to project folder,MSBuild.NugetContentRestore,False,2014-09-28T06:36:17.507-07:00,True,False,,"nuget,content,restore,msbuild,task",43795,False,0.1.5
Sergey Zwezdin,2014-09-14T09:14:48.723Z,Lightweight library to implement CQS principle with .NET applications.,CSQ.NET.EntityFramework,False,1899-12-31T16:00:00-08:00,False,False,,,-1,False,1.0.0
Robin Herbots,2014-09-15T09:55:20.547Z,"jquery.inputmask is a jquery plugin which create an input mask.

An inputmask helps the user with the input by ensuring a predefined format. This can be useful for dates, numerics, phone numbers, ...

Highlights:
- easy to use
- optional parts anywere in the mask
- possibility to define aliases which hide complexity
- date / datetime masks
- numeric masks
- lots of callbacks
- non-greedy masks
- many features can be enabled/disabled/configured by options
- supports readonly/disabled/dir=""rtl"" attributes
- support data-inputmask attribute(s)  
- alternator-mask support
- regex-mask support
- dynamic-mask support
- preprocessing-mask support
- value formatting / validating without input element",jQuery.InputMask,False,2017-11-21T11:47:23.837+00:00,True,False,jquery.inputmask is a jquery plugin which create an input mask.,"jQuery,plugins,input,form,inputmask,mask",236889,False,3.1.22
Volkan Ceylan,2014-09-15T13:45:06.187Z,Contains filtering related classes...,Serenity.Data.Filtering,False,1899-12-31T16:00:00-08:00,False,False,,Serenity,-1,False,1.1.0
Jalal,2014-09-14T10:21:53.36Z,This is mvc library for proggasoft projects.,Proggasoft.Mvc,False,2017-06-03T23:11:21.863-07:00,True,False,,,5299,False,2.0.5370
Colin David Scott,2014-09-15T14:17:06.177Z,Provides Autofac support for the LightBlue Azure development platform,LightBlue.Autofac,True,2018-01-16T03:05:23.487+00:00,True,False,,azure,9914,False,1.1.12-beta
Volkan Ceylan,2014-09-15T13:45:31.37Z,Contains classes for CRUD service / repository implementations...,Serenity.Services,False,2018-03-31T16:40:02.41+00:00,True,False,,Serenity,114264,False,1.1.0
"Michael Edwards,Tom Dudfield,Chris van de Steeg,Reinoud van Dalen",2014-09-15T08:49:42.657Z,Allows you to use Sitecore 7.2(+) contentsearch features combined with glass objects,BoC.Glass.Mapper.Sc.ContentSearch,False,1899-12-31T16:00:00-08:00,False,False,,"Glass,Mapper,Sitecore,Glass.Mapper,contentsearch",-1,False,1.0.1
Jin-Wook Chung,2014-09-14T05:01:06.187Z,Experiment.AutoFixture supports auto data using AutoFixture library in parameterized tests.,Experiment.AutoFixture,False,2014-11-23T18:06:48.48-08:00,True,False,,"unit-testing,tdd,autofixture",25486,False,1.5.1
GeertvanHorrik,2014-09-15T09:59:36.32Z,Catel.Extensions.Data library which provides data classes such as repositories.,Catel.Extensions.Data,True,2016-11-29T05:35:59.533-08:00,True,False,,"catel,data,repository,repositories",103312,True,4.0.0-unstable0507
Sergey Zwezdin,2014-09-14T09:21:12.05Z,Lightweight library to implement CQS principle with .NET applications.,CQS.NET.EntityFramework,False,1899-12-31T16:00:00-08:00,False,False,,,-1,False,1.0.0.1
ReflectSoftware Inc.,2014-09-15T05:10:20.357Z,"We've added support for the NLog appender. This allows you to leverage your current investment in NLog, but leverage the power and flexibility that comes with the ReflectInsight viewer. 

In order to use this extension you must have the ReflectInsight Viewer installed. Download and install the ReflectInsight Viewer from this location: 

http://www.ReflectSoftware.com/Public/Download.aspx

You can view your NLog messages in realtime, in a rich viewer that allows you to filter out and search for what really matters to you.",ReflectSoftware.Insight.Extensions.NLog,True,2018-01-29T01:30:40.397+00:00,True,False,ReflectInsight NLog logging extention makes it easy to integrate ReflectInsight into your existing application logging infrastructure and leverage the power of the ReflectInsight log viewer.,"NLog,Logging,Extensions,ReflectInsight,Appender,Log,Tracing,RabbitMQ",8706,False,5.3.2-rc1
Paul Knopf,2014-09-14T01:45:13.937Z,"SourceIndexingSharp.Extractor is a tool that will extract source files via command line. SourceIndexingSharp generates source server commands within pdb files, which in turn, call this extractor. SourceIndexingSharp is embedded within this extractor.",SourceIndexingSharp.Extractor,False,2014-09-17T01:37:41.267-07:00,True,False,,"debugging,pdb,sourceserver,sourceindexing",758,False,0.0.0.31
luguandao,2014-09-14T18:09:30.317Z,数据库轻量级访问件,SSystem.Data,False,2017-08-29T03:54:21.19+00:00,True,False,,���������ݷ��ʣ�SSystem.Data,8696,False,4.1.0.3528
NServiceBus Ltd,2014-09-15T13:02:06.73Z,NServiceBus Transport for the Windows Azure Storage Queues,NServiceBus.Azure.Transports.WindowsAzureStorageQueues,False,2018-02-16T08:29:58.587+00:00,True,False,,"nservicebus,servicebus,msmq,cqrs,publish,subscribe",60231,False,5.3.4
Jon Arild Torresdal,2014-09-14T19:04:58.76Z,"ConDep is a highly extendable Domain Specific Language for Continuous Deployment, Continuous Delivery and Infrastructure as Code on Windows. This package contians all the default operations found in ConDep. For additional operations, look for ConDep.Dsl.Operations.Contrib.",ConDep.Dsl.Operations,True,1899-12-31T16:00:00-08:00,False,False,,"Continuous,Deployment,Delivery,Infrastructure,WebDeploy,Deploy,msdeploy,IIS,automation,powershell,remote",12723,False,3.0.35-beta
Jon Arild Torresdal,2014-09-14T19:07:43.9Z,"ConDep is a highly extendable Domain Specific Language for Continuous Deployment, Continuous Delivery and Infrastructure as Code on Windows. This package contians all the default operations found in ConDep. For additional operations, look for ConDep.Dsl.Operations.Contrib.",ConDep.Dsl.Operations,True,1899-12-31T16:00:00-08:00,False,False,,"Continuous,Deployment,Delivery,Infrastructure,WebDeploy,Deploy,msdeploy,IIS,automation,powershell,remote",12723,False,3.0.36-beta
Chad Kuehn,2014-09-15T12:29:20.697Z,"This is a plugin for jQuery DataTables. It customizes the pagination of your table so that you can enter a page number in a textbox. It includes a bootstrap focus highlight with intuitive navigation images.  There are several settings that can be adjusted to your liking.

Dependencies include jQuery and jquery.datatables.  Install as Nuget or CDN.

See how to implement along with other options and visuals by visiting the Project Information or Project Site link.
",DatatablePaginateBootstrap,False,1899-12-31T16:00:00-08:00,False,False,"This is an extension script to jQuery Datatables.  It is an alternative pager, styled with bootstrap, that allows to select a page by entering a number.  It uses Glyphicons for navigation with many overridable features.
","Twitter,Bootstrap,jQuery,DataTable,DataTables,pagination,paginate,input,textbox,FontAwesome,Glyphicons",-1,False,1.0.4
