authors,created,description,id,is_prerelease,last_updated,listed,missing_info,summary,tags,total_downloads,verified,versionExceptionless,2013-02-21T17:58:29.473Z,Exceptionless is a cloud based error reporting service that sends your exceptions to http://exceptionless.com and provides aggregated views and analytics.,Exceptionless,True,2018-02-15T14:17:13.09+00:00,True,False,,"Error,Report,Reporting,Exception,Logging,Log",293079,True,0.9.0.503-pre
Exceptionless,2013-02-21T19:17:35.387Z,Exceptionless is a cloud based error reporting service that sends your exceptions to http://exceptionless.com and provides aggregated views and analytics.,Exceptionless.Web,True,2018-02-15T14:21:03.533+00:00,True,False,,"Error,Report,Reporting,Exception,Logging,Log",130384,True,0.9.0.506-pre
Pablo Cibraro,2013-02-22T18:22:31.337Z,Hawk Http Authentication,HawkNet,False,2015-11-19T03:29:32.58-08:00,True,False,,"Auth,Security,Hawk",26620,False,1.1.0.2
Exceptionless,2013-02-21T18:43:52.54Z,Exceptionless is a cloud based error reporting service that sends your exceptions to http://exceptionless.com and provides aggregated views and analytics.,Exceptionless.Mvc,True,2018-02-15T14:19:13.42+00:00,True,False,,"Error,Report,Reporting,Exception,Logging,Log",163392,True,0.9.0.505-pre
"Marc Climent,Subgurim",2013-02-22T17:28:28.83Z,"Subgurim Maps for ASP.NET is lightweight and offers all the power of the GoogleMaps API v3 and much more without any external dependencies.

Report any bug or suggestion on the project page or to @SubgurimMaps on Twitter",Subgurim.Maps,False,2013-03-14T11:37:58.8-07:00,True,False,,"asp.net,google,maps,googlemaps",14846,False,4.1.0.2
Exceptionless,2013-02-22T04:09:47.287Z,Exceptionless is a cloud based error reporting service that sends your exceptions to http://exceptionless.com and provides aggregated views and analytics.,Exceptionless,True,2018-02-15T14:17:13.09+00:00,True,False,,"Error,Report,Reporting,Exception,Logging,Log",293079,True,0.9.0.516-pre
Andy,2013-02-21T19:52:12.427Z,Tools for simple PerformanceAnalysis,PerformanceTools,False,2013-02-21T12:10:20.45-08:00,True,False,,,791,False,1.0.0
Reid Evans,2013-02-22T15:59:32.32Z,Leverages Dapper's simple object mapping with a command pattern approach rather than an extension method approach.,DapperQueryExecutor,False,2013-02-22T07:59:32.32-08:00,True,False,,,749,False,1.0.0
Terence Parr,2013-02-22T16:45:44.463Z,"ANother Tool for Language Recognition, is a language tool that provides a framework for constructing recognizers, interpreters, compilers, and translators from grammatical descriptions containing actions in a variety of target languages.",Antlr,False,2013-09-12T11:22:34.217-07:00,True,False,"ANother Tool for Language Recognition, is a language tool that provides a framework for constructing recognizers, interpreters, compilers, and translators from grammatical descriptions containing actions in a variety of target languages.",,18608031,True,3.4.1.9004
Mobile Devices,2013-02-22T14:21:22.707Z,Driver to manage Notification from the Cloud Connect of Mobile Devices,MD.CloudConnect,False,2014-01-20T07:47:21.657-08:00,True,False,,"Mdi,CloudConnect,Mobile-devices,Mobile,devices",5438,False,0.0.9.3
Nathan Gonzalez,2013-02-22T15:52:40.33Z,An NUnit wrapper for the Given BDD framework.  This version is signed.,Given.NUnit-signed,False,2013-07-09T20:40:18.447-07:00,True,False,,"BDD,TDD,Testing,NUnit,Given",3195,False,0.1.4801.17750
CubeBuild Team,2013-02-21T23:20:46.68Z,"CubeBuild Core is the dependency libraries for the public release CMS CubeBuild.  It is incorporated into the default CubeBuild project, or can be integrated into any ASP.NET MVC application as an inbuild content manager.",CubeBuild.Application,False,2013-03-11T00:20:30.753-07:00,True,False,,"cms,mvc",3546,False,2.0.4801.18573
Pieter van Ginkel,2013-02-21T15:13:52.32Z,Simple asynchronous .NET HTTP server.,NHttp,False,2015-12-05T08:17:46.72-08:00,True,False,,"http,server",8674,False,0.1.6
Terry SoRelle,2013-02-21T21:15:56.987Z,Adds references controllers and Atlatl views for simple authentication.,Catapult.Peanut.Atlatl.AccountController,False,2013-04-05T11:21:59.05-07:00,True,False,,"Catapult,Peanut,Atlatl",2201,False,1.0.1
SYSTEM,2013-02-22T16:24:13.903Z,Noodles transforms your object model into a web app. Install this library to use Noodles with Web Api,Noodles.WebApi,False,2013-11-23T10:56:58.177-08:00,True,False,,,39841,False,1.1.383
Exceptionless,2013-02-21T17:58:31.77Z,Exceptionless is a cloud based error reporting service that sends your exceptions to http://exceptionless.com and provides aggregated views and analytics.,Exceptionless.Web,True,2018-02-15T14:21:03.533+00:00,True,False,,"Error,Report,Reporting,Exception,Logging,Log",130384,True,0.9.0.503-pre
Q42,2013-02-21T14:42:34.76Z,"Open source library for interaction with the Philips Hue Bridge. Allows you to control your lights from C#. Portable library works with .Net, Windows 8 and Windows Phone 8",Q42.HueApi,True,2018-02-22T12:11:22.947+00:00,True,False,Open source library for interaction with the Philips Hue Bridge.,"philips,hue,lights",24743,False,1.4.0-beta
Acid Media,2013-02-22T14:36:08.3Z,Mobiscroll package for jQuery Mobile,Mobiscroll-jQuery-Mobile,False,2014-10-22T05:59:04.473-07:00,True,False,A wheel scroller user control optimized for touchscreens to easily enter date and/or time. The control can easily be customized to support any custom values.,"jQuery,JavaScript,datepicker,timepicker,touchscreen,Webkit,android,iPhone,iPad,webapps,GalaxyTab,dropdown,mobile,wheel,senseui",9630,False,2.4.4
Terry SoRelle,2013-02-21T19:19:08.867Z,Adds additional Type Script files and Templates to integrate Atlatl SPA framework with the Peanut framework.,Catapult.Peanut.Atlatl,True,2013-04-05T11:06:14.723-07:00,True,False,,"Catapult,Peanut,Atlatl",3052,False,1.0.3-Beta
Nexul Software LLC,2013-02-21T18:22:37.463Z,"Extensions for MVC such as Enhanced dropdown lists and enhanced checkbox lists.  Enhanced controls support all valid html attributes, whereas basic MVC only supports common html attributes.",Candor.Web.Mvc,False,2014-07-24T15:53:25.953-07:00,True,False,,"Candor,Mvc,Checkbox,DropDown,EnhancedSelectListItem,IsJsonRequest,RenderPartialViewToString",3032,False,0.6.1.30221
Microsoft,2013-02-22T10:42:58.637Z,Noodles transforms your object model into a web app. This assembly contains stuff to make Noodles work with ASP MVC,Noodles.AspMvc,False,2013-11-23T10:56:42.207-08:00,True,False,,,41585,False,1.1.375
Probel,2013-02-22T00:59:43.293Z,Allow to manage remote statistics,Probel.NDoctor.Statistics,False,2013-02-24T10:45:27.52-08:00,True,False,,"nDoctor,statistics",4070,False,1.0.3.9
Exceptionless,2013-02-21T18:43:51.413Z,Exceptionless is a cloud based error reporting service that sends your exceptions to http://exceptionless.com and provides aggregated views and analytics.,Exceptionless,True,2018-02-15T14:17:13.09+00:00,True,False,,"Error,Report,Reporting,Exception,Logging,Log",293079,True,0.9.0.505-pre
SYSTEM,2013-02-21T18:18:48.91Z,Noodles transforms your object modelinto a web app. This is a library to integrate Noodles with AJAX jquery datatables,Noodles.AspMvc.DataTables,False,2013-11-23T10:56:48.06-08:00,True,False,,,40219,False,1.1.373
Microsoft,2013-02-22T14:52:00.453Z,"Noodles transforms your object model into a web app. Install this library to customise the cshtml template files, or if you don't want to use the EmbeddedResourceVirtualPathProvider to load your views",Noodles.AspMvc.Templates,False,2013-11-23T10:56:53.3-08:00,True,False,,,40469,False,1.1.381
mq524d,2013-02-22T16:32:25.34Z,My package description.,LocalPackage,False,1899-12-31T16:00:00-08:00,False,False,,,-1,False,1.0.1
Probel,2013-02-22T13:29:58.11Z,Allow to manage remote statistics,Probel.NDoctor.Statistics,False,2013-02-24T10:45:27.52-08:00,True,False,,"nDoctor,statistics",4070,False,1.0.3.57
Exceptionless,2013-02-22T04:09:48.35Z,Exceptionless is a cloud based error reporting service that sends your exceptions to http://exceptionless.com and provides aggregated views and analytics.,Exceptionless.Mvc,True,2018-02-15T14:19:13.42+00:00,True,False,,"Error,Report,Reporting,Exception,Logging,Log",163392,True,0.9.0.516-pre
Atlassian Pty Ltd.,2013-02-22T02:52:49.913Z,Set of Core utils for Atlassian .NET development,Atlassian.Core,False,1900-01-01T00:00:00+00:00,False,False,,,8177,False,1.0.222.34
Exceptionless,2013-02-21T19:17:36.667Z,Exceptionless is a cloud based error reporting service that sends your exceptions to http://exceptionless.com and provides aggregated views and analytics.,Exceptionless.WebApi,True,2018-02-15T14:21:30.19+00:00,True,False,,"Error,Report,Reporting,Exception,Logging,Log",144636,True,0.9.0.506-pre
"Antoine Aubry,Marco Cecconi",2013-02-22T14:32:20.133Z,"The SixPack rapid development library is a collection of classes for rapid development on the .NET/Mono platform. It has been built with medium to large scale sites in mind, and supports high performance requirements (thousands of concurrent users per server.)",SixPack,False,2014-12-01T06:54:03.13-08:00,True,False,This is the main package of the SixPack library.,"rapid,development,library",17364,False,1.2.41
Hibernating Rhinos,2013-02-21T15:08:11.87Z,The cascade delete bundle allows for a specified set of documents and attachments to be deleted when the document that owns it is deleted. Typical usage scenarios include deleting an attachment that is referenced by a document or removing a set of child documents referenced by a parent document.,RavenDB.Bundles.CascadeDelete,True,1900-01-01T00:00:00+00:00,False,False,,"nosql,ravendb,raven,document,database,bundles",196831,True,2.5.2506-Unstable
Hibernating Rhinos,2013-02-22T13:48:50.297Z,RavenDB 'Authorization' bundle client extend RavenDB and add document level permissions.,RavenDB.Client.Authorization,True,1900-01-01T00:00:00+00:00,False,False,,"nosql,ravendb,raven,document,database,client,bundles,authorization",166092,True,2.0.2284-Unstable
Microsoft,2013-02-21T17:41:09.127Z,Library for walking an object tree as if it were a DOM,Walkies,False,2013-02-21T10:06:22.877-08:00,True,False,,,9928,False,1.2.37
Hibernating Rhinos,2013-02-21T16:27:06.383Z,"This package let you include RavenDB embedded in your asp.net application. RavenDB is a document database for the .NET/Windows platform, offering a flexible data model design to fit the needs of real world systems.",RavenDB.AspNetHost,True,2018-02-22T21:28:46.793+00:00,True,False,This package let you include RavenDB embedded in your Asp.Net web application.,"nosql,ravendb,raven,document,database,embedded",123933,True,2.5.2507-Unstable
Hibernating Rhinos,2013-02-22T13:52:16.867Z,"Use this package if you want to run RavenDB as a standalone application. This package is not intented to be used in Visual Studio. RavenDB is a document database for the .NET platform, offering a flexible data model design to fit the needs of real world systems.",RavenDB.Server,True,1900-01-01T00:00:00+00:00,False,False,This package contains the Raven.Server.exe database binaries.,"nosql,ravendb,raven,document,database",269984,True,2.0.2284-Unstable
Atlassian Pty Ltd.,2013-02-22T02:55:04.917Z,Set of Core utils for Atlassian .NET development,Atlassian.Core,False,1900-01-01T00:00:00+00:00,False,False,,,8177,False,1.0.222.42
Hibernating Rhinos,2013-02-22T13:51:03.333Z,RavenDB Client MvcIntegration let you include a visual profiler in your ASP.NET MVC application which will show you all the opened sessions and the time took to complete each database request. This can help you when developing with RavenDB.,RavenDB.Client.MvcIntegration,True,1900-01-01T00:00:00+00:00,False,False,A visual profiler for RavenDB that you can use in your ASP.NET MVC application.,"nosql,ravendb,raven,document,database,client,mvc",240462,True,2.0.2284-Unstable
Acid Media,2013-02-22T14:35:49.467Z,Mobiscroll package for jQuery,Mobiscroll,False,2014-10-22T05:56:49.22-07:00,True,False,A wheel scroller user control optimized for touchscreens to easily enter date and/or time. The control can easily be customized to support any custom values.,"jQuery,JavaScript,datepicker,timepicker,touchscreen,Webkit,android,iPhone,iPad,webapps,GalaxyTab,dropdown,mobile,wheel,senseui",19226,False,2.4.4
Exceptionless,2013-02-21T20:21:23.493Z,Exceptionless is a cloud based error reporting service that sends your exceptions to http://exceptionless.com and provides aggregated views and analytics.,Exceptionless.Mvc,True,2018-02-15T14:19:13.42+00:00,True,False,,"Error,Report,Reporting,Exception,Logging,Log",163392,True,0.9.0.508-pre
Demis Bellot,2013-02-22T00:43:05.763Z,Add the MsgPack binary format and endpoint to a StackExpress web service host.,StackExpress.Plugins.MsgPack,True,2013-05-05T16:45:52.933-07:00,True,False,MsgPack Format Serializer ContentType ServiceClients for StackExpress,"MsgPack,MessagePack,Message,Pack,Fast,Binary,Serializer,Format,ContentType,StackExpress,REST,Web,Services",65319,False,3.9.575-unstable
"Antoine Aubry,Marco Cecconi",2013-02-22T14:59:31.19Z,"The SixPack rapid development library is a collection of classes for rapid development on the .NET/Mono platform. It has been built with medium to large scale sites in mind, and supports high performance requirements (thousands of concurrent users per server.)",SixPack,False,2014-12-01T06:54:03.13-08:00,True,False,This is the main package of the SixPack library.,"rapid,development,library",17364,False,1.2.42
Demis Bellot,2013-02-22T10:44:49.887Z,"Binaries for the StackExpress web framework.
      Visit http://www.ServiceStack.net/ServiceStack.Hello/
      and https://github.com/ServiceStack/ServiceStack/wiki/Create-your-first-webservice
      for walk throughs and docs on creating your first web service.",StackExpress,True,2013-05-05T16:45:17.45-07:00,True,False,Opensource .NET and Mono REST Web Services framework,"Fast,JSON,XML,CSV,HTML,SOAP,JSV,REST,Web,Service,Framework,MONO",68884,False,3.9.576-unstable
"Structum,Inc.",2013-02-22T07:27:52.817Z,Create applications that take advatage of the iKnode Cloud Platform. Get started in minutes using the SDK and start executing your Applications and storing data in the Cloud.,iKnodeSdk,False,2013-02-21T23:27:52.817-08:00,True,False,Create applications that take advatage of the iKnode Cloud Platform.,"baas,backend,rest,iknode,cloud",1106,False,1.0.0.2
Atlassian Pty Ltd.,2013-02-22T03:09:52.57Z,Set of Core utils for Atlassian .NET development,Atlassian.Core,False,1900-01-01T00:00:00+00:00,False,False,,,8177,False,1.0.222.71
JoobMobile,2013-02-22T01:50:42.963Z,"JoobMobile Client for .net 4.5 / Windows 8 / Windows Phone 8
Alpha package to test nuget installation and see whats broken. Not currently recommended for installation.",JoobMobile,False,1899-12-31T16:00:00-08:00,False,False,,,18999,False,3.1.0.57
"Antoine Aubry,Marco Cecconi",2013-02-22T15:15:26.867Z,"The SixPack rapid development library is a collection of classes for rapid development on the .NET/Mono platform. It has been built with medium to large scale sites in mind, and supports high performance requirements (thousands of concurrent users per server.)",SixPack,False,2014-12-01T06:54:03.13-08:00,True,False,This is the main package of the SixPack library.,"rapid,development,library",17364,False,1.2.43
Atlassian Pty Ltd.,2013-02-22T03:15:43.993Z,Set of Core utils for Atlassian .NET development,Atlassian.Core,False,1900-01-01T00:00:00+00:00,False,False,,,8177,False,1.0.222.81
Probel,2013-02-21T22:28:22.707Z,Allow to manage remote statistics,Probel.NDoctor.Statistics,False,2013-02-24T10:45:27.52-08:00,True,False,,"nDoctor,statistics",4070,False,1.0.2.42244
Harry McIntyre,2013-02-22T16:26:01.87Z,"FormFactory generates HTML forms from object models, using conventions and a semantic model. See http://formfactory.apphb.com/",FormFactory,False,2018-03-12T09:51:06.5+00:00,True,False,,,91805,False,1.2.243
Hibernating Rhinos,2013-02-22T13:51:24.267Z,RavenDB 'Unique Constraints' bundle client. Allow the user to implement unique constraints in the objects (useful for properties like email or social security number).,RavenDB.Client.UniqueConstraints,True,1900-01-01T00:00:00+00:00,False,False,,"nosql,ravendb,raven,document,database,client,bundles",239798,True,2.0.2284-Unstable
Microsoft,2013-02-22T14:09:10.687Z,Noodles transforms your object model into a web app. This assembly contains stuff to make Noodles work with ASP MVC,Noodles.AspMvc,False,2013-11-23T10:56:42.207-08:00,True,False,,,41585,False,1.1.379
Exceptionless,2013-02-21T17:58:33.927Z,Exceptionless is a cloud based error reporting service that sends your exceptions to http://exceptionless.com and provides aggregated views and analytics.,Exceptionless.Windows,True,2018-02-15T14:21:56.363+00:00,True,False,,"Error,Report,Reporting,Exception,Logging,Log",119842,True,0.9.0.503-pre
Michael Galetzka,2013-02-21T20:57:17.353Z,This is a general scheduling framework able to create schedules using arbitrary constraints written in C#.,Schedule4Net,False,2013-03-05T06:54:33.217-08:00,True,False,,"schedule,scheduler,constraint,framework,task,algorithm",1784,False,1.1.1
Exceptionless,2013-02-22T18:23:15.097Z,Exceptionless is a cloud based error reporting service that sends your exceptions to http://exceptionless.com and provides aggregated views and analytics.,Exceptionless,True,2018-02-15T14:17:13.09+00:00,True,False,,"Error,Report,Reporting,Exception,Logging,Log",293079,True,0.9.0.517-pre
Aaron Powell,2013-02-21T23:57:15.52Z,This is a simple plugin that allows you to inspect your KnockoutJS ViewModels using the Glimpse tool,glimpse-knockout,False,2013-03-06T03:12:34.007-08:00,True,False,A KnockoutJS inspector for Glimpse,"knockoutjs,glimpse,web",17847,False,0.1.4
Maciek Misztal,2013-02-22T08:31:44.67Z,Nx.UI Library for cross-platform application developement,Nx.UI,False,2013-05-16T15:00:18.677-07:00,True,False,,,10502,False,0.0.41.22466
Hibernating Rhinos,2013-02-21T10:59:08.603Z,"Use this package if you want to run RavenDB as a standalone application. This package is not intented to be used in Visual Studio. RavenDB is a document database for the .NET platform, offering a flexible data model design to fit the needs of real world systems.",RavenDB.Server,True,1900-01-01T00:00:00+00:00,False,False,This package contains the Raven.Server.exe database binaries.,"nosql,ravendb,raven,document,database",269984,True,2.0.2282-Unstable
Paul Trampert,2013-02-22T03:09:43.403Z,"This package provides managed hooks into libvlc.dll. Included with this package are libvlc.dll, libvlccore.dll, and the plugins directory for convenience.",com.ptrampert.LibVLCBind,False,2013-07-05T18:06:09.27-07:00,True,False,,,3534,False,2.0.1
jduv,2013-02-22T20:03:33.397Z,"SqlLightning is a small, lightweight SQL data access layer designed to supplement existing ORM technology.",SqlLightning,False,2013-02-22T20:53:03.1-08:00,True,False,,,755,False,1.0.1.2
"CityIndex Ltd,Sky Sanders,David Laing",2013-02-21T23:32:23.823Z,.NET client library for CityIndex Trading API,CIAPI,True,2013-11-06T02:04:00.687-08:00,True,False,,,39961,False,9.5.3-bleeding-545
Peter Lisovin,2013-02-21T21:35:49.437Z,"Core of the framework for developing scalable JavaScript client side applications.

      The framework is targeted towards a .Net developer who has experience with Silverlight or WPF and is looking for ways to apply same principles and patterns (e.g. MVVM, bindings, modularization, templated controls, reactive programming, etc.) to JavaScript client side development. It's inspired by Nicholas Zakas ""Scalable JavaScript Application Architecture"" talk.

      The framework leverages best tools and libraries such as Knockout, Linq, RxJS, RequireJS, JSLint, Nuget, Chutzpah, jasmine, etc. and relies on what's considered as ""good parts"" of JavaScript language.",scalejs,False,2013-12-07T09:51:44.447-08:00,True,False,Core library for developing scalable JavaScript application,"JavaScript,scalejs,scalable",9466,False,0.2.7.1
Hibernating Rhinos,2013-02-21T15:53:10.613Z,"Use this package if you want to run RavenDB as a standalone application. This package is not intented to be used in Visual Studio. RavenDB is a document database for the .NET platform, offering a flexible data model design to fit the needs of real world systems.",RavenDB.Server,True,1900-01-01T00:00:00+00:00,False,False,This package contains the Raven.Server.exe database binaries.,"nosql,ravendb,raven,document,database",269984,True,2.0.2283-Unstable
Terry SoRelle,2013-02-22T00:06:02.977Z,Adds references controllers and Atlatl views for simple authentication.,Catapult.Peanut.Atlatl.AccountController,False,2013-04-05T11:21:59.05-07:00,True,False,,"Catapult,Peanut,Atlatl",2201,False,1.0.2
Hibernating Rhinos,2013-02-21T15:08:37.9Z,"This package includes the client API of RavenDB. RavenDB is a document database for the .NET platform, offering a flexible data model design to fit the needs of real world systems.",RavenDB.Client,True,2018-03-30T12:13:14.39+00:00,True,False,This package includes the client API of RavenDB.,"nosql,ravendb,raven,document,database,client",1114390,True,2.5.2506-Unstable
Exceptionless,2013-02-22T18:23:19.163Z,Exceptionless is a cloud based error reporting service that sends your exceptions to http://exceptionless.com and provides aggregated views and analytics.,Exceptionless.Web,True,2018-02-15T14:21:03.533+00:00,True,False,,"Error,Report,Reporting,Exception,Logging,Log",130384,True,0.9.0.517-pre
Ninject Project Contributors,2013-02-22T15:31:23.367Z,Adds Web hosting support to web common.,Ninject.Web.Common.WebHost,True,2017-10-23T14:34:18.073+00:00,True,False,,"Ninject,ioc,di,ASP.NET",2142669,False,3.0.2-unstable-2
SYSTEM,2013-02-21T19:38:50.173Z,Noodles transforms your object model into a web app. Install this library to use Noodles with Web Api,Noodles.WebApi,False,2013-11-23T10:56:58.177-08:00,True,False,,,39841,False,1.1.374
Hibernating Rhinos,2013-02-21T15:08:29.14Z,This bundle aims to allow the user to implement unique constraints in the objects (usefull for properties like email or social security number).,RavenDB.Bundles.UniqueConstraints,True,1900-01-01T00:00:00+00:00,False,False,,"nosql,ravendb,raven,document,database,bundles",212752,True,2.5.2506-Unstable
Karsten N. Strand,2013-02-21T19:34:00.977Z,Core library for exposing a web service through Pomona.,Pomona,True,2017-09-22T12:41:25.8+00:00,True,False,,"REST,linq,mapping",36105,False,0.1.2-alpha6
Mariuzzo,2013-02-22T15:27:36.373Z,Extra missing components for ASP.NET MVC.,Mariuzzo.Web.Mvc.Extras,False,2013-03-08T01:32:45.677-08:00,True,False,,"asp.net,mvc,extra,extras",3364,False,13.2.22.20613
Valeriu Caraulean,2013-02-21T15:23:04.727Z,"Integration of Caliburn.Micro with Telerik's controls: conventions, IWindowManager implementation (TelerikWindowManager), extensions methods to IWindowManager: Alert, Confirm, Prompt. 
      Target frameworks: Silverlight 5.0, WPF 4.
      Source code with sample projects available at http://github.com/vcaraulean/Caliburn.Micro.Telerik .",Caliburn.Micro.Telerik,False,2013-07-03T07:10:30.09-07:00,True,False,Caliburn.Micro conventions for Telerik controls,"Caliburn.Micro,Telerik,Silverlight,WPF,SL40,SL50",17994,False,2.1.5
maruf,2013-02-22T00:15:14.747Z,Easy file upload integration in mvc application with JQuery File Upload javascript plugin and Html helpers,MvcFileUploader,False,2015-04-29T19:52:34.803-07:00,True,False,,"FileUpload,JQuery,File,Upload,Mvc",14304,False,1.1.0
Exceptionless,2013-02-21T18:38:28.763Z,Exceptionless is a cloud based error reporting service that sends your exceptions to http://exceptionless.com and provides aggregated views and analytics.,Exceptionless.Windows,True,2018-02-15T14:21:56.363+00:00,True,False,,"Error,Report,Reporting,Exception,Logging,Log",119842,True,0.9.0.504-pre
csainty,2013-02-22T17:38:21.167Z,Adds entries for each RavenDb query to the MiniProfiler results table.,MiniProfiler.RavenDb,False,2013-02-22T09:38:21.167-08:00,True,False,,"ravendb,miniprofiler",14530,True,2.3.0
RainbowSoft,2013-02-22T12:35:28.833Z,Fluent exception handlers for .net,exceptional,False,2013-02-22T04:35:29.88-08:00,True,False,,,3471,False,1.0.0.2
Atlassian Pty Ltd.,2013-02-22T02:48:55.55Z,Set of Core utils for Atlassian .NET development,Atlassian.Core,False,1900-01-01T00:00:00+00:00,False,False,,,8177,False,1.0.222.28
Hibernating Rhinos,2013-02-22T13:48:26.547Z,"The Authorization Bundle extend RavenDB and add document level permissions. The Auth Bundle allows to define permissions for a specific user, a group or using arbitrary tagging. The system is design to be high performance, scalable and flexible.",RavenDB.Bundles.Authorization,True,1900-01-01T00:00:00+00:00,False,False,,"nosql,ravendb,raven,document,database,bundles,authorization",199189,True,2.0.2284-Unstable
Probel,2013-02-22T17:18:12.1Z,Allow to manage remote statistics,Probel.NDoctor.Statistics,False,2013-02-24T10:45:27.52-08:00,True,False,,"nDoctor,statistics",4070,False,1.0.3.133
Microsoft,2013-02-22T13:36:40.907Z,Noodles transforms your object model into a web app. This assembly contains stuff to make Noodles work with ASP MVC,Noodles.AspMvc,False,2013-11-23T10:56:42.207-08:00,True,False,,,41585,False,1.1.377
"CityIndex Ltd,Sky Sanders,David Laing",2013-02-21T18:12:46.29Z,.NET client library for CityIndex Trading API,CIAPI,True,2013-11-06T02:04:00.687-08:00,True,False,,,39961,False,9.5.3-bleeding-520
CubeBuild Team,2013-02-21T23:21:01.633Z,This is a plugin to the CubeBuild MVC Framework that adds the ability to create and present custom forms.,CubeBuild.Forms,False,2013-03-11T00:20:36.753-07:00,True,False,,"cms,mvc",2904,False,1.0.4801.18578
