authors,created,description,id,is_prerelease,last_updated,listed,missing_info,summary,tags,total_downloads,verified,version"XAct Software Solutions,Inc.",2015-09-28T09:09:22.363Z,An XActLib assembly: assembly for persisting History entries related to specific domain entities (not the same as Tracing or Logging).,XAct.History,False,2017-02-08T17:57:18.227-08:00,True,False,,"XAct,XActLib",73308,False,0.0.5002
CityIndex Ltd,2015-09-28T05:44:01.5Z,LogSearchShipper client,LogSearchShipper,False,1899-12-31T16:00:00-08:00,False,False,,,4392,False,1.0.5749.22734
Bryan Apellanes,2015-09-28T00:43:18.213Z,Data access objects and tools for use with the Bam framework,Bam.Net.Data,False,2018-01-25T03:43:20.57+00:00,True,False,,,7570,False,1.0.8
Team XSockets Sweden AB,2015-09-28T07:59:57.203Z,Provides a javascript API for sending text and binary messages to a XSockets server with a pub/sub and rpc pattern.,XSockets.JsApi,False,2017-11-18T07:43:11.12+00:00,True,False,Provides a javascript API for sending text and binary messages to a XSockets server with a pub/sub and rpc pattern.,"XSockets,Websockets,JavaScript,HTML5",61022,False,5.0.0
"XAct Software Solutions,Inc.",2015-09-28T08:52:45.63Z,An XActLib assembly: a library to develop Uml diagrams describing functionality of an application.,XAct.Diagnostics.Uml,False,2017-02-08T17:57:09.243-08:00,True,False,,"XAct,XActLib",6745,False,0.0.5002
"XAct Software Solutions,Inc.",2015-09-28T11:18:11.863Z,An XActLib assembly: an assembly to manage K2 Servers.,XAct.Workflows.K2.Management,False,2017-02-08T17:58:17.947-08:00,True,False,,"XAct,XActLib",57815,False,0.0.5003
rasmus,2015-09-28T11:30:04.013Z,MSSQL event store for EventFlow,EventFlow.EventStores.MsSql,False,1899-12-31T16:00:00-08:00,False,False,,"CQRS,ES,event,sourceing,mssql,eventstore",-1,False,0.17.1134
latticework,2015-09-28T08:01:13.233Z,latticework.cs,latticework.cs,False,2013-07-22T14:32:56.307+00:00,True,False,,,309952,False,0.0.1202
Renato Golia,2015-09-28T06:53:08.58Z,Nybus makes it easier to decouple the components of your platform by letting you raise events and invoking commands that will be eventually handled by other components.,Nybus.Interfaces,False,2016-11-27T17:35:37.643-08:00,True,False,,,6742,False,0.4.0.65
"XAct Software Solutions,Inc.",2015-09-28T10:14:55.977Z,An XActLib assembly: a library of Services and connectors to report the status on the server.,XAct.Diagnostics.Status,False,2017-02-08T17:57:08.807-08:00,True,False,,"XAct,XActLib",10369,False,0.0.5003
Team XSockets Sweden AB,2015-09-28T07:59:57.203Z,Provides a javascript API for sending text and binary messages to a XSockets server with a pub/sub and rpc pattern.,XSockets.JsApi,False,2017-11-18T07:43:11.12+00:00,True,False,Provides a javascript API for sending text and binary messages to a XSockets server with a pub/sub and rpc pattern.,"XSockets,Websockets,JavaScript,HTML5",61022,False,5.0.0
Bryan Apellanes,2015-09-28T00:44:49.943Z,Repository pattern providers for Bam framework,Bam.Net.Data.Repositories,False,2018-01-25T03:45:16.277+00:00,True,False,,,10610,False,1.0.8
CityIndex Ltd,2015-09-28T07:36:02.477Z,LogSearchShipper client,LogSearchShipper,False,1899-12-31T16:00:00-08:00,False,False,,,4392,False,1.0.5749.26259
Paul Jenkins; Jake Ginnivan; Brendan Forster (shiftkey); Alex Mitchell (Amrykid); Dennis Daume (flagbug); Jan Karger (punker76),2015-09-28T10:44:43.623Z,"The goal of MahApps.Metro is to allow devs to quickly and easily cobble together a ""Metro"" or ""Modern UI"" for their WPF4+ apps, with minimal effort.",MahApps.Metro,True,2018-03-13T22:31:08.54+00:00,True,False,"The goal of MahApps.Metro is to allow devs to quickly and easily cobble together a ""Metro"" or ""Modern UI"" for their WPF4+ apps, with minimal effort.","WPF,UI,Metro,ModernUI,XAML,Toolkit,Library,.NET",1273570,True,1.1.3-ALPHA178
Team XSockets Sweden AB,2015-09-28T08:01:51.607Z,A package for building modular applications in a blink.,XSockets.Plugin.Framework,False,2017-11-20T17:57:01.813+00:00,True,False,Inspired by MEF this package lets you Export/Import types unknown a compile time.,"plugin,modularity,modules",63216,False,5.0.0
Alain Defrance,2015-09-27T23:17:48.64Z,Lightweight documentation tool,Projbook,False,2016-10-27T20:51:02.14-07:00,False,False,,,8257,False,0.1.0
"Robert Moore,Matthew Davies",2015-09-28T02:50:54.957Z,"Provides an NHibernate driver that uses the Microsoft Transient Fault Handling library to allow for reliable SQL Azure connections.
      This package has the Microsoft Transient Fault Handling library IL-merged into it; for a version that doesn't see the NHibernate.SqlAzure.Standalone package.",NHibernate4.SqlAzure,False,2018-02-18T01:39:16.953+00:00,True,False,,"nhibernate,azure,sql,transient",19848,False,2.1.3
Qsys Sverige AB,2015-09-28T06:26:19.067Z,QuickPick One Database assembly server component,QuickPickOneCLR,False,2018-02-19T10:36:42.787+00:00,True,False,,"Apollo,Apollo13,Quickpick,Qsys",87785,False,1.0.15222.59
"XAct Software Solutions,Inc.",2015-09-28T08:33:48Z,An XActLib assembly: an assembly to deploy database schemas.,XAct.Deployment.Db.Schemas,False,2017-02-08T17:57:08.023-08:00,True,False,,"XAct,XActLib",55550,False,0.0.5002
Bryan Apellanes,2015-09-28T00:41:42.163Z,Automation Tools,Bam.Net.Automation,False,2018-01-25T03:44:09.523+00:00,True,False,,,10811,False,1.0.8
aloisdg,2015-09-28T12:24:44.82Z,"FeedParserPCL is a PCL to parse Atom, Rss and Rdf feed.",FeedParserPCL,True,2015-09-28T05:24:44.82-07:00,True,False,,,169,False,0.1.5749.31894-alpha
Konstantinos Papakonstantinou,2015-09-27T22:53:32.84Z,A simple wrapper for reading typed values from ConfigurationManager.AppSettings,SimpleAppSettings,False,2015-09-27T16:46:23.393-07:00,True,False,,,975,False,0.1.0
"Mike Hadlow,Contributors (see GitHub repo)",2015-09-28T10:30:22.67Z,"EasyNetQ is a simple, opinionated .NET API for RabbitMQ",EasyNetQ,False,1900-01-01T00:00:00+00:00,False,False,,"RabbitMQ,Messaging,AMQP",755864,False,0.50.8.400
"XAct Software Solutions,Inc.",2015-09-28T08:13:14.243Z,An XActLib Assembly: code common to the whole library using only Portable Class Library references.,XAct.Core.PCL,False,2015-11-01T20:52:06.727-08:00,True,False,,"XAct,XActLib",37496,False,0.0.5002
Bryan Apellanes,2015-09-28T00:40:53.173Z,Appication services including tools for creating distributed compute nodes out of pocos,Bam.Net.ApplicationServices,False,2016-01-21T10:54:03.563-08:00,True,False,,,3031,False,1.0.8
"XAct Softwaer Solutions,Inc.",2015-09-28T09:07:48.817Z,An XActLib Assembly: a base library for accessing Graphs via Repositories.,XAct.Graphs.Persistence.Db,False,2015-11-02T03:25:55.57-08:00,True,False,,"XAct,XActLib",54531,False,0.0.5002
Cady.IO,2015-09-28T03:23:34.897Z,A collection of .Net Utilities,Dewey.Net,False,2016-06-26T15:22:29.937-07:00,True,False,,,8835,False,2.7.7
"Chris Patterson,Dru Sellers,Travis Smith",2015-09-28T04:32:03.813Z,"MassTransit is a distributed application framework for .NET, including support for RabbitMQ and Azure Service Bus.",MassTransit.Automatonymous,False,2018-04-17T18:21:30.787+00:00,True,False,MassTransit Automatonymous State Machine Support,MassTransit,53045,False,3.0.13
Thomas Blitz,2015-09-28T00:12:51.54Z,Validate and encrrypt passwords based on hashing and salting passwords. Use for basic authentication.,Encryption,False,1899-12-31T16:00:00-08:00,False,False,,"Encryption,Krypt,Password,Salt,SHA512,basic,authentication",-1,False,1.0.0
Dave Senn,2015-09-28T10:16:57.713Z,Extend is a set of .Net extension methods build as portable class library. Extend enhance the .Net framework by adding a bunch of methods to increase developer’s productivity.,Extend,True,2017-11-04T17:20:53.59+00:00,True,False,,"C#,Extensions,Extend,Portable,Extension,Methods,.Net,Library,PCL",19966,False,1.1.6.78-alpha
Gibraltar Software,2015-09-01T21:56:13.033Z,Enables logging of VistaDB diagnostic and trace information to Loupe.,VistaDB.5.Loupe,False,2016-09-12T20:34:39.737-07:00,True,False,,"VistaDB,Loupe,Logging",1573,False,5.1.2.1432
Dave Senn,2015-09-28T08:09:06.29Z,Extend is a set of .Net extension methods build as portable class library. Extend enhance the .Net framework by adding a bunch of methods to increase developer’s productivity.,Extend,True,2017-11-04T17:20:53.59+00:00,True,False,,"C#,Extensions,Extend,Portable,Extension,Methods,.Net,Library,PCL",19966,False,1.1.6.76-alpha
"XAct Software Solutions,Inc.",2015-09-28T08:39:22.113Z,An XActLib assembly: services to report product defects.,XAct.Diagnostics.Defects,False,2015-11-01T21:23:35.213-08:00,True,False,,"XAct,XActLib",52934,False,0.0.5002
Team XSockets Sweden AB,2015-09-28T07:56:20.083Z,"Supports: .NET 4.0+, Xamarin iOS x64, MonoTouch (iOS), MonoDroid (Android).",XSockets.Client,False,2017-01-19T13:30:37.953+00:00,True,False,"On github you can also find more clients such as JavaScript, Dart, NETMF,  Arduino etc","XSockets,Websockets,Realtime",37186,False,5.0.0
ScottISAFool,2015-07-31T22:15:37.237Z,Helper library to more easily create the notification to update tiles for all sizes,AdaptiveTileExtensions,False,1899-12-31T16:00:00-08:00,False,False,,"Adaptive,tiles,uwp",-1,False,1.0.0
"XAct Software Solutions,Inc.",2015-09-28T10:38:37.767Z,An XActLib assembly: Library for working with NVelocity,XAct.IO.TemplateEngines.NVelocity,False,2017-02-09T01:57:27.383+00:00,True,False,,"XAct,XActLib",90040,False,0.0.5003
winadmin,2015-09-28T10:32:57.827Z,Description,ObjectDiffer,False,2015-11-09T13:07:53.637+00:00,True,False,,,2140,False,1.0.11
Team XSockets Sweden AB,2015-09-28T07:59:03.34Z,Item Templates for XSockets in Visual Studio,XSockets.ItemTemplates,False,2017-03-21T06:15:40.17-07:00,True,False,Item Templates for XSockets in Visual Studio,"Websockets,sockets,WebRTC,Realtime,XSockets,m2m,p2p,client,server,IoT",4780,False,5.0.0
"XAct Software Solutions,Inc.",2015-09-28T11:13:52.187Z,An XActLib assembly: a Library of code for working with Asp.NET Mvc v3 Framework,XAct.UI.Web.Mvc,False,2017-02-09T01:58:07.993+00:00,True,False,,"XAct,XActLib",69921,False,0.0.5003
"James Newkirk,Brad Wilson",2015-09-28T03:41:22.157Z,"Console and Visual Studio runner for xUnit.net.

Supported platforms:
- DNX 4.5.1
- DNX Core 5+",xunit.runner.dnx,True,1899-12-31T16:00:00-08:00,False,False,,,-1,False,2.1.0-beta5a-build188
"XAct Software Solutions,Inc.",2015-09-28T08:20:20.69Z,An XActLib assembly: common code specific app.Config Configuration,XAct.Configuration,False,2017-02-08T17:56:54.79-08:00,True,False,,"XAct,XActLib",90743,False,0.0.5002
"XAct Software Solutions,Inc.",2015-09-28T10:46:22.7Z,"An XActLib assembly: implementations of the contracts defined in XAct.Notifications, using EF.",XAct.Notifications.Persistence.EF,False,2017-02-09T01:57:39.163+00:00,True,False,,"XAct,XActLib",53515,False,0.0.5003
"Chris Patterson,Dru Sellers,Travis Smith",2015-09-28T04:33:34.45Z,"MassTransit is a distributed application framework for .NET, including support for RabbitMQ and Azure Service Bus.",MassTransit.CastleWindsor,False,2018-04-17T18:21:48.16+00:00,True,False,MassTransit Castle Windsor Container Support,MassTransit,74335,False,3.0.13
Paket team,2015-09-28T08:58:30.283Z,A package dependency manager for .NET with support for NuGet packages and GitHub repositories.,Paket.Core,False,2018-04-17T08:54:04.56+00:00,True,False,A package dependency manager for .NET with support for NuGet packages and GitHub repositories.,"nuget,bundler,F#",293543,False,2.4.0
kanirudha14,2015-09-28T09:36:39.007Z,Html Helper exrtensions uysing bootstrap theme. Mainly includes grid using Bootstrap-Table,BsMvc,False,1899-12-31T16:00:00-08:00,False,False,,,-1,False,1.0.1
"XAct Software Solutions,Inc.",2015-09-28T09:58:52.783Z,"An XActLib assembly: a base assembly that almost all other XActLib assemblies have a reference. Contains mostly ExtensionMethods, essential common interfaces, enums, and collections, but contains a couple of essential Services used by all other assemblies.",XAct.Core,False,2017-02-08T17:56:57.023-08:00,True,False,,"XAct,XActLib",104221,False,0.0.5003
Microsoft,2015-09-28T06:00:02.317Z,"This client library adds file management capabilities to client applications built with the Azure Mobile Apps SDK. For more information, check out https://www.windowsazure.com/mobile.",WindowsAzure.MobileServices.Files,True,1899-12-31T16:00:00-08:00,False,False,Windows Azure Mobile Apps File Management SDK.,"microsoft,windows,azure,mobile,services,windowsazureofficial",-1,False,1.0.0-alpha
Troi GmbH,2015-09-28T11:23:43.743Z,Troi API client,Troi.API,False,2016-11-15T13:46:15.547+00:00,False,False,,"Troi,API",2550,False,1.5.5
City Index Ltd,2015-09-28T10:42:45.007Z,Additional appenders for the log4net logging framework,log4net.Appenders.Contrib,False,2015-09-28T20:41:48.763-07:00,True,False,,,3575,False,3.0.1.22
"XAct Software Solutions,Inc.",2015-09-28T10:49:49.84Z,"An XActLib assembly: an Assembly that provides a Service to map Domain Entities to Client Layer Models, and/or Data Storage Entities.",XAct.ObjectMapping,False,2017-02-09T01:57:41.01+00:00,True,False,,"XAct,XActLib",74370,False,0.0.5003
Alain Defrance,2015-09-28T07:20:03.423Z,Lightweight documentation tool,Projbook,False,2016-10-27T20:51:02.14-07:00,False,False,,,8257,False,0.1.3
"XAct Software Solutions,Inc.",2015-09-28T11:12:21.283Z,An XActLib assembly: Domain object required to support UI development.,XAct.UI.Entities,False,2017-02-09T01:58:06.37+00:00,True,False,,"XAct,XActLib",56552,False,0.0.5003
Darcslate,2015-09-28T03:54:19.33Z,Simulation description,Simulation,False,2015-09-28T18:44:24.583-07:00,True,False,,"Dorbits,Shape",1482,False,2015.9.28.2
"XAct Software Solutions,Inc.",2015-09-28T10:10:44.207Z,An ActLib Assembly: OBSOLETE:  Prefer using XAct.Diagnostics.Status.,XAct.Diagnostics.Integration.Checks,False,2017-02-09T01:57:07.65+00:00,True,False,,"XAct,XActLib",56223,False,0.0.5003
kanirudha14,2015-09-28T09:50:06.393Z,Html Helper exrtensions uysing bootstrap theme. Mainly includes grid using Bootstrap-Table,BsMvc,False,1899-12-31T16:00:00-08:00,False,False,,,-1,False,1.0.2
Bastian Eicher,2015-09-25T13:55:35.99Z,This package provides extension methods for registering Dehydrator.EntityFramework repositories and factories in the Unity Application Block.,Dehydrator.EntityFramework.Unity,False,2016-10-17T10:55:07.573+00:00,True,False,Extension methods for registering Dehydrator.EntityFramework in Unity,"Dehydrate,Entity,JSON,REST,WebAPI,ORM,EntityFramework",2018,False,0.1.0
Renato Golia,2015-09-28T06:55:14.247Z,Nybus makes it easier to decouple the components of your platform by letting you raise events and invoking commands that will be eventually handled by other components.,Nybus.Core,False,2016-11-27T17:36:01.41-08:00,True,False,,,5941,False,0.4.0.65
"Chris Patterson,Dru Sellers,Travis Smith",2015-09-28T04:31:16.73Z,"MassTransit is a distributed application framework for .NET, including support for RabbitMQ and Azure Service Bus.",MassTransit.Autofac,False,2018-04-17T18:21:26.787+00:00,True,False,MassTransit Autofac Container Support,MassTransit,151490,False,3.0.13
"XAct Software Solutions,Inc.",2015-09-28T08:22:17.077Z,"An XActLib assembly: a base assembly that almost all other XActLib assemblies have a reference. Contains mostly ExtensionMethods, essential common interfaces, enums, and collections, but contains a couple of essential Services used by all other assemblies.",XAct.Core,False,2017-02-08T17:56:57.023-08:00,True,False,,"XAct,XActLib",104221,False,0.0.5002
"XAct Software Solutions,Inc.",2015-09-28T10:57:01.277Z,An XActLib assembly: a library to provide datastorage of XAct.Scheduling entities.,XAct.Scheduling.Persistence.EF,False,2017-02-09T01:57:49.383+00:00,True,False,,"XAct,Software,Solutions,Inc.",54331,False,0.0.5003
"XAct Software Solutions,Inc.",2015-09-28T10:54:59.42Z,An XActLib assembly: an implementation of XAct.Rules using EntityFramework.,XAct.Rules.Persistence.EF,False,2017-02-09T01:57:46.29+00:00,True,False,,"XAct,XActLib",56158,False,0.0.5003
"XAct Software Solutions,Inc.",2015-09-28T10:03:53.22Z,"An XAct Library Assembly: an Assembly that builds on the interfaces defined in XAct.Data, to provide RDBMS specific functionality.",XAct.Data.Db,False,2017-02-08T17:57:01.04-08:00,True,False,,"XAct,XActLib",97937,False,0.0.5003
"Aleksander Sjåfjell,Kristian Enge",2015-09-28T08:54:32.253Z,Klientbibliotek for integrasjon mot Digipost REST-API.,digipost-api-client,True,2017-11-29T10:51:09.823+00:00,True,False,Apache Licence 2.0,,16470,False,6.2.5749.17830-beta
Konstantinos Papakonstantinou,2015-09-27T23:07:54.237Z,A simple wrapper for reading typed values from ConfigurationManager.AppSettings,SimpleAppSettings,False,2015-09-27T16:46:23.393-07:00,True,False,,,975,False,0.1.0.3
unvell,2015-09-28T03:02:13.163Z,"Free Spreadsheet control to open, show, edit, print and save Excel format spreadsheet. Supports many extensions such as cell types, custom cells, selection mode, read-only-mode, formula calculation, even the script execution like VBA.",unvell.ReoGrid.dll,False,2017-10-21T13:17:26.757+00:00,True,False,,"Grid,Spreadsheet,Excel,Drawing,Chart",5917,False,0.9.1
"XAct Software Solutions,Inc.",2015-09-28T10:55:22.8Z,An XActLib assembly: a Library of code for working with ActiveX and COM,XAct.Runtime.InteropServices,False,2017-02-09T01:57:45.993+00:00,True,False,,"XAct,XActLib",92089,False,0.0.5003
Carlos G. Sarmiento,2015-09-28T06:28:19.283Z,The dynamic configuration manager for .NET,DynamiConf.IniInterpreter,False,2015-09-28T20:28:01.717-07:00,True,False,,"Configuration,Dynamic,DynamiConf,Conf,Ini",1035,False,0.2.4
"XAct Software Solutions,Inc.",2015-09-28T10:00:03.023Z,"An XAct Library Assembly: An Assembly that contains interfaces common to datastore, while not limiting it to DBMS (see XAct.Data.Db, XAct.Data.EF, for such functionality).",XAct.Data,False,2017-02-08T17:56:56.587-08:00,True,False,,"XAct,XActLib",98101,False,0.0.5003
Thomas Blitz,2015-09-28T00:15:05.96Z,Validate and encrrypt passwords based on hashing and salting passwords. Use for basic authentication.,Krypt,False,2015-09-27T17:26:18.527-07:00,True,False,,"Encryption,Krypt,Password,Salt,SHA512,basic,authentication",446,False,1.0.0
rasmus,2015-09-28T11:30:29.99Z,MSSQL read store for EventFlow,EventFlow.ReadStores.MsSql,False,1899-12-31T16:00:00-08:00,False,False,,"CQRS,ES,event,sourceing,mssql,readstore",-1,False,0.17.1134
"XAct Software Solutions,Inc.",2015-09-28T11:02:21.533Z,An XActLib assembly: a Library for working with an DependencyInjectionContainer in an Mvc App,XAct.Services.IoC.AspMvc,False,2017-02-09T01:57:57.337+00:00,True,False,,"XAct,XActLib",73865,False,0.0.5003
Notificatio Team (Ilya P.),2015-09-18T02:39:39.563Z,Send Telegram notifications with one line of C#. http://landing.notifcatio.me,Notificatio.TelegramClient,False,1899-12-31T16:00:00-08:00,False,False,,,-1,False,1.0.1
"XAct Software Solutions,Inc.",2015-09-28T10:37:45.267Z,An XActLib assembly: a library for accessing the FS system directly (not IsolatedStorage). Higher security concern than just XAct.IO,XAct.IO.FS,False,2017-02-09T01:57:24.71+00:00,True,False,,"XAct,XActLib",91702,False,0.0.5003
"XAct Software Solutions,Inc.",2015-09-28T10:52:41.39Z,An XActLib assembly: a Library for working with Resources.,XAct.Resources,False,2017-02-08T17:57:43.633-08:00,True,False,,"XAct,XActLib",93390,False,0.0.5003
Roman Ivantsov,2015-09-28T07:54:33.527Z,VITA ORM driver for MS SQL Compact Edition.,Vita.Data.SqlCe,False,2017-07-24T23:39:13.29+00:00,True,False,,"VITA,ORM,SqlCe",5722,False,1.6.7
"XAct Software Solutions,Inc.",2015-09-28T08:16:33.5Z,An XActLib assembly: providing persistence (using EF) to XAct.Assistance services.,XAct.Assistance.Persistence.EF,False,2017-02-08T17:56:51.35-08:00,True,False,,"XAct,XActLib",48278,False,0.0.5002
"XAct Software Solutions,Inc.",2015-09-28T10:41:59.85Z,"An XActLib assembly: an implementation of the Markdown contracts defined in XAct.IO.Transformations.Markdown, using the Markdownsharp library.",XAct.IO.Transformations.Markdown.MarkdownSharp,False,2017-02-08T17:57:31.197-08:00,True,False,,"XAct,XActLib",55587,False,0.0.5003
juniho,2015-09-28T03:51:58.793Z,Base classes from RabbitSoftware,Rabbit.Foundation,False,2016-06-16T04:04:04.577-07:00,False,False,,"RabbitSoftware,SmartList",4680,False,1.4.1
"XAct Software Solutions,Inc.",2015-09-28T11:06:21.727Z,"An XActLib assembly: an implementation of the contract defined in XAct.Settings.Host.Db, using EntityFramework CodeFirst.",XAct.Settings.Persistence.EF,False,2017-02-09T01:57:59.12+00:00,True,False,,"XAct,XActLib",58832,False,0.0.5003
"XAct Software Solutions,Inc.",2015-09-28T10:45:52.303Z,"An XActLib assembly: a library for notification service contracts (Alerts, Tips, Onboarding).",XAct.Notifications.PCL,False,2017-02-08T17:57:38.023-08:00,True,False,,"XAct,XActLib",8133,False,0.0.5003
AmamiyaYuuko,2015-09-28T03:53:24.493Z,ASP.Net vNext Anti Xss Library,CodeComb.AntiXSS,True,1899-12-31T16:00:00-08:00,False,False,,"AntiXSS,ASP.Net,XSS",-1,False,1.0.9-beta8-15875
"XAct Software Solutions,Inc.",2015-09-28T11:00:29.163Z,"An XActLib assembly: a library that uses the interfaces defined in XAct.Security, in order to offer a WindowsAuthenticationService, and a WindowsAuthorizationService.",XAct.Security.Windows,False,2017-02-08T17:57:54.087-08:00,True,False,,"XAct,XActLib",91059,False,0.0.5003
rasmus,2015-09-28T11:29:47.573Z,CQRS+ES framework,EventFlow,False,2018-02-25T21:50:07.633+00:00,True,False,,"CQRS,ES,event,sourceing,eventstore",27318,False,0.17.1134
Carlos G. Sarmiento,2015-09-28T06:16:07.407Z,The dynamic configuration manager for .NET,DynamiConf.IniInterpreter,False,2015-09-28T20:28:01.717-07:00,True,False,,"Configuration,Dynamic,DynamiConf,Conf,Ini",1035,False,0.2.3
Team XSockets Sweden AB,2015-09-28T08:03:39.337Z,Real-Time framework for everything,XSockets,False,2017-11-20T17:58:40.847+00:00,True,False,Runs everywhere and is always realtime (full duplex). Connects anything!,"Websockets,sockets,WebRTC,Realtime,XSockets,m2m,p2p,client,server,IoT",74363,False,5.0.0
Paket team,2015-09-28T09:23:22.08Z,A package dependency manager for .NET with support for NuGet packages and GitHub repositories.,Paket.Core,False,2018-04-17T08:54:04.56+00:00,True,False,A package dependency manager for .NET with support for NuGet packages and GitHub repositories.,"nuget,bundler,F#",293543,False,2.4.1
OneFlow Systems,2015-09-28T12:32:26.663Z,OneFlow Systems SDK allows quick and secure integration with our cloud infrastructure,OneFlowSDK,False,2017-11-14T10:40:39.547+00:00,True,False,,,37342,False,0.6.1.127
"Chris Patterson,Dru Sellers,Travis Smith",2015-09-28T04:42:44.587Z,"MassTransit is a distributed application framework for .NET, including support for RabbitMQ and Azure Service Bus.",MassTransit.Unity,False,2018-04-17T18:23:19.993+00:00,True,False,MassTransit Unity Container Support,MassTransit,43244,False,3.0.13
Furore and contributors,2015-09-28T12:18:16.213Z,The Spark FHIR Server implementation for mongo database and search,Spark.Mongo,True,2017-01-18T06:37:15.073-08:00,True,False,The Spark FHIR Server implementation for mongo database and search,"HL7,FHIR,Spark,engine,mongo,implementation,search,mongodb",3359,False,0.50.3-alpha6
"XAct Software Solutions,Inc.",2015-09-28T10:43:58.013Z,An XActLib assembly: provides a common means of evaluating CSharp using the Rosyln engine.,XAct.Languages.CS.Roslyn,False,2017-02-09T01:57:32.337+00:00,True,False,,"XAct,XActLib",6361,False,0.0.5003
"XAct Software Solutions,Inc.",2015-09-28T10:32:22.17Z,"An XActLib assembly: common code for accessing files, etc.",XAct.IO,False,2017-02-08T17:57:23.43-08:00,True,False,,"XAct,XActLib",98589,False,0.0.5003
Rob Janssen,2015-09-25T08:59:10.547Z,PostcodeNlApi provides an API to directly talk with the Postcode.nl API through the REST endpoint offered into your .NET (web)applications.,PostcodeNlApi,False,2015-09-25T01:59:10.547-07:00,True,False,PostcodeNlApi provides an API to directly talk with the Postcode.nl API through the REST endpoint offered into your .NET (web)applications.,"Postcode.nl,ASP.Net",1482,False,1.0.0
"XAct Software Solutions,Inc.",2015-09-28T09:56:57.967Z,An XActLib assembly: common code specific app.Config Configuration,XAct.Configuration,False,2017-02-08T17:56:54.79-08:00,True,False,,"XAct,XActLib",90743,False,0.0.5003
"XAct Software Solutions,Inc.",2015-09-28T10:05:03.87Z,An XActLib assembly: an Assembly that provides implementations of Repositories for EF40 and later suitable for working with POCOs as well as CodeFirst.,XAct.Data.EF,False,2015-11-02T03:19:10.707-08:00,True,False,,"XAct,XActLib",58687,False,0.0.5003
"XAct Software Solutions,Inc.",2015-09-28T11:16:10.09Z,An XActLib assembly: a base library for remote connections to a Workflow Server.,XAct.Workflows.Client,False,2017-02-09T01:58:19.213+00:00,True,False,,"XAct,XActLib",57723,False,0.0.5003
kanirudha14,2015-09-28T08:55:25.91Z,Html Helper exrtensions uysing bootstrap theme. Mainly includes grid using Bootstrap-Table,BsMvc,False,1899-12-31T16:00:00-08:00,False,False,,,-1,False,1.0.0
Chillisoft,2015-09-28T04:01:26.943Z,Habanero,Habanero,True,2017-04-19T21:01:31.993-07:00,True,False,,,165264,False,3.9.538-prerelease
"Chris Patterson,Dru Sellers,Travis Smith",2015-09-28T04:39:44.08Z,"MassTransit is a distributed application framework for .NET, including support for RabbitMQ and Azure Service Bus.",MassTransit.RabbitMQ,False,2018-04-17T18:22:48.227+00:00,True,False,MassTransit RabbitMQ Transport,MassTransit,498505,False,3.0.13
