authors,created,days_abandoned,days_alive,description,id,is_prerelease,last_updated,listed,missing_info,summary,tags,total_downloads,verified,versionXamarin,2016-02-03T13:04:13.463Z,18,807,UI Automation Framework for testing Android and iOS apps.,Xamarin.UITest,True,2018-04-02T11:34:03.027+00:00,True,False,,,1508429,False,1.2.0.1400-dev
rzmoz,2016-01-13T08:39:29.87Z,43209,828,Syntactical IO sugar and long path support for disk operations,CSharp.Basics.IO,False,1899-12-31T16:00:00-08:00,False,False,,,-1,False,7.1.7
David Neumann & Lukas Rögner,2016-02-03T20:18:46.473Z,674,807,"A simple and light-weight inversion of control container, which makes it possible to define dependencies declaratively in code, rather than in configuration files.",System.InversionOfControl,False,2016-06-15T20:00:28.5+00:00,True,False,"A light-weight, portable inversion of control container for .NET.","IoC,Inversion,of,Control,Dependency,Injection,Portable",1953,False,0.1.1
JetBrains,2016-02-03T15:44:34.65Z,43209,807,JetBrains dotMemory dotMemoryUnit Common Package Version 105.0.20160203.140450-EAP,JetBrains.dotMemory.dotMemoryUnit.Common,True,1900-01-01T00:00:00+00:00,False,False,,,-1,False,105.0.20160203.140450-EAP
JetBrains,2016-02-03T15:45:11Z,43209,807,JetBrains dotTrace AppBrowser Package Version 105.0.20160203.140701-EAP,JetBrains.dotTrace.AppBrowser,True,1900-01-01T00:00:00+00:00,False,False,,,-1,False,105.0.20160203.140701-EAP
Microsoft,2016-02-03T18:37:01.707Z,464,807,"This package is part of the Azure Mobile .NET Server SDK and provides the default Azure Mobile homepage at the root of your site. To learn more about Azure Mobile, go to http://azure.microsoft.com/mobile.",Microsoft.Azure.Mobile.Server.Home,False,2017-01-10T16:46:53.537-08:00,True,False,,"microsoft,azure,mobile,server,appservice,windowsazureofficial,aspnet,webapi,aspnetwebapi,owin,app,service,api,apps",206268,True,1.1.157.1
"Glenn Dierckx,Yenthe Oerlemans,Benny Michielsen",2016-02-03T15:00:49.797Z,807,807,"DefinitelyTyped.NET is a utility that can generate typescript classes, interfaces and enums, based on .net types.",DefinitelyTyped.NET,True,2016-02-03T07:03:04.91-08:00,True,False,,"TypeScript,DefinitelyTyped,DefinitelyTyped.NET,Generation,Contracts,SmartAsses",3840,False,0.1.16034.1-continuous
ForerunnerSW,2016-01-29T18:51:37.403Z,43209,812,"This package allows you to create the All Samples V4 web application using the Forerunner SDK. This sample contains a number of client side examples as well as documention on the REST API, all wrapped up in a Single Pgae Application (SPA). It is integrated with bootstrap.js and demontrates not only the ForerunnerSDK but how to create a responsive SPA. Inclusing how to setup hashtag navigation. Just create an empty web project and install.",Forerunner_AllSamplesV4,False,1900-01-01T00:00:00+00:00,False,False,"This package allows you to create the All Samples V4 web application using the Forerunner SDK. This sample contains a number of client side examples as well as documention on the REST API, all wrapped up in a Single Pgae Application (SPA). It is integrated with bootstrap.js and demontrates not only the ForerunnerSDK but how to create a responsive SPA. Inclusing how to setup hashtag navigation.","SSRS,SQL,Report,Forerunner,MVC,REST,Mobile,Sample,Mobilizer,Example,jQuery,Widget,bootstrap,hashtag",-1,False,5.0.572
rzmoz,2016-01-08T08:07:19.47Z,43209,833,Syntactical IO sugar and long path support for disk operations,CSharp.Basics.IO,False,1899-12-31T16:00:00-08:00,False,False,,,-1,False,7.0.11
Vicotr.X.Qu,2016-02-03T14:43:05.157Z,643,807,"C# Object Validator, learn from FluentValidation",ObjectValidator,False,2016-07-16T16:10:11.43+00:00,True,False,,,1475,False,0.0.4.2
DHTMLX,2016-02-03T15:49:14.997Z,172,807,"DHTMLX Scheduler .NET web control provides rich and flexible APIs to achieve the desired look-and-feel.
You can change the calendar appearance and configuration according to your app needs. The calendar has basic views (Day, Week, Month), and can also display events in Timeline, Agenda, Year, Grid and Multiple Resource views.

30 day trial version.",DHTMLX.Scheduler.NET,False,2017-10-30T14:20:13.79+00:00,True,False,DHTMLX Scheduler .NET is a customizable library for creating web-based event and booking calendars in ASP.NET.,"dhtmlx,scheduler,calendar,recurring,events",71279,False,3.3.12.4
Sebastien Ros,2016-02-03T20:12:30.593Z,57,807,YesSql.Core,YesSql.Core,True,2018-02-22T22:39:03.143+00:00,True,False,,,51410,False,2.0.0-alpha-9019
rzmoz,2016-01-13T08:27:56.283Z,43209,828,Syntactical IO sugar and long path support for disk operations,CSharp.Basics.IO,False,1899-12-31T16:00:00-08:00,False,False,,,-1,False,7.1.6
hannasm,2016-02-03T19:24:19.573Z,390,807,This is a source only distribution of the ExpressiveExpressionTrees library that can be embedded inside of other projects / libraries.,ExpressiveExpressionTrees.Sources,False,2017-03-26T09:30:26.26-07:00,True,False,,,438,False,1.1.0
David Neumann & Lukas Rögner,2016-02-03T20:18:46.473Z,674,807,"A simple and light-weight inversion of control container, which makes it possible to define dependencies declaratively in code, rather than in configuration files.",System.InversionOfControl,False,2016-06-15T20:00:28.5+00:00,True,False,"A light-weight, portable inversion of control container for .NET.","IoC,Inversion,of,Control,Dependency,Injection,Portable",1953,False,0.1.1
Hibernating Rhinos,2016-02-03T15:35:40.167Z,43209,807,RavenDB 'Authorization' bundle client extend RavenDB and add document level permissions.,RavenDB.Client.Authorization,True,1900-01-01T00:00:00+00:00,False,False,,"nosql,ravendb,raven,document,database,client,bundles,authorization",168504,True,2.5.25004-Unstable
JetBrains,2016-02-03T15:49:46.827Z,43209,807,JetBrains Profiler Editor Windows BehaviorModel Package Version 105.0.20160203.134844-EAP,JetBrains.Profiler.Editor.Windows.BehaviorModel,True,1900-01-01T00:00:00+00:00,False,False,,,-1,False,105.0.20160203.134844-EAP
"Jeavon Leopold,Marc Stöcker",2016-02-03T15:12:54.863Z,37,807,Please follow the instructions on the project page http://our.umbraco.org/projects/website-utilities/slimsy,Our.Umbraco.Slimsy,False,2018-03-14T15:47:04.597+00:00,True,False,Effortless Responsive Images with Slimmage and Umbraco using Slimmage.js,umbraco,13997,False,1.1.7
Vagif Abilov,2016-02-03T13:55:53.55Z,176,807,"Simple.OData.V4.Client is a multiplatform OData client library supporting .NET 4.x, Windows Store, Windows Phone 8, Silverlight 5, iOS and Android. The adapter provides a great alternative to WCF Data Services client. It does not require generation of context or entity classes and fits RESTful nature of OData services.
      The package Simple.OData.V4.Client contains libraries that can work with OData feeds that implement V4 OData protocol.
      To access V3 OData feeds use Simple.OData.V4.Client or Simple.OData.Client that can consume OData feeds of any version.",Simple.OData.V4.Client,False,2017-10-26T14:29:41.017+00:00,True,False,"Simple.OData.V4.Client is a multiplatform OData client library supporting .NET 4.x, Windows Store, Windows Phone 8, Silverlight 5, iOS and Android. The adapter provides a great alternative to WCF Data Services client. It does not require generation of context or entity classes and fits RESTful nature of OData services.
      The package Simple.OData.V4.Client contains libraries that can work with OData feeds that implement V4 OData protocol.
      To access V3 OData feeds use Simple.OData.V4.Client or Simple.OData.Client that can consume OData feeds of any version.","odata,data,rest,client,portable,pcl,net40,net45,silverlight,windows8,winrt,win8,wp80,wpa81,mono,adnroid,ios,touch",71738,False,4.14.2
rzmoz,2015-01-15T15:14:46.39Z,43209,1191,CSharp.Basics.SevenZip,CSharp.Basics.SevenZip,False,1900-01-01T00:00:00+00:00,False,False,,,-1,False,3.0.0.39
Amael Noel,2016-02-03T14:55:37.897Z,43209,807,Contract for fluent ribbon for Excel add-in,AddIn.Core.Contract,False,1899-12-31T16:00:00-08:00,False,False,,,-1,False,1.0.1
Orthogonal Programming,2015-11-18T03:15:04.133Z,419,884,A lightweight easy-to-use library for persisting settings using different backing storage implementations. This library contains implementations using an XML file or the Registry as the backing storage. The source code on Bitbucket also contains experimental but fully working implementations that use Azure Tables and SQL Server as the backing storage.,Orthogonal.NSettings,False,2017-02-25T03:17:55.127+00:00,True,False,A lightweight library for persisting settings.,orthogonal,2666,False,1.6.2
ApiO,2016-02-03T11:02:29.747Z,807,807,jQuery UI collection for advanced search,jquery.buchette,False,2016-02-03T03:36:07.677-08:00,False,False,,"jquery,buchette",1084,False,1.2.1
Brian Friesen,2016-02-03T17:48:31.393Z,654,807,Magic. Unicorns. Static dependency injection.,Rock.StaticDependencyInjection,False,2016-07-05T14:54:31.37-07:00,True,False,Magic. Unicorns. Static dependency injection.,"magic,unicorns,static,dependency,injection",2387,False,1.1.4
JetBrains,2016-02-03T15:54:26.413Z,4,807,JetBrains ReSharper SDK Package,JetBrains.ReSharper.SDK,True,2018-04-16T12:59:54.54+00:00,True,False,,"JetBrains,ReSharper,Plugin,SDK,Extension",69163,True,10.1.20160203.142343-EAP
Microsoft,2016-02-03T20:09:08.93Z,650,807,Description,global_libs,False,2016-07-09T09:45:24.793-07:00,True,False,,,6179,False,1.0.5877.41660
"Infinitus Solutions,Breno",2016-02-03T17:10:01.607Z,43209,807,"Naylah is a Universal App Toolkit, Lib, Module, etc.",Naylah.Toolkit.UWP,False,1899-12-31T16:00:00-08:00,False,False,,"Naylah,Toolkit,Universal,Apps,UWP,C#,Xaml",-1,False,1.0.1.3
Victor Baybekov,2016-02-03T13:46:16.43Z,546,807,Spreads.Extensions,Spreads.Extensions,True,2016-10-21T04:06:17.25-07:00,True,False,Spreads.Extensions,Spreads,4691,False,0.3.1-alpha
JetBrains,2016-02-03T15:48:43.183Z,43209,807,JetBrains Platform Standalone TextControl Package Version 105.0.20160203.133936-EAP,JetBrains.Platform.Standalone.TextControl,True,1900-01-01T00:00:00+00:00,False,False,,,-1,False,105.0.20160203.133936-EAP
rzmoz,2015-07-22T09:25:33.31Z,43209,1003,CSharp.Basics.SevenZip,CSharp.Basics.SevenZip,False,1900-01-01T00:00:00+00:00,False,False,,,-1,False,6.0.0.5
,2016-01-27T08:38:33.927Z,43209,814,Silly empty demo project,PaketBug2,True,1899-12-31T16:00:00-08:00,False,False,,,-1,False,2.47.3-alpha001
Earthware Ltd,2016-02-03T13:17:09.353Z,492,807,Extensions to the standard forms authentication provider for Nancy.,Earthware.Nancy.Authentication.Forms,False,2016-12-14T03:05:25.407-08:00,True,False,Extends the standard Nancy.Authentication.Forms library with sliding session expiry and randomly generated auth session ids,"Earthware,Nancy,Authentication",2269,False,1.0.7
JetBrains,2016-02-03T15:49:40.95Z,43209,807,JetBrains Profiler Editor Core Package Version 105.0.20160203.134844-EAP,JetBrains.Profiler.Editor.Core,True,1900-01-01T00:00:00+00:00,False,False,,,-1,False,105.0.20160203.134844-EAP
Michael Ganss,2016-02-03T16:15:39.47Z,32,807,Cleans HTML from constructs that can be used for cross site scripting (XSS),HtmlSanitizer,False,2018-03-19T11:57:04.19+00:00,True,False,,"xss,anti,antixss,html,security",409695,False,3.1.79
JetBrains,2016-02-03T15:54:38.393Z,4,807,JetBrains ReSharper SDK Tests Package,JetBrains.ReSharper.SDK.Tests,True,2018-04-16T13:00:06.527+00:00,True,False,,"JetBrains,ReSharper,Plugin,SDK,Extension,Tests",36073,True,10.1.20160203.142343-EAP
Hibernating Rhinos,2016-02-03T15:35:50.293Z,43209,807,RavenDB Client MvcIntegration let you include a visual profiler in your ASP.NET MVC application which will show you all the opened sessions and the time took to complete each database request. This can help you when developing with RavenDB.,RavenDB.Client.MvcIntegration,True,1900-01-01T00:00:00+00:00,False,False,A visual profiler for RavenDB that you can use in your ASP.NET MVC application.,"nosql,ravendb,raven,document,database,client,mvc",243184,True,2.5.25004-Unstable
Amael Noel,2016-02-03T15:58:47.79Z,43209,807,Implementation of the wrapper for ConfigurationManager for AddIn,AddIn.Core.Configuration.Impl,False,1899-12-31T16:00:00-08:00,False,False,,,-1,False,1.0.2
rzmoz,2014-05-27T12:55:14.123Z,43209,1424,CSharp.Basics.SevenZip,CSharp.Basics.SevenZip,False,1900-01-01T00:00:00+00:00,False,False,,,-1,False,1.5.0
rzmoz,2015-07-22T09:09:51.517Z,43209,1003,CSharp.Basics.SevenZip,CSharp.Basics.SevenZip,False,1900-01-01T00:00:00+00:00,False,False,,,-1,False,6.0.0.4
"Chad Myers,Jeremy D. Miller,Joshua Flanagan",2016-02-03T14:49:48.593Z,807,807,A foundational library for .Net frameworks including model binding and localization,FubuCore,False,2016-02-03T14:49:48.593+00:00,True,False,,"utilities,fubu",109500,False,2.0.1.321
JetBrains,2016-02-03T15:43:25.58Z,43209,807,JetBrains dotCommon RemoteAgentBuild Package Version 105.0.20160203.134457-EAP,JetBrains.dotCommon.RemoteAgentBuild,True,1900-01-01T00:00:00+00:00,False,False,,,-1,False,105.0.20160203.134457-EAP
Leanwork,2016-02-03T14:22:23.233Z,784,807,"Pacote de códigos utilitários, extensões e boas práticas usadas pela equipe de desenvolvimento da Leanwork",Leanwork.CodePack.Mvc,False,2016-02-26T20:19:10.973+00:00,True,False,Leanwork.CodePack.Mvc,"asp,net,mvc,extensions",1728,False,1.2.0
skomar,2016-02-03T20:14:47.41Z,43209,807,My package description.,Microsoft.WindowsAzure.EngSys.Internal.rd_rnm_aciscontract,False,1899-12-31T16:00:00-08:00,False,False,,,-1,False,1.0.4
JetBrains,2016-02-03T15:42:45.887Z,43209,807,JetBrains dotCommon Native Link Package Version 105.0.20160203.134114-EAP,JetBrains.dotCommon.Native.Link,True,1900-01-01T00:00:00+00:00,False,False,,,-1,False,105.0.20160203.134114-EAP
Xceed,2015-09-16T15:32:18.937Z,99,947,Combines the streamlined form factor of a listbox—as well as unique “path” views—with lightning-fast remote data retrieval and absolute responsiveness,Xceed.Products.Wpf.Toolkit.ListBox.Themes,False,2018-01-11T19:41:16.533+00:00,False,False,"Metro, Office, Media and Live Explorer themes for the Ultimate ListBox in Xceed Extended WPF Toolkit Plus.","xceed,Extended,WPF,toolkit,plus,listbox,theme,product",2621,False,2.8.15465.16500
rzmoz,2014-04-30T11:27:15.243Z,43209,1451,CSharp.Basics.SevenZip,CSharp.Basics.SevenZip,False,1900-01-01T00:00:00+00:00,False,False,,,-1,False,1.4.0
Stalin Paz Soldan Ochoa,2016-02-03T17:01:34.9Z,800,807,ensamblado con funcionalidades para WPF y MVVM,WPFtoolkitFramework,False,2016-02-10T23:37:55.427+00:00,True,False,"An WPF, MVVM Nuget Framework","wpf,mvvm",2345,False,1.0.3
Raynald Messié,2016-02-03T20:15:05.613Z,546,807,Simple collection of Helpers I commonly use in my MVC apps,asp.net-mvc-helpers,False,2016-10-21T06:03:15.38-07:00,True,False,,,7525,False,0.1.19.2
takenet,2016-02-03T19:25:05.047Z,283,807,LIME HTTP emulation layer.,Lime.Transport.Http,False,2017-07-11T10:50:52.317-07:00,True,False,,"lime,http",64014,False,0.2.390
takenet,2016-02-03T18:33:00.55Z,617,807,LIME envelope serializer using Json.Net,Lime.Protocol.Serialization.Newtonsoft,False,2016-08-11T12:21:20.157-07:00,True,False,,lime,36926,False,0.2.389
,2016-01-28T11:31:59.75Z,43209,813,Silly empty demo project,PaketBug2,True,1899-12-31T16:00:00-08:00,False,False,,,-1,False,3.0.0-alpha038
"Martin Evans,Thomas Gillen",2016-02-03T17:04:19.723Z,756,807,Myre: An XNA Game Framework (Basic UI Library),Myre.UI,False,2016-03-24T19:48:30.433-07:00,True,False,,,2596,False,3.0.0
takenet,2016-02-03T19:24:40.417Z,14,807,Common content types and resource for LIME messaging applications.,Lime.Messaging,False,2018-04-06T14:54:02.897+00:00,True,False,,lime,76495,False,0.2.390
Victor Baybekov,2016-02-03T13:46:26.27Z,806,807,Spreads.RPlugin,Spreads.RPlugin,True,2016-02-04T06:45:59.597-08:00,True,False,Spreads.RPlugin,Spreads,447,False,0.3.1-alpha
Joerg Battermann,2016-02-03T20:31:56.02Z,124,807,Provides custom collection and list types.,JB.Common.Collections,True,2017-12-17T13:26:22.343+00:00,True,False,This package contains custom type(s) I needed myself or deemed useful for current or future projects.,"Collections,Collection,List,BindingList,Enumerable",9596,False,0.8.72-pre
Microsoft,2016-02-03T18:37:19.847Z,464,807,"This is the Azure Mobile Apps .NET Server SDK quickstart package, which references all other server SDK packages. To learn more about Azure Mobile, go to http://azure.microsoft.com/mobile.",Microsoft.Azure.Mobile.Server.Quickstart,False,2017-01-10T16:50:09.147-08:00,True,False,,"microsoft,azure,mobile,server,appservice,windowsazureofficial,aspnet,webapi,aspnetwebapi,owin,app,service,api,apps",201306,True,1.1.157.1
Grid Protection Alliance,2016-02-03T19:19:44.73Z,1,807,"Library of ASP.NET web forms extensions, embedded resource hosting and HTTP Module for implementing role-based security.",GSF.Web,True,2018-04-20T04:18:05.907+00:00,True,False,,"Web,ASP.NET,Extensions,Hosting,HTTP,Module,Security,Portal,JavaScript",71648,False,2.1.170-beta
TYROSOFT GmbH,2016-02-03T18:17:29.13Z,43209,807,The WCF Client connector for the UiComm Client.,UiComm.Connector.WcfClient,False,1900-01-01T00:00:00+00:00,False,False,,,6864,False,1.2.3
Amael Noel,2016-02-03T14:56:27.55Z,43209,807,Implementation for fluent ribbon for Excel add-in,AddIn.Core.Implementation,False,1899-12-31T16:00:00-08:00,False,False,,,-1,False,1.0.1
Xceed,2015-06-09T17:03:09.15Z,99,1046,Combines the streamlined form factor of a listbox—as well as unique “path” views—with lightning-fast remote data retrieval and absolute responsiveness,Xceed.Products.Wpf.Toolkit.ListBox.Themes,False,2018-01-11T19:41:16.533+00:00,False,False,"Metro, Office, Media and Live Explorer themes for the Ultimate ListBox in Xceed Extended WPF Toolkit Plus.","xceed,Extended,WPF,toolkit,plus,listbox,theme,product",2621,False,2.7.15309.11180
Alexey Politov,2016-02-03T19:38:32.81Z,807,807,Navigation service for MVVM pattern. Example: https://github.com/EmptyBucket/NavigationServiceMVVMPattern,NavigationServiceMVVM,False,2016-02-03T13:31:52.493-08:00,True,False,,,630,False,1.0.2
Xceed,2015-09-16T15:23:55.35Z,99,947,"Extended WPF Toolkit Plus is the commercial edition of the popular Extended WPF Toolkit project, the number one collection of WPF controls for creating next-gen Windows apps.",Xceed.Products.Wpf.Toolkit.Base.Themes,False,2018-01-11T19:39:52.607+00:00,False,False,Metro and Office themes for Extended WPF Toolkit Plus.,"xceed,Extended,WPF,toolkit,plus,theme,product",4419,False,2.8.15465.16500
Andre Carlucci,2016-01-16T01:46:35.853Z,528,825,AnyCpu version of libpxcclr.cs,libpxcclr.cs,False,2016-11-08T14:42:07.713-08:00,True,False,,"realsense,intel,camera3d,gestures",2705,False,7.0.23.8038
rzmoz,2016-02-03T14:16:00.567Z,43209,807,Helper methods for working with console apps and parsing arguments,CSharp.Basics.ConsoleApp,False,1899-12-31T16:00:00-08:00,False,False,,,-1,False,7.1.23
rzmoz,2015-02-18T12:29:48.19Z,43209,1157,CSharp.Basics.SevenZip,CSharp.Basics.SevenZip,False,1900-01-01T00:00:00+00:00,False,False,,,-1,False,3.0.0.48
rzmoz,2015-01-22T13:40:30.033Z,43209,1184,CSharp.Basics.SevenZip,CSharp.Basics.SevenZip,False,1900-01-01T00:00:00+00:00,False,False,,,-1,False,3.0.0.43
Grid Protection Alliance,2016-02-03T19:20:10.317Z,1,807,"Library of base Windows Form and WPF Window extensions and dialogs, including those needed for implementing role-based security inside a Windows application.",GSF.Windows,True,2018-04-20T04:18:07.593+00:00,True,False,"Library of base Windows Form and WPF Window extensions, common dialogs and security forms.","Windows,Forms,WPF,Security,User,Interface,Extensions,About,Dialog",69929,False,2.1.170-beta
rzmoz,2015-01-29T17:37:39.357Z,43209,1177,CSharp.Basics.SevenZip,CSharp.Basics.SevenZip,False,1900-01-01T00:00:00+00:00,False,False,,,-1,False,3.0.0.45
Stalin Paz Soldan Ochoa,2016-02-03T18:13:27.2Z,800,807,ensamblado con funcionalidades para WPF y MVVM,WPFtoolkitFramework,False,2016-02-10T23:37:55.427+00:00,True,False,"An WPF, MVVM Nuget Framework","wpf,mvvm",2345,False,1.0.4
Johan Larsson,2016-02-03T19:17:30.317Z,197,807,WPF textboxes for numeric input,Gu.Wpf.NumericInput,False,2017-10-05T15:09:24.84+00:00,True,False,,"wpf,xaml,numeric,textbox",6523,False,0.4.5
rzmoz,2015-05-02T23:29:15.297Z,43209,1084,CSharp.Basics.SevenZip,CSharp.Basics.SevenZip,False,1900-01-01T00:00:00+00:00,False,False,,,-1,False,4.0.0.3
Hibernating Rhinos,2016-02-03T15:39:04.173Z,43209,807,"This package includes a utility class that helps test features of RavenDB. RavenDB is a document database for the .NET platform, offering a flexible data model design to fit the needs of real world systems.",RavenDB.Tests.Helpers,True,1900-01-01T00:00:00+00:00,False,False,This package includes a utility class that helps test features of RavenDB.,"nosql,ravendb,raven,document,database,test",244252,True,2.5.25004-Unstable
ForerunnerSW,2016-01-29T18:52:39.89Z,43209,812,"With the Forerunner SDK all of the Controls, APIs, CSS and Events we used to build Mobilizer are documented and available for you to build your own custom experience or incorporate into your existing applications. With full support for MVC, REST / AJAX, HTML5 and CSS building your own modern web application is a breeze.",ForerunnerSDK,False,1900-01-01T00:00:00+00:00,False,False,The Forerunner SDK allows you to showcase your investiment in SSRS reports in your own web application. Forerunner SDK runs on all major browsers and mobile devices.,"SSRS,SQL,Report,Forerunner,MVC,Mobile,Mobilizer,Responsive,jQuery,Widget",-1,False,5.0.572
Dennis Gao,2016-01-25T09:14:37.72Z,43209,816,Cowboy is a library for building Sockets/HTTP based services.,Cowboy,False,1899-12-31T16:00:00-08:00,False,False,,,-1,False,1.1.15
rzmoz,2015-02-19T19:52:42.887Z,43209,1156,CSharp.Basics.SevenZip,CSharp.Basics.SevenZip,False,1900-01-01T00:00:00+00:00,False,False,,,-1,False,3.1.0.5
Joerg Battermann,2016-02-03T20:32:35.107Z,124,807,"Provides custom types, helpers and extension methods for Visual Studio extensibility.",JB.Common.VisualStudio,True,2017-12-17T13:27:49.453+00:00,True,False,This package contains custom type(s) I needed myself or deemed useful for current or future projects.,"VisualStudio,Common,Helpers,HelperMethods,ExtensionMethods,Extensibility,VSIX",7612,False,0.8.72-pre
TYROSOFT GmbH,2016-02-03T18:19:03.07Z,43209,807,The WCF Server connector for the UiComm Client.,UiComm.Connector.WcfServer,False,1900-01-01T00:00:00+00:00,False,False,,,5872,False,1.2.3
rzmoz,2015-09-08T10:00:39.793Z,43209,955,CSharp.Basics.SevenZip,CSharp.Basics.SevenZip,False,1900-01-01T00:00:00+00:00,False,False,,,-1,False,6.3.14
fatboyzz,2016-02-03T14:04:06.777Z,798,807,F# SDK for qiniu cloud storage,QiniuFS,False,2016-02-11T21:42:28.28-08:00,True,False,,"qiniu,F#,f#,fsharp",636,False,1.0.1
Scott Kirkland,2016-02-03T18:48:10.71Z,137,807,Models which can be used to represents gifts,GiftModels.JS,False,2017-12-04T15:17:09.15+00:00,True,False,,,3316,False,1.3.1.404
takenet,2016-02-03T20:15:25.25Z,283,807,LIME HTTP emulation layer.,Lime.Transport.Http,False,2017-07-11T10:50:52.317-07:00,True,False,,"lime,http",64014,False,0.2.391
JetBrains,2016-02-03T15:49:22.04Z,43209,807,JetBrains Profiler Configurator Core Package Version 105.0.20160203.134844-EAP,JetBrains.Profiler.Configurator.Core,True,1900-01-01T00:00:00+00:00,False,False,,,-1,False,105.0.20160203.134844-EAP
vip32,2016-02-03T16:03:10.23Z,43209,807,A long description of the package. This shows up in the right pane of the Add Package Dialog as well as in the Package Manager Console when listing packages using the Get-Package command.,Xtricate.DocSet.Sqlite,False,1900-01-01T00:00:00+00:00,False,False,"A short description of the package. If specified, this shows up in the middle pane of the Add Package Dialog. If not specified, a truncated version of the description is used instead.","nosql,data,sqlite,dapper,docset,xtricate",19317,False,0.1.51
Joerg Battermann,2016-02-03T20:32:12.11Z,124,807,Provides custom Reactive Extensions Related types and helpers.,JB.Common.Reactive,True,2017-12-17T13:26:47.817+00:00,True,False,This package contains custom type(s) I needed myself or deemed useful for current or future projects.,"Reactive,Extensions,rxnet,Async,AsyncReaderWriterLock",8010,False,0.8.72-pre
Xceed,2015-09-16T15:18:03.353Z,43209,947,"Extended WPF Toolkit Plus is the commercial edition of the popular Extended WPF Toolkit project, the number one collection of WPF controls for creating next-gen Windows apps.",Extended.Wpf.Toolkit.Plus,False,1899-12-31T16:00:00-08:00,False,False,"The complete feature set of the Xceed Extended WPF Toolkit Plus including the DataGrid, ListBox, AvalonDock and all custom themes","xceed,Extended,WPF,toolkit,plus,avalondock,listbox,datagrid,theme,product",-1,False,2.8.15465.16500
JetBrains,2016-02-03T15:43:31.737Z,43209,807,JetBrains dotCommon Standalone Package Version 105.0.20160203.134457-EAP,JetBrains.dotCommon.Standalone,True,1900-01-01T00:00:00+00:00,False,False,,,-1,False,105.0.20160203.134457-EAP
vip32,2016-02-03T16:18:28.94Z,43209,807,A long description of the package. This shows up in the right pane of the Add Package Dialog as well as in the Package Manager Console when listing packages using the Get-Package command.,Xtricate.DocSet.Sqlite,False,1900-01-01T00:00:00+00:00,False,False,"A short description of the package. If specified, this shows up in the middle pane of the Add Package Dialog. If not specified, a truncated version of the description is used instead.","nosql,data,sqlite,dapper,docset,xtricate",19317,False,0.1.52
