authors,created,days_abandoned,days_alive,description,id,is_prerelease,last_updated,listed,missing_info,summary,tags,total_downloads,verified,versionvip32,2016-02-03T16:03:26.317Z,43209,807,A long description of the package. This shows up in the right pane of the Add Package Dialog as well as in the Package Manager Console when listing packages using the Get-Package command.,Xtricate.Web.Dashboard,False,1900-01-01T00:00:00+00:00,False,False,"A short description of the package. If specified, this shows up in the middle pane of the Add Package Dialog. If not specified, a truncated version of the description is used instead.","web,mvc,razor,middleware,owin,webpages",22570,False,0.1.51
DukeGonzo,2016-02-03T19:12:57.84Z,43209,807,Blazing fast and extremely easy to use twitter client.,AwesomeTwitterClient,False,1899-12-31T16:00:00-08:00,False,False,,Twitter,-1,False,0.0.2
rzmoz,2015-05-03T18:37:23.317Z,43209,1083,CSharp.Basics.SevenZip,CSharp.Basics.SevenZip,False,1900-01-01T00:00:00+00:00,False,False,,,-1,False,5.0.0.4
JetBrains,2016-02-03T15:43:38.077Z,43209,807,JetBrains dotCommon Timeline Package Version 105.0.20160203.134457-EAP,JetBrains.dotCommon.Timeline,True,1900-01-01T00:00:00+00:00,False,False,,,-1,False,105.0.20160203.134457-EAP
Concode AB,2016-02-03T16:36:43.357Z,450,807,Description,Concode.Dox.MsSqlBuilder,False,2017-01-25T07:55:03.707+00:00,True,False,,,11361,False,2.1.8
d-fens GmbH,2016-02-03T14:53:31.94Z,570,807,"biz.dfch.CS.Appclusive.Api
========================

Service Reference to the Appclusive Framework",biz.dfch.CS.Appclusive.Api,False,2016-09-27T10:57:23.233-07:00,True,False,Service reference to the Appclusive Framework,"dfch,OData,service,reference,Appclusive,C#",7600,False,1.4.0
JetBrains,2016-02-03T15:50:05.69Z,43209,807,JetBrains Profiler History Core Package Version 105.0.20160203.134844-EAP,JetBrains.Profiler.History.Core,True,1900-01-01T00:00:00+00:00,False,False,,,-1,False,105.0.20160203.134844-EAP
Jakob Christensen,2016-02-03T14:50:29.84Z,642,807,Sitecore Pathfinder toolchain.,Sitecore.Pathfinder,True,2016-07-17T02:23:48.003-07:00,True,False,"Get started, get far, get happy.","Sitecore,Pathfinder,compilation,nuget,npm",538,False,0.6.7-alpha
Qsys Sverige AB,2016-02-03T20:16:24.01Z,60,807,QuickPick One Database assembly server component,QuickPickOneCLR,False,2018-02-19T10:36:42.787+00:00,True,False,,"Apollo,Apollo13,Quickpick,Qsys",88457,False,1.0.15287.173
rzmoz,2015-06-23T13:36:27.053Z,43209,1032,CSharp.Basics.SevenZip,CSharp.Basics.SevenZip,False,1900-01-01T00:00:00+00:00,False,False,,,-1,False,5.0.0.41
takenet,2016-02-03T18:32:42.957Z,14,807,Common content types and resource for LIME messaging applications.,Lime.Messaging,False,2018-04-06T14:54:02.897+00:00,True,False,,lime,76495,False,0.2.389
Jay Landrum,2016-02-03T15:47:18.457Z,789,807,Contains .NET code for simplifying list data access and ULS logging on the server.,J.SharePoint,False,2016-02-21T14:03:48.987-08:00,True,False,,,1163,False,1.0.1
NeoDeck Holdings Corp,2016-02-03T17:37:59.67Z,217,807,Includes the necessary components needed by an application to connect to the PatientVault service.,PatientVault.Plugin,False,2017-09-15T19:45:07.53+00:00,True,False,PatientVault allows developer to easily integrate patient engagement capabilities into their applications for free.,"patient,engagement,phr,health,medical",3622,False,1.0.17
Microsoft,2016-02-03T18:36:29.277Z,464,807,"This is the Azure Mobile Apps .NET Server package, the core package for the server SDK. To learn more about Azure Mobile, go to http://azure.microsoft.com/mobile.",Microsoft.Azure.Mobile.Server,False,2017-01-11T00:44:09.16+00:00,True,False,,"microsoft,azure,mobile,server,windowsazureofficial,aspnet,webapi,aspnetwebapi,owin,app,service,api,apps",297335,True,1.1.157.1
Paket team,2016-02-03T15:41:03.177Z,2,807,A package dependency manager for .NET with support for NuGet packages and GitHub repositories.,Paket.Core,False,2018-04-18T10:23:20.457+00:00,True,False,A package dependency manager for .NET with support for NuGet packages and GitHub repositories.,"nuget,bundler,F#",298246,False,2.49.0
Monzoom (Poul Foged),2016-02-03T15:04:15.053Z,128,807,"Start Elasticsearch from .NET for integration tests. Contains both java runtime and elasticsearch embedded in the dll. 
    The version number follows the version of the embedded Elasticsearch. With Jvm updates and other changes only the last digit is increased.",elasticsearch-inside,False,2017-12-13T10:50:45.24+00:00,True,False,,"elasticsearch,elastic,integration,tests",24030,False,2.0.2
Soeteman Software,2016-02-03T14:21:36.91Z,64,807,CMSImport helps you import content or members from any datasource into Umbraco CMS.,CMSImport,False,2018-02-15T15:18:34.073+00:00,True,False,,"umbraco,import",16903,False,3.4.0
"Martin Evans,Thomas Gillen",2016-02-03T17:04:08.373Z,730,807,Myre: An XNA Game Framework (Core Library),Myre,False,2016-04-20T08:16:02.19-07:00,True,False,,,9407,False,8.0.0
JetBrains,2016-02-03T15:54:14.39Z,43209,807,JetBrains Platform Tests Framework Package Version 105.0.20160203.133936-EAP,JetBrains.Platform.Tests.Framework,True,1900-01-01T00:00:00+00:00,False,False,,,51764,True,105.0.20160203.133936-EAP
Drew Marsh (@drub0y),2016-02-03T19:32:19.69Z,591,807,Microsoft Azure Service Bus transport support for the Obvs Framework.,Obvs.AzureServiceBus,True,2016-09-06T23:49:29.123+00:00,True,False,,"Azure,Commands,Events,CQRS,Rx,Observable",3976,False,0.8.0-beta
rzmoz,2015-09-08T11:42:46.82Z,43209,955,CSharp.Basics.SevenZip,CSharp.Basics.SevenZip,False,1900-01-01T00:00:00+00:00,False,False,,,-1,False,6.3.15
SharpCrafters s.r.o.,2016-02-03T13:06:19.01Z,22,807,Part of the PostSharp infrastructure. For PostSharp internal use only.,PostSharp.Compiler.Common,False,2018-03-29T18:37:29.32+00:00,True,False,Part of the PostSharp infrastructure. For PostSharp internal use only.,,11860,True,4.2.20
JetBrains,2016-02-03T15:42:13.7Z,43209,807,JetBrains dotCommon ElevationAgent Package Version 105.0.20160203.134457-EAP,JetBrains.dotCommon.ElevationAgent,True,1900-01-01T00:00:00+00:00,False,False,,,-1,False,105.0.20160203.134457-EAP
,2016-01-27T09:31:23.6Z,43209,814,Silly empty demo project,PaketBug2,True,1899-12-31T16:00:00-08:00,False,False,,,-1,False,2.47.3-alpha002
Vitalii Fedorchenko,2016-02-03T15:23:18.003Z,386,807,HTML-to-PDF converter component for C# (.NET) based on WkHtmlToPdf utility. Generates pretty-looking PDF documents from .NET application by HTML-layout.,NReco.PdfGenerator,False,2017-03-30T09:44:20.743+00:00,True,False,,"PDF,Html,WkHtmlToPdf,c#,html-to-pdf,html2pdf,Converter,PdfGenerator",296564,True,1.1.12
rzmoz,2015-05-03T23:09:30.443Z,43209,1083,CSharp.Basics.SevenZip,CSharp.Basics.SevenZip,False,1900-01-01T00:00:00+00:00,False,False,,,-1,False,5.0.0.10
rzmoz,2016-02-03T14:07:12.353Z,43209,807,Syntactical sugar for IO operations,CSharp.Basics.IO,False,1899-12-31T16:00:00-08:00,False,False,,,-1,False,7.1.22
"Glenn Dierckx,Yenthe Oerlemans,Benny Michielsen",2016-02-03T15:03:04.91Z,807,807,"DefinitelyTyped.NET is a utility that can generate typescript classes, interfaces and enums, based on .net types.",DefinitelyTyped.NET,True,2016-02-03T07:03:04.91-08:00,True,False,,"TypeScript,DefinitelyTyped,DefinitelyTyped.NET,Generation,Contracts,SmartAsses",3840,False,0.1.16034.2-continuous
rzmoz,2015-07-16T13:29:11.55Z,43209,1009,CSharp.Basics.SevenZip,CSharp.Basics.SevenZip,False,1900-01-01T00:00:00+00:00,False,False,,,-1,False,5.1.0.45
PostSharp Technologies,2016-02-03T13:06:51.353Z,22,807,Adds support for NLog to PostSharp.Patterns.Diagnostics. An official PostSharp pattern library.,PostSharp.Patterns.Diagnostics.NLog,False,2018-03-29T18:41:25.22+00:00,True,False,,"postsharp,sharcrafters,aop,aspect,monitoring,instrumentation,log,logging,tracing,nlog,log4net,elmah,Patterns",62389,True,4.2.20
"Martin Evans,Thomas Gillen",2016-02-03T17:04:28.397Z,744,807,Myre: An XNA Game Framework (Entity/Scene Management Library),Myre.Entities,False,2016-04-05T20:09:29.467-07:00,True,False,,,8081,False,10.0.0
takenet,2016-02-03T16:50:54.4Z,617,807,LIME envelope serializer using Json.Net,Lime.Protocol.Serialization.Newtonsoft,False,2016-08-11T12:21:20.157-07:00,True,False,,lime,36926,False,0.2.388
JetBrains,2016-02-03T15:47:52.16Z,43209,807,JetBrains Platform Interop dotMemoryUnit Framework Package Version 105.0.20160203.133936-EAP,JetBrains.Platform.Interop.dotMemoryUnit.Framework,True,1900-01-01T00:00:00+00:00,False,False,,,-1,False,105.0.20160203.133936-EAP
"Martin Evans,Thomas Gillen",2016-02-03T17:04:43.25Z,745,807,Myre: An XNA Game Framework (Flexible Graphics Pipeline),Myre.Graphics,False,2016-04-05T10:21:19.117-07:00,True,False,,,13652,False,11.0.0
takenet,2016-02-03T20:15:17.19Z,617,807,LIME envelope serializer using Json.Net,Lime.Protocol.Serialization.Newtonsoft,False,2016-08-11T12:21:20.157-07:00,True,False,,lime,36926,False,0.2.391
Team XSockets Sweden AB,2016-01-29T09:26:28.16Z,456,812,"Supports: .NET 4.5+, Xamarin iOS x64, MonoTouch (iOS), MonoDroid (Android). Universal Apps, WinPhone, WinStore, Win10IoT",XSockets.Client,True,2017-01-19T13:30:37.953+00:00,False,False,,"XSockets,Websockets,Realtime,IoT",37281,False,6.0.0-beta3
Ben Abelshausen,2016-02-03T18:47:09.53Z,43209,807,OsmSharp is an open-source mapping project.,OsmSharp.Routing,True,1900-01-01T00:00:00+00:00,False,False,OsmSharp is an open-source mapping project available on Android and iOS using Xamarin and other platforms using Mono/.NET,"osm,openstreetmap,routing,rendering,xamarin,mapping",-1,False,0.3.1-rc1-0132
Grid Protection Alliance,2016-02-03T19:17:48.447Z,1,807,"Library of .NET functions, extensions and components including asynchronous processing queues, configuration APIs, diagnostics, error handling, console functions, adapter framework, active directory and local account functions, checksum algorithms, unit conversion, binary parsing, cron-style task scheduler, Unix and NTP time classes, precision timer, 24-bit signed and unsigned integers, database extensions and abstraction layer, extensions for drawing, reflection, XML, buffers, chars, date/times, enumerations, strings, etc.",GSF.Core,True,2018-04-20T04:17:43.233+00:00,True,False,"Library of functions, extensions, components and APIs for any .NET application.","Core,Energy,Utility,Adapters,Functions,Extensions,Queues,Threads,Serialization,Units,Checksums,Endianness,Bits,Words,Diagnostics,LDAP,ActiveDirectory,Configuration,User,Account,ADO,Database,Abstraction,Task,Scheduling",73957,False,2.1.170-beta
rzmoz,2016-02-03T14:07:06.79Z,43209,807,Helpers for commuonly used WinForms functionalitys,CSharp.Basics.Forms,False,1899-12-31T16:00:00-08:00,False,False,,,-1,False,7.1.22
,2016-01-29T18:29:12.71Z,43209,812,Silly empty demo project,PaketBug2,False,1899-12-31T16:00:00-08:00,False,False,,,-1,False,2.48.1
ForerunnerSW,2016-02-03T19:09:59.907Z,43209,807,"With the Forerunner SDK all of the Controls, APIs, CSS and Events we used to build Mobilizer are documented and available for you to build your own custom experience or incorporate into your existing applications. With full support for MVC, REST / AJAX, HTML5 and CSS building your own modern web application is a breeze.",ForerunnerSDK,False,1900-01-01T00:00:00+00:00,False,False,The Forerunner SDK allows you to showcase your investiment in SSRS reports in your own web application. Forerunner SDK runs on all major browsers and mobile devices.,"SSRS,SQL,Report,Forerunner,MVC,Mobile,Mobilizer,Responsive,jQuery,Widget",-1,False,4.0.454
Singer Instrument Company Limited,2016-02-03T16:05:09.207Z,43209,807,Control functions for Singer Instrument products,SI.Hardware.Control,False,1899-12-31T16:00:00-08:00,False,False,,"SingerInstruments,HardwareControl",1100,False,1.0.5877.20643
rzmoz,2015-02-19T13:17:43.457Z,43209,1156,CSharp.Basics.SevenZip,CSharp.Basics.SevenZip,False,1900-01-01T00:00:00+00:00,False,False,,,-1,False,3.0.0.55
rzmoz,2015-05-04T07:25:11.8Z,43209,1082,CSharp.Basics.SevenZip,CSharp.Basics.SevenZip,False,1900-01-01T00:00:00+00:00,False,False,,,-1,False,5.0.0.12
rzmoz,2015-01-15T13:56:40.56Z,43209,1191,CSharp.Basics.SevenZip,CSharp.Basics.SevenZip,False,1900-01-01T00:00:00+00:00,False,False,,,-1,False,3.0.0.38
rzmoz,2015-05-02T23:09:44.85Z,43209,1084,CSharp.Basics.SevenZip,CSharp.Basics.SevenZip,False,1900-01-01T00:00:00+00:00,False,False,,,-1,False,4.0.0.1
Adam Fisher,2016-02-03T18:15:14.48Z,156,807,Restores Newtonsoft.JSON as the default serializer for RestSharp.,RestSharp.Newtonsoft.Json,False,2017-11-15T03:17:02.08+00:00,True,False,,"REST,HTTP,API,JSON,XML,NEWTONSOFT,RESTSHARP",85144,False,1.0.0
Soeteman Software,2016-02-03T14:19:13.333Z,807,807,CMSImport NuPicker field providers adds extra field providers to support the NuPicker property editors. This package requires that CMSImport is installed.,CMSImport.FieldProviders.NuPicker,False,2016-02-03T06:19:13.333-08:00,True,False,,"umbraco,cmsimport,import,nupicker",309,False,3.4.0
JetBrains,2016-02-03T15:49:28.18Z,43209,807,JetBrains Profiler Configurator WinForms Package Version 105.0.20160203.134844-EAP,JetBrains.Profiler.Configurator.WinForms,True,1900-01-01T00:00:00+00:00,False,False,,,-1,False,105.0.20160203.134844-EAP
PostSharp Technologies,2016-02-03T13:07:13.21Z,22,807,Adds a concept of thread safety to C# and VB so that most threading defects are detected at build-time or in a single-threaded test coverage. An official PostSharp pattern library.,PostSharp.Patterns.Threading,False,2018-03-29T18:43:16.613+00:00,True,False,,"postsharp,sharcrafters,aop,aspect,Patterns,threading,synchronization,lock,locks,deadlock,parallel,powerthreading,retlang,concurrent",68155,True,4.2.20
Microsoft,2016-02-03T18:37:38.183Z,464,807,"This package is part of the Azure Mobile .NET Server SDK and contains features for integrating with Azure Table Storage. To learn more about Azure Mobile, go to http://azure.microsoft.com/mobile.",Microsoft.Azure.Mobile.Server.Storage,False,2017-01-10T16:49:33.49-08:00,True,False,,"microsoft,azure,mobile,server,storage,windowsazureofficial,aspnet,webapi,aspnetwebapi,owin,app,service,api,apps,table",9631,True,1.1.157.1
Victor Baybekov,2016-02-03T13:46:02.05Z,52,807,Spreads.Core,Spreads.Core,True,2018-02-27T20:04:37.46+00:00,True,False,Spreads.Core,Spreads,5526,False,0.3.1-alpha
OrchestraDevs,2016-02-03T19:08:43.423Z,7,807,Advanced log viewer control for WPF.,Orc.LogViewer,True,2018-04-13T12:50:17.817+00:00,True,False,,"log,viewer,loggin,orcomp,orc",6568,True,1.2.0-unstable0001
JetBrains,2016-02-03T15:54:00.523Z,43209,807,Empty package for JetBrains products semantic root.,Wave,True,1900-01-01T00:00:00+00:00,False,False,,,-1,False,5.0.0-EAP
Grid Protection Alliance,2016-02-03T19:19:35.71Z,1,807,"Framework for enabling time-series data processing services including hosted input, action and output adapter implementations.",GSF.TimeSeries,True,2018-04-20T04:18:03.67+00:00,True,False,,"TimeSeries,Data,Framework,Adapter,Input,Action,Output,Measurement,Time,Concentration,Hosting,Environment,Publish,Subscribe,Metadata,Serialization,Schema,Routing,Event,Messaging,Complex,Processing",71709,False,2.1.170-beta
Hibernating Rhinos,2016-02-03T15:34:22.473Z,57,807,"This package let you include RavenDB embedded in your asp.net application. RavenDB is a document database for the .NET/Windows platform, offering a flexible data model design to fit the needs of real world systems.",RavenDB.AspNetHost,True,2018-02-22T21:28:46.793+00:00,True,False,This package let you include RavenDB embedded in your Asp.Net web application.,"nosql,ravendb,raven,document,database,embedded",124680,True,2.5.25004-Unstable
Grid Protection Alliance,2016-02-03T19:17:57.29Z,1,807,Library for parsing E-MAX Director control and record data files used for transient data exchange,GSF.EMAX,True,2018-04-20T04:17:44.797+00:00,True,False,,"Transient,Data,Exchange,File,Format,Parser,E-MAX,Library",69096,False,2.1.170-beta
rzmoz,2015-09-08T09:38:56.837Z,43209,955,CSharp.Basics.SevenZip,CSharp.Basics.SevenZip,False,1900-01-01T00:00:00+00:00,False,False,,,-1,False,6.3.12
Hibernating Rhinos,2016-02-03T15:34:49.803Z,57,807,RavenDB embedded database,RavenDB.Bundles.IndexReplication,True,2018-02-22T21:29:30.903+00:00,True,False,,"nosql,ravendb,raven,document,database,bundles",116112,True,2.5.25004-Unstable
Pimix,2016-02-03T13:02:59.643Z,760,807,Pimix Server related components,Pimix.Service,False,2016-03-20T22:34:47.87-07:00,True,False,,"Pimix,Service,lib",1191,False,1.4.0
takenet,2016-02-03T18:33:24.267Z,14,807,WebSocket transport for LIME protocol.,Lime.Transport.WebSocket,False,2018-04-06T14:54:54.913+00:00,True,False,,lime,51719,False,0.2.389
Grid Protection Alliance,2016-02-03T19:17:38.807Z,1,807,Library for parsing and creating COMTRADE (COMmon format for Transient Data Exchange for power systems) files,GSF.COMTRADE,True,2018-04-20T04:17:40.857+00:00,True,False,,"Transient,Data,Exchange,File,Format,Parser,Writer,COMTRADE,Library",69472,False,2.1.170-beta
JetBrains,2016-02-03T15:47:03.677Z,43209,807,JetBrains Platform Core Ide Package Version 105.0.20160203.133936-EAP,JetBrains.Platform.Core.Ide,True,1900-01-01T00:00:00+00:00,False,False,,,53923,True,105.0.20160203.133936-EAP
rzmoz,2015-08-12T13:36:58.613Z,43209,982,CSharp.Basics.SevenZip,CSharp.Basics.SevenZip,False,1900-01-01T00:00:00+00:00,False,False,,,-1,False,6.2.0.6
JetBrains,2016-02-03T15:48:03.337Z,43209,807,JetBrains Platform Interop dotMemoryUnit Interop Package Version 105.0.20160203.133936-EAP,JetBrains.Platform.Interop.dotMemoryUnit.Interop,True,1900-01-01T00:00:00+00:00,False,False,,,-1,False,105.0.20160203.133936-EAP
JetBrains,2016-02-03T15:44:49.48Z,43209,807,JetBrains dotMemory Standalone Package Version 105.0.20160203.140450-EAP,JetBrains.dotMemory.Standalone,True,1900-01-01T00:00:00+00:00,False,False,,,-1,False,105.0.20160203.140450-EAP
rzmoz,2016-01-29T05:54:40.6Z,43209,812,Syntactical IO sugar and long path support for disk operations,CSharp.Basics.IO,False,1899-12-31T16:00:00-08:00,False,False,,,-1,False,7.1.16
JetBrains,2016-02-03T15:42:58.66Z,43209,807,JetBrains dotCommon Psi SourceView Package Version 105.0.20160203.135621-EAP,JetBrains.dotCommon.Psi.SourceView,True,1900-01-01T00:00:00+00:00,False,False,,,-1,False,105.0.20160203.135621-EAP
"GeertvanHorrik,OrchestraDevs",2016-02-03T20:24:18.81Z,4,807,The Ribbon.Microsoft shell for Orchestra based applications.,Orchestra.Shell.Ribbon.Microsoft,True,2018-04-16T15:54:36.213+00:00,True,False,,"mvvm,orchestra,shell,prism,framework,wpf,microsoft,ribbon",38668,True,2.4.0-unstable0009
Paket team,2016-02-03T15:25:58.16Z,357,807,A package dependency manager for .NET with support for NuGet packages and GitHub repositories.,Paket.PowerShell,True,2017-04-28T07:19:40.903+00:00,True,False,A package dependency manager for .NET with support for NuGet packages and GitHub repositories.,"nuget,bundler,F#",138115,False,2.49.0-alpha001
RobIII,2016-02-03T14:27:58.483Z,583,807,KeenConnect CDR API .Net library,KeenConnect-CDAPI,True,2016-09-14T03:00:34.627-07:00,True,False,Contains classes for communicating with the KeenConnect backend,,2369,False,1.2.2-beta
Monzoom (Poul Foged),2016-02-03T14:39:44.307Z,128,807,"Start Elasticsearch from .NET for integration tests. Contains both java runtime and elasticsearch embedded in the dll. 
    The version number follows the version of the embedded Elasticsearch. With Jvm updates and other changes only the last digit is increased.",elasticsearch-inside,False,2017-12-13T10:50:45.24+00:00,True,False,,"elasticsearch,elastic,integration,tests",24030,False,1.7.4
rzmoz,2015-07-16T20:52:30.677Z,43209,1009,CSharp.Basics.SevenZip,CSharp.Basics.SevenZip,False,1900-01-01T00:00:00+00:00,False,False,,,-1,False,5.1.0.58
rzmoz,2015-07-27T12:58:15.037Z,43209,998,CSharp.Basics.SevenZip,CSharp.Basics.SevenZip,False,1900-01-01T00:00:00+00:00,False,False,,,-1,False,6.1.0.1
Ivan Gavryliuk,2016-02-03T15:07:23.647Z,43209,807,.NET support library with useful functions which are missing or not easily accessible in the standard .NET framework.,Aloneguid.Support,False,1899-12-31T16:00:00-08:00,False,False,"The library tagets .NET 4.5 framework.
         It is also available as a Portable version which targets .NET 4.5, Windows 8, Windows Phone 8.1, Windows Phone Silverlight 8, Xamarin (Android and iOS).",Common,-1,False,2.1.8
"Eirik Tsarpalis,Nick Palladinos,Kostas Rontogiannis,Isaac Abraham,Don Syme",2016-02-03T17:50:34.827Z,171,807,MBrace.Azure cluster management library.,MBrace.Azure.Management,False,2017-10-31T12:17:56.58+00:00,True,False,Contains a set of routines for deploying and managing MBrace cloud services on Azure.,"F#,cloud,mapreduce,distributed,azure,windowsazure",16141,False,1.1.22
Stalin Paz Soldan Ochoa,2016-02-03T17:01:34.9Z,800,807,ensamblado con funcionalidades para WPF y MVVM,WPFtoolkitFramework,False,2016-02-10T23:37:55.427+00:00,True,False,"An WPF, MVVM Nuget Framework","wpf,mvvm",2345,False,1.0.3
JetBrains,2016-02-03T15:50:37.963Z,43209,807,JetBrains Profiler Kernel Windows Api Package Version 105.0.20160203.134844-EAP,JetBrains.Profiler.Kernel.Windows.Api,True,1900-01-01T00:00:00+00:00,False,False,,,-1,False,105.0.20160203.134844-EAP
rzmoz,2015-05-05T13:07:05.29Z,43209,1081,CSharp.Basics.SevenZip,CSharp.Basics.SevenZip,False,1900-01-01T00:00:00+00:00,False,False,,,-1,False,5.0.0.17
Monzoom (Poul Foged),2016-02-03T15:38:22.527Z,128,807,"Start Elasticsearch from .NET for integration tests. Contains both java runtime and elasticsearch embedded in the dll. 
    The version number follows the version of the embedded Elasticsearch. With Jvm updates and other changes only the last digit is increased.",elasticsearch-inside,False,2017-12-13T10:50:45.24+00:00,True,False,,"elasticsearch,elastic,integration,tests",24030,False,2.2.0
rzmoz,2014-04-30T11:09:17.643Z,43209,1451,CSharp.Basics.SevenZip,CSharp.Basics.SevenZip,False,1900-01-01T00:00:00+00:00,False,False,,,-1,False,1.1.0
Xamarin Inc.,2016-02-03T20:30:44.607Z,294,807,Extensions for UIImageView allowing you to asynchronously load web images.,Xamarin.SDWebImage,False,2017-06-29T17:01:49.78-07:00,True,False,,,74188,True,3.7.5
,2016-01-25T10:47:44.387Z,43209,816,Silly empty demo project,PaketBug2,False,1899-12-31T16:00:00-08:00,False,False,,,-1,False,2.47.2
rzmoz,2015-08-13T12:44:44.71Z,43209,981,CSharp.Basics.SevenZip,CSharp.Basics.SevenZip,False,1900-01-01T00:00:00+00:00,False,False,,,-1,False,6.2.0.8
CP2aSDK 4.2.0,2016-02-03T13:59:54.047Z,807,807,CP2aSDK for 4.2.0,CP2aSDK,False,2016-02-03T13:59:54.047+00:00,True,False,,,3102,False,4.2.0
takenet,2016-02-03T19:25:21.507Z,14,807,WebSocket transport for LIME protocol.,Lime.Transport.WebSocket,False,2018-04-06T14:54:54.913+00:00,True,False,,lime,51719,False,0.2.390
JetBrains,2016-02-03T15:50:12.25Z,43209,807,JetBrains Profiler History WPF Package Version 105.0.20160203.134844-EAP,JetBrains.Profiler.History.WPF,True,1900-01-01T00:00:00+00:00,False,False,,,-1,False,105.0.20160203.134844-EAP
JetBrains,2016-02-03T15:43:53.39Z,43209,807,JetBrains dotCover Presentation Package Version 105.0.20160203.140603-EAP,JetBrains.dotCover.Presentation,True,1900-01-01T00:00:00+00:00,False,False,,,-1,False,105.0.20160203.140603-EAP
Microsoft,2016-02-03T18:37:10.023Z,464,807,"This package is part of the Azure Mobile .NET Server SDK. Use it to register push notifications with Azure Notification Hubs. To learn more about Azure Mobile, go to http://azure.microsoft.com/mobile.",Microsoft.Azure.Mobile.Server.Notifications,False,2017-01-10T16:47:40.083-08:00,True,False,,"microsoft,azure,mobile,server,appservice,windowsazureofficial,aspnet,webapi,aspnetwebapi,owin,app,service,api,apps",215233,True,1.1.157.1
ForerunnerSW,2016-01-29T18:50:40.087Z,43209,812,"With the Forerunner SDK all of the Controls, APIs, CSS and Events we used to build Mobilizer are documented and available for you to build your own custom experience or incorporate into your existing applications. With full support for MVC, REST / AJAX, HTML5 and CSS building your own modern web application is a breeze.",ForerunnerSDK,False,1900-01-01T00:00:00+00:00,False,False,The Forerunner SDK allows you to showcase your investiment in SSRS reports in your own web application. Forerunner SDK runs on all major browsers and mobile devices.,"SSRS,SQL,Report,Forerunner,MVC,Mobile,Mobilizer,Responsive,jQuery,Widget",-1,False,4.0.453
takenet,2016-02-03T20:14:59.067Z,14,807,Common content types and resource for LIME messaging applications.,Lime.Messaging,False,2018-04-06T14:54:02.897+00:00,True,False,,lime,76495,False,0.2.391
rzmoz,2014-04-30T11:04:40.63Z,43209,1451,CSharp.Basics.SevenZip,CSharp.Basics.SevenZip,False,1900-01-01T00:00:00+00:00,False,False,,,-1,False,1.0.0
Justin Skiles,2016-02-03T17:43:16.703Z,254,807,Parses Valve Source Engine game schema files into easy to use object oriented structures.,SourceSchemaParser,False,2017-08-09T00:46:24.587+00:00,True,False,,"valve,source,steam,schema,parser,json",5212,False,1.0.0.47
takenet,2016-02-03T16:51:19.127Z,14,807,WebSocket transport for LIME protocol.,Lime.Transport.WebSocket,False,2018-04-06T14:54:54.913+00:00,True,False,,lime,51719,False,0.2.388
takenet,2016-02-03T18:32:52.353Z,14,807,C# LIME protocol stack implementation.,Lime.Protocol,False,2018-04-06T14:54:15.49+00:00,True,False,,lime,91449,False,0.2.389
rzmoz,2016-01-08T08:36:47.427Z,43209,833,Syntactical IO sugar and long path support for disk operations,CSharp.Basics.IO,False,1899-12-31T16:00:00-08:00,False,False,,,-1,False,7.0.13
JetBrains,2016-02-03T15:48:23.363Z,43209,807,JetBrains Platform Standalone Ide Package Version 105.0.20160203.133936-EAP,JetBrains.Platform.Standalone.Ide,True,1900-01-01T00:00:00+00:00,False,False,,,-1,False,105.0.20160203.133936-EAP
