authors,created,description,id,is_prerelease,last_updated,listed,missing_info,summary,tags,total_downloads,verified,versionAlex Razvalinov and Paul Nezhencev,2012-07-03T22:00:35.977Z,"The easiest AJAX library for ASP.NET.

Use Render method on any ISelfRenderedControl-derived control and get ready-to-show HTML.",SelfRenderedControl,False,2012-07-03T15:00:35.977-07:00,True,False,,"ASP.NET,AJAX,control",1331,False,1.0.2
Hibernating Rhinos,2012-07-02T23:23:25.507Z,"This package includes the client API of RavenDB to use in FSharp projects. RavenDB is a document database for the .NET platform, offering a flexible data model design to fit the needs of real world systems.",RavenDB.Client.FSharp,True,1899-12-31T16:00:00-08:00,False,False,This package includes the client API of RavenDB.,"nosql,ravendb,raven,document,database,client,fsharp",-1,False,1.2.2028-Unstable
Microsoft,2012-07-03T17:03:03.67Z,Noodles transforms your object model into a web app. This assembly contains stuff to make Noodles work with ASP MVC,Noodles.Web,False,1899-12-31T16:00:00-08:00,False,False,,,-1,False,1.1.269
Hibernating Rhinos,2012-07-04T05:15:31.88Z,"This package let you include RavenDB embedded in your asp.net application. RavenDB is a document database for the .NET/Windows platform, offering a flexible data model design to fit the needs of real world systems.",RavenDB.AspNetHost,True,2018-02-22T21:28:46.793+00:00,True,False,This package let you include RavenDB embedded in your Asp.Net web application.,"nosql,ravendb,raven,document,database,embedded",122255,True,1.2.2029-Unstable
"James Newkirk,Brad Wilson",2012-07-04T22:44:53.34Z,"Extensions for the xUnit.net framework, including data theories (data-driven tests) and several extension attributes.",xunit.extensions,False,2015-03-16T14:14:35.82-07:00,True,False,,,989928,True,1.9.1
Jonathan Oliver,2012-07-04T01:34:07.323Z,A fast and ultra-lightweight (sub-100K) general messaging library and service bus for .NET,NanoMessageBus,False,2016-05-31T09:43:32.42-07:00,True,False,,"messaging,service,bus,servicebus,nano,message,nanomessagebus,nmb,messages",13474,False,2.0.19
"XAct Software Solutions,Inc.",2012-07-05T08:55:25.79Z,An XActLib Assembly: a service to persist History with a UI element. Not the same as Trace or Logging.,XAct.History.I.Db.EF,False,1899-12-31T16:00:00-08:00,False,False,,"XAct,XActLib",-1,False,0.0.528
"Justin Etheredge,Alex Ullrich",2012-07-02T17:52:44.137Z,ASP.NET MVC Extensions for SquishIt,SquishIt.Mvc,True,2017-10-15T21:45:03.527+00:00,True,False,,,106699,False,0.8.7.1-alpha1
SYSTEM,2012-07-04T15:50:05.383Z,Noodles transforms your object modelinto a web app. This is a library to integrate Noodles with AJAX jquery datatables,Noodles.DataTables,False,1899-12-31T16:00:00-08:00,False,False,,,-1,False,1.1.275
S. van Deursen,2012-07-03T21:01:25.053Z,Extension for Simple Injector providing integration with ASP.NET MVC3.,SimpleInjector.MVC3,False,2018-04-14T14:45:34.387+00:00,True,False,Extension for Simple Injector providing integration with ASP.NET MVC3.,"simpleinjector,MVC,MVC3,architecture,dependency-injection,DI,easy,easy-to-use,Inversion-of-Control,IOC,DependencyResolver,ControllerFactory",144396,False,1.4.3.12185
Hibernating Rhinos,2012-07-04T05:19:32.547Z,RavenDB 'Unique Constraints' bundle client. Allow the user to implement unique constraints in the objects (useful for properties like email or social security number).,RavenDB.Client.UniqueConstraints,True,1900-01-01T00:00:00+00:00,False,False,,"nosql,ravendb,raven,document,database,client,bundles",237530,True,1.2.2029-Unstable
"XAct Software Solutions,Inc.",2012-07-05T09:06:19.46Z,An XActLib assembly: a library to manage SharePoint remotely.,XAct.SharePoint.Client,False,2017-02-08T17:58:02.633-08:00,True,False,,"XAct,XActLib",72815,False,0.0.528
"XAct Software Solutions,Inc.",2012-07-05T08:58:12.207Z,"An XActLib assembly: an Assembly that provides a Service to map Domain Entities to Client Layer Models, and/or Data Storage Entities. Uses AutoMapper internally.",XAct.ObjectMapping,False,2017-02-09T01:57:41.01+00:00,True,False,,"XAct,XActLib",73133,False,0.0.528
Mauricio Scheffer,2012-07-03T02:57:14.273Z,Integrates Fuchu with FsCheck,Fuchu.FsCheck,False,2016-01-26T16:59:35.18-08:00,True,False,,"test,testing",13708,False,0.1.3
UTFPR,2012-07-03T19:34:53.247Z,The core assembly in wich UtfprLibrary builds upon.,UtfprLibrary.Core,True,2013-01-25T08:18:48.343-08:00,True,False,,UTFPR,40338,False,1.0.189-alpha
"CityIndex Ltd,Andrei Faber",2012-07-04T16:52:03.67Z,AppMetrics - shared utils,AppMetrics.WebUtils,False,1899-12-31T16:00:00-08:00,False,False,,,30687,False,1.0.226
"XAct Software Solutions,Inc.",2012-07-05T08:53:40.947Z,An XActLib assembly: an Assembly that provides a Log4NetTraceListener (rerouting XAct.Diagnostics.Trace calls to Log4Net -- nice!) as well as Log4Net specific implementation of the Tracing service defined in XAct.Core.,XAct.Diagnostics.Log4Net,False,2017-02-08T17:57:07.633-08:00,True,False,,"XAct,XActLib",90650,False,0.0.528
ziyasal,2012-07-02T23:10:42.607Z,AOPify.Aspects provides PreProcess and PostProcess operations custom processors,AOPify.Aspects,False,2013-02-22T13:54:19.47+00:00,True,False,,"AOP,Aspect,Attibute",2180,False,0.2.3.209
"XAct Software Solutions,Inc.",2012-07-05T08:55:46.507Z,"An XActLib Assembly: common code for accessing files, etc.",XAct.IO,False,2017-02-08T17:57:23.43-08:00,True,False,,"XAct,XActLib",97215,False,0.0.528
Hibernating Rhinos,2012-07-02T23:21:56.88Z,The Authorization Bundle extends RavenDB and adds...TODO,RavenDB.Bundles.Authentication,True,1899-12-31T16:00:00-08:00,False,False,,"nosql,ravendb,raven,document,database,bundles",-1,False,1.2.2028-Unstable
SpringSource,2012-07-03T18:12:25.963Z,"A WCF Binding for RabbitMQ. The RabbitMQ .NET client is an implementation of an AMQP client library for C# (and, implicitly, other .NET languages), and a binding exposing AMQP services via Microsoft's Windows Communication Foundation (WCF).",RabbitMQ.ServiceModel,False,2017-03-29T07:17:38.547-07:00,True,False,,"RabbitMQ,Client,AMQP,WCF,SpringSource,vmware",23069,False,2.8.4
KW_COMPANYNAME,2012-07-05T06:43:22.437Z,KW_ASSEMBLYDESCRIPTION,XAct.Diagnostics.EnterpriseLibrary,False,1899-12-31T16:00:00-08:00,False,False,,,-1,False,0.0.527
Microsoft,2012-07-04T15:44:24.117Z,Noodles transforms your object model into a web app. This assembly contains stuff to make Noodles work with ASP MVC,Noodles.Web,False,1899-12-31T16:00:00-08:00,False,False,,,-1,False,1.1.274
"XAct Software Solutions,Inc.",2012-07-05T06:44:25.767Z,An XActLib assembly: assembly for persisting History entries related to specific domain entities (not the same as Tracing or Logging).,XAct.History,False,2017-02-08T17:57:18.227-08:00,True,False,,"XAct,XActLib",72082,False,0.0.527
hazzik,2012-07-04T19:51:52.06Z,Grapes it is an utility library which takes care of mapping tree-like data structures into database.,Brandy.Grapes.FluentNHibernate,False,2015-01-05T23:54:35.387-08:00,True,False,,,1436,False,1.0.3
saveenr,2012-07-04T17:38:28.367Z,"Convert colors between RGB, HSV, HSL, XYZ, and LAB.",Colorspace,False,2012-07-04T10:38:28.367-07:00,True,False,,"Color,RGB,XYZ,HSV,HSL,LAB",3680,False,1.0.2
Mark Seemann,2012-07-04T10:36:41.557Z,"AutoFixture makes it easier for developers to do Test-Driven Development by automating non-relevant Test Fixture Setup, allowing the Test Developer to focus on the essentials of each test case.",AutoFixture,False,2018-03-21T15:54:28.72+00:00,True,False,,,3070911,True,2.11.4
kimbirkelund,2012-07-05T08:14:38.693Z,An XML serialization framework.,SekhmetSerialization,False,1899-12-31T16:00:00-08:00,False,False,,,-1,False,0.9.0.10
"XAct Software Solutions,Inc.",2012-07-05T08:59:26.297Z,An XActLib Assembly: contains initialization code that requires EF,XAct.Resources.Db.EF,False,1899-12-31T16:00:00-08:00,False,False,,"XAct,XActLib",-1,False,0.0.528
Harry McIntyre,2012-07-04T15:49:54.72Z,Noodles transforms your object modelinto a web app. This is the core library without a dependency on ASP MVC,Noodles,False,2013-11-23T10:56:35.543-08:00,True,False,,,86087,False,1.1.275
Tatham Oddie,2012-07-02T23:14:36.423Z,Testing helpers for the System.IO.Abstractions package to save having to manually mock everything.,System.IO.Abstractions.TestingHelpers,False,2018-01-11T23:41:49.64+00:00,True,False,,testing,224197,False,1.4.0.25
"CityIndex Ltd,Andrei Faber",2012-07-05T08:05:46.367Z,.NET client library for the AppMetrics application runtime intelligence system,AppMetrics.Client,False,2013-10-31T21:39:49.57-07:00,True,False,,,99159,False,1.0.227
Adriano Caldeira,2012-07-03T21:49:10.777Z,Thunder,jQueryThunder,False,1899-12-31T16:00:00-08:00,False,False,,"jquery,modal,form,ajax",-1,False,1.1.3
Steven Bey,2012-07-03T23:40:40.047Z,XML ErrorLog Provider for ELFAR (WebApi).,elfar.webapi.xml,False,2012-07-03T16:40:40.047-07:00,True,False,,"elfar,webapi,xml,error,logging,unhandled,exceptions",2882,False,1.2.4567.26294
Harry McIntyre,2012-07-03T16:43:19.407Z,Noodles transforms your object modelinto a web app. This is the core library without a dependency on ASP MVC,Noodles,False,2013-11-23T10:56:35.543-08:00,True,False,,,86087,False,1.1.266
"Justin Etheredge,Alex Ullrich",2012-07-02T17:57:09.55Z,SquishIt lets you easily compress and combine JavaScript and CSS.,SquishIt,True,2017-10-15T21:43:35.103+00:00,True,False,,,267175,False,0.9.0-alpha2
Jonathan Oliver,2012-07-04T01:34:35.467Z,Additional logging provider for NanoMessageBus using Log4Net v1.2.11 (aka v2.0).,NanoMessageBus.Log4Net2,False,1899-12-31T16:00:00-08:00,False,False,Log4Net logging plugin for NanoMessageBus.,"messaging,service,bus,servicebus,nano,message,nanomessagebus,nmb,messages,logging,log4net",-1,False,2.0.19
Code Owls LLC,2012-07-03T19:06:58.247Z,PowerShell module that deeply integrates Visual Studio extensibility with your PowerShell session.,StudioShell.Beta,False,2013-05-27T16:28:27.84-07:00,True,False,,"StudioShell,PowerShell,VisualStudio,DTE",3298,False,1.3.1
Ethan Brown,2012-07-03T19:27:15.903Z,"An MSBuild project integration that makes it easy to keep version numbers synced across all projects in a solution based on a simple date scheme and user provided major / minor version numbers.  Provides a single source of truth for versioning, and modifies it at build time as necessary to keep assembly metadata fresh.",CroMagVersion,False,2013-02-11T16:23:36.903-08:00,True,False,An MSBuild project integration that makes it easy to keep version numbers synced across all projects in a solution based on a simple date scheme and user provided major / minor version numbers.,"msbuild,version,ci,continuous,integration,dvcs,mercurial,hg,git",5980,False,0.3.1
Microsoft,2012-07-03T16:47:07.803Z,"Noodles transforms your object model into a web app. Install this library to customise the cshtml template files, or if you don't want to use the EmbeddedResourceVirtualPathProvider to load your views",Noodles.Templates,False,1899-12-31T16:00:00-08:00,False,False,,,-1,False,1.1.267
"XAct Software Solutions,Inc.",2012-07-05T08:54:48.307Z,An XActLib assembly: assembly for persisting History entries related to specific domain entities (not the same as Tracing or Logging).,XAct.History,False,2017-02-08T17:57:18.227-08:00,True,False,,"XAct,XActLib",72082,False,0.0.528
Microsoft,2012-07-03T16:47:16.577Z,Noodles transforms your object model into a web app. This assembly contains stuff to make Noodles work with ASP MVC,Noodles.Web,False,1899-12-31T16:00:00-08:00,False,False,,,-1,False,1.1.267
Appfail,2012-07-04T12:58:02.327Z,Appfail monitors your web application for exceptions and reports them to appfail.net for rich failure analytics and notifications.,Appfail.WebForms,False,2012-07-04T05:58:04.997-07:00,True,False,,,54472,False,1.1.0
"XAct Software Solutions,Inc.",2012-07-05T06:48:43.407Z,"An XActLib assembly: a library to manage security. Defines contracts used by other assemblies (such as XAct.Security.FormsAuthentication, etc.)",XAct.Security,False,2017-02-09T01:57:50.917+00:00,True,False,,"XAct,XActLib",91129,False,0.0.527
Duncan Smart,2012-07-04T17:40:27.66Z,HTTP handlers that transform *.less and *.coffee files into CSS and JavaScript resepectively on the fly.,LessCoffee,False,2014-02-05T04:31:55.457-08:00,True,False,,"less,css,javascript,coffeescript",15025,False,2.1.0
kimbirkelund,2012-07-05T10:27:09.127Z,An XML serialization framework.,Sekhmet.Serialization.XmlSerializerSupport,False,2013-04-17T08:46:50.667-07:00,True,False,,,4705,False,0.9.0.18
SYSTEM,2012-07-04T15:51:41.513Z,Noodles transforms your object modelinto a web app. This is a library to integrate Noodles with AJAX jquery datatables,Noodles.DataTables,False,1899-12-31T16:00:00-08:00,False,False,,,-1,False,1.1.276
samuel.carlsson,2012-07-04T16:00:57.487Z,Adds support for sending crash reports to bugsense from Windows Desktop Applications,Bugsense.WPF,False,2013-06-24T01:28:16.963-07:00,True,False,,,2573,False,1.0.1
Microsoft,2012-07-03T16:59:40.42Z,Noodles transforms your object model into a web app. This assembly contains stuff to make Noodles work with ASP MVC,Noodles.Web,False,1899-12-31T16:00:00-08:00,False,False,,,-1,False,1.1.268
"XAct Software Solutions,Inc.",2012-07-05T08:59:06.377Z,An XActLib assembly: a Library to access resources in a Db.,XAct.Resources.Db,False,1899-12-31T16:00:00-08:00,False,False,,"XAct,XActLib",-1,False,0.0.528
UTFPR,2012-07-03T18:22:50.053Z,WindowsForms,UtfprLibrary.WindowsForms,True,2013-01-25T08:19:22.657-08:00,True,False,,"UTFPR,WindowsForms,EntityFramework",95986,False,1.0.187-alpha
Hibernating Rhinos,2012-07-04T05:15:50.21Z,The cascade delete bundle allows for a specified set of documents and attachments to be deleted when the document that owns it is deleted. Typical usage scenarios include deleting an attachment that is referenced by a document or removing a set of child documents referenced by a parent document.,RavenDB.Bundles.CascadeDelete,True,1900-01-01T00:00:00+00:00,False,False,,"nosql,ravendb,raven,document,database,bundles",194586,True,1.2.2029-Unstable
"XAct Software Solutions,Inc.",2012-07-05T06:49:30.343Z,"An XActLib assembly: a library that uses the interfaces defined in XAct.Security, in order to offer a WindowsAuthenticationService, and a WindowsAuthorizationService.",XAct.Security.Windows,False,2017-02-08T17:57:54.087-08:00,True,False,,"XAct,XActLib",89728,False,0.0.527
Steven Bey,2012-07-03T14:39:04.437Z,Mail module for ELFAR. Requires one of the ErrorLog Provider packages to be installed and a manual update of the App_Start\Elfar.cs file.,elfar.mail,False,2012-07-03T16:47:48.233-07:00,True,False,,"elfar,mvc,mail,error,logging,unhandled,exceptions",3714,False,1.2.4567.26289
Steven Bey,2012-07-03T23:05:57.113Z,Mail module for ELFAR. Requires one of the ErrorLog Provider packages to be installed and a manual update of the App_Start\Elfar.cs file.,elfar.mail,False,2012-07-03T16:47:48.233-07:00,True,False,,"elfar,mvc,mail,error,logging,unhandled,exceptions",3714,False,1.2.4567.41427
Simon Green,2012-07-03T22:07:05.877Z,ELMAH with configuration for getting started quickly on a MongoDB database as the error log. NB requires manual configuration.,elmah.mongodb,False,2012-12-26T11:42:47.33-08:00,True,False,ELMAH with configuration for getting started quickly on a MongoDB database as the error log. NB requires manual configuration.,"mongodb,elmah,error,logging,unhandled,exception",23236,False,1.5.0
Microsoft,2012-07-04T15:31:51.133Z,"Noodles transforms your object model into a web app. Install this library to customise the cshtml template files, or if you don't want to use the EmbeddedResourceVirtualPathProvider to load your views",Noodles.Templates,False,1899-12-31T16:00:00-08:00,False,False,,,-1,False,1.1.273
Steven Bey,2012-07-03T23:51:08.787Z,In-Memory ErrorLog Provider for ELFAR.,elfar.in-memory,False,2012-07-03T16:51:08.787-07:00,True,False,,"elfar,mvc,in-memory,error,logging,unhandled,exceptions",3536,False,1.2.4567.26288
Steven Bey,2012-07-03T14:38:47.28Z,Core library for Error Logging Filter and Route (ELFAR).,elfar.core,False,2012-08-11T16:19:09.223-07:00,True,False,An error logging utility.,"elfar,error,logging,unhandled,exceptions",3971,False,1.2.4567.26287
JohnMichaelHauck,2012-07-04T18:42:52.973Z,A Custom Content Control for Metro Settings Charm Flyouts,CharmFlyout,False,2013-02-06T07:43:29.253-08:00,True,False,,,8703,False,1.0.0
"XAct Software Solutions,Inc.",2012-07-05T09:02:58.277Z,An XActLib assembly: a Library for working with Ninject in a classic ASP.NET App,XAct.Services.IoC.AspNet.Ninject,False,2014-01-22T22:26:12.763-08:00,True,False,,"XAct,XActLib",60284,False,0.0.528
SG,2012-07-03T18:59:41.017Z,Sencha Touch 2 for Windows Phone,SenchaTouchWPdebug,False,1899-12-31T16:00:00-08:00,False,False,,,-1,False,1.0.3
Mark Seemann,2012-07-03T04:12:56.713Z,"This extension turns AutoFixture into an Auto-Mocking Container. The mock instances are created by Moq. To use it, add the AutoMoqCustomization to your Fixture instance. Read more at http://blog.ploeh.dk/2010/08/19/AutoFixtureAsAnAutomockingContainer.aspx",AutoFixture.AutoMoq,False,2018-03-21T15:55:13.55+00:00,True,False,Turns AutoFixture into an Auto-Mocking Container based on Moq.,,873863,True,2.11.3
IBM,2012-07-03T20:58:12.167Z,Interop library for Notes Domino 8.5.3,interop.domino.dll,False,2012-07-03T13:58:14.29-07:00,True,False,,"Lotus,Notes,Domino",36230,False,1.0.0
hazzik,2012-07-05T09:29:38.7Z,Grapes it is an utility library which takes care of mapping tree-like data structures into database.,Brandy.Grapes.NHibernate,False,2015-01-05T23:53:53.303-08:00,True,False,,,2235,False,1.0.4
Anthony Johnston,2012-07-02T21:58:05.033Z,"Testing helpers, incl. Generic Builder to delegate instance creation for testing data using Mocks, Pocos or whatever",antix-testing,True,2013-05-14T15:55:19.717-07:00,True,False,,"Testing,Builder",10653,False,1.1.0-b02
Cameron MacFarland,2012-07-03T04:56:16.887Z,MetroChrome is a simple theme for WPF.,MetroChrome,False,1900-01-01T00:00:00+00:00,False,False,,"WPF,XAML,theme",-1,False,0.1.0.42
Goroll,2012-07-04T14:17:28.32Z,"A TreeView which supports, unlike the standard tree in WPF, multiple selection and is a little better stylable.",treeviewex,False,2012-07-04T07:20:54.643-07:00,True,False,,.net40,1539,False,0.1.0
hazzik,2012-07-05T09:29:21.253Z,Grapes it is an utility library which takes care of mapping tree-like data structures into database.,Brandy.Grapes.FluentNHibernate,False,2015-01-05T23:54:35.387-08:00,True,False,,,1436,False,1.0.4
Amir Rajan,2012-07-04T01:52:21.433Z,"Dynamic models for .Net applications (data access, associations, validation change tracking). Handles saving and retrieving data (using an altered version of Massive..DynamicRepository).",cambium,False,2013-12-11T09:37:42.29-08:00,True,False,,"dynamic,activemodel,oak",16442,False,1.2.1
"Justin Etheredge,Alex Ullrich,Rodrigo Dumont",2012-07-02T17:57:44.517Z,Adds Sass processing capability to SquishIt. Can compile .sass and .scss files.,SquishIt.Sass,True,2017-10-15T21:45:26.72+00:00,True,False,,,15068,False,0.9.0-alpha2
Iain Hunter,2012-07-04T22:23:08.85Z,"AzureCdn.Me.Nant contains a custom build of YUI Compressor that adds a new parameter to the cssCompressor task allowing you to append a query string onto image refs in your css files, thus invalidating them on the Azure CDN cache",AzureCdn.Me.Nant,False,2012-07-04T15:23:08.85-07:00,True,False,"AzureCdn.Me.Nant appends a querystring to images referenced in CSS files, thus invalidating any CDN cache","azure,cdn,cacheing,nant,css,javascript",2696,False,1.0.0.6
MefContrib,2012-07-05T05:41:58.063Z,Managed Extensibility Framework (MEF) and Unity integration.,MefContrib.Integration.Unity,False,2012-07-05T08:01:35.14-07:00,True,False,Managed Extensibility Framework (MEF) and Unity integration.,"mef,ioc,di,dependency,injection,mvc,composition,unity",18740,False,1.2.2
Hibernating Rhinos,2012-07-02T23:22:14.303Z,"The expiration bundle serves a very simple purpose, it deletes documents whose time have passed. Usage scenarios for the Expiration Bundle include storing user sessions in RavenDB or using RavenDB as a cache.",RavenDB.Bundles.Expiration,True,1899-12-31T16:00:00-08:00,False,False,,"nosql,ravendb,raven,document,database,bundles",-1,False,1.2.2028-Unstable
Steven Bey,2012-07-03T14:39:13.607Z,SQL Server ErrorLog Provider for ELFAR.,elfar.sqlclient,False,2012-07-03T16:06:05.3-07:00,True,False,,"elfar,mvc,sqlclient,error,logging,unhandled,exceptions",3769,False,1.2.4567.26289
Steven Bey,2012-07-03T14:40:34.123Z,SQLite ErrorLog Provider for ELFAR (WebApi).,elfar.webapi.sqlite,False,1899-12-31T16:00:00-08:00,False,False,,"elfar,webapi,sqlite,error,logging,unhandled,exceptions",2848,False,1.2.4567.26293
NinjaTurtles,2012-07-04T14:15:09.54Z,Mutation testing library for .NET,NinjaTurtles,False,2015-05-19T07:06:36.357-07:00,True,False,,,5283,False,0.3.0.1
Adolfo Marinucci,2012-07-04T21:20:13.33Z,"AvalonDock is a WPF controls library which can be used to create a docking layout system like that is present in VisualStudio. It supports fly-out panes, floating windows, multiple docking manager in same window, styles and themes and it can host WinForms controls.",AvalonDock,False,1899-12-31T16:00:00-08:00,False,False,,"WPF,Docking",-1,False,2.0.1074
SG,2012-07-03T15:32:20.31Z,Sencha Touch 2 for Windows Phone,SenchaTouchWPdebug,False,1899-12-31T16:00:00-08:00,False,False,,,-1,False,1.0.1
"XAct Software Solutions,Inc.",2012-07-05T06:54:31.503Z,An XActLib assembly: a Library of code for working with Asp.NET Mvc v3 Framework,XAct.UI.Web.Mvc,False,2017-02-09T01:58:07.993+00:00,True,False,,"XAct,XActLib",68731,False,0.0.527
Steven Bey,2012-07-03T23:43:12.337Z,SQL Server CE ErrorLog Provider for ELFAR (MVC+WebApi).,elfar.combined.sqlserverce,False,2012-07-03T16:43:12.337-07:00,True,False,,"elfar,mvc,webapi,sqlserverce,error,logging,unhandled,exceptions",1610,False,1.2.4567.26294
"XAct Software Solutions,Inc.",2012-07-05T06:54:52.377Z,"An XActLib assembly: a collection of gifs, etc. of somewhat dubious use in Web applications.",XAct.UI.Web.Resources,False,2015-11-02T07:50:40.53+00:00,True,False,,"XAct,XActLib",64921,False,0.0.527
"XAct Software Solutions,Inc.",2012-07-05T08:54:06.21Z,"An ActLib Assembly: a library for developing the Domain of an application. Contains contracts for repositories, etc.",XAct.Domain,False,2017-02-08T17:57:14.227-08:00,True,False,,"XAct,XActLib",74047,False,0.0.528
"CityIndex Ltd,Andrei Faber",2012-07-05T08:05:50.07Z,AppMetrics - shared utils,AppMetrics.WebUtils,False,1899-12-31T16:00:00-08:00,False,False,,,30687,False,1.0.227
Hibernating Rhinos,2012-07-02T23:23:36.85Z,RavenDB Client MvcIntegration let you include a visual profiler in your ASP.NET MVC application which will show you all the opened sessions and the time took to complete each database request. This can help you when developing with RavenDB.,RavenDB.Client.MvcIntegration,True,1900-01-01T00:00:00+00:00,False,False,A visual profiler for RavenDB that you can use in your ASP.NET MVC application.,"nosql,ravendb,raven,document,database,client,mvc",238227,True,1.2.2028-Unstable
Johan Laanstra,2012-07-03T15:10:11.497Z,Windows.UI.Interactivity is a port of System.Windows.Interactivity to the Windows Runtime and allows you to use behaviors and triggers as in Silverlight.,Windows.UI.Interactivity,False,2013-02-24T13:40:43.113-08:00,True,False,,"winrt,behaviors,triggers,interactivity",28957,False,1.0.0
"XAct Software Solutions,Inc.",2012-07-05T06:47:15.813Z,An XActLib assembly: a Library for working with Resources.,XAct.Resources,False,2017-02-08T17:57:43.633-08:00,True,False,,"XAct,XActLib",92033,False,0.0.527
Ozan Seymen,2012-07-03T22:16:51.017Z,NLog Target for GrayLog2,Gelf4NLog.Target,False,2012-07-03T15:16:54.143-07:00,True,False,,,33434,False,1.0.0.2
shawnk,2012-07-02T22:25:53.92Z,C# SDK for the ArcGIS Server Admin REST API,ArcGISServerAdminSDK,False,2012-07-02T15:25:55.903-07:00,True,False,C# SDK for the ArcGIS Server Admin REST API,"ArcGIS,AGS",5177,False,1.2.2
Microsoft,2012-07-04T15:44:06.773Z,"Noodles transforms your object model into a web app. Install this library to customise the cshtml template files, or if you don't want to use the EmbeddedResourceVirtualPathProvider to load your views",Noodles.Templates,False,1899-12-31T16:00:00-08:00,False,False,,,-1,False,1.1.274
Steven Bey,2012-07-03T23:08:01.107Z,SQLite ErrorLog Provider for ELFAR (WebApi).,elfar.webapi.sqlite,False,1899-12-31T16:00:00-08:00,False,False,,"elfar,webapi,sqlite,error,logging,unhandled,exceptions",2848,False,1.2.4567.26289
Microsoft,2012-07-03T16:44:09.743Z,Noodles transforms your object model into a web app. This assembly contains stuff to make Noodles work with ASP MVC,Noodles.Web,False,1899-12-31T16:00:00-08:00,False,False,,,-1,False,1.1.266
UTFPR,2012-07-03T12:59:28.053Z,The core assembly in wich UtfprLibrary builds upon.,UtfprLibrary.Core,True,2013-01-25T08:18:48.343-08:00,True,False,,UTFPR,40338,False,1.0.186-alpha
anders@perifer.se,2012-07-05T00:14:28.677Z,A time picker for jQuery inspired by Google Calendar,jQuery.timePicker,True,2012-07-05T06:39:41.593-07:00,True,False,A time picker for jQuery inspired by Google Calendar,jQuery,1196,False,0.9.2-beta
Microsoft,2012-07-04T15:30:01.167Z,"Noodles transforms your object model into a web app. Install this library to customise the cshtml template files, or if you don't want to use the EmbeddedResourceVirtualPathProvider to load your views",Noodles.Templates,False,1899-12-31T16:00:00-08:00,False,False,,,-1,False,1.1.272
Steven Bey,2012-07-03T14:40:46.453Z,SQL Server CE ErrorLog Provider for ELFAR (WebApi).,elfar.webapi.sqlserverce,False,2012-07-03T16:36:28.997-07:00,True,False,,"elfar,webapi,sqlserverce,error,logging,unhandled,exceptions",2835,False,1.2.4567.26293
