authors,created,days_abandoned,days_alive,description,id,is_prerelease,last_updated,listed,missing_info,summary,tags,total_downloads,verified,versionjzumwalt,2014-11-07T16:42:28.747Z,1260,1260,Empty package to test Squirrel Windows,SquirrelTest,False,2014-11-07T09:09:16.89-08:00,True,False,,,2456,False,1.0.2
"Steffen Forkmann,Mauricio Scheffer,Colin Bull",2014-11-07T16:10:14.63Z,5,1260,FAKE - F# Make - is a build automation tool for .NET. Tasks and dependencies are specified in a DSL which is integrated in F#. Extensions for Gallio,FAKE.Gallio.x64,False,2018-04-15T16:41:31.16+00:00,True,False,FAKE - F# Make - Get rid of the noise in your build scripts.,"build,fake,f#",58791,False,3.9.0
Cameron VanHouzen,2014-11-07T18:34:38.57Z,43209,1260,A set of APIs for interacting with the Versus™ RTLS system.,MAPI,True,1900-01-01T00:00:00+00:00,False,False,,"rtls,api,mapi,mockingbird",-1,False,3.0.0-beta001
SolerSoft,2014-11-06T20:28:42.76Z,1257,1261,"This helper library makes it easier to create .Net-backed Azure Mobile Services. It includes helper controller base classes 
          and it allows client applications and services to share the same entity class files (though file linking).
          Simply reference SolerSoft.Data.Client in the client project and SolerSoft.Data.AzureNetServer in the server project, then
          inherit your entities from SolerSoft.Data.DataObject. On the client, DataObjec provides full property change notification.
          On the server, DataObject inherits from EntityData as reqired by Mobile Service controllers. Conditional compile 
          statements can be used to further refine between client behaviors and server behaviors.",SolerSoft.Data.AzureNetServer,True,2014-11-10T11:34:09.437-08:00,True,False,,"SolerSoft,Data,Azure,MobileServices",4524,False,1.0.0-beta5
"XAct Software Solutions,Inc.",2014-11-07T11:52:47.897Z,435,1260,"An XAct Library Assembly: An Assembly that contains interfaces common to datastore, while not limiting it to DBMS (see XAct.Data.Db, XAct.Data.EF, for such functionality).",XAct.Data,False,2017-02-08T17:56:56.587-08:00,True,False,,"XAct,XActLib",98590,False,0.0.4819
"XAct Software Solutions,Inc.",2014-11-07T12:58:01.787Z,435,1260,An XActLib Assembly: Domain object required to support UI development.,XAct.UI.Entities,False,2017-02-09T01:58:06.37+00:00,True,False,,"XAct,XActLib",56747,False,0.0.4819
eXpandFramework,2014-11-06T19:37:20.743Z,11,1261,Validation Module (Win) / eXpandFramework. To debug in VS enable Source Server support under Tools/Options/Debugging.,eXpandValidationWin,False,2018-04-09T16:24:36.837+00:00,True,False,Validation Module (Win) / eXpandFramework,"DevExpress,eXpand,XAF,eXpressApp",39091,False,14.1.8.1
"XAct Software Solutions,Inc.",2014-11-07T12:40:14.027Z,435,1260,"An XActLib assembly: a library to manage security. Defines contracts used by other assemblies (such as XAct.Security.FormsAuthentication, etc.)",XAct.Security,False,2017-02-09T01:57:50.917+00:00,True,False,,"XAct,XActLib",92941,False,0.0.4819
GeertvanHorrik,2014-11-06T22:36:57.233Z,507,1261,Catel.Extensions.CSLA library which provides CSLA.NET view models for Catel.,Catel.Extensions.CSLA,True,2016-11-29T13:35:56.627+00:00,True,False,,"catel,csla,clsa.net",105532,True,4.0.0-unstable0535
Takenet,2014-11-07T19:05:22.323Z,1260,1260,Get carrier Info,db.take.io.carrier.library,False,2014-11-07T11:08:05.82-08:00,True,False,,,3648,False,0.0.0.2
Nu,2014-11-07T08:05:28.137Z,1206,1260,Wrapper of log4net,Nu.Logger,False,2014-12-30T19:23:36.177-08:00,True,False,,,7989,False,1.2.3
GeertvanHorrik,2014-11-07T01:10:45.403Z,507,1260,"Catel.Extensions.Controls library which contains user controls, such as the StackGrid.",Catel.Extensions.Controls,True,2016-11-29T13:35:55.627+00:00,True,False,,"windows,controls,stackgrid,styles,stylehelper",170616,True,4.0.0-unstable0537
Nu,2014-11-07T04:46:14.793Z,1247,1260,Common gui classes wrapper of dot net graph library.,Nu.Common.Gui,False,2014-11-19T18:48:35.2-08:00,True,False,,,8975,False,1.1.4
"XAct Software Solutions,Inc.",2014-11-07T12:10:02.087Z,435,1260,"An XActLib Assembly: library for working with Zip Packages (Compression + Structure). A poor man's Zip Solution, that requires no external assemblies beyond .NET. See DotNetZip for better functionality.",XAct.IO.Compression.ZipPackage,False,2017-02-08T17:57:22.977-08:00,True,False,,"XAct,XActLib",91345,False,0.0.4819
Hibernating Rhinos,2014-11-07T08:04:14.593Z,57,1260,RavenDB embedded database,RavenDB.Bundles.IndexReplication,False,2018-02-22T21:29:30.903+00:00,True,False,,"nosql,ravendb,raven,document,database,bundles",116112,True,2.5.2938
Mathieu Brun,2014-11-06T19:32:06.867Z,775,1261,"Easily generate sample data for your demos, using fluent API",SampleDataGenerator,False,2016-03-06T10:34:29.017-08:00,True,False,,"sample,data,demo,generator,generation",9617,False,1.0.7
Mogens Heller Grabe,2014-11-07T05:58:37.943Z,309,1260,Entity Framework-based view manager for d60 event sourcing + cqrs kit,d60.Cirqus.EntityFramework,False,2017-06-14T22:32:11.503-07:00,True,False,,,22298,False,0.44.0
Steve Fenton,2014-11-06T22:19:54.76Z,320,1261,"An xUnit style framework for TypeScript with auto-discovery and assertions. Styled to suit use as an internal module.
      If you are using internal modules, use the tsUnit.External NuGet package instead.",tsUnit,False,2017-06-04T13:21:53.783-07:00,True,False,An xUnit style framework for TypeScript with auto-discovery and assertions. Styled to suit use as an internal module.,"unit,testing,framework,typescript",9983,False,1.5.2
"XAct Software Solutions,Inc.",2014-11-07T12:41:46.037Z,435,1260,"An XActLib assembly: a library that uses the interfaces defined in XAct.Security, in order to offer a WindowsAuthenticationService, and a WindowsAuthorizationService.",XAct.Security.Windows,False,2017-02-08T17:57:54.087-08:00,True,False,,"XAct,XActLib",91531,False,0.0.4819
Erik Källén,2014-11-06T20:12:55.107Z,996,1261,This package contains file necessary to develop plugins for the Saltarelle C# to Javascript compiler. This package is NOT needed during normal usage.,Saltarelle.Compiler.ExtensibilityDevelopment,False,2015-07-29T07:13:48.813-07:00,True,False,,,4247,False,2.6.1
"XAct Software Solutions,Inc.",2014-11-07T11:50:36.417Z,435,1260,An XActLib Assembly: common code specific app.Config Configuration,XAct.Configuration,False,2017-02-08T17:56:54.79-08:00,True,False,,"XAct,XActLib",91253,False,0.0.4819
"XAct Software Solutions,Inc.",2014-11-07T11:55:09.19Z,900,1260,An XActLib assembly: a library of common code for working with ClickOnce deployment technology.,XAct.Deployment.ClickOnce,False,2015-11-01T21:20:42.97-08:00,True,False,,"XAct,XActLib",54251,False,0.0.4819
Amazon Web Services,2014-11-06T23:39:23.297Z,919,1261,TraceListener extensions for the AWS SDK for .NET. This contains a TraceListener using Amazon DynamoDB.,AWS.TraceListener,False,2015-10-14T16:00:07.26-07:00,True,False,,"AWS,Amazon,cloud",67621,False,2.3.6
ITfoxtec,2014-11-07T14:40:09.317Z,743,1260,"The ITfoxtec SAML 2.0 package adds SAML-P support on top of the SAML 2.0 token functionality implemented in the .NET framework.
Supports: Message signing and validation as well as decryption. Login, logout, single logout and metadata. Both SP Initiated and IdP Initiated sign on. The Danish OIOSAML 2.0 profile and NemLog-in. 

Supporting .NET 4.5",ITfoxtec.Saml2,False,2016-04-07T03:26:05.833-07:00,True,False,,"SAML,SAML2.0,SAML2,SAML-P,SAMLP,SSO,Authentication,Metadata,OIOSAML,NemLog-in",8919,False,1.2.0
Nu,2014-11-07T08:23:47.57Z,1172,1260,Serial Port Param UI,Nu.Io.Serial.Ui,False,2015-02-02T23:42:03.877-08:00,True,False,,,3386,False,1.1.1
"XAct Software Solutions,Inc.",2014-11-07T12:25:05.5Z,435,1260,"An XActLib Assembly: library for handling SMTP, etc.",XAct.Net,False,2017-02-09T01:57:38.93+00:00,True,False,,"XAct,XActLib",44499,False,0.0.4819
"XAct Software Solutions,Inc.",2014-11-07T12:51:28.203Z,435,1260,An XActLib Assembly: common SharePoint code.,XAct.SharePoint,False,2017-02-08T17:58:03.167-08:00,True,False,,"XAct,XActLib",56291,False,0.0.4819
OrchestraDevs,2014-11-07T12:54:34.523Z,4,1260,This library makes managing workspaces very easy.,Orc.WorkspaceManagement.Xaml,True,2018-04-16T15:16:11.083+00:00,True,False,,"orc,workspace,management,xaml,wpf",12203,True,0.2.0-unstable0048
Mogens Heller Grabe,2014-11-07T05:59:20.047Z,309,1260,NLog integration for Cirqus,d60.Cirqus.NLog,False,2017-06-14T22:32:50.753-07:00,True,False,,,28364,False,0.44.0
"XAct Software Solutions,Inc.",2014-11-07T12:57:02.653Z,435,1260,"An XActLib assembly: a Common library of UI Layer code, that is UI-Framework Agnostic.",XAct.UI,False,2017-02-08T17:58:04.79-08:00,True,False,,"XAct,XActLib",100589,False,0.0.4819
"XAct Software Solutions,Inc.",2014-11-07T11:55:56.017Z,435,1260,An XActLib assembly: an assembly to deploy database schemas.,XAct.Deployment.Db.Schemas,False,2017-02-08T17:57:08.023-08:00,True,False,,"XAct,XActLib",56011,False,0.0.4819
Logistical Labs,2014-11-07T14:42:29.383Z,30,1260,Rex client library,RexClient,False,2018-03-21T11:12:37.46+00:00,True,False,,,47239,False,1.2.2.26279
Steve Fenton,2014-11-06T22:19:57.987Z,43209,1261,"An xUnit style framework for TypeScript with auto-discovery and assertions. Styled to suit use as an external module.
      If you are using internal modules, use the tsUnit NuGet package instead.",tsUnit.external,False,1899-12-31T16:00:00-08:00,False,False,An xUnit style framework for TypeScript with auto-discovery and assertions. Styled to suit use as an external module.,"unit,testing,framework,typescript",5345,False,1.5.2
Nu,2014-11-07T08:18:20.293Z,1247,1260,Common classes wrapper of dotnet.,Nu.Common,False,2014-11-19T18:47:57.24-08:00,True,False,,,12863,False,1.1.4
Caelan,2014-11-07T14:49:43.573Z,595,1260,Common framework for DAL and BIZ packages,Caelan.Frameworks.Common,False,2016-09-02T05:46:10.773-07:00,True,False,,"caelan,frameworks,builder,common,automapperextender,passwordhelper",29563,False,2.2.3
"XAct Software Solutions,Inc.",2014-11-07T12:15:40.447Z,435,1260,An XActLib Assembly: Library to work against the StringTemplates Template Engine,XAct.IO.TemplateEngines.StringTemplate,False,2017-02-08T17:57:28.18-08:00,True,False,,"XAct,XActLib",54529,False,0.0.4819
"XAct Software Solutions,Inc.",2014-11-07T11:54:19.563Z,900,1260,An XActLib assembly: an Assembly that provides implementations of Repositories for EF40 and later suitable for working with POCOs as well as CodeFirst.,XAct.Data.EF,False,2015-11-02T03:19:10.707-08:00,True,False,,"XAct,XActLib",59158,False,0.0.4819
damienbod,2014-11-06T20:59:18.13Z,544,1261,Elasticsearch simple CRUD operations,ElasticsearchCRUD,False,2016-10-23T12:22:13.74+00:00,True,False,,"Elasticsearch,HttpClient",24591,False,1.0.14
GeertvanHorrik,2014-11-06T22:41:03.303Z,507,1261,Catel.Extensions.Prism library which contains helper classes for prism.,Catel.Extensions.Prism,True,2016-11-29T13:36:21.16+00:00,True,False,,"prism,catel,mvvm",129719,True,4.0.0-unstable0535
objo,2014-11-07T09:22:10.65Z,43209,1260,Provides custom controls for WPF and a scene graph based on SharpDX.,HelixToolkit.Wpf.SharpDX,False,1900-01-01T00:00:00+00:00,False,False,,"wpf,SharpDX,3D",37985,False,2014.2.426
Magnus Månsson,2014-11-07T12:45:04.327Z,533,1260,Contains the API for Styx,Findwise.Styx.Api,True,2016-11-03T02:15:22.047-07:00,True,False,,"Styx,Api,DTO",19297,False,1.6.89-unstable
NServiceBus Ltd,2014-11-07T10:56:11.637Z,14,1260,The most popular open-source service bus for .net,NServiceBus,False,2018-04-06T19:48:02.973+00:00,True,False,,"nservicebus,servicebus,msmq,cqrs,publish,subscribe",1169248,False,5.1.2
"XAct Software Solutions,Inc.",2014-11-07T12:55:21.817Z,435,1260,"An XActLib assembly: a library to ease testing of XActLib, as well as applications built with it.",XAct.Tests,False,2017-02-08T17:58:03.37-08:00,True,False,,"XAct,XActLib",37930,False,0.0.4819
GeertvanHorrik,2014-11-06T22:35:57.353Z,4,1261,"Catel.Core library which provides the core building blocks required when developing professional applications. This
	  package contains IoC components, logging, argument checking, message mediators and much more!",Catel.Core,True,2018-04-16T10:11:44.76+00:00,True,False,,"mvvm,model,modelbase,logging,data,object,wpf,silverlight,sl,windows,phone,wp,wp8,winrt,c#,ioc,servicelocator,typefactory,messaging,messenger,message,mediator",244767,True,4.0.0-unstable0535
Winnovative Software Solutions,2014-11-07T07:04:11.697Z,43209,1260,"Winnovative HTML to PDF Converter for .NET is a library that can be used in any type of .NET application, including ASP.NET web sites and Windows Forms applications, to convert URLs, HTML strings and streams to PDF, to SVG or to images. The library is compatible with .NET 2.0, .NET 4.0 and later.

The converter offers full support for HTML tags, CSS3, JavaScript, SVG, Canvas, page breaks control, media type rules, repeating HTML table header and footer, live links in PDF, bookmarks, HTML in PDF document header and footer.",wnvhtmlconvert,False,1900-01-01T00:00:00+00:00,False,False,Convert HTML to PDF in your .NET applications with Winnovative HTML to PDF Converter.,"HTML,to,PDF,Converter,for,.NET",116593,False,11.12.0
Matthew Schrager,2014-11-07T13:56:06.277Z,1024,1260,An implementation of the generic repository pattern for filesystems.,Repository.FileSystem,False,2015-07-01T05:14:57.88-07:00,True,False,,"Repository,FileSystem",9180,False,1.0.2.8
Kentor,2014-11-07T11:40:43.317Z,93,1260,"A SAML2 Service Provider for ASP.NET. Built to mimic the WSFederationAuthenticationModule in .NET 4.5, but using SAML2 instead. The module works with the claims model of .NET 4.5 and uses the present infrastructure for claims translation, session authentication cookies etc.",Kentor.AuthServices,False,2018-01-17T15:03:39.173+00:00,True,False,,"SAML2,authentication,ASP.NET,SAML,SSO",153209,False,0.10.0
"XAct Software Solutions,Inc.",2014-11-07T12:03:19.61Z,435,1260,An XActib Assembly: entities used by XAct.Graphs,XAct.Graphs.Entities,False,2017-02-08T17:57:17.18-08:00,True,False,,"XAct,XActLib",56501,False,0.0.4819
Outercurve Foundation,2014-11-07T01:46:30.457Z,1142,1260,"Create, edit, or read the package metadata catalog.",NuGet.Services.Metadata.Catalog,True,2015-03-05T13:54:31.373-08:00,True,False,,,35540,True,3.0.164-r-master
Novar,2014-11-07T17:13:33.18Z,1250,1260,Async and linked commands for MVVM pattern,RepeatableTask,False,2014-11-16T19:11:18.217-08:00,True,False,Library containing commands for MVVM pattern. Optionally asynchronous or linked in groups.,,1617,False,0.2.0
Dusan Janosik,2014-11-07T12:48:47.017Z,43209,1260,"Moon.Web.Validation provides extensions for ASP.NET MVC validation framework. It supports convention-based localizeable messages, error images (with messages as tooltips) and more validators.",Moon.Web.Validation,False,1899-12-31T16:00:00-08:00,False,False,ASP.NET MVC validation extensions.,"mooncode,asp.net,mvc,validation",-1,False,3.0.8
Mogens Heller Grabe,2014-11-07T05:58:12.57Z,309,1260,Azure Service Bus event dispatcher d60 event sourcing + cqrs kit,d60.Cirqus.AzureServiceBus,False,2017-06-14T22:32:00.207-07:00,True,False,,,28969,False,0.44.0
DigitalWare,2014-11-07T18:02:07.647Z,1260,1260,"ImVader is a framework for working with graphs. It provides implementation of common graph algorithms: BFS, DFS, Dijkstra and Floyd-Worshell algorithms, topological sort, computing strong components, finding minimum cuts and others.",ImvaderPackage,False,2014-11-07T10:02:07.647-08:00,True,False,Provides implementation of basic algoritms on graph objects.,"graphs,framework,algorithms,BFS,DFS,Floyd-Warshall,topological,sort,strong,components,minimum,cuts,node,vertex,graph,transport,network,spanning,tree,dijkstra,breadth,first,search,depth,imvader",1559,False,1.0.2
Dusan Janosik,2014-11-07T12:59:02.607Z,43209,1260,ASP.NET routing and UrlHelper for jQuery.,Moon.JsRouting,False,1899-12-31T16:00:00-08:00,False,False,,"mooncode,asp.net,routing,jquery",-1,False,1.5.3
Dusan Janosik,2014-11-07T12:49:38.567Z,245,1260,Moon.Windows.Validation provides extensions for DataAnnotations and WPF validation framework.,Moon.Windows.Validation,False,2017-08-18T17:12:21.74+00:00,True,False,WPF validation extensions.,"mooncode,wpf,validation",4977,False,3.0.8
Marco.Mastropaolo,2014-11-07T18:24:48.317Z,553,1260,"A Lua interpreter written entirely in C# for the .NET, Mono, Xamarin and Unity3D platforms.",MoonSharp,False,2016-10-14T10:12:53.59-07:00,True,False,,"Lua,Script,Scripting",38041,False,0.7.0.1
Hibernating Rhinos,2014-11-07T08:07:13.227Z,43209,1260,RavenDB 'Unique Constraints' bundle client. Allow the user to implement unique constraints in the objects (useful for properties like email or social security number).,RavenDB.Client.UniqueConstraints,False,1900-01-01T00:00:00+00:00,False,False,,"nosql,ravendb,raven,document,database,client,bundles",242613,True,2.5.2938
"XAct Software Solutions,Inc.",2014-11-07T12:40:58.823Z,435,1260,An XActLib Assembly: EntityFramework based persistence of security properties.,XAct.Security.Persistence.EF,False,2017-02-09T01:57:51.743+00:00,True,False,,"XAct,XActLib",40647,False,0.0.4819
"XAct Software Solutions,Inc.",2014-11-07T13:05:44.553Z,435,1260,An XActLib assembly: an assembly of mock implementations of the services defined in XAct.Workflows. For testing purposes only.,XAct.Workflows.Server.Mocks,False,2017-02-08T17:58:20.853-08:00,True,False,,"XAct,XActLib",58146,False,0.0.4819
GeertvanHorrik,2014-11-07T01:13:10.99Z,507,1260,"Catel.Extensions.EntityFramework6 library which provides data classes such as repositories, unit of work, DbContextManager and more.",Catel.Extensions.EntityFramework6,True,2016-11-29T13:36:08.753+00:00,True,False,,"catel,entity,framework,entityframework,EF,EF6,UnitOfWork,unit,of,work,DbContextManager,repository,repositories,database",74652,True,4.0.0-unstable0537
"John Sheehan,RestSharp Community",2014-11-07T06:52:39.05Z,968,1260,Simple REST and HTTP API Client,RestSharpSigned,False,2015-08-26T16:49:13.13-07:00,True,False,,"REST,HTTP,API,JSON,XML",324237,False,105.0.0
"XAct Software Solutions,Inc.",2014-11-07T12:42:34.823Z,435,1260,"An XActLib assembly: an assembly that builds on the interfaces defined in XAct.Security, in order to offer a Service implementation that wrap the basic *web* based Forms Authentication mechanism.",XAct.Security.Web,False,2017-02-08T17:57:52.29-08:00,True,False,,"XAct,XActLib",88675,False,0.0.4819
GeertvanHorrik,2014-11-07T01:12:39.727Z,507,1260,"Catel.Extensions.EntityFramework5 library which provides data classes such as repositories, unit of work, DbContextManager and more.",Catel.Extensions.EntityFramework5,True,2016-11-29T13:36:06.393+00:00,True,False,,"catel,entity,framework,entityframework,EF,EF5,UnitOfWork,unit,of,work,DbContextManager,repository,repositories,database",97012,True,4.0.0-unstable0537
plexityHide,2014-11-07T02:03:24.183Z,509,1260,"GTP.NET.WinForms is a package of components to build interactive Gantt and Schedule charts on .net4,.net4.5 WindowsForms",GTP.NET.WinForms,False,2016-11-27T21:01:50.9+00:00,True,False,,"Gantt,Schedule,plexityHide,GTP.NET,GTP.NET.WinForms",24906,False,5.11.7.7528
Novar,2014-11-07T15:00:33.503Z,1260,1260,Byte-level 'forward read' only buffered data source infrastructure,BufferedSource,False,2014-11-07T07:26:46.783-08:00,True,False,Byte-level 'forward read' only buffered data source infrastructure. Intended to be used instead of System.IO.Stream as source of binary data.,,1979,False,0.2.1
GeertvanHorrik,2014-11-07T01:12:10.697Z,507,1260,"Catel.Extensions.DynamicObjects library which provides dynamic objects. This adds the IDynamicMetaObjectProvider and ICustomTypeProvider
	  to the ModelBase class.",Catel.Extensions.DynamicObjects,True,2016-11-29T05:36:02.283-08:00,True,False,,"catel,data,model,modelbase,dynamic,object,IDynamicMetaObjectProvider,ICustomTypeProvider",76524,True,4.0.0-unstable0537
Robin Hultman,2014-11-07T13:55:22.397Z,1147,1260,Pipeline component to copy one context property to another,BizTalkComponents.PipelineComponents.CopyContextProperty,False,2015-02-27T23:23:13.557-08:00,True,False,,BizTalk,2192,False,1.0.0
Hibernating Rhinos,2014-11-07T08:00:40.137Z,57,1260,"This package let you include RavenDB embedded in your asp.net application. RavenDB is a document database for the .NET/Windows platform, offering a flexible data model design to fit the needs of real world systems.",RavenDB.AspNetHost,False,2018-02-22T21:28:46.793+00:00,True,False,This package let you include RavenDB embedded in your Asp.Net web application.,"nosql,ravendb,raven,document,database,embedded",124680,True,2.5.2938
Eben Roux,2014-11-07T16:41:40.573Z,43209,1260,Contains MSBuild tasks used in building Shuttle solutions.,shuttle-core-msbuild,False,1899-12-31T16:00:00-08:00,False,False,,"msbuild,shuttle",-1,False,1.1.1
Grid Protection Alliance,2014-11-06T21:54:17.723Z,43209,1261,"Library of ASP.NET web forms extensions, embedded resource hosting and HTTP Module for implementing role-based security.",GSF.Libraries.Web,True,1899-12-31T16:00:00-08:00,False,False,,,6652,False,2.0.0-beta228
gregsdennis,2014-11-06T23:45:16.037Z,14,1261,"A JSON serializer implementation for Manatee.Trello, backed by Manatee..Json.",Manatee.Trello.ManateeJson,False,2018-04-06T03:22:12.41+00:00,True,False,,"trello,json,manatee",22697,False,1.3.0.2
Cloud Access Ltd,2014-11-07T08:29:30.333Z,1222,1260,Cloud Access repository pattern,CloudAccess.Repository,False,2014-12-15T09:36:35.437-08:00,True,False,,"cloud,access,repo,repository",11142,False,1.0.8
eXpandFramework,2014-11-06T19:30:40.5Z,11,1261,Security Module (Win) / eXpandFramework. To debug in VS enable Source Server support under Tools/Options/Debugging.,eXpandSecurityWin,False,2018-04-09T16:21:49.393+00:00,True,False,Security Module (Win) / eXpandFramework,"DevExpress,eXpand,XAF,eXpressApp",39788,False,14.1.8.1
"XAct Software Solutions,Inc.",2014-11-07T12:56:10.817Z,435,1260,An XActLib assembly: a Library for working with Transactions in the Application Layer,XAct.Transactions,False,2017-02-08T17:58:05.087-08:00,True,False,,"XAct,XActLib",59360,False,0.0.4819
"Andrew Browne,Picnic Software",2014-11-07T11:19:14.173Z,925,1260,An EventSourcing library,Eventful,True,2015-10-07T21:56:58.313-07:00,True,False,,,56280,False,0.2.259-beta
Mogens Heller Grabe,2014-11-07T05:57:51.08Z,309,1260,Event sourcing + cqrs kit,d60.Cirqus,False,2017-06-14T22:31:49.347-07:00,True,False,,,31448,False,0.44.0
"XAct Software Solutions,Inc.",2014-11-07T12:00:46.893Z,435,1260,An XActLib Assembly: Library of code to access ActiveDirectory resources.,XAct.DirectoryServices.ActiveDirectory,False,2017-02-08T17:57:13.227-08:00,True,False,,"XAct,XActLib",62769,False,0.0.4819
"XAct Software Solutions,Inc.",2014-11-07T11:51:22.93Z,900,1260,An XActLib Assembly: Service to perform Compilation over the wire,XAct.Compilation.Service,False,2015-11-02T03:16:33.94-08:00,True,False,,"XAct,XActLib",57459,False,0.0.4819
"XAct Software Solutions,Inc.",2014-11-07T11:59:14.227Z,435,1260,An XActLib assembly: an Assembly that provides a Log4NetTraceListener (rerouting XAct.Diagnostics.Trace calls to Log4Net -- nice!) as well as Log4Net specific implementation of the core Tracing service.,XAct.Diagnostics.Log4Net,False,2017-02-08T17:57:07.633-08:00,True,False,,"XAct,XActLib",92546,False,0.0.4819
Grid Protection Alliance,2014-11-06T21:53:47.067Z,43209,1261,Framework for Enabling Time-series Data Processing Services,GSF.Libraries.TimeSeries,True,1899-12-31T16:00:00-08:00,False,False,,,6647,False,2.0.0-beta228
Yves Reynhout,2014-11-07T09:33:24.74Z,1257,1260,CloudServiceTaskHost provides lightweight infrastructure for hosting jobs in an Azure Worker Role.,CloudServiceTaskHost,False,2014-11-10T03:10:35.653-08:00,True,False,,"messaging,Azure",2139,False,0.0.9
Matthew Schrager,2014-11-07T13:42:34.68Z,787,1260,A generic implementation for the repository pattern in C#.,Repository,False,2016-02-23T13:37:48.5-08:00,True,False,,Repository,29610,False,1.0.7.5
Robin Hultman,2014-11-07T13:04:32.373Z,920,1260,Promotes a specified value to a specified property.,BizTalkComponents.PipelineComponents.SetProperty,False,2015-10-13T02:42:20.6-07:00,True,False,,BizTalk,2723,False,1.0.0
Paket team,2014-11-07T09:07:49.797Z,2,1260,A package dependency manager for .NET with support for NuGet packages and GitHub repositories.,Paket,True,2018-04-18T10:23:50.3+00:00,True,False,A package dependency manager for .NET with support for NuGet packages and GitHub repositories.,"nuget,bundler,F#",834968,False,0.12.0-alpha001
halcharger,2014-11-07T12:56:13.817Z,172,1260,Adding .NET framework extension methods to basic types,NExtensions,False,2017-10-30T16:24:39.813+00:00,True,False,Adding basic everyday extensions methods to .NET framework base types that should be there but aren't.,,11251,False,1.0.29
Paket team,2014-11-07T16:37:21.4Z,2,1260,A package dependency manager for .NET with support for NuGet packages and GitHub repositories.,Paket,False,2018-04-18T10:23:50.3+00:00,True,False,A package dependency manager for .NET with support for NuGet packages and GitHub repositories.,"nuget,bundler,F#",834968,False,0.12.2
Nathan Carroll,2014-11-07T14:30:18.837Z,1187,1260,Binding and Ajax javascript files.,Bastard.js,False,2015-01-19T14:06:18.697-08:00,True,False,Bastard is a binding and ajax javascript library.  The name evolved from an in house ado.net framework called Sword.,,101670,False,14.11.7.8
Robin Hultman,2014-11-07T07:33:55.27Z,43209,1260,PipelineComponent that validates incomming XML against a schema and returns HTTP 400 if it is not valid.,BizTalkComponents.HttpXmlValidator,False,1899-12-31T16:00:00-08:00,False,False,,BizTalk,-1,False,1.0.0.5
