authors,created,description,id,is_prerelease,last_updated,listed,missing_info,summary,tags,total_downloads,verified,versionDemis Bellot,2012-07-03T05:22:16.307Z,"Extremely fast and simple pure node.js/javascript solution to statically complie, minify and combine your websites .css, .less, .coffee and .js files into user-defined bundles. Supports configurable bundle settings providing ideal unminified output for development and combined minified .min.js and .min.css files optimal for deployment. Integrates with MVC. No .dlls, includes all soure code for all customizable build scripts. Self-contained, no dependencies required at run-time.",Bundler,False,2014-07-09T20:08:55.63-07:00,True,False,"CoffeeScript, JavaScript, Less, Sass, Css compiler, minifier and combiner for ASP.NET MVC websites.","LESS,CoffeeScript,JavaScript,CSS,SASS,Node,JS,Minify,Minifier,Compiler,Combine,Concatenate",63362,False,1.1.0
Steven Bey,2012-07-03T23:45:41.617Z,XML ErrorLog Provider for ELFAR.,elfar.xml,False,2012-07-03T16:45:41.617-07:00,True,False,,"elfar,mvc,xml,error,logging,unhandled,exceptions",5420,False,1.2.4567.26294
RobVesse,2012-07-04T21:07:11.727Z,"dotNetRDF is a RDF, SPARQL and Semantic Web API for .Net.  It provides simple but powerfully extensible APIs for this and integrates with a variety of popular triple stores.",dotNetRDF,False,2018-01-21T12:41:15.91+00:00,True,False,,"RDF,Semantic,Web,SPARQL",103522,False,0.7.0
Adam Carter,2012-07-04T16:41:52.923Z,"FileCache is a concrete implementation of the .Net Framework 4's System.Runtime.Caching.ObjectCache that uses the local filesystem as the target location.

This DLL has been signed in order to work with other signed projects.",FileCache.Signed,False,2017-12-29T05:12:16.98+00:00,True,False,,"cache,objectcache,System.Runtime.Caching.ObjectCache",4226,False,1.1.2
Hibernating Rhinos,2012-07-02T23:24:48.347Z,"Use this package if you want to run RavenDB as a standalone application. This package is not intented to be used in Visual Studio. RavenDB is a document database for the .NET platform, offering a flexible data model design to fit the needs of real world systems.",RavenDB.Server,True,1900-01-01T00:00:00+00:00,False,False,This package contains the Raven.Server.exe database binaries.,"nosql,ravendb,raven,document,database",267691,True,1.2.2028-Unstable
Harry McIntyre,2012-07-04T15:29:46.36Z,Noodles transforms your object modelinto a web app. This is the core library without a dependency on ASP MVC,Noodles,False,2013-11-23T10:56:35.543-08:00,True,False,,,86087,False,1.1.272
Robert O'Brien,2012-07-03T18:43:20.867Z,A totally unsupported way to quickly add Federated Identity Scaffolding to a Phone Project. Works on my machine.,FedId.Phone.Project.Scaffolding,False,2014-07-16T15:55:48.18+00:00,True,False,,"Federated,Identity,Phone,Project,Scaffolding",9833,False,1.5.1.6
UTFPR,2012-07-03T19:35:09.117Z,EntityFramework extensions of UtfprLibrary.,UtfprLibrary.EntityFramework,True,2013-01-25T08:18:59.937-08:00,True,False,,UTFPR,39429,False,1.0.189-alpha
"XAct Software Solutions,Inc.",2012-07-05T09:02:33.937Z,An XActLib assembly: a Library for working with an IoC in an Mvc App,XAct.Services.IoC.AspMvc,False,2017-02-09T01:57:57.337+00:00,True,False,,"XAct,XActLib",72638,False,0.0.528
Steven Bey,2012-07-03T23:05:42.143Z,XML ErrorLog Provider for ELFAR.,elfar.data.xml,False,2012-07-03T16:05:42.143-07:00,True,False,,"elfar,xml,error,logging,unhandled,exceptions",916,False,1.2.4567.26293
"XAct Software Solutions,Inc.",2012-07-05T08:56:31.07Z,"An XActLib Assembly: library for working with Zip Packages (Compression + Structure). A poor man's Zip Solution, that requires no external assemblies beyond .NET. See DotNetZip for better functionality.",XAct.IO.Compression.ZipPackage,False,2017-02-08T17:57:22.977-08:00,True,False,,"XAct,XActLib",89506,False,0.0.528
Hibernating Rhinos,2012-07-02T23:23:42.41Z,RavenDB 'Unique Constraints' bundle client. Allow the user to implement unique constraints in the objects (useful for properties like email or social security number).,RavenDB.Client.UniqueConstraints,True,1900-01-01T00:00:00+00:00,False,False,,"nosql,ravendb,raven,document,database,client,bundles",237530,True,1.2.2028-Unstable
Chris.Jansen,2012-07-04T09:26:54.74Z,"Based on the inactive WCFExtras project, WCFExtrasPlus is a collection of useful WCF extensions including SOAP Header support, WSDL flattening and documentation, and more.",WCFExtrasPlus2.2,False,1899-12-31T16:00:00-08:00,False,False,,,-1,False,2.2.0
"XAct Software Solutions,Inc.",2012-07-05T09:00:09.36Z,"An XActLib assembly: a library to manage security. Defines contracts used by other assemblies (such as XAct.Security.FormsAuthentication, etc.)",XAct.Security,False,2017-02-09T01:57:50.917+00:00,True,False,,"XAct,XActLib",91129,False,0.0.528
Erik Schierboom,2012-07-04T15:51:11.267Z,Collection of classes to help with creating a .NET application.,StudioDonder.Framework,False,2013-09-23T02:50:30.53-07:00,True,False,,"SD,Framework,Domain",4566,False,1.0.0
Jonathan Oliver,2012-07-04T17:50:45.84Z,Additional logging provider for NanoMessageBus using Log4Net v1.2.11 (aka v2.0).,NanoMessageBus.Log4Net2,False,1899-12-31T16:00:00-08:00,False,False,Log4Net logging plugin for NanoMessageBus.,"messaging,service,bus,servicebus,nano,message,nanomessagebus,nmb,messages,logging,log4net",-1,False,2.0.20
"XAct Software Solutions,Inc.",2012-07-05T09:08:26.46Z,An XActLib assembly: a Library of code for working with Asp.NET Mvc v3 Framework,XAct.UI.Web.Mvc,False,2017-02-09T01:58:07.993+00:00,True,False,,"XAct,XActLib",68731,False,0.0.528
LucaPrieto,2012-07-03T21:40:34.767Z,Framework de REST do LEMAF,LemafWebServiceReST,False,2012-07-03T14:40:34.767-07:00,True,False,,lemaf,745,False,1.0.0
saveenr,2012-07-04T15:36:25.737Z,"Convert colors between RGB, HSV, HSL, XYZ, and LAB.",Colorspace,False,2012-07-04T10:38:28.367-07:00,True,False,,"Color,RGB,XYZ,HSV,HSL,LAB",3680,False,1.0.1
Hibernating Rhinos,2012-07-02T23:24:08.38Z,"Use this package if you want extend RavenDB. Don't use this package if you just want to work with existing RavenDB server, in order to so just use the client API which is in the RavenDB.Client package. RavenDB is a document database for the .NET platform, offering a flexible data model design to fit the needs of real world systems.",RavenDB.Database,True,1900-01-01T00:00:00+00:00,False,False,This package allows you to extend RavenDB database.,"nosql,ravendb,raven,document,database",656854,True,1.2.2028-Unstable
"Brian Jenkins,Emiliano Soto,Gustavo Rascioni,Nicolas Rausch,Eduardo Campañó",2012-07-03T17:58:22.333Z,SlamCMS ASP.NET MVC integration,SlamCms.Mvc,False,1899-12-31T16:00:00-08:00,False,False,SlamCMS is an open source content management system built to harness the power of SharePoint for managing content while giving you complete control over what to do with it.,"SlamCMS,CMS",8393,False,1.0.2
"XAct Software Solutions,Inc.",2012-07-05T09:05:54.807Z,An XActLib assembly: a library to manage user Profile settings in a modular and serializable way.,XAct.Settings.Profile,False,1899-12-31T16:00:00-08:00,False,False,,"XAct,XActLib",-1,False,0.0.528
Dusan Janosik,2012-07-04T14:43:46.067Z,ASP.NET MVC validation extensions for jQuery Validate.,Moon.Validation.jQuery,True,1899-12-31T16:00:00-08:00,False,False,"Moon.Validation.jQuery is meant to replace the original jQuery.Unobtrusive.Validation package. It supports 
      more validators and uses jQuery Globalize to make validations culture-specific.","mooncode,asp.net,mvc,jquery,unobtrusive,validation",-1,False,0.1.11-beta
Jakub Fijałkowski,2012-07-02T21:24:57.137Z,"FLib.WPF is extension to FLib with WPF-specific features such as validators, converters,
      extensions to standard controls(eg. filtering input) and a couple of pure XAML extensions.",FLib.WPF,False,1899-12-31T16:00:00-08:00,False,False,FLib.WPF is extension to FLib with WPF-specific features.,"library,utilities,wpf",-1,False,0.3.6
Steven Bey,2012-07-03T23:16:57.01Z,SQL Server ErrorLog Provider for ELFAR.,elfar.data.sqlclient,False,2012-07-03T16:16:57.01-07:00,True,False,,"elfar,sqlclient,error,logging,unhandled,exceptions",1278,False,1.2.4567.41427
Steven Bey,2012-07-03T14:38:56.877Z,In-Memory ErrorLog Provider for ELFAR.,elfar.in-memory,False,2012-07-03T16:51:08.787-07:00,True,False,,"elfar,mvc,in-memory,error,logging,unhandled,exceptions",3536,False,1.2.4567.26287
Steven Bey,2012-07-03T23:07:51.423Z,SQL Server ErrorLog Provider for ELFAR (WebApi).,elfar.webapi.sqlclient,False,2012-07-03T16:07:51.423-07:00,True,False,,"elfar,webapi,sqlclient,error,logging,unhandled,exceptions",2895,False,1.2.4567.41427
Anthony Johnston,2012-07-02T19:14:47.49Z,"Testing helpers, incl. Generic Builder to delegate instance creation for testing data using Mocks, Pocos or whatever",antix-testing,True,2013-05-14T15:55:19.717-07:00,True,False,,"Testing,Builder",10653,False,1.1.0-b01
Aspose,2012-07-03T03:29:41.95Z,"Aspose.Words for .NET class library supports DOC, DOCX, RTF, HTML, OpenDocument, PDF, XPS, EPUB and other formats. With Aspose.Words you can generate, modify, convert, render and print documents without utilizing Microsoft Word®",Aspose.Words,False,2018-04-02T10:43:30.07+00:00,True,False,,"Aspose.Words,DOC,DOCX,RTF,HTML,OpenDocument,XPS,EPUB,Word,Document,Processing",507975,False,11.5.0
Hibernating Rhinos,2012-07-04T05:16:19.377Z,More Like This returns a list of similar documents that are related to a given document.,RavenDB.Bundles.MoreLikeThis,True,1899-12-31T16:00:00-08:00,False,False,,"nosql,ravendb,raven,document,database,bundles",-1,False,1.2.2029-Unstable
"XAct Software Solutions,Inc.",2012-07-05T08:59:47.313Z,An XActLib assembly: a Library of code for working with ActiveX and COM,XAct.Runtime.InteropServices,False,2017-02-09T01:57:45.993+00:00,True,False,,"XAct,XActLib",90735,False,0.0.528
Rob Reynolds,2012-07-02T21:51:28.21Z,"Chocolatey - think executables/application packages (like apt-get for Windows), not library packages. This is what the Chocolatey NuGet goodness is for.
Chocolatey allows you to install application nuggets and run executables from anywhere.  
======= Executable Nuggets =======
For example, say you have an executable in the tools folder of your package named bob.exe. Then you can type
'chocolatey install yourPackageName [-source source] [-version version]' OR 'cinst yourPackageName [-source source] [-version version]'
and when it finishes you can type
'bob'
and it will run your application executable.  
======= Application Nuggets =======
Full on double rainbow. For example, say you type 
'chocolatey install 7zip [-source source] [-version version]' OR 'cinst 7zip [-source source] [-version version]' 
- when it finishes you will have installed 7zip on your machine (in your add/remove programs).  
======= More? =======
Check out the WIKI in the project URL for all the details of what you can do with chocolatey!",chocolatey,False,2018-04-12T20:04:46.847+00:00,True,False,"Chocolatey is your machine level NuGet repository. Think apt-get for Windows (executables/application packages), not library packages.","nuget,apt-get,machine,repository,chocolatey",108570,False,0.9.8.19
Bastian Eicher,2012-07-05T10:25:54.247Z,The OmegaGUI provides a skinable GUI toolkit for the OmegaEngine with an XML file format und Lua scripting.,OmegaGUI,False,2016-10-26T00:15:58.163-07:00,True,False,Skinable GUI toolkit for the OmegaEngine,,2510,False,0.8.0
"XAct Software Solutions,Inc.",2012-07-05T09:10:38.583Z,An XActLib assembly: an assembly of mock implementations of the services defined in XAct.Workflows. For testing purposes only.,XAct.Workflows.Mocks,False,1899-12-31T16:00:00-08:00,False,False,,"XAct,XActLib",-1,False,0.0.528
Steven Bey,2012-07-03T14:41:24.357Z,XML ErrorLog Provider for ELFAR.,elfar.xml,False,2012-07-03T16:45:41.617-07:00,True,False,,"elfar,mvc,xml,error,logging,unhandled,exceptions",5420,False,1.2.4567.26293
"XAct Software Solutions,Inc.",2012-07-05T06:50:06.95Z,An XActLib Assembly:library to manage registration and retrieval of Services from an IoC.,XAct.Services.IoC,False,1899-12-31T16:00:00-08:00,False,False,,"XAct,XActLib",-1,False,0.0.527
VéritéCo (a project of the Knight News Innovation Lab),2012-07-03T12:03:04.6Z,"Beautifully crafted timelines that are easy, and intuitive to use.",TimelineJS,False,2014-10-04T11:41:29.187-07:00,True,False,"TimelineJS can pull in media from different sources. It has built in support for: Twitter, Flickr, Google Maps, YouTube, Vimeo, Dailymotion, Wikipedia, SoundCloud and more media types in the future.","jquery,plugin,timeline",7563,False,1.0.3
"XAct Software Solutions,Inc.",2012-07-05T06:43:03.2Z,"An XActLib assembly: an Assembly that builds on the interfaces defined in XAct.Data, providing implementations of Repositories for EF 40 and EF4.2, suitable for working with POCOs, etc. as well as CodeFirst.",XAct.Data.Db.EF,False,1899-12-31T16:00:00-08:00,False,False,,"XAct,XActLib",-1,False,0.0.527
Adam Carter,2012-07-04T16:41:18.76Z,FileCache is a concrete implementation of the .Net Framework 4's System.Runtime.Caching.ObjectCache that uses the local filesystem as the target location.,FileCache,False,2017-12-29T05:10:49.867+00:00,True,False,,"cache,objectcache,System.Runtime.Caching.ObjectCache",12503,False,1.1.2
BI Team,2012-07-03T19:26:10.157Z,Business Intelligence Common Framework,Rock.QL.BI.Framework.Core,False,1899-12-31T16:00:00-08:00,False,False,,"BIG,BI",-1,False,1.0.29
Steven Bey,2012-07-03T14:41:04.047Z,XML ErrorLog Provider for ELFAR (WebApi).,elfar.webapi.xml,False,2012-07-03T16:40:40.047-07:00,True,False,,"elfar,webapi,xml,error,logging,unhandled,exceptions",2882,False,1.2.4567.26293
Jonathan Oliver,2012-07-04T17:50:29.027Z,Additional wireup provider for NanoMessageBus using Autofac.,NanoMessageBus.Autofac,False,2016-05-31T09:43:45.44-07:00,True,False,Autofac wireup NanoMessageBus.,"messaging,service,bus,servicebus,nano,message,nanomessagebus,nmb,messages,ioc,inversion,of,control,dependecy,injection,Autofac",11837,False,2.0.20
Naked Objects Group Ltd,2012-07-03T15:08:15.84Z,Typically this package is only installed as a dependency of another package.,RestfulObjects.Mvc,False,1899-12-31T16:00:00-08:00,False,False,Provides a base controller and helper classes for an MVC4-based implementation of Restful Objects,,-1,False,0.24.1
DigiData Corp.,2012-07-04T08:13:47.877Z,"This package contains a .NET client library for the DigiData REST Service.  It is made up of a .NET assembly (and its dependent assemblies) that respects the RESTful approach of the DigiData REST Service rather than, say, mapping the REST service RPC function calls.  We have attempted to create it with all of the flexibility of the DDRS so that it should not need to be updated merely to accommodate new functionality in the REST service.",DigiData.Services.Rest.Client,False,2014-05-07T07:55:33.707-07:00,True,False,,rest,23659,False,1.0.745
Attila Losonc,2012-07-02T18:52:13.053Z,Speed up your work by using these HTML helpers to integrate jQuery UI into your ASP.NET MVC 3 application. Requires the .NET Framework 4 and ASP.NET MVC3.,jQueryUIHelpers.Mvc3,False,2015-10-11T02:43:15.733-07:00,True,False,The easy way to integrate jQuery UI into your ASP.NET MVC 3 application.,"jQueryUI,jQuery,MVC3",9818,False,0.5.1
hazzik,2012-07-05T09:28:57.753Z,"Grapes it is an utility library which takes care of mapping tree-like data structures into database.

      Probably you want to install Brandy.Grapes.NHibernate or Brandy.Grapes.FluentNHibernate",Brandy.Grapes,False,2015-04-19T17:00:25.483-07:00,True,False,,,2258,False,1.0.4
UTFPR,2012-07-03T18:22:37.177Z,WindowsForms.Core,UtfprLibrary.WindowsForms.Core,True,2013-01-25T08:19:07.14-08:00,True,False,,"UTFPR,WindowsForms,EntityFramework",32303,False,1.0.187-alpha
Nikos Baxevanis,2012-07-03T04:12:52.997Z,"This extension turns AutoFixture into an Auto-Mocking Container. The mock instances are created by FakeItEasy. To use it, add the AutoFakeItEasyCustomization to your Fixture instance. Read more at http://autofixture.codeplex.com/",AutoFixture.AutoFakeItEasy,False,2018-03-21T15:54:43.143+00:00,True,False,Turns AutoFixture into an Auto-Mocking Container based on FakeItEasy.,,130972,True,2.11.3
Frank Schwieterman,2012-07-04T08:12:08.767Z,"NJasmine is an NUnit extension for writing given/when/then style specifications or tests.  Like RSpec, NJasmine as a DSL uses nested anonymous methods to build up a specification.  Reference nuget NJasmine to write your specs, and reference nuget NJasmine.NUnit to run your tests.",NJasmine.NUnit,False,2012-10-28T18:10:15.05-07:00,True,False,NJasmine allows writing RSpec-like specifications.,"BDD,TDD,NUnit",2942,False,0.2.4
Steven Bey,2012-07-03T14:40:11.373Z,In-Memory ErrorLog Provider for ELFAR (WebApi).,elfar.webapi.in-memory,False,2012-07-03T16:39:29.713-07:00,True,False,,"elfar,webapi,in-memory,error,logging,unhandled,exceptions",2595,False,1.2.4567.26287
Bastian Eicher,2012-07-05T10:25:18.027Z,"The OmegaEngine is a general-purpose 3D graphics engine written in C# using the .NET Framework 2.0 and DirectX 9 via SlimDX.
The engine is designed to be light-weight, modular and gameplay-agnostic.",OmegaEngine,False,2016-10-26T00:15:40.54-07:00,True,False,DirectX 9-based general-purpose 3D graphics engine,,2626,False,0.8.0
Hibernating Rhinos,2012-07-04T05:16:58.297Z,RavenDB client debugger visualizer,RavenDB.Client.Debug,True,1899-12-31T16:00:00-08:00,False,False,This package includes a debugger RavenDB.,"nosql,ravendb,raven,document,database,client,debug",-1,False,1.2.2029-Unstable
"XAct Software Solutions,Inc",2012-07-05T09:03:26.357Z,An XActLib assembly: a Library of code to encapsulate what is required to host an ASP.NET website using Unity as the IoC,XAct.Services.IoC.AspNet.Unity,False,1899-12-31T16:00:00-08:00,False,False,,"XAct,XActLib",-1,False,0.0.528
Jonathan Oliver,2012-07-04T01:34:39.513Z,Additional logging provider for NanoMessageBus using NLog.,NanoMessageBus.NLog,False,2016-05-31T09:44:18.143-07:00,True,False,NLog logging plugin for NanoMessageBus.,"messaging,service,bus,servicebus,nano,message,nanomessagebus,nmb,messages,logging,nlog",11753,False,2.0.19
Jonathan Oliver,2012-07-04T01:19:09.57Z,Additional logging provider for NanoMessageBus using Log4Net v1.2.10.,NanoMessageBus.Log4Net,False,2016-05-31T09:44:07.653-07:00,True,False,Log4Net logging plugin for NanoMessageBus.,"messaging,service,bus,servicebus,nano,message,nanomessagebus,nmb,messages,logging,log4net",12060,False,2.0.18
"10gen,Inc.",2012-07-03T07:54:12.443Z,Official 10gen supported C# driver for MongoDB,mongocsharpdriver,False,2017-12-12T21:41:24.45+00:00,True,False,,"mongodb,mongo,nosql",1700840,False,1.5.0
Harry McIntyre,2012-07-03T16:46:37.397Z,Noodles transforms your object modelinto a web app. This is the core library without a dependency on ASP MVC,Noodles,False,2013-11-23T10:56:35.543-08:00,True,False,,,86087,False,1.1.267
"XAct Software Solutions,Inc.",2012-07-05T06:41:13.203Z,An XActLib Assembly: common code specific Collections,XAct.Collections,False,2017-02-08T17:56:52.837-08:00,True,False,,"XAct,XActLib",99101,False,0.0.527
Dusan Janosik,2012-07-04T15:16:21.423Z,"Moon.Validation provides extensions for DataAnnotations and ASP.NET MVC validation framework. It supports convention-based localizable error messages, error images (with messages as tooltips) and adds more validators.",Moon.Validation,True,2017-08-18T17:12:09.05+00:00,True,False,ASP.NET MVC validation extensions.,"mooncode,asp.net,mvc,validation",18255,False,0.1.13-beta
Dusan Janosik,2012-07-04T14:37:36.887Z,ASP.NET MVC validation extensions.,Moon.Validation,True,2017-08-18T17:12:09.05+00:00,True,False,,"mooncode,asp.net,mvc,validation",18255,False,0.1.10-beta
Tatham Oddie,2012-07-02T23:14:30.527Z,"Just like System.Web.Abstractions, but for System.IO. Yay for testable IO access! Be sure to check out the System.IO.Abstractions.TestingHelpers package too.",System.IO.Abstractions,False,2018-01-11T23:41:38.67+00:00,True,False,,testing,528822,False,1.4.0.25
UTFPR,2012-07-03T13:00:17.633Z,WindowsForms,UtfprLibrary.WindowsForms,True,2013-01-25T08:19:22.657-08:00,True,False,,"UTFPR,WindowsForms,EntityFramework",95986,False,1.0.186-alpha
ziyasal,2012-07-02T22:57:07.97Z,AOPify lightweight fluent AOP framework that provides basic AOP features with logging support when execute operations..,AOPify,False,2012-07-02T15:57:07.97-07:00,True,False,,"Fluent,AOP,Expression",2963,False,0.6.79.147
Rob White,2012-07-03T21:31:43.427Z,Exception Hasher,ExceptionHash,False,2012-07-03T14:31:43.427-07:00,True,False,,,753,False,1.0.0
Appfail,2012-07-04T12:58:25.997Z,Appfail monitors your web application for exceptions and reports them to http://appfail.net for rich failure analytics and notifications.,Appfail.Mvc,False,2012-07-04T05:58:27.7-07:00,True,False,,,52491,False,1.1.0
Graham Mendick,2012-07-03T16:33:44.557Z,"Navigation for ASP.NET Web Forms manages movement and data passing between ASPX pages in a unit-testable manner. There is no client-side logic, so it works in all browsers, and no server-side cache, so it works with the browser back button",Navigation,False,2015-01-03T06:08:45.117-08:00,True,False,,"navigation,asp.net,webforms,databinding,ajax,history,unittest,breadcrumb",7369,False,1.5.0
Microsoft,2012-07-03T17:02:53.123Z,"Noodles transforms your object model into a web app. Install this library to customise the cshtml template files, or if you don't want to use the EmbeddedResourceVirtualPathProvider to load your views",Noodles.Templates,False,1899-12-31T16:00:00-08:00,False,False,,,-1,False,1.1.269
saveenr,2012-07-04T15:34:33.12Z,"Convert colors between RGB, HSV, HSL, XYZ, and LAB.",Colorspace,False,2012-07-04T10:38:28.367-07:00,True,False,,"Color,RGB,XYZ,HSV,HSL,LAB",3680,False,1.0.0
Skewed Aspect Studios,2012-07-02T18:52:03.99Z,"NConf is an advanced configuration system for .Net projects. It's written out of the need for more advanced configuration than what .Net provides. The key features it supports is multiple configuration sources, simple to use syntax, the ability to reload/update configuration at runtime, and the easy ability to implement custom configuration sources.",NConf,False,2012-10-16T13:41:46.69-07:00,True,False,NConf is an advanced configuration system for .Net projects.,"Configuration,config,dynamic",2429,False,0.2.4566.23138
eBay,2012-07-04T22:04:54.883Z,eBay .NET SDK,eBay,False,2017-11-10T09:01:39.73+00:00,True,False,,,52855,False,3.771.0
UTFPR,2012-07-04T18:57:51.75Z,WindowsForms,UtfprLibrary.WindowsForms,True,2013-01-25T08:19:22.657-08:00,True,False,,"UTFPR,WindowsForms,EntityFramework",95986,False,1.0.190-alpha
Naked Objects Group Ltd,2012-07-05T08:52:56.447Z,Typically this package is only installed as a dependency of another package.,RestfulObjects.Mvc,False,1899-12-31T16:00:00-08:00,False,False,Provides a base controller and helper classes for an MVC4-based implementation of Restful Objects,,-1,False,0.24.3
SYSTEM,2012-07-04T15:43:46.15Z,Noodles transforms your object modelinto a web app. This is a library to integrate Noodles with AJAX jquery datatables,Noodles.DataTables,False,1899-12-31T16:00:00-08:00,False,False,,,-1,False,1.1.274
kimbirkelund,2012-07-05T10:15:13.143Z,An XML serialization framework.,Sekhmet.Serialization.XmlSerializerSupport,False,2013-04-17T08:46:50.667-07:00,True,False,,,4705,False,0.9.0.14
Steven Bey,2012-07-03T14:38:14.08Z,SQL Server CE ErrorLog Provider for ELFAR (MVC+WebApi).,elfar.combined.sqlserverce,False,2012-07-03T16:43:12.337-07:00,True,False,,"elfar,mvc,webapi,sqlserverce,error,logging,unhandled,exceptions",1610,False,1.2.4567.26293
Hibernating Rhinos,2012-07-04T05:19:58.937Z,"Use this package if you want extend RavenDB. Don't use this package if you just want to work with existing RavenDB server, in order to so just use the client API which is in the RavenDB.Client package. RavenDB is a document database for the .NET platform, offering a flexible data model design to fit the needs of real world systems.",RavenDB.Database,True,1900-01-01T00:00:00+00:00,False,False,This package allows you to extend RavenDB database.,"nosql,ravendb,raven,document,database",656854,True,1.2.2029-Unstable
Hibernating Rhinos,2012-07-04T05:20:37.683Z,"Use this package if you want to run RavenDB as a standalone application. This package is not intented to be used in Visual Studio. RavenDB is a document database for the .NET platform, offering a flexible data model design to fit the needs of real world systems.",RavenDB.Server,True,1900-01-01T00:00:00+00:00,False,False,This package contains the Raven.Server.exe database binaries.,"nosql,ravendb,raven,document,database",267691,True,1.2.2029-Unstable
Central,2012-07-05T05:27:49.07Z,Dynamic Linq Query Builder base on Expressions (core). Excellent PrepareQuery method with QueryParams,CentralLinq,False,2012-08-20T20:56:25.49-07:00,True,False,,"central,linq,dynamic,query,expressions,builder,prepare,params",3707,False,0.0.4
JohnMichaelHauck,2012-07-04T23:20:02.917Z,A Custom Content Control for Metro Settings Charm Flyouts,CharmFlyout,False,2013-02-06T07:43:29.253-08:00,True,False,,,8703,False,1.0.1
IBM,2012-07-03T20:54:18.723Z,Interop library for Notes Domino 8.5.3,interop.domino.dll,True,2012-07-03T13:58:14.29-07:00,True,False,,"Lotus,Notes,Domino",36230,False,1.0.0-alpha
SYSTEM,2012-07-03T17:02:37.457Z,Noodles transforms your object modelinto a web app. This is a library to integrate Noodles with AJAX jquery datatables,Noodles.DataTables,False,1899-12-31T16:00:00-08:00,False,False,,,-1,False,1.1.269
UTFPR,2012-07-04T18:57:15.487Z,EntityFramework extensions of UtfprLibrary.,UtfprLibrary.EntityFramework,True,2013-01-25T08:18:59.937-08:00,True,False,,UTFPR,39429,False,1.0.190-alpha
