authors,created,description,id,is_prerelease,last_updated,listed,missing_info,summary,tags,total_downloads,verified,versionNuGet,2014-12-25T06:16:47.967Z,NuGet v3.0.0 visual studio client,NuGet.Client.V3.VisualStudio,True,2015-01-12T13:57:44.797-08:00,True,False,,,5092,True,0.1.2-master-1224
Jason Jarrett,2014-12-25T06:11:04.097Z,TypeScript Definitions (d.ts) for multer. Generated based off the DefinitelyTyped repository [git commit: dd4398796d746c4a7bfc739fedfcaadb0a8feb77]. http://github.com/DefinitelyTyped,multer.TypeScript.DefinitelyTyped,False,2016-08-29T21:01:18.693-07:00,True,False,,"TypeScript,JavaScript",11806,False,0.3.4
Jason Jarrett,2014-12-25T10:11:13.187Z,TypeScript Definitions (d.ts) for multiparty. Generated based off the DefinitelyTyped repository [git commit: dd4398796d746c4a7bfc739fedfcaadb0a8feb77]. http://github.com/DefinitelyTyped,multiparty.TypeScript.DefinitelyTyped,False,2016-09-28T07:04:28.75-07:00,True,False,,"TypeScript,JavaScript",10502,False,0.4.4
Media Browser Team,2014-12-26T01:48:53.16Z,Contains common model objects and interfaces used by all Media Browser solutions.,MediaBrowser.Common,False,2018-04-14T14:59:42.14+00:00,True,False,,,143598,False,3.0.525
"Marcel Vroone,It-actief",2014-12-25T10:55:08.433Z,Library containing several extension classes to ease your development.,MVExtensions.Core,False,1900-01-01T00:00:00+00:00,False,False,Library containing several extension classes to ease your development.,"Extensions,Class,Library",-1,False,0.0.5
plexityHide,2014-12-26T02:03:32.653Z,GTP.NET.ASP.NET is a package of components to build interactive Gantt and Schedule charts on ASP.NET Ajax,GTP.NET.ASP.NET,False,2016-11-27T13:01:59.51-08:00,True,False,,"Gantt,Schedule,plexityHide,GTP.NET,GTP.NET.ASP.NET",22944,False,5.12.26.7582
Jason Jarrett,2014-12-26T02:01:50.83Z,TypeScript Definitions (d.ts) for angular-protractor. Generated based off the DefinitelyTyped repository [git commit: 958500847d48f4d341f7d8cc96067f4e0ca4af02]. http://github.com/DefinitelyTyped,angular-protractor.TypeScript.DefinitelyTyped,False,2016-11-01T07:01:39.263-07:00,True,False,,"TypeScript,JavaScript",63980,False,0.4.3
"Finaquant Analytics GmbH - finaquant.com,Tunc Ali Kutukcuoglu",2014-12-24T17:14:52.527Z,"Open-source Excel add-in in C#/.NET4.0 that makes matrix, vector and most importantly, table-valued functions of Finaquant Calcs available for Excel users and programmers. Based on ExcelDNA and NetOffice",TableFunctionsInExcel,False,2014-12-24T09:14:52.527-08:00,True,False,"Open-source Excel add-in in C#/.NET4.0 that makes matrix, vector and most importantly, table-valued functions of Finaquant Calcs available for Excel users and programmers. Based on ExcelDNA and NetOffice","excel,addin,add-in,VBA,macro,Finaquant,Calcs,ExcelDNA,NetOffice,data,table,table-valued,matrix,functions,TableFunctions,NoSQL,database,sql,matrixtable,analytics,BusinessIntelligence,dotnet,DataTable,OLAP,BigData,DataScience",859,False,1.0.3
Jason Jarrett,2014-12-25T02:05:11.017Z,TypeScript Definitions (d.ts) for dojo. Generated based off the DefinitelyTyped repository [git commit: dd4398796d746c4a7bfc739fedfcaadb0a8feb77]. http://github.com/DefinitelyTyped,dojo.TypeScript.DefinitelyTyped,False,2016-09-07T09:53:06.72-07:00,True,False,,"TypeScript,JavaScript",52412,False,0.3.9
Media Browser Team,2014-12-26T02:06:52.887Z,Contains common model objects and interfaces used by all Media Browser solutions.,MediaBrowser.Model.Signed,False,1899-12-31T16:00:00-08:00,False,False,,,42151,False,3.0.526
Jason Jarrett,2014-12-25T10:08:54.633Z,TypeScript Definitions (d.ts) for minimist. Generated based off the DefinitelyTyped repository [git commit: dd4398796d746c4a7bfc739fedfcaadb0a8feb77]. http://github.com/DefinitelyTyped,minimist.TypeScript.DefinitelyTyped,False,2016-03-22T12:12:06.557-07:00,True,False,,"TypeScript,JavaScript",24511,False,0.4.5
Jérémy Ansel,2014-12-24T18:05:10.77Z,ColorQuant is a color quantizer based on Xiaolin Wu's Color Quantizer.,JeremyAnsel.ColorQuant,False,2016-03-21T07:28:59.25-07:00,True,False,,,4823,False,1.0.17
Kobi Kadosh,2014-12-24T16:49:04.787Z,Google reCaptcha ASP.NET MVC,reCaptcha.AspNet.Mvc,False,2016-01-24T22:19:50.057+00:00,True,False,,"captcha,google,recaptcha,asp.net,mvc",16522,False,1.0.5471.30570
Jason Jarrett,2014-12-25T06:06:37.847Z,TypeScript Definitions (d.ts) for jjv. Generated based off the DefinitelyTyped repository [git commit: dd4398796d746c4a7bfc739fedfcaadb0a8feb77]. http://github.com/DefinitelyTyped,jjv.TypeScript.DefinitelyTyped,False,2016-03-22T11:40:52.117-07:00,True,False,,"TypeScript,JavaScript",22711,False,0.4.3
Val Melamed,2014-12-25T04:38:34.207Z,"Features:
            * The package uses industry strong cryptographic algorithms for encryption, hashing and signing included in the .NET framework.
            * It is very easy to integrate with a Dependency Injection container like Unity, i.e. the behaviors are abstracted with a handful of simple interfaces.
            * It is very easy to use and configure the objects. No configuration parameters default to sensible defaults.
            * The package does not have dependencies except the .NET framework BCL.
            * Built and tested with .NET 4.5.",Ciphers,False,2018-03-23T00:53:07.067+00:00,True,False,"The Ciphers package helps in addressing a common requirement for achieving confidentiality, integrity and 
            source authentication of data at rest, e.g. PII (Personally Identifiable Information) fields.","encryption,decryption,hash,signature",11218,False,1.0.0
Evgeny Komarevtsev,2014-12-25T01:03:09.207Z,Idecom.Bus log4net integration,Idecom.Bus.Logging.Log4Net,False,2015-03-05T23:41:06.693-08:00,True,False,,,1921,False,1.0.5
苏震巍,2014-12-25T05:15:12.613Z,"微信公众账号SDK：Senparc.Weixin.dll
（作为Senparc.Weixin.MP.dll及Senparc.Weixin.QY.dll的基类）
开源项目：
https://github.com/JeffreySu/WeiXinMPSDK",Senparc.Weixin,False,2018-02-28T10:25:28.963+00:00,True,False,,,107884,False,1.6.1
Jason Jarrett,2014-12-25T14:03:07.087Z,TypeScript Definitions (d.ts) for breeze. Generated based off the DefinitelyTyped repository [git commit: 3279297291825a75d8e03331f4fbbf2e69868e94]. http://github.com/DefinitelyTyped,breeze.TypeScript.DefinitelyTyped,False,2016-12-13T22:35:45.643-08:00,True,False,,"TypeScript,JavaScript",96619,False,0.7.4
Jason Jarrett,2014-12-25T18:15:27.67Z,TypeScript Definitions (d.ts) for proxyquire. Generated based off the DefinitelyTyped repository [git commit: c8f3fe257908ae25fde1f1f27139716a3e95c92a]. http://github.com/DefinitelyTyped,proxyquire.TypeScript.DefinitelyTyped,False,2016-03-22T12:37:21.34-07:00,True,False,,"TypeScript,JavaScript",7154,False,0.3.6
Jason Jarrett,2014-12-25T14:06:53.19Z,TypeScript Definitions (d.ts) for express-partials. Generated based off the DefinitelyTyped repository [git commit: 3279297291825a75d8e03331f4fbbf2e69868e94]. http://github.com/DefinitelyTyped,express-partials.TypeScript.DefinitelyTyped,False,2016-03-22T11:10:32.06-07:00,True,False,,"TypeScript,JavaScript",30328,False,0.0.1
Jason Jarrett,2014-12-25T10:06:22.597Z,TypeScript Definitions (d.ts) for jjv. Generated based off the DefinitelyTyped repository [git commit: dd4398796d746c4a7bfc739fedfcaadb0a8feb77]. http://github.com/DefinitelyTyped,jjv.TypeScript.DefinitelyTyped,False,2016-03-22T11:40:52.117-07:00,True,False,,"TypeScript,JavaScript",22711,False,0.4.4
Jason Jarrett,2014-12-25T02:09:07.997Z,TypeScript Definitions (d.ts) for mocha. Generated based off the DefinitelyTyped repository [git commit: dd4398796d746c4a7bfc739fedfcaadb0a8feb77]. http://github.com/DefinitelyTyped,mocha.TypeScript.DefinitelyTyped,False,2016-10-28T09:02:32.573-07:00,True,False,,"TypeScript,JavaScript",41207,False,0.4.9
zumicts. rikkit,2014-12-24T21:03:30.96Z,A portable sdk for last.fm,IF.Lastfm.Zumicts,False,2015-02-28T07:08:46.773-08:00,True,False,,,4395,False,0.3.1.91
Hibernating Rhinos,2014-12-25T04:14:54.317Z,"Note: this package is deprecated. You should use RavenDB.Database package instead.

		This package let you include RavenDB embedded in-process with your application. RavenDB is a document database for the .NET platform, offering a flexible data model design to fit the needs of real world systems.",RavenDB.Embedded,True,1900-01-01T00:00:00+00:00,False,False,This package let you include RavenDB embedded in-process with your application.,"nosql,ravendb,raven,document,database,embedded",545197,True,3.0.3552-Unstable
jlyonsmith,2014-12-24T19:46:19.703Z,An extremely useful collection of utility classes for .NET,ToolBelt,False,2015-06-11T19:21:51.267-07:00,True,False,,"oauth,utility,path,endian,console,localization,commandline,string,extension,mono,osx,linux",15296,False,3.0.11224
Jason Jarrett,2014-12-25T18:08:37.563Z,TypeScript Definitions (d.ts) for imap. Generated based off the DefinitelyTyped repository [git commit: c8f3fe257908ae25fde1f1f27139716a3e95c92a]. http://github.com/DefinitelyTyped,imap.TypeScript.DefinitelyTyped,False,2016-08-31T11:01:43.473-07:00,True,False,,"TypeScript,JavaScript",24252,False,0.4.6
Jason Jarrett,2014-12-24T22:09:49.107Z,TypeScript Definitions (d.ts) for mockery. Generated based off the DefinitelyTyped repository [git commit: dd4398796d746c4a7bfc739fedfcaadb0a8feb77]. http://github.com/DefinitelyTyped,mockery.TypeScript.DefinitelyTyped,False,2016-03-22T12:13:33.327-07:00,True,False,,"TypeScript,JavaScript",10671,False,0.3.2
Jason Jarrett,2014-12-25T06:11:52.257Z,TypeScript Definitions (d.ts) for ngprogress. Generated based off the DefinitelyTyped repository [git commit: dd4398796d746c4a7bfc739fedfcaadb0a8feb77]. http://github.com/DefinitelyTyped,ngprogress.TypeScript.DefinitelyTyped,False,2016-03-22T12:18:23.247-07:00,True,False,,"TypeScript,JavaScript",11306,False,0.4.2
Jason Jarrett,2014-12-25T22:05:43.107Z,TypeScript Definitions (d.ts) for dojo. Generated based off the DefinitelyTyped repository [git commit: c8f3fe257908ae25fde1f1f27139716a3e95c92a]. http://github.com/DefinitelyTyped,dojo.TypeScript.DefinitelyTyped,False,2016-09-07T09:53:06.72-07:00,True,False,,"TypeScript,JavaScript",52412,False,0.4.4
rynn.wang,2014-12-25T07:52:20.42Z,"Common library for .NET projects. Including REST Api handler, exception handler, AOP, Reflection, Extensions, Configurations, etc.

NOTE: version 2.x is not compatible for version 1.x in exception handler methods.",ifunction.Common,False,2015-12-07T22:29:02.52-08:00,True,False,"Common library for .NET projects. Including REST Api handler, exception handler, AOP, Reflection, Extensions, Configurations, etc.",,68169,False,2.2.6
Jason Jarrett,2014-12-26T02:04:35.51Z,TypeScript Definitions (d.ts) for createjs-lib. Generated based off the DefinitelyTyped repository [git commit: 958500847d48f4d341f7d8cc96067f4e0ca4af02]. http://github.com/DefinitelyTyped,createjs-lib.TypeScript.DefinitelyTyped,False,2016-12-13T22:59:57.923-08:00,True,False,,"TypeScript,JavaScript",54590,False,0.8.4
Jason Jarrett,2014-12-25T06:11:28.153Z,TypeScript Definitions (d.ts) for multiparty. Generated based off the DefinitelyTyped repository [git commit: dd4398796d746c4a7bfc739fedfcaadb0a8feb77]. http://github.com/DefinitelyTyped,multiparty.TypeScript.DefinitelyTyped,False,2016-09-28T07:04:28.75-07:00,True,False,,"TypeScript,JavaScript",10502,False,0.4.3
Jason Jarrett,2014-12-26T02:13:19.423Z,TypeScript Definitions (d.ts) for mongoose-mock. Generated based off the DefinitelyTyped repository [git commit: 958500847d48f4d341f7d8cc96067f4e0ca4af02]. http://github.com/DefinitelyTyped,mongoose-mock.TypeScript.DefinitelyTyped,False,2016-03-22T12:14:14.04-07:00,True,False,,"TypeScript,JavaScript",10157,False,0.3.9
Jason Jarrett,2014-12-25T14:09:36.847Z,TypeScript Definitions (d.ts) for jquery.joyride. Generated based off the DefinitelyTyped repository [git commit: 3279297291825a75d8e03331f4fbbf2e69868e94]. http://github.com/DefinitelyTyped,jquery.joyride.TypeScript.DefinitelyTyped,False,2016-03-22T11:46:48.603-07:00,True,False,,"TypeScript,JavaScript",13639,False,0.1.7
NuGet,2014-12-25T06:48:29.487Z,NuGet v3.0.0 visual studio client,NuGet.Client.V3.VisualStudio,True,2015-01-12T13:57:44.797-08:00,True,False,,,5092,True,0.1.3-master-1224
The AngularJS Team,2014-12-24T16:24:30.377Z,See the AngularJS.* packages for other Angular modules,AngularJS.Aria,False,2018-01-31T07:58:05.54+00:00,True,False,"AngularJS. HTML enhanced for web apps!

AngularJS.Aria contains the Angular Aria module. 

DISCLAIMER: This package is maintained by Scott Hanselman and John Papa, but neither of us work on Angular JS. This is simply a repackaging for use by NuGet Users","angular,angularjs",100627,False,1.3.8
Jason Jarrett,2014-12-24T18:07:21.827Z,TypeScript Definitions (d.ts) for jjve. Generated based off the DefinitelyTyped repository [git commit: dd4398796d746c4a7bfc739fedfcaadb0a8feb77]. http://github.com/DefinitelyTyped,jjve.TypeScript.DefinitelyTyped,False,2016-03-22T11:40:58.567-07:00,True,False,,"TypeScript,JavaScript",21478,False,0.4.0
jlyonsmith,2014-12-24T19:45:34.247Z,PCL ToolBelt for Applications,AppBelt,False,2015-06-11T19:20:44.437-07:00,True,False,,"utility,servicestack,plugin,cors,copy,mongodb,mono,osx,linux,pcl",4454,False,3.0.11224
Hibernating Rhinos,2014-12-26T04:09:43.473Z,This bundle aims to allow the user to implement unique constraints in the objects (usefull for properties like email or social security number).,RavenDB.Bundles.UniqueConstraints,True,1900-01-01T00:00:00+00:00,False,False,,"nosql,ravendb,raven,document,database,bundles",213834,True,3.0.3553-Unstable
latticework,2014-12-25T09:01:00.333Z,latticework.cs,latticework.cs,False,2013-07-22T14:32:56.307+00:00,True,False,,,309952,False,0.0.654
Jason Jarrett,2014-12-25T18:11:20.053Z,TypeScript Definitions (d.ts) for minimist. Generated based off the DefinitelyTyped repository [git commit: c8f3fe257908ae25fde1f1f27139716a3e95c92a]. http://github.com/DefinitelyTyped,minimist.TypeScript.DefinitelyTyped,False,2016-03-22T12:12:06.557-07:00,True,False,,"TypeScript,JavaScript",24511,False,0.4.7
Evgeny Komarevtsev,2014-12-25T00:54:42.527Z,Newtonsoft.Json serializer for Idecom.Bus,Idecom.Bus.Serializer.JsonNet,False,2015-03-05T23:42:53.7-08:00,True,False,,,3679,False,1.0.12
Andrey Taritsyn,2014-12-25T10:58:56.84Z,"BundleTransformer.Autoprefixer contains one postprocessor-adapter for postprocessing of CSS-code - `AutoprefixCssPostProcessor`. `AutoprefixCssPostProcessor` is based on the Andrey Sitnik's Autoprefixer (http://github.com/postcss/autoprefixer) version 4.0.2.2.
   
As a JS-engine is used the JavaScript Engine Switcher library (http://github.com/Taritsyn/JavaScriptEngineSwitcher). For correct working of this module is recommended to install the following NuGet packages: JavaScriptEngineSwitcher.V8 or JavaScriptEngineSwitcher.Msie (only in the `ChakraJsRt` mode).",BundleTransformer.Autoprefixer,False,2018-04-16T17:59:15.11+00:00,True,False,BundleTransformer.Autoprefixer contains one postprocessor-adapter for postprocessing of CSS-code - `AutoprefixCssPostProcessor`. `AutoprefixCssPostProcessor` is based on the Andrey Sitnik's Autoprefixer version 4.0.2.2.,"System.Web.Optimization,IBundleTransform,ASP.NET,CSS,Bundling,Postprocessing,Postprocessor,Autoprefixer",56061,False,1.9.36
Jason Jarrett,2014-12-25T18:10:07.437Z,TypeScript Definitions (d.ts) for jquery.joyride. Generated based off the DefinitelyTyped repository [git commit: c8f3fe257908ae25fde1f1f27139716a3e95c92a]. http://github.com/DefinitelyTyped,jquery.joyride.TypeScript.DefinitelyTyped,False,2016-03-22T11:46:48.603-07:00,True,False,,"TypeScript,JavaScript",13639,False,0.1.8
Jason Jarrett,2014-12-25T22:01:13.523Z,TypeScript Definitions (d.ts) for angular-local-storage. Generated based off the DefinitelyTyped repository [git commit: c8f3fe257908ae25fde1f1f27139716a3e95c92a]. http://github.com/DefinitelyTyped,angular-local-storage.TypeScript.DefinitelyTyped,False,2016-12-13T22:09:59.513-08:00,True,False,,"TypeScript,JavaScript",72028,False,0.3.7
Aurigma Inc.,2014-12-25T09:47:12.42Z,"Graphics Mill is an advanced image processing library. It allows loading/saving images (JPEG, PNG, GIF, TIFF, EPS, PDF, EPS, PSD and others) in various bitmap formats (RGB, CMYK, 8 and 16-bit per channel), managing metadata (EXIF, IPTC, XMP, Adobe Resources), manipulating image channels and pixels, applying operations on images (crop, resize, rotate, flip), drawing bitmap and vector elements, single and multiline text (including artistic effects and text line distortions),  converting colors with ICC profiles, adjust color/tone/brightness/contrasts and apply image filters.  

IMPORTANT: This version is targeted for x64 environment. For x86 applications, please use the package named Graphics Mill Core (x86).",Aurigma.GraphicsMill.Core.x64,False,2018-04-17T10:16:47.707+00:00,True,False,Everything to load/save/modify image files in your C# app,"image,imaging,jpeg,png,tiff,eps,pdf,psd,webp,cmyk,crop,resize,resizing,exif,iptc,xmp,adobe,drawing,font",11896,False,7.2.20
Jason Jarrett,2014-12-26T02:06:39.477Z,TypeScript Definitions (d.ts) for easeljs. Generated based off the DefinitelyTyped repository [git commit: 958500847d48f4d341f7d8cc96067f4e0ca4af02]. http://github.com/DefinitelyTyped,easeljs.TypeScript.DefinitelyTyped,False,2016-10-06T11:01:42.93-07:00,True,False,,"TypeScript,JavaScript",46924,False,0.3.0
latticework,2014-12-25T09:01:01.48Z,latticework.cs,latticework.cs,False,2013-07-22T14:32:56.307+00:00,True,False,,,309952,False,0.0.653
Joel Verhagen,2014-12-25T04:05:21.297Z,General purpose building blocks for your .NET projects... and the kitchen sink.,Knapcode.KitchenSink,False,2014-12-28T20:00:33.897-08:00,True,False,,,3190,False,2.0.2
Jason Jarrett,2014-12-25T06:08:44.9Z,TypeScript Definitions (d.ts) for log4js. Generated based off the DefinitelyTyped repository [git commit: dd4398796d746c4a7bfc739fedfcaadb0a8feb77]. http://github.com/DefinitelyTyped,log4js.TypeScript.DefinitelyTyped,False,2016-06-07T23:03:44.153-07:00,True,False,,"TypeScript,JavaScript",11132,False,0.1.0
Jason Jarrett,2014-12-25T06:05:45.273Z,TypeScript Definitions (d.ts) for fabricjs. Generated based off the DefinitelyTyped repository [git commit: dd4398796d746c4a7bfc739fedfcaadb0a8feb77]. http://github.com/DefinitelyTyped,fabricjs.TypeScript.DefinitelyTyped,False,2016-09-08T11:01:59.67-07:00,True,False,,"TypeScript,JavaScript",66166,False,1.3.9
Jason Jarrett,2014-12-25T14:08:02.737Z,TypeScript Definitions (d.ts) for imap. Generated based off the DefinitelyTyped repository [git commit: 3279297291825a75d8e03331f4fbbf2e69868e94]. http://github.com/DefinitelyTyped,imap.TypeScript.DefinitelyTyped,False,2016-08-31T11:01:43.473-07:00,True,False,,"TypeScript,JavaScript",24252,False,0.4.5
Jason Jarrett,2014-12-25T18:05:04.12Z,TypeScript Definitions (d.ts) for devextreme. Generated based off the DefinitelyTyped repository [git commit: c8f3fe257908ae25fde1f1f27139716a3e95c92a]. http://github.com/DefinitelyTyped,devextreme.TypeScript.DefinitelyTyped,False,2016-11-30T18:01:22.65-08:00,True,False,,"TypeScript,JavaScript",63610,False,0.4.9
Jason Jarrett,2014-12-25T10:02:41.057Z,TypeScript Definitions (d.ts) for breeze. Generated based off the DefinitelyTyped repository [git commit: dd4398796d746c4a7bfc739fedfcaadb0a8feb77]. http://github.com/DefinitelyTyped,breeze.TypeScript.DefinitelyTyped,False,2016-12-13T22:35:45.643-08:00,True,False,,"TypeScript,JavaScript",96619,False,0.7.3
Jason Jarrett,2014-12-25T14:00:46.257Z,TypeScript Definitions (d.ts) for amqp-rpc. Generated based off the DefinitelyTyped repository [git commit: 3279297291825a75d8e03331f4fbbf2e69868e94]. http://github.com/DefinitelyTyped,amqp-rpc.TypeScript.DefinitelyTyped,False,2016-12-13T22:05:47.253-08:00,True,False,,"TypeScript,JavaScript",53414,False,0.4.6
Jason Jarrett,2014-12-25T22:09:17.977Z,TypeScript Definitions (d.ts) for jquery.joyride. Generated based off the DefinitelyTyped repository [git commit: c8f3fe257908ae25fde1f1f27139716a3e95c92a]. http://github.com/DefinitelyTyped,jquery.joyride.TypeScript.DefinitelyTyped,False,2016-03-22T11:46:48.603-07:00,True,False,,"TypeScript,JavaScript",13639,False,0.1.9
Evgeny Komarevtsev,2014-12-25T01:03:39.127Z,"MongoDB pub/sub, subscription storage and saga persistence for Idecom.Bus",Idecom.Bus.PubSub.MongoDB,False,2015-03-05T23:42:01.473-08:00,True,False,,,3173,False,1.0.10
Jason Jarrett,2014-12-25T14:08:46.743Z,TypeScript Definitions (d.ts) for jjve. Generated based off the DefinitelyTyped repository [git commit: 3279297291825a75d8e03331f4fbbf2e69868e94]. http://github.com/DefinitelyTyped,jjve.TypeScript.DefinitelyTyped,False,2016-03-22T11:40:58.567-07:00,True,False,,"TypeScript,JavaScript",21478,False,0.4.5
Jason Jarrett,2014-12-26T02:14:54.1Z,TypeScript Definitions (d.ts) for openlayers. Generated based off the DefinitelyTyped repository [git commit: 958500847d48f4d341f7d8cc96067f4e0ca4af02]. http://github.com/DefinitelyTyped,openlayers.TypeScript.DefinitelyTyped,False,2016-12-08T14:04:08.473-08:00,True,False,,"TypeScript,JavaScript",12946,False,0.2.4
Jason Jarrett,2014-12-25T02:13:39.9Z,TypeScript Definitions (d.ts) for threejs. Generated based off the DefinitelyTyped repository [git commit: dd4398796d746c4a7bfc739fedfcaadb0a8feb77]. http://github.com/DefinitelyTyped,threejs.TypeScript.DefinitelyTyped,False,2016-10-28T14:02:20.463+00:00,True,False,,"TypeScript,JavaScript",57156,False,0.7.7
Jason Jarrett,2014-12-25T06:12:16.183Z,TypeScript Definitions (d.ts) for openlayers. Generated based off the DefinitelyTyped repository [git commit: dd4398796d746c4a7bfc739fedfcaadb0a8feb77]. http://github.com/DefinitelyTyped,openlayers.TypeScript.DefinitelyTyped,False,2016-12-08T14:04:08.473-08:00,True,False,,"TypeScript,JavaScript",12946,False,0.1.9
NuGet,2014-12-25T05:12:22.92Z,NuGet v3.0.0 core types,NuGet.Client.BaseTypes,True,2015-01-12T13:51:38.543-08:00,True,False,,,10082,True,0.1.2-master-1224
Jason Jarrett,2014-12-24T22:01:33.997Z,TypeScript Definitions (d.ts) for amqp-rpc. Generated based off the DefinitelyTyped repository [git commit: dd4398796d746c4a7bfc739fedfcaadb0a8feb77]. http://github.com/DefinitelyTyped,amqp-rpc.TypeScript.DefinitelyTyped,False,2016-12-13T22:05:47.253-08:00,True,False,,"TypeScript,JavaScript",53414,False,0.4.2
The AngularJS Team,2014-12-24T16:24:33.25Z,See the AngularJS.* packages for other Angular modules,AngularJS.Animate,False,2018-01-31T07:58:05.12+00:00,True,False,"AngularJS. HTML enhanced for web apps!

AngularJS.Animate contains the Angular Animate module. 

DISCLAIMER: This package is maintained by Scott Hanselman and John Papa, but neither of us work on Angular JS. This is simply a repackaging for use by NuGet Users","angular,angularjs",848057,False,1.3.8
Jason Jarrett,2014-12-25T06:00:59.263Z,TypeScript Definitions (d.ts) for amqp-rpc. Generated based off the DefinitelyTyped repository [git commit: dd4398796d746c4a7bfc739fedfcaadb0a8feb77]. http://github.com/DefinitelyTyped,amqp-rpc.TypeScript.DefinitelyTyped,False,2016-12-13T22:05:47.253-08:00,True,False,,"TypeScript,JavaScript",53414,False,0.4.4
Jason Jarrett,2014-12-25T18:02:02.267Z,TypeScript Definitions (d.ts) for angular-protractor. Generated based off the DefinitelyTyped repository [git commit: c8f3fe257908ae25fde1f1f27139716a3e95c92a]. http://github.com/DefinitelyTyped,angular-protractor.TypeScript.DefinitelyTyped,False,2016-11-01T07:01:39.263-07:00,True,False,,"TypeScript,JavaScript",63980,False,0.4.1
Media Browser Team,2014-12-26T02:12:10.42Z,Contains common model objects and interfaces used by all Media Browser solutions.,MediaBrowser.Model.Signed,False,1899-12-31T16:00:00-08:00,False,False,,,42151,False,3.0.527
"Marcel Vroone,It-actief",2014-12-25T10:31:25.053Z,Library containing several extension classes to ease your development.,MVExtensions.Core,False,1900-01-01T00:00:00+00:00,False,False,Library containing several extension classes to ease your development.,"Extensions,Class,Library",-1,False,0.0.4
Jason Jarrett,2014-12-25T18:10:29.707Z,TypeScript Definitions (d.ts) for less. Generated based off the DefinitelyTyped repository [git commit: c8f3fe257908ae25fde1f1f27139716a3e95c92a]. http://github.com/DefinitelyTyped,less.TypeScript.DefinitelyTyped,False,2016-12-08T14:03:15.853-08:00,True,False,,"TypeScript,JavaScript",18224,False,0.5.3
Jason Jarrett,2014-12-24T18:02:58.503Z,TypeScript Definitions (d.ts) for breeze. Generated based off the DefinitelyTyped repository [git commit: dd4398796d746c4a7bfc739fedfcaadb0a8feb77]. http://github.com/DefinitelyTyped,breeze.TypeScript.DefinitelyTyped,False,2016-12-13T22:35:45.643-08:00,True,False,,"TypeScript,JavaScript",96619,False,0.6.9
Aurigma Inc.,2014-12-25T09:50:23.63Z,"Graphics Mill Web Controls is a front end for Graphics Mill image processing library. Set of web controls allow viewing and editing graphics. Use Bitmap Viewer allows to display, zoom, crop and apply different effects on bitmap images. AJAX Vector Objects allows viewing and editing composite images consisting of multiple elements such as bitmaps, texts and vector data which can be used to build rich image editing application like business card or t-shirt editor.

IMPORTANT: This version is targeted for x64 environment. For x86 applications, please use the package named Graphics Mill Web Controls (x86).",Aurigma.GraphicsMill.Web.x64,False,2018-04-17T10:17:02.397+00:00,True,False,HTML5 controls to view and edit images in the browser,"image,imaging,jpeg,png,tiff,eps,pdf,psd,webp,cmyk,crop,resize,resizing,exif,iptc,xmp,adobe,drawing,font",8276,False,7.2.20
