authors,created,description,id,is_prerelease,last_updated,listed,missing_info,summary,tags,total_downloads,verified,versiongregsdennis,2014-05-13T02:01:32.503Z,"A JSON serializer implementation for Manatee.Trello, backed by Manatee..Json.",Manatee.Trello.ManateeJson,False,2018-04-06T03:22:12.41+00:00,True,False,,"trello,json,manatee",22298,False,1.0.4
Envoc,2014-05-12T03:51:57.09Z,Envoc.Directives,Envoc.Directives,False,2016-11-11T12:44:22.873-08:00,True,False,,,16846,False,1.0.0.41
James Craig,2014-05-12T17:30:20.687Z,"This is a basic framework built on top of Craig's Utility Library. It's designed for MVC. This was formerly called Batman Framework, but apparently BatmanJS is a thing and people were getting confused...",Ironman.Core,True,2016-08-22T09:50:45.373-07:00,True,False,This is a basic framework to help with MVC development built on top of Craig's Utility Library.,"utility,utilities",22536,False,1.0.136-beta
Eben Roux,2014-05-12T17:20:54.167Z,A free open-source enterprise service bus.,shuttle-esb-core,True,1899-12-31T16:00:00-08:00,False,False,,"Enterprise,Service,ESB,esb,c#,Event,Driven,messaging,MSMQ,RabbitMQ,nservicebus,pipeline,development,Bus,shuttle,soa",-1,False,3.0.0-rc5
drvic10k,2014-05-11T16:41:20.213Z,"Adding sorting ability to bootstrap table.

In fact, it can be used for any tables.",bootstrap-sortable,False,2016-02-20T08:22:11.177-08:00,True,False,,"bootstrap,table,sortable",42089,False,1.9.0
Denis Korkhov,2014-05-12T10:07:36.493Z,"Data Patterns for Cortoxa Framework with NHibernate implementation. 
Cortoxa Framework is a Powerful Framework for faster and easier building .Net applications based on Dependency Injection patterns. 
Contains implementation of common ""Design Patterns"".",Cortoxa.Data.NHibernate,False,2014-07-30T10:31:01.607-07:00,True,False,Data Patterns for Cortoxa Framework,"logger,log,logging,nlog",4398,False,1.0.9
TTRider,2014-05-13T02:42:27.163Z,Fluid-style SQL statement generator,TTRider.FluidSql.dll,False,2017-08-09T02:23:12.623+00:00,True,False,,SQL,22623,False,0.0.0.7
"Launchark,Prasanna V. Loganathar",2014-05-11T19:29:58.727Z,"A simple high-peformance portable logging framework for .NET, which follows simple convention over configuration, and works with PCL.",SharpLog,False,2014-06-07T11:11:24.723-07:00,True,False,A simple high-peformance portable logging framework for .NET,"log,logging,pcl,logger,framework",2559,False,1.0.2
Jerome Haltom,2014-05-12T00:31:20.937Z,"NXKit forms the basis of an XML processing engine that can be used to implement other XML based models, such as XForms, or theoritically a full web browser user agent.

            Implements the XInclude specification.",NXKit.XInclude,False,2015-04-28T22:37:04.49-07:00,True,False,,"xml,xforms,xinclude",4003,False,0.4.0
Patrik Svensson,2014-05-11T21:16:08.177Z,Use this library if you want to debug Lunt pipeline components.,Lunt.Debugging,False,2014-05-25T14:40:32.157-07:00,True,False,Lunt is an asset pipeline and build system for games.,"Lunt,Build,Debugging",1152,False,0.0.5
Guy Godin,2014-05-11T22:23:47.267Z,SharpOVR is a .NET API for the Oculus Rift,SharpOVR,False,2015-07-20T01:06:03.463-07:00,True,False,,,5881,False,0.3.1.1
John Doty,2014-05-13T05:37:18.513Z,"A drop-in augmentation for the typescript targets file that
    causes the compiler to run incrementally, potentially saving quite a lot
    of time.",TypeScript.Incremental,False,2014-05-12T22:37:18.513-07:00,True,False,,,474,False,1.0.0
Trevor Pilley and MicroLite Project Contributors,2014-05-12T16:33:14.013Z,An extension for the MicroLite ORM Framework to integrate with ASP.NET MVC.,MicroLite.Extensions.Mvc,False,2018-03-05T18:15:02.483+00:00,True,False,,"Micro,ORM,Framework,POCO,Database,ASP.NET,MVC",7178,False,5.1.0
Lucas Ontivero <lucasontivero@gmail.com>,2014-05-12T13:22:09.087Z,A simple and easy-to-use .NET managed wrapper for Low Level Keyboard hooking.,Open.WinKeyboardHook,False,2017-04-20T09:02:04.32-07:00,True,False,,"Keyboard,hook,intercept,global,event,keyup,keydown,keypress",3295,False,0.1.0
Chillisoft,2014-05-13T04:03:01.43Z,Habanero.Faces,Habanero.Faces,True,2017-04-19T21:02:45.06-07:00,True,False,,,162877,False,3.9.203-prerelease
Max Pavlov,2014-05-12T17:05:33.093Z,$description$,radacode.membership.mvc5,False,1900-01-01T00:00:00+00:00,False,False,,"mvc5,membership",-1,False,1.0.0
gregsdennis,2014-05-13T02:00:52.747Z,A fully object-oriented .Net wrapper for the TrelloAPI.,Manatee.Trello,False,2018-04-06T03:22:35.753+00:00,True,False,,"wrapper,trello,manatee",32561,False,0.6.8
"Admir Tuzovic,Josip Dusper,Mirza Dervisevic,Fedja Omeragic",2014-05-12T12:40:08.487Z,Part of Vault libraries set designed to enhance experience with latest UI frameworks.,Vault.js,False,2015-06-10T12:27:32.09-07:00,True,False,Vault JavaScript UI library.,,17820,False,0.0.65
Michalis Sarigiannidis,2014-05-12T19:47:14.833Z,"This package contains a class library that can be used to access and operate any and all webcams attached to your pc.

If you are looking for an easy way to operate a webcam, this is it!",M1.Video,False,1899-12-31T16:00:00-08:00,False,False,This package contains a class library that can be used to access and operate any and all webcams attached to your pc.,"BaseFilter,Cam,device,FilterGraph,LifeCam,Logitech,MediaControl,Microsoft,M1,M1chal1s,Michalis,SampleGrabber,Sarigiannidis,Stream,USB,Webcam",-1,False,1.0.1
James Craig,2014-05-12T15:05:35.627Z,"Craig's Utility Library is one of the largest collections of utility classes and extension methods for .Net. It includes code to help with tasks including encryption, compression, serialization, file management, email, image manipulation, SQL, various file formats (CSV, iCal, etc.), randomization, validation, math related classes, various data types, reflection, code gen, events, code profiling, etc.",CraigsUtilityLibrary-ORM,True,2016-08-22T09:47:31.05-07:00,True,False,This is the ORM namespace from Craig's Utility Library,"utility,utilities",49853,False,4.0.134-beta
Gabriel Campbell,2014-05-11T19:08:47.797Z,BDD setup for Javascript using CucumberJS.,cucumberjs-specrunner,False,2014-05-11T12:08:47.797-07:00,True,False,,,684,False,1.0.0
Ivony,2014-05-12T08:47:40.357Z,"simple route table for MVC
WebSockets support for MVC",Ivony.Web.Mvc,False,2014-05-31T22:15:39.707-07:00,True,False,,"ASP.NET,MVC,SimpleRouteTable,route",1220,False,1.0.2
Eben Roux,2014-05-12T17:22:03.95Z,A free open-source enterprise service bus.,shuttle-esb-msmq,True,1899-12-31T16:00:00-08:00,False,False,,"Enterprise,Service,ESB,esb,c#,Event,Driven,messaging,MSMQ,RabbitMQ,nservicebus,pipeline,development,Bus,shuttle,soa",-1,False,3.0.0-rc5
"Microsoft Open Technologies,Inc.",2014-05-12T18:34:55.23Z,Tx (LINQ to Logs and Traces) container package for all supported raw trace/log sources,Tx.All,False,2017-06-12T11:08:15.3-07:00,True,False,,"Tx,Traces,Logs,Playback,Replay,XEvent,ETW",18706,False,1.0.40512
JustGiving,2014-05-12T10:33:03.253Z,Wrapper for simple integration with EventStore.,JustGiving.EventStore.Http.Client,False,2017-08-11T10:11:59.263+00:00,True,False,JustGiving.EventStore.Http.Client,"EventStore,event,store,soa,http",23500,False,1.0.53
"Microsoft Open Technologies,Inc.",2014-05-12T18:35:32.713Z,"Tx (LINQ to Logs and Traces) components for SQL Server. So far, this incldes Extended Events (XEvent)",Tx.SqlServer,False,2017-06-12T11:08:56.66-07:00,True,False,,"Tx,Traces,Logs,Playback,Replay,XEvent",19743,False,1.0.40512
Aditi Technologies Pvt. Ltd.,2014-05-12T05:08:07.163Z,Brewmaster Template SDK Contracts Ver-1.0.0-betaB352R737cff2,Brewmaster.TemplateSDK.Contracts,True,2015-04-22T03:13:15.327-07:00,True,False,,"Aditi,Brewmaster,TemplateSDk",3251,False,1.0.0-betaB352R737cff2
Wonka,2014-05-12T08:16:01.087Z,Description,Cortoxa.Data.Identity,False,2014-07-30T10:26:07.793-07:00,True,False,,,3654,False,1.0.7
objo,2014-05-12T19:28:05.443Z,OxyPlot is an open source plotting library for .NET.,OxyPlot.Silverlight,False,1899-12-31T16:00:00-08:00,False,False,,"silverlight,plotting,plot,charting,chart",130947,False,2014.1.301.1
Jamie Kurtz,2014-05-12T00:59:09.047Z,Provides easy implementation for JWT-based HTTP authentication in an ASP.NET Web API project.,JwtAuthForWebAPI,False,2015-04-21T19:45:38.237-07:00,True,False,,"REST,ASP.NET,WebAPI,JSON,Web,Token,JWT,Authentication",13118,False,1.0.7
Outercurve RIA Services,2014-05-12T21:31:03.563Z,"OpenRiaServices.Endpoints provides the OpenRiaServices.DomainServices.Hosting.Endpoint assembly, which serves the SOAP and JSON endpoints for Domain Services.

      The necessary web.config entries are added with this package as well.",OpenRiaServices.Endpoints,True,2018-03-04T21:55:00.337+00:00,True,False,Open RIA Services - SOAP and JSON Endpoints for web development,"WCF,RIA,Services,RIAServices,SOAP,JSON,OpenRiaServices",3022,True,4.4.0-Beta2
Oystein Bjorke,2014-05-12T19:26:35.037Z,OxyPlot is an open source plotting library for .NET.,OxyPlot.Metro,False,1899-12-31T16:00:00-08:00,False,False,,"winrt,win8,metro,plotting,plot,charting,chart",-1,False,2014.1.301.1
Denis Korkhov,2014-05-12T11:44:59.467Z,"Windsor Implementation of the ""Dependency Injection"" pattern for Cortoxa Framework. 
Cortoxa Framework is a Powerful Framework for faster and easier building .Net applications based on Dependency Injection patterns. Contains implementation of common ""Design Patterns"".",Cortoxa.Windsor,False,2014-07-30T10:26:43.367-07:00,True,False,"Windsor Implementation of the ""Dependency Injection"" pattern for Cortoxa Framework.","Cortoxa,Windsor",2764,False,1.0.11
CapableObjects,2014-05-12T12:37:45.947Z,Descr,EcoWebASP,False,2018-04-17T02:39:00.97+00:00,True,False,,"ModelDrivenDevelopment,ECO,CapableObjects",115352,False,7.0.0.7273
"Chris Sampson,James Goodenough",2014-05-12T21:00:44.383Z,"Inversion of control container and core libraries for cross platform development on Android, iOS and WinRT",SystemDotCore,False,2015-01-31T04:26:47.847-08:00,True,False,"Inversion of control container and core libraries for cross platform development on Android, iOS and WinRT","Ioc,Cross,Platform",14812,False,1.2.9
James Craig,2014-05-12T15:02:47.73Z,"Craig's Utility Library is one of the largest collections of utility classes and extension methods for .Net. It includes code to help with tasks including encryption, compression, serialization, file management, email, image manipulation, SQL, various file formats (CSV, iCal, etc.), randomization, validation, math related classes, various data types, reflection, code gen, events, code profiling, etc.",CraigsUtilityLibrary-Configuration,True,2016-08-22T09:46:26.787-07:00,True,False,This is the Configuration namespace from Craig's Utility Library,"utility,utilities",49782,False,4.0.134-beta
J.Baltika,2014-05-12T17:09:22.74Z,Framework to simplify static file in subdomain handle in the Sitecore project,Constellation.StaticFile.Controls,False,1899-12-31T16:00:00-08:00,False,False,Framework to simplify static file in subdomain handle in the Sitecore project,"ASP.NET,CSS,JS,CDN,Sitecore",-1,False,1.0.1
Service Stack,2014-05-13T07:01:24.213Z,"Binaries for the ServiceStack web framework.
      Visit http://mono.servicestack.net/ServiceStack.Hello/
      and https://github.com/ServiceStack/ServiceStack/wiki/Create-your-first-webservice
      for walk throughs and docs on creating your first web service.",ServiceStack,False,2018-01-02T14:40:21.217+00:00,True,False,Opensource .NET and Mono REST Web Services framework,"Fast,JSON,XML,CSV,HTML,SOAP,JSV,REST,Web,Service,Framework,MONO,ServiceStack",993613,False,4.0.20
James Ottaway,2014-05-12T00:31:27.677Z,Syntactic sugar for .NET,Sweet,False,2014-05-11T17:31:27.677-07:00,True,False,Syntactic sugar for .NET,,418,False,0.0.1
Benjamin Fradet,2014-05-12T17:10:37.67Z,"C# Wrapper for the Riot Games API.
This product is not endorsed, certified or otherwise approved in any way by Riot Games, Inc. or any of its affiliates.",RiotSharp,False,2017-11-10T23:04:16.85+00:00,True,False,C# Wrapper for the Riot Games API,,10763,False,1.7.0
Chillisoft,2014-05-13T04:02:04.637Z,Habanero,Habanero,True,2017-04-19T21:01:31.993-07:00,True,False,,,164400,False,3.9.203-prerelease
James Craig,2014-05-12T15:05:51.423Z,"Craig's Utility Library is one of the largest collections of utility classes and extension methods for .Net. It includes code to help with tasks including encryption, compression, serialization, file management, email, image manipulation, SQL, various file formats (CSV, iCal, etc.), randomization, validation, math related classes, various data types, reflection, code gen, events, code profiling, etc.",CraigsUtilityLibrary-Profiler,True,2016-08-22T09:47:39.963-07:00,True,False,This is the Profiler namespace from Craig's Utility Library,"utility,utilities",50194,False,4.0.134-beta
MMerayo,2014-05-12T08:46:45.547Z,Implementation of the subasta game,Subasta.Lib,False,2015-11-09T09:38:29.387-08:00,True,False,,,8863,False,0.5000.1000.1029
Outercurve RIA Services,2014-05-12T21:25:45.76Z,OpenRiaServices.UnitTesting provides a DomainServiceTestHost that can be used to unit test your Domain Services.,OpenRiaServices.UnitTesting,True,2018-03-25T17:02:00.46+00:00,True,False,Open RIA Services - Domain Service Unit Test Host,"WCF,RIA,Services,RIAServices,Testing,OpenRiaServices",2686,True,4.4.0-Beta2
Denis Korkhov,2014-05-12T10:20:09.633Z,"Windsor Implementation of the ""Dependency Injection"" pattern for Cortoxa Framework. 
Cortoxa Framework is a Powerful Framework for faster and easier building .Net applications based on Dependency Injection patterns. Contains implementation of common ""Design Patterns"".",Cortoxa.Windsor,False,2014-07-30T10:26:43.367-07:00,True,False,"Windsor Implementation of the ""Dependency Injection"" pattern for Cortoxa Framework.","Cortoxa,Windsor",2764,False,1.0.10
Yann Crumeyrolle,2014-05-11T18:40:39.66Z,A feature flipping system.,FeatureFlipper,True,2014-07-08T14:16:32.937-07:00,True,False,,"feature,flipping,flipper,toggle",1609,False,1.0.0-alpha
Zach Bray,2014-05-11T22:13:36.987Z,A library for building web servers. Compatible with FunScript. Exports human-readable documentation.,TypeInferred.HashBang,False,2014-10-16T03:11:44.643-07:00,True,False,,"F#,FSharp,JavaScript,TypeProvider,FunScript",10344,False,0.1.51
Fix8,2014-05-12T06:55:58.863Z,"Redistributable components for package 'fix8.dev.tests'. This package should only be installed as a dependency. 
(This is not the package you are looking for).",fix8.dev.tests.redist,False,2015-10-19T05:33:02.993-07:00,True,False,Redistributable components for for package 'fix8.dev.tests',"FIX8,native,CoApp,nativepackage",5976,False,1.1.20140512.2
Jason Jarrett,2014-05-12T05:00:45.03Z,TypeScript Definitions (d.ts) for jquery.tile. Generated based off the DefinitelyTyped repository [git commit: 6c578814d31fe71308eefef4014b9300157be765]. http://github.com/DefinitelyTyped,jquery.tile.TypeScript.DefinitelyTyped,False,2016-03-22T11:49:42.863-07:00,True,False,,"TypeScript,JavaScript",535,False,0.0.1
iainb,2014-05-12T09:23:51.183Z,"An extension that helps with building installers for .Net applications and websites with WiX. It's like Heat, but simpler and more focused for .Net development.",WixBacktraceExtension,False,2015-02-16T04:07:21.447-08:00,True,False,An extension that helps with building installers for .Net applications and websites with WiX.,"wix,extension,installer,automation,windows",5135,False,1.0.17
Jason Jarrett,2014-05-11T21:00:40.907Z,TypeScript Definitions (d.ts) for atom. Generated based off the DefinitelyTyped repository [git commit: e9b0f608b1ca18344b2a916048594c8f30b0df10]. http://github.com/DefinitelyTyped,atom.TypeScript.DefinitelyTyped,False,2016-12-13T22:21:08.62-08:00,True,False,,"TypeScript,JavaScript",29608,False,0.0.7
Dani Michel,2014-05-12T08:15:43.547Z,A CouchDB design document generator that integrates into your .NET application.,CouchDesignDocuments,False,2017-09-21T13:09:58.747+00:00,True,False,,"CouchDB,DesignDocuments",1517,False,0.3.0
Microsoft,2014-05-12T15:35:22.633Z,"JavaScript client libraries that support Office 365 APIs for Mail, Calendar, Contacts and Active Directory Graph.

These Libraries are meant to be used with multi-device hybrid apps only and do not work with browser scenarios. Learn more about how to use these libraries @ http://aka.ms/ClientLibraries.",Microsoft.Office365.ClientLib.JS,True,2014-11-05T13:29:08.88-08:00,True,False,JavaScript client libraries that support Office 365 APIs for multi-device hybrid apps,"Microsoft,Office,Office365,Service,REST",2989,False,0.1.0-alpha
Danny Varod,2014-05-12T23:39:44.42Z,"Interfaces for abstracting NoSQL Databases
(moved to PubComp.NoSql.Core)",PubExp.NoSqlRep,False,2014-10-28T06:04:08.183-07:00,True,False,"Interfaces for abstracting NoSQL Databases
(moved to PubComp.NoSql.Core)","pubexp,nosql",1713,False,1.5.0
Rafael Staib,2014-05-12T10:52:36.203Z,"Nice, sleek and intuitive. A grid control especially designed for bootstrap.",jQuery.Bootgrid,True,2015-09-11T00:53:40.797-07:00,True,False,"Nice, sleek and intuitive. A grid control especially designed for bootstrap.","jQuery,Grid,Table,Bootstrap,Accessibility,HTML5,Sorting,Filtering,UI",31047,False,0.9.2-alpha
James Craig,2014-05-12T15:08:42.79Z,"This is a basic framework built on top of Craig's Utility Library. It's designed for MVC. This was formerly called Batman Framework, but apparently BatmanJS is a thing and people were getting confused...",Ironman.Core,True,2016-08-22T09:50:45.373-07:00,True,False,This is a basic framework to help with MVC development built on top of Craig's Utility Library.,"utility,utilities",22536,False,1.0.134-beta
Apolineo | Design For Apps,2014-05-11T19:43:18.317Z,Conjunto de classes para acelerar o desenvolvimento de aplicativos Windows Phone,Lean.Engine.Framework.Phone,False,2014-05-13T11:17:12.587-07:00,True,False,,,1333,False,1.1.65.15
Tim Jones,2014-05-12T15:00:51.123Z,"Output module for Gemini, providing a buffered output tool pane.",Gemini.Modules.Output,False,2015-09-20T06:50:37.367-07:00,True,False,,".net40,WPF,MVVM,AvalonDock,Caliburn,Micro,Visual,Studio,IDE,Shell,Output",2926,False,0.5.0
Ninject Project Contributors,2014-05-12T10:54:12.33Z,Extension for Ninject which adds support for Azure roles,Ninject.Extensions.Azure,True,2014-11-04T08:05:50.123-08:00,True,False,,"Ninject,ioc,di,azure",35299,False,3.2.0-unstable-005
Gurdip Singh,2014-05-12T13:44:20.357Z,WinToastr is a C# library for notifications inspired by toastrjs.,WinToastr,False,2014-05-12T06:44:20.357-07:00,True,False,,,589,False,1.0.1
Edgar,2014-05-13T02:54:07.917Z,"**IMPORTANT**
Add the code below to your Global.asax > Application_Start() in order to load the binder in the application start:

ModelBinders.Binders.Add(typeof(decimal), new DecimalModelBinder());

This is the code from http://haacked.com/archive/2011/03/19/fixing-binding-to-decimals.aspx/ with a few changes to work with invariant culture and multiple currency types in the same Model/page.",DecimalModelBinder,False,2014-05-12T19:54:07.917-07:00,True,False,Decimal model binder to work with currency decimal fields in Models.,,1938,False,1.0.1
Envoc,2014-05-12T13:51:09.19Z,Envoc.Directives,Envoc.Directives,False,2016-11-11T12:44:22.873-08:00,True,False,,,16846,False,1.0.0.44
Envoc,2014-05-12T15:19:52.09Z,Envoc.Directives,Envoc.Directives,False,2016-11-11T12:44:22.873-08:00,True,False,,,16846,False,1.0.0.47
Envoc,2014-05-12T14:41:08.967Z,Envoc.Directives,Envoc.Directives,False,2016-11-11T12:44:22.873-08:00,True,False,,,16846,False,1.0.0.46
TeamCity.Service,2014-05-12T15:11:04.143Z,Description,Foundation.FormBuilder,False,2014-11-05T06:38:24.137-08:00,True,False,,,6688,False,0.25.0
Dave Timmins,2014-05-12T20:27:32.647Z,"Json.NET implementation of an ISerializer to use with ArcGIS.PCL.

      To use just call JsonDotNetSerializer.Init().",ArcGIS.PCL.JsonDotNetSerializer,False,2014-11-24T11:13:24.47-08:00,True,False,Json.NET implementation of an ISerializer to use with ArcGIS.PCL.,"ArcGIS,PCL,Json,Serializer",3199,False,1.0.0
"Chris Sampson,James Goodenough",2014-05-11T17:58:28.21Z,"Service bus for cross platform development on iOS, Android, WinRT and Windows",SystemDotServiceBus,False,2014-05-22T13:10:56.687-07:00,True,False,"Service bus for cross platform development on iOS, Android, WinRT and Windows","ServiceBus,Bus,DDD,DDDD,Messaging,Cross,Platform",3832,False,1.1.8
James Craig,2014-05-12T17:28:04.203Z,"Craig's Utility Library is one of the largest collections of utility classes and extension methods for .Net. It includes code to help with tasks including encryption, compression, serialization, file management, email, image manipulation, SQL, various file formats (CSV, iCal, etc.), randomization, validation, math related classes, various data types, reflection, code gen, events, code profiling, etc.",CraigsUtilityLibrary-Validation,True,2016-08-22T09:47:56.717-07:00,True,False,This is the Validation namespace from Craig's Utility Library,"utility,utilities",49814,False,4.0.136-beta
Signere.no,2014-05-12T13:41:58.52Z,"Client library to communication with Signere.no REST API.
		The library contains relevant model classes and a client class with methods to access all resources provided in the Signere.no API. 
		The client class itself is implemented from an interface to make it easily testable.
		
		All explicit communication with the API is handled internally and translated to POCO objects. 
		The client methods require certain fields from Signere.no user credentials in order to work properly. 
		To create a user account and obtain these credentials, please visit signere.no .  
		
		Also, check out the REST API documentation at Https://api.signere.no for further details about the resources that can be accessed through this library.",Unipluss.Sign.ClientNET35,False,1900-01-01T00:00:00+00:00,False,False,,"Signere,Sign,BankID,Digital,signatur,Uni,Pluss,Signere.no",202521,False,1.0.1425
James Craig,2014-05-12T17:27:30.903Z,"Craig's Utility Library is one of the largest collections of utility classes and extension methods for .Net. It includes code to help with tasks including encryption, compression, serialization, file management, email, image manipulation, SQL, various file formats (CSV, iCal, etc.), randomization, validation, math related classes, various data types, reflection, code gen, events, code profiling, etc.",CraigsUtilityLibrary-Profiler,True,2016-08-22T09:47:39.963-07:00,True,False,This is the Profiler namespace from Craig's Utility Library,"utility,utilities",50194,False,4.0.136-beta
James Craig,2014-05-12T15:08:57.88Z,This adds LESS support to the Iron Man Framework.,Ironman.Core.Assets.Less,True,2016-08-22T09:51:02.54-07:00,True,False,This adds LESS support to the Iron Man Framework.,less,21489,False,1.0.134-beta
JustGiving,2014-05-12T10:15:13.627Z,"Ninject bindings for the JG EventStore Http subscriber, used for instantiating event handlers for subscribed messages",JustGiving.EventStore.Http.SubscriberHost.Ninject,False,2017-08-11T10:24:43.367+00:00,True,False,JustGiving.EventStore.Http.SubscriberHost.Ninject,"EventStore,event,store,soa,http,ninject,subscribe",18503,False,1.0.51
"Sam Saffron,Marc Gravell",2014-05-12T13:57:41.78Z,"A high performance Micro-ORM supporting Sql Server, MySQL, Sqlite, SqlCE, Firebird etc..",Dapper,False,2017-11-26T02:22:48.19+00:00,True,False,A high performance Micro-ORM,"orm,sql,micro-orm",6943881,False,1.23.0
Google Inc,2014-05-11T15:25:19.103Z,"Symbols for package 'fix8.dependencies.gtest'. This package should not likely be installed. 
(This is not the package you are looking for).",fix8.dependencies.gtest.symbols,False,2014-05-11T08:25:19.103-07:00,True,False,Symbols for for package 'fix8.dependencies.gtest',"GTEST,native,CoApp,nativepackage",990,False,1.7.20140509.1
Trevor Pilley and MicroLite Project Contributors,2014-05-11T14:49:17.867Z,"MicroLite ORM is a micro Object Relational Mapper for the .NET framework designed for ease of use, testability and extensibility.",MicroLite,False,2017-11-22T14:52:16.697+00:00,True,False,,"Micro,ORM,Framework,POCO,Database,SQL,Builder,MsSQL,MySQL,SQLite,PostgreSQL",24725,False,5.0.3
Jakub Pachansky,2014-05-12T21:38:00.997Z,R Scheduler Contracts,R.Scheduler.Contracts,False,2018-03-28T16:09:25.76+00:00,True,False,,"Scheduler,Contracts,Scheduler.Contracts,Scheduler.Interfaces,R.Scheduler,R",11682,False,0.0.0.2
"KORUS Consulting CIS,Ltd.",2014-05-12T06:58:37.673Z,Public Sphere.Courier API,Eds.Api.Public,False,2018-03-27T13:23:21.553+00:00,True,False,,,25903,False,12.2.0.44
Robert O'Brien,2014-05-12T14:12:18.697Z,A solution for adding Federated Identity Scaffolding to a Windows 8 WinRT Project. See Project Site link for more details.,FedId.WinRT.Project.Scaffolding,False,2014-05-12T14:12:18.71+00:00,True,False,,"wsfed,oauth,jwt,swt,winrt,sts,aad,acs,adfs,authn,authz",9324,False,1.7.0.9
Envoc,2014-05-12T18:36:42.483Z,Envoc.Directives,Envoc.Directives,False,2016-11-11T12:44:22.873-08:00,True,False,,,16846,False,1.0.0.49
James Craig,2014-05-12T15:07:13.26Z,"Craig's Utility Library is one of the largest collections of utility classes and extension methods for .Net. It includes code to help with tasks including encryption, compression, serialization, file management, email, image manipulation, SQL, various file formats (CSV, iCal, etc.), randomization, validation, math related classes, various data types, reflection, code gen, events, code profiling, etc.",CraigsUtilityLibrary,True,2016-08-22T09:48:39.393-07:00,True,False,One of the largest collections of utility classes and extension methods for .Net,"utility,utilities",106655,False,4.0.134-beta
