authors,created,description,id,is_prerelease,last_updated,listed,missing_info,summary,tags,total_downloads,verified,versionAtlassian Pty Ltd.,2013-02-22T02:48:33.047Z,Set of Core utils for Atlassian .NET development,Atlassian.Core,False,1900-01-01T00:00:00+00:00,False,False,,,8177,False,1.0.222.26
Exceptionless,2013-02-21T23:52:13.753Z,Exceptionless is a cloud based error reporting service that sends your exceptions to http://exceptionless.com and provides aggregated views and analytics.,Exceptionless.Mvc,True,2018-02-15T14:19:13.42+00:00,True,False,,"Error,Report,Reporting,Exception,Logging,Log",163392,True,0.9.0.512-pre
Exceptionless,2013-02-21T20:49:21.307Z,Exceptionless is a cloud based error reporting service that sends your exceptions to http://exceptionless.com and provides aggregated views and analytics.,Exceptionless.Web,True,2018-02-15T14:21:03.533+00:00,True,False,,"Error,Report,Reporting,Exception,Logging,Log",130384,True,0.9.0.510-pre
Exceptionless,2013-02-21T19:17:37.747Z,Exceptionless is a cloud based error reporting service that sends your exceptions to http://exceptionless.com and provides aggregated views and analytics.,Exceptionless.Windows,True,2018-02-15T14:21:56.363+00:00,True,False,,"Error,Report,Reporting,Exception,Logging,Log",119842,True,0.9.0.506-pre
Harry McIntyre,2013-02-22T16:01:43.383Z,Noodles transforms your object modelinto a web app. This is the core library without a dependency on ASP MVC,Noodles,False,2013-11-23T10:56:35.543-08:00,True,False,,,86888,False,1.1.382
Karsten N. Strand,2013-02-21T19:33:21.537Z,Pomona shared library between server and client.,Pomona.Common,True,2017-09-22T12:41:39.457+00:00,True,False,,"REST,linq,mapping",36739,False,0.1.2-alpha6
Framework One,2013-02-21T11:21:22.18Z,"CloudCore is an out-of-the-box, cloud-based enterprise foundation and business process automation platform that facilitates rapid and modular system development for the cloud.",CloudCore,False,1899-12-31T16:00:00-08:00,False,False,,,-1,False,1.0.0.144
Hibernating Rhinos,2013-02-21T15:51:50.247Z,"This package includes the client API of RavenDB. RavenDB is a document database for the .NET platform, offering a flexible data model design to fit the needs of real world systems.",RavenDB.Client,True,2018-03-30T12:13:14.39+00:00,True,False,This package includes the client API of RavenDB.,"nosql,ravendb,raven,document,database,client",1114390,True,2.0.2283-Unstable
SYSTEM,2013-02-22T13:44:40.973Z,Noodles transforms your object model into a web app. Install this library to use Noodles with Web Api,Noodles.WebApi,False,2013-11-23T10:56:58.177-08:00,True,False,,,39841,False,1.1.378
Maciek Misztal,2013-02-22T07:46:29.797Z,Nx.UI Library for cross-platform application developement,Nx.UI,False,2013-05-16T15:00:18.677-07:00,True,False,,,10502,False,0.0.40.22464
SYSTEM,2013-02-21T18:18:58.127Z,Noodles transforms your object model into a web app. Install this library to use Noodles with Web Api,Noodles.WebApi,False,2013-11-23T10:56:58.177-08:00,True,False,,,39841,False,1.1.373
Demis Bellot,2013-02-21T15:47:49.697Z,"Full details in Mvc PowerPack: http://servicestack.net/mvc-powerpack/
      Adapter classes to provide tight integration and re-usable functionality between ServiceStack and MVC3.
      Including adapters for: MiniProfiler, FluentValidation, Funq IOC Controller Factory, Funq Validator Factory
      ControllerBase (configured with access to ServiceStack's ICacheClient, ISession, typed UserSession dependencies).",StackExpress.Mvc,True,2013-05-05T16:45:43.937-07:00,True,False,.NET 4.0 project Integration of StackExpress with MVC3,"MiniProfiler,FluentValidation,MVC,Controller",65494,False,3.9.574-unstable
ReferEngine.com,2013-02-22T00:28:45.703Z,"ReferEngine.com is a facebook integration service for Windows Store Apps. Refer Engine offers app customers the ability to recommend the
      Windows app and earn rewards for the successful recommendations. You can register your all at www.referengine.com.",ReferEngine.Windows.Javascript,False,1899-12-31T16:00:00-08:00,False,False,ReferEngine.com is a facebook integration service for Windows Store Apps.,"ReferEngine,Refer,Engine,Apexa,Windows,Store",-1,False,0.2.0
Prasanna V L,2013-02-22T00:31:51.283Z,"Providers a clean, and fast implementation of MongoDB Session Provider for production environments.

Code: https://github.com/prasannavl/MongoSessionProvider",PVL.MongoSessionProvider,False,2014-02-26T16:21:45.99-08:00,True,False,An ASP.NET Session State Provider for MongoDB.,"mongodb,session",1762,False,1.0.0
Nexul Software LLC,2013-02-21T18:20:27.787Z,Common classes used by other Candor libraries.,Candor.Core,False,2015-09-29T22:35:31.69-07:00,True,False,,"Candor,Reflection,Provider,Paging",7610,False,0.6.1.30221
Acklen Avenue,2013-02-22T16:40:11.243Z,BDD-Style Extensions for MSTest,AcklenAvenue.Testing.BDD.MSTest,False,2013-07-03T09:44:20.773-07:00,True,False,,"Tag1,Tag2",4720,False,1.2.0.1
Jon Arild Torresdal,2013-02-21T22:32:18.287Z,"Note: This package is for extending the ConDep DSL. If you're looking for ConDep to do deployment or infrastructure as code, please use the ConDep package. ConDep is a highly extendable Domain Specific Language for Continuous Deployment, Continuous Delivery and Infrastructure as Code on Windows.",ConDep.Dsl,False,2016-12-06T04:12:57.487-08:00,True,False,,"Continuous,Deployment,Delivery,Infrastructure,WebDeploy,Deploy,msdeploy,IIS,automation,powershell,remote",65471,False,1.0.9
Eskat0n,2013-02-22T11:08:59.507Z,A pack of extension methods which improves your coding experience while using AutoMapper,NArms.AutoMapper,False,2014-04-08T02:32:42.337-07:00,True,False,,"AutoMapper,ExtensionMethods,Utility,NArms",3897,False,1.1.1
DeltaEngine,2013-02-22T18:06:08.74Z,"OpenGL Version of the Delta Engine, uses OpenTK. The Delta Engine is allows you to develop applications and especially games for many different platforms (mobile, tablets, console, PC) completely under Windows with .NET or native C++ by using your favorite tools.",DeltaEngine.OpenGL,False,2014-03-20T15:40:00.42-07:00,True,False,,"DeltaEngine,Delta,Engine,.NET,Windows,OpenGL,OpenTK,Open,Source,Multiplatform,Game,Development",3921,False,0.9.7.2
Atlassian Pty Ltd.,2013-02-22T02:56:39.563Z,Set of Core utils for Atlassian .NET development,Atlassian.Core,False,1900-01-01T00:00:00+00:00,False,False,,,8177,False,1.0.222.54
Exceptionless,2013-02-21T19:23:08.733Z,Exceptionless is a cloud based error reporting service that sends your exceptions to http://exceptionless.com and provides aggregated views and analytics.,Exceptionless.Wpf,True,2018-02-15T14:22:28.13+00:00,True,False,,"Error,Report,Reporting,Exception,Logging,Log",124899,True,0.9.0.507-pre
Paolo Possanzini,2013-02-21T16:25:41.47Z,"JoshuaCMS is a Content Management System for Microsoft asp.net mvc 4.

Default username: admin
Default password: root",Joshua.base,False,2014-06-24T00:48:02.153-07:00,True,False,,"mvc,cms,joshua,razor,jquery,azure",21744,False,3.0.165
Exceptionless,2013-02-21T23:52:12.597Z,Exceptionless is a cloud based error reporting service that sends your exceptions to http://exceptionless.com and provides aggregated views and analytics.,Exceptionless,True,2018-02-15T14:17:13.09+00:00,True,False,,"Error,Report,Reporting,Exception,Logging,Log",293079,True,0.9.0.512-pre
Probel,2013-02-21T18:11:04.123Z,Allow to manage remote statistics,Probel.NDoctor.Statistics,False,2013-02-24T10:45:27.52-08:00,True,False,,"nDoctor,statistics",4070,False,1.0.0.34232
Terry SoRelle,2013-02-22T19:51:35.643Z,Adds additional Type Script files and Templates to integrate Atlatl SPA framework with the Peanut framework.,Catapult.Peanut.Atlatl,True,2013-04-05T11:06:14.723-07:00,True,False,,"Catapult,Peanut,Atlatl",3052,False,1.0.7-Beta
Michael Lang,2013-02-21T18:23:59.933Z,"An MVC AccountController with corresponding view models, and views.  When installed the added files will adopt your project's root namespace.",Candor.Web.Mvc.Security,False,2013-12-29T20:27:34.89-08:00,True,False,,"candor,mvc,security",1507,False,0.6.1.30221
Microsoft,2013-02-22T16:02:01.267Z,"Noodles transforms your object model into a web app. Install this library to customise the cshtml template files, or if you don't want to use the EmbeddedResourceVirtualPathProvider to load your views",Noodles.AspMvc.Templates,False,2013-11-23T10:56:53.3-08:00,True,False,,,40469,False,1.1.382
Acid Media,2013-02-22T14:35:27.077Z,Mobiscroll package for jqMobi,Mobiscroll-jqMobi,False,2014-10-22T05:57:48.487-07:00,True,False,A wheel scroller user control optimized for touchscreens to easily enter date and/or time. The control can easily be customized to support any custom values.,"jqMobi,JavaScript,datepicker,timepicker,touchscreen,Webkit,android,iPhone,iPad,webapps,GalaxyTab,dropdown,mobile,wheel,senseui",8592,False,2.4.4
Microsoft,2013-02-22T16:01:52.097Z,Noodles transforms your object model into a web app. This assembly contains stuff to make Noodles work with ASP MVC,Noodles.AspMvc,False,2013-11-23T10:56:42.207-08:00,True,False,,,41585,False,1.1.382
DevScope,2013-02-22T13:53:57.593Z,S4S is a SDK that will allow you to create custom controls for your application enabling accessibility on them. This includes resizing the controls and their fontsize or enabling scroll helpers to remove the swipe motion.,S4S,False,2014-02-18T09:43:34.823-08:00,True,False,,,6504,False,1.0.3
EastBanc Technologies,2013-02-22T17:53:55.35Z,MVVM for Windows 8,w8mvvm,False,2013-05-28T11:25:01.737-07:00,True,False,,"MVVM,Windows,8,store",1932,False,1.0.0.5
Maciek Misztal,2013-02-22T08:31:37.53Z,Core Nx Library for cross-platform application developement,Nx.Core,False,1899-12-31T16:00:00-08:00,False,False,,,17730,False,0.0.41.22466
Hibernating Rhinos,2013-02-21T15:09:22.1Z,"This package let you include RavenDB embedded in-process with your application. RavenDB is a document database for the .NET platform, offering a flexible data model design to fit the needs of real world systems.",RavenDB.Embedded,True,1900-01-01T00:00:00+00:00,False,False,This package let you include RavenDB embedded in-process with your application.,"nosql,ravendb,raven,document,database,embedded",544004,True,2.5.2506-Unstable
Hibernating Rhinos,2013-02-21T15:51:37.963Z,RavenDB embedded database,RavenDB.Bundles.IndexReplication,True,2018-02-22T21:29:30.903+00:00,True,False,,"nosql,ravendb,raven,document,database,bundles",115350,True,2.0.2283-Unstable
SYSTEM,2013-02-22T13:36:48.433Z,Noodles transforms your object modelinto a web app. This is a library to integrate Noodles with AJAX jquery datatables,Noodles.AspMvc.DataTables,False,2013-11-23T10:56:48.06-08:00,True,False,,,40219,False,1.1.377
Harry McIntyre,2013-02-22T17:19:07.353Z,Noodles transforms your object modelinto a web app. This is the core library without a dependency on ASP MVC,Noodles,False,2013-11-23T10:56:35.543-08:00,True,False,,,86888,False,1.1.384
JoobMobile,2013-02-22T02:35:21.46Z,"JoobMobile Client for .net 4.5 / Windows 8 / Windows Phone 8
Alpha package to test nuget installation and see whats broken. Not currently recommended for installation.",JoobMobile,False,1899-12-31T16:00:00-08:00,False,False,,,18999,False,3.1.0.59
Exceptionless,2013-02-21T17:58:32.847Z,Exceptionless is a cloud based error reporting service that sends your exceptions to http://exceptionless.com and provides aggregated views and analytics.,Exceptionless.WebApi,True,2018-02-15T14:21:30.19+00:00,True,False,,"Error,Report,Reporting,Exception,Logging,Log",144636,True,0.9.0.503-pre
"Software By Ben,Ben Scott,swxben,belfryimages",2013-02-22T05:49:30.8Z,A small library of Winforms based dialogs and helpers,swxben.Windows.Forms,False,2013-08-11T00:10:15.843-07:00,True,False,A small library of Winforms based dialogs and helpers,"forms,winforms,windows",3316,False,1.7.0
GMT Europe B.V.,2013-02-22T08:07:36.567Z,.NET TCP/IP protocol based on Protobuf.Net with support for asynchronous AJAX communication.,ProtoChannel,False,2013-03-22T06:02:04.727-07:00,True,False,,,1975,False,1.12.3
Exceptionless,2013-02-21T18:38:20.377Z,Exceptionless is a cloud based error reporting service that sends your exceptions to http://exceptionless.com and provides aggregated views and analytics.,Exceptionless,True,2018-02-15T14:17:13.09+00:00,True,False,,"Error,Report,Reporting,Exception,Logging,Log",293079,True,0.9.0.504-pre
Alberto Chvaicer,2013-02-21T21:33:48.527Z,A project to call stored procedures in a neat way,Neat.Procedure,False,2013-07-05T07:28:40.117-07:00,True,False,,"StoredProcedure,Stored,Procedure,ADO.Net",1990,False,1.0.1
Microsoft,2013-02-21T18:06:22.877Z,Library for walking an object tree as if it were a DOM,Walkies,False,2013-02-21T10:06:22.877-08:00,True,False,,,9928,False,1.2.38
SYSTEM,2013-02-22T13:36:57.09Z,Noodles transforms your object model into a web app. Install this library to use Noodles with Web Api,Noodles.WebApi,False,2013-11-23T10:56:58.177-08:00,True,False,,,39841,False,1.1.377
Probel,2013-02-22T18:20:02.637Z,Allow to manage remote statistics,Probel.NDoctor.Statistics,False,2013-02-24T10:45:27.52-08:00,True,False,,"nDoctor,statistics",4070,False,1.0.3.155
SYSTEM,2013-02-22T10:43:15.08Z,Noodles transforms your object model into a web app. Install this library to use Noodles with Web Api,Noodles.WebApi,False,2013-11-23T10:56:58.177-08:00,True,False,,,39841,False,1.1.375
Pablo Cibraro,2013-02-21T20:12:29.907Z,Hawk Http Authentication,HawkNet,False,2015-11-19T03:29:32.58-08:00,True,False,,"Auth,Security,Hawk",26620,False,1.1.0.1
CubeBuild Team,2013-02-21T23:21:30.877Z,This plugin provides profile management to the CubeBuild CMS Framework.,CubeBuild.Membership,False,2013-03-11T00:20:54.847-07:00,True,False,,"cms,mvc",2915,False,1.3.4801.18573
Matteo Migliore,2013-02-22T14:32:58Z,Simplify the adoption of the MVVM pattern using WPF.,EyeSoft.Wpf.Facilities,False,2013-11-11T09:31:42.457-08:00,True,False,,"MVVM,AOP,DialogService,MessageBroker,mediator,conventions",42366,False,0.2.3.90
DevScope,2013-02-22T17:59:04.863Z,S4S is a SDK that will allow you to create custom controls for your application enabling accessibility on them. This includes resizing the controls and their fontsize or enabling scroll helpers to remove the swipe motion.,S4S,False,2014-02-18T09:43:34.823-08:00,True,False,,,6504,False,1.0.5.1
Exceptionless,2013-02-21T19:23:04.673Z,Exceptionless is a cloud based error reporting service that sends your exceptions to http://exceptionless.com and provides aggregated views and analytics.,Exceptionless.Mvc,True,2018-02-15T14:19:13.42+00:00,True,False,,"Error,Report,Reporting,Exception,Logging,Log",163392,True,0.9.0.507-pre
Microsoft,2013-02-21T19:38:22.93Z,Noodles transforms your object model into a web app. This assembly contains stuff to make Noodles work with ASP MVC,Noodles.AspMvc,False,2013-11-23T10:56:42.207-08:00,True,False,,,41585,False,1.1.374
Librame/Rongstar,2013-02-22T07:43:05.46Z,Librame for .NET Framework (Support 3.5+),Librame.Web,False,1899-12-31T16:00:00-08:00,False,False,Librame for .NET Framework (Support 3.5+),"Tags:,Librame,ASP.NET,C#,Framework,Utility",-1,False,1.3.2.2235
KellermanSoftware,2013-02-21T18:35:33.717Z,"Commercial ORM and LINQ Provider.  Features: Auto Mapping, Generate Classes from Tables, Generate Tables from Classes, Synchronize Classes to Tables, Generic ADO.NET Wrapper, LINQ Provider support for SQL Server, Oracle, MySQL, VistaDB, Firebird, SQLite, and Microsoft Access.",KnightDataAccessLayer,False,2017-04-27T17:33:57.97-07:00,True,False,"Commercial ORM and LINQ Provider.  Features: Auto Mapping, Generate Classes from Tables, Generate Tables from Classes, Synchronize Classes to Tables, Generic ADO.NET Wrapper, LINQ Provider support for SQL Server, Oracle, MySQL, VistaDB, Firebird, SQLite, and Microsoft Access.","ORM,LINQ,Provider,generator,ADO.NET,SQL,Server,MySQL,Oracle,Firebird,Sqlite,Microsoft,Access,VistaDB",6058,False,1.13.0
SYSTEM,2013-02-21T19:11:59.02Z,"Install this project if you want to edit the FormFactory templates, or if you don't want to use the EmbeddedResourceVirutalPathProvider",FormFactory.Templates,False,2018-03-12T09:51:54.47+00:00,True,False,,,53611,False,1.2.239
mminns,2013-02-21T23:12:36.01Z,Description,CodeBetter.JohnVPetersen.ApiDocumentation,False,1899-12-31T16:00:00-08:00,False,False,,,-1,False,1.0.130.137
Harry McIntyre,2013-02-22T13:44:20.977Z,Noodles transforms your object modelinto a web app. This is the core library without a dependency on ASP MVC,Noodles,False,2013-11-23T10:56:35.543-08:00,True,False,,,86888,False,1.1.378
Harry McIntyre,2013-02-21T19:43:36.637Z,"FormFactory generates HTML forms from object models, using conventions and a semantic model. See http://formfactory.apphb.com/",FormFactory,False,2018-03-12T09:51:06.5+00:00,True,False,,,91805,False,1.2.240
"Terry SoRelle,Catapult Systems",2013-02-22T19:49:41.673Z,Peanut Framework WebApi Classes,CatapultSystems.Services.WebApi,False,2013-04-02T09:43:05.143-07:00,True,False,,"Catapult,Peanut",2073,False,1.0.0.4
Framework One,2013-02-21T14:18:23.59Z,"CloudCore is an out-of-the-box, cloud-based enterprise foundation and business process automation platform that facilitates rapid and modular system development for the cloud.",CloudCore,False,1899-12-31T16:00:00-08:00,False,False,,,-1,False,1.0.0.149
S. van Deursen,2013-02-22T02:45:14.663Z,"
      This package contains no logic and is included for backwards compatibility.
    ",SimpleInjector.Extensions,True,1899-12-31T16:00:00-08:00,False,False,"
      This package contains no logic and is included for backwards compatibility.
    ",,-1,False,2.0.0-beta5
Media Browser Team,2013-02-22T06:00:14.38Z,Contains core components required to build plugins for Media Browser Server.,MediaBrowser.Server.Core,False,2018-04-14T14:59:39.967+00:00,True,False,,,136986,False,1.0.0
Hibernating Rhinos,2013-02-21T16:27:52.713Z,RavenDB Client MvcIntegration let you include a visual profiler in your ASP.NET MVC application which will show you all the opened sessions and the time took to complete each database request. This can help you when developing with RavenDB.,RavenDB.Client.MvcIntegration,True,1900-01-01T00:00:00+00:00,False,False,A visual profiler for RavenDB that you can use in your ASP.NET MVC application.,"nosql,ravendb,raven,document,database,client,mvc",240462,True,2.5.2507-Unstable
Microsoft,2013-02-22T10:43:10.077Z,"Noodles transforms your object model into a web app. Install this library to customise the cshtml template files, or if you don't want to use the EmbeddedResourceVirtualPathProvider to load your views",Noodles.AspMvc.Templates,False,2013-11-23T10:56:53.3-08:00,True,False,,,40469,False,1.1.375
Atlassian Pty Ltd.,2013-02-22T02:46:22.747Z,Set of Core utils for Atlassian .NET development,Atlassian.Core,False,1900-01-01T00:00:00+00:00,False,False,,,8177,False,1.0.222.22
Atlassian Pty Ltd.,2013-02-22T02:45:17.707Z,Set of Core utils for Atlassian .NET development,Atlassian.Core,False,1900-01-01T00:00:00+00:00,False,False,,,8177,False,1.0.222.20
Fareportal,2013-02-21T20:04:03.333Z,MobileWeb,MobileWeb,False,1899-12-31T16:00:00-08:00,False,False,,,-1,False,0.0.3
Hibernating Rhinos,2013-02-21T15:10:07.937Z,"This package includes a utiliti class that helps test features of RavenDB. RavenDB is a document database for the .NET platform, offering a flexible data model design to fit the needs of real world systems.",RavenDB.Tests.Helpers,True,1900-01-01T00:00:00+00:00,False,False,This package includes a utiliti class that helps test features of RavenDB.,"nosql,ravendb,raven,document,database,test",241455,True,2.5.2506-Unstable
Pragmagile,2013-02-22T15:28:26.8Z,A DataSourceControl using O/R Mapster to data-bound controls.,ORMapster.Web.UI,False,2016-09-24T22:41:44.977-07:00,True,False,,,1753,False,4.5.2013.222
Demis Bellot,2013-02-22T00:42:53.007Z,"Common library dependency for other StackExpress projects.
      Includes JSON, XML, JSV and SOAP Generic Service Clients.
      Contains:
      - StackExpress.Interfaces
      - StackExpress.Common
      Dependenies:
      - StackExpress.Text",StackExpress.Common,True,2013-05-05T16:45:38.26-07:00,True,False,Opensource .NET and Mono REST Web Services framework,"StackExpress,Common,Framework",66824,False,3.9.575-unstable
Media Browser Team,2013-02-22T05:35:05.033Z,Contains common model objects and interfaces used by all Media Browser solutions.,MediaBrowser.Common,False,2018-04-14T14:59:42.14+00:00,True,False,,,142997,False,1.0.0
Demis Bellot,2013-02-22T00:43:10.923Z,Add the ProtoBuf binary format and endpoint to a StackExpress web service host.,StackExpress.Plugins.ProtoBuf,True,2013-05-05T16:45:58.313-07:00,True,False,ProtoBuf Format Serializer ContentType ServiceClients for StackExpress,"ProtoBuf,Fast,Binary,Serializer,Format,ContentType,StackExpress,REST,Web,Services",65377,False,3.9.575-unstable
Rongstar,2013-02-22T07:41:50.447Z,Librame for .NET Framework (Support 3.5+),Librame.Core,False,1899-12-31T16:00:00-08:00,False,False,Librame for .NET Framework (Support 3.5+),"Librame,ASP.NET,C#,Framework,Utility",-1,False,1.3.2.2235
Exceptionless,2013-02-22T18:23:22.897Z,Exceptionless is a cloud based error reporting service that sends your exceptions to http://exceptionless.com and provides aggregated views and analytics.,Exceptionless.Wpf,True,2018-02-15T14:22:28.13+00:00,True,False,,"Error,Report,Reporting,Exception,Logging,Log",124899,True,0.9.0.517-pre
Demis Bellot,2013-02-21T15:47:36.117Z,"Adds OpenId Auth Providers for use in StackExpress Web and REST Services. 
        Includes built-in support for Google, Yahoo, MyOpenId and Custom OpenId providers.
        
        More Info on Auth Providers: 
        https://github.com/ServiceStack/ServiceStack/wiki/Authentication-and-authorization",StackExpress.Authentication.OpenId,True,2013-05-05T16:45:29.547-07:00,True,False,"OpenId Auth Providers for StackExpress - inc. Google, Yahoo, MyOpenId","OpenId,Google,Yahoo,MyOpenId,Authentication,Auth,Provider,ServiceStack,REST,Web,Services",65454,False,3.9.574-unstable
HexaSystems Inc.,2013-02-22T18:05:17.047Z,Hexa.Core is HexaSystems implementation of the Domain Driven Design Architecture. Also providing a set of helper classes for ASP.Net and WCF development.,Hexa.Core,False,1899-12-31T16:00:00-08:00,False,False,Hexa.Core is HexaSystems implementation of the Domain Driven Design Architecture.,DDD,-1,False,3.0.0.3
Euroling AB,2013-02-22T12:39:54.843Z,SiteSeeker integration module for EPiServer,SiteSeeker.EPiServer,True,1899-12-31T16:00:00-08:00,False,False,,"SiteSeeker,EPiServer,Search,module",39828,False,4.2.66-beta81
Haitch,2013-02-21T19:56:01.177Z,TFS WinRT Library,Microsoft.TFS.RTLib,False,2013-07-22T14:00:08.673-07:00,True,False,,"TFS,WinRT",2826,False,1.0.0.4
Probel,2013-02-21T22:02:50.433Z,Allow to manage remote statistics,Probel.NDoctor.Statistics,False,2013-02-24T10:45:27.52-08:00,True,False,,"nDoctor,statistics",4070,False,1.0.2.41471
Todd,2013-02-22T06:59:12.983Z,Html Extensions to render Bootstrap in Razor.,Views4Mvc,False,2013-09-30T06:50:18.447-07:00,True,False,,,2580,False,0.5.0.5
Harry McIntyre,2013-02-22T15:22:32.143Z,"FormFactory generates HTML forms from object models, using conventions and a semantic model. See http://formfactory.apphb.com/",FormFactory,False,2018-03-12T09:51:06.5+00:00,True,False,,,91805,False,1.2.242
Hibernating Rhinos,2013-02-22T13:51:49.313Z,"Use this package if you want extend RavenDB. Don't use this package if you just want to work with existing RavenDB server, in order to so just use the client API which is in the RavenDB.Client package. RavenDB is a document database for the .NET platform, offering a flexible data model design to fit the needs of real world systems.",RavenDB.Database,True,1900-01-01T00:00:00+00:00,False,False,This package allows you to extend RavenDB database.,"nosql,ravendb,raven,document,database",659272,True,2.0.2284-Unstable
Salar Khalilzadeh,2013-02-23T05:26:08.24Z,"Provides an independent date and time to system, which should be synced by server. Suitable for client-server applications.",IndieDateTime,False,2013-02-22T21:26:08.24-08:00,True,False,,"DateTime,Client,Server,Independent,Indie",640,False,1.0.4
Microsoft,2013-02-21T12:04:31.723Z,Turn a non queryable data source into a (limited) IQueryable. https://github.com/mcintyre321/DelegateQueryable,DelegateQueryable,False,1899-12-31T16:00:00-08:00,False,False,,,-1,False,1.2.5
Microsoft,2013-02-22T04:08:34.94Z,The Silverlight 5 Toolkit MSTest testing support package. Contains all the assemblies required to do unit testing for your Silverlight project. Packaged by Singulink (www.singulink.com) as apparently no more love is being shown by Microsoft for Silverlight :(,Silverlight5Toolkit-Testing,False,1899-12-31T16:00:00-08:00,False,False,,"silverlight,toolkit,sltoolkit,unit,testing,mstest",-1,False,5.2012.5.1
Erik Källén,2013-02-21T20:18:35.433Z,This package contains file necessary to develop plugins for the Saltarelle C# to Javascript compiler. This package is NOT needed during normal usage.,Saltarelle.Compiler.ExtensibilityDevelopment,False,2015-07-29T07:13:48.813-07:00,True,False,,,4228,False,2.0.3
Remo Gloor,2013-02-22T15:32:42.73Z,Ninject extension to add ioc for WCF services when self hosting.,Ninject.Extensions.Wcf.Selfhost,True,2017-10-29T09:58:49.573+00:00,True,False,Ninject extension to add ioc for WCF services when self hosting.,"Ninject,ioc,di,wcf",34382,False,3.0.2-unstable-1
Simon Bartlett,2013-02-22T05:26:48.317Z,A geospatial library for .NET,Geo,False,2016-04-09T13:29:17.803-07:00,True,False,,"geo,spatial,gps,coordinates,wgs84,geography,WKT,WKB,GeoJSON,GPX,IGC,NMEA,Garmin,PocketFMS,SkyDemon",22125,False,0.10.0
