authors,created,description,id,is_prerelease,last_updated,listed,missing_info,summary,tags,total_downloads,verified,version"Jeremy D. Miller,Dru Sellers,et al.",2013-08-06T12:34:27.467Z,Shared libraries for runtime and deployment packaging of .Net applications,Bottles,False,2016-01-05T05:44:00.873-08:00,True,False,,"packaging,areas,slices",75719,False,1.1.0.533
"Steffen Forkmann,Mauricio Scheffer,Colin Bull",2013-08-06T16:59:49.62Z,FAKE - F# Make - is a build automation tool for .NET. Tasks and dependencies are specified in a DSL which is integrated in F#.,FAKE,False,2018-04-15T16:37:14.193+00:00,True,False,,build,1440554,False,1.74.252
ForexClub,2013-08-06T19:02:25.503Z,Shared classe for all projects.,Fx.Common,True,1899-12-31T16:00:00-08:00,False,False,,"fxclub,fxcommon,fx.common",-1,False,1.0.0.41464-beta
ForexClub,2013-08-06T20:49:43.597Z,Build from svn-trunk (executer),Fx.RemoteAdmin.Server,True,1899-12-31T16:00:00-08:00,False,False,,"fxclub,fx.remoteadmin,fxremoteadmin",-1,False,1.0.4967.1459-beta
"Steffen Forkmann,Mauricio Scheffer,Colin Bull",2013-08-06T15:36:42.387Z,FAKE - F# Make - is a build automation tool for .NET. Tasks and dependencies are specified in a DSL which is integrated in F#.,FAKE,True,2018-04-15T16:37:14.193+00:00,True,False,,build,1440554,False,2.1.241-alpha
Accela Inc.,2013-08-06T01:04:10.207Z,Accela SDK for Windows 8 & Windows Phone 8,AccelaSDK,False,2014-10-16T03:11:06.763-07:00,True,False,,AccelaSDK,12559,False,3.0.2.1
"Steffen Forkmann,Mauricio Scheffer,Colin Bull",2013-08-06T09:20:03.853Z,FAKE - F# Make - is a build automation tool for .NET. Tasks and dependencies are specified in a DSL which is integrated in F#.,FAKE,True,2018-04-15T16:37:14.193+00:00,True,False,,build,1440554,False,2.1.239-alpha
"Jonathan Goldman,Colin Anderson",2013-08-06T13:46:06.017Z,"MsgPack serializer for Chinchilla, the little library that makes RabbitMQ awesome",Chinchilla.Serializers.MsgPack,False,2017-12-18T17:10:10.36+00:00,True,False,"MsgPack serializer for Chinchilla, the little library that makes RabbitMQ awesome","rabbitmq,management,api,http,chinchilla",6143,False,0.1.14.1
ForexClub,2013-08-06T20:49:09.113Z,Build from svn-trunk (executer),Fx.AppServer.ConfigurationUI,True,1899-12-31T16:00:00-08:00,False,False,,"fxclub,fxappserver,fx.appserver",-1,False,1.0.4967.1462-beta
Ivan A. Petrov,2013-08-06T13:32:51.053Z,This package integrates Paymill into your Sitefinity Project.,PaymillPaymentProcessor,False,1899-12-31T16:00:00-08:00,False,False,,,-1,False,1.0.0
ForexClub,2013-08-06T19:04:01.37Z,Shared classe for all projects.,Fx.Common.SL,True,1899-12-31T16:00:00-08:00,False,False,,"fxclub,fxcommon,fxcommonsl,fx.common,Fx.Common.SL,fxsl",-1,False,1.0.0.41509-beta
Jake Ginnivan,2013-08-06T17:29:13.663Z,Adds Autofac support to VSTO Contrib,VSTOContrib.Autofac,False,2013-11-25T13:18:42.04-08:00,True,False,,"VSTO,Office,Autofac,IoC",1227,False,0.12.0.98
Daniel Lo Nigro,2013-08-06T11:32:28.92Z,"JavaScript URL routing for ASP.NET MVC. Allows you to use your ASP.NET MVC routes from JavaScript. Please refer to project site (https://github.com/Daniel15/RouteJs) for more details, usage examples and sample code.",RouteJs.Mvc2,False,2017-07-01T13:31:39.88-07:00,True,False,,"asp.net,mvc,asp,routing,route,url,ajax,jquery,javascript,js",3001,False,1.1.2
ForexClub,2013-08-06T20:51:38.637Z,Build from svn-trunk (executer),Fx.AppServer.DefaultTemplate,True,1899-12-31T16:00:00-08:00,False,False,,"fxclub,fxappserver,fx.appserver",-1,False,1.1.4967.1534-beta
ForexClub,2013-08-06T21:47:29.217Z,Base socket system,Fx.SocketSystem.Extensions,True,1899-12-31T16:00:00-08:00,False,False,,"fxclub,fxsocketsystem,fx.socketsystem",-1,False,1.0.4967.3206-beta
mookid8000,2013-08-06T17:38:54.013Z,Provides MongoDB saga persister and subscription storage,Rebus.MongoDb,False,2017-08-15T22:41:41.72+00:00,True,False,,"rebus,mongodb",67668,False,0.35.0
Harry McIntyre,2013-08-06T20:07:16.013Z,"Install this project to customise the cshtml templates, or if you don't want to use the EmbeddedResourceVirtualPathProvider",Mvc.JQuery.Datatables.Templates,False,2018-02-13T13:33:15.63+00:00,True,False,,,50743,False,1.2.65
ForexClub,2013-08-06T21:01:45.967Z,Build from svn-trunk (executer),Fx.AppServer.DefaultTemplate,True,1899-12-31T16:00:00-08:00,False,False,,"fxclub,fxappserver,fx.appserver",-1,False,1.1.4967.1826-beta
"Joshua Arnold,Jeremy D. Miller,et al.",2013-08-06T12:45:13.297Z,Helpers to bootstrap FubuValidation for StructureMap,FubuValidation.StructureMap,False,2014-03-01T07:58:09.03-08:00,True,False,,"fubu,validation,fubumvc,conventional",925,False,0.9.4.823
Leon Meijer,2013-08-06T10:09:18.357Z,Part of the Co-Console SDK. Use this package to connect to the Co-Console API.,Lucy.CoConsole.ApiClient.Actions.Win32,False,2017-11-07T08:58:35+00:00,True,False,,,8192,False,1.8.5.56
"Jeremy D. Miller,Joshua Arnold,Corey Kaylor",2013-08-06T12:44:54.413Z,Small library of classes to easily write integration tests against FubuMVC applications hosted by Kayak,FubuMVC.TestingHarness,False,2014-03-01T07:57:28.373-08:00,True,False,,"web,framework,mvc,fubumvc",1496,False,1.1.0.1542
Avi Avni,2013-08-06T11:29:59.007Z,My ui infrastructure for wpf,Avi.Toolbox,False,2015-03-04T01:41:17.777-08:00,True,False,,"wpf,ui,control,prism",2939,False,1.0.1
Van Thoai Nguyen,2013-08-07T04:03:40.4Z,"Burrow.Extras provide DependencyInjection TunnelFactory, JsonSerializer and RabbitSetup which help to create Exchanges and Queues programmatically. YOU DON'T NEED TO DOWNLOAD BURROW.RPC IF YOU DON'T USE RPC IN YOUR CODE.",Burrow.Extras,False,2016-04-04T21:12:15.167-07:00,True,False,Burrow.Extras provides extra utilities for Burrow.NET such as supporting publishing to priority queues,"Burrow,Burrow.NET,RabbitMQ,RabbitMQ-client,AMQP,Burrow.Extras",10371,False,1.0.20
Ed Charbeneau,2013-08-06T13:32:03.047Z,Core SCSS (Sass) and JavaScript files for Foundation framework. For the complete package install Foundation4.MVC4.Sass,Foundation4.Core.Sass,False,2013-08-06T06:32:03.063-07:00,True,False,Core SCSS (Sass) and JavaScript files for Foundation framework. For the complete package install Foundation4.MVC4.Sass,,7977,False,4.3.1
Jason Jarrett,2013-08-06T13:04:21.01Z,TypeScript Definitions (d.ts) for sugar. Generated based off the DefinitelyTyped repository [git commit: a4165810a32f8fbf3a3bfefaacc9c75fc2268ca3]. http://github.com/DefinitelyTyped,sugar.TypeScript.DefinitelyTyped,False,2016-10-03T07:04:18.027-07:00,True,False,,"TypeScript,JavaScript",7307,False,0.0.6
Falafel Software,2013-08-06T22:55:38.847Z,Core Falafel library for Sitefinity CMS.,Falafel.Sitefinity,False,1899-12-31T16:00:00-08:00,False,False,,"Sitefinity,Falafel",-1,False,1.0.4.8
ForexClub,2013-08-06T20:51:17.94Z,>Build from svn-trunk (executer),Fx.AppServer,True,1899-12-31T16:00:00-08:00,False,False,,"fxclub,fxappserver,fx.appserver",-1,False,1.0.4967.1531-beta
eXpand,2013-08-06T11:11:21.473Z,ConditionalObjectView Module  / eXpand Framework,eXpandConditionalObjectView,False,2013-08-09T07:40:48.087-07:00,True,False,ConditionalObjectView Module / eXpand Framework,"DevExpress,eXpand",5825,False,13.1.5.18
David Robert Morgan,2013-08-06T04:37:15.903Z,Create view models for Mvc3 by placing attributes on your existing domain models.,DomainViewModels,False,2013-08-07T04:18:26.08-07:00,True,False,,"MVC3,ViewModel",745,False,1.0.0
Kazi Manzur Rashid.,2013-08-06T19:38:04.723Z,Provides GitHub OAuth2 SignIn support.,Community.Owin.Security.GitHub,True,1899-12-31T16:00:00-08:00,False,False,,"OWIN,GitHub,OAuth2,OAuth,Security",-1,False,1.1.0-beta2-20604-000
"Jeremy D. Miller,Joshua Arnold,Corey Kaylor",2013-08-06T12:44:30.737Z,Quickstart nuget for using FubuMVC with the Spark engine and Twitter Bootstrap,FubuMVC.QuickStart.Spark,False,2013-12-16T12:01:55.28-08:00,True,False,,"web,framework,mvc,spark",1202,False,1.0.0.200
imaya,2013-08-07T02:32:12.293Z,"compact zlib, deflate, inflate, zip library in JavaScript",zlib.js,False,2013-08-06T19:32:12.293-07:00,True,False,,"zlib,javascript",931,False,0.1.7
"Steffen Forkmann,Mauricio Scheffer,Colin Bull",2013-08-06T16:14:18.777Z,FAKE - F# Make - is a build automation tool for .NET. Tasks and dependencies are specified in a DSL which is integrated in F#.,FAKE,False,2018-04-15T16:37:14.193+00:00,True,False,,build,1440554,False,1.74.251
eXpand,2013-08-06T11:13:50.787Z,TreelistView Module (Web) / eXpand Framework,eXpandTreelistViewWeb,False,2018-04-09T16:23:30.6+00:00,True,False,TreelistView Module (Web) / eXpand Framework,"DevExpress,eXpand",68262,False,13.1.5.18
eXpand,2013-08-06T11:11:03.873Z,AdditionalViewControlsProvider Module (Web) / eXpand Framework,eXpandAdditionalViewControlsProviderWeb,False,2018-04-09T16:09:20.143+00:00,True,False,AdditionalViewControlsProvider Module (Web) / eXpand Framework,"DevExpress,eXpand",72346,False,13.1.5.18
Jake Ginnivan,2013-08-06T18:50:13.767Z,Enabled Hypermedia support in Asp.net Web API using the HAL mediatype,WebApi.Hal,False,2018-03-19T12:16:49.803+00:00,True,False,,"Hypermedia,Asp.net,WebApi,Json,Xml,HAL",62028,False,2.0.0.5
"Steffen Forkmann,Mauricio Scheffer,Colin Bull",2013-08-06T17:00:16.713Z,FAKE - F# Make - is a build automation tool for .NET. Tasks and dependencies are specified in a DSL which is integrated in F#.,FAKE,True,2018-04-15T16:37:14.193+00:00,True,False,,build,1440554,False,2.1.245-alpha
ForexClub,2013-08-06T21:01:35.847Z,Build from svn-trunk (executer),Fx.AppServer.ConfigurationUI,True,1899-12-31T16:00:00-08:00,False,False,,"fxclub,fxappserver,fx.appserver",-1,False,1.0.4967.1824-beta
Jeremy D. Miller,2013-08-06T12:44:15.43Z,Run FubuMVC applications using Katana and OWIN,FubuMVC.Katana,False,2016-01-05T05:45:10.537-08:00,True,False,,"web,framework,specification,fubumvc",3736,False,1.1.0.1542
"Rollins,Inc.",2013-08-06T20:43:52.267Z,Utilities & extensions to make programming in .NET easier.,Rolcore,False,2013-08-28T09:22:25.437-07:00,True,False,,Utilities,8026,False,0.0.4966.28094
王建川,2013-08-06T08:24:58.743Z,玄峰.Net公共类，提供.Net开发中常用的方法和属性，功能非常非常的强大，部分代码都是原创，也有一部分是互联网上收集而来。免费分享给大家，让我们的开会更快捷。,ExfSoft.Common,False,2016-11-19T00:19:33.04-08:00,True,False,玄峰.Net公共类，提供.Net开发中常用的方法和属性，功能非常非常的强大，部分代码都是原创，也有一部分是互联网上收集而来。免费分享给大家，让我们的开会更快捷。,"exfsoft,.net,Helper",13196,False,1.3.4
"Lars Beckmann,Bo Jensen",2013-08-06T08:49:42.067Z,This is the SulumSolver library for the Optimization.Framework. The Optimization.Framework allows you to use C# as a modelling language for mathematical optimization. It furthermore allows you to use solvers as services.,Optimization.Solver.Sulum,False,2014-11-04T04:10:44.723-08:00,True,False,This is the SulumSolver library for the Optimization.Framework. The Optimization.Framework allows you to use C# as a modelling language for mathematical optimization. It furthermore allows you to use solvers as services.,,13557,False,0.1.43
Devlin Liles and Tim Rayburn,2013-08-06T19:07:10.497Z,The fastest and smoothest way to great architecture,Highway.Insurance.UI,False,2013-09-03T12:23:52.847-07:00,True,False,,"Architecture,CodedUI,Testing,UI,Automation,QA,Productivity",5632,False,1.0.1.8
mookid8000,2013-08-06T17:39:08.633Z,Provides a Unity container adapter for Rebus,Rebus.Unity,False,2017-08-15T22:47:07.983+00:00,True,False,,"rebus,unity,di,dependencyInjection,ioc,inversionOfControl",63076,False,0.35.0
ForexClub,2013-08-06T19:04:10.333Z,Base socket system,Fx.SocketSystem.Domain,True,1899-12-31T16:00:00-08:00,False,False,,"fxclub,fxsocketsystem,fx.socketsystem",-1,False,1.0.0.41511-beta
eXpand,2013-08-06T11:11:34.753Z,ExceptionHandling Module (Win) / eXpand Framework,eXpandExceptionHandlingWin,False,2015-04-27T12:08:01.677-07:00,True,False,ExceptionHandling Module (Win) / eXpand Framework,"DevExpress,eXpand",56784,False,13.1.5.18
Moritz Gunz,2013-08-06T13:19:56.247Z,zlibnet - c# zlib wrapper library,LightClaw.zLibNet,False,1899-12-31T16:00:00-08:00,False,False,,"zlibnet,zlib,compression,zip,deflate,gzip,deflatestream,managed,speed,fast",-1,False,1.2.1
ForexClub,2013-08-06T20:52:35.04Z,Base socket system,Fx.SocketSystem.Extensions,True,1899-12-31T16:00:00-08:00,False,False,,"fxclub,fxsocketsystem,fx.socketsystem",-1,False,1.0.4967.1527-beta
ForexClub,2013-08-06T20:52:01.913Z,Build from svn-trunk (executer),Fx.RemoteAdmin.Server,True,1899-12-31T16:00:00-08:00,False,False,,"fxclub,fx.remoteadmin,fxremoteadmin",-1,False,1.0.4967.1529-beta
Devlin Liles and Tim Rayburn,2013-08-06T18:59:39.807Z,The fastest and smoothest way to great architecture,Highway.Insurance.UI.Windows,False,2013-09-03T12:23:57.113-07:00,True,False,,"Architecture,CodedUI,Testing,UI,Automation,QA,Productivity",5586,False,1.0.1.7
GeertvanHorrik,2013-08-06T06:23:35.487Z,Catel.Extensions.Interception library which provides interception capabilities.,Catel.Extensions.Interception,True,2016-11-29T13:36:15.02+00:00,True,False,,"catel,interception",80106,True,3.6.1308060814-beta
ForexClub,2013-08-06T20:51:28.27Z,Build from svn-trunk (executer),Fx.AppServer.ConfigurationUI,True,1899-12-31T16:00:00-08:00,False,False,,"fxclub,fxappserver,fx.appserver",-1,False,1.0.4967.1532-beta
ForexClub,2013-08-06T21:02:02.25Z,Silverlight controls,Fx.Common.SL.Controls,True,1899-12-31T16:00:00-08:00,False,False,,"fxclub,fxcommon,fx.common,Fx.Common.SL.Controls,Fxcontrols,fxsl",-1,False,1.0.4967.1817-beta
Microsoft,2013-08-06T03:34:05.163Z,"Incredibly simple real-time web for .NET.
        This package pulls in the server components and JavaScript client required to use SignalR in an ASP.NET application.",Microsoft.AspNet.SignalR,False,2018-03-14T20:20:11.6+00:00,True,False,Incredibly simple real-time web for .NET.,"Microsoft,AspNet,SignalR,AspNetSignalR,websockets,real-time,realtime,comet,HTTP,streaming",4246323,True,1.1.3
"Jeremy D. Miller,Josh Arnold",2013-08-06T12:44:24.88Z,Navigation model for FubuMVC applications,FubuMVC.Navigation,False,2016-01-05T05:45:20.327-08:00,True,False,,"web,framework,specification,fubumvc",7488,False,0.9.1.167
"Corey Kaylor,Jeremy D. Miller,Joshua Arnold",2013-08-06T12:44:27.273Z,OWIN hosting support for FubuMVC applications,FubuMVC.OwinHost,False,2016-01-05T05:45:26.123-08:00,True,False,,"web,framework,mvc,fubumvc",3645,False,1.1.0.1542
eXpand,2013-08-06T21:02:42.087Z,FilterDatastore Module (Web) / eXpand Framework,eXpandFilterDatastoreWeb,False,2016-05-25T07:42:26.04-07:00,True,False,FilterDatastore Module (Web) / eXpand Framework,"DevExpress,eXpand",61435,False,13.1.5.19
Joe Taylor,2013-08-06T13:43:56.957Z,Provides Base Controllers that interact with Joe.Business to implement Default CRUD Actions.,Joe.Web.Mvc,False,2018-04-06T17:33:55.15+00:00,True,False,Provides Base Controllers(And API controllers) that interact with Joe.Business to implement Default CRUD Actions.,,28793,False,1.0.5.4
Harry McIntyre,2013-08-06T22:02:02.967Z,"Object to html form transformer. FormFactory.RazorEngine can be embedded in WebApi, Nancy and Console apps. See http://formfactory.apphb.com/",FormFactory.RazorEngine,False,2017-02-19T04:31:00.453-08:00,True,False,,"Html,EditorTemplates,Razor,RazorEngine",15902,False,1.2.285
gleblebedev,2013-08-06T14:26:06.41Z,Circular array queue for TOE.,Toe.CircularArrayQueue,False,2013-08-06T07:26:06.41-07:00,True,False,,Toe,1086,False,1.0.0.4
ForexClub,2013-08-06T20:52:21.627Z,Base socket system,Fx.SocketSystem.Domain,True,1899-12-31T16:00:00-08:00,False,False,,"fxclub,fxsocketsystem,fx.socketsystem",-1,False,1.0.4967.1525-beta
ForexClub,2013-08-06T18:56:21.087Z,Base socket system,Fx.SocketSystem.Extensions,True,1899-12-31T16:00:00-08:00,False,False,,"fxclub,fxsocketsystem,fx.socketsystem",-1,False,1.0.0-beta
ForexClub,2013-08-05T23:58:40.04Z,Shared classe for all projects.,Fx.Common.SL,True,1899-12-31T16:00:00-08:00,False,False,,"fxclub,fxcommon,fxcommonsl,fx.common,Fx.Common.SL,fxsl",-1,False,1.0.0.7150-beta
Microsoft,2013-08-06T03:34:47.787Z,JavaScript client for ASP.NET SignalR.,Microsoft.AspNet.SignalR.JS,False,2018-03-14T20:21:06.993+00:00,True,False,JavaScript client for ASP.NET SignalR.,"Microsoft,AspNet,SignalR,AspNetSignalR,JS",4671985,True,1.1.3
Microsoft,2013-08-06T03:35:02.853Z,SQL Server messaging backplane for scaling out of ASP.NET SignalR applications in a web-farm.,Microsoft.AspNet.SignalR.SqlServer,False,2015-06-30T18:20:32.887+00:00,True,False,SQL Server messaging backplane for scaling out of ASP.NET SignalR applications in a web-farm.,"Microsoft,AspNet,SignalR,AspNetSignalR,SqlServer",270244,True,1.1.3
"Chad Myers,Jeremy D. Miller,Joshua Flanagan",2013-08-06T12:43:00.833Z,A foundational library for .Net frameworks including model binding and localization,FubuCore,False,2016-02-03T14:49:48.593+00:00,True,False,,"utilities,fubu",108896,False,1.1.0.255
NServiceBus Ltd,2013-08-06T21:03:12.07Z,The Notifications component for the NServicebus,NServiceBus.Notifications,True,1899-12-31T16:00:00-08:00,False,False,,"nservicebus,servicebus,msmq,cqrs,publish,subscribe",12854,False,1.0.0-unstable3330
Leon Meijer,2013-08-06T11:58:43.343Z,Part of the Co-Console SDK. Use this package to connect to the Co-Console API.,Lucy.CoConsole.ApiClient.Actions.Win32,False,2017-11-07T08:58:35+00:00,True,False,,,8192,False,1.8.5.57
"Jonathan Goldman,Colin Anderson",2013-08-06T13:45:51.077Z,Chinchilla is a little library to help make RabbitMq easier to use.,Chinchilla,False,2017-12-18T17:09:46.547+00:00,True,False,Making RabbitMq Awesome,"rabbitmq,chinchilla",23540,False,0.1.14.1
Ananth Balasubramaniam,2013-08-06T19:08:21.203Z,"Provides types, classes and methods that provide .NET bindings to OpenCL",OpenCL.Net,False,2013-10-23T12:21:26.477-07:00,True,False,".NET bindings for OpenCL that are easy-to-use and true to the original API. There is no 
OOP abstraction, nor will there ever be. OpenCL.Net is meant to be small, fast (with as 
little explicit marshaling as possible) and .NET friendly at the same time.

The contents of this project are made available under the terms of the
Eclipse Public License v1.0 (the ""License"") which accompanies this
distribution, and is available at the following URL:
http://www.opensource.org/licenses/eclipse-1.0.php

Software distributed under the License is distributed on an ""AS IS"" basis,
WITHOUT WARRANTY OF ANY KIND, either expressed or implied. See the License for
the specific language governing rights and limitations under the License.

By using this software in any fashion, you are agreeing to be bound by the
terms of the License.

Please send comments and/or suggestions to ananth<at>ananthonline<dot>net.","OpenCL,C#,.NET,GPGPU,Dataparallel,Compute,multicore,multi-core,parallel,HPC",29754,False,2.0.2
ForexClub,2013-08-06T21:22:39.877Z,Shared classe for all projects.,Fx.Common.SL,True,1899-12-31T16:00:00-08:00,False,False,,"fxclub,fxcommon,fxcommonsl,fx.common,Fx.Common.SL,fxsl",-1,False,1.0.4967.2448-beta
Hibernating Rhinos LTD,2013-08-06T14:54:24.84Z,"LLBLGen Profiler is a real-time visual debugger allowing a development team to gain valuable insight and perspective into their usage of LLBLGen. The product is architected with input coming from many top industry leaders within the OR/M community. Alerts are presented in a concise code-review manner indicating patterns of misuse by your application. To streamline your efforts to correct the misuse, we provide links to the problematic code section that triggered the alert.

We provide a 30 day trial to download and see for yourself, the value you will receive with your purchase of LLBLGen Profiler.",LLBLGenProfiler.Production,False,1899-12-31T16:00:00-08:00,False,False,This package enables production profiling of LLBLGen.,"LLBLGen,Profiler,Prof,Production,LLBLGenProf",-1,False,2.0.2188
eXpand,2013-08-06T11:13:31.573Z,SqlDbMapper Module (Web) / eXpand Framework,eXpandSqlDbMapperWeb,False,2013-08-09T07:42:53.813-07:00,True,False,SqlDbMapper Module (Web) / eXpand Framework,"DevExpress,eXpand",31250,False,13.1.5.18
Google Inc.,2013-08-06T20:40:34.423Z,"The Google APIs Client Library is a runtime client for working with Google Services. The library supports service requests, media upload and download, etc.",Google.Apis,True,2018-02-08T11:06:13.173+00:00,True,False,,Google,3578717,True,1.4.0.1-beta
eXpand,2013-08-06T11:12:30.537Z,MasterDetail Module (Win) / eXpand Framework,eXpandMasterDetailWin,False,2018-04-09T16:16:30.427+00:00,True,False,MasterDetail Module (Win) / eXpand Framework,"DevExpress,eXpand",69382,False,13.1.5.18
Leon Meijer,2013-08-06T11:45:35.047Z,"Main package of the Co-Console SDK for using the Co-Console API. This is a Portable Class Library that can be referenced from .NET 4 and higher, .NET for Windows Store apps and Windows Phone 8 and newer",Lucy.CoConsole.ApiClient,False,1899-12-31T16:00:00-08:00,False,False,,,-1,False,1.8.5.56
Van Thoai Nguyen,2013-08-07T04:03:30.24Z,"Burrow.NET is a simple library created based on some EasyNetQ ideas, it's a thin wrapper of RabbitMQ.Client for .NET. Basically, if you just need to put your message or subscribe messages from RabbitMQ server, you found the right place. With Burrow.NET, you can easily customize almost everything start with exchange and queue name, changing the way to serialize your object, inject custom error handling strategies, etc.",Burrow.NET,False,2016-04-04T21:12:52.613-07:00,True,False,Burrow.NET is a simple .NET client library for RabbitMQ,"Burrow,Burrow.NET,RabbitMQ,RabbitMQ-client,AMQP",12884,False,1.0.20
plexityHide,2013-08-07T01:21:01.343Z,"GTP.NET.WinForms is a package of components to build interactive Gantt and Schedule charts on .net4,.net4.5 WindowsForms",GTP.NET.WinForms,False,2016-11-27T21:01:50.9+00:00,True,False,,"Gantt,Schedule,plexityHide,GTP.NET,GTP.NET.WinForms",24778,False,4.8.7.35
"Jeremy Miller,et al.",2013-08-06T12:44:12.547Z,JSON.NET adapters for FubuMVC to bring the power of model-binding to JSON usage.,FubuMVC.Json,False,2013-12-16T12:01:47.993-08:00,True,False,,"fubumvc,json,modelbinding",2158,False,0.1.0.340
Simon Cropp,2013-08-06T04:24:14.657Z,Fody add-in for embedding references as resources.,Costura.Fody,False,2018-04-04T12:06:11.187+00:00,True,False,,"ILMerge,ILWeaving,Embed,Resource,Fody,Cecil",566261,False,0.4.0
ForexClub,2013-08-06T21:59:37.217Z,Base socket system,Fx.SocketSystem.Extensions,True,1899-12-31T16:00:00-08:00,False,False,,"fxclub,fxsocketsystem,fx.socketsystem",-1,False,1.0.4967.3570-beta
eXpand,2013-08-06T21:03:09.07Z,IO Module (Web) / eXpand Framework,eXpandIOWeb,False,2018-04-09T16:13:57.577+00:00,True,False,IO Module (Web) / eXpand Framework,"DevExpress,eXpand",69209,False,13.1.5.19
ForexClub,2013-08-06T21:36:43.45Z,Build from svn-trunk (executer),Fx.RemoteAdmin.Server,True,1899-12-31T16:00:00-08:00,False,False,,"fxclub,fx.remoteadmin,fxremoteadmin",-1,False,1.0.4967.2884-beta
eXpand,2013-08-06T11:14:43.267Z,"Creates dynamic persistent assemblies. The XAF user interface allows us to create an assembly without writing a single line of code. Advanced users can even use c# scripting and create new code generation templates.  
Blogs:
http://apobekiaris.blogspot.com/search/label/WorldCreator",eXpandWorldCreatorWeb,False,2018-04-09T16:26:20.077+00:00,True,False,Design runtime assemblies,"DevExpress,eXpand",67935,False,13.1.5.18
Jake Ginnivan,2013-08-06T17:29:29.203Z,"Makes VSTO development with PowerPoint far nicer, support DI/IoC, ViewModel per context (Document, Workbook, ApointmentItem etc), WPF like binding in RibbonXML, WPF Support and more!",VSTOContrib.PowerPoint,False,2013-11-25T13:19:02.967-08:00,True,False,,"VSTO,Office,PowerPoint",3490,False,0.12.0.98
eXpand,2013-08-06T11:13:44.677Z,Thumbnail Module (Web) / eXpand Framework,eXpandThumbnailWeb,False,2016-05-25T07:49:22.287-07:00,True,False,Thumbnail Module (Web) / eXpand Framework,"DevExpress,eXpand",58726,False,13.1.5.18
ForexClub,2013-08-06T00:22:45.13Z,Shared classe for all projects.,Fx.Common,True,1899-12-31T16:00:00-08:00,False,False,,"fxclub,fxcommon,fx.common",-1,False,1.0.0.7875-beta
"Steffen Forkmann,Mauricio Scheffer,Colin Bull",2013-08-06T12:27:13.26Z,FAKE - F# Make - is a build automation tool for .NET. Tasks and dependencies are specified in a DSL which is integrated in F#.,FAKE,False,2018-04-15T16:37:14.193+00:00,True,False,,build,1440554,False,1.74.249
Devlin Liles and Tim Rayburn,2013-08-06T19:07:11.83Z,The fastest and smoothest way to great architecture,Highway.Insurance.UI.Web,False,2013-09-03T12:23:55.567-07:00,True,False,,"Architecture,CodedUI,Testing,UI,Automation,QA,Productivity",5680,False,1.0.1.8
