authors,created,description,id,is_prerelease,last_updated,listed,missing_info,summary,tags,total_downloads,verified,versionHibernating Rhinos,2013-02-22T13:48:48.987Z,"This package includes the client API of RavenDB. RavenDB is a document database for the .NET platform, offering a flexible data model design to fit the needs of real world systems.",RavenDB.Client,True,2018-03-30T12:13:14.39+00:00,True,False,This package includes the client API of RavenDB.,"nosql,ravendb,raven,document,database,client",1114390,True,2.0.2284-Unstable
S. van Deursen,2013-02-22T02:46:35.413Z,"The Simple Injector ASP.NET Integration package adds a lifestyle to the Simple Injector called 'Per Web Request', which allows instances to live within a single HTTP request and get disposed when the request ends.",SimpleInjector.Integration.Web,True,2018-04-15T09:24:50.96+00:00,True,False,"ASP.NET integration for Simple Injector. General integration package for web applications such as Web Forms, MVC and IIS hosted Web API projects.","simpleinjector,architecture,dependency-injection,DI,easy,easy-to-use,Inversion-of-Control,IOC,Servicelocator,per-web-request,web,integration",800979,False,2.0.0-beta5
JoobMobile,2013-02-22T02:16:50.477Z,"JoobMobile Client for .net 4.5 / Windows 8 / Windows Phone 8
Alpha package to test nuget installation and see whats broken. Not currently recommended for installation.",JoobMobile,False,1899-12-31T16:00:00-08:00,False,False,,,18999,False,3.1.0.58
SYSTEM,2013-02-22T10:43:06.373Z,Noodles transforms your object modelinto a web app. This is a library to integrate Noodles with AJAX jquery datatables,Noodles.AspMvc.DataTables,False,2013-11-23T10:56:48.06-08:00,True,False,,,40219,False,1.1.375
Microsoft,2013-02-22T17:19:10.817Z,Noodles transforms your object model into a web app. This assembly contains stuff to make Noodles work with ASP MVC,Noodles.AspMvc,False,2013-11-23T10:56:42.207-08:00,True,False,,,41585,False,1.1.384
Dayi Chen,2013-02-22T01:50:02.283Z,"A base code for enterprise business application development, includes IoC, Aop and Localization .",EBA,False,2014-11-02T05:22:04.277-08:00,True,False,,企业应用,13744,False,0.2.4.3
Nexul Software LLC,2013-02-21T18:22:08.283Z,Tasks that can monitor windows services (System.ServiceProcess),Candor.Tasks.ServiceProcess,False,2014-07-24T15:52:48.07-07:00,True,False,,"Candor,ServiceProcess,monitoring",3394,False,0.6.1.30221
Hibernating Rhinos,2013-02-21T15:51:56.997Z,RavenDB 'Authorization' bundle client extend RavenDB and add document level permissions.,RavenDB.Client.Authorization,True,1900-01-01T00:00:00+00:00,False,False,,"nosql,ravendb,raven,document,database,client,bundles,authorization",166092,True,2.0.2283-Unstable
Mariuzzo,2013-02-21T14:16:04.81Z,Extra missing components for ASP.NET MVC.,Mariuzzo.Web.Mvc.Extras,False,2013-03-08T01:32:45.677-08:00,True,False,,"asp.net,mvc,extra,extras",3364,False,13.2.21.18465
Exceptionless,2013-02-22T18:23:21.757Z,Exceptionless is a cloud based error reporting service that sends your exceptions to http://exceptionless.com and provides aggregated views and analytics.,Exceptionless.Windows,True,2018-02-15T14:21:56.363+00:00,True,False,,"Error,Report,Reporting,Exception,Logging,Log",119842,True,0.9.0.517-pre
Tim MacFarlane and contributors,2013-02-21T12:01:40.817Z,A new build framework for C# projects.,Bounce,False,2017-02-13T04:41:30.683-08:00,True,False,,"build,CI,deploy,configuration",5092,False,0.8.1
Bitovi,2013-02-22T20:22:53.8Z,"CanJS is a MIT-licensed, client-side, JavaScript framework that makes building rich web applications easy. Use it because it’s: Smaller, Faster, Safer, Easier, Library-er.

CanJS’s core supports jQuery, Zepto, Dojo, YUI and Mootools.",CanJS.AMD,False,2014-11-04T22:28:28.737-08:00,True,False,"CanJS is a MIT-licensed, client-side, JavaScript framework that supports MVC, Live Binding, Routing and Modular Development","canjs,javascript,mvc,jquery,dojo,yui,zepto,mootools",4382,False,1.1.4
Demis Bellot,2013-02-21T15:47:43.417Z,"Common library dependency for other StackExpress projects.
      Includes JSON, XML, JSV and SOAP Generic Service Clients.
      Contains:
      - StackExpress.Interfaces
      - StackExpress.Common
      Dependenies:
      - StackExpress.Text",StackExpress.Common,True,2013-05-05T16:45:38.26-07:00,True,False,Opensource .NET and Mono REST Web Services framework,"StackExpress,Common,Framework",66824,False,3.9.574-unstable
Exceptionless,2013-02-21T23:52:14.69Z,Exceptionless is a cloud based error reporting service that sends your exceptions to http://exceptionless.com and provides aggregated views and analytics.,Exceptionless.Web,True,2018-02-15T14:21:03.533+00:00,True,False,,"Error,Report,Reporting,Exception,Logging,Log",130384,True,0.9.0.512-pre
James South,2013-02-21T15:19:46.92Z,"ImageProcessor.Web adds a configurable HttpModule to your website which allows on-th-fly processing of image files. The module also comes with a file and browser based cache that increases your processing output saving precious server memory.


If you use ImageProcessor please get in touch on my twitter @james_m_south


Feedback is always welcome.",ImageProcessor.Web,False,2018-04-09T01:22:39.897+00:00,True,False,An extension to ImageProcessor that allows on-the-fly processing of image files in an ASP.NET website,"Image,Imaging,ASP,Performance,Processing,HttpModule,Cache,Resize,Rotate,Crop,Filter,Effects,Quality,Watermark,Alpha,Gif,Jpeg,Bitmap,Png,Fluent",839706,False,1.2.0
Microsoft,2013-02-21T19:38:32.167Z,"Noodles transforms your object model into a web app. Install this library to customise the cshtml template files, or if you don't want to use the EmbeddedResourceVirtualPathProvider to load your views",Noodles.AspMvc.Templates,False,2013-11-23T10:56:53.3-08:00,True,False,,,40469,False,1.1.374
Acklen Avenue,2013-02-22T15:45:46.957Z,Extensions for Testing,AcklenAvenue.Testing,False,2016-04-18T12:26:23.583-07:00,True,False,,"Tag1,Tag2",16453,False,1.0.0
Exceptionless,2013-02-21T20:27:23.01Z,Exceptionless is a cloud based error reporting service that sends your exceptions to http://exceptionless.com and provides aggregated views and analytics.,Exceptionless.WebApi,True,2018-02-15T14:21:30.19+00:00,True,False,,"Error,Report,Reporting,Exception,Logging,Log",144636,True,0.9.0.509-pre
JoobMobile,2013-02-22T03:11:39.773Z,"JoobMobile Client for .net 4.5 / Windows 8 / Windows Phone 8
Alpha package to test nuget installation and see whats broken. Not currently recommended for installation.",JoobMobile,False,1899-12-31T16:00:00-08:00,False,False,,,18999,False,3.1.0.61
CubeBuild Team,2013-02-21T23:21:20.07Z,This is a plugin to the CubeBuild MVC Framework that adds Forms authentication.,CubeBuild.Framework,False,2013-03-11T00:20:49.753-07:00,True,False,,"cms,mvc",3016,False,1.9.4801.18572
Exceptionless,2013-02-22T04:09:50.4Z,Exceptionless is a cloud based error reporting service that sends your exceptions to http://exceptionless.com and provides aggregated views and analytics.,Exceptionless.WebApi,True,2018-02-15T14:21:30.19+00:00,True,False,,"Error,Report,Reporting,Exception,Logging,Log",144636,True,0.9.0.516-pre
ziyasal,2013-02-22T13:54:19.47Z,AOPify.Aspects provides PreProcess and PostProcess aspects while executing operations,AOPify.Aspects,False,2013-02-22T13:54:19.47+00:00,True,False,,"AOP,Aspect,Attibute",2187,False,0.3.1
"Jeremy D. Miller,Joshua Flanagan",2013-02-22T12:31:35.04Z,Package description,HtmlTags,False,2018-03-26T18:39:51.877+00:00,True,False,,html,202044,False,1.2.0.149
Microsoft,2013-02-22T16:24:00.427Z,Noodles transforms your object model into a web app. This assembly contains stuff to make Noodles work with ASP MVC,Noodles.AspMvc,False,2013-11-23T10:56:42.207-08:00,True,False,,,41585,False,1.1.383
Jon Arild Torresdal,2013-02-21T21:06:54.51Z,"Note: This package is for extending the ConDep DSL. If you're looking for ConDep to do deployment or infrastructure as code, please use the ConDep package. ConDep is a highly extendable Domain Specific Language for Continuous Deployment, Continuous Delivery and Infrastructure as Code on Windows.",ConDep.Dsl,False,2016-12-06T04:12:57.487-08:00,True,False,,"Continuous,Deployment,Delivery,Infrastructure,WebDeploy,Deploy,msdeploy,IIS,automation,powershell,remote",65471,False,1.0.6
Probel,2013-02-22T14:03:22.987Z,Allow to manage remote statistics,Probel.NDoctor.Statistics,False,2013-02-24T10:45:27.52-08:00,True,False,,"nDoctor,statistics",4070,False,1.0.3.61
Giacomo Stelluti Scala,2013-02-22T12:06:15.523Z,The Command Line Parser Library offers to CLR applications a clean and concise API for manipulating command line arguments and related tasks.,CommandLineParser,True,2018-01-11T00:06:21.5+00:00,True,False,,"command,line,argument,option,parser,parsing,library,syntax,shell",3410537,False,1.9.6-rc1
SYSTEM,2013-02-22T17:19:17.893Z,Noodles transforms your object modelinto a web app. This is a library to integrate Noodles with AJAX jquery datatables,Noodles.AspMvc.DataTables,False,2013-11-23T10:56:48.06-08:00,True,False,,,40219,False,1.1.384
Exceptionless,2013-02-21T21:38:27.287Z,Exceptionless is a cloud based error reporting service that sends your exceptions to http://exceptionless.com and provides aggregated views and analytics.,Exceptionless.Web,True,2018-02-15T14:21:03.533+00:00,True,False,,"Error,Report,Reporting,Exception,Logging,Log",130384,True,0.9.0.511-pre
Harry McIntyre,2013-02-21T11:44:54.63Z,Strongly type html helpers for rendering jquery.datatables tables from IQueryables,Mvc.JQuery.Datatables,False,2018-02-13T13:32:31.3+00:00,True,False,,"jquery,datatables,iqueryable,razor",125838,False,1.2.44
Viacheslav.Manulik,2013-02-22T13:37:56.92Z,Version of LumiSoft.Net library with community fixes.,LumiSoft.Net,False,2013-02-22T05:37:56.92-08:00,True,False,Version of LumiSoft.Net library with community fixes.,,19633,False,2.0.4492.11923
Robin Herbots,2013-02-21T17:51:13.09Z,"jquery.inputmask is a jquery plugin which create an input mask.

An inputmask helps the user with the input by ensuring a predefined format. This can be usefull for dates, numerics, phone numbers, ...

Highlights:
- easy to use
- optional parts anywere in the mask
- possibility to define aliases which hide complexity
- date / datetime masks
- numeric masks
- lots of callbacks
- non-greedy masks
- many features can be enabled/disabled/configured by options
- supports readonly/disabled/dir=""rtl"" attributes",jQuery.InputMask,False,2017-11-21T11:47:23.837+00:00,True,False,,"jQuery,plugins",236428,False,2.1.1
Hibernating Rhinos,2013-02-21T16:27:48.45Z,RavenDB 'Authorization' bundle client extend RavenDB and add document level permissions.,RavenDB.Client.Authorization,True,1900-01-01T00:00:00+00:00,False,False,,"nosql,ravendb,raven,document,database,client,bundles,authorization",166092,True,2.5.2507-Unstable
Mariuzzo,2013-02-22T15:34:15.583Z,Extra missing components for ASP.NET MVC.,Mariuzzo.Web.Mvc.Extras,False,2013-03-08T01:32:45.677-08:00,True,False,,"asp.net,web,mvc,extra,extras,mariuzzo,modelstate,expression,helper,extensions",3364,False,13.2.5000.20814
Kristoffer Ahl,2013-02-21T22:26:15.817Z,The honey flavoured psake build automation tool,Koshu,False,2016-10-21T07:35:03.9-07:00,True,False,,"psake,build,automation,templates,helpers",3664,False,0.4.0
Remo Gloor,2013-02-22T15:32:50.417Z,Ninject extension to add ioc for WCF services when IIS hosting.,Ninject.Extensions.Wcf.WebHost,True,2016-10-29T07:18:50.853-07:00,True,False,Extension for Ninject providing integration with ASP.NET MVC WebAPI WebHost,"Ninject,ioc,di,wcf",32481,False,3.0.2-unstable-1
Harry McIntyre,2013-02-22T14:58:20.953Z,"FormFactory generates HTML forms from object models, using conventions and a semantic model. See http://formfactory.apphb.com/",FormFactory,False,2018-03-12T09:51:06.5+00:00,True,False,,,91805,False,1.2.241
Framework One,2013-02-21T12:07:04.06Z,"CloudCore is an out-of-the-box, cloud-based enterprise foundation and business process automation platform that facilitates rapid and modular system development for the cloud.",CloudCore,False,1899-12-31T16:00:00-08:00,False,False,,,-1,False,1.0.0.145
Exceptionless,2013-02-21T21:38:26.113Z,Exceptionless is a cloud based error reporting service that sends your exceptions to http://exceptionless.com and provides aggregated views and analytics.,Exceptionless.Mvc,True,2018-02-15T14:19:13.42+00:00,True,False,,"Error,Report,Reporting,Exception,Logging,Log",163392,True,0.9.0.511-pre
Pragmagile,2013-02-22T15:07:38.247Z,A pragmatic O/R Mapper that implements Linq and uses Self-Tracking Entities.,ORMapster.Framework,False,2016-09-24T22:41:14.56-07:00,True,False,,,2069,False,4.5.2013.222
Harry McIntyre,2013-02-21T18:18:37.36Z,Noodles transforms your object modelinto a web app. This is the core library without a dependency on ASP MVC,Noodles,False,2013-11-23T10:56:35.543-08:00,True,False,,,86888,False,1.1.373
Ninject Project Contributors,2013-02-22T15:32:30.16Z,Ninject extension to add ioc for WCF services.,Ninject.Extensions.Wcf,True,2017-10-29T09:58:36.4+00:00,True,False,,"Ninject,ioc,di,wcf",323084,False,3.0.2-unstable-1
Taliesin Sisson,2013-02-22T08:02:28.943Z,A suite of Http Modules and Http Handlers to easily implemented best practices and increase performance of asp.net webforms and asp.net mvc websites.,Talifun.Web,False,2014-06-19T15:51:41.107-07:00,True,False,A suite of Http Modules and Http Handlers to easily implemented best practices and increase performance of asp.net webforms and asp.net mvc websites.,"talifun,http,module",4009,False,2.6.5
Exceptionless,2013-02-21T21:38:24.537Z,Exceptionless is a cloud based error reporting service that sends your exceptions to http://exceptionless.com and provides aggregated views and analytics.,Exceptionless,True,2018-02-15T14:17:13.09+00:00,True,False,,"Error,Report,Reporting,Exception,Logging,Log",293079,True,0.9.0.511-pre
Nathan Gonzalez,2013-02-22T15:41:56.54Z,An NUnit wrapper for the Given BDD framework.  This version is signed.,Given.NUnit-signed,False,2013-07-09T20:40:18.447-07:00,True,False,,"BDD,TDD,Testing,NUnit,Given",3195,False,0.1.4801.17423
Hibernating Rhinos,2013-02-21T16:28:27.533Z,"This package let you include RavenDB embedded in-process with your application. RavenDB is a document database for the .NET platform, offering a flexible data model design to fit the needs of real world systems.",RavenDB.Embedded,True,1900-01-01T00:00:00+00:00,False,False,This package let you include RavenDB embedded in-process with your application.,"nosql,ravendb,raven,document,database,embedded",544004,True,2.5.2507-Unstable
Rocky,2013-02-22T09:53:47.367Z,WCF common library.,Timothy.Service,False,2013-07-27T02:45:04.013-07:00,True,False,,.Net4.0,4309,False,1.0.12
SYSTEM,2013-02-22T14:09:15.31Z,Noodles transforms your object modelinto a web app. This is a library to integrate Noodles with AJAX jquery datatables,Noodles.AspMvc.DataTables,False,2013-11-23T10:56:48.06-08:00,True,False,,,40219,False,1.1.379
Aaron Powell,2013-02-21T22:53:25.62Z,This is a simple plugin that allows you to inspect your KnockoutJS ViewModels using the Glimpse tool,glimpse-knockout,False,2013-03-06T03:12:34.007-08:00,True,False,A KnockoutJS inspector for Glimpse,"knockoutjs,glimpse,web",17847,False,0.1.3
Exceptionless,2013-02-21T20:27:22.057Z,Exceptionless is a cloud based error reporting service that sends your exceptions to http://exceptionless.com and provides aggregated views and analytics.,Exceptionless.Web,True,2018-02-15T14:21:03.533+00:00,True,False,,"Error,Report,Reporting,Exception,Logging,Log",130384,True,0.9.0.509-pre
Exceptionless,2013-02-21T20:49:19.04Z,Exceptionless is a cloud based error reporting service that sends your exceptions to http://exceptionless.com and provides aggregated views and analytics.,Exceptionless,True,2018-02-15T14:17:13.09+00:00,True,False,,"Error,Report,Reporting,Exception,Logging,Log",293079,True,0.9.0.510-pre
Exceptionless,2013-02-21T18:38:23.873Z,Exceptionless is a cloud based error reporting service that sends your exceptions to http://exceptionless.com and provides aggregated views and analytics.,Exceptionless.Web,True,2018-02-15T14:21:03.533+00:00,True,False,,"Error,Report,Reporting,Exception,Logging,Log",130384,True,0.9.0.504-pre
Remo Gloor,2013-02-22T15:42:19.627Z,Extension for Ninject providing integration with ASP.NET MVC WebAPI,Ninject.Web.WebApi,True,2017-10-23T15:17:50.18+00:00,True,False,Extension for Ninject providing integration with ASP.NET MVC WebAPI,"Ninject,ioc,di,web,mvc,api",1271228,False,3.0.2-unstable-1
CubeBuild Team,2013-02-21T23:19:58.79Z,This is a plugin to the CubeBuild MVC Framework that adds Forms authentication.,CubeBuild.AccountForms,False,2013-03-11T00:19:57.8-07:00,True,False,,"cms,mvc",2942,False,1.2.4801.18578
Framework One,2013-02-21T13:55:42.997Z,"CloudCore is an out-of-the-box, cloud-based enterprise foundation and business process automation platform that facilitates rapid and modular system development for the cloud.",CloudCore,False,1899-12-31T16:00:00-08:00,False,False,,,-1,False,1.0.0.148
"CityIndex Ltd,Sky Sanders,David Laing",2013-02-21T22:15:41.4Z,.NET client library for CityIndex Trading API,CIAPI,True,2013-11-06T02:04:00.687-08:00,True,False,,,39961,False,9.5.3-bleeding-544
Simon Cropp,2013-02-22T12:12:07.87Z,Fody add-in for injecting INotifyPropertyChanging code into properties.,PropertyChanging.Fody,False,2018-04-06T23:35:10.967+00:00,True,False,,"WPF,Silverlight,MVVM,WP7,WindowsPhone,INotifyPropertyChanging,DataBinding,ILWeaving,Cecil",25580,False,1.19.0
"Steffen Forkmann,Mauricio Scheffer,Colin Bull",2013-02-21T13:15:19.7Z,FAKE - F# Make - is a build automation tool for .NET. Tasks and dependencies are specified in a DSL which is integrated in F#.,FAKE,True,2018-04-15T16:37:14.193+00:00,True,False,,build,1440554,False,2.1.144-alpha
Erik Källén,2013-02-21T20:18:31.807Z,Installing this package will transform the project to compile to JavaScript.,Saltarelle.Compiler,False,2015-07-29T07:13:09.687-07:00,True,False,,,32726,False,2.0.3
JoobMobile,2013-02-22T02:44:51.483Z,"JoobMobile Client for .net 4.5 / Windows 8 / Windows Phone 8
Alpha package to test nuget installation and see whats broken. Not currently recommended for installation.",JoobMobile,False,1899-12-31T16:00:00-08:00,False,False,,,18999,False,3.1.0.60
Microsoft,2013-02-22T16:24:08.813Z,"Noodles transforms your object model into a web app. Install this library to customise the cshtml template files, or if you don't want to use the EmbeddedResourceVirtualPathProvider to load your views",Noodles.AspMvc.Templates,False,2013-11-23T10:56:53.3-08:00,True,False,,,40469,False,1.1.383
Hibernating Rhinos,2013-02-21T15:52:03.427Z,RavenDB 'Unique Constraints' bundle client. Allow the user to implement unique constraints in the objects (useful for properties like email or social security number).,RavenDB.Client.UniqueConstraints,True,1900-01-01T00:00:00+00:00,False,False,,"nosql,ravendb,raven,document,database,client,bundles",239798,True,2.0.2283-Unstable
Ninject Project Contributors,2013-02-22T15:31:15.757Z,Adds self hosting support to web common.,Ninject.Web.Common.Selfhost,True,2017-10-23T14:34:06.357+00:00,True,False,,"Ninject,ioc,di,ASP.NET",52590,False,3.0.2-unstable-2
Exceptionless,2013-02-21T17:58:30.787Z,Exceptionless is a cloud based error reporting service that sends your exceptions to http://exceptionless.com and provides aggregated views and analytics.,Exceptionless.Mvc,True,2018-02-15T14:19:13.42+00:00,True,False,,"Error,Report,Reporting,Exception,Logging,Log",163392,True,0.9.0.503-pre
Hibernating Rhinos,2013-02-21T15:52:28.477Z,"Use this package if you want extend RavenDB. Don't use this package if you just want to work with existing RavenDB server, in order to so just use the client API which is in the RavenDB.Client package. RavenDB is a document database for the .NET platform, offering a flexible data model design to fit the needs of real world systems.",RavenDB.Database,True,1900-01-01T00:00:00+00:00,False,False,This package allows you to extend RavenDB database.,"nosql,ravendb,raven,document,database",659272,True,2.0.2283-Unstable
Jon Arild Torresdal,2013-02-21T21:07:17.95Z,"ConDep is a highly extendable Domain Specific Language for Continuous Deployment, Continuous Delivery and Infrastructure as Code on Windows.",ConDep,False,2015-03-08T13:43:49.03-07:00,True,False,,"Continuous,Deployment,Delivery,Infrastructure,WebDeploy,Deploy,msdeploy,IIS,automation,powershell,remote",42312,False,1.0.6
Terry SoRelle,2013-02-21T23:39:11.167Z,Adds additional Type Script files and Templates to integrate Atlatl SPA framework with the Peanut framework.,Catapult.Peanut.Atlatl,True,2013-04-05T11:06:14.723-07:00,True,False,,"Catapult,Peanut,Atlatl",3052,False,1.0.5-Beta
Demis Bellot,2013-02-22T12:20:22.11Z,"StackExpress Razor Documentation: http://razor.servicestack.net

      - Turns ServiceStack into a Complete Web + REST Services Stack. Replaces need for ASP.NET MVC.
      - Runs In ASP.NET or Self-host, first-class cross-platform support on .NET / Mono runtimes.
      - Add HTML views to existing services.
      - Change Views and Layout templates at runtime.
      - No Ceremony development options - Pages without controllers, with typed and dynamic View Models.
      - Include Partial Markdown views in Razor pages.
      - Cascading Layout templates.
      - Pretty urls by default (no custom Routes needed).
      - Keep all views and assets together.
      - Smart View Pages.",StackExpress.Razor,True,2013-04-13T08:22:10.39-07:00,True,False,Provides ServiceStack's HTML Story including integrated support for MVC Razor's ViewEngine,"ServiceStack,Razor,ViewEngine,View,Templates,Controllers,Mono,ASP.NET,Self-Host",64846,False,3.9.577-unstable
Demis Bellot,2013-02-22T00:43:17.127Z,"StackExpress Razor Documentation: http://razor.servicestack.net

      - Turns ServiceStack into a Complete Web + REST Services Stack. Replaces need for ASP.NET MVC.
      - Runs In ASP.NET or Self-host, first-class cross-platform support on .NET / Mono runtimes.
      - Add HTML views to existing services.
      - Change Views and Layout templates at runtime.
      - No Ceremony development options - Pages without controllers, with typed and dynamic View Models.
      - Include Partial Markdown views in Razor pages.
      - Cascading Layout templates.
      - Pretty urls by default (no custom Routes needed).
      - Keep all views and assets together.
      - Smart View Pages.",StackExpress.Razor,True,2013-04-13T08:22:10.39-07:00,True,False,Provides ServiceStack's HTML Story including integrated support for MVC Razor's ViewEngine,"ServiceStack,Razor,ViewEngine,View,Templates,Controllers,Mono,ASP.NET,Self-Host",64846,False,3.9.575-unstable
Demis Bellot,2013-02-22T12:19:59.397Z,"Common library dependency for other StackExpress projects.
      Includes JSON, XML, JSV and SOAP Generic Service Clients.
      Contains:
      - StackExpress.Interfaces
      - StackExpress.Common
      Dependenies:
      - StackExpress.Text",StackExpress.Common,True,2013-05-05T16:45:38.26-07:00,True,False,Opensource .NET and Mono REST Web Services framework,"StackExpress,Common,Framework",66824,False,3.9.577-unstable
Hibernating Rhinos,2013-02-21T15:51:34.04Z,The cascade delete bundle allows for a specified set of documents and attachments to be deleted when the document that owns it is deleted. Typical usage scenarios include deleting an attachment that is referenced by a document or removing a set of child documents referenced by a parent document.,RavenDB.Bundles.CascadeDelete,True,1900-01-01T00:00:00+00:00,False,False,,"nosql,ravendb,raven,document,database,bundles",196831,True,2.0.2283-Unstable
Nick Payne,2013-02-21T16:39:12.857Z,"Bootbox.js is a small JavaScript library which allows you to create programmatic dialog boxes using Twitter's Bootstrap modals, without having to worry about creating, managing or removing any of the required DOM elements or JS event handlers.",bootbox,False,2014-10-03T01:29:13.537-07:00,True,False,"Bootbox.js—alert, confirm and flexible dialogs for Twitter's Bootstrap framework","jquery,bootstrap,dialog",191903,False,3.2.0
SYSTEM,2013-02-22T16:02:02.3Z,Noodles transforms your object model into a web app. Install this library to use Noodles with Web Api,Noodles.WebApi,False,2013-11-23T10:56:58.177-08:00,True,False,,,39841,False,1.1.382
Exceptionless,2013-02-21T20:49:24.747Z,Exceptionless is a cloud based error reporting service that sends your exceptions to http://exceptionless.com and provides aggregated views and analytics.,Exceptionless.Wpf,True,2018-02-15T14:22:28.13+00:00,True,False,,"Error,Report,Reporting,Exception,Logging,Log",124899,True,0.9.0.510-pre
ziyasal,2013-02-22T13:48:53.937Z,AOPify.Aspects provides PreProcess and PostProcess aspects while executing operations,AOPify.Aspects,False,2013-02-22T13:54:19.47+00:00,True,False,,"AOP,Aspect,Attibute",2187,False,0.3.0
Jon Arild Torresdal,2013-02-21T22:32:20.64Z,"ConDep is a highly extendable Domain Specific Language for Continuous Deployment, Continuous Delivery and Infrastructure as Code on Windows.",ConDep,False,2015-03-08T13:43:49.03-07:00,True,False,,"Continuous,Deployment,Delivery,Infrastructure,WebDeploy,Deploy,msdeploy,IIS,automation,powershell,remote",42312,False,1.0.9
Probel,2013-02-21T22:52:05.5Z,Allow to manage remote statistics,Probel.NDoctor.Statistics,False,2013-02-24T10:45:27.52-08:00,True,False,,"nDoctor,statistics",4070,False,1.0.2.42949
