authors,created,days_abandoned,days_alive,description,id,is_prerelease,last_updated,listed,missing_info,summary,tags,total_downloads,verified,versionPavel Zaitsau; Alexander Belenkov,2013-07-12T11:15:47.72Z,1540,1743,My package description.,Zapos.Printers.Gembox,False,2014-01-31T00:10:56.59-08:00,True,False,,"Export,PDF,XLSX,Razor",3640,False,1.13.1.41
Robert May,2013-07-12T00:05:45.237Z,43209,1743,"Database Deploy is a mechanism for scripting updates to your database.  DbDeploy will evaluate a given database for the script version currently installed and generate a change script for updating the database to the latest version, based on your script files.

DbDeploy can be run as a build task, from the command line, or from many other automated deployment technologies.

DbDeploy will also create scripts that are SqlAzure friendly.

DbDeployNet2 is a codeplex open source project.  You can get the source at http://dbdeploynet2.codeplex.com",DbDeployNet2,False,1899-12-31T16:00:00-08:00,False,False,Database Deploy is a mechanism for scripting updates to your database.,"Database,Deploy,dbdeploy,db,migrations,Migrations",11161,False,1.0.0
MvvmCross,2013-07-12T09:46:47.32Z,43209,1743,This package contains the 'Json' plugin for MvvmCross v3 - Hot Tuna. This and other packages are currently under development...,MvvmCross.HotTuna.Plugin.Json,True,1899-12-31T16:00:00-08:00,False,False,,"mvvm,mvvmcross,xamarin,monodroid,monotouch,wpf,windows8,winrt,netcore,wp,wpdev,windowsphone",-1,False,3.0.9-beta8
MvvmCross,2013-07-12T06:59:13.457Z,43209,1743,This package contains the 'PhoneCall' plugin for MvvmCross v3 - Hot Tuna. This and other packages are currently under development...,MvvmCross.HotTuna.Plugin.PhoneCall,True,1899-12-31T16:00:00-08:00,False,False,,"mvvm,mvvmcross,xamarin,monodroid,monotouch,wpf,windows8,winrt,netcore,wp,wpdev,windowsphone",-1,False,3.0.9-beta7
Contoso,2013-07-11T21:17:31.78Z,1744,1744,This package contains implementations of abstract Services for use with ASP.NET MVC 3.,BclEx-Abstract.Web.Mvc3,False,2013-07-11T14:17:31.78-07:00,True,False,,"mvc,mvc3,servicelocator,web,bclex",751,False,1.0.0
Pierre Chalamet,2013-07-12T22:16:09.553Z,289,1743,Tools for cassandra-sharp-interfaces,cassandra-sharp-tools,False,2017-07-05T13:10:34.82-07:00,True,False,"cassandra-sharp is a high performance .NET driver for Apache Cassandra, fully supporting asynchronous operations (using TPL and Rx) and CQL 3 binary protocol.","apache,cassandra,driver,net40,net45,mono,database,nosql,tpl,rx,reactive,high,performance,streaming",4839,False,3.3.1
eXpand,2013-07-11T22:43:33.127Z,1089,1744,ExceptionHandling Module (Web) / eXpand Framework,eXpandExceptionHandlingWeb,False,2015-04-27T12:07:21.237-07:00,True,False,ExceptionHandling Module (Web) / eXpand Framework,"DevExpress,eXpand",56866,False,13.1.5.6
Frozen Mountain Software,2013-07-12T22:10:53.733Z,48,1743,A server-side library for .NET that provides core utilities for other FM server-side libraries. (Community Edition),FM.Server,False,2018-03-03T21:25:47.003+00:00,True,False,,"FM,Server,Core,Frozen,Mountain,.NET",18230,False,2.3.2
Jerome Haltom,2013-07-11T21:43:33.517Z,43209,1744,OLinq is a project to provide a Linq Queryable provider implementation for operating on ObservableCollections or other INotifyCollectionChanged supporting lists. The output of OLinq is an ObservableView which notifies when the results of the query have changed.,OLinq,False,1899-12-31T16:00:00-08:00,False,False,,"linq,observable,clinq,bindable,wpf,rx,queryable",5918,False,0.0.12
Ameotech,2013-07-12T10:45:31.26Z,1610,1743,The package contains Restaurant Service Core Dlls,RestaurantCoreBin,False,2013-11-22T06:37:18.327-08:00,True,False,,"Restaurant,Service,Core,Bin,created,by,Ameotech,:,12-07-2013",1506,False,1.0.0
https://github.com/martin-magakian,2013-07-12T21:08:23.21Z,1591,1743,"Allow you to search, faceted search, add, update, remove objects from your Amazon Cloud Search Index in C#.",AmazingCloudSearch,False,2013-12-11T13:46:46.857-08:00,True,False,,"cloudsearch,amazon,search",6185,False,0.1.1
Autofac Contributors,2013-07-12T12:25:13.077Z,829,1743,ASP.NET WebForms integration for Autofac,Autofac.Web,False,2016-01-12T13:15:09.397-08:00,True,False,Provides dependency management and property injection for ASP.NET WebForms Pages.,,329312,False,3.1.0
huan,2013-07-13T03:18:52.8Z,1742,1742,Phan Thi Admin,PTAdmin,False,2013-07-12T21:33:11.327-07:00,True,False,,"Phan,thi",1515,False,1.0.3
Pavel Zaitsau; Alexander Belenkov,2013-07-12T11:15:39.303Z,1540,1743,My package description.,Zapos.Common,False,2014-01-31T00:10:16.993-08:00,True,False,,"Export,Razor",3692,False,1.13.1.41
MvvmCross,2013-07-12T09:46:41.277Z,43209,1743,This package contains the 'FieldBinding' plugin for MvvmCross v3 - Hot Tuna. This and other packages are currently under development...,MvvmCross.HotTuna.Plugin.FieldBinding,True,1899-12-31T16:00:00-08:00,False,False,,"mvvm,mvvmcross,xamarin,monodroid,monotouch,wpf,windows8,winrt,netcore,wp,wpdev,windowsphone",-1,False,3.0.9-beta8
huan,2013-07-13T00:54:04.277Z,1742,1742,Phan Thi Admin,PTAdmin,False,2013-07-12T21:33:11.327-07:00,True,False,,"Phan,thi",1515,False,1.0.1
Martin Jul,2013-07-12T12:01:54.48Z,1626,1743,Diesel is a DSL toolkit for .NET code generation for DDD,Diesel,False,2013-11-06T02:42:56.45-08:00,True,False,,"DDD,DSL,CodeDom,Compiler,Generator",4633,False,1.12.0
GeertvanHorrik,2013-07-13T11:59:28.537Z,507,1742,Catel.Extensions.Prism library which contains helper classes for prism.,Catel.Extensions.Prism,True,2016-11-29T13:36:21.16+00:00,True,False,,"prism,catel,mvvm",129719,True,3.6.1307131351-beta
mpareja,2013-07-12T17:29:26.057Z,1743,1743,Simple auto-mapping of configuration settings to POCOs.,ConfigAutoMapper,False,2013-07-12T10:29:26.057-07:00,True,False,,"auto-mapping,configuration,appsettings",772,False,0.1.0
Casey Watson,2013-07-12T15:57:23.023Z,43209,1743,This library contains the base Mantle logging components.,mantle-logging,True,1899-12-31T16:00:00-08:00,False,False,,"Cloud,Mantle,Logging",1247,False,1.0.0-beta
"John Hoerr,GitHub contributors",2013-07-12T19:02:17.83Z,1743,1743,A client implementation of the Box v2 REST API.  API documentation can be found at http://developers.box.com.,Box.v2.SDK,False,2013-07-12T12:02:17.83-07:00,True,False,,"Box,Box.com",12554,False,2.1.0
Contoso,2013-07-11T21:16:55.387Z,1744,1744,This package contains a NLog implementation of the abstract ServiceLog.,BclEx-Abstract.NLog,False,2013-07-11T14:16:55.387-07:00,True,False,,"nlog,servicelog,log,logging,bclex",580,False,1.0.0
Contoso,2013-07-11T21:39:31.23Z,1744,1744,This package contains System.Web extentions for MVC 3.,BclEx-Web.Mvc4,False,2013-07-11T14:39:31.23-07:00,True,False,,"mvc,mvc4,web,bclex",633,False,1.0.0
NServiceBus Ltd,2013-07-11T21:02:02.37Z,43209,1744,The Azure Host for the timeout manager on NServicebus,NServiceBus.Timeout.Hosting.Azure,True,1899-12-31T16:00:00-08:00,False,False,,"nservicebus,servicebus,msmq,cqrs,publish,subscribe",-1,False,4.0.0-unstable3257
gallaghe,2013-07-11T20:25:46.04Z,1744,1744,Binary .NET library of language extension methods. Source code is here http://code.msdn.microsoft.com/Working-with-Language-b77fe21f,TeamLibPackage,False,2013-07-11T13:25:46.04-07:00,True,False,,,641,False,1.0.1
MvvmCross,2013-07-12T06:59:52.717Z,43209,1743,This package contains the 'Droid Dialog' assemblies for MvvmCross v3 - Hot Tuna. This and other packages are currently under development...,MvvmCross.HotTuna.Droid.Dialog,True,1899-12-31T16:00:00-08:00,False,False,,,-1,False,3.0.9-beta7
Damian Hickey,2013-07-12T20:06:46.78Z,43209,1743,An implementation of HttpMessageHandler that invokes requests against an OWIN application. Useful for testing and embedded scenarios.,Owin.HttpMessageHandler,False,1899-12-31T16:00:00-08:00,False,False,,,-1,False,0.1.0.43
Paul Jenkins; Jake Ginnivan,2013-07-12T08:59:14.96Z,38,1743,"The goal of MahApps.Metro is to allow devs to quickly and easily cobble togther a ""Metro"" UI for their WPF4+ apps, with minimal effort.",MahApps.Metro,True,2018-03-13T22:31:08.54+00:00,True,False,"The goal of MahApps.Metro is to allow devs to quickly and easily cobble togther a ""Metro"" UI for their WPF4+ apps, with minimal effort.","WPF,UI,Metro",1280769,True,0.11.0.41-ALPHA
MvvmCross,2013-07-12T09:47:38.21Z,43209,1743,This package contains the 'Droid Dialog' assemblies for MvvmCross v3 - Hot Tuna. This and other packages are currently under development...,MvvmCross.HotTuna.Droid.Dialog,True,1899-12-31T16:00:00-08:00,False,False,,,-1,False,3.0.9-beta8
GeertvanHorrik,2013-07-11T21:58:56.537Z,507,1744,Catel.Extensions.Data library which provides data classes such as repositories.,Catel.Extensions.Data,True,2016-11-29T05:35:59.533-08:00,True,False,,"catel,data,repository,repositories",103618,True,3.6.1307112354-beta
Frozen Mountain Software,2013-07-12T22:10:57.383Z,84,1743,A client-side library for JavaScript that provides an aspect-oriented framework for developing RESTful APIs.,FM.TheRest.JS,False,2018-01-26T02:27:09.117+00:00,True,False,,"TheRest,Client,REST,RESTful,JavaScript",15448,False,2.3.2
NServiceBus Ltd,2013-07-12T07:46:00.667Z,63,1743,The Autofac Container for the nservicebus,NServiceBus.Autofac,True,2018-02-16T08:25:42.907+00:00,True,False,,"nservicebus,servicebus,msmq,cqrs,publish,subscribe",279857,False,4.1.0-unstable3260
MvvmCross,2013-07-12T06:59:43.427Z,43209,1743,This package contains the 'Getting Started' assemblies for MvvmCross v3 - Hot Tuna. This and other packages are currently under development...,MvvmCross.HotTuna.StarterPack,True,1899-12-31T16:00:00-08:00,False,False,,,-1,False,3.0.9-beta7
Contoso,2013-07-11T21:16:31.657Z,1744,1744,This package contains a Memcached implementation of the abstract ServiceCache.,BclEx-Abstract.Memcached,False,2013-07-11T14:16:31.657-07:00,True,False,,"memcache,memcached,cache,servicecache,bclex",610,False,1.0.0
Pierre Chalamet,2013-07-12T22:15:57.797Z,289,1743,"cassandra-sharp - high performance .NET driver for Apache Cassandra.

Please note only binary protocol (cql 3) is supported - this requires Apache Cassandra 1.2.

Major features:
* async operations (TPL tasks / Rx subscriptions)
* Rx interface (IObservable / IObserver) for result streaming
* TPL Task (compatible with C# 5 async) for future operations
* Linq friendly
* extensible rowset mapping (poco, property bag, params out of the box)
* blazing fast object marshaler (dynamic gen'ed code)
* robust connection handling (connection recovery supported)
* ability to understand performance issues (client and server side)
* multiple extension points
* timeout support
* command line tool (cqlplus)
* .NET 4.0+ support (Microsoft .NET / Mono)

Release notes: https://raw.github.com/pchalamet/cassandra-sharp/master/CHANGES.txt

For information, bug reports, suggestions or contributions: https://github.com/pchalamet/cassandra-sharp",cassandra-sharp,False,2017-07-05T13:10:12.117-07:00,True,False,"cassandra-sharp is a high performance .NET driver for Apache Cassandra, fully supporting asynchronous operations (using TPL and Rx) and CQL 3 binary protocol.","apache,cassandra,driver,net40,net45,mono,database,nosql,tpl,rx,reactive,high,performance,streaming",16782,False,3.3.1
MvvmCross,2013-07-12T06:58:42.117Z,43209,1743,This package contains the 'Bookmarks' plugin for MvvmCross v3 - Hot Tuna. This and other packages are currently under development...,MvvmCross.HotTuna.Plugin.Bookmarks,True,1899-12-31T16:00:00-08:00,False,False,,"mvvm,mvvmcross,xamarin,monodroid,monotouch,wpf,windows8,winrt,netcore,wp,wpdev,windowsphone",-1,False,3.0.9-beta7
TheHunter,2013-07-11T21:44:41.987Z,1200,1744,"This library is designed for transforming objects through an object Mapper / Merger, which contains a set of actions for mapping properties from source object into destination object.
This library can be useful when applications need to transform business data into DTO objects, or maybe in another complex context when (for example) applications need to set some properties, and this is possible by custom filters.",DynamicMapResolver,False,2015-01-06T09:51:04.053-08:00,True,False,DynamicMapResolver is a library used for transforming  input objects into custom output objects through  a set of actions which map properties from input  object type into output object type.,,3017,False,1.0.0
Scott Xu,2013-07-13T11:36:10.14Z,43209,1742,"Safely dispose WCF client when release Ninject kernel 
Abort when in faulted state and try close before the final dispose",Ninject.Extensions.WcfClientDisposableKernel,True,1899-12-31T16:00:00-08:00,False,False,,"wcf,client,clientbase,using,Ninject,dispose,abort,close",-1,False,1.0.0-beta1
NServiceBus Ltd,2013-07-12T21:01:43.61Z,63,1743,The StructureMap Container for the nservicebus,NServiceBus.StructureMap,True,2018-02-16T08:26:21.58+00:00,True,False,,"nservicebus,servicebus,msmq,cqrs,publish,subscribe",211946,False,4.1.0-unstable3262
Michiel van Oosterhout,2013-07-13T11:33:50.463Z,1742,1742,"Use this package if you need to parse or format RFC 822 formatted dates, like those found in RSS feeds. An RFC 822 formatted date time may look something like this: ""Sun, 18 Nov 2012 20:32 +0100""",Rfc822,False,2013-07-13T04:35:51.613-07:00,True,False,Parse or write a date and time formatted according to the RFC 822 specification.,"RFC,822,RSS",7832,False,1.0.2
Contoso,2013-07-11T21:17:02.013Z,1744,1744,This package contains a Rhino Service Bus implementation of the abstract ServiceBus.,BclEx-Abstract.RhinoServiceBus,False,2013-07-11T14:17:02.013-07:00,True,False,,"rhino,rhino-esb,servicebus,bclex",587,False,1.0.0
Contoso,2013-07-11T21:16:51.107Z,1744,1744,This package contains a Ninject implementation of the abstract ServiceLocator.,BclEx-Abstract.Ninject,False,2013-07-11T14:16:51.107-07:00,True,False,,"ninject,servicelocator,ioc,di,bclex",613,False,1.0.0
huan,2013-07-12T10:27:05.707Z,1742,1743,Phan Thi Admin,PTAdmin,False,2013-07-12T21:33:11.327-07:00,True,False,,"Phan,thi",1515,False,1.0.0
"Justin Adler,Phillip Haydon and contributors",2013-07-13T12:03:48.507Z,43209,1742,"Used with SimpleAuthentication, provides automated configuration for ASP.NET Mvc projects.",SimpleAuthentication.Mvc,False,1899-12-31T16:00:00-08:00,False,False,"An ASP.NET Mvc plugin for SimpleAuthentiction. It provides a default controller, routes and uses WebActivator to auto-wire up those routes.","authentication,mvc,controller,twitter,google,facebook,microsoftaccount,oauth,oauth1,oauth2,openid,unicorn,magicalunicorn,magical-unicorn,worlddomination,worldomination",-1,False,0.3.0
S. van Deursen,2013-07-12T15:42:49.217Z,5,1743,Quick Start for Simple Injector WCF integration. This package adds the needed dependencies and code examples to get started quickly with Simple Injector in an WCF application.,SimpleInjector.Integration.Wcf.QuickStart,False,2018-04-15T09:24:39.067+00:00,True,False,Quick Start for Simple Injector WCF integration.,"quick,start,quickstart,simpleinjector,architecture,dependency-injection,DI,easy,easy-to-use,Inversion-of-Control,IOC,Servicelocator,per-web-request,web,wcf,integration",30245,False,2.3.1
Contoso,2013-07-11T21:17:16.483Z,1744,1744,his package contains a StructureMap implementation of the abstract ServiceLocator.,BclEx-Abstract.StructureMap,False,2013-07-11T14:17:16.483-07:00,True,False,,"structuremap,servicelocator,ioc,di,bclex",601,False,1.0.0
ByteScout,2013-07-12T08:34:14.993Z,9,1743,"Bytescout PDF To HTML SDK for .NET ASP.NET, ActiveX

(c) ByteScout 2008-2013

Bytescout PDF To HTML SDK converts PDF to HTML without any additional software required.

Benefits:

- converts PDF to HTML with layout preserved;
- text, fonts, images, tables are preserved;
- vector graphics is preserved (as a background images)
- precise positioning of text and images to reproduce the original PDF file
- doesn't require Adobe Reader or any other 3rd software to be installed;
- works with .NET 2.00, 3.5, 4.00 for desktop applications;
- works with ASP.NET 2.00, 3.5, 4.00 for web-applications;
- provides access via ActiveX interface for use by legacy programming languages (Visual Basic 6, old versions of Delphi) and scripting (VBscript and others);

http://bytescout.com/",Bytescout.PDF2HTML,False,2018-04-11T12:21:16.477+00:00,True,False,,"bytescout,pdf,html,to,htm,text",5272,False,3.20.0.1076
Mark Seemann,2013-07-11T21:06:56.373Z,4,1744,Ubiquitous use of AutoFixture for unit testing has given rise to a number of idiomatic unit tests - unit tests that tend to follow common templates. The AutoFixture Idioms library encapsulates these idioms into reusable classes and methods.,AutoFixture.Idioms,False,2018-04-16T15:25:08.98+00:00,True,False,Extension to AutoFixture that contains unit testing idioms.,,160046,True,3.6.1
MvvmCross,2013-07-12T06:58:34.71Z,43209,1743,This package contains the 'Droid Fragment' assemblies for MvvmCross v3 - Hot Tuna. This and other packages are currently under development...,MvvmCross.HotTuna.Droid.Fragging,True,1899-12-31T16:00:00-08:00,False,False,,,-1,False,3.0.9-beta7
Framework One,2013-07-13T11:39:10.527Z,10,1742,The modules required to build CloudCore-based web modules.,CloudCore.Web,False,2018-04-10T10:18:11.247+00:00,True,False,,,73222,False,1.1.79
NServiceBus Ltd,2013-07-11T21:01:21.387Z,1283,1744,The Interfaces for NServiceBus Implementation,NServiceBus.Interfaces,True,2014-10-14T20:53:16.433-07:00,True,False,,"nservicebus,servicebus,msmq,cqrs,publish,subscribe",389461,False,4.0.0-unstable3257
NServiceBus Ltd,2013-07-12T21:00:42.26Z,417,1743,Azure support for NServicebus,NServiceBus.Azure,True,2017-02-27T15:06:56.187-08:00,True,False,,"nservicebus,servicebus,msmq,cqrs,publish,subscribe",154035,False,4.1.0-unstable3262
Mark Seemann,2013-07-11T21:06:49.567Z,4,1744,"This extension turns AutoFixture into an Auto-Mocking Container. The mock instances are created by Moq. To use it, add the AutoMoqCustomization to your Fixture instance. Read more at http://blog.ploeh.dk/2010/08/19/AutoFixtureAsAnAutomockingContainer.aspx",AutoFixture.AutoMoq,False,2018-04-16T15:24:18.43+00:00,True,False,Turns AutoFixture into an Auto-Mocking Container based on Moq.,,885226,True,3.6.1
NServiceBus Ltd,2013-07-12T07:45:45.277Z,14,1743,The most popular open-source service bus for .net,NServiceBus,True,2018-04-06T19:48:02.973+00:00,True,False,,"nservicebus,servicebus,msmq,cqrs,publish,subscribe",1169248,False,4.1.0-unstable3260
Kenji Wada,2013-07-12T08:11:13.853Z,1597,1743,Manages application files and settings for Windows Phone/Windows store apps projects.,Softbuild.Data,False,2013-12-04T16:54:56.887-08:00,True,False,,,1924,False,1.0.0
MvvmCross,2013-07-12T09:47:24.83Z,43209,1743,This package contains the 'WebBrowser' plugin for MvvmCross v3 - Hot Tuna. This and other packages are currently under development...,MvvmCross.HotTuna.Plugin.WebBrowser,True,1899-12-31T16:00:00-08:00,False,False,,"mvvm,mvvmcross,xamarin,monodroid,monotouch,wpf,windows8,winrt,netcore,wp,wpdev,windowsphone",-1,False,3.0.9-beta8
Paul Jenkins; Jake Ginnivan,2013-07-12T08:57:31.527Z,38,1743,"The goal of MahApps.Metro is to allow devs to quickly and easily cobble togther a ""Metro"" UI for their WPF4+ apps, with minimal effort.",MahApps.Metro,True,2018-03-13T22:31:08.54+00:00,True,False,"The goal of MahApps.Metro is to allow devs to quickly and easily cobble togther a ""Metro"" UI for their WPF4+ apps, with minimal effort.","WPF,UI,Metro",1280769,True,0.11.0.39-ALPHA
Contoso,2013-07-11T21:12:14.637Z,43209,1744,This package contains a Castle Windsor implementation of the abstract ServiceLocator.,BclContrib-Abstract.CastleWindsor,False,1899-12-31T16:00:00-08:00,False,False,,"castle,windsor,servicelocator,ioc,di,bclex",-1,False,1.0.1
NServiceBus Ltd,2013-07-12T07:46:36.047Z,1283,1743,The Interfaces for NServiceBus Implementation,NServiceBus.Interfaces,True,2014-10-14T20:53:16.433-07:00,True,False,,"nservicebus,servicebus,msmq,cqrs,publish,subscribe",389461,False,4.1.0-unstable3260
NServiceBus Ltd,2013-07-11T21:01:00.36Z,63,1744,"The hosting template for the nservicebus, The most popular open-source service bus for .net",NServiceBus.Host,True,2018-02-16T08:27:09.05+00:00,True,False,,"nservicebus,servicebus,msmq,cqrs,publish,subscribe",446743,False,4.0.0-unstable3257
Stajs,2013-07-12T12:02:10.147Z,1732,1743,Proxy-friendly web caching.,WebCache,True,2013-07-23T04:22:36.863-07:00,True,False,,,1241,False,0.1.0-alpha4
Contoso,2013-07-11T21:12:04.743Z,43209,1744,"This package contains abstractions to provide standard Interfaces, or Abstracts, for common services typicality re-implemented in various Projects/Assemblies. Utilizing a standards based Type allows services to flow between otherwise disconnected Assemblies.",BclContrib-Abstract,False,1899-12-31T16:00:00-08:00,False,False,,"abstract,nosql,interface,ioc,di,aggregateroot,servicebus,servicelocator,bclex",-1,False,1.0.1
Bill Sorensen,2013-07-12T02:46:13.95Z,1678,1743,"A simple ""stateless"" finite-state machine library for .NET.",FSM.NET,False,2013-09-15T16:45:02.33-07:00,True,False,,"statemachine,stateless,fsm,F#,fsharp,csharp,C#",1028,False,2.0.0
Contoso,2013-07-11T21:16:28.173Z,1744,1744,This package contains a Log4Net implementation of the abstract ServiceLog.,BclEx-Abstract.Log4Net,False,2013-07-11T14:16:28.173-07:00,True,False,,"log4net,servicelog,log,logging,bclex",596,False,1.0.0
eXpand,2013-07-11T22:46:24.873Z,1715,1744,ViewVariants Module (Win) / eXpand Framework,eXpandViewVariantsWin,False,2013-08-09T07:43:42.687-07:00,True,False,ViewVariants Module (Win) / eXpand Framework,"DevExpress,eXpand",30860,False,13.1.5.6
NServiceBus Ltd,2013-07-12T07:47:21.303Z,63,1743,The Unity Container for the nservicebus,NServiceBus.Unity,True,2018-02-16T08:26:32.347+00:00,True,False,,"nservicebus,servicebus,msmq,cqrs,publish,subscribe",180078,False,4.1.0-unstable3260
Dmitry Kischenko,2013-07-12T08:33:41.847Z,60,1743,xFunc.Maths is a simple and easy to use library that allows you to build mathematical expressions.,xFunc.Maths,False,2018-02-19T19:40:50.55+00:00,True,False,,"Math,Expression,Expressions,Parser,MathParser,Differentiation,Simplification",14355,False,2.3.2
Mark Seemann,2013-07-11T21:06:45.397Z,4,1744,"AutoFixture makes it easier for developers to do Test-Driven Development by automating non-relevant Test Fixture Setup, allowing the Test Developer to focus on the essentials of each test case.",AutoFixture,False,2018-04-16T15:23:24.43+00:00,True,False,,,3115138,True,3.6.1
Contoso,2013-07-11T21:17:05.323Z,1744,1744,This package contains a Server AppFabric implementation of the abstract ServiceCache.,BclEx-Abstract.ServerAppFabric,False,2013-07-11T14:17:05.323-07:00,True,False,,"appfabric,servicecache,bclex",639,False,1.0.0
eXpand,2013-07-11T22:47:03.08Z,11,1744,Dashboard Module / eXpand Framework,eXpandDashboard,False,2018-04-09T16:10:29.52+00:00,True,False,Dashboard Module / eXpand Framework,"DevExpress,eXpand",49792,False,13.1.5.6
kazuk,2013-07-12T04:19:34.41Z,1187,1743,create a nuget package on build.,OnBuild.PackageAssemblyForNuget,False,2015-01-18T17:53:08.813-08:00,True,False,,,2733,False,1.0.1
Contoso,2013-07-11T21:16:25.017Z,1744,1744,This package contains a Hiro implementation of the abstract ServiceLocator.,BclEx-Abstract.Hiro,False,2013-07-11T14:16:25.017-07:00,True,False,,"hiro,servicelocator,ioc,di,bclex",755,False,1.0.0
Giacomo Canonico,2013-07-12T13:46:28.897Z,1544,1743,Joshua 3.0 Twitter plugin,Joshua.plugins.twitter,False,2014-01-27T01:38:57.947-08:00,True,False,,,1125,False,1.0.3
Contoso,2013-07-11T21:39:26.227Z,1744,1744,This package contains System.Web extentions for MVC 2.,BclEx-Web.Mvc2,False,2013-07-11T14:39:26.227-07:00,True,False,,"mvc,mvc2,web,bclex",597,False,1.0.0
Robert May,2013-07-11T23:06:19.243Z,43209,1744,"Database Deploy is a mechanism for scripting updates to your database.  DbDeploy will evaluate a given database for the script version currently installed and dynamically update the database to the latest version, based on your script files.

DbDeploy can be run as a build task, from the command line, or from many other automated deployment technologies.

DbDeploy will also create scripts that are SqlAzure friendly.

DbDeployNet2 is a codeplex open source project.  You can get the source at http://dbdeploynet2.codeplex.com",DbDeployNet2_1.0.1.1,False,1899-12-31T16:00:00-08:00,False,False,Database Deploy is a mechanism for scripting updates to your database.,"Database,Deploy,dbdeploy,db,migrations,Migrations",-1,False,1.0.1.1
"Gregory Nickonov,Andrew Nefedkin",2013-07-12T13:16:22.42Z,1299,1743,Windows Phone adaptor for Digillect Model-View-ViewModel Framework,Digillect.Mvvm.WindowsPhone,False,2014-09-29T05:31:25.97-07:00,True,False,,"digillect,mvvm,windowsphone,wp8,wp71,wp75",2531,False,2.2.1
Paolo Possanzini,2013-07-12T12:56:37.567Z,1396,1743,"JoshuaCMS is a Content Management System for Microsoft asp.net mvc 4.

Default username: admin
Default password: root",Joshua.base,False,2014-06-24T00:48:02.153-07:00,True,False,,"mvc,cms,joshua,razor,jquery,azure",21831,False,3.1.3
eXpand,2013-07-11T22:43:26.117Z,1715,1744,ConditionalObjectView Module  / eXpand Framework,eXpandConditionalObjectView,False,2013-08-09T07:40:48.087-07:00,True,False,ConditionalObjectView Module / eXpand Framework,"DevExpress,eXpand",5850,False,13.1.5.6
Frozen Mountain Software,2013-07-12T22:10:55.72Z,48,1743,A client-side library for .NET that provides an aspect-oriented framework for developing RESTful APIs. (Community Edition),FM.TheRest,False,2018-03-03T21:26:00.877+00:00,True,False,,"TheRest,Client,REST,RESTful,.NET",14955,False,2.3.2
