authors,created,description,id,is_prerelease,last_updated,listed,missing_info,summary,tags,total_downloads,verified,versionOleg Shilo,2015-09-28T01:16:25.02Z,"Wix# is a framework for building a complete MSI or WiX source code by using build script files written with the C# syntax.
The package contains the binaries only.  In order to use this package you need have WiX Toolset installed.
The package is tested against WIX (Windows Installer Xml) version v3.9.1208.0",WixSharp.bin,True,2018-04-14T10:47:22.967+00:00,True,False,Wix# (WixSharp) - Binaries,"C#,scripting,msi,install,setup,wix",63547,False,1.0.27.1-HotFix
tanaka_733,2015-09-28T05:23:40.607Z,Chatwork API Client,Chatwork.Api,False,2017-05-28T02:00:38.13-07:00,True,False,,chatwork,7310,False,0.3.4
Team XSockets Sweden AB,2015-09-28T07:59:03.34Z,Item Templates for XSockets in Visual Studio,XSockets.ItemTemplates,False,2017-03-21T06:15:40.17-07:00,True,False,Item Templates for XSockets in Visual Studio,"Websockets,sockets,WebRTC,Realtime,XSockets,m2m,p2p,client,server,IoT",4780,False,5.0.0
"XAct Software Solutions,Inc.",2015-09-28T11:19:17.527Z,An XActLib assembly: library of code to work with Windows Workflow,XAct.Workflows.WWF,False,2017-02-08T17:58:17.01-08:00,True,False,,"XAct,XActLib",43278,False,0.0.5003
Chillisoft,2015-09-28T04:02:19.743Z,Habanero.Binding,Habanero.Binding,True,2017-04-20T04:02:51.37+00:00,True,False,,,143162,False,1.2.2022-prerelease
Mike,2015-09-27T19:24:49.3Z,Common Shareable Library,CMShareable,False,2018-01-24T22:40:36.053+00:00,False,False,,"Shareable,Library,Helper,AbstractDao",13164,False,0.2.34
Konstantinos Papakonstantinou,2015-09-27T23:06:08.873Z,A simple wrapper for reading typed values from ConfigurationManager.AppSettings,SimpleAppSettings,False,2015-09-27T16:46:23.393-07:00,False,False,,,975,False,0.1.0.2
Chris Patterson,2015-09-28T03:59:06.387Z,"Automatonymous, an open source state machine library, usable with MassTransit.",Automatonymous,False,1900-01-01T00:00:00+00:00,False,False,"Automatonymous, an open source state machine library, usable with MassTransit",MassTransit,80187,False,3.0.6
Team XSockets Sweden AB,2015-09-28T07:58:06.023Z,A fallback from websockets to WebAPI in .NET 4.5,XSockets.Fallback,False,2015-11-26T16:59:48.563+00:00,True,False,A fallback from websockets to WebAPI in .NET 4.5,"RealTime,WebSockets,Fallback,WebAPI",17935,False,5.0.0
"XAct Software Solutions,Inc.",2015-09-28T10:13:52.927Z,An XActLib assembly: an Assembly that provides a Log4NetTraceListener (rerouting XAct.Diagnostics.Trace calls to Log4Net -- nice!) as well as Log4Net specific implementation of the core Tracing service.,XAct.Diagnostics.Log4Net,False,2017-02-08T17:57:07.633-08:00,True,False,,"XAct,XActLib",92086,False,0.0.5003
"XAct Software Solutions,Inc.",2015-09-28T10:41:32.127Z,"An XActLib assembly: an implementation of the Markdown service contracts defined in XAct.IO.Transformations.Markdown, using the MarkdownDeep library.",XAct.IO.Transformations.MarkDown.MarkdownDeep,False,2015-11-02T03:31:31.307-08:00,True,False,,"XAct,XActLib",54665,False,0.0.5003
Paket team,2015-09-28T08:58:25.58Z,A package dependency manager for .NET with support for NuGet packages and GitHub repositories.,paket.bootstrapper,False,2018-02-23T08:19:46.023+00:00,True,False,A package dependency manager for .NET with support for NuGet packages and GitHub repositories.,"nuget,bundler,F#",6943,False,2.4.0
AmamiyaYuuko,2015-09-28T04:45:49.287Z,ASP.Net vNext testing helper,CodeComb.Testing,True,2015-11-19T03:32:12.44-08:00,True,False,,"vNext,ASP.Net,MVC,Dnx,Host",2557,False,1.0.4-beta8-15875
Sinch AB,2015-09-28T07:50:21.283Z,Sinch Callback SDK.  Validates the message integrity of callbacks from Sinch,Sinch.ServerSdk.Callback.WebApi,False,2015-09-29T08:45:01.203+00:00,True,False,,"sinch,sms,messaging,callback,request,signing,validate,filter,messagehandler,delegatinghandler",1117,False,1.0.0.1
Alain Defrance,2015-09-28T06:58:04.833Z,Lightweight documentation tool,Projbook,False,2016-10-27T20:51:02.14-07:00,False,False,,,8257,False,0.1.1
ScottIsAFool,2015-08-20T08:56:07.523Z,Helper library to more easily create the notification to display an interactive notification,InteractiveToastExtensions,False,1899-12-31T16:00:00-08:00,False,False,,"interactive,Toast,notification,uwp",-1,False,1.0.2
Rob Janssen,2015-09-25T08:59:10.547Z,PostcodeNlApi provides an API to directly talk with the Postcode.nl API through the REST endpoint offered into your .NET (web)applications.,PostcodeNlApi,False,2015-09-25T01:59:10.547-07:00,True,False,PostcodeNlApi provides an API to directly talk with the Postcode.nl API through the REST endpoint offered into your .NET (web)applications.,"Postcode.nl,ASP.Net",1482,False,1.0.0
Renato Golia,2015-09-28T06:54:31.663Z,Nybus bus based on MassTransit,Nybus.MassTransit,False,2016-11-27T17:35:53.8-08:00,True,False,,,6695,False,0.4.0.65
Bryan Apellanes,2015-09-28T00:56:47.72Z,Basic user account management system for use with Bam,Bam.Net.UserAccounts,False,2018-01-25T03:48:54.393+00:00,True,False,,,10462,False,1.0.8
juchen,2015-09-28T02:11:22.683Z,Add the ApiExplorer Extension,CustomApiExplorer,False,2015-09-27T19:11:22.683-07:00,True,False,extend ApiExplorer,ApiExplorer,503,False,1.0.0
Alex Jorgenson,2015-09-28T01:01:14.56Z,A simple .net library for working with intervals of comparable types.,Jorgy.Intervals,False,2015-09-27T18:01:14.56-07:00,True,False,,"Interval,Intervals",287,False,0.1.0
Kevin Montrose,2015-09-28T03:08:42.73Z,A fast JSON serializer and deserializer.,Jil,False,2017-08-23T20:49:28.65+00:00,True,False,,json,456738,False,2.12.1
"XAct Software Solutions,Inc.",2015-09-28T08:29:33.207Z,An XActLib assembly: an Assembly that provides implementations of Repositories for EF40 and later suitable for working with POCOs as well as CodeFirst.,XAct.Data.EF,False,2015-11-02T03:19:10.707-08:00,True,False,,"XAct,XActLib",58687,False,0.0.5002
Johann Brink,2015-09-28T12:02:36.483Z,"A package that implements Auditing for Entity Framework 7 based DbContexts. It is extensible to allow other logging providers like MongoDB, Azure tables etc.
Just inherit AuditingDbContext from your application's DbContext and use the overloaded SaveChange(string userName) instead of the standard SaveChanges().",EFAuditing,False,1899-12-31T16:00:00-08:00,False,False,"A package that implements Auditing for Entity Framework 7 based DbContexts. It is extensible to allow other logging providers like MongoDB, Azure tables etc.
Just inherit AuditingDbContext from your application's DbContext and use the overloaded SaveChange(string userName) instead of the standard SaveChanges().
 Please see https://www.nuget.org/packages/EFAuditing.MongoDB for our MongoDB AuditLogProvider that extends EFAuditing's capabilities.","EntityFramework,EF7,Mongo,MongoDB,Audit,Auditing",-1,False,1.0.6
Alain Defrance,2015-09-28T07:20:03.423Z,Lightweight documentation tool,Projbook,False,2016-10-27T20:51:02.14-07:00,False,False,,,8257,False,0.1.3
Gibraltar Software,2015-09-27T23:03:54.733Z,"Contains the various types and attributes necessary to create
extensions for Loupe Desktop and Server.  This assembly
is not used when collecting information within your application, to customize
data collection see the Loupe Agent.",Loupe.Extensibility,False,2018-03-18T00:31:58.423+00:00,True,False,,"Loupe,Logging",901,False,4.0.0.3015
Gibraltar Software,2015-09-27T23:31:20.633Z,"Records performance and tracing information for EF interactions while your application runs.  Designed for use in a production environment, it extends the Loupe Agent with features specific to Entity Framework (6 and later) and works with any EF provider.",Gibraltar.Agent.EntityFramework,False,2015-09-27T16:31:20.633-07:00,True,False,,"Loupe,Logging,Entity,Framework,EntityFramework,EF",10268,False,4.0.0.3015
"Robert Moore,Matthew Davies",2015-09-28T02:48:30.127Z,"Provides an NHibernate driver that uses the Microsoft Transient Fault Handling library to allow for reliable SQL Azure connections.
      This package has the Microsoft Transient Fault Handling library IL-merged into it; for a version that doesn't see the NHibernate.SqlAzure.Standalone package.",NHibernate.SqlAzure,False,2018-02-18T01:38:59.407+00:00,True,False,,"nhibernate,azure,sql,transient",62772,False,2.1.3
rasmus,2015-09-28T11:30:00.507Z,Event Store event store for EventFlow. Download it from https://geteventstore.com/.,EventFlow.EventStores.EventStore,False,2018-02-25T21:50:54.197+00:00,True,False,,"CQRS,ES,event,sourceing,store,eventstore",7015,False,0.17.1134
Team XSockets Sweden AB,2015-09-28T08:02:47.833Z,The assemblies needed to run a XSockets.NET server,XSockets.Server,False,2017-11-20T17:57:30.24+00:00,True,False,The assemblies needed to run a XSockets.NET server,"XSockets,Controllers,IoT,RealTime,WebSockets",67108,False,5.0.0
juniho,2015-09-28T03:53:57.687Z,Base classes from RabbitSoftware,Rabbit.Foundation,False,2016-06-16T04:04:04.577-07:00,True,False,,"RabbitSoftware,SmartList",4680,False,1.5.0
"XAct Software Solutions,Inc.",2015-09-28T09:55:55.897Z,An XActLib assembly: common code specific Collections,XAct.Collections,False,2017-02-08T17:56:52.837-08:00,True,False,,"XAct,XActLib",100518,False,0.0.5003
"XAct Software Solutions,Inc.",2015-09-28T11:23:02.86Z,"An XActLib assembly: library to implement the persistence of the entities within XAct.Assitance.Tips to a datastore, using Entity Framework.",XAct.Users.Tips.Persistence.EF,False,2017-02-09T01:58:18.23+00:00,True,False,,"XAct,XActLib",16449,False,0.0.5003
"XAct Software Solutions,Inc.",2015-09-28T09:13:01.31Z,An XActLib assembly: base library for code to do with image manipulation or analysis.,XAct.Imaging,False,2017-02-08T17:57:21.133-08:00,True,False,,"XAct,XActLib",54045,False,0.0.5002
"XAct Software Solutions,Inc.",2015-09-28T11:14:57.813Z,An XActLib assembly: the base class for functionality required on a web server.,XAct.Web,False,2017-02-09T01:58:13.103+00:00,True,False,,"XAct,XActLib",30347,False,0.0.5003
"Robert Moore,Matthew Davies",2015-09-28T02:49:25.77Z,"Provides an NHibernate driver that uses the Microsoft Transient Fault Handling library to allow for reliable SQL Azure connections.
      Unlike NHibernate.SqlAzure, this library doesn't come with TransientFaultHandling IL-merged - instead it's a NuGet dependency.",NHibernate.SqlAzure.Standalone,False,2018-02-17T23:56:41.957+00:00,True,False,,"nhibernate,azure,sql,transient",7429,False,2.1.3
"XAct Software Solutions,Inc.",2015-09-28T08:45:45.823Z,An XActLib Asssembly: an Assembly providing a Service to work with PerformanceCounters.,XAct.Diagnostics.Performance,False,2017-02-08T17:57:09.18-08:00,True,False,,"XAct,XActLib",54656,False,0.0.5002
ScottIsAFool,2015-08-20T09:30:48.9Z,Helper library to more easily create the notification to update tiles for all sizes,AdaptiveTileExtensions,False,1899-12-31T16:00:00-08:00,False,False,,"Adaptive,tiles,uwp",-1,False,1.0.1
Andrey Poltavets,2015-09-28T06:59:37.35Z,Bitpool rest api client. This version supports .net framework 4.5.2,BitPool.Client,False,2017-12-12T05:21:03.997+00:00,False,False,,,2134,False,1.0.4
Gibraltar Software,2015-09-28T00:29:43.38Z,"Records diagnostic information about your ASP.NET web site in the background while it runs.  Designed for use in a production environment, it extends the Loupe Agent with features specific to ASP.NET WebForms.",Gibraltar.Agent.Web,False,2016-07-04T14:22:07.237-07:00,True,False,,"Loupe,Logging,ASP.NET,WebForms",21033,False,4.0.0.3015
CityIndex Ltd,2015-09-28T07:37:54.08Z,LogSearchShipper client,LogSearchShipper,False,1899-12-31T16:00:00-08:00,False,False,,,4392,False,1.0.5749.26311
"XAct Software Solutions,Inc.",2015-09-28T11:10:44.87Z,"An XActLib assembly: a library to ease testing of XActLib, as well as applications built with it.",XAct.Tests,False,2017-02-08T17:58:03.37-08:00,True,False,,"XAct,XActLib",37496,False,0.0.5003
Carlos G. Sarmiento,2015-09-28T06:14:46.517Z,The dynamic configuration manager for .NET,DynamiConf.AzureLocator,False,2015-09-28T20:26:35.033-07:00,True,False,,"Configuration,Dynamic,DynamiConf,Conf,Azure,Blob",1040,False,0.2.3
"Chris Patterson,Dru Sellers,Travis Smith",2015-09-28T04:35:06.32Z,"MassTransit is a distributed application framework for .NET, including support for RabbitMQ and Azure Service Bus.",MassTransit.Host,False,2018-04-17T18:22:14.24+00:00,True,False,MassTransit Host Service,MassTransit,10212,False,3.0.13
AmamiyaYuuko,2015-09-28T04:36:50.97Z,ASP.Net Dnx Test Host,CodeComb.TestHost,True,1899-12-31T16:00:00-08:00,False,False,,"vNext,ASP.Net,MVC,Dnx,Host",-1,False,1.0.1-beta8-15875
Team XSockets Sweden AB,2015-08-05T19:29:07.33Z,Real-Time framework for everything,XSockets,True,2017-11-20T17:58:40.847+00:00,False,False,Runs everywhere and is always realtime (full duplex). Connects anything!,"Websockets,sockets,WebRTC,Realtime,XSockets,m2m,p2p,client,server,IoT",74363,False,5.0.0-rc2
effyt,2015-09-28T12:42:04.527Z,"C# client library for Gremlin
See more details here:
https://github.com/effyteva/CSharpLibraries/tree/master/Teva.Common.Data.Gremlin",Teva.Common.Data.Gremlin,False,1899-12-31T16:00:00-08:00,False,False,,,1224,False,1.0.0
"XAct Software Solutions,Inc.",2015-09-28T11:05:32.017Z,"An XActLib assembly: an implementation of IHostSettingsService, implemented around the AppSettings section in an app's config file.",XAct.Settings.Persistence.AppSettings,False,2017-02-09T01:57:57.243+00:00,True,False,,"XAct,XActLib",57707,False,0.0.5003
新生命开发团队,2015-09-28T02:07:30.577Z,日常开发中的各种基础功能,NewLife.Core,False,2018-04-14T10:24:59.6+00:00,True,False,,"新生命团队,X组件,NewLife",8157,False,5.4.5749.17541
"XAct Software Solutions,Inc.",2015-09-28T10:47:40.417Z,An XActLib assembly: Service for delivering Messages via SMTP,XAct.Net.Messaging.SMTP,False,2017-02-08T17:57:38.977-08:00,True,False,,"XAct,XActLib",45722,False,0.0.5003
"PulseBridge,Inc.",2015-09-25T18:28:24.513Z,Tooling support for cross-platform build automation.,PulseBridge.Condo,True,2016-06-17T18:35:26.077+00:00,False,False,,"build,asp.net,dnx,xplat",5271,False,1.0.0-rc-00045
Bryan Apellanes,2015-09-28T00:45:28.747Z,Basic color and graphics management,Bam.Net.Drawing,False,2018-01-25T03:45:40.527+00:00,True,False,,,10530,False,1.0.8
Bryan Apellanes,2015-09-28T00:48:43.443Z,Basic dependency injection container used by the Bam framework,Bam.Net.Incubation,False,2018-01-25T03:46:18.027+00:00,True,False,,,9918,False,1.0.8
AndreyPoltavets,2015-09-25T13:45:07.29Z,Bitpool rest api client,BitPool.Client,False,2017-12-12T05:21:03.997+00:00,False,False,Current version supports .net framework 4.5.2,,2134,False,1.0.3
Naked Objects Group Ltd,2015-09-25T12:06:24Z,"This is the package used to upgrade an existing NakedObjects.Mvc project. It updates the assemblies, and adds a .zip of other files that might need to be merged with your own changes. (If you are starting from scratch, install NakedObjects.Mvc-FileTemplates)",NakedObjects.Mvc-Assemblies,False,1899-12-31T16:00:00-08:00,False,False,,"naked,objects,nakedobjects,asp.net,mvc,ddd,domain,driven,design",-1,False,7.0.10
Cady.IO,2015-09-28T03:16:02.387Z,A ceollection of .Net utilities for Azure,Dewey.Net.Azure,False,1899-12-31T16:00:00-08:00,False,False,,,-1,False,1.2.0
"Chris Patterson,Dru Sellers,Travis Smith",2015-09-28T04:41:15.723Z,"MassTransit is a distributed application framework for .NET, including support for RabbitMQ and Azure Service Bus.",MassTransit.StructureMap,False,2018-04-17T18:23:09.54+00:00,True,False,MassTransit StructureMap Container Support,MassTransit,49275,False,3.0.13
Ricardo Barbosa,2015-09-27T05:40:23.643Z,"CodeCop is a free to use library that builds on top of JSON to provide a fast unobtrusive way to write method interceptors for your .NET apps.

Interceptor placement is independent from your app's code. It's done on a JSON file which means that at anytime you can add or remove interceptors without code changes or redeploys.

Method interception happens in one or all of these stages, before execution, after execution and it is possible also to override the behavior completely. 

CodeCop can intercept your code and also other 3rd party assemblies your app depends on.",CodeCop,False,2016-03-10T02:29:14.217+00:00,False,False,The JSON configurable method interception library for .NET,"CodeCop,JSON,Method,Interception,.NET,Free",7415,False,1.1.6
"XAct Software Solutions,Inc.",2015-09-28T10:11:46.12Z,An XActLib Asssembly: an Assembly providing a Service to work with PerformanceCounters.,XAct.Diagnostics.Performance,False,2017-02-08T17:57:09.18-08:00,True,False,,"XAct,XActLib",54656,False,0.0.5003
mavil,2015-09-27T21:01:43.57Z,"AppDi - write maintainable selenium tests, fast.",AppDi,False,2016-06-13T16:10:41.3+00:00,True,False,AppDi,"Selenium,UI,AppDi,C#",2875,False,0.9.0
kanirudha14,2015-09-28T09:36:39.007Z,Html Helper exrtensions uysing bootstrap theme. Mainly includes grid using Bootstrap-Table,BsMvc,False,1899-12-31T16:00:00-08:00,False,False,,,-1,False,1.0.1
"XAct Software Solutions,Inc.",2015-09-28T09:14:04.307Z,An XActLib assembly: a Library for working with Tiff Images (ie processing incoming Faxes).,XAct.Imaging.TIFF,False,2017-02-08T17:57:22.337-08:00,True,False,,"XAct,XActLib",56855,False,0.0.5002
"Brock Allen,Dominick Baier",2015-09-28T04:51:20.337Z,"IdentityServer is a framework and a hostable component that allows implementing single sign-on and access control for modern web applications and APIs using protocols like OpenID Connect and OAuth2. It supports a wide range of clients like mobile, web, SPAs and desktop applications and is extensible to allow integration in new and existing architectures.",Thinktecture.IdentityServer3,False,1899-12-31T16:00:00-08:00,False,False,OpenID Connect Provider and OAuth2 Authorization Server Framework.,"Thinktecture,IdentityServer,OpenID,Connect,OpenIDConnect,OAuth2,OWIN,ASP.NET,Katana,WebApi,SSO,Federation,Claims,Identity",-1,False,1.6.3
Andrey Poltavets,2015-09-28T07:34:27.003Z,Bitpool rest api client. This version compatible with .net framework >= 4.5.2,BitPool.Client,False,2017-12-12T05:21:03.997+00:00,True,False,,,2134,False,1.0.5
"XAct Software Solutions,Inc.",2015-09-28T11:13:17.487Z,"An XActLib assembly: a library of Common Code for the UI layer of a web application, without being specific to WebForms, MVC or other UI framework",XAct.UI.Web,False,2017-02-09T01:58:13.633+00:00,True,False,,"XAct,XActLib",102373,False,0.0.5003
"XAct Software Solutions,Inc.",2015-09-28T10:02:01.147Z,An XActLib assembly: a library of services to manage information regarding data sources.,XAct.Data.DataSources,False,2017-02-09T01:56:58.743+00:00,True,False,,"XAct,XActLib",12028,False,0.0.5003
Bryan Apellanes,2015-09-28T00:49:23.447Z,EcmaScript.Net extensions for server side javascript execution,Bam.Net.Javascript,False,2018-01-25T03:46:30.543+00:00,True,False,,,10501,False,1.0.8
"PulseBridge,Inc.",2015-09-25T18:41:47.147Z,Tooling support for cross-platform build automation.,PulseBridge.Condo,True,2016-06-17T18:35:26.077+00:00,False,False,,"build,asp.net,dnx,xplat",5271,False,1.0.0-rc-00047
Mike,2015-08-21T02:01:11.707Z,Common Shareable Library,CMShareable,False,2018-01-24T22:40:36.053+00:00,False,False,,"Shareable,Library,Helper,AbstractDao",13164,False,0.2.33
Luca Sgroi,2015-09-28T10:00:31.937Z,"This package provides a set of PowerShell scripts to automatically compile, test and package .NET code based on a set of conventions. It leverages psake and consists of a set of predefined tasks and ability to create custom ones.",psake.net,True,1899-12-31T16:00:00-08:00,False,False,Convention based automation for .NET leveraging psake,"psake,powershell,combile,build,test,pack,push,nuget",-1,False,0.8.0-beta0038
"XAct Software Solutions,Inc.",2015-09-28T08:49:57.187Z,An XActLib assembly: an Assembly that provides a Log4NetTraceListener (rerouting XAct.Diagnostics.Trace calls to Log4Net -- nice!) as well as Log4Net specific implementation of the core Tracing service.,XAct.Diagnostics.Log4Net,False,2017-02-08T17:57:07.633-08:00,True,False,,"XAct,XActLib",92086,False,0.0.5002
"David Fowler,Scott Hanselman,Steve Sanderson,David Anderson",2015-09-28T12:49:55.407Z,A fast and customizable way to build parts of your .NET application via templates,T4Scaffolding.Core.VS2015,False,2015-10-06T17:23:02.903+00:00,True,False,A fast and customizable way to build parts of your .NET application via templates,,32736,False,1.0.1
"XAct Software Solutions,Inc.",2015-09-28T10:34:20.077Z,"An XActLib assembly: library for working with Zip Packages (Compression + Structure). A poor man's Zip Solution, that requires no external assemblies beyond .NET. See DotNetZip for better functionality.",XAct.IO.Compression.ZipPackage,False,2017-02-08T17:57:22.977-08:00,True,False,,"XAct,XActLib",90851,False,0.0.5003
RobotDotNet,2015-09-27T23:41:10.953Z,FRC NetworkTables using the new ntcore library,FRC.NetworkTables,False,1899-12-31T16:00:00-08:00,False,False,,"WPILib,FRC,FIRST,RoboRIO",4059,False,2015.1.0
CityIndex Ltd,2015-09-28T08:26:05.777Z,LogSearchShipper client,LogSearchShipper,False,1899-12-31T16:00:00-08:00,False,False,,,4392,False,1.0.5749.27714
"XAct Software Solutions,Inc.",2015-09-28T11:21:17.473Z,An XActLib assembly: a News management service.,XAct.Users.News,False,2017-02-08T17:58:15.04-08:00,True,False,,"XAct,XActLib",16334,False,0.0.5003
Konstantinos Papakonstantinou,2015-09-27T23:02:50.42Z,A simple wrapper for reading typed values from ConfigurationManager.AppSettings,SimpleAppSettings,False,2015-09-27T16:46:23.393-07:00,True,False,,,975,False,0.1.0.1
Bryan Apellanes,2015-09-28T00:39:21.56Z,Productivity Tools,Bam.Net,False,2018-01-25T03:44:22.977+00:00,True,False,,,10744,False,1.0.8
mradwan,2015-09-28T12:04:10.427Z,TestingConfUtilities Class Library,TestingConfUtilities,False,2015-09-28T14:29:13.49-07:00,True,False,,,403,False,1.0.0
"XAct Software Solutions,Inc.",2015-09-28T10:36:46.707Z,An XActLib assembly: optional configuration for XAct.IO.FileSystemWatcher,XAct.IO.FileSystemWatcher.Configuration,False,2017-02-09T01:57:26.117+00:00,True,False,,"XAct,XActLib",55088,False,0.0.5003
S2 UG,2015-09-28T10:03:12.513Z,[S2] extended utility library,s2Libs.s2Utils,False,2016-01-07T12:54:16.33+00:00,True,False,Contains extended classes and utilities useful for all kinds of projects.,,3528,False,2.0.21
Johann Brink,2015-09-28T12:03:08.387Z,This package is a MongoDB based AuditStoreProvider that extends the EFAuditing NuGet package's functionality.,EFAuditing.MongoDB,False,1899-12-31T16:00:00-08:00,False,False,,"EntityFramework,EF7,Mongo,MongoDB,Audit,Auditing",-1,False,1.0.2
rasmus,2015-09-28T11:30:19.073Z,OWIN support for EventFlow,EventFlow.Owin,False,2018-02-25T21:51:28.713+00:00,True,False,,"CQRS,ES,event,sourceing,owin",10941,False,0.17.1134
Sergii Bomko,2015-09-28T11:03:38.537Z,Contains middlewares to support LaunchKey's OAuth 2.0 authentication workflows.,AquilaDev.Owin.Security.LaunchKey,True,2015-11-07T11:22:44.657-08:00,True,False,,"OWIN,Security,OAuth,LaunchKey",494,False,1.0.0-alpha
Bryan Apellanes,2015-09-28T00:54:46.903Z,"Tools for programmatically interacting with command line git 
	and TFS source control",Bam.Net.SourceControl,False,2016-07-26T08:00:18.003-07:00,True,False,,,6910,False,1.0.8
"anchheda@microsoft.com,craigmcm@microsoft.com",2015-09-28T12:46:44.513Z,Microsoft libraries for integration with Microsoft Azure Active Directory,Microsoft.SystemForCrossDomainIdentityManagement,False,2017-05-26T17:49:25.393+00:00,True,False,,"Microsoft,Azure,Active,Directory,_Origin:http://vstfrd.redmond.corp.microsoft.com:8080/Azure/One/_git/SystemForCrossDomainIdentityManagement,_Repository:X:\bt\652456\repo,_Head:HEAD,_Project:Microsoft.SystemForCrossDomainIdentityManagement.nuproj,_ProjectDirectoryPath:\Package,_AssemblyName:,_OutputType:,_User:corecet",9550,False,1.0.130.37
Bam DotNet,2015-09-28T00:44:04.06Z,description,Bam.Net.Data.Dynamic,False,2018-01-25T03:45:03.603+00:00,True,False,,,9994,False,1.0.8
Paket team,2015-09-28T12:36:51.913Z,A package dependency manager for .NET with support for NuGet packages and GitHub repositories.,Paket.Core,False,2018-04-17T08:54:04.56+00:00,True,False,A package dependency manager for .NET with support for NuGet packages and GitHub repositories.,"nuget,bundler,F#",293543,False,2.4.3
Gibraltar Software,2015-08-28T18:47:54.217Z,"Contains the various types and attributes necessary to create
Loupe AddIns that extend Loupe Desktop and Server.  This assembly
is not used when collecting information within your application, to customize
data collection see the Gibraltar.Agent.",Gibraltar.AddIn,False,2016-01-20T09:01:36.87-08:00,True,False,,"Loupe,Logging",6437,False,3.7.4.2728
"XAct Software Solutions,Inc.",2015-09-28T10:21:32Z,KW_ASSEMBLYDESCRIPTION,XAct.Entertainment.Quotes.PCL,False,2017-02-08T17:57:12.663-08:00,True,False,,"XAct,XActLib",9079,False,0.0.5003
Carlos G. Sarmiento,2015-09-28T06:27:28.303Z,The dynamic configuration manager for .NET,DynamiConf.HttpLocator,False,2015-09-28T20:27:17.853-07:00,True,False,,"Configuration,Dynamic,DynamiConf,Conf,AppSettings,EnvironmentVar",908,False,0.2.4
Renato Golia,2015-09-28T06:55:52.827Z,NLog support for Nybus,Nybus.NLog,False,2016-11-27T17:36:08.63-08:00,True,False,,,4300,False,0.4.0.65
"Microsoft,KirillOsenkov",2015-09-27T23:23:53.533Z,"Generates a static HTML website from a managed Visual Studio solution that allows you to search, browse and navigate the C#, VB, MSBuild and TypeScript code online.",Microsoft.SourceBrowser,False,2017-11-14T22:41:41.95+00:00,True,False,Generates a website to browse a managed code solution online,"Roslyn,Source,Browser",29065,False,1.0.1
