authors,created,description,id,is_prerelease,last_updated,listed,missing_info,summary,tags,total_downloads,verified,versionDevart Software,2015-09-11T05:02:27.43Z,dotConnect Express for PostgreSQL is a free of charge enhanced database connectivity solution built over ADO.NET architecture and a development framework with a number of innovative technologies. dotConnect offers a complete solution for developing database-related applications and web sites. It introduces new approaches for designing applications and boosts productivity of database application development.,dotConnect.Express.for.PostgreSQL,False,2018-03-30T11:06:50.83+00:00,True,False,dotConnect Express for PostgreSQL is a free of charge enhanced database connectivity solution built over ADO.NET architecture and a development framework with a number of innovative technologies.,"PostgreSQL,ADO.NET,provider,Database",89596,False,7.4.492
tht,2015-09-11T06:18:59.047Z,"CSharp utils, tht, Tdroid",CSharp.Tdroid,False,2015-09-11T01:19:48.773-07:00,False,False,,,911,False,1.0.0
Paket team,2015-09-11T08:57:41.537Z,A package dependency manager for .NET with support for NuGet packages and GitHub repositories.,Paket,True,2018-04-17T08:54:34.933+00:00,True,False,A package dependency manager for .NET with support for NuGet packages and GitHub repositories.,"nuget,bundler,F#",825043,False,2.0.0-rc002
Hibernating Rhinos,2015-09-10T23:08:49.977Z,"This package includes a utility class that helps test features of RavenDB. RavenDB is a document database for the .NET platform, offering a flexible data model design to fit the needs of real world systems.",RavenDB.Tests.Helpers,True,1900-01-01T00:00:00+00:00,False,False,This package includes a utility class that helps test features of RavenDB.,"nosql,ravendb,raven,document,database,test",242371,True,2.5.2967-Unstable
objo,2015-09-11T09:05:08.74Z,Strongly typed physical quantities.,QuantityTypes,False,2017-10-10T04:16:06.78+00:00,True,False,,"physical,quantities,unit,conversion,units,of,measurement",15736,False,1.0.74
Patrick Evers,2015-09-10T22:52:48.91Z,A MVC 6 content management system.,Panther.CMS,True,1900-01-01T00:00:00+00:00,False,False,,"CMS,MVC6",2018,False,1.3.4-beta7
SPA Tools,2015-09-11T07:21:05.83Z,Knockout Utilities Extensions to simplify Knockout app development,KoMvvm,False,2015-09-11T00:21:05.83-07:00,True,False,,"Knockout,Mvvm,Commands,Operation,Messenger,Extension,AMD",2658,False,0.1.4
SPA Tools,2015-09-11T02:37:38.79Z,Knockout ORM framework with REST service adapter and offline storage,KORM,False,2016-02-16T13:37:30.667-08:00,True,False,,"Knockout,ORM,Data,Rest,OData,Offline,AMD",6187,False,0.3.3
Hibernating Rhinos,2015-09-11T03:17:10.647Z,"Note: this package is deprecated. You should use RavenDB.Database package instead.

		This package let you include RavenDB embedded in-process with your application. RavenDB is a document database for the .NET platform, offering a flexible data model design to fit the needs of real world systems.",RavenDB.Embedded,True,1900-01-01T00:00:00+00:00,False,False,This package let you include RavenDB embedded in-process with your application.,"nosql,ravendb,raven,document,database,embedded",545197,True,3.0.3790-Unstable
SharpCrafters s.r.o.,2015-09-11T09:51:16.223Z,"An official PostSharp Pattern. Adds detailed tracing to any method without modifying your source code. Several backends
      are available as separate NuGet packages.",PostSharp.Patterns.Diagnostics,False,2018-03-29T18:39:30.7+00:00,True,False,,"postsharp,sharcrafters,aop,aspect,monitoring,instrumentation,log,logging,tracing,nlog,log4net,elmah,Patterns",124202,True,3.1.70
Maksim Volkau,2015-09-11T11:43:09.073Z,DryIoc extension for ASP.NET providing Web Request Reuse,DryIoc.Web,True,2017-04-04T01:56:54.273-07:00,True,False,,"Web,ASP,Extension,IoC,Container,Inversion-of-Control,DI,Dependency-Injection,DRY,DryIoc",22645,False,2.0.0-rc3build322
akmittal,2015-09-08T07:55:13.277Z,Description,BarcodeScanControl,False,2015-09-11T09:34:05.277+00:00,True,False,,,1424,False,1.0.0
Dumont Cedric,2015-09-11T10:52:45.073Z,Effort Extensions and Helpers for all Cextensions projects in .net,CExtensions.Effort,True,2016-01-15T03:49:28.48-08:00,True,False,Effort Extensions and Helpers for all Cextensions projects in .net,".NET,Extensions",2618,False,1.1.0-CI00024
Hibernating Rhinos,2015-09-10T22:58:34.817Z,"This package includes the client API of RavenDB. RavenDB is a document database for the .NET platform, offering a flexible data model design to fit the needs of real world systems.",RavenDB.Client,True,2018-03-30T12:13:14.39+00:00,True,False,This package includes the client API of RavenDB.,"nosql,ravendb,raven,document,database,client",1115852,True,2.5.2967-Unstable
Cedric Dumont,2015-09-11T10:24:48.647Z,Extensions for the Effort testing framework. check website for more info,CExtensions.Effort,True,2016-01-15T03:49:28.48-08:00,True,False,,,2618,False,1.1.0-CI00023
Chillisoft,2015-09-11T04:03:38.803Z,Habanero.Faces,Habanero.Faces,True,2017-04-19T21:02:45.06-07:00,True,False,,,163761,False,3.9.521-prerelease
APPVYR-WIN20122\appveyor,2015-09-11T04:50:59.923Z,Created on 2015-09-11 04:50,Naos.Deployment.Core,True,2018-04-11T16:24:46.707+00:00,True,False,,,37190,False,1.0.114-fixmongodeploy
"Bart Read,Lewis Ayers-Stephens,Mike Hancock",2015-09-11T09:58:23.61Z,Dapper.SimpleSave makes it easy to save complex object hierarchies to a relational database.,Dapper.SimpleSave,False,2018-03-16T09:53:39.897+00:00,True,False,,"Dapper,SQL,micro-ORM",15212,False,1.0.94
Dumont Cedric,2015-09-11T10:53:23.953Z,Entity Framework Extensions and Helpers for all Cextensions projects in .net,CExtensions.EntityFramework,True,2016-01-15T03:49:34.59-08:00,True,False,Entity Framework Extensions and Helpers for all Cextensions projects in .net,".NET,Extensions",2757,False,1.1.0-CI00024
Adamantworks LLC,2015-02-12T19:50:33.227Z,An alternate SDK for Amazon DynamoDB with a cleaner API and advanced operations. Supports async and sync.,Adamantworks.Amazon.DynamoDB,True,2015-12-14T13:47:32.463-08:00,False,False,,"AWS,Amazon,cloud,DynamoDB",6721,False,0.1.0-alpha019
SPA Tools,2015-09-11T03:44:07.223Z,Set of tools to help Single Page Application development,Appy,False,2016-02-24T19:52:48.54-08:00,True,False,,"Knockout,Spa,Tools,Utilities,Modules,Cache,AMD",3188,False,0.1.9
Maksim Volkau,2015-09-11T10:50:27.74Z,DryIoc extension for ASP.NET MVC,DryIoc.Mvc,True,2017-04-04T01:57:17.627-07:00,True,False,,"Web,ASP,MVC,Extension,IoC,Container,Inversion-of-Control,DI,Dependency-Injection,DRY,DryIoc",22647,False,2.0.0-rc3build321
Maksim Volkau,2015-09-11T10:08:56.497Z,"DryIoc is small, fast, capable IoC container for .NET",DryIoc.dll,True,2018-03-17T16:00:47.92+00:00,True,False,,"IoC,Container,Inversion-of-Control,DI,Dependency-Injection,DRY,Service-Provider,Factory",221820,False,2.0.0-rc3build320
SharpCrafters s.r.o.,2015-09-11T09:53:07.053Z,Adds support for NLog to PostSharp.Patterns.Diagnostics.,PostSharp.Patterns.Diagnostics.NLog,False,2018-03-29T18:41:25.22+00:00,True,False,,"postsharp,sharcrafters,aop,aspect,monitoring,instrumentation,log,logging,tracing,nlog,log4net,elmah,Patterns",61782,True,3.1.70
Nicholas Randal,2015-09-11T13:02:30.097Z,Automagic Model Factory,Randal.Core.Testing.Factory,False,2016-05-17T14:57:24.847-07:00,True,False,,"Testing,Factory",1552,False,1.1.1
Viktor Elofsson,2015-09-11T08:14:05.393Z,Binary OpenSSL 1.0.2d package built with MSVC14 (Win64).,hadouken.openssl,False,1899-12-31T16:00:00-08:00,False,False,,,-1,False,0.3.0
Paket team,2015-09-11T08:21:28.467Z,A package dependency manager for .NET with support for NuGet packages and GitHub repositories.,Paket.PowerShell,False,2017-04-28T07:19:40.903+00:00,True,False,A package dependency manager for .NET with support for NuGet packages and GitHub repositories.,"nuget,bundler,F#",135731,False,1.39.3
Ben Abelshausen,2015-09-11T11:14:34.597Z,OsmSharp is an open-source mapping project.,OsmSharp.Core,True,2016-09-29T14:20:19.907-07:00,True,False,OsmSharp is an open-source mapping project available on Android and iOS using Xamarin and other platforms using Mono/.NET,"osm,openstreetmap,routing,rendering,xamarin,mapping",19181,False,0.0.0.28-beta
XULU,2015-09-11T08:49:59.013Z,ITOO.BasicSystemSettings.ViewModel,ITOO.BasicSystemSettings.ViewModel,False,2015-09-11T01:49:59.013-07:00,True,False,,"Tag1,Tag2",791,False,2.0.0.3
Paket team,2015-09-11T09:50:45.847Z,A package dependency manager for .NET with support for NuGet packages and GitHub repositories.,Paket.PowerShell,False,2017-04-28T07:19:40.903+00:00,True,False,A package dependency manager for .NET with support for NuGet packages and GitHub repositories.,"nuget,bundler,F#",135731,False,1.39.6
Xtensive LLC,2015-09-10T22:50:17.7Z,Adds support for SQL Server CE 3.5 for DataObjects.Net,Xtensive.Orm.SqlServerCe,True,2015-01-30T11:24:23.907+00:00,True,False,,"DataObjects.Net,ORM,BLL,Persistence,SQLServerCE,SQLServerCompact",12563,False,5.0.7-RC
Andy Wilson and contributors,2015-09-11T09:07:22.89Z,Provides helper functions for setting up and tearing down SQL Server database fakes for use in integration testing.,IntegrationTestingLibraryForSqlServer,False,2017-06-30T10:32:44.367+00:00,True,False,,"testing,sqlserver,continuous,integration,database,automation",4077,False,1.2.0
APPVYR-WIN20122\appveyor,2015-09-10T22:13:58.873Z,Created on 2015-09-10 22:13,Naos.Deployment.Contract,True,1899-12-31T16:00:00-08:00,False,False,,,22917,False,1.0.113-fixmongodeploy
Nick Strupat,2015-09-11T05:14:01.93Z,"Supports events for entity inserting, inserted, updating, updated, deleting, and deleted. Also events on insert failure, update failure, and delete failure.",EntityFramework.Triggers,True,2017-10-26T23:59:59.293+00:00,True,False,"Supports events for entity inserting, inserted, updating, updated, deleting, and deleted. Also events on insert failure, update failure, and delete failure.","entity-framework,triggers",19543,False,5.3.0-prerelease
"Steffen Forkmann,Mauricio Scheffer,Colin Bull",2015-09-11T08:20:43Z,FAKE - F# Make - is a build automation tool for .NET. Tasks and dependencies are specified in a DSL which is integrated in F#.,FAKE.Core.x64,False,2018-04-15T16:38:41.15+00:00,True,False,FAKE - F# Make - Get rid of the noise in your build scripts.,"build,fake,f#",58844,False,4.4.0
Maksim Volkau,2015-09-11T10:14:51.153Z,DryIoc extension for ASP.NET WebAPI,DryIoc.WebApi.dll,True,2018-02-05T20:26:19.6+00:00,True,False,,"Web,ASP,API,Extension,IoC,Container,Inversion-of-Control,DI,Dependency-Injection,DRY,DryIoc",41336,False,2.0.0-rc3build320
Invenietis,2015-09-11T13:02:33.447Z,A set of classes that handles XML serialization and deserialization of complex objects.,CK.Storage,True,2015-11-26T02:09:23.57-08:00,True,False,,,1874,False,4.3.0-r02
Dimension Data,2015-09-10T23:47:53.47Z,"Provides a client to fully manage the CaaS including deploying machines, managing backups etc.",DD.CBU.Compute.Api.Client,True,2018-04-05T01:25:32.323+00:00,True,False,Dimension Data Compute as a Service client API.,,22495,False,3.0.11-develop
Mike Jewell,2015-09-11T04:32:21.05Z,Abstractions on Azure service infrastructure to help Arragro interact with Azure.,Arragro.Azure,False,2017-12-29T21:50:58+00:00,True,False,Azure,"Arragro,Arragro.Azure,Azure,Abstraction",14478,False,1.0.0.50
Pieter van der Westhuizen,2015-09-11T07:21:45.097Z,A .Net client library for using the Sage One Accounting API,SageOneAccountingAPIWrapper,False,1899-12-31T16:00:00-08:00,False,False,,"C#,Restsharp,Sage,One",-1,False,1.0.1
"Benjamin Mayrargue,NinZine",2015-09-11T09:47:21.377Z,"Mixpanel bindings for Xamarin
      Android Bindings 4.6.4 for android 4.0.3+
      iOS Bindings 2.8.3 armv7/simulator/arm64 only",Vapolia.Mixpanel,False,2015-12-07T10:25:41.67-08:00,True,False,,"mixpanel,xamarin,ios,android",3368,False,4.6.4.8
Wonka,2015-09-11T11:50:33.667Z,Description,Lemonade.Sql,True,2016-03-21T09:07:14.817+00:00,True,False,,,9125,False,1.0.0-CI00001
Tim Jones,2015-09-11T07:06:56.797Z,Gemini is an application shell similar in concept to the Visual Studio Shell. It uses AvalonDock and has an MVVM architecture based on Caliburn Micro.,GeminiWpf,False,2015-09-20T06:50:03.537-07:00,True,False,,".net40,WPF,MVVM,AvalonDock,Caliburn,Micro,Visual,Studio,IDE,Shell",8806,False,0.6.0
thocun,2015-09-11T03:13:13.097Z,Store data object to many type of stores,MagicalStorage.Repository.SQL,False,2015-09-11T00:51:35.983-07:00,True,False,,"Entity,Framework,MS,SQL,MySQL,C#,.NET",883,False,1.0.1
Maksim Volkau,2015-09-11T10:08:21.713Z,"Implementation of CommonServiceLocator for DryIoc container, see rationale at https://commonservicelocator.codeplex.com/",DryIoc.CommonServiceLocator.dll,True,2016-10-20T05:59:26.74-07:00,True,False,,"Service-Locator,CommonServiceLocator,IoC,Container,Inversion-of-Control,DI,Dependency-Injection,DRY,Service-Provider,Factory",48095,False,2.0.0-rc3build320
Dumont Cedric,2015-09-11T09:48:10.54Z,Common extensions for all Cextensions projects in .net,CExtensions.Common,True,2016-01-15T03:49:22.507-08:00,True,False,Common extensions for all Cextensions projects in .net,".NET,Extensions",2902,False,1.1.0-CI00022
Pieter van der Westhuizen,2015-09-11T06:10:34.563Z,A .Net client library for using the Sage One Accounting API,SageOneAPI,False,1899-12-31T16:00:00-08:00,False,False,,"C#,Restsharp,Sage,One",-1,False,1.0.0
Logus HMS,2015-09-11T11:47:02.817Z,Integration messages for HMS protocol,Logus.HMS.Messages,False,2018-02-06T17:27:09.82+00:00,True,False,,,4768,False,1.33.2
pjc,2015-09-11T02:32:19.89Z,migration,Merona.Migration.cs,False,2015-09-10T19:32:19.89-07:00,True,False,,,329,False,1.0.0
Bill Menees,2015-09-11T03:18:16.603Z,"Provides analyzers for validating that:
		* Tabs are used for indentation.
		* Lengths of lines, methods, properties, and files are acceptable.
		* #regions are used within long files and files that contain multiple types.
		* Method blocks use a single return.
		* File names match the names of types they contain.
		* Preferred exception types are used.
		* Magic numbers aren't used.
		* Using directives are indented consistently.",Menees.Analyzers,False,2016-04-24T20:47:31.08+00:00,True,False,,"Analyzers,DotNetAnalyzers,Roslyn",5052,False,1.0.5.1
Niclas Olofsson,2015-09-10T21:55:38.827Z,MiNET - a Minecraft PocketEdition Server,MiNET,False,2018-02-02T22:13:57.123+00:00,True,False,,"MiNET,Plugin,API,MCPE,Minecraft,PocketEdition",139462,False,1.0.577
Lukiya,2015-09-11T04:24:22.05Z,A cache extension of CQRS framework for SyncSoft.,SyncSoft.CQRS.Redis,True,2017-09-25T15:42:30.62+00:00,True,False,,,8322,False,1.1.0.3-beta
tht,2015-09-11T06:18:59.047Z,"CSharp utils, tht, Tdroid",CSharp.Tdroid,False,2015-09-11T01:19:48.773-07:00,True,False,,,911,False,1.0.0
Maksim Volkau,2015-09-11T11:45:33.587Z,DryIoc extension for ASP.NET WebAPI and OWIN,DryIoc.WebApi.Owin,True,2017-02-01T12:57:20.427-08:00,True,False,,"Web,ASP,WebApi,OWIN,Extension,IoC,Container,Inversion-of-Control,DI,Dependency-Injection,DRY,DryIoc",20453,False,2.0.0-rc3build322
ScienceSoft,2015-09-11T09:32:19.183Z,"Xamarin.Forms gestures plugin for view controls (targeted at Android, iOS and Windows Phone)",ScnViewGestures.Forms,False,2016-10-24T14:26:15.72+00:00,False,False,,"xamarin,xamarin.forms,gestures,ios,android,windows,phone,winphone,wp8",16109,False,1.2.8
"Steffen Forkmann,Mauricio Scheffer,Colin Bull",2015-09-11T09:08:24.067Z,FAKE - F# Make - is a build automation tool for .NET. Tasks and dependencies are specified in a DSL which is integrated in F#. Extensions for FAKE Deploy,FAKE.Deploy.Lib.x64,False,2018-04-15T16:39:29.933+00:00,True,False,FAKE - F# Make - Get rid of the noise in your build scripts.,"build,fake,f#",57988,False,4.4.1
xabre,2015-09-11T09:51:25.077Z,This package contains the 'BLE' plugin for MvvmCross,MvvmCross.Plugin.BLE,False,2017-07-23T12:58:02.287+00:00,True,False,,"mvvm,mvvmcross,xamarin,monodroid,Xamarin.iOS10",11895,False,0.7.0
Maksim Volkau,2015-09-11T10:56:17.93Z,Superset of MEF attributes. In addition to Export/Import contains attributes to support modern IOC (DryIoc) features.,DryIocAttributes,True,2018-02-05T19:16:31.683+00:00,True,False,,"MEF,Attributes,Attributed-Model,Composition,IoC,Container,Inversion-of-Control,DI,Dependency-Injection,DRY,Service-Provider,Factory",11998,False,2.0.0-rc3build321
Mike Jewell,2015-09-11T04:34:14.347Z,Helpers for Asp.Net WebApi Clients,Arragro.WebApi.Client,False,2017-12-29T21:51:34.627+00:00,True,False,Azure,"Arragro,Arragro.WebApi.Client,WebApi",6699,False,1.0.0.50
Sameer Mirza / JitCoder,2015-09-11T07:53:43.723Z,"Lightning fast, scalable, cross-platform server side MVC Framework for .NET designed for rapid application development.",radmvc,False,2015-10-14T03:37:20.207+00:00,True,False,Rapid Application Development Cross-Platform MVC Framework,"mvc,asp.net,cross,platform",2242,False,0.1.0
Maksim Volkau,2015-09-11T11:47:57.463Z,"DryIocZero provides container to work on top of compile-time generated factory delegates, therefore decreasing application startup cost.",DryIocZero,True,2018-03-22T22:12:33.063+00:00,True,False,,"IoC,Container,Inversion-of-Control,DI,Dependency-Injection,DRY,Service-Provider,Factory,No-Container,Pure-DI,Poor-Man-DI",12556,False,2.0.0-rc3build322
Vladimír Mach,2015-09-11T12:19:13.95Z,Basic library with useful classes implementing MVVM pattern.,Mach.Wpf.Mvvm,False,2015-10-21T09:57:55.747+00:00,True,False,,"wpf,mvvm",1025,False,1.0.1
dkackman,2015-09-10T22:22:43.183Z,"OAuth flow for scenarios with limited access to input devices or web browsers, like console apps, or IoT devices.",DeviceOAuth2,True,2017-10-22T14:05:56.64+00:00,True,False,,"OAuth2,IoT,portable,PCL,UWP,device,console",2390,False,2.0.0-alpha-1
Nicholas Randal,2015-09-11T00:13:27.517Z,Automagic Model Factory,Randal.Core.Testing.Factory,False,2016-05-17T14:57:24.847-07:00,True,False,,"Testing,Factory",1552,False,1.0.1
Dumont Cedric,2015-09-11T10:53:59.017Z,Xml Extensions and Helpers for all Cextensions projects in .net,CExtensions.Xml,True,2016-01-15T03:49:41.19-08:00,True,False,Xml Extensions and Helpers for all Cextensions projects in .net,".NET,Extensions",2924,False,1.1.0-CI00024
thocun,2015-09-07T07:41:34.203Z,Store data object to many type of stores,MagicalStorage.Repository.SQL,False,2015-09-11T00:51:35.983-07:00,False,False,,"Entity,Framework,MS,SQL,MySQL,C#,.NET",883,False,1.0.0
Dumont Cedric,2015-09-11T10:24:10.65Z,Common extensions for all Cextensions projects in .net,CExtensions.Common,True,2016-01-15T03:49:22.507-08:00,True,False,Common extensions for all Cextensions projects in .net,".NET,Extensions",2902,False,1.1.0-CI00023
"Steffen Forkmann,Mauricio Scheffer,Colin Bull",2015-09-11T08:24:34.207Z,FAKE - F# Make - is a build automation tool for .NET. Tasks and dependencies are specified in a DSL which is integrated in F#. Extensions for Gallio,FAKE.Gallio.x64,False,2018-04-15T16:41:31.16+00:00,True,False,FAKE - F# Make - Get rid of the noise in your build scripts.,"build,fake,f#",57821,False,4.4.0
Tim Long,2015-09-11T04:59:33.03Z,"A text-based display driver for SSD1306 I2C OLED displays, targeting .NET MicroFramework 4.3+ and Netduino Plus hardware platform.
      The driver works with I2C interface (only) and offers basic text rendering using bitmapped fonts. Two very minimal fonts are included
      but because fonts have a high memory footprint, these need to be specified by the application and should be optimized to contain the
      minimum required characters. Currently, the driver is text-only and no graphics primitives are included, although the display
      is bitmapped and this could be a future enhancement.",TA.NetMF.Devices.SSD1306,True,2015-10-19T18:26:23.707-07:00,True,False,"A text-based display driver for SSD1306 I2C OLED displays, targeting .NET MicroFramework 4.3+ and Netduino Plus hardware platform.","netduino,NetMF,MicroFramework,4.3,display,driver,oled,i2c,ssd1306,c#",1538,False,0.1.0-Beta1009
Maksim Volkau,2015-09-11T10:47:32.517Z,"Implementation of CommonServiceLocator for DryIoc container, see rationale at https://commonservicelocator.codeplex.com/",DryIoc.CommonServiceLocator,True,2016-10-20T05:59:17.24-07:00,True,False,,"Service-Locator,CommonServiceLocator,IoC,Container,Inversion-of-Control,DI,Dependency-Injection,DRY,Service-Provider,Factory",46383,False,2.0.0-rc3build321
"Steffen Forkmann,Mauricio Scheffer,Colin Bull",2015-09-11T09:05:41.273Z,FAKE - F# Make - is a build automation tool for .NET. Tasks and dependencies are specified in a DSL which is integrated in F#.,FAKE.Core,False,2018-04-15T16:36:46.647+00:00,True,False,FAKE - F# Make - Get rid of the noise in your build scripts.,"build,fake,f#",271996,False,4.4.1
Paul Appeldoorn,2015-09-11T07:16:07.527Z,Devshed Shared Library,Devshed.Shared,False,2015-09-11T00:16:07.527-07:00,True,False,,,4465,False,1.3.8
Spoqa,2015-09-11T04:05:26.96Z,"MvvmLightBindingAttributes provides attributes for Mvvm Light.
      The attributes are based on LocationInterceptionAspect of PostSharp, simplify binding properties between View and ViewModel.",MvvmLightBindingAttributes,False,2016-01-01T01:08:44.487-08:00,True,False,,"mvvm,mvvmlight,postsharp",1123,False,0.0.1
Paul Appeldoorn,2015-09-11T07:16:46.247Z,Devshed Imaging Library.,Devshed.Imaging,False,2015-09-11T00:16:46.247-07:00,True,False,,,2146,False,1.3.7.1
Xtensive LLC,2015-09-10T22:43:35.943Z,Adds support for Oracle for DataObjects.Net. Requires ODP.NET to be installed.,Xtensive.Orm.Oracle,True,2015-01-30T11:19:26.837+00:00,True,False,,"DataObjects.Net,ORM,BLL,Persistence,Oracle,ODP.NET",12473,False,5.0.7-RC
Hibernating Rhinos,2015-09-11T03:19:15.6Z,"Use this package if you want to run RavenDB as a standalone application. This package is not intented to be used in Visual Studio. RavenDB is a document database for the .NET platform, offering a flexible data model design to fit the needs of real world systems.",RavenDB.Server,True,1900-01-01T00:00:00+00:00,False,False,This package contains the Raven.Server.exe database binaries.,"nosql,ravendb,raven,document,database",271051,True,3.0.3790-Unstable
objo,2015-09-11T05:58:23.723Z,Provides custom controls and extensions for WPF 3D.,HelixToolkit.Wpf,False,1900-01-01T00:00:00+00:00,False,False,,"wpf,wpf3d,3D",100724,False,2015.1.606
Mike Jewell,2015-09-11T04:31:41.81Z,Arragro Object Logging library.,Arragro.ObjectLogging.Mvc,False,2017-12-29T21:50:45.923+00:00,True,False,,"Arragro,Arragro.Logging",7762,False,1.0.0.50
Hibernating Rhinos,2015-09-11T03:12:04.06Z,"This package includes the client API of RavenDB. RavenDB is a document database for the .NET platform, offering a flexible data model design to fit the needs of real world systems.",RavenDB.Client,True,2018-03-30T12:13:14.39+00:00,True,False,This package includes the client API of RavenDB.,"nosql,ravendb,raven,document,database,client",1115852,True,3.0.3790-Unstable
adam.kopcinski,2015-09-11T11:09:08.94Z,My package description.,AbcAsposeWord,False,1899-12-31T16:00:00-08:00,False,False,,,-1,False,1.0.0
Martin Gondermann,2015-09-11T10:35:28.467Z,Functional data types for C#,Pagansoft.Functional,False,2015-09-11T12:22:37.047+00:00,True,False,,"data,type,functional,option",1372,False,2.0.2
Devart Software,2015-09-11T05:00:31.823Z,dotConnect Express for Oracle is a free of charge enhanced database connectivity solution built over ADO.NET architecture and a development framework with a number of innovative technologies. dotConnect offers a complete solution for developing database-related applications and web sites. It introduces new approaches for designing applications and boosts productivity of database application development.,dotConnect.Express.for.Oracle,False,2018-03-30T11:04:05.81+00:00,True,False,dotConnect Express for Oracle is a free of charge enhanced database connectivity solution built over ADO.NET architecture and a development framework with a number of innovative technologies.,"Oracle,ADO.NET,provider,Database",45519,False,8.5.492
Hibernating Rhinos,2015-09-10T22:55:34.123Z,"The Authorization Bundle extend RavenDB and add document level permissions. The Auth Bundle allows to define permissions for a specific user, a group or using arbitrary tagging. The system is design to be high performance, scalable and flexible.",RavenDB.Bundles.Authorization,True,1900-01-01T00:00:00+00:00,False,False,,"nosql,ravendb,raven,document,database,bundles,authorization",200261,True,2.5.2967-Unstable
"Steffen Forkmann,Mauricio Scheffer,Colin Bull",2015-09-11T08:18:17.95Z,FAKE - F# Make - is a build automation tool for .NET. Tasks and dependencies are specified in a DSL which is integrated in F#.,FAKE.Core,False,2018-04-15T16:36:46.647+00:00,True,False,FAKE - F# Make - Get rid of the noise in your build scripts.,"build,fake,f#",271996,False,4.4.0
Paket team,2015-09-11T08:25:22.973Z,A package dependency manager for .NET with support for NuGet packages and GitHub repositories.,Paket.PowerShell,False,2017-04-28T07:19:40.903+00:00,True,False,A package dependency manager for .NET with support for NuGet packages and GitHub repositories.,"nuget,bundler,F#",135731,False,1.39.4
Mike Jewell,2015-09-11T04:32:59.003Z,Abstractions for Google Apis.,Arragro.Google.Apis,False,2017-12-29T21:51:10.58+00:00,True,False,,"Arragro,Arragro.Google.Apis",7079,False,1.0.0.50
