authors,created,days_abandoned,days_alive,description,id,is_prerelease,last_updated,listed,missing_info,summary,tags,total_downloads,verified,versionGeertvanHorrik,2014-11-06T22:36:27.68Z,507,1261,"Catel.Extensions.Controls library which contains user controls, such as the StackGrid.",Catel.Extensions.Controls,True,2016-11-29T13:35:55.627+00:00,True,False,,"windows,controls,stackgrid,styles,stylehelper",170616,True,4.0.0-unstable0535
Mozu.com,2014-11-07T03:12:50.467Z,120,1260,Mozu.Api.ToolKit,Mozu.Api.ToolKit,True,2017-12-21T05:44:36.2+00:00,True,False,,"""Mozu""",21714,False,1.2.0-dev1411062112
James Geall,2014-11-07T14:52:01.177Z,433,1260,Powershell module for admin tasks for IdentityServer.v3.MongoDb persistence,IdentityServer.MongoDb.AdminModule,True,2017-02-11T05:26:16.08-08:00,True,False,,"IdentityServer,MongoDb,Powershell",5959,False,0.0.1-alpha-14
"Steffen Forkmann,Mauricio Scheffer,Colin Bull",2014-11-07T16:14:48.327Z,5,1260,FAKE - F# Make - is a build automation tool for .NET. Tasks and dependencies are specified in a DSL which is integrated in F#. Extensions for FAKE Deploy,FAKE.Deploy.Lib,False,2018-04-15T16:38:30.65+00:00,True,False,FAKE - F# Make - Get rid of the noise in your build scripts.,"build,fake,f#",180923,False,3.9.0
eXpandFramework,2014-11-06T19:31:14.867Z,11,1261,State Machine Module/ eXpandFramework. To debug in VS enable Source Server support under Tools/Options/Debugging.,eXpandStateMachine,False,2018-04-09T16:22:05.19+00:00,True,False,State Machine Module/ eXpandFramework,"DevExpress,eXpand,XAF,eXpressApp",37796,False,14.1.8.1
GeertvanHorrik,2014-11-07T01:14:10.783Z,507,1260,Catel.Extensions.Interception library which provides interception capabilities.,Catel.Extensions.Interception,True,2016-11-29T13:36:15.02+00:00,True,False,,"catel,interception",80898,True,4.0.0-unstable0537
Hibernating Rhinos,2014-11-07T08:06:37.197Z,43209,1260,RavenDB Client MvcIntegration let you include a visual profiler in your ASP.NET MVC application which will show you all the opened sessions and the time took to complete each database request. This can help you when developing with RavenDB.,RavenDB.Client.MvcIntegration,False,1900-01-01T00:00:00+00:00,False,False,A visual profiler for RavenDB that you can use in your ASP.NET MVC application.,"nosql,ravendb,raven,document,database,client,mvc",243184,True,2.5.2938
SEEK Ltd.,2014-11-06T22:34:08.697Z,995,1261,Custom DSC Resources for managing resources residing on the hard disk,seek-dsc-harddisk,False,2015-07-30T06:08:43.92-07:00,True,False,,"admin,DSC",15877,False,1.0.0.72
SolerSoft,2014-11-06T22:46:44.107Z,1257,1261,"This helper library makes it easier to create .Net-backed Azure Mobile Services. It includes helper controller base classes 
          and it allows client applications and services to share the same entity class files (though file linking).
          Simply reference SolerSoft.Data.Client in the client project and SolerSoft.Data.AzureNetServer in the server project, then
          inherit your entities from SolerSoft.Data.DataObject. On the client, DataObjec provides full property change notification.
          On the server, DataObject inherits from EntityData as reqired by Mobile Service controllers. Conditional compile 
          statements can be used to further refine between client behaviors and server behaviors.",SolerSoft.Data.AzureNetServer,True,2014-11-10T11:34:09.437-08:00,True,False,,"SolerSoft,Data,Azure,MobileServices",4524,False,1.0.0-beta7
Exceptionless,2014-11-07T18:00:57.593Z,144,1260,DateTimeRange and various DateTime and TimeSpan extension methods.,Exceptionless.DateTimeExtensions,False,2017-11-27T14:40:05.553+00:00,True,False,,"DateTime,DateTimeRange,Extensions",35888,True,3.0.20
devdigital,2014-11-07T11:13:12.767Z,1256,1260,Simple .NET Jira wrapper.,Kaiju,False,2014-11-11T11:45:26.143-08:00,True,False,,,6061,False,0.0.8
rivantsov,2014-11-06T23:25:55.533Z,270,1261,Another Entity Framework - done right,VITA,False,2017-07-24T23:38:07.43+00:00,True,False,"Full-featured ORM and application framework. Supports MS SQL SErver, SQL CE, MySQL, Postgres. Full LINQ support, built-in authorization framework, modular app composition, data caching, lazy loading, Web Api integration; provides standard modules implementing User Login, Error Log, SQL Log, Web Calls Log, etc ","ORM,MSSQL,MySQL,Postgres,LINQ,Authorization,Caching",11393,False,0.0.9
"XAct Software Solutions,Inc.",2014-11-07T12:21:55.23Z,43209,1260,An XActLib Assembly: provides C# processing as a service.,XAct.Languages.CS.Mono,False,1899-12-31T16:00:00-08:00,False,False,,"XAct,XActLib",50068,False,0.0.4819
SEEK Ltd.,2014-11-06T22:34:42.383Z,995,1261,Custom DSC Resources for message queue administration,seek-dsc-messagequeue,False,2015-07-30T06:09:19.563-07:00,True,False,,"admin,DSC",15844,False,1.0.0.72
Antonio,2014-11-07T18:24:54.02Z,43209,1260,Es un conjunto de clases e interfaces que definen un patrones comúnes de comunicación con una base de datos en una aplicación para aplicaciones escritas en C#.,Messier16.SuperFactory,False,1899-12-31T16:00:00-08:00,False,False,,,-1,False,1.0.0
eXpandFramework,2014-11-06T19:27:35.807Z,11,1261,Scheduler Module / eXpandFramework. To debug in VS enable Source Server support under Tools/Options/Debugging.,eXpandScheduler,False,2018-04-09T16:20:25.92+00:00,True,False,Scheduler Module / eXpandFramework,"DevExpress,eXpand,XAF,eXpressApp",35781,False,14.1.8.1
NServiceBus Ltd,2014-11-07T10:57:02.443Z,14,1260,Acceptance tests for nservicebus core functionality,NServiceBus.AcceptanceTesting,False,2018-04-06T19:48:08.207+00:00,True,False,,"nservicebus,servicebus,msmq,cqrs,publish,subscribe",28263,False,5.1.2
Takenet,2014-11-07T19:06:18.527Z,1260,1260,Get carrier Info,db.take.io.carrier.library,False,2014-11-07T11:08:05.82-08:00,True,False,,,3648,False,0.0.0.4
"XAct Software Solutions,Inc.",2014-11-07T12:37:31.113Z,435,1260,An XActLib assembly: a Library of code for working with ActiveX and COM,XAct.Runtime.InteropServices,False,2017-02-09T01:57:45.993+00:00,True,False,,"XAct,XActLib",92536,False,0.0.4819
"XAct Software Solutions,Inc.",2014-11-07T12:47:22.43Z,435,1260,"An XActLib Assembly: the base assembly for Settings (app,host).",XAct.Settings,False,2017-02-09T01:57:56.947+00:00,True,False,,"XAct,XActLib",62518,False,0.0.4819
Erik Källén,2014-11-06T20:12:33.997Z,996,1261,Installing this package will transform the project to compile to JavaScript.,Saltarelle.Compiler,False,2015-07-29T07:13:09.687-07:00,True,False,,,32794,False,2.6.1
Badreddine DLAILA,2014-11-07T09:40:32.313Z,1156,1260,"TweetSharp for windows phone (8/8.1) is a fast, clean wrapper around the Twitter API. It uses T4 templates to make adding new endpoints easy.",TweetSharp.WindowsPhone,False,2015-02-19T05:48:38.823-08:00,True,False,"TweetSharp  for windows phone (8/8.1) is a fast, clean wrapper around the Twitter API. It uses T4 templates to make adding new endpoints easy.","twitter,tweetsharp,web,api,http,rest,wrapper,json,wp8",1626,False,2.3.0
"XAct Software Solutions,Inc.",2014-11-07T11:53:32.68Z,435,1260,"An XAct Library Assembly: an Assembly that builds on the interfaces defined in XAct.Data, to provide RDBMS specific functionality.",XAct.Data.Db,False,2017-02-08T17:57:01.04-08:00,True,False,,"XAct,XActLib",98435,False,0.0.4819
"CTL Global,Inc.",2014-11-07T03:21:45.343Z,4,1260,A collection of core utilities and extensions applicable for most projects.,Ctl.Core,False,2018-04-16T20:46:49.987+00:00,True,False,,"core,ctl",10406,False,1.0.5423.38433
Drivr,2014-11-06T23:48:20.783Z,568,1261,Drivr.Api.Core.Expandable,Drivr.Api.Core.Expandable,False,2016-09-29T07:21:59.837-07:00,True,False,,,13061,False,1.0.0.21
Robin Hultman,2014-11-07T06:48:27.05Z,59,1260,Extension methods for the BizTalk message context.,BizTalkComponents.Utils,False,2018-02-20T14:26:07.697+00:00,True,False,,BizTalk,10054,False,2.0.0.3
"XAct Software Solutions,Inc.",2014-11-07T13:02:02.35Z,435,1260,An XActLib assembly: the base class for functionality required on a web server.,XAct.Web,False,2017-02-09T01:58:13.103+00:00,True,False,,"XAct,XActLib",30740,False,0.0.4819
eXpandFramework,2014-11-06T19:36:16.88Z,11,1261,Validation Module / eXpandFramework. To debug in VS enable Source Server support under Tools/Options/Debugging.,eXpandValidation,False,2018-04-09T16:24:04.49+00:00,True,False,Validation Module / eXpandFramework,"DevExpress,eXpand,XAF,eXpressApp",39383,False,14.1.8.1
Takenet,2014-11-07T19:06:41.277Z,1260,1260,Get carrier Info,db.take.io.carrier.library,False,2014-11-07T11:08:05.82-08:00,True,False,,,3648,False,0.0.0.5
Takenet,2014-11-07T19:05:47.86Z,1260,1260,Get carrier Info,db.take.io.carrier.library,False,2014-11-07T11:08:05.82-08:00,True,False,,,3648,False,0.0.0.3
eXpandFramework,2014-11-06T19:39:01.147Z,11,1261,WorkFlow Module/ eXpandFramework. To debug in VS enable Source Server support under Tools/Options/Debugging.,eXpandWorkFlow,False,2018-04-09T16:25:28.137+00:00,True,False,WorkFlow Module / eXpandFramework,"DevExpress,eXpand,XAF,eXpressApp",38301,False,14.1.8.1
SEEK Ltd.,2014-11-06T22:35:05.677Z,995,1261,Custom DSC Resources for networking administration,seek-dsc-networking,False,2015-07-30T06:10:03.163-07:00,True,False,,"admin,DSC",17675,False,1.0.0.72
SolerSoft,2014-11-06T22:47:22.753Z,1257,1261,"This helper library allows client applications and Azure .Net backed mobile services to share the same entity class files 
          (through file linking). Simply reference SolerSoft.Data.Client in the client project and SolerSoft.Data.AzureNetServer in 
          the server project, then inherit your entities from SolerSoft.Data.DataObject. On the client, DataObject provides full 
          property change notification. On the server, DataObject inherits from EntityData as reqired by Mobile Service controllers. 
          Conditional compile statements can be used to further refine between client behaviors and server behaviors.",SolerSoft.Data.Client,True,2014-11-10T11:33:33.253-08:00,True,False,,"SolerSoft,Data,Client,Universal,Azure,MobileServices",4422,False,1.0.0-beta7
"XAct Software Solutions,Inc.",2014-11-07T12:23:32.243Z,435,1260,An XActLib assembly: wraps the use of the Jurassic language processor.,XAct.Languages.JS.Jurassic,False,2017-02-09T01:57:36.54+00:00,True,False,,"XAct,XActLib",59581,False,0.0.4819
mtranter mhancock,2014-11-07T14:14:42.18Z,809,1260,An AJAX/HTML Table framework for ASP.Net MVC,MvcTables,False,2016-02-01T08:15:54.38-08:00,True,False,,"mvc,ajax,table,jquery,datatable,grid,iqueryable,razor",7776,False,1.0.0.29
Thong Nguyen,2014-11-07T02:40:01.883Z,43209,1260,"Platform.VirtualFileSystem is a powerful .NET library that provides a uniform and cross-platform abstraction layer for file systems. It is similar to VFS features of various operating systems like Linux except it all runs in managed code.
    You can use one common API for accessing files from various sources (local, http, zip etc) as well as create user-defined file systems using views and overlays.
    
    Find out more at: https://github.com/platformdotnet/Platform.VirtualFileSystem",Platform.VirtualFileSystem,False,1899-12-31T16:00:00-08:00,False,False,A powerful cross-platform virtual file system layer for .NET,"Virtual,VirtualFileSystem,VFS,url,uri,file,directory,files,directories,io",9506,False,1.0.0.87
"Adam Anderly,Geoff Appleford",2014-11-07T15:11:17.79Z,792,1260,DNSimple REST API helper library,DNSimple,False,2016-02-18T08:45:36.997-08:00,True,False,,"REST,DNS,Domains,SSL",6519,False,0.6.0
"GeertvanHorrik,OrchestraDevs",2014-11-07T14:31:35.683Z,4,1260,The Ribbon.Microsoft shell for Orchestra based applications.,Orchestra.Shell.Ribbon.Microsoft,True,2018-04-16T15:54:36.213+00:00,True,False,,"mvvm,orchestra,shell,prism,framework,wpf,microsoft,ribbon",38668,True,2.0.0-unstable0252
Paket team,2014-11-07T15:58:52.927Z,2,1260,A package dependency manager for .NET with support for NuGet packages and GitHub repositories.,Paket.Core,False,2018-04-18T10:23:20.457+00:00,True,False,A package dependency manager for .NET with support for NuGet packages and GitHub repositories.,"nuget,bundler,F#",298246,False,0.12.1
"XAct Software Solutions,Inc.",2014-11-07T12:16:26.943Z,435,1260,An XActLib Assembly: DEFUNCT. No longer needed (service contracts moved to XAct.Core),XAct.IO.Transformations,False,2017-02-09T01:57:29.447+00:00,True,False,,"XAct,XActLib",54803,False,0.0.4819
OrchestraDevs,2014-11-07T13:28:01.117Z,4,1260,This library makes managing workspaces very easy.,Orc.WorkspaceManagement.Xaml,True,2018-04-16T15:16:11.083+00:00,True,False,,"orc,workspace,management,xaml,wpf",12203,True,0.2.0-unstable0049
eXpandFramework,2014-11-06T19:35:08.027Z,11,1261,TreelistView Module (Web) / eXpandFramework. To debug in VS enable Source Server support under Tools/Options/Debugging.,eXpandTreelistViewWeb,False,2018-04-09T16:23:30.6+00:00,True,False,TreelistView Module (Web) / eXpandFramework,"DevExpress,eXpand,XAF,eXpressApp",68988,False,14.1.8.1
eXpandFramework,2014-11-06T19:35:40.98Z,11,1261,TreelistView Module (Win) / eXpandFramework. To debug in VS enable Source Server support under Tools/Options/Debugging.,eXpandTreelistViewWin,False,2018-04-09T16:23:47.913+00:00,True,False,TreelistView Module (Win) / eXpandFramework,"DevExpress,eXpand,XAF,eXpressApp",69561,False,14.1.8.1
eXpandFramework,2014-11-06T19:41:06.483Z,11,1261,"Creates dynamic persistent assemblies. The XAF user interface allows us to create an assembly without writing a single line of code. Advanced users can even use c# scripting and create new code generation templates. To debug in VS enable Source Server support under Tools/Options/Debugging.  
Blogs:
http://apobekiaris.blogspot.com/search/label/WorldCreator",eXpandWorldCreatorWin,False,2018-04-09T16:26:37.873+00:00,True,False,Design runtime assemblies,"DevExpress,eXpand,XAF,eXpressApp",68863,False,14.1.8.1
Kentor,2014-11-07T11:41:33.733Z,93,1260,"A SAML2 Service Provider for ASP.NET MVC. Install in project and add sections to web.config. No coding required. The package adds an MVC controller that handles the SAML SignIn and SignOut. It works with the claims model of .NET 4.5 and uses the present infrastructure for claims translation, session authentication cookies etc.",Kentor.AuthServices.Mvc,False,2018-01-17T15:04:24.033+00:00,True,False,"A SAML2 Service Provider for ASP.NET MVC. The package adds an MVC controller that handles the SAML SignIn and SignOut. It is built on top of the claims model of .NET 4.5 and uses the present infrastructure for claims translation, session authentication cookies etc.","SAML2,authentication,ASP.NET,SAML,SSO,AspNetMvc,Mvc",41673,False,0.10.0
Muhammad Rehan Saeed (RehanSaeed.co.uk),2014-11-06T19:29:59.62Z,1185,1261,Elysium Extra is a library that implements Metro style for Windows Presentation Foundation (WPF) applications. This Project is a very large add-on project built on top of the Elysium SDK.,Elysium.Extra,False,2015-01-20T23:12:41.377-08:00,True,False,Elysium Extra is a library that implements Metro style for Windows Presentation Foundation (WPF) applications. This Project is a very large add-on project built on top of the Elysium SDK.,"Elysium,WPF,UI,Theme,Theming,Metro,Modern,Windows,Phone,8,8.1,8.2,9,Presentation,Foundation,Muhammad,Rehan,Saeed",7978,False,1.1.3
"GeertvanHorrik,OrchestraDevs",2014-11-07T14:30:59.74Z,4,1260,The Ribbon.Fluent shell for Orchestra based applications.,Orchestra.Shell.Ribbon.Fluent,True,2018-04-16T15:54:22.93+00:00,True,False,,"mvvm,orchestra,shell,prism,framework,wpf,fluent,ribbon",36233,True,2.0.0-unstable0252
Grid Protection Alliance,2014-11-06T21:51:31.007Z,43209,1261,"Library of Network Protocol Implementations (e.g., FTP)",GSF.Libraries.Net,True,1899-12-31T16:00:00-08:00,False,False,,,6587,False,2.0.0-beta228
"XAct Software Solutions,Inc.",2014-11-07T11:49:18.217Z,435,1260,An XActLib Assembly: providing persistence (using EF) to XAct.Assistance services.,XAct.Assistance.Persistence.EF,False,2017-02-08T17:56:51.35-08:00,True,False,,"XAct,XActLib",48749,False,0.0.4819
GeertvanHorrik,2014-11-07T01:14:43.84Z,507,1260,Catel.Extensions.Memento library which provides the memento pattern implementation as a service.,Catel.Extensions.Memento,True,2016-11-29T13:36:18.13+00:00,True,False,,"catel,memento",85548,True,4.0.0-unstable0537
David Grenier,2014-11-07T12:56:05.487Z,361,1260,"F# friendly wrapper that will avoid having you spread the Kendo API throughout your code-base.

WebSharper.Kendo contains the Wrapper as well as any dependencies.",WebSharper.KendoWeb,True,2017-04-24T10:37:28.687-07:00,True,False,This new version depends on IntelliFactory's premium kendo extension.,"WebSharper,Kendo",25232,False,1.2.73-alpha
"Adam Anderly,Geoff Appleford",2014-11-06T21:54:37.957Z,792,1261,DNSimple REST API helper library,DNSimple,False,2016-02-18T08:45:36.997-08:00,True,False,,"REST,DNS,Domains,SSL",6519,False,0.5.2
Nu,2014-11-07T08:27:56.867Z,1172,1260,Wrapper of NI communication libs.,Nu.Io.Ni,False,2015-02-02T23:40:21.397-08:00,True,False,,,3606,False,1.1.3
Rapid Solutions Stockholm,2014-11-07T09:10:52.963Z,865,1260,Api to help control access to resources,TypeLess.ResourceAccess,False,2015-12-07T05:56:19.297-08:00,True,False,,,25776,False,1.1.33
eXpandFramework,2014-11-06T19:33:51.257Z,695,1261,Thumbnail Module (Web) / eXpandFramework. To debug in VS enable Source Server support under Tools/Options/Debugging.,eXpandThumbnailWeb,False,2016-05-25T07:49:22.287-07:00,True,False,Thumbnail Module (Web) / eXpandFramework,"DevExpress,eXpand,XAF,eXpressApp",59041,False,14.1.8.1
Takenet,2014-11-07T19:03:03.037Z,520,1260,Client for Takenet Charging Gateway Platform,ChargingGatewayClient,False,2016-11-16T07:46:34.42-08:00,True,False,,"Takenet,Client,Charging,Gateway",2163,False,1.0.5
jzumwalt,2014-11-07T15:55:16.463Z,1260,1260,My package description.,SquirrelTest,False,2014-11-07T09:09:16.89-08:00,True,False,,,2456,False,1.0.0
eXpandFramework,2014-11-06T19:38:27.07Z,11,1261,Wizard Module (Win) / eXpandFramework. To debug in VS enable Source Server support under Tools/Options/Debugging.,eXpandWizardWin,False,2018-04-09T16:25:10.697+00:00,True,False,Wizard Module (Win) / eXpandFramework,"DevExpress,eXpand,XAF,eXpressApp",69382,False,14.1.8.1
"XAct Software Solutions,Inc.",2014-11-07T12:28:48.423Z,435,1260,"An XActLib assembly: an Assembly that provides a Service to map Domain Entities to Client Layer Models, and/or Data Storage Entities.",XAct.ObjectMapping,False,2017-02-09T01:57:41.01+00:00,True,False,,"XAct,XActLib",74806,False,0.0.4819
Takenet,2014-11-07T19:04:56.747Z,1260,1260,Get carrier Info,db.take.io.carrier.library,False,2014-11-07T11:08:05.82-08:00,True,False,,,3648,False,0.0.0.1
Dusan Janosik,2014-11-07T13:47:11.15Z,43209,1260,Makes DataAnnotations and Moon.Validation attributes localizeable by using ResourceManager.,Moon.Localization.Validation,False,1899-12-31T16:00:00-08:00,False,False,,"mooncode,asp.net,mvc,localization,validation",-1,False,0.5.31
York Yao,2014-11-07T15:07:43.48Z,1173,1260,a library to retrieve password.,RetrievePassword,False,2015-02-02T05:59:36.327-08:00,True,False,,"retrieve,password",939,False,1.0.0
Nu,2014-11-07T08:21:17.317Z,1172,1260,Wrapper of NIDigit Card.,Nu.Io.Ni,False,2015-02-02T23:40:21.397-08:00,True,False,,,3606,False,1.1.2
eXpandFramework,2014-11-06T19:34:29.61Z,11,1261,TreelistView Module / eXpandFramework. To debug in VS enable Source Server support under Tools/Options/Debugging.,eXpandTreelistView,False,2018-04-09T16:23:15.02+00:00,True,False,TreelistView Module / eXpandFramework,"DevExpress,eXpand,XAF,eXpressApp",38265,False,14.1.8.1
"XAct Software Solutions,Inc.",2014-11-07T12:20:33.36Z,435,1260,An XActLib Assembly: a library of code to work with the Irony Framework for defining languages.,XAct.Languages.Irony,False,2017-02-08T17:57:34.01-08:00,True,False,,"XAct,XActLib",52156,False,0.0.4819
Mihai Stanimir,2014-11-07T09:43:58.263Z,1257,1260,Metascan Connector,Opswat.Metascan.Connector,False,2014-11-10T01:50:00.323-08:00,True,False,,"Opswat,Metascan,Connector",8850,False,1.1.7
"XAct Software Solutions,Inc.",2014-11-07T12:18:21.06Z,900,1260,"An XActLib Assembly: an implementation of the Markdown service contracts defined in XAct.IO.Transformations.Markdown, using the MarkdownDeep library.",XAct.IO.Transformations.MarkDown.MarkdownDeep,False,2015-11-02T03:31:31.307-08:00,True,False,,"XAct,XActLib",55100,False,0.0.4819
Cameron VanHouzen,2014-11-06T19:39:11.827Z,43209,1261,A set of APIs for interacting with the Versus™ RTLS system.,MAPI,True,1900-01-01T00:00:00+00:00,False,False,,"rtls,api,mapi,mockingbird",-1,False,3.0.0-alpha8
JBM Technologies,2014-11-07T14:08:19.097Z,43209,1260,This package is a collection of extension methods and helpers created by JBM Technologies to use in any project needed.,JBMTCore,False,1900-01-01T00:00:00+00:00,False,False,,,-1,False,1.0.0.22
Allan Ritchie,2014-11-07T14:49:20.857Z,722,1260,"Alert, Confirm, Prompt, Toast, Action Sheet, Login, Loading, and Progress Dialogs calls for your core PCL MvvmCross library (iOS, Android, and WP8)",Acr.MvvmCross.Plugins.UserDialogs,False,2016-04-28T13:40:14.51-07:00,True,False,,"xamarin,mvvmcross",19249,False,2.2.0
eXpandFramework,2014-11-06T19:29:25.49Z,11,1261,Security Module / eXpandFramework. To debug in VS enable Source Server support under Tools/Options/Debugging.,eXpandSecurity,False,2018-04-09T16:21:17.33+00:00,True,False,Security Module / eXpandFramework,"DevExpress,eXpand,XAF,eXpressApp",40956,False,14.1.8.1
GeertvanHorrik,2014-11-06T22:37:53.35Z,507,1261,"Catel.Extensions.DynamicObjects library which provides dynamic objects. This adds the IDynamicMetaObjectProvider and ICustomTypeProvider
	  to the ModelBase class.",Catel.Extensions.DynamicObjects,True,2016-11-29T05:36:02.283-08:00,True,False,,"catel,data,model,modelbase,dynamic,object,IDynamicMetaObjectProvider,ICustomTypeProvider",76524,True,4.0.0-unstable0535
Bernhard Richter,2014-11-06T21:18:00.123Z,158,1261,Provides an integration that enables LightInject to be used as the IoC container in the Nancy web framework.,LightInject.Nancy,False,2017-11-13T10:10:55.477+00:00,True,False,,"Ioc,Dependency-Injection,Inversion-of-Control,LightInject,Web,Nancy,NancyFx",2177,False,1.0.0.1
jzumwalt,2014-11-07T17:09:16.89Z,1260,1260,Empty package to test Squirrel Windows,SquirrelTest,False,2014-11-07T09:09:16.89-08:00,True,False,,,2456,False,1.0.3
Paket team,2014-11-07T09:19:52.327Z,2,1260,A package dependency manager for .NET with support for NuGet packages and GitHub repositories.,Paket,False,2018-04-18T10:23:50.3+00:00,True,False,A package dependency manager for .NET with support for NuGet packages and GitHub repositories.,"nuget,bundler,F#",834968,False,0.12.0
Grid Protection Alliance,2014-11-06T21:49:14.347Z,43209,1261,"Library of components for TCP, UDP, serial and file-based communication in an abstract fashion.",GSF.Libraries.Communication,True,1899-12-31T16:00:00-08:00,False,False,,,7147,False,2.0.0-beta228
"XAct Software Solutions,Inc.",2014-11-07T12:06:10.273Z,435,1260,An XActLib assembly: base library for code to do with image manipulation or analysis.,XAct.Imaging,False,2017-02-08T17:57:21.133-08:00,True,False,,"XAct,XActLib",54496,False,0.0.4819
Mihai Stanimir,2014-11-07T11:23:31.137Z,1257,1260,Metascan Connector,Opswat.Metascan.Connector,False,2014-11-10T01:50:00.323-08:00,True,False,,"Opswat,Metascan,Connector",8850,False,1.1.9
Hibernating Rhinos,2014-11-07T08:05:30.057Z,21,1260,"This package includes the client API of RavenDB. RavenDB is a document database for the .NET platform, offering a flexible data model design to fit the needs of real world systems.",RavenDB.Client,False,2018-03-30T12:13:14.39+00:00,True,False,This package includes the client API of RavenDB.,"nosql,ravendb,raven,document,database,client",1119805,True,2.5.2938
GeertvanHorrik,2014-11-07T01:15:38.38Z,507,1260,Catel.Extensions.Wcf.Server library which provides WCF server capabilities.,Catel.Extensions.Wcf.Server,True,2016-11-29T13:36:30.393+00:00,True,False,,"catel,wcf,server,windows,communication,foundation",67795,True,4.0.0-unstable0537
"Nikhil Kothari,Erik Källén",2014-11-07T17:34:41.45Z,996,1260,Runtime library for projects compiled with Saltarelle.Compiler. This is a slightly modified version of the Script# runtime library by Nikhil Kothari (https://github.com/nikhilk/scriptsharp).,Saltarelle.Runtime,False,2015-07-29T07:14:30.817-07:00,True,False,,"compiler,c#,javascript,web",30414,False,2.6.2
"XAct Software Solutions,Inc.",2014-11-07T12:44:47.717Z,435,1260,An XActLib assembly: a Library for working with an DependencyInjectionContainer in an Mvc App,XAct.Services.IoC.AspMvc,False,2017-02-09T01:57:57.337+00:00,True,False,,"XAct,XActLib",74328,False,0.0.4819
JBM Technologies,2014-11-06T21:11:23.673Z,43209,1261,This package is a collection of extension methods and helpers created by JBM Technologies to use in any project needed.,JBMTCore,False,1900-01-01T00:00:00+00:00,False,False,,,-1,False,1.0.0.20
Thomas Krantz,2014-11-07T11:20:26.717Z,1247,1260,Description,CloudyCMS,False,2014-11-20T02:04:04.27-08:00,True,False,,,5281,False,1.2.27
eXpandFramework,2014-11-06T19:37:55.593Z,11,1261,ViewVariants Module / eXpandFramework. To debug in VS enable Source Server support under Tools/Options/Debugging.,eXpandViewVariants,False,2018-04-09T16:24:52.93+00:00,True,False,ViewVariants Module / eXpandFramework,"DevExpress,eXpand,XAF,eXpressApp",38158,False,14.1.8.1
Grean,2014-11-07T12:34:52.52Z,1243,1260,Azure Blog Storage persistence library for an event store implementation based on the Atom syndication format.,AtomEventStore.AzureBlob,False,2014-11-24T06:30:29.317-08:00,True,False,,"EventSourcing,Atom",4283,False,1.6.0
