authors,created,description,id,is_prerelease,last_updated,listed,missing_info,summary,tags,total_downloads,verified,versionEd Charbeneau,2013-08-06T13:32:22.94Z,"See included readme for setup instructions.

Foundation is the most advanced responsive front-end framework in the world. With Foundation you can quickly prototype and build sites or apps that work on any kind of device, with tons of included layout constructs (like a full responsive grid), elements and best practices.

Homepage: http://foundation.zurb.com
Documentation: http://foundation.zurb.com/docs
Download: http://foundation.zurb.com/download.php

Foundation is MIT-licensed and absolutely free to use. Foundation wouldn't be possible without the support of the entire ZURB team, our friends and colleagues who gave feedback, and some luminaries who did some heavy lifting that we took advantage of (thanks guys).",Foundation4.MVC4.Sass,False,2013-08-06T06:32:22.94-07:00,True,False,"Zurb Foundation HTML Boilerplate, CSS, JS, Plugins
An easy to use, powerful, and flexible framework for building prototypes and production code on any kind of device.","HTML,CSS,MVC,Template,Boilerplate,Javascript,Prototyping,Framework,Foundation,Zurb",8203,False,1.2.431
NServiceBus Ltd,2013-08-06T21:03:30.493Z,RabbitMQ support for NServicebus,NServiceBus.RabbitMQ,True,2018-02-16T08:20:32.96+00:00,True,False,,"nservicebus,servicebus,msmq,cqrs,publish,subscribe",197554,False,1.0.0-unstable3330
NServiceBus Ltd,2013-08-06T21:02:31.55Z,Azure support for NServicebus,NServiceBus.Azure,True,2017-02-27T15:06:56.187-08:00,True,False,,"nservicebus,servicebus,msmq,cqrs,publish,subscribe",153360,False,4.1.0-unstable3330
"atuzovic,jdusper,devlogic",2013-08-06T08:17:27.96Z,Extensible library that allows removal of metadata from various document formats.,MetaRipper,False,2013-11-30T08:57:49.697-08:00,True,False,Document metadata remover.,,4787,False,0.1.9
"Thomas PIERRAIN,Cyrille DUPUYDAUBY,Marc-Antoine LATOUR,Rui CARVALHO",2013-08-06T18:28:41.38Z,"NFluent is an ergonomic check library which aims to fluent your .NET TDD experience (based on simple Check.That() check statements). NFluent aims your tests to be fluent to write (with an happy 'dot' auto completion experience), fluent to read (i.e. as close as possible to plain English expression), but also fluent to troubleshoot, in a less-error-prone way comparing to the classical .NET test frameworks. NFluent is directly, but also freely, inspired by the awesome Java FEST fluent check/reflection library (http://fest.easytesting.org/).",NFluent,False,2018-02-10T08:49:31.423+00:00,True,False,NFluent is an ergonomic check library which aims to fluent your .NET TDD experience.,"tdd,bdd,test,fluent,check,checks,easy",170730,False,0.9.0
"Jeremy Miller,et al.",2013-08-06T12:44:47.063Z,Helpers to integrate the SlickGrid library into FubuMVC applications,FubuMVC.SlickGrid,False,2016-01-05T05:27:17.62-08:00,True,False,,"fubumvc,slickgrid",6612,False,0.5.0.638
Mehdi Khalili,2013-08-06T14:57:39.917Z,"A micro-framework that turns your normal strings, type names, enum fields, date fields ETC into a human friendly format",Humanizer,False,2017-05-04T16:58:14.877-07:00,True,False,,,824236,True,0.3.1
ForexClub,2013-08-06T19:04:12.533Z,Base socket system,Fx.SocketSystem.Engine,True,1899-12-31T16:00:00-08:00,False,False,,"fxclub,fxsocketsystem,fx.socketsystem",-1,False,1.0.0.41512-beta
ForexClub,2013-08-06T21:59:16.677Z,Build from svn-trunk (executer),Fx.AppServer.DefaultTemplate,True,1899-12-31T16:00:00-08:00,False,False,,"fxclub,fxappserver,fx.appserver",-1,False,1.1.4967.3572-beta
ForexClub,2013-08-06T20:50:02.973Z,Base socket system,Fx.SocketSystem.Domain,True,1899-12-31T16:00:00-08:00,False,False,,"fxclub,fxsocketsystem,fx.socketsystem",-1,False,1.0.4967.1455-beta
ForexClub,2013-08-06T21:36:24.67Z,Build from svn-trunk (executer),Fx.AppServer.DefaultTemplate,True,1899-12-31T16:00:00-08:00,False,False,,"fxclub,fxappserver,fx.appserver",-1,False,1.1.4967.2886-beta
Selenium Committers,2013-08-06T17:42:39.533Z,"Selenium is a set of different software tools each with a different approach to supporting browser automation. These tools are highly flexible, allowing many options for locating and manipulating elements within a browser, and one of its key features is the support for automating multiple browser platforms. This package contains the .NET bindings for the older, more procedural Selenium Remote Control (or Selenium RC) API. It requires a running instance of the Selenium Server, and uses JavaScript for automating the browser, which means it is limited to the functionality available from within the JavaScript sandbox.",Selenium.RC,False,2017-02-16T08:02:09.67-08:00,True,False,.NET bindings for the Selenium RC API,"Selenium,remote,control,RC,browser,automation",558786,False,2.34.0
Hibernating Rhinos LTD,2013-08-06T14:50:22.697Z,"LinqToSql Profiler is a real-time visual debugger allowing a development team to gain valuable insight and perspective into their usage of LinqToSql. The product is architected with input coming from many top industry leaders within the OR/M community. Alerts are presented in a concise code-review manner indicating patterns of misuse by your application. To streamline your efforts to correct the misuse, we provide links to the problematic code section that triggered the alert.

We provide a 30 day trial to download and see for yourself, the value you will receive with your purchase of LinqToSql Profiler.",LinqToSqlProfiler.Production,False,1899-12-31T16:00:00-08:00,False,False,This package enables production profiling of LinqToSql.,"LinqToSql,Profiler,Prof,Production,L2SProf",-1,False,2.0.2188
SYSTEM,2013-08-06T22:00:59.297Z,Noodles transforms your object model into a web app. Install this library to use Noodles with Web Api,Noodles.WebApi,False,2013-11-23T10:56:58.177-08:00,True,False,,,39841,False,1.1.513
GeertvanHorrik,2013-08-06T06:23:25.66Z,Catel.Extensions.Data library which provides data classes such as repositories.,Catel.Extensions.Data,True,2016-11-29T05:35:59.533-08:00,True,False,,"catel,data,repository,repositories",102751,True,3.6.1308060814-beta
ForexClub,2013-08-06T20:15:50.897Z,Shared classe for all projects.,Fx.Common.SL,True,1899-12-31T16:00:00-08:00,False,False,,"fxclub,fxcommon,fxcommonsl,fx.common,Fx.Common.SL,fxsl",-1,False,1.0.4967.460-beta
"Daniel Crenna,JP Toto",2013-08-06T18:06:20.323Z,Leave email delivery to the experts with this plugin to bring Postmark email services to your web application. Requires a Postmark account.,Postmark,False,2017-10-30T13:18:36.37+00:00,True,False,Leave email delivery to the experts with this plugin to bring Postmark email services to your web application.,"postmark,email,web,api,client,http,rest,services,wrapper,json",180272,False,1.2.0
ForexClub,2013-08-06T00:22:58.043Z,Base socket system,Fx.SocketSystem.Domain,True,1899-12-31T16:00:00-08:00,False,False,,"fxclub,fxsocketsystem,fx.socketsystem",-1,False,1.0.0.7878-beta
"Joshua Arnold,et al.",2013-08-06T12:43:15.827Z,Request correlation and other AJAX helpers for FubuMVC,FubuMVC.Ajax,False,2013-12-16T12:01:06.947-08:00,True,False,,"fubumvc,ajax,continuations",8858,False,0.1.0.399
"Thad Smith,Page Brooks",2013-08-06T22:21:52.343Z,"A small library that complements Dapper by adding basic CRUD operations (Get, Insert, Update, Delete) for your POCOs. For more advanced querying scenarios, Dapper Extensions provides a predicate system.",DapperExtensions,False,2017-08-09T02:40:55.057+00:00,True,False,,"orm,sql,micro-orm,Data,Dapper",297044,False,1.4.2
ForexClub,2013-08-06T21:36:36.65Z,Shared classe for all projects.,Fx.Common,True,1899-12-31T16:00:00-08:00,False,False,,"fxclub,fxcommon,fx.common",-1,False,1.0.4967.2880-beta
ForexClub,2013-08-06T21:23:02.373Z,Socket for zabbix,Fx.SocketSystem.Zabbix,True,1899-12-31T16:00:00-08:00,False,False,,"fxclub,fxsocketsystem,fx.socketsystem,fxzabbix,fx.zabbix",-1,False,1.0.4967.2452-beta
eXpand,2013-08-06T21:04:53.683Z,TreelistView Module (Web) / eXpand Framework,eXpandTreelistViewWeb,False,2018-04-09T16:23:30.6+00:00,True,False,TreelistView Module (Web) / eXpand Framework,"DevExpress,eXpand",68262,False,13.1.5.19
ForexClub,2013-08-05T23:55:30.56Z,Silverlight controls,Fx.Common.SL.Controls,True,1899-12-31T16:00:00-08:00,False,False,,"fxclub,fxcommon,fx.common,Fx.Common.SL.Controls,Fxcontrols,fxsl",-1,False,1.0.0.7055-beta
Jeremy D. Miller,2013-08-06T12:43:07.933Z,Frictionless documentation tooling,FubuDocs,False,2014-03-01T07:55:38.593-08:00,True,False,,"fubumvc,documentation",1475,False,0.9.0.165
"Joshua Arnold,Jeremy D. Miller,et al.",2013-08-06T12:34:33.067Z,Bottle services,Bottles.Services,False,2013-08-06T05:34:33.067-07:00,True,False,,"packaging,areas,slices,services",558,False,0.1.0.26
ForexClub,2013-08-06T21:02:29.233Z,Base socket system,Fx.SocketSystem.Extensions,True,1899-12-31T16:00:00-08:00,False,False,,"fxclub,fxsocketsystem,fx.socketsystem",-1,False,1.0.4967.1818-beta
"Alex Henning Johannessen,et al.",2013-08-06T12:43:37.07Z,CoffeeScript support for FubuMVC.,FubuMVC.Coffee,False,2013-12-16T12:01:14.973-08:00,True,False,,fubumvc,7500,False,0.0.1.1016
ForexClub,2013-08-06T20:15:53.653Z,Silverlight controls,Fx.Common.SL.Controls,True,1899-12-31T16:00:00-08:00,False,False,,"fxclub,fxcommon,fx.common,Fx.Common.SL.Controls,Fxcontrols,fxsl",-1,False,1.0.4967.461-beta
SYSTEM,2013-08-06T22:02:07.257Z,"Install this project if you want to edit the FormFactory templates, or if you don't want to use the EmbeddedResourceVirutalPathProvider",FormFactory.Templates,False,2018-03-12T09:51:54.47+00:00,True,False,,,53611,False,1.2.285
"Jeremy D. Miller,Joshua Arnold,Corey Kaylor",2013-08-06T12:43:46.7Z,FubuMVC.Core Library,FubuMVC.Core,False,2017-08-22T17:56:15.127+00:00,True,False,,"web,framework,mvc,fubumvc",57353,False,1.1.0.1542
Scooletz,2013-08-06T17:38:48.48Z,The LINQ extension over protobuf-net,protobuf-linq,False,2013-08-06T10:38:48.48-07:00,True,False,,"binary,serialization,protocol,buffers,protobuf,deserialization,LINQ",2846,False,0.3.0
CGenTools,2013-08-06T10:50:32.93Z,System Utilities,CGenT.SysUtil.N450,False,2013-08-06T14:43:54.323-07:00,True,False,,CGenT,3684,False,0.6.4966.35597
Andreas Larsen,2013-08-06T20:57:25.503Z,"Units.NET gives you all the common units of measurement and the conversions between them. It is light-weight, unit tested and supports PCL.",UnitsNet,False,2018-04-16T10:58:31.157+00:00,True,False,Simplifies working with units of measurement.,"unit,units,si,metric,imperial,abbreviation,abbreviations,convert,parse",142579,False,1.6.0
"Alex Henning Johannessen,et al.",2013-08-06T12:44:18.007Z,Less support for FubuMVC.,FubuMVC.Less,False,2013-12-16T12:01:51.577-08:00,True,False,,fubumvc,7982,False,0.0.1.1016
Harry McIntyre,2013-08-06T20:56:44.257Z,Noodles transforms your object modelinto a web app. This is the core library without a dependency on ASP MVC,Noodles,False,2013-11-23T10:56:35.543-08:00,True,False,,"NakedObjects,Scaffolding,DynamicData",86888,False,1.1.512
"Corey Kaylor,Alex Henning Johannessen,Jeremy D. Miller",2013-08-06T12:44:34.51Z,Support for using the Razor view engine within a FubuMVC application.,FubuMVC.Razor,False,2017-01-31T12:50:52.66-08:00,True,False,,"fubumvc,razor,razorengine,fubu",19937,False,1.0.0.534
Anders Malmgren,2013-08-06T14:19:37.51Z,Caliburn Micro style conventions for Knockout,Knockout.BindingConventions,False,2015-04-17T11:07:21.703-07:00,True,False,,"Knockout,MVVM,Binding,Convention,MVC,ViewModel,Presentation,Model-View-ViewModel,Caliburn",10048,False,1.2.72
"Jeremy D. Miller,Dru Sellers,et al.",2013-08-06T12:34:30.75Z,Support for creating services via Bottles,Bottles.Host.Packaging,False,2013-08-06T05:34:30.75-07:00,True,False,,"packaging,service",34709,False,0.9.2.23
camle,2013-08-06T11:04:06.977Z,Business objects application framework.,Worm,False,1899-12-31T16:00:00-08:00,False,False,,,44446,False,1.0.193
eXpand,2013-08-06T11:12:23.86Z,JobSheduler Module (Win) / eXpand Framework,eXpandJobShedulerWin,False,2013-08-09T07:41:46.73-07:00,True,False,JobSheduler Module (Win) / eXpand Framework,"DevExpress,eXpand",31917,False,13.1.5.18
NServiceBus Ltd,2013-08-06T21:02:26.417Z,The Autofac Container for the nservicebus,NServiceBus.Autofac,True,2018-02-16T08:25:42.907+00:00,True,False,,"nservicebus,servicebus,msmq,cqrs,publish,subscribe",277658,False,4.1.0-unstable3330
David Ebbo,2013-08-06T20:07:34.347Z,"A package that allows other packages to execute some startup code in web apps. This package should be used over the older WebActivator, which was not strong named.",WebActivatorEx,False,2016-10-05T13:12:09.48-07:00,True,False,,,11844728,False,2.0.3
"Daniel Crenna,JP Toto",2013-08-06T16:15:15.413Z,Leave email delivery to the experts with this plugin to bring Postmark email services to your web application. Requires a Postmark account.,Postmark,True,2017-10-30T13:18:36.37+00:00,True,False,Leave email delivery to the experts with this plugin to bring Postmark email services to your web application.,"postmark,email,web,api,client,http,rest,services,wrapper,json",180272,False,1.2.0-beta
Leon Meijer,2013-08-06T10:08:57.723Z,Part of the Co-Console SDK. Use this package to connect to the Co-Console API.,Lucy.CoConsole.ApiClient.Actions.Portable,False,1899-12-31T16:00:00-08:00,False,False,,,-1,False,1.8.5.56
Jake Ginnivan,2013-08-06T17:29:34.973Z,"Makes VSTO development with Word far nicer, support DI/IoC, ViewModel per context (Document, Workbook, ApointmentItem etc), WPF like binding in RibbonXML, WPF Support and more!",VSTOContrib.Word,False,2013-11-25T13:19:08.333-08:00,True,False,,"VSTO,Office,Word",4004,False,0.12.0.98
ForexClub,2013-08-06T20:52:15.053Z,>Build from svn-trunk (executer),Fx.RemoteAdmin.Shared.SL,True,1899-12-31T16:00:00-08:00,False,False,,"fxclub,fx.remoteadmin,fxremoteadmin",-1,False,1.0.4967.1529-beta
Qsys Sverige AB,2013-08-06T13:39:40.51Z,QuickPick Base module,QuickPick.One,False,2018-04-09T14:56:23.34+00:00,True,False,,"Apollo,Apollo13,Quickpick,Qsys",129848,False,1.0.2.29
tom-englert.de,2013-08-06T10:26:42.72Z,"This package contains useful extensions for the MS DataGrid (System.Windows.Controls.DataGrid).
The current version supports the following features:

Add filtering capabilities to the DataGrid.
 - Easy to use
 - Easy to customize
 - Attaches to the existing DataGrid",DataGridExtensions,False,2017-09-14T05:06:46.573+00:00,True,False,Modular extensions for the DataGrid control.,"DGX,DataGrid,Filter",24087,False,1.0.10
Matthias Gernand,2013-08-06T19:12:22.61Z,WindowsPhone 8 test runner app for NUnit.,PUnit.WindowsPhone,False,1899-12-31T16:00:00-08:00,False,False,,"nunit,runner,windowsphone",-1,False,1.0.1
"Sam Harwell,Terence Parr",2013-08-06T05:10:55.643Z,"The C# target of the ANTLR 3 parser generator. This package supports projects targeting .NET 2.0 or newer, and built using Visual Studio 2008 or newer.",Antlr3,True,2018-04-08T13:37:48.197+00:00,True,False,The C# target of the ANTLR 3 parser generator.,"antlr,antlr3,parsing",18565,True,3.5.0.3-alpha001
ForexClub,2013-08-06T20:16:13.68Z,>Build from svn-trunk (executer),Fx.RemoteAdmin.Shared.SL,True,1899-12-31T16:00:00-08:00,False,False,,"fxclub,fx.remoteadmin,fxremoteadmin",-1,False,1.0.4967.466-beta
eXpand,2013-08-06T21:02:35.727Z,ExceptionHandling Module (Win) / eXpand Framework,eXpandExceptionHandlingWin,False,2015-04-27T12:08:01.677-07:00,True,False,ExceptionHandling Module (Win) / eXpand Framework,"DevExpress,eXpand",56784,False,13.1.5.19
eXpand,2013-08-06T11:14:50.057Z,"Creates dynamic persistent assemblies. The XAF user interface allows us to create an assembly without writing a single line of code. Advanced users can even use c# scripting and create new code generation templates.  
Blogs:
http://apobekiaris.blogspot.com/search/label/WorldCreator",eXpandWorldCreatorWin,False,2018-04-09T16:26:37.873+00:00,True,False,Design runtime assemblies,"DevExpress,eXpand",68108,False,13.1.5.18
"Alex Henning Johannessen,et al.",2013-08-06T12:44:22.947Z,JavaScript minification for FubuMVC with uglify.js,FubuMVC.Minifier,False,2013-12-16T12:01:55.2-08:00,True,False,,fubumvc,1239,False,0.0.1.1016
eXpand,2013-08-06T11:12:09.863Z,IO Module (Win) / eXpand Framework,eXpandIOWin,False,2018-04-09T16:14:14.513+00:00,True,False,IO Module (Win) / eXpand Framework,"DevExpress,eXpand",69263,False,13.1.5.18
mookid8000,2013-08-06T17:38:41.077Z,Provides extension methods that allow for registering reply handlers inline,Rebus.Async,False,2017-08-15T22:38:07.727+00:00,True,False,,"rebus,async,lambda",28795,False,0.35.0
ForexClub,2013-08-06T20:15:43.943Z,Shared classe for all projects.,Fx.Common,True,1899-12-31T16:00:00-08:00,False,False,,"fxclub,fxcommon,fx.common",-1,False,1.0.4967.459-beta
ForexClub,2013-08-05T23:56:32.55Z,Shared classe for all projects.,Fx.Common.SL,True,1899-12-31T16:00:00-08:00,False,False,,"fxclub,fxcommon,fxcommonsl,fx.common,Fx.Common.SL,fxsl",-1,False,1.0.0.7086-beta
ForexClub,2013-08-06T20:52:41.903Z,Socket for zabbix,Fx.SocketSystem.Zabbix,True,1899-12-31T16:00:00-08:00,False,False,,"fxclub,fxsocketsystem,fx.socketsystem,fxzabbix,fx.zabbix",-1,False,1.0.4967.1527-beta
NServiceBus Ltd,2013-08-06T21:03:46.883Z,"The testing for the nservicebus, The most popular open-source service bus for .net",NServiceBus.Testing,True,2018-02-16T08:24:31.56+00:00,True,False,,"nservicebus,servicebus,msmq,cqrs,publish,subscribe",324198,False,4.1.0-unstable3330
"Daniel Crenna,JP Toto",2013-08-06T19:04:19.977Z,Leave email delivery to the experts with this plugin to bring Postmark email services to your web application. Requires a Postmark account.,Postmark,True,2017-10-30T13:18:36.37+00:00,True,False,Leave email delivery to the experts with this plugin to bring Postmark email services to your web application.,"postmark,email,web,api,client,http,rest,services,wrapper,json",180272,False,1.2.1-beta
"Jeremy Miller,et al.",2013-08-06T12:44:48.44Z,Serenity/WebDriver/Storyteller test helpers for FubuMVC.SlickGrid,FubuMVC.SlickGrid.Serenity,False,2013-12-16T12:02:13.357-08:00,True,False,,"fubumvc,slickgrid",1485,False,0.5.0.638
mookid8000,2013-08-06T17:39:03.773Z,Provides RavenDb saga persister and subscription storage,Rebus.RavenDb,False,2017-08-15T22:44:57.243+00:00,True,False,,"rebus,ravendb",66507,False,0.35.0
eXpand,2013-08-06T11:13:38.077Z,SqlDbMapper Module (Win) / eXpand Framework,eXpandSqlDbMapperWin,False,2013-08-09T07:43:04.063-07:00,True,False,SqlDbMapper Module (Win) / eXpand Framework,"DevExpress,eXpand",31341,False,13.1.5.18
GeertvanHorrik,2013-08-06T06:23:30.65Z,"Catel.Extensions.EntityFramework5 library which provides data classes such as repositories, unit of work, DbContextManager and more.",Catel.Extensions.EntityFramework5,True,2016-11-29T13:36:06.393+00:00,True,False,,"catel,entity,framework,entityframework,EF,EF5,UnitOfWork,unit,of,work,DbContextManager,repository,repositories,database",96169,True,3.6.1308060814-beta
saveenr,2013-08-06T18:19:13.937Z,"VisioAutomation helps developers to control Visio from .NET languages. 
It simplifies common tasks and makes it easier to build Visio add-ins and automation/scripting tools.",VisioAutomation2010,False,2017-08-15T06:42:17.947+00:00,True,False,,Visio,11206,False,1.1.2
Jake Ginnivan,2013-08-06T17:29:19.063Z,"Makes VSTO development with Excel far nicer, support DI/IoC, ViewModel per context (Document, Workbook, ApointmentItem etc), WPF like binding in RibbonXML, WPF Support and more!",VSTOContrib.Excel,False,2013-11-25T13:18:48.933-08:00,True,False,,"VSTO,Office,Excel",3908,False,0.12.0.98
NServiceBus Ltd,2013-08-06T21:02:36.043Z,The CastleWindsor Container for the nservicebus,NServiceBus.CastleWindsor,True,2018-02-16T08:25:50.44+00:00,True,False,,"nservicebus,servicebus,msmq,cqrs,publish,subscribe",197855,False,4.1.0-unstable3330
Aristotelis Pitaridis,2013-08-06T05:24:13.23Z,This library allows a DNN developer to easily add features in an ASP.NET MVC site with ready to use HTML Helpers.,jQueryDotNet,False,1899-12-31T16:00:00-08:00,False,False,,,-1,False,1.0.0
GeertvanHorrik,2013-08-06T06:23:37.767Z,Catel.Extensions.Memento library which provides the memento pattern implementation as a service.,Catel.Extensions.Memento,True,2016-11-29T13:36:18.13+00:00,True,False,,"catel,memento",84774,True,3.6.1308060814-beta
eXpand,2013-08-06T21:05:33.723Z,WorkFlow Module (Web) / eXpand Framework,eXpandWorkFlowWeb,False,2013-08-09T07:44:02.05-07:00,True,False,WorkFlow Module (Web) / eXpand Framework,"DevExpress,eXpand",32615,False,13.1.5.19
"Jeremy Miller,et al.",2013-08-06T12:44:38.617Z,Adds Saml2 support to a FubuMVC application,FubuMVC.Saml2,False,2013-12-16T12:02:00.48-08:00,True,False,,"fubumvc,authentication,saml2",694,False,0.5.0.36
Jon Henning,2013-08-06T14:27:51.157Z,A collection of useful extension methods,CodeEndeavors.Extensions,False,2016-09-13T08:46:42.213-07:00,True,False,,,4816,False,1.0.1
ForexClub,2013-08-06T20:15:59.577Z,Build from svn-trunk (executer),Fx.RemoteAdmin.Server,True,1899-12-31T16:00:00-08:00,False,False,,"fxclub,fx.remoteadmin,fxremoteadmin",-1,False,1.0.4967.466-beta
ForexClub,2013-08-05T23:55:27.21Z,Shared classe for all projects.,Fx.Common.SL,True,1899-12-31T16:00:00-08:00,False,False,,"fxclub,fxcommon,fxcommonsl,fx.common,Fx.Common.SL,fxsl",-1,False,1.0.0.7054-beta
ForexClub,2013-08-06T20:16:27.18Z,Base socket system,Fx.SocketSystem.Engine,True,1899-12-31T16:00:00-08:00,False,False,,"fxclub,fxsocketsystem,fx.socketsystem",-1,False,1.0.4967.463-beta
eXpand,2013-08-06T21:03:28.11Z,JobSheduler Module (Win) / eXpand Framework,eXpandJobShedulerWin,False,2013-08-09T07:41:46.73-07:00,True,False,JobSheduler Module (Win) / eXpand Framework,"DevExpress,eXpand",31917,False,13.1.5.19
"KCF Technologies,Inc.",2013-08-06T14:04:17.603Z,Description,Prometheus.Shared,False,2014-05-14T06:34:59.16-07:00,True,False,,,68764,False,1.0.4966.16290
XemioNetwork,2013-08-06T21:42:54.313Z,A simple GDI renderer for the XGL.,Xemio-GameLibrary-GDI-Renderer,False,2014-05-08T07:51:00.123-07:00,True,False,,"xemio,game,library,xna,gdi,renderer",7761,False,1.0.0
Microsoft,2013-08-06T03:34:58.447Z,Windows Azure Service Bus messaging backplane for scaling out of ASP.NET SignalR applications in a web-farm.,Microsoft.AspNet.SignalR.ServiceBus,False,2018-03-14T20:21:47.59+00:00,True,False,Windows Azure Service Bus messaging backplane for scaling out of ASP.NET SignalR applications in a web-farm.,"Microsoft,AspNet,SignalR,AspNetSignalR,ServiceBus",289446,True,1.1.3
eXpand,2013-08-06T11:12:44.34Z,ModelArtifact Module (Web) / eXpand Framework,eXpandModelArtifactWeb,False,2013-08-09T07:42:06.993-07:00,True,False,ModelArtifact Module (Web) / eXpand Framework,"DevExpress,eXpand",31855,False,13.1.5.18
ForexClub,2013-08-06T20:49:19.67Z,Build from svn-trunk (executer),Fx.AppServer.DefaultTemplate,True,1899-12-31T16:00:00-08:00,False,False,,"fxclub,fxappserver,fx.appserver",-1,False,1.1.4967.1464-beta
Aristotelis Pitaridis,2013-08-06T05:43:02.157Z,This library allows a DNN developer to easily add features in an ASP.NET MVC site with ready to use HTML Helpers.,jQueryDotNet,False,1899-12-31T16:00:00-08:00,False,False,,"jQuery,html,helper,net",-1,False,1.0.1
Microsoft,2013-08-06T22:00:54.9Z,"Noodles transforms your object model into a web app. Install this library to customise the cshtml template files, or if you don't want to use the EmbeddedResourceVirtualPathProvider to load your views",Noodles.AspMvc.Templates,False,2013-11-23T10:56:53.3-08:00,True,False,,,40469,False,1.1.513
Jerrod Horton,2013-08-05T23:48:49.797Z,"SimpleRest is a light weight, extensible, easy to use REST platform created to make REST service creation easier and more full featured.",SimpleRest.Core,False,2013-11-07T19:18:18.407-08:00,True,False,,"rest,service,simple,simplerest,simplerest.core",7909,False,1.0.3.8
jiaweiwei,2013-08-07T02:11:02.627Z,"Fastest.Json is the fastest serialize framework for .Net,it support all base type,and other type ,we can serialize object to byte[] or json direct to byte[] better for net transfer,and all it you ToString(),it can,most important, it fastest, in normal case,it can 4x than other,such as ServiceStack,Newtonsoft.Json and fastJson . of course ,if you can use binary serialize,it more fast and use less space. if you use ,you will like.",Fastest.Json,False,1899-12-31T16:00:00-08:00,False,False,,,-1,False,0.3.5
eXpand,2013-08-06T11:13:17.537Z,PivotChart Module (Web) / eXpand Framework,eXpandPivotChartWeb,False,2018-04-09T16:18:47.917+00:00,True,False,PivotChart Module (Web) / eXpand Framework,"DevExpress,eXpand",68944,False,13.1.5.18
Matt Sollars,2013-08-06T12:43:32.75Z,Autofac bootstrapping for FubuMVC applications,FubuMVC.Autofac,False,2014-03-01T07:55:48.217-08:00,True,False,,"web,framework,mvc,fubumvc",1460,False,1.1.0.1542
"Jeremy D. Miller,Joshua Arnold,Corey Kaylor",2013-08-06T12:43:55.357Z,Shared support for FubuMVC view engines,FubuMVC.Core.View,False,2016-01-05T05:44:54.64-08:00,True,False,,"web,framework,mvc,fubumvc",14184,False,1.0.0.534
Michael Ahern,2013-08-06T19:05:55.157Z,"IfInjector is a high performance mobile ready, C# micro IoC container.",IfInjector,False,2013-11-27T14:33:56.187-08:00,True,False,"High performance mobile ready, C# micro IoC container.",,3456,False,0.5.0
Colby Dillion,2013-08-06T23:18:47.353Z,A DICOM library for .NET,fo-dicom,False,2017-05-02T06:49:01.943-07:00,True,False,,,45584,False,1.0.36
"Steffen Forkmann,Mauricio Scheffer,Colin Bull",2013-08-06T09:09:08.167Z,FAKE - F# Make - is a build automation tool for .NET. Tasks and dependencies are specified in a DSL which is integrated in F#.,FAKE,False,2018-04-15T16:37:14.193+00:00,True,False,,build,1440554,False,1.74.248
