authors,created,description,id,is_prerelease,last_updated,listed,missing_info,summary,tags,total_downloads,verified,versionJalal,2014-09-14T10:08:26.677Z,This is mvc library for proggasoft projects.,Proggasoft.Mvc,False,2017-06-03T23:11:21.863-07:00,True,False,,,5299,False,2.0.5369
GeertvanHorrik,2014-09-15T10:00:00.013Z,"Catel.Extensions.DynamicObjects library which provides dynamic objects. This adds the IDynamicMetaObjectProvider and ICustomTypeProvider
	  to the ModelBase class.",Catel.Extensions.DynamicObjects,True,2016-11-29T05:36:02.283-08:00,True,False,,"catel,data,model,modelbase,dynamic,object,IDynamicMetaObjectProvider,ICustomTypeProvider",76212,True,4.0.0-unstable0507
Davide Icardi,2014-09-13T23:54:06.903Z,"Dynamic Expresso is an expression interpreter for simple C# statements.
      Dynamic Expresso embeds it's own parsing logic, and really interprets C# statements by converting it to .NET LambdaExpression that can be invoked as any standard delegate.
      It doesn't generate assembly but it creates dynamic expression/delegate on the fly.",DynamicExpresso.Core,False,2017-12-17T13:41:21.983+00:00,True,False,C# expression interpreter/evaluator,,85977,False,1.0.0
Daniel Moore <polaris@northhorizon.net>,2014-09-14T15:38:01.07Z,A micro-library to provide support for easy view model creation and view/view model composition.,WpfIgniter,False,2014-12-01T07:54:01.897-08:00,True,False,,"wpf,inpc,INotifyPropertyChanged,binding,mvvm",4855,False,2.2.0
Alexander Krylkov,2014-09-14T06:43:33.82Z,Simplify DI common interface for IOC containers,Simplify.DI,False,2018-03-10T13:50:21.067+00:00,True,False,Simplify DI common interface for IOC containers,".NET,DI,IOC-container",9698,False,1.0.2
"Henrik Feldt,Intelliplan International AB",2014-09-14T15:03:29.213Z,"Logary is a high performance, multi-target logging, metric and health-check library for mono and .Net.",Intelliplan.Logary.Riemann,True,1899-12-31T16:00:00-08:00,False,False,,"logging,f#,nosql,log4net,nlog,serilog,log,logs,metrics,metrics.net,measure,performance,perf,semantic,structured",-1,False,2.0.0-alpha3
Dennis Bappert,2014-09-14T12:56:49.027Z,"You like EntityFramework and use it frequently but sometimes you need just a simple embedded database for an app or a small application, then MobileDB ist just right for you. It's a lightweight, fast and simple JSON database with an EntityFramework inspired API.",MobileDB,True,2014-09-30T01:51:55.857-07:00,True,False,,"database,json,entityframework,embedded",888,False,0.0.8-alpha
Jin-Wook Chung,2014-09-15T05:12:12.687Z,Experiment.AutoFixture supports auto data using AutoFixture library in parameterized tests.,Experiment.AutoFixture,True,2014-11-23T18:06:48.48-08:00,True,False,,"unit-testing,tdd,autofixture",25486,False,1.6.0-a02
Andreas Kuntner (mobilemotion.eu),2014-09-14T17:13:43.6Z,"A collection of basic helper classes to be used in MVVM projects. Fully portable library (PCL), compatible with WinPhone 8.0+, WinRT (Windows Store 8.1+ and Universal Apps) and .NET 4.5.",MVVMbasics,False,2016-08-14T13:17:58.003-07:00,True,False,,,11221,False,2.0.2
Volkan Ceylan,2014-09-15T13:42:58.597Z,Contains a modified version of MUNQ IoC container by Matthew Dennis. https://munq.codeplex.com/ which is released under the Microsoft Public License (Ms-PL) http://www.opensource.org/licenses/ms-pl.html,Serenity.Munq,False,1899-12-31T16:00:00-08:00,False,False,,Serenity,-1,False,1.1.0
"Henrik Feldt,Intelliplan International AB",2014-09-14T10:17:33.463Z,"Logary is a high performance, multi-target logging, metric and health-check library for mono and .Net.",Intelliplan.Logary.CSharp,True,1899-12-31T16:00:00-08:00,False,False,,"logging,f#,nosql,log4net,nlog,serilog,log,logs,metrics,metrics.net,measure,performance,perf,semantic,structured",-1,False,2.0.0-alpha2
Filip Skakun,2014-09-14T06:21:06.29Z,A set of debugging controls and helpers for Windows Runtime XAML applications.,WinRTXamlToolkit.Debugging.Windows,False,2015-01-15T23:19:26.293-08:00,True,False,,"winrt,xaml,toolkit,winrtxamltoolkit,xyzzer,debugging,debug,diagnostics,trace",4228,False,1.7.2
Daniel Moore <polaris@northhorizon.net>,2014-09-14T17:08:16.357Z,A micro-library to provide support for easy view model creation and view/view model composition.,WpfIgniter,True,2014-12-01T07:54:01.897-08:00,True,False,,"wpf,inpc,INotifyPropertyChanged,binding,mvvm",4855,False,2.3.0-beta-1
NServiceBus Ltd,2014-09-15T13:02:17.493Z,The Azure Cloudservices Host for NServicebus,NServiceBus.Hosting.Azure,False,2018-02-16T08:29:01.053+00:00,True,False,,"nservicebus,servicebus,msmq,cqrs,publish,subscribe",151381,False,5.3.4
OrchestraDevs,2014-09-14T13:04:13.69Z,This library makes managing workspaces very easy.,Orc.WorkspaceManagement.Xaml,True,2018-04-16T15:16:11.083+00:00,True,False,,"orc,workspace,management,xaml,wpf",12082,True,0.2.0-unstable0040
RArcher Software Ltd.,2014-09-14T11:48:15.777Z,The RArcher.WinRT.Toolkit package provides various classes that help when developing WinRT 8.1 (Windows and Windows Phone) apps based on a lightweight interpretation of the MVVM design pattern. This package is required by all other RArcher.WinRT.Toolkit.* packages.,RArcher.WinRT.Toolkit,True,2014-10-09T02:55:12.96-07:00,True,False,,,1168,False,1.0.0-prerelease
AVOS Cloud,2014-09-15T02:10:07.267Z,"AVOS Cloud SDK for .NET 4.5 Desktop.
Document：https://cn.avoscloud.com/docs/dotnet_guide.html.",AVOSCloud.NetFx45,True,2015-06-11T02:26:45.937-07:00,True,False,,"BaaS,avoscloud,PaaS,windows,cloudservice,clouddb",2507,False,0.0.1-beta
"Henrik Feldt,Intelliplan International AB",2014-09-14T15:04:44.107Z,"Logary is a high performance, multi-target logging, metric and health-check library for mono and .Net.",Intelliplan.Logary.Zipkin,True,1899-12-31T16:00:00-08:00,False,False,,"logging,f#,nosql,log4net,nlog,serilog,log,logs,metrics,metrics.net,measure,performance,perf,semantic,structured",-1,False,2.0.0-alpha3
Paul Betts,2014-09-14T23:35:38.93Z,"Write your app using System.Net.Http, but drop this library in and it will go drastically faster.",modernhttpclient,False,2015-05-21T21:41:44.67-07:00,True,False,"Write your app using System.Net.Http, but drop this library in and it will go drastically faster.",,676944,False,2.1.1
"Filip Skakun,Thomas Martinsen,Mahmoud Moussa,Joost van Schaik",2014-09-14T06:22:22.03Z,"A set of controls, extensions and helper classes for Windows Runtime XAML applications.",WinRTXamlToolkit.WindowsPhone,False,2015-01-15T23:21:26.45-08:00,True,False,,"winrt,xaml,toolkit,winrtxamltoolkit,xyzzer",22976,False,1.7.2
Chillisoft,2014-09-14T04:02:13.233Z,Habanero,Habanero,True,2017-04-19T21:01:31.993-07:00,True,False,,,165264,False,3.9.317-prerelease
Adam Griffiths,2014-09-15T14:38:18.17Z,The ViewRanger BuddyBeacon API Client allows quick and easy access to the BuddyBeacon system.,ViewRanger.BuddyBeacon.API,False,2014-09-16T07:06:42.51-07:00,True,False,,"viewranger,api,buddybeacon",1473,False,1.2.0
ReflectSoftware Inc.,2014-09-15T05:16:19.357Z,"We've added support for the Enterprise Library Logging adapter. This allows you to leverage your current investment in EntLib, but leverage the power and flexibility of the ReflectInsight Viewer. A special benefit in this extension as it will parse and display XML message in proper syntax.

In order to use this extension you must have the ReflectInsight Viewer installed. Download and install the ReflectInsight Viewer from this location: 

http://www.ReflectSoftware.com/Public/Download.aspx

You can view your EntLib messages in realtime, in a rich viewer that allows you to filter out and search for what really matters to you.",ReflectSoftware.Insight.Extensions.EnterpriseLibrary,True,2017-06-20T21:06:29.56-07:00,True,False,ReflectInsight EnterpriseLibrary logging extention makes it easy to integrate ReflectInsight into your existing application logging infrastructure and leverage the power of the ReflectInsight log view,"EnterpriseLibrary,Logging,Extensions,ReflectInsight,Appender,EntLib,Log,Tracing,RabbitMQ",8454,False,5.3.2.5-rc1
Volkan Ceylan,2014-09-14T13:18:15.607Z,Contains UI script classes. Use only with Saltarelle projects that produce Javascript code.,Serenity.Script.UI,False,1899-12-31T16:00:00-08:00,False,False,,Serenity,-1,False,1.0.9
Sitecore Corporation,2014-09-15T11:30:22.397Z,Common functionality for projects of IST team,Sitecore.Integration.Common,False,1899-12-31T16:00:00-08:00,False,False,,,5022,False,1.0.31
Patrik Svensson,2014-09-14T11:08:01.99Z,The Cake script runner.,Cake,False,2018-03-03T15:41:25.37+00:00,True,False,Cake (C# Make) is a build automation system inspired by Fake.,"Cake,Script,Build",1844140,False,0.1.20
"Henrik Feldt,Intelliplan International AB",2014-09-14T10:20:01.553Z,"Logary is a high performance, multi-target logging, metric and health-check library for mono and .Net.",Intelliplan.Logary.Riemann,True,1899-12-31T16:00:00-08:00,False,False,,"logging,f#,nosql,log4net,nlog,serilog,log,logs,metrics,metrics.net,measure,performance,perf,semantic,structured",-1,False,2.0.0-alpha2
Volkan Ceylan,2014-09-14T13:17:16.12Z,Contains helper classes for unit / integration testing...,Serenity.Testing,False,2018-03-31T16:40:15.99+00:00,True,False,,Serenity,38075,False,1.0.9
Jin-Wook Chung,2014-09-15T07:17:41.493Z,"Experiment.Idioms is to facilitate running idiomatic, regular unit-tests.",Experiment.Idioms,True,2016-04-13T13:07:18.34-07:00,True,False,,"unit-testing,tdd",20936,False,2.0.0-pre01
Blue Marble,2014-09-13T20:38:50.007Z,Shared Azure functions and classes for Blue Marble projects,BlueMarble.Shared.Azure,False,1899-12-31T16:00:00-08:00,False,False,,,6439,False,1.0.61
Ninny,2014-09-15T11:28:19.777Z,Common Library for all front-site and services-site using.,MMQ.CommonLibrary,False,2016-06-20T19:20:08.323-07:00,True,False,,,102571,False,0.0.321
"Rich Hickey,Clojure",2014-09-13T19:32:12.287Z,Clojure for the CLR.,Clojure,False,2018-04-07T21:17:51.59+00:00,True,False,,"clojure,clojureclr",8479,False,1.6.0.1
luisrudge,2014-09-13T21:40:51.967Z,Generate beautiful identicons with flat colors,NIdenticon.FlatColorRandomBrushGenerator,False,2014-09-15T15:10:28.947-07:00,True,False,Generate beautiful identicons with flat colors,"flat,identicon,nidenticon",918,False,1.0.0
Volkan Ceylan,2014-09-14T13:15:37.863Z,Contains classes for CRUD service / repository implementations...,Serenity.Services,False,2018-03-31T16:40:02.41+00:00,True,False,,Serenity,114264,False,1.0.9
VCL.JS Team,2014-09-15T11:03:09.92Z,"VCL.JS is a TypeScript open-source platform for building enterprise web apps in a fraction of the time, whether you’re an expert developer or just getting started.b application.For more information http://vcljs.com",VCL.JS,False,2016-04-04T07:06:42.94-07:00,True,False,,"TypeScript,VCL,delphi,javascript,web",43514,False,0.1.240
rasmus,2014-09-14T17:38:07.57Z,LogReceiver sink for Serilog.,Serilog.Sinks.LogReceiver,False,1899-12-31T16:00:00-08:00,False,False,,,-1,False,1.4.8.9
Patrick Ineichen,2014-09-14T19:35:31.93Z,"A library which supports DDD, CQRS and event sourcing. This is the RavenDB persistence module for the EventStore.",SimpleDomain.EventStore.RavenPersistence,True,1899-12-31T16:00:00-08:00,False,False,,,-1,False,0.6.0-beta0001
GeertvanHorrik,2014-09-15T10:01:36.557Z,Catel.Extensions.Interception library which provides interception capabilities.,Catel.Extensions.Interception,True,2016-11-29T13:36:15.02+00:00,True,False,,"catel,interception",80561,True,4.0.0-unstable0507
Volkan Ceylan,2014-09-15T13:43:22.08Z,Contains HttpRuntimeCache that implements ICache interface,Serenity.Caching.Web,False,1899-12-31T16:00:00-08:00,False,False,,Serenity,-1,False,1.1.0
To-Increase B.V.,2014-09-15T14:35:21.15Z,REST Wrapper for Organization Domain,TI.Client.Organization,False,2014-10-28T03:11:33.727-07:00,True,False,,,3029,False,1.0.311
Bryan Apellanes,2014-09-14T22:09:49.803Z,Schema.Org generated classes representing schema.org things,Brevitee.Schema.Org,False,2015-09-06T11:26:47.263-07:00,True,False,,,2354,False,3.0.7
David,2014-09-15T07:27:02.377Z,采集数据至mongodb,David.Utility.DataAcquisition,False,1899-12-31T16:00:00-08:00,False,False,,Acquisition,1754,False,1.0.1
SQLite Development Team,2014-09-13T21:49:14.06Z,This is a pre-release package and is not intended for production use.  The official SQLite database engine for both x86 and x64 along with the ADO.NET provider.,System.Data.SQLite.Core.Test,False,1899-12-31T16:00:00-08:00,False,False,,"sqlite,database,ado.net,provider,interop",-1,False,1.0.94.2
To-Increase B.V.,2014-09-15T14:22:37.243Z,REST Wrapper for Organization Domain,TI.Client.Organization,False,2014-10-28T03:11:33.727-07:00,True,False,,,3029,False,1.0.310
fir3pho3nixx@gmail.com,2014-09-14T21:14:10.947Z,A library for make windsor really easy,FluentWindsor,False,2017-09-14T20:09:56.56+00:00,True,False,,"Castle,Windsor,Fluent",15661,False,1.0.0.1
Bryan Apellanes,2014-09-14T22:05:47.083Z,Fluent extensions to TagBuilder,Brevitee.Html,False,2015-09-06T11:22:13.3-07:00,True,False,,,2454,False,3.0.7
"Henrik Feldt,Intelliplan International AB",2014-09-14T10:20:37.393Z,"Logary is a high performance, multi-target logging, metric and health-check library for mono and .Net.",Intelliplan.Logary.TOML,True,1899-12-31T16:00:00-08:00,False,False,,"logging,f#,nosql,log4net,nlog,serilog,log,logs,metrics,metrics.net,measure,performance,perf,semantic,structured",-1,False,2.0.0-alpha2
Alex Mang,2014-09-13T23:06:22.03Z,"This client library enables working with Microsoft Azure Search service which includes the ability of searching for documents within self-defined indexes.

The client library is designed for .NET Framework 4.5 applications and allows leveraging the full set of functionalities available within the Azure Search service from within you C#/VB.NET apps.

For release notes, see http://alexmang.ro/azure-search-client-library/change-log

Alex Mang's blog - http://alexmang.ro",AzureSearchClient,False,2015-02-13T10:23:11.72-08:00,True,False,.NET client library for Microsoft Azure Search,"azure,search,service,full-text,client,library,api,alex,mang",30922,False,0.6.5370.1398
Markus Ullmark,2014-09-14T10:19:08.96Z,Generate YouTube-like hashes from one or many numbers. Use hashids when you do not want to expose your database ids to the user.,hashids.net,False,2016-09-14T12:09:29.36+00:00,True,False,,"ids,hash",162485,False,1.0.0
Capita Childrens Services,2014-09-15T06:19:23.41Z,Convert Rtf to Html using DevExpress,RtfToHtmlusingDevExpress,False,1899-12-31T16:00:00-08:00,False,False,Convert Rtf to Html using DevExpress,,1067,False,14.1.0
Yves Reynhout,2014-09-15T09:54:32.75Z,Paramol provides lightweight infrastructure for producing SQL DML statements.,Paramol,False,2016-04-12T04:33:53.687-07:00,True,False,,"eventsourcing,DDDesign",11196,False,0.0.95
"Danial Farid,Georgios Diamantopoulos (nuget package)",2014-09-14T03:08:32.007Z,"Light-weight HTML5 and cross-browser AngularJS directives for file upload, progress, abort, drag and drop",angular-file-upload,False,2016-11-04T21:34:07.76-07:00,True,False,,"angularjs,upload",380326,False,1.6.6
Daniel Lo Nigro,2014-09-15T01:50:45.083Z,"ReactJS tools for ASP.NET. If using ASP.NET MVC, also install React.Web.Mvc4. 
Please refer to project site (http://reactjs.net/) for more details, usage examples and sample code.",React.Web,False,2018-03-05T03:16:45.68+00:00,True,False,ReactJS tools for ASP.NET,"asp.net,mvc,asp,jquery,javascript,js,react,facebook,reactjs",290370,False,1.1.2
Jakub Pachansky,2014-09-13T23:40:20.577Z,"A simple, easy to use plugin execution engine built on top of Quartz Enterprise Scheduler .NET",R.Scheduler,False,2018-03-29T13:48:33.3+00:00,True,False,,"Scheduler,R,R.Scheduler,Quartz,RScheduler,R.MessageBus,Scheduling",19532,False,0.0.0.26
Sam Thwaites,2014-09-15T06:40:14.107Z,"AFrame is a common automation framework built ontop of Selenium for Web Apps, Microsoft CodedUI for
          Desktop Apps and Appium for Mobile Apps. Utilizing the page object pattern and many others, AFrame
          gives your automation scripts the ability to be maintainable, flexible, and reliable without impacting on your design.
          With amazing documentation and samples galore, you will not be disappointed.

          NOTE: This is the desktop package of AFrame. For others please see AFrame.Mobile or AFrame.Web.",AFrame.Desktop,False,2015-08-13T03:31:08.69-07:00,True,False,,"automation,framework,uiautomation,selenium,codedui,appium,browser,mobile,web,ui,desktop,gui,phone,webdriver,unittest,test,testing,bdd,acceptance,tdd",6859,False,0.4.18
Lucaci Andrei,2014-09-13T20:20:45.143Z,"This is an implementation in C# of the well known game 2048. It also supports other numbers as a base numbers (no only powers of 2), and also different grid sizes.",2048,False,2014-09-13T13:20:45.143-07:00,True,False,"Example of result using this game engine:
http://lucaciandrei.somee.com/2048","2048,game,implementation,Lucaci,Andrei",2178,False,1.0.2
"Michael Edwards,Tom Dudfield,Chris van de Steeg,Reinoud van Dalen",2014-09-15T08:50:21.6Z,Allows you to use Sitecore 7.2(+) contentsearch features combined with glass objects,BoC.Glass.Mapper.Sc.ContentSearch.LuceneProvider,False,2018-01-11T15:32:38.39+00:00,True,False,,"Glass,Mapper,Sitecore,Glass.Mapper,contentsearch",9152,False,1.0.1
Gabriele Cocco,2014-09-15T02:02:34.517Z,The FSCL Runtime framework is taking care of executing OpenCL kernels generated from the FSCL Compiler in a way that is completely transparent to programmers. On platforms with multiple OpenCL-enabled devices the runtime is also able to perform an automatic selection of the best device where to execute each OpenCL computation the programmer asks to run.,FSCL.Runtime,False,2015-06-17T20:12:36.633-07:00,True,False,FSCL kernels scheduling and execution layer for heterogeneous platforms,"Meta-Programming,Compiler,Compilation,OpenCL,Parallel-programming,Heterogenous-computing,F#,Quotations",4506,False,1.3.4
GeertvanHorrik,2014-09-15T10:00:24.28Z,"Catel.Extensions.EntityFramework5 library which provides data classes such as repositories, unit of work, DbContextManager and more.",Catel.Extensions.EntityFramework5,True,2016-11-29T13:36:06.393+00:00,True,False,,"catel,entity,framework,entityframework,EF,EF5,UnitOfWork,unit,of,work,DbContextManager,repository,repositories,database",96703,True,4.0.0-unstable0507
Knagis,2014-09-13T21:34:39.29Z,Library for converting Markdown documents to HTML according to the CommonMark specification. Optimized for maximum performance.,CommonMark.NET,False,2017-02-20T10:50:39.943-08:00,True,False,,"CommonMark,Markdown",301010,False,0.1.3
Jakub Pachansky,2014-09-13T23:40:40.447Z,R Scheduler Contracts,R.Scheduler.Contracts,False,2018-03-28T16:09:25.76+00:00,True,False,,"Scheduler,Contracts,Scheduler.Contracts,Scheduler.Interfaces,R.Scheduler,R",11740,False,0.0.0.14
Sam Thwaites,2014-09-15T00:45:48.857Z,"AFrame is a common automation framework built ontop of Selenium for Web Apps, Microsoft CodedUI for
          Desktop Apps and Appium for Mobile Apps. Utilizing the page object pattern and many others, AFrame
          gives your automation scripts the ability to be maintainable, flexible, and reliable without impacting on your design.
          With amazing documentation and samples galore, you will not be disappointed.

          NOTE: This is the mobile package of AFrame. For others please see AFrame.Desktop or AFrame.Web.",AFrame.Mobile,False,2015-08-13T03:30:34.573-07:00,True,False,,"automation,framework,uiautomation,selenium,codedui,appium,browser,mobile,web,ui,desktop,gui,phone,webdriver,unittest,test,testing,bdd,acceptance,tdd",6331,False,0.4.10
Nicolas Dorier,2014-09-14T17:03:17.693Z,Block chain Indexer using Microsoft Azure as backend,NBitcoin.Indexer,False,2017-11-01T23:31:30.627+00:00,True,False,,,31493,False,1.0.0.21
Bryan Apellanes,2014-09-14T22:09:00.487Z,"Legacy configuration encryption provider.  
	New projects should consider using the Vault class in
	Brevitee.Encryption",Brevitee.Profiguration,False,2015-09-06T11:26:09.077-07:00,True,False,,,2279,False,3.0.7
Manish Kumar,2014-09-15T05:44:04.98Z,"Converts the resx files in the project to corresponding .json files.
The JSON will also contain the lcid and lang name, eg : en-us  and 1033",ResxToJson.MSBuild,False,2014-12-01T20:47:07.12-08:00,True,False,Converts the resx files in the project to corresponding .json files. These can be packaged up along with your other js files.,"resx,json",794,False,1.0.0
ReflectSoftware Inc.,2014-09-15T03:43:52.12Z,"We've added a new destination listener extension for ReflectInsight for sending emails. This new destination listener extension is called ReflectSoftware.Insight.Listeners.Email and allows you to send logging messages via email. This is typically done for Exceptions, Errors and Fatal messages types where you might want to be notified via email if something went wrong in your application.

Traditional simple text base logging frameworks lack what your application can easily emit in providing you better insight into the health of your application. Wouldn’t it be great to easily instrument incredible rich details? Well, look no further. ReflectInsight was designed to easily let your application speak volumes!

One of ReflectInsight’s most powerful features is its impressive and elegant Viewer. The Viewer was design to hone in on particular issues and filter any unwanted noise by creating User Defined Views. User Defined Views allow you to filter a given request and visualize the execution path that actually caused the issue at hand. 

Everyone knows that debugging multithread applications is no simple task. Due to racing conditions, traditional IDE debuggers are not well suited for the job and don’t really provide an accurate picture behind the scenes. With ReflectInsight’s Live Viewer, debugging multithread applications is that much easier!

In order to use this library you must have the ReflectInsight Viewer installed. Download and install the ReflectInsight Viewer from this location: 

http://www.ReflectSoftware.com/Public/Download.aspx

You can view your messages in realtime, in a rich viewer that allows you to filter out and search for what really matters to you.",ReflectSoftware.Insight.Listeners.Email,False,2018-01-29T17:03:09.757+00:00,True,False,"ReflectInsight - The Next Generation in Application Logging.

ReflectInsight goes beyond where no text-based logging has gone before.","Email,.NET,Diagnostic,Debug,Trace,Logging,Extensions,ReflectInsight,Appender,Log,Tracing,RabbitMQ",4138,False,5.3.2
"Henrik Feldt,Intelliplan International AB",2014-09-14T14:58:29.723Z,"Logary is a high performance, multi-target logging, metric and health-check library for mono and .Net.",Intelliplan.Logary,True,1899-12-31T16:00:00-08:00,False,False,,"logging,f#,nosql,log4net,nlog,serilog,log,logs,metrics,metrics.net,measure,performance,perf,semantic,structured",-1,False,2.0.0-alpha3
Mark Kemper,2014-09-14T05:12:44.013Z,"Sample usages:
          
          using (var session = new TemporarySession())
          {
                var testObject = new TestDoc { Text = ""hello world"" };

                var result = session.Get<TestDoc>(""test"");

                Assert.That(result, Is.Null);

                var info = session.Save(testObject, ""test"");

                testObject.Text = ""hello world chagned"";

                session.Save(testObject);

                testObject.Text = ""hello world changed"";

                info = session.Save(testObject);

                testObject.Text = ""hello world changed 2"";

                session.Save(testObject, info);

                session.Delete(testObject);

                result = session.Get<TestDoc>(""test"");

          Assert.That(result, Is.Null);
          }

          also supports some design document helpers (views and updates)
          e.g.
            session.Design(""test"").ViewDocs<TestDoc>(""test"", track: true);
            string result = session.Design(""test"").Update<TestDoc, string>(""test"", testObject);",CouchN,False,2015-07-03T21:00:40.337-07:00,True,False,"A simple library for interacting with couch db.
          Supports tracking of documents and automatic updating of a javascript based design documents.

          And a design view query helper for e.g.
            session.Design(""test"").ViewDocs<TestDoc>(""test"", track: true);
            
          which whould run the _design/test/view/test view with include_docs=true and map then to the TestDoc object.
          The objects would also be tracked to allow save / delete operations.",,13133,False,0.2.0.6
Morten Houston Ludvigsen,2014-09-14T19:08:33.02Z,A CommonMark parser for .Net,CommonMarkSharp,False,2014-09-17T04:08:23.007-07:00,True,False,,"CommonMark,Markdown",2596,False,0.2.0
Accord.NET Extensions,2014-09-13T22:53:39.503Z,"Provides computer vision algorithms: Pyramidal KLT tracker, Camshift, Meanshift.",Accord.Extensions.Vision,True,2015-10-08T17:30:00-07:00,True,False,"Provides computer vision algorithms: Pyramidal KLT tracker, Camshift, Meanshift.","accord.net,framework,extensions,computer-vision,KLT-tracker,camshift,meanshift",4715,False,1.0.0-rc
Blue Marble,2014-09-13T22:05:19.257Z,Shared Azure functions and classes for Blue Marble projects,BlueMarble.Shared.Azure,False,1899-12-31T16:00:00-08:00,False,False,,,6439,False,1.0.62
Infolink,2014-09-15T11:25:58.63Z,"Interface za bazni Bll, Validator te implementacija istih.",Infolink.Base.Projects,False,2015-01-16T06:25:50.647-08:00,True,False,,,1293,False,1.0.3
SEEK Ltd.,2014-09-15T06:35:46.64Z,Custom DSC Resources for administration of an IIS web server,seek-dsc-webadministration,False,2015-07-30T06:12:32.33-07:00,True,False,,"admin,DSC",14753,False,1.0.0.33
